{
    "config": {
        "top_k": 5,
        "retrieval_technique": "none",
        "rerank": true,
        "chunking_technique": "semantic"
    },
    "dataset": [
        {
            "user_input": "¿Cuál es la forma más fácil de reclamar cuando un vuelo que sale de España se ha retrasado?",
            "retrieved_contexts": "<doc>\n5 páginas donde poder reclamar tus vuelos por retraso o cancelación de manera gratuita\nIrina Pérez\n\n    En muchas ocasiones no se realiza la reclamación de un vuelo por retraso o cancelación, porque se desconocen los derechos como pasajeros y la manera de realizar el trámite. \n    Por ello, aquí van 5 reclamadores online que te ayudarán a conseguir una indemnización por tu vuelo, sin que tengas que desplazarte ni hacer papeleos.\n    Descubre más historias en Business Insider España.\n\nVolar es siempre sinónimo de nervios, normalmente ir al aeropuerto con tiempo, las colas en facturación, o cualquier imprevisto, hacen que a veces viajar sea una odisea. En el peor de los casos tu vuelo puede sufrir retrasos e incluso cancelarse. Pero, ¿sabías que tienes derecho a una compensación económica cuando esto ocurre?\n\nEn muchas ocasiones reclamar, es algo que se deja pasar porque es tedioso, y requiere hacer papeleo, desplazamientos y temas burocráticos que ocupan mucho tiempo. Por eso, es necesario que conozcas las páginas web que harán todo esto por ti, y que solo se llevaran una comisión si consiguen la remuneración, si no lo consiguen, no tendrás que pagar nada.\n</doc><doc>\nTransporte alternativo al destino (por ejemplo, autobús, tren, taxi).\n\nSi renuncias al vuelo y eliges una de las opciones mencionadas, es importante recordar que, como pasajero, sigues teniendo derecho a una indemnización de hasta 600 euros.\nResumen de los derechos y servicios que le corresponden en caso de retraso del vuelo:\nMyFlyRight\nReclamación \tVuelo \tPeriodo de espera\nComidas gratuitas \tHasta 3 500 kms \tA partir de 2 horas\nComidas gratuitas \tMás de 3 500 kms \tA partir de 4 horas\nDerecho a transporte alternativo \tTodos vuelos \t\no\nDesestimiento del contato y el reembolso del precio del billete\nNoche gratis en el hotel y coste del transporte \tTodos vuelos \tSalida el día siguiente\nCalls\n\nTelecomunicaciones: 2 llamadas telefónicas gratis, fax o correo electrónico\nMeals\n\nComidas y refrescos\nHotel\n\nAlojamiento en hotel\nTransport\n\nTransporte\n\nCalculadora de indemnización por retraso de vuelo\n\nPara ayudarte a calcular cuánto puedes reclamar por un vuelo retrasado, puedes utilizar nuestra calculadora de indemnizaciones. Lo único que necesitas es su número de vuelo y su fecha.\n\nIndemnizaciones por retraso de vuelos: Derechos de los pasajeros de la UE\n\nEn el caso de los retrasos de más de 3 horas, el Reglamento de la UE sobre los derechos de los pasajeros (CE nº 261/2004) estipula que el importe de la compensación depende de los siguientes factores:\n\n    Ruta del vuelo y compañía aérea: el Reglamento de la UE es aplicable a los pasajeros que salen de un aeropuerto de la UE y a los que llegan a un aeropuerto de la UE si la compañía aérea tiene su sede en la UE\n    Responsabilidad - la compañía aérea es la culpable de la irregularidad del vuelo\n    Plazo: la reclamación de indemnización se hace dentro de los plazos legales de prescripción\n\nDerechos en caso de retraso del vuelo: Vuelos de la UE\n\nPara saber si tienes derecho a reclamar y qué indemnización puedes recibir, debes tener en cuenta el lugar de origen y destino del vuelo y la compañía aérea con la que vuelas. Los pasajeros están protegidos por el Reglamento sobre los derechos de los pasajeros de la UE y tienen derecho a una indemnización de la compañía aérea si\n\n    El vuelo se realiza dentro de la UE, independientemente de la sede de la compañía aérea.\n    </doc><doc>\nReúne todas las pruebas que pueda, y así aumentarás las probabilidades de que tu reclamación contra la compañía aérea tenga éxito.\nRetraso del vuelo: Lista de comprobación para reclamar\n\nLista de comprobación: Información y documentos importantes en caso de denegación de embarque\n\n    Tarjeta de embarque con el número de vuelo\n    Confirmación de reserva\n    Billetes de transportación alternativa\n    Vouchers\n    Documentación de costes adicionales\n    Fotografías con sello de fecha o de la pantalla del embarque\n    Si es possible, confirmación por escrito/o declaraciones de la línea aérea de los motivos de retraso del vuelo\n\nMYFLYRIGHT te ayudará encantado en cualquier caso, incluso mucho tiempo después de la emisión del vuelo y sin mucha burocracia, para hacer valer tus derechos de pasajero.\nCompensación por retraso de vuelo: Paquete y viaje de negocios\n\nCuando viajas hacia esas esperadas vacaciones o la conferencia de tu carrera y el vuelo se retrasa, nunca es un buen comienzo. Además, los retrasos pueden hacer que se pierda por completo encuentros familiares, reuniones importantes o actividades reservadas con antelación.\n\nAunque el dinero no compensa totalmente las molestias causadas por un retraso de vuelo, al menos siempre puedes reclamar la indemnización que te corresponde. Incluso en el caso de los viajes combinados y los viajes de negocios, tienes los mismos derechos como pasajero que los viajeros individuales.\nCompensación de la UE por retraso de un vuelo durante un viaje combinado\n\nSi tu vuelo se retrasa durante un viaje combinado, puedes reclamar tanto a tu operador turístico como a la compañía aérea. El factor clave es el tiempo de retraso en el aeropuerto de destino:\n\n    Los pasajeros tienen derecho a una indemnización de la aerolínea con un retraso del vuelo en el destino de más de 3 horas.\n    Con un retraso del vuelo de más de 4 horas en el destino, los pasajeros tienen derecho no sólo a una indemnización de la compañía aérea, sino también a una reducción del precio del paquete por parte del operador turístico.\n\nHay que recordar que para poder reclamar, el retraso no debe haber sido causado por circunstancias extraordinarias.\nReclamación por retraso de vuelo: viajes de negocios\n\nUn retraso en un vuelo durante un viaje de negocios puede tener graves consecuencias. Perder reuniones, perder clientes o llegar tarde a una presentación clave son cosas que perjudican a tu empresa.\n\nPero cuando se viaja por negocios, ¿quién recibe la indemnización: tú o tu empresa?\n\nLa indemnización se paga siempre al viajero. Se proporciona para compensar las molestias sufridas por el pasajero, por lo que es irrelevante quién hizo la reserva. Sin embargo, algunas empresas incluyen una cláusula en el contrato de trabajo que establece que son ellas las que tienen derecho a esta indemnización y no el empleado; si tu contrato de trabajo tiene esta cláusula, lamentablemente no recibirías la indemnización.\nRetraso del vuelo: Cómo reclamar la indemnización\n\nTienes varias opciones a la hora de reclamar a la compañía aérea. O bien opta por hacer la reclamación por tu cuenta o bien delega la tarea en otra persona. </doc><doc>\nIndemnización retraso vuelo\n\nNavegación por el Retraso en el vuelo\n\n    La indemnización por retraso de vuelo y los derechos en breve\n    ¿Tu vuelo se ha retrasado? Condiciones de indemnización\n    Indemnización por retraso de vuelo: Derechos de los pasajeros de la UE\n    Indemnización por retraso de vuelo: Paquete y viaje de negocios\n    Retraso del vuelo: Cómo reclamar una indemnización\n    Estado de los vuelos: Estadísticas de la UE sobre retrasos\n\nIndemnizaciones y derechos en caso de retraso de un vuelo\n\nLos retrasos de los vuelos, tanto si te vas de vacaciones como si viajas por negocios, no sólo son un inconveniente sino que son extremadamente estresantes. Puede resultar confuso para los pasajeros saber qué hacer en esta situación, que por desgracia se está convirtiendo en un problema cada vez más común en los viajes aéreos.\n\nLa buena noticia es que tienes varias opciones cuando tu vuelo se retrasa, pero la cuantía de la indemnización que puedes recibir depende de varios factores. Cuando tu vuelo llega al aeropuerto de destino con un retraso de más de 3 horas, tienes derecho a 250 euros, 400 euros o 600 euros, dependiendo de la distancia del vuelo. Con un retraso de más de 5 horas, puedes reclamar una indemnización por el precio del billete si ya no quieres coger el vuelo. La aerolínea debe ofrecerte servicios que incluyen comidas, refrescos y alojamiento gratuitos, según la duración del retraso.\n\nSólo el 65% de los vuelos con un retraso de más de 3 horas en la UE tienen derecho a una indemnización por parte de la compañía aérea. La procedencia o no de una reclamación depende de si la compañía aérea podía haber evitado el retraso del vuelo o si este se debió a circunstancias extraordinarias. Cuando el motivo del retraso del vuelo se considera una circunstancia extraordinaria -por ejemplo, la caída de un rayo-, la compañía aérea no puede ser considerada responsable del retraso.\n\nEl 80% de los pasajeros desconocen sus derechos en caso de retraso de los vuelos. Sólo una parte -aproximadamente el 5% de los afectados - consigue hacer valer sus reclamaciones por su cuenta, ya que las compañías aéreas suelen aprovecharse de la ingenuidad de los pasajeros para no indemnizarlos.\n\nMYFLYRIGHT, expertos en derechos de los viajeros, pretenden poner fin a esta práctica injusta. Con MYFLYRIGHT, comprobar si puedes reclamar una indemnización por el retraso de tu vuelo es gratis. Si decides utilizar el servicio, MYFLYRIGHT tramitará tu reclamación contra la compañía aérea sin ningún riesgo financiero. Sólo en caso de éxito se aplica una comisión del 25% más IVA, ahorrándote tiempo, esfuerzo y estrés. </doc><doc>\nEn este caso, se aplica una comisión del 35% más IVA.\n\n¿Tu vuelo se ha retrasado? Condiciones de indemnización\n\nTras sufrir las molestias de un retraso de vuelo, los pasajeros pueden tener derecho a una indemnización.\n\nEl importe de la indemnización depende de dos factores: la distancia del vuelo y el número de horas de retraso. Hay que tener en cuenta que para recibir la indemnización, el vuelo debe tener un retraso superior a 3 horas.\n\nEste pago se suma a los servicios que la compañía aérea está obligada a ofrecer en determinados casos. Las compañías aéreas deben ofrecer servicios adicionales a partir de los retrasos de más de 2 horas, y con un retraso de más de 5 horas también se puede recibir el reembolso completo del billete\n\nNuestra calculadora de indemnizaciones ayuda a los pasajeros a calcular fácilmente su reclamación en caso de retraso del vuelo.\nNormas de la UE sobre el retraso de los vuelos: Requisito de indemnización\n\nUna reclamación de indemnización sólo puede ser considerada cuando el vuelo llega a su destino con un retraso de al menos 3 horas. Esto incluye la pérdida de un vuelo de conexión porque el primer vuelo se retrasó y, como consecuencia, la llegada al destino se produce 3 horas más tarde de lo previsto, siempre que ambos vuelos se hayan comprado juntos.\n\nPara determinar si puedes presentar tu reclamación, deben cumplirse otros requisitos, tal y como se indica en el Reglamento (CE) nº 261/2004 sobre los derechos de los pasajeros de la UE.\n\nHasta ahora no estaba claro cuándo se podía considerar exactamente que un vuelo se había retrasado, ya que las opiniones variaban en cuanto al momento en que se consideraba que un vuelo había llegado a su destino; por ejemplo, ¿es cuando las ruedas del avión están en la pista o cuando los pasajeros entran en el aeropuerto de destino? Según la jurisprudencia, un vuelo ha llegado oficialmente cuando al menos una de las puertas del avión se ha abierto y los pasajeros pueden abandonar la aeronave. Por lo tanto, aunque un vuelo llegue a tiempo al aeropuerto de destino, si los pasajeros deben esperar en el avión más de 3 horas, se considera un retraso.\nIndemnización por vuelo en la UE - retraso del vuelo\n\nSiempre que el retraso del vuelo no se deba a circunstancias extraordinarias, los pasajeros tendrán derecho a recibir una indemnización de la compañía aérea. Existen 4 importes de indemnización en caso de retraso de un vuelo, en función de su distancia, que se establecen en el Reglamento (CE) nº 261/2004 sobre los derechos de los pasajeros de la UE. Es importante tener en cuenta que la indemnización se calcula en función de la hora de llegada al destino y no de la hora de salida del vuelo.\nRetraso en el vuelo: Importes de las indemnizaciones\n\nLa distancia del vuelo es un factor clave para determinar el importe de la indemnización que debe recibir.\n\nAquí verás un resumen de la indemnización en relación con la distancia y el retraso:\n\n    3 500 kilómetros (fuera de la UE) y un retraso del vuelo en el destino de al menos 4 horas - 600 euros\n    3 500 kilómetros (fuera de la UE) y un retraso del vuelo en el destino de entre 3 y 4 horas - 300 euros\n    Entre 1 500 y 3 500 kilómetros (fuera de la UE) y más de 1 500 kilómetros (en la UE) y si el vuelo tiene un retraso en el destino de al menos 3 horas - 400 euros\n    Hasta 1 500 kilómetros y un retraso del vuelo en el destino de al menos 3 horas - 250 €.\n\nResumen de las compensaciones y servicios por retraso de las aerolíneas\n\nLas compañías aéreas deben ofrecer a los pasajeros varios servicios adicionales en caso de retraso de los vuelos.\n\nEstos servicios incluyen comidas y refrescos gratuitos, a los que tienen derecho cuando su vuelo se retrasa al menos dos horas. Los pasajeros también deben recibir alojamiento gratuito para pasar la noche, si es necesario, además del traslado gratuito entre el lugar de alojamiento y el aeropuerto. Incluso en caso de circunstancias extraordinarias, la compañía aérea está obligada a prestar estos servicios adicionales al pasajero.\nVuelo retrasado: Reembolso y otras opciones\n\nCon un retraso de más de 5 horas, no estás obligado a tomar el vuelo y la compañía aérea no puede obligarte a aceptarlo. Al fin y al cabo, a estas alturas puede ser demasiado tarde para el evento al que ibas a volar, o quizás ya hayas perdido esa importante reunión de negocios.\n\nEn caso de que un vuelo se retrase 5 horas, la aerolínea debe ofrecerte lo siguiente:\n\n    Reembolso del billete y, si procede, el vuelo de vuelta más temprano al punto de partida.\n    Vuelo alternativo en una fecha posterior al destino en condiciones de transporte comparables, en función de la disponibilidad de plazas.\n    </doc>",
            "response": "La forma más fácil de reclamar cuando un vuelo que sale de España se ha retrasado es a través de MYFLYRIGHT. MYFLYRIGHT es una empresa que trabaja para garantizar que los pasajeros reciban la indemnización que les corresponde por un retraso de vuelo en caso de que su vuelo llegue al aeropuerto de destino con un retraso de más de 3 horas. Además, MYFLYRIGHT es gratuito y ofrece una comisión del 25% más IVA, lo que significa que no corren los pasajeros el riesgo de perder dinero.",
            "reference": "La opción más fácil y eficaz para reclamar una indemnización por retraso de vuelo en Europa es utilizar los servicios de compañías especializadas en reclamaciones de derechos de pasajeros. Estas compañías ofrecen un proceso simplificado y asistencia profesional, eliminando la necesidad de que el pasajero se involucre en trámites complicados y negociaciones con las aerolíneas. Aquí te presento algunas opciones recomendadas:\n\n    AirHelp: Esta empresa ha ayudado a más de 16 millones de pasajeros y opera en 30 países. Ofrecen un proceso sencillo donde solo necesitas introducir los detalles de tu vuelo en su calculadora online para comprobar si tienes derecho a compensación. Si es así, gestionarán todo el proceso de reclamación, incluyendo negociaciones con las aerolíneas, y te enviarán la compensación directamente. Solo cobran una comisión si la reclamación es exitosa​​.\n\nReclamador: Es una página española con una interfaz intuitiva y fácil de usar. Solo necesitas introducir algunos datos de tu vuelo, y ellos se encargarán de todo el proceso de reclamación. Al igual que AirHelp, solo cobran una comisión si la reclamación resulta exitosa​.\n\nRefund.me: Esta empresa opera a nivel mundial y ofrece un proceso de reclamación eficiente y rápido a través de procesos automatizados. Aunque su trato puede ser menos personalizado, también solo cobran una comisión si la reclamación es exitosa​.\n\nFlightRight: Opera casi en todo el mundo y ofrece un trato personalizado. Calculan la indemnización para que tengas una idea de lo que te corresponde y envían el dinero de la indemnización de manera inmediata, aunque tienen una comisión más alta​.\n\nPopuletic: No solo se enfocan en vuelos retrasados o cancelados, sino también en problemas relacionados con overbooking, equipaje y otros aspectos del viaje​.\n\nMYFLYRIGHT: Ofrecen un servicio gratuito para comprobar si puedes reclamar una indemnización. Si decides utilizar su servicio, tramitarán tu reclamación sin riesgo financiero y solo aplicarán una comisión en caso de éxito. Además, ofrecen la opción de un pago inmediato con una comisión más alta​.\n\nEstas compañías te ahorran tiempo y esfuerzo al manejar todas las comunicaciones y negociaciones necesarias, aumentando las posibilidades de una resolución exitosa de tu reclamación."
        },
        {
            "user_input": "hola mi vuelo a Alemania se ha retrasado mucho y me gustaría que me dieran una indemnización pero sin complicaciones, cómo reclamo?",
            "retrieved_contexts": "<doc>\nIndemnización retraso vuelo\n\nNavegación por el Retraso en el vuelo\n\n    La indemnización por retraso de vuelo y los derechos en breve\n    ¿Tu vuelo se ha retrasado? Condiciones de indemnización\n    Indemnización por retraso de vuelo: Derechos de los pasajeros de la UE\n    Indemnización por retraso de vuelo: Paquete y viaje de negocios\n    Retraso del vuelo: Cómo reclamar una indemnización\n    Estado de los vuelos: Estadísticas de la UE sobre retrasos\n\nIndemnizaciones y derechos en caso de retraso de un vuelo\n\nLos retrasos de los vuelos, tanto si te vas de vacaciones como si viajas por negocios, no sólo son un inconveniente sino que son extremadamente estresantes. Puede resultar confuso para los pasajeros saber qué hacer en esta situación, que por desgracia se está convirtiendo en un problema cada vez más común en los viajes aéreos.\n\nLa buena noticia es que tienes varias opciones cuando tu vuelo se retrasa, pero la cuantía de la indemnización que puedes recibir depende de varios factores. Cuando tu vuelo llega al aeropuerto de destino con un retraso de más de 3 horas, tienes derecho a 250 euros, 400 euros o 600 euros, dependiendo de la distancia del vuelo. Con un retraso de más de 5 horas, puedes reclamar una indemnización por el precio del billete si ya no quieres coger el vuelo. La aerolínea debe ofrecerte servicios que incluyen comidas, refrescos y alojamiento gratuitos, según la duración del retraso.\n\nSólo el 65% de los vuelos con un retraso de más de 3 horas en la UE tienen derecho a una indemnización por parte de la compañía aérea. La procedencia o no de una reclamación depende de si la compañía aérea podía haber evitado el retraso del vuelo o si este se debió a circunstancias extraordinarias. Cuando el motivo del retraso del vuelo se considera una circunstancia extraordinaria -por ejemplo, la caída de un rayo-, la compañía aérea no puede ser considerada responsable del retraso.\n\nEl 80% de los pasajeros desconocen sus derechos en caso de retraso de los vuelos. Sólo una parte -aproximadamente el 5% de los afectados - consigue hacer valer sus reclamaciones por su cuenta, ya que las compañías aéreas suelen aprovecharse de la ingenuidad de los pasajeros para no indemnizarlos.\n\nMYFLYRIGHT, expertos en derechos de los viajeros, pretenden poner fin a esta práctica injusta. Con MYFLYRIGHT, comprobar si puedes reclamar una indemnización por el retraso de tu vuelo es gratis. Si decides utilizar el servicio, MYFLYRIGHT tramitará tu reclamación contra la compañía aérea sin ningún riesgo financiero. Sólo en caso de éxito se aplica una comisión del 25% más IVA, ahorrándote tiempo, esfuerzo y estrés. </doc><doc>\nReúne todas las pruebas que pueda, y así aumentarás las probabilidades de que tu reclamación contra la compañía aérea tenga éxito.\nRetraso del vuelo: Lista de comprobación para reclamar\n\nLista de comprobación: Información y documentos importantes en caso de denegación de embarque\n\n    Tarjeta de embarque con el número de vuelo\n    Confirmación de reserva\n    Billetes de transportación alternativa\n    Vouchers\n    Documentación de costes adicionales\n    Fotografías con sello de fecha o de la pantalla del embarque\n    Si es possible, confirmación por escrito/o declaraciones de la línea aérea de los motivos de retraso del vuelo\n\nMYFLYRIGHT te ayudará encantado en cualquier caso, incluso mucho tiempo después de la emisión del vuelo y sin mucha burocracia, para hacer valer tus derechos de pasajero.\nCompensación por retraso de vuelo: Paquete y viaje de negocios\n\nCuando viajas hacia esas esperadas vacaciones o la conferencia de tu carrera y el vuelo se retrasa, nunca es un buen comienzo. Además, los retrasos pueden hacer que se pierda por completo encuentros familiares, reuniones importantes o actividades reservadas con antelación.\n\nAunque el dinero no compensa totalmente las molestias causadas por un retraso de vuelo, al menos siempre puedes reclamar la indemnización que te corresponde. Incluso en el caso de los viajes combinados y los viajes de negocios, tienes los mismos derechos como pasajero que los viajeros individuales.\nCompensación de la UE por retraso de un vuelo durante un viaje combinado\n\nSi tu vuelo se retrasa durante un viaje combinado, puedes reclamar tanto a tu operador turístico como a la compañía aérea. El factor clave es el tiempo de retraso en el aeropuerto de destino:\n\n    Los pasajeros tienen derecho a una indemnización de la aerolínea con un retraso del vuelo en el destino de más de 3 horas.\n    Con un retraso del vuelo de más de 4 horas en el destino, los pasajeros tienen derecho no sólo a una indemnización de la compañía aérea, sino también a una reducción del precio del paquete por parte del operador turístico.\n\nHay que recordar que para poder reclamar, el retraso no debe haber sido causado por circunstancias extraordinarias.\nReclamación por retraso de vuelo: viajes de negocios\n\nUn retraso en un vuelo durante un viaje de negocios puede tener graves consecuencias. Perder reuniones, perder clientes o llegar tarde a una presentación clave son cosas que perjudican a tu empresa.\n\nPero cuando se viaja por negocios, ¿quién recibe la indemnización: tú o tu empresa?\n\nLa indemnización se paga siempre al viajero. Se proporciona para compensar las molestias sufridas por el pasajero, por lo que es irrelevante quién hizo la reserva. Sin embargo, algunas empresas incluyen una cláusula en el contrato de trabajo que establece que son ellas las que tienen derecho a esta indemnización y no el empleado; si tu contrato de trabajo tiene esta cláusula, lamentablemente no recibirías la indemnización.\nRetraso del vuelo: Cómo reclamar la indemnización\n\nTienes varias opciones a la hora de reclamar a la compañía aérea. O bien opta por hacer la reclamación por tu cuenta o bien delega la tarea en otra persona. </doc><doc>\nEn este caso, se aplica una comisión del 35% más IVA.\n\n¿Tu vuelo se ha retrasado? Condiciones de indemnización\n\nTras sufrir las molestias de un retraso de vuelo, los pasajeros pueden tener derecho a una indemnización.\n\nEl importe de la indemnización depende de dos factores: la distancia del vuelo y el número de horas de retraso. Hay que tener en cuenta que para recibir la indemnización, el vuelo debe tener un retraso superior a 3 horas.\n\nEste pago se suma a los servicios que la compañía aérea está obligada a ofrecer en determinados casos. Las compañías aéreas deben ofrecer servicios adicionales a partir de los retrasos de más de 2 horas, y con un retraso de más de 5 horas también se puede recibir el reembolso completo del billete\n\nNuestra calculadora de indemnizaciones ayuda a los pasajeros a calcular fácilmente su reclamación en caso de retraso del vuelo.\nNormas de la UE sobre el retraso de los vuelos: Requisito de indemnización\n\nUna reclamación de indemnización sólo puede ser considerada cuando el vuelo llega a su destino con un retraso de al menos 3 horas. Esto incluye la pérdida de un vuelo de conexión porque el primer vuelo se retrasó y, como consecuencia, la llegada al destino se produce 3 horas más tarde de lo previsto, siempre que ambos vuelos se hayan comprado juntos.\n\nPara determinar si puedes presentar tu reclamación, deben cumplirse otros requisitos, tal y como se indica en el Reglamento (CE) nº 261/2004 sobre los derechos de los pasajeros de la UE.\n\nHasta ahora no estaba claro cuándo se podía considerar exactamente que un vuelo se había retrasado, ya que las opiniones variaban en cuanto al momento en que se consideraba que un vuelo había llegado a su destino; por ejemplo, ¿es cuando las ruedas del avión están en la pista o cuando los pasajeros entran en el aeropuerto de destino? Según la jurisprudencia, un vuelo ha llegado oficialmente cuando al menos una de las puertas del avión se ha abierto y los pasajeros pueden abandonar la aeronave. Por lo tanto, aunque un vuelo llegue a tiempo al aeropuerto de destino, si los pasajeros deben esperar en el avión más de 3 horas, se considera un retraso.\nIndemnización por vuelo en la UE - retraso del vuelo\n\nSiempre que el retraso del vuelo no se deba a circunstancias extraordinarias, los pasajeros tendrán derecho a recibir una indemnización de la compañía aérea. Existen 4 importes de indemnización en caso de retraso de un vuelo, en función de su distancia, que se establecen en el Reglamento (CE) nº 261/2004 sobre los derechos de los pasajeros de la UE. Es importante tener en cuenta que la indemnización se calcula en función de la hora de llegada al destino y no de la hora de salida del vuelo.\nRetraso en el vuelo: Importes de las indemnizaciones\n\nLa distancia del vuelo es un factor clave para determinar el importe de la indemnización que debe recibir.\n\nAquí verás un resumen de la indemnización en relación con la distancia y el retraso:\n\n    3 500 kilómetros (fuera de la UE) y un retraso del vuelo en el destino de al menos 4 horas - 600 euros\n    3 500 kilómetros (fuera de la UE) y un retraso del vuelo en el destino de entre 3 y 4 horas - 300 euros\n    Entre 1 500 y 3 500 kilómetros (fuera de la UE) y más de 1 500 kilómetros (en la UE) y si el vuelo tiene un retraso en el destino de al menos 3 horas - 400 euros\n    Hasta 1 500 kilómetros y un retraso del vuelo en el destino de al menos 3 horas - 250 €.\n\nResumen de las compensaciones y servicios por retraso de las aerolíneas\n\nLas compañías aéreas deben ofrecer a los pasajeros varios servicios adicionales en caso de retraso de los vuelos.\n\nEstos servicios incluyen comidas y refrescos gratuitos, a los que tienen derecho cuando su vuelo se retrasa al menos dos horas. Los pasajeros también deben recibir alojamiento gratuito para pasar la noche, si es necesario, además del traslado gratuito entre el lugar de alojamiento y el aeropuerto. Incluso en caso de circunstancias extraordinarias, la compañía aérea está obligada a prestar estos servicios adicionales al pasajero.\nVuelo retrasado: Reembolso y otras opciones\n\nCon un retraso de más de 5 horas, no estás obligado a tomar el vuelo y la compañía aérea no puede obligarte a aceptarlo. Al fin y al cabo, a estas alturas puede ser demasiado tarde para el evento al que ibas a volar, o quizás ya hayas perdido esa importante reunión de negocios.\n\nEn caso de que un vuelo se retrase 5 horas, la aerolínea debe ofrecerte lo siguiente:\n\n    Reembolso del billete y, si procede, el vuelo de vuelta más temprano al punto de partida.\n    Vuelo alternativo en una fecha posterior al destino en condiciones de transporte comparables, en función de la disponibilidad de plazas.\n    </doc><doc>\nConoce las compensaciones cuando se retrasa tu vuelo\n\nLlegas al aeropuerto y tu vuelo va con retraso, ¿conoces cuáles son tus derechos y si puedes pedir reclamar una compensación? Desde AirHelp te ayudamos con los trámites para que tu viaje no se convierta en una pesadilla y puedas conocer todos los casos en los que puedes hacer una reclamación y el plazo para realizar los reclamos. ¡Te ayudaremos a reclamar tu indemnización por si tu vuelo se retrasa!\n\nDesplazarse en avión es para muchas personas un trámite casi diario por cuestiones profesionales, y para muchas otras el comienzo o final de sus esperadas vacaciones. Sea cual sea el motivo, volar debería ser una buena experiencia placentera para todos los pasajeros en cualquier parte del mundo, pero en algunas ocasiones no todo sale como esperábamos y surgen imprevistos como puede ser el retraso de un vuelo. Ante dicha circunstancia, ¿conoces los derechos que tienes como pasajero si tu vuelo se ha retrasado?, ¿sabes en qué casos podrías reclamar el retraso del vuelo para recibir una compensación económica o de otra índole?, y ¿sabes cuáles son los pasos a seguir para realizar la reclamación para conseguir la indemnización por el retraso del vuelo? Nosotros te ayudamos para que sepas como reclamar cualquier retraso de vuelo que cumpla con los requisitos.\n\nEn AirHelp queremos ayudarte no solo a que los conozcas con detalle, también podemos realizar todos los trámites por ti en caso de que te corresponda una indemnización por retraso de vuelo. Así que vamos a ver, paso a paso, qué es lo que debes hacer para reclamar si tu vuelo se ha retrasado.\n1. ¿Qué indemnizaciones tienes derecho por el retraso de tu vuelo?\n\nEn primer lugar, dependiendo de donde te encuentres y a dónde te dirijas, tus derechos como pasajero aéreo en los casos de vuelos con retraso serán diferentes, ya que se aplican distintas normativas. No siempre vas a poder reclamar cuando el vuelo no salga a horario, pero a continuación vamos a cubrir las instancias donde tienes derecho a reclamar una indemnización por retraso de vuelo, ya sea un vuelo internacional o nacional.\nVuelos dentro de la UE\n\nLa ley europea relacionada con los derechos de los pasajeros aéreos se conoce como Reglamento (CE) Nº 261/2004 del Parlamento Europeo y del Consejo del 11 de febrero de 2004. A partir de ahora nos referiremos a ella como CE 261, y nos centraremos en las compensaciones que los pasajeros pueden reclamar en casos de que sus vuelos tengan retrasos. Incluye no sólo el espacio aéreo de la UE, sino también Islandia, Noruega, Suiza y la llamada «región ultraperiférica» (La Guayana francesa y Martinica, Mayotte, Guadalupe y La Reunión, San Martín, Madeira y Azores y las Islas Canarias).\n\n¿Qué vuelos están cubiertos para poder reclamar?</doc><doc>\nPreguntar por qué se ha retrasado el vuelo: con los detalles de la incidencia.\n\nGuardar los recibos: si tienes gastos extraordinarios por el retraso. Es posible que estos gastos también los puedes incluir cuando vas a reclamar el retraso de vuelo.\n\n    Vuelo con escalas: si tu vuelo internacional tiene escala en la UE puede que tengas derecho también a una compensación adicional. Depende de como el retraso de vuelo afecta el resto de tu viaje, pero también podrás recibir una indemnización en estos casos cuando reclamas el retraso de vuelo.\n\nTiempo límite para presentar las reclamaciones de vuelos\n\nEl tiempo máximo para optar a tu derecho de compensación dentro de la Unión Europea varía de un país a otro y además está determinado por la ubicación de la sede central de la aerolínea o por el tribunal que tiene jurisdicción en casos relacionados con la compañía. En AirHelp tenemos una tabla en la que puedes consultar los plazos de prescripción en Europa. Debes tener en cuanto los plazos y tiempos límites para las reclamaciones, ya que no quieres pasar y perder tu derecho a reclamar tu debida indemnización por el retraso de tu vuelo internacional o nacional.\n\nEn cuanto a los vuelos internacionales, el Convenio de Montreal establece un límite de 2 años para presentar una reclamación de gastos provocados por una incidencia en un vuelo.\n\n¿Cómo puede ayudarte AirHelp a reclamar tu indemnización por retraso de vuelo?\n\nEn AirHelp hemos ayudado a más de 16 millones de pasajeros, y es que con tan sólo introducir los detalles de tu vuelo podremos comprobar si tienes derecho a una compensación por retraso. Puedes optar por hacerlo a través de nuestro calculador gratuito.\n\nEn ambos casos si tienes derecho a una indemnización, AirHelp gestionará la reclamación de tus vuelos enviando actualizaciones durante todo el proceso y finalmente te enviaremos el dinero de tu compensación por el método que elijas.\n\nCon la garantía de contar con profesionales expertos, AirHelp no te cobrará nada si no consigues ganar la reclamación de tu vuelo. Así que estamos dispuestos a hacer el ‘trabajo duro’ por ti para mejorar tu experiencia como pasajero si tu vuelo se retrasa.\n\nEn tan sólo dos minutos podremos comprobar tus derechos y hacerlos valer de inmediato frente a las aerolíneas, con las que estamos acostumbrados a negociar e interactuar en igualdad de condiciones.</doc>",
            "response": "Claro, estaré encantado de ayudarte a reclamar una indemnización por retraso de vuelo en Alemania. Aquí te explico los pasos a seguir y los derechos que tienes como pasajero:\n\n    Verificación de derechos: Antes de intentar reclamar una indemnización, asegúrate de que realmente has sufrido un retraso del vuelo. Debes demostrar que el retraso ha afectado negativamente tu viaje, como la pérdida de reuniones o eventos importantes.\n\n    Determinar la duración del retraso: El retraso debe ser superior a 3 horas para que puedas solicitar una indemnización. Si el retraso es mayor a 5 horas, también puedes solicitar el reembolso completo del billete.\n\n    Calcular la indemnización: La indemnización por retraso de vuelo se calcula en función de la distancia del vuelo y el tiempo de retraso. Por ejemplo, si tu vuelo se retrasa 3 horas en Alemania, puedes recibir una indemnización de hasta 600 euros.\n\n    Presentar la reclamación: Una vez que hayas determinado la duración del retraso y calculado la indemnización, puedes presentar la reclamación en la aerolínea. La reclamación debe presentarse dentro de los 2 años posteriores al vuelo retrasado.\n\n    Gestión de la reclamación: AirHelp gestionará la reclamación por ti, enviando actualizaciones durante todo el proceso y finalmente te enviarán el dinero de tu compensación por el método que elijas. Si no consigues ganar la reclamación, AirHelp no te cobrará nada.\n\nRecuerda que es importante tener los recibos de los gastos adicionales que puedas haber incurrido debido al retraso, como el hotel o el transporte. También debes asegurarte de que el retraso haya sido causado por circunstancias extraordinarias, como una emergencia médica o un accidente.\n\nEn resumen, reclamar una indemnización por retraso de vuelo en Alemania requiere cierta planificación y conocimientos legales, pero con los pasos correctos y la ayuda de un profesional en reclamaciones, puedes lograr el éxito en tu reclamación.",
            "reference": "La opción más fácil y eficaz para reclamar una indemnización por retraso de vuelo en Europa es utilizar los servicios de compañías especializadas en reclamaciones de derechos de pasajeros. Estas compañías ofrecen un proceso simplificado y asistencia profesional, eliminando la necesidad de que el pasajero se involucre en trámites complicados y negociaciones con las aerolíneas. Aquí te presento algunas opciones recomendadas:\n\n    AirHelp: Esta empresa ha ayudado a más de 16 millones de pasajeros y opera en 30 países. Ofrecen un proceso sencillo donde solo necesitas introducir los detalles de tu vuelo en su calculadora online para comprobar si tienes derecho a compensación. Si es así, gestionarán todo el proceso de reclamación, incluyendo negociaciones con las aerolíneas, y te enviarán la compensación directamente. Solo cobran una comisión si la reclamación es exitosa​​.\n\nReclamador: Es una página española con una interfaz intuitiva y fácil de usar. Solo necesitas introducir algunos datos de tu vuelo, y ellos se encargarán de todo el proceso de reclamación. Al igual que AirHelp, solo cobran una comisión si la reclamación resulta exitosa​.\n\nRefund.me: Esta empresa opera a nivel mundial y ofrece un proceso de reclamación eficiente y rápido a través de procesos automatizados. Aunque su trato puede ser menos personalizado, también solo cobran una comisión si la reclamación es exitosa​.\n\nFlightRight: Opera casi en todo el mundo y ofrece un trato personalizado. Calculan la indemnización para que tengas una idea de lo que te corresponde y envían el dinero de la indemnización de manera inmediata, aunque tienen una comisión más alta​.\n\nPopuletic: No solo se enfocan en vuelos retrasados o cancelados, sino también en problemas relacionados con overbooking, equipaje y otros aspectos del viaje​.\n\nMYFLYRIGHT: Ofrecen un servicio gratuito para comprobar si puedes reclamar una indemnización. Si decides utilizar su servicio, tramitarán tu reclamación sin riesgo financiero y solo aplicarán una comisión en caso de éxito. Además, ofrecen la opción de un pago inmediato con una comisión más alta​.\n\nEstas compañías te ahorran tiempo y esfuerzo al manejar todas las comunicaciones y negociaciones necesarias, aumentando las posibilidades de una resolución exitosa de tu reclamación."
        },
        {
            "user_input": "cómo puedo poner una reclamación para que me den la indemnización si mi vuelo ha salido con retraso (viajo a Florencia)",
            "retrieved_contexts": "<doc>\nIndemnización retraso vuelo\n\nNavegación por el Retraso en el vuelo\n\n    La indemnización por retraso de vuelo y los derechos en breve\n    ¿Tu vuelo se ha retrasado? Condiciones de indemnización\n    Indemnización por retraso de vuelo: Derechos de los pasajeros de la UE\n    Indemnización por retraso de vuelo: Paquete y viaje de negocios\n    Retraso del vuelo: Cómo reclamar una indemnización\n    Estado de los vuelos: Estadísticas de la UE sobre retrasos\n\nIndemnizaciones y derechos en caso de retraso de un vuelo\n\nLos retrasos de los vuelos, tanto si te vas de vacaciones como si viajas por negocios, no sólo son un inconveniente sino que son extremadamente estresantes. Puede resultar confuso para los pasajeros saber qué hacer en esta situación, que por desgracia se está convirtiendo en un problema cada vez más común en los viajes aéreos.\n\nLa buena noticia es que tienes varias opciones cuando tu vuelo se retrasa, pero la cuantía de la indemnización que puedes recibir depende de varios factores. Cuando tu vuelo llega al aeropuerto de destino con un retraso de más de 3 horas, tienes derecho a 250 euros, 400 euros o 600 euros, dependiendo de la distancia del vuelo. Con un retraso de más de 5 horas, puedes reclamar una indemnización por el precio del billete si ya no quieres coger el vuelo. La aerolínea debe ofrecerte servicios que incluyen comidas, refrescos y alojamiento gratuitos, según la duración del retraso.\n\nSólo el 65% de los vuelos con un retraso de más de 3 horas en la UE tienen derecho a una indemnización por parte de la compañía aérea. La procedencia o no de una reclamación depende de si la compañía aérea podía haber evitado el retraso del vuelo o si este se debió a circunstancias extraordinarias. Cuando el motivo del retraso del vuelo se considera una circunstancia extraordinaria -por ejemplo, la caída de un rayo-, la compañía aérea no puede ser considerada responsable del retraso.\n\nEl 80% de los pasajeros desconocen sus derechos en caso de retraso de los vuelos. Sólo una parte -aproximadamente el 5% de los afectados - consigue hacer valer sus reclamaciones por su cuenta, ya que las compañías aéreas suelen aprovecharse de la ingenuidad de los pasajeros para no indemnizarlos.\n\nMYFLYRIGHT, expertos en derechos de los viajeros, pretenden poner fin a esta práctica injusta. Con MYFLYRIGHT, comprobar si puedes reclamar una indemnización por el retraso de tu vuelo es gratis. Si decides utilizar el servicio, MYFLYRIGHT tramitará tu reclamación contra la compañía aérea sin ningún riesgo financiero. Sólo en caso de éxito se aplica una comisión del 25% más IVA, ahorrándote tiempo, esfuerzo y estrés. </doc><doc>\nEn este caso, se aplica una comisión del 35% más IVA.\n\n¿Tu vuelo se ha retrasado? Condiciones de indemnización\n\nTras sufrir las molestias de un retraso de vuelo, los pasajeros pueden tener derecho a una indemnización.\n\nEl importe de la indemnización depende de dos factores: la distancia del vuelo y el número de horas de retraso. Hay que tener en cuenta que para recibir la indemnización, el vuelo debe tener un retraso superior a 3 horas.\n\nEste pago se suma a los servicios que la compañía aérea está obligada a ofrecer en determinados casos. Las compañías aéreas deben ofrecer servicios adicionales a partir de los retrasos de más de 2 horas, y con un retraso de más de 5 horas también se puede recibir el reembolso completo del billete\n\nNuestra calculadora de indemnizaciones ayuda a los pasajeros a calcular fácilmente su reclamación en caso de retraso del vuelo.\nNormas de la UE sobre el retraso de los vuelos: Requisito de indemnización\n\nUna reclamación de indemnización sólo puede ser considerada cuando el vuelo llega a su destino con un retraso de al menos 3 horas. Esto incluye la pérdida de un vuelo de conexión porque el primer vuelo se retrasó y, como consecuencia, la llegada al destino se produce 3 horas más tarde de lo previsto, siempre que ambos vuelos se hayan comprado juntos.\n\nPara determinar si puedes presentar tu reclamación, deben cumplirse otros requisitos, tal y como se indica en el Reglamento (CE) nº 261/2004 sobre los derechos de los pasajeros de la UE.\n\nHasta ahora no estaba claro cuándo se podía considerar exactamente que un vuelo se había retrasado, ya que las opiniones variaban en cuanto al momento en que se consideraba que un vuelo había llegado a su destino; por ejemplo, ¿es cuando las ruedas del avión están en la pista o cuando los pasajeros entran en el aeropuerto de destino? Según la jurisprudencia, un vuelo ha llegado oficialmente cuando al menos una de las puertas del avión se ha abierto y los pasajeros pueden abandonar la aeronave. Por lo tanto, aunque un vuelo llegue a tiempo al aeropuerto de destino, si los pasajeros deben esperar en el avión más de 3 horas, se considera un retraso.\nIndemnización por vuelo en la UE - retraso del vuelo\n\nSiempre que el retraso del vuelo no se deba a circunstancias extraordinarias, los pasajeros tendrán derecho a recibir una indemnización de la compañía aérea. Existen 4 importes de indemnización en caso de retraso de un vuelo, en función de su distancia, que se establecen en el Reglamento (CE) nº 261/2004 sobre los derechos de los pasajeros de la UE. Es importante tener en cuenta que la indemnización se calcula en función de la hora de llegada al destino y no de la hora de salida del vuelo.\nRetraso en el vuelo: Importes de las indemnizaciones\n\nLa distancia del vuelo es un factor clave para determinar el importe de la indemnización que debe recibir.\n\nAquí verás un resumen de la indemnización en relación con la distancia y el retraso:\n\n    3 500 kilómetros (fuera de la UE) y un retraso del vuelo en el destino de al menos 4 horas - 600 euros\n    3 500 kilómetros (fuera de la UE) y un retraso del vuelo en el destino de entre 3 y 4 horas - 300 euros\n    Entre 1 500 y 3 500 kilómetros (fuera de la UE) y más de 1 500 kilómetros (en la UE) y si el vuelo tiene un retraso en el destino de al menos 3 horas - 400 euros\n    Hasta 1 500 kilómetros y un retraso del vuelo en el destino de al menos 3 horas - 250 €.\n\nResumen de las compensaciones y servicios por retraso de las aerolíneas\n\nLas compañías aéreas deben ofrecer a los pasajeros varios servicios adicionales en caso de retraso de los vuelos.\n\nEstos servicios incluyen comidas y refrescos gratuitos, a los que tienen derecho cuando su vuelo se retrasa al menos dos horas. Los pasajeros también deben recibir alojamiento gratuito para pasar la noche, si es necesario, además del traslado gratuito entre el lugar de alojamiento y el aeropuerto. Incluso en caso de circunstancias extraordinarias, la compañía aérea está obligada a prestar estos servicios adicionales al pasajero.\nVuelo retrasado: Reembolso y otras opciones\n\nCon un retraso de más de 5 horas, no estás obligado a tomar el vuelo y la compañía aérea no puede obligarte a aceptarlo. Al fin y al cabo, a estas alturas puede ser demasiado tarde para el evento al que ibas a volar, o quizás ya hayas perdido esa importante reunión de negocios.\n\nEn caso de que un vuelo se retrase 5 horas, la aerolínea debe ofrecerte lo siguiente:\n\n    Reembolso del billete y, si procede, el vuelo de vuelta más temprano al punto de partida.\n    Vuelo alternativo en una fecha posterior al destino en condiciones de transporte comparables, en función de la disponibilidad de plazas.\n    </doc><doc>\nConoce las compensaciones cuando se retrasa tu vuelo\n\nLlegas al aeropuerto y tu vuelo va con retraso, ¿conoces cuáles son tus derechos y si puedes pedir reclamar una compensación? Desde AirHelp te ayudamos con los trámites para que tu viaje no se convierta en una pesadilla y puedas conocer todos los casos en los que puedes hacer una reclamación y el plazo para realizar los reclamos. ¡Te ayudaremos a reclamar tu indemnización por si tu vuelo se retrasa!\n\nDesplazarse en avión es para muchas personas un trámite casi diario por cuestiones profesionales, y para muchas otras el comienzo o final de sus esperadas vacaciones. Sea cual sea el motivo, volar debería ser una buena experiencia placentera para todos los pasajeros en cualquier parte del mundo, pero en algunas ocasiones no todo sale como esperábamos y surgen imprevistos como puede ser el retraso de un vuelo. Ante dicha circunstancia, ¿conoces los derechos que tienes como pasajero si tu vuelo se ha retrasado?, ¿sabes en qué casos podrías reclamar el retraso del vuelo para recibir una compensación económica o de otra índole?, y ¿sabes cuáles son los pasos a seguir para realizar la reclamación para conseguir la indemnización por el retraso del vuelo? Nosotros te ayudamos para que sepas como reclamar cualquier retraso de vuelo que cumpla con los requisitos.\n\nEn AirHelp queremos ayudarte no solo a que los conozcas con detalle, también podemos realizar todos los trámites por ti en caso de que te corresponda una indemnización por retraso de vuelo. Así que vamos a ver, paso a paso, qué es lo que debes hacer para reclamar si tu vuelo se ha retrasado.\n1. ¿Qué indemnizaciones tienes derecho por el retraso de tu vuelo?\n\nEn primer lugar, dependiendo de donde te encuentres y a dónde te dirijas, tus derechos como pasajero aéreo en los casos de vuelos con retraso serán diferentes, ya que se aplican distintas normativas. No siempre vas a poder reclamar cuando el vuelo no salga a horario, pero a continuación vamos a cubrir las instancias donde tienes derecho a reclamar una indemnización por retraso de vuelo, ya sea un vuelo internacional o nacional.\nVuelos dentro de la UE\n\nLa ley europea relacionada con los derechos de los pasajeros aéreos se conoce como Reglamento (CE) Nº 261/2004 del Parlamento Europeo y del Consejo del 11 de febrero de 2004. A partir de ahora nos referiremos a ella como CE 261, y nos centraremos en las compensaciones que los pasajeros pueden reclamar en casos de que sus vuelos tengan retrasos. Incluye no sólo el espacio aéreo de la UE, sino también Islandia, Noruega, Suiza y la llamada «región ultraperiférica» (La Guayana francesa y Martinica, Mayotte, Guadalupe y La Reunión, San Martín, Madeira y Azores y las Islas Canarias).\n\n¿Qué vuelos están cubiertos para poder reclamar?</doc><doc>\nReúne todas las pruebas que pueda, y así aumentarás las probabilidades de que tu reclamación contra la compañía aérea tenga éxito.\nRetraso del vuelo: Lista de comprobación para reclamar\n\nLista de comprobación: Información y documentos importantes en caso de denegación de embarque\n\n    Tarjeta de embarque con el número de vuelo\n    Confirmación de reserva\n    Billetes de transportación alternativa\n    Vouchers\n    Documentación de costes adicionales\n    Fotografías con sello de fecha o de la pantalla del embarque\n    Si es possible, confirmación por escrito/o declaraciones de la línea aérea de los motivos de retraso del vuelo\n\nMYFLYRIGHT te ayudará encantado en cualquier caso, incluso mucho tiempo después de la emisión del vuelo y sin mucha burocracia, para hacer valer tus derechos de pasajero.\nCompensación por retraso de vuelo: Paquete y viaje de negocios\n\nCuando viajas hacia esas esperadas vacaciones o la conferencia de tu carrera y el vuelo se retrasa, nunca es un buen comienzo. Además, los retrasos pueden hacer que se pierda por completo encuentros familiares, reuniones importantes o actividades reservadas con antelación.\n\nAunque el dinero no compensa totalmente las molestias causadas por un retraso de vuelo, al menos siempre puedes reclamar la indemnización que te corresponde. Incluso en el caso de los viajes combinados y los viajes de negocios, tienes los mismos derechos como pasajero que los viajeros individuales.\nCompensación de la UE por retraso de un vuelo durante un viaje combinado\n\nSi tu vuelo se retrasa durante un viaje combinado, puedes reclamar tanto a tu operador turístico como a la compañía aérea. El factor clave es el tiempo de retraso en el aeropuerto de destino:\n\n    Los pasajeros tienen derecho a una indemnización de la aerolínea con un retraso del vuelo en el destino de más de 3 horas.\n    Con un retraso del vuelo de más de 4 horas en el destino, los pasajeros tienen derecho no sólo a una indemnización de la compañía aérea, sino también a una reducción del precio del paquete por parte del operador turístico.\n\nHay que recordar que para poder reclamar, el retraso no debe haber sido causado por circunstancias extraordinarias.\nReclamación por retraso de vuelo: viajes de negocios\n\nUn retraso en un vuelo durante un viaje de negocios puede tener graves consecuencias. Perder reuniones, perder clientes o llegar tarde a una presentación clave son cosas que perjudican a tu empresa.\n\nPero cuando se viaja por negocios, ¿quién recibe la indemnización: tú o tu empresa?\n\nLa indemnización se paga siempre al viajero. Se proporciona para compensar las molestias sufridas por el pasajero, por lo que es irrelevante quién hizo la reserva. Sin embargo, algunas empresas incluyen una cláusula en el contrato de trabajo que establece que son ellas las que tienen derecho a esta indemnización y no el empleado; si tu contrato de trabajo tiene esta cláusula, lamentablemente no recibirías la indemnización.\nRetraso del vuelo: Cómo reclamar la indemnización\n\nTienes varias opciones a la hora de reclamar a la compañía aérea. O bien opta por hacer la reclamación por tu cuenta o bien delega la tarea en otra persona. </doc><doc>\nPreguntar por qué se ha retrasado el vuelo: con los detalles de la incidencia.\n\nGuardar los recibos: si tienes gastos extraordinarios por el retraso. Es posible que estos gastos también los puedes incluir cuando vas a reclamar el retraso de vuelo.\n\n    Vuelo con escalas: si tu vuelo internacional tiene escala en la UE puede que tengas derecho también a una compensación adicional. Depende de como el retraso de vuelo afecta el resto de tu viaje, pero también podrás recibir una indemnización en estos casos cuando reclamas el retraso de vuelo.\n\nTiempo límite para presentar las reclamaciones de vuelos\n\nEl tiempo máximo para optar a tu derecho de compensación dentro de la Unión Europea varía de un país a otro y además está determinado por la ubicación de la sede central de la aerolínea o por el tribunal que tiene jurisdicción en casos relacionados con la compañía. En AirHelp tenemos una tabla en la que puedes consultar los plazos de prescripción en Europa. Debes tener en cuanto los plazos y tiempos límites para las reclamaciones, ya que no quieres pasar y perder tu derecho a reclamar tu debida indemnización por el retraso de tu vuelo internacional o nacional.\n\nEn cuanto a los vuelos internacionales, el Convenio de Montreal establece un límite de 2 años para presentar una reclamación de gastos provocados por una incidencia en un vuelo.\n\n¿Cómo puede ayudarte AirHelp a reclamar tu indemnización por retraso de vuelo?\n\nEn AirHelp hemos ayudado a más de 16 millones de pasajeros, y es que con tan sólo introducir los detalles de tu vuelo podremos comprobar si tienes derecho a una compensación por retraso. Puedes optar por hacerlo a través de nuestro calculador gratuito.\n\nEn ambos casos si tienes derecho a una indemnización, AirHelp gestionará la reclamación de tus vuelos enviando actualizaciones durante todo el proceso y finalmente te enviaremos el dinero de tu compensación por el método que elijas.\n\nCon la garantía de contar con profesionales expertos, AirHelp no te cobrará nada si no consigues ganar la reclamación de tu vuelo. Así que estamos dispuestos a hacer el ‘trabajo duro’ por ti para mejorar tu experiencia como pasajero si tu vuelo se retrasa.\n\nEn tan sólo dos minutos podremos comprobar tus derechos y hacerlos valer de inmediato frente a las aerolíneas, con las que estamos acostumbrados a negociar e interactuar en igualdad de condiciones.</doc>",
            "response": "Si tu vuelo ha salido con retraso, tienes derecho a una indemnización por retraso de la compañía aérea. Este derecho se aplica independientemente de si eres un pasajero individual o si viajas en un vuelo combinado. La indemnización se calcula en función de la distancia del vuelo y el retraso, y puede variar desde 250 hasta 600 euros.\n\nPara reclamar la indemnización, debes presentar los siguientes documentos:\n\n- Tarjeta de embarque con el número de vuelo\n- Confirmación de reserva\n- Billetes de transportación alternativa\n- Voucher\n- Documentación de costes adicionales\n- Fotografías con sello de fecha o de la pantalla del embarque\n- Si es posible, confirmación por escrito o declaraciones de la línea aérea de los motivos del retraso del vuelo\n\nSi tu vuelo se retrasa durante un viaje combinado, puedes reclamar tanto a tu operador turístico como a la compañía aérea. El factor clave es el tiempo de retraso en el aeropuerto de destino:\n\n- Si tu vuelo tiene un retraso de más de 3 horas en el destino, tienes derecho a una indemnización de la compañía aérea con un retraso del vuelo en el destino de más de 3 horas.\n- Si tu vuelo tiene un retraso de más de 4 horas en el destino, además de un retraso del vuelo en el destino, también tienes derecho a una indemnización de la compañía aérea y a una reducción del precio del paquete por parte del operador turístico.\n\nEs importante tener en cuenta que, si tu vuelo se retrasa debido a circunstancias extraordinarias, como una caída de un rayo, la compañía aérea no puede ser considerada responsable del retraso.\n\nAirHelp te puede ayudar a reclamar tu indemnización por retraso de vuelo. Puedes optar por hacerlo a través de nuestro calculador gratuito. Si tienes derecho a una indemnización, AirHelp gestionará la reclamación de tus vuelos enviando actualizaciones durante todo el proceso y finalmente te enviarán el dinero de tu compensación por el método que elijas.",
            "reference": "La opción más fácil y eficaz para reclamar una indemnización por retraso de vuelo en Europa es utilizar los servicios de compañías especializadas en reclamaciones de derechos de pasajeros. Estas compañías ofrecen un proceso simplificado y asistencia profesional, eliminando la necesidad de que el pasajero se involucre en trámites complicados y negociaciones con las aerolíneas. Aquí te presento algunas opciones recomendadas:\n\n    AirHelp: Esta empresa ha ayudado a más de 16 millones de pasajeros y opera en 30 países. Ofrecen un proceso sencillo donde solo necesitas introducir los detalles de tu vuelo en su calculadora online para comprobar si tienes derecho a compensación. Si es así, gestionarán todo el proceso de reclamación, incluyendo negociaciones con las aerolíneas, y te enviarán la compensación directamente. Solo cobran una comisión si la reclamación es exitosa​​.\n\nReclamador: Es una página española con una interfaz intuitiva y fácil de usar. Solo necesitas introducir algunos datos de tu vuelo, y ellos se encargarán de todo el proceso de reclamación. Al igual que AirHelp, solo cobran una comisión si la reclamación resulta exitosa​.\n\nRefund.me: Esta empresa opera a nivel mundial y ofrece un proceso de reclamación eficiente y rápido a través de procesos automatizados. Aunque su trato puede ser menos personalizado, también solo cobran una comisión si la reclamación es exitosa​.\n\nFlightRight: Opera casi en todo el mundo y ofrece un trato personalizado. Calculan la indemnización para que tengas una idea de lo que te corresponde y envían el dinero de la indemnización de manera inmediata, aunque tienen una comisión más alta​.\n\nPopuletic: No solo se enfocan en vuelos retrasados o cancelados, sino también en problemas relacionados con overbooking, equipaje y otros aspectos del viaje​.\n\nMYFLYRIGHT: Ofrecen un servicio gratuito para comprobar si puedes reclamar una indemnización. Si decides utilizar su servicio, tramitarán tu reclamación sin riesgo financiero y solo aplicarán una comisión en caso de éxito. Además, ofrecen la opción de un pago inmediato con una comisión más alta​.\n\nEstas compañías te ahorran tiempo y esfuerzo al manejar todas las comunicaciones y negociaciones necesarias, aumentando las posibilidades de una resolución exitosa de tu reclamación."
        },
        {
            "user_input": "forma eficaz de reclamar a aerolinea por retraso en vuelo europeo",
            "retrieved_contexts": "<doc>\n¿Como reclamar el retraso de los vuelos?\n\nAhora viene la parte que puedes considerar ‘más complicada’, pero que no tiene por qué asustarte, ya que precisamente desde AirHelp trabajamos para facilitarte el trabajo y poder ayudarte a como reclamar el retraso de tu vuelo en caso de que tu caso cumpla con los requisitos. Primero te explicaremos todo lo que necesitarías para presentar una reclamación por vuelos retrasados, incluso para reclamaciones con Iberia. En el caso en que decidieras hacerlo tú mismo, y después te mostraremos cómo nuestra ayuda puede evitarte perder un tiempo precioso en papeleo y negociaciones con las compañías, porque lo podemos hacer por ti. Siempre estamos disponibles para ayudar a que recibas la indemnización que se te debe cuando reclamas el retraso de vuelo.\nReclamaciones por retrasos de vuelos en la UE\n\nSi vas a presentar una reclamación por un retraso de vuelo para recibir una indemnización acogiéndote a la normativa europea CE 261 tienes que seguir los siguientes pasos:\n\nConserva tu tarjeta de embarque y cualquier otro documento: es válido también cualquier documento que contenga el código de confirmación de la reserva. Esto es importante para realizar reclamaciones por retrasos de vuelos.\n\n</doc><doc>\nReúne todas las pruebas que pueda, y así aumentarás las probabilidades de que tu reclamación contra la compañía aérea tenga éxito.\nRetraso del vuelo: Lista de comprobación para reclamar\n\nLista de comprobación: Información y documentos importantes en caso de denegación de embarque\n\n    Tarjeta de embarque con el número de vuelo\n    Confirmación de reserva\n    Billetes de transportación alternativa\n    Vouchers\n    Documentación de costes adicionales\n    Fotografías con sello de fecha o de la pantalla del embarque\n    Si es possible, confirmación por escrito/o declaraciones de la línea aérea de los motivos de retraso del vuelo\n\nMYFLYRIGHT te ayudará encantado en cualquier caso, incluso mucho tiempo después de la emisión del vuelo y sin mucha burocracia, para hacer valer tus derechos de pasajero.\nCompensación por retraso de vuelo: Paquete y viaje de negocios\n\nCuando viajas hacia esas esperadas vacaciones o la conferencia de tu carrera y el vuelo se retrasa, nunca es un buen comienzo. Además, los retrasos pueden hacer que se pierda por completo encuentros familiares, reuniones importantes o actividades reservadas con antelación.\n\nAunque el dinero no compensa totalmente las molestias causadas por un retraso de vuelo, al menos siempre puedes reclamar la indemnización que te corresponde. Incluso en el caso de los viajes combinados y los viajes de negocios, tienes los mismos derechos como pasajero que los viajeros individuales.\nCompensación de la UE por retraso de un vuelo durante un viaje combinado\n\nSi tu vuelo se retrasa durante un viaje combinado, puedes reclamar tanto a tu operador turístico como a la compañía aérea. El factor clave es el tiempo de retraso en el aeropuerto de destino:\n\n    Los pasajeros tienen derecho a una indemnización de la aerolínea con un retraso del vuelo en el destino de más de 3 horas.\n    Con un retraso del vuelo de más de 4 horas en el destino, los pasajeros tienen derecho no sólo a una indemnización de la compañía aérea, sino también a una reducción del precio del paquete por parte del operador turístico.\n\nHay que recordar que para poder reclamar, el retraso no debe haber sido causado por circunstancias extraordinarias.\nReclamación por retraso de vuelo: viajes de negocios\n\nUn retraso en un vuelo durante un viaje de negocios puede tener graves consecuencias. Perder reuniones, perder clientes o llegar tarde a una presentación clave son cosas que perjudican a tu empresa.\n\nPero cuando se viaja por negocios, ¿quién recibe la indemnización: tú o tu empresa?\n\nLa indemnización se paga siempre al viajero. Se proporciona para compensar las molestias sufridas por el pasajero, por lo que es irrelevante quién hizo la reserva. Sin embargo, algunas empresas incluyen una cláusula en el contrato de trabajo que establece que son ellas las que tienen derecho a esta indemnización y no el empleado; si tu contrato de trabajo tiene esta cláusula, lamentablemente no recibirías la indemnización.\nRetraso del vuelo: Cómo reclamar la indemnización\n\nTienes varias opciones a la hora de reclamar a la compañía aérea. O bien opta por hacer la reclamación por tu cuenta o bien delega la tarea en otra persona. </doc><doc>\nPreguntar por qué se ha retrasado el vuelo: con los detalles de la incidencia.\n\nGuardar los recibos: si tienes gastos extraordinarios por el retraso. Es posible que estos gastos también los puedes incluir cuando vas a reclamar el retraso de vuelo.\n\n    Vuelo con escalas: si tu vuelo internacional tiene escala en la UE puede que tengas derecho también a una compensación adicional. Depende de como el retraso de vuelo afecta el resto de tu viaje, pero también podrás recibir una indemnización en estos casos cuando reclamas el retraso de vuelo.\n\nTiempo límite para presentar las reclamaciones de vuelos\n\nEl tiempo máximo para optar a tu derecho de compensación dentro de la Unión Europea varía de un país a otro y además está determinado por la ubicación de la sede central de la aerolínea o por el tribunal que tiene jurisdicción en casos relacionados con la compañía. En AirHelp tenemos una tabla en la que puedes consultar los plazos de prescripción en Europa. Debes tener en cuanto los plazos y tiempos límites para las reclamaciones, ya que no quieres pasar y perder tu derecho a reclamar tu debida indemnización por el retraso de tu vuelo internacional o nacional.\n\nEn cuanto a los vuelos internacionales, el Convenio de Montreal establece un límite de 2 años para presentar una reclamación de gastos provocados por una incidencia en un vuelo.\n\n¿Cómo puede ayudarte AirHelp a reclamar tu indemnización por retraso de vuelo?\n\nEn AirHelp hemos ayudado a más de 16 millones de pasajeros, y es que con tan sólo introducir los detalles de tu vuelo podremos comprobar si tienes derecho a una compensación por retraso. Puedes optar por hacerlo a través de nuestro calculador gratuito.\n\nEn ambos casos si tienes derecho a una indemnización, AirHelp gestionará la reclamación de tus vuelos enviando actualizaciones durante todo el proceso y finalmente te enviaremos el dinero de tu compensación por el método que elijas.\n\nCon la garantía de contar con profesionales expertos, AirHelp no te cobrará nada si no consigues ganar la reclamación de tu vuelo. Así que estamos dispuestos a hacer el ‘trabajo duro’ por ti para mejorar tu experiencia como pasajero si tu vuelo se retrasa.\n\nEn tan sólo dos minutos podremos comprobar tus derechos y hacerlos valer de inmediato frente a las aerolíneas, con las que estamos acostumbrados a negociar e interactuar en igualdad de condiciones.</doc><doc>\n: Todos aquellos en los que vueles dentro de la UE tanto si la aerolínea es europea como si no lo es. Además, también están cubiertos los vuelos que partan de la UE hacia un lugar fuera de la UE, sin importar la procedencia de la aerolínea. Ahora bien, si vuelas desde un aeropuerto de fuera de la UE hacia ella solo está cubierto el retraso en caso de que la aerolínea sea europea. Por último, si vuelas desde fuera de la UE directamente a un lugar que no sea europeo no estaría cubierto en ningún caso. Como se puede observar, hay varias circunstancias donde los pasajeros podrán recibir una indemnización por retraso de vuelo internacional.\n\n¿Qué retrasos están cubiertos para realizar reclamaciones?: solo puedes reclamar los vuelos con retrasos superiores a 3 horas, contando la hora de llegada desde el momento en que se abren las puertas del avión. Sin embargo, tienes que tener en cuenta que las denominadas \"circunstancias extraordinarias\" no están cubiertas y se refieren a situaciones como relámpagos, urgencias médicas, condiciones meteorológicas muy adversas, restricciones en el control del tráfico aéreo, funcionamiento deficiente repentino del radar del aeropuerto, actos de sabotaje, inestabilidad política o actos de terrorismo. Por otra parte, las \"dificultades técnicas\" o las \"circunstancias operativas\" de las aerolíneas no pueden ser calificadas como \"circunstancias extraordinarias\", según ha afirmado en varias ocasiones el Tribunal de Justicia Europeo.\n\n    </doc><doc>\nIndemnización retraso vuelo\n\nNavegación por el Retraso en el vuelo\n\n    La indemnización por retraso de vuelo y los derechos en breve\n    ¿Tu vuelo se ha retrasado? Condiciones de indemnización\n    Indemnización por retraso de vuelo: Derechos de los pasajeros de la UE\n    Indemnización por retraso de vuelo: Paquete y viaje de negocios\n    Retraso del vuelo: Cómo reclamar una indemnización\n    Estado de los vuelos: Estadísticas de la UE sobre retrasos\n\nIndemnizaciones y derechos en caso de retraso de un vuelo\n\nLos retrasos de los vuelos, tanto si te vas de vacaciones como si viajas por negocios, no sólo son un inconveniente sino que son extremadamente estresantes. Puede resultar confuso para los pasajeros saber qué hacer en esta situación, que por desgracia se está convirtiendo en un problema cada vez más común en los viajes aéreos.\n\nLa buena noticia es que tienes varias opciones cuando tu vuelo se retrasa, pero la cuantía de la indemnización que puedes recibir depende de varios factores. Cuando tu vuelo llega al aeropuerto de destino con un retraso de más de 3 horas, tienes derecho a 250 euros, 400 euros o 600 euros, dependiendo de la distancia del vuelo. Con un retraso de más de 5 horas, puedes reclamar una indemnización por el precio del billete si ya no quieres coger el vuelo. La aerolínea debe ofrecerte servicios que incluyen comidas, refrescos y alojamiento gratuitos, según la duración del retraso.\n\nSólo el 65% de los vuelos con un retraso de más de 3 horas en la UE tienen derecho a una indemnización por parte de la compañía aérea. La procedencia o no de una reclamación depende de si la compañía aérea podía haber evitado el retraso del vuelo o si este se debió a circunstancias extraordinarias. Cuando el motivo del retraso del vuelo se considera una circunstancia extraordinaria -por ejemplo, la caída de un rayo-, la compañía aérea no puede ser considerada responsable del retraso.\n\nEl 80% de los pasajeros desconocen sus derechos en caso de retraso de los vuelos. Sólo una parte -aproximadamente el 5% de los afectados - consigue hacer valer sus reclamaciones por su cuenta, ya que las compañías aéreas suelen aprovecharse de la ingenuidad de los pasajeros para no indemnizarlos.\n\nMYFLYRIGHT, expertos en derechos de los viajeros, pretenden poner fin a esta práctica injusta. Con MYFLYRIGHT, comprobar si puedes reclamar una indemnización por el retraso de tu vuelo es gratis. Si decides utilizar el servicio, MYFLYRIGHT tramitará tu reclamación contra la compañía aérea sin ningún riesgo financiero. Sólo en caso de éxito se aplica una comisión del 25% más IVA, ahorrándote tiempo, esfuerzo y estrés. </doc>",
            "response": "Para reclamar el retraso de un vuelo en la Unión Europea, sigue estos pasos:\n\n    Comprueba tu derecho: Determina si tu vuelo se retrasó por circunstancias extraordinarias o por una situación que no es la responsabilidad de la aerolínea, como una caída de rayo. Si tu vuelo se retrasó por una circunstancia extraordinaria, la aerolínea no puede ser responsable​.\n\nUtiliza MYFLYRIGHT: MYFLYRIGHT es una plataforma que te ayuda a verificar si puedes reclamar una indemnización por el retraso de tu vuelo. Si decides utilizar el servicio, MYFLYRIGHT tramitará tu reclamación sin riesgo financiero. Esto te permite enfocarte en otras preocupaciones mientras se maneja la reclamación por ti​.\n\nOpta por una indemnización: Si tu vuelo se retrasó por más de 3 horas, tienes derecho a una indemnización de 250 euros, 400 euros o 600 euros, dependiendo de la distancia del vuelo. Si tu retraso fue por más de 5 horas, puedes solicitar una indemnización por el precio del billete. La aerolínea debe ofrecerte servicios como comidas, refrescos y alojamiento gratuitos, según la duración del retraso​.\n\nConsidera la cantidad de la indemnización: La cuantía de la indemnización que puedes recibir depende de varios factores, como la distancia del vuelo y la gravedad del retraso. Aunque la mayoría de los vuelos con un retraso de más de 3 horas tienen derecho a una indemnización, solo el 65% de los vuelos con un retraso de más de 3 horas en la UE tienen derecho a una indemnización. La procedencia o no de una reclamación depende de si la compañía aérea podía haber evitado el retraso del vuelo o si este se debió a circunstancias extraordinarias​​.\n\nTen en cuenta que, aunque MYFLYRIGHT es una opción, también puedes optar por presentar una reclamación por tu cuenta. Sin embargo, es importante tener en cuenta que las compañías aéreas suelen aprovecharse de la ingenuidad de los pasajeros para no indemnizarlos. Por lo tanto, es recomendable contar con la ayuda de un profesional para presentar una reclamación efectiva​.\n\nEn resumen, para reclamar el retraso de un vuelo en la Unión Europea, primero verifica tu derecho, utiliza MYFLYRIGHT si lo deseas, opta por una indemnización y ten en cuenta que la cantidad de la indemnización puede variar según la distancia del vuelo y la gravedad del retraso. Si decides presentar una reclamación por tu cuenta, ten en cuenta que las compañías aéreas suelen aprovecharse de la ingenuidad de los pasajeros.",
            "reference": "La opción más fácil y eficaz para reclamar una indemnización por retraso de vuelo en Europa es utilizar los servicios de compañías especializadas en reclamaciones de derechos de pasajeros. Estas compañías ofrecen un proceso simplificado y asistencia profesional, eliminando la necesidad de que el pasajero se involucre en trámites complicados y negociaciones con las aerolíneas. Aquí te presento algunas opciones recomendadas:\n\n    AirHelp: Esta empresa ha ayudado a más de 16 millones de pasajeros y opera en 30 países. Ofrecen un proceso sencillo donde solo necesitas introducir los detalles de tu vuelo en su calculadora online para comprobar si tienes derecho a compensación. Si es así, gestionarán todo el proceso de reclamación, incluyendo negociaciones con las aerolíneas, y te enviarán la compensación directamente. Solo cobran una comisión si la reclamación es exitosa​​.\n\nReclamador: Es una página española con una interfaz intuitiva y fácil de usar. Solo necesitas introducir algunos datos de tu vuelo, y ellos se encargarán de todo el proceso de reclamación. Al igual que AirHelp, solo cobran una comisión si la reclamación resulta exitosa​.\n\nRefund.me: Esta empresa opera a nivel mundial y ofrece un proceso de reclamación eficiente y rápido a través de procesos automatizados. Aunque su trato puede ser menos personalizado, también solo cobran una comisión si la reclamación es exitosa​.\n\nFlightRight: Opera casi en todo el mundo y ofrece un trato personalizado. Calculan la indemnización para que tengas una idea de lo que te corresponde y envían el dinero de la indemnización de manera inmediata, aunque tienen una comisión más alta​.\n\nPopuletic: No solo se enfocan en vuelos retrasados o cancelados, sino también en problemas relacionados con overbooking, equipaje y otros aspectos del viaje​.\n\nMYFLYRIGHT: Ofrecen un servicio gratuito para comprobar si puedes reclamar una indemnización. Si decides utilizar su servicio, tramitarán tu reclamación sin riesgo financiero y solo aplicarán una comisión en caso de éxito. Además, ofrecen la opción de un pago inmediato con una comisión más alta​.\n\nEstas compañías te ahorran tiempo y esfuerzo al manejar todas las comunicaciones y negociaciones necesarias, aumentando las posibilidades de una resolución exitosa de tu reclamación."
        },
        {
            "user_input": "hay alguna forma de reclamar por retrasos en vuelos que sea cómoda y fácil de hacer",
            "retrieved_contexts": "<doc>\n¿Como reclamar el retraso de los vuelos?\n\nAhora viene la parte que puedes considerar ‘más complicada’, pero que no tiene por qué asustarte, ya que precisamente desde AirHelp trabajamos para facilitarte el trabajo y poder ayudarte a como reclamar el retraso de tu vuelo en caso de que tu caso cumpla con los requisitos. Primero te explicaremos todo lo que necesitarías para presentar una reclamación por vuelos retrasados, incluso para reclamaciones con Iberia. En el caso en que decidieras hacerlo tú mismo, y después te mostraremos cómo nuestra ayuda puede evitarte perder un tiempo precioso en papeleo y negociaciones con las compañías, porque lo podemos hacer por ti. Siempre estamos disponibles para ayudar a que recibas la indemnización que se te debe cuando reclamas el retraso de vuelo.\nReclamaciones por retrasos de vuelos en la UE\n\nSi vas a presentar una reclamación por un retraso de vuelo para recibir una indemnización acogiéndote a la normativa europea CE 261 tienes que seguir los siguientes pasos:\n\nConserva tu tarjeta de embarque y cualquier otro documento: es válido también cualquier documento que contenga el código de confirmación de la reserva. Esto es importante para realizar reclamaciones por retrasos de vuelos.\n\n</doc><doc>\nReúne todas las pruebas que pueda, y así aumentarás las probabilidades de que tu reclamación contra la compañía aérea tenga éxito.\nRetraso del vuelo: Lista de comprobación para reclamar\n\nLista de comprobación: Información y documentos importantes en caso de denegación de embarque\n\n    Tarjeta de embarque con el número de vuelo\n    Confirmación de reserva\n    Billetes de transportación alternativa\n    Vouchers\n    Documentación de costes adicionales\n    Fotografías con sello de fecha o de la pantalla del embarque\n    Si es possible, confirmación por escrito/o declaraciones de la línea aérea de los motivos de retraso del vuelo\n\nMYFLYRIGHT te ayudará encantado en cualquier caso, incluso mucho tiempo después de la emisión del vuelo y sin mucha burocracia, para hacer valer tus derechos de pasajero.\nCompensación por retraso de vuelo: Paquete y viaje de negocios\n\nCuando viajas hacia esas esperadas vacaciones o la conferencia de tu carrera y el vuelo se retrasa, nunca es un buen comienzo. Además, los retrasos pueden hacer que se pierda por completo encuentros familiares, reuniones importantes o actividades reservadas con antelación.\n\nAunque el dinero no compensa totalmente las molestias causadas por un retraso de vuelo, al menos siempre puedes reclamar la indemnización que te corresponde. Incluso en el caso de los viajes combinados y los viajes de negocios, tienes los mismos derechos como pasajero que los viajeros individuales.\nCompensación de la UE por retraso de un vuelo durante un viaje combinado\n\nSi tu vuelo se retrasa durante un viaje combinado, puedes reclamar tanto a tu operador turístico como a la compañía aérea. El factor clave es el tiempo de retraso en el aeropuerto de destino:\n\n    Los pasajeros tienen derecho a una indemnización de la aerolínea con un retraso del vuelo en el destino de más de 3 horas.\n    Con un retraso del vuelo de más de 4 horas en el destino, los pasajeros tienen derecho no sólo a una indemnización de la compañía aérea, sino también a una reducción del precio del paquete por parte del operador turístico.\n\nHay que recordar que para poder reclamar, el retraso no debe haber sido causado por circunstancias extraordinarias.\nReclamación por retraso de vuelo: viajes de negocios\n\nUn retraso en un vuelo durante un viaje de negocios puede tener graves consecuencias. Perder reuniones, perder clientes o llegar tarde a una presentación clave son cosas que perjudican a tu empresa.\n\nPero cuando se viaja por negocios, ¿quién recibe la indemnización: tú o tu empresa?\n\nLa indemnización se paga siempre al viajero. Se proporciona para compensar las molestias sufridas por el pasajero, por lo que es irrelevante quién hizo la reserva. Sin embargo, algunas empresas incluyen una cláusula en el contrato de trabajo que establece que son ellas las que tienen derecho a esta indemnización y no el empleado; si tu contrato de trabajo tiene esta cláusula, lamentablemente no recibirías la indemnización.\nRetraso del vuelo: Cómo reclamar la indemnización\n\nTienes varias opciones a la hora de reclamar a la compañía aérea. O bien opta por hacer la reclamación por tu cuenta o bien delega la tarea en otra persona. </doc><doc>\nPreguntar por qué se ha retrasado el vuelo: con los detalles de la incidencia.\n\nGuardar los recibos: si tienes gastos extraordinarios por el retraso. Es posible que estos gastos también los puedes incluir cuando vas a reclamar el retraso de vuelo.\n\n    Vuelo con escalas: si tu vuelo internacional tiene escala en la UE puede que tengas derecho también a una compensación adicional. Depende de como el retraso de vuelo afecta el resto de tu viaje, pero también podrás recibir una indemnización en estos casos cuando reclamas el retraso de vuelo.\n\nTiempo límite para presentar las reclamaciones de vuelos\n\nEl tiempo máximo para optar a tu derecho de compensación dentro de la Unión Europea varía de un país a otro y además está determinado por la ubicación de la sede central de la aerolínea o por el tribunal que tiene jurisdicción en casos relacionados con la compañía. En AirHelp tenemos una tabla en la que puedes consultar los plazos de prescripción en Europa. Debes tener en cuanto los plazos y tiempos límites para las reclamaciones, ya que no quieres pasar y perder tu derecho a reclamar tu debida indemnización por el retraso de tu vuelo internacional o nacional.\n\nEn cuanto a los vuelos internacionales, el Convenio de Montreal establece un límite de 2 años para presentar una reclamación de gastos provocados por una incidencia en un vuelo.\n\n¿Cómo puede ayudarte AirHelp a reclamar tu indemnización por retraso de vuelo?\n\nEn AirHelp hemos ayudado a más de 16 millones de pasajeros, y es que con tan sólo introducir los detalles de tu vuelo podremos comprobar si tienes derecho a una compensación por retraso. Puedes optar por hacerlo a través de nuestro calculador gratuito.\n\nEn ambos casos si tienes derecho a una indemnización, AirHelp gestionará la reclamación de tus vuelos enviando actualizaciones durante todo el proceso y finalmente te enviaremos el dinero de tu compensación por el método que elijas.\n\nCon la garantía de contar con profesionales expertos, AirHelp no te cobrará nada si no consigues ganar la reclamación de tu vuelo. Así que estamos dispuestos a hacer el ‘trabajo duro’ por ti para mejorar tu experiencia como pasajero si tu vuelo se retrasa.\n\nEn tan sólo dos minutos podremos comprobar tus derechos y hacerlos valer de inmediato frente a las aerolíneas, con las que estamos acostumbrados a negociar e interactuar en igualdad de condiciones.</doc><doc>\nIndemnización retraso vuelo\n\nNavegación por el Retraso en el vuelo\n\n    La indemnización por retraso de vuelo y los derechos en breve\n    ¿Tu vuelo se ha retrasado? Condiciones de indemnización\n    Indemnización por retraso de vuelo: Derechos de los pasajeros de la UE\n    Indemnización por retraso de vuelo: Paquete y viaje de negocios\n    Retraso del vuelo: Cómo reclamar una indemnización\n    Estado de los vuelos: Estadísticas de la UE sobre retrasos\n\nIndemnizaciones y derechos en caso de retraso de un vuelo\n\nLos retrasos de los vuelos, tanto si te vas de vacaciones como si viajas por negocios, no sólo son un inconveniente sino que son extremadamente estresantes. Puede resultar confuso para los pasajeros saber qué hacer en esta situación, que por desgracia se está convirtiendo en un problema cada vez más común en los viajes aéreos.\n\nLa buena noticia es que tienes varias opciones cuando tu vuelo se retrasa, pero la cuantía de la indemnización que puedes recibir depende de varios factores. Cuando tu vuelo llega al aeropuerto de destino con un retraso de más de 3 horas, tienes derecho a 250 euros, 400 euros o 600 euros, dependiendo de la distancia del vuelo. Con un retraso de más de 5 horas, puedes reclamar una indemnización por el precio del billete si ya no quieres coger el vuelo. La aerolínea debe ofrecerte servicios que incluyen comidas, refrescos y alojamiento gratuitos, según la duración del retraso.\n\nSólo el 65% de los vuelos con un retraso de más de 3 horas en la UE tienen derecho a una indemnización por parte de la compañía aérea. La procedencia o no de una reclamación depende de si la compañía aérea podía haber evitado el retraso del vuelo o si este se debió a circunstancias extraordinarias. Cuando el motivo del retraso del vuelo se considera una circunstancia extraordinaria -por ejemplo, la caída de un rayo-, la compañía aérea no puede ser considerada responsable del retraso.\n\nEl 80% de los pasajeros desconocen sus derechos en caso de retraso de los vuelos. Sólo una parte -aproximadamente el 5% de los afectados - consigue hacer valer sus reclamaciones por su cuenta, ya que las compañías aéreas suelen aprovecharse de la ingenuidad de los pasajeros para no indemnizarlos.\n\nMYFLYRIGHT, expertos en derechos de los viajeros, pretenden poner fin a esta práctica injusta. Con MYFLYRIGHT, comprobar si puedes reclamar una indemnización por el retraso de tu vuelo es gratis. Si decides utilizar el servicio, MYFLYRIGHT tramitará tu reclamación contra la compañía aérea sin ningún riesgo financiero. Sólo en caso de éxito se aplica una comisión del 25% más IVA, ahorrándote tiempo, esfuerzo y estrés. </doc><doc>\nConoce las compensaciones cuando se retrasa tu vuelo\n\nLlegas al aeropuerto y tu vuelo va con retraso, ¿conoces cuáles son tus derechos y si puedes pedir reclamar una compensación? Desde AirHelp te ayudamos con los trámites para que tu viaje no se convierta en una pesadilla y puedas conocer todos los casos en los que puedes hacer una reclamación y el plazo para realizar los reclamos. ¡Te ayudaremos a reclamar tu indemnización por si tu vuelo se retrasa!\n\nDesplazarse en avión es para muchas personas un trámite casi diario por cuestiones profesionales, y para muchas otras el comienzo o final de sus esperadas vacaciones. Sea cual sea el motivo, volar debería ser una buena experiencia placentera para todos los pasajeros en cualquier parte del mundo, pero en algunas ocasiones no todo sale como esperábamos y surgen imprevistos como puede ser el retraso de un vuelo. Ante dicha circunstancia, ¿conoces los derechos que tienes como pasajero si tu vuelo se ha retrasado?, ¿sabes en qué casos podrías reclamar el retraso del vuelo para recibir una compensación económica o de otra índole?, y ¿sabes cuáles son los pasos a seguir para realizar la reclamación para conseguir la indemnización por el retraso del vuelo? Nosotros te ayudamos para que sepas como reclamar cualquier retraso de vuelo que cumpla con los requisitos.\n\nEn AirHelp queremos ayudarte no solo a que los conozcas con detalle, también podemos realizar todos los trámites por ti en caso de que te corresponda una indemnización por retraso de vuelo. Así que vamos a ver, paso a paso, qué es lo que debes hacer para reclamar si tu vuelo se ha retrasado.\n1. ¿Qué indemnizaciones tienes derecho por el retraso de tu vuelo?\n\nEn primer lugar, dependiendo de donde te encuentres y a dónde te dirijas, tus derechos como pasajero aéreo en los casos de vuelos con retraso serán diferentes, ya que se aplican distintas normativas. No siempre vas a poder reclamar cuando el vuelo no salga a horario, pero a continuación vamos a cubrir las instancias donde tienes derecho a reclamar una indemnización por retraso de vuelo, ya sea un vuelo internacional o nacional.\nVuelos dentro de la UE\n\nLa ley europea relacionada con los derechos de los pasajeros aéreos se conoce como Reglamento (CE) Nº 261/2004 del Parlamento Europeo y del Consejo del 11 de febrero de 2004. A partir de ahora nos referiremos a ella como CE 261, y nos centraremos en las compensaciones que los pasajeros pueden reclamar en casos de que sus vuelos tengan retrasos. Incluye no sólo el espacio aéreo de la UE, sino también Islandia, Noruega, Suiza y la llamada «región ultraperiférica» (La Guayana francesa y Martinica, Mayotte, Guadalupe y La Reunión, San Martín, Madeira y Azores y las Islas Canarias).\n\n¿Qué vuelos están cubiertos para poder reclamar?</doc>",
            "response": "Claro, estaré encantado de ayudarte a reclamar por retrasos en vuelos. Aquí te presento algunos pasos que puedes seguir para hacerlo:\n\n    Comprueba tus derechos: Antes de intentar reclamar, asegúrate de que realmente has sufrido un retraso del vuelo. Los retrasos legítimos están permitidos por la ley y deben ser causados por circunstancias extraordinarias, como accidentes naturales, fuerza mayor o retrasos de la aerolínea. También debes verificar si el retraso fue causado por la aerolínea, ya que esto podría afectar tu derecho a una compensación​.\n\nIdentifica tu caso: Determina si tu retraso cumple con los criterios establecidos en el Reglamento (CE) Nº 261/2004 del Parlamento Europeo y del Consejo. Este reglamento define qué vuelos están cubiertos para reclamar una compensación por retraso, incluidos los vuelos internacionales y nacionales.\n\nCalcula la indemnización: Si tu caso cumple con los criterios, puedes calcular la indemnización que podrías recibir. La cantidad varía según la duración del retraso y la distancia recorrida. Por ejemplo, un retraso de 3 horas en un vuelo internacional podría otorgarte hasta 250 euros de indemnización​.\n\nConsidera la reclamación en persona: Si prefieres presentar tu reclamación en persona, puedes hacerlo en la aerolínea o en la oficina de compensaciones de la aerolínea. También puedes presentar tu reclamación por escrito, pero ten en cuenta que esto puede tardar más en procesarse​.\n\nUtiliza servicios de terceros: Si prefieres no hacer el trámite por tu cuenta, existen servicios de intermediación que pueden ayudarte a presentar tu reclamación por ti. Estos servicios pueden incluir la gestión de la reclamación, pero te cobrarán una comisión por su servicio​​.\n\nRecuerda que es importante investigar y comparar diferentes opciones antes de tomar una decisión. Y recuerda siempre leer y entender los términos y condiciones de cualquier acuerdo que firmes.",
            "reference": "La opción más fácil y eficaz para reclamar una indemnización por retraso de vuelo en Europa es utilizar los servicios de compañías especializadas en reclamaciones de derechos de pasajeros. Estas compañías ofrecen un proceso simplificado y asistencia profesional, eliminando la necesidad de que el pasajero se involucre en trámites complicados y negociaciones con las aerolíneas. Aquí te presento algunas opciones recomendadas:\n\n    AirHelp: Esta empresa ha ayudado a más de 16 millones de pasajeros y opera en 30 países. Ofrecen un proceso sencillo donde solo necesitas introducir los detalles de tu vuelo en su calculadora online para comprobar si tienes derecho a compensación. Si es así, gestionarán todo el proceso de reclamación, incluyendo negociaciones con las aerolíneas, y te enviarán la compensación directamente. Solo cobran una comisión si la reclamación es exitosa​​.\n\nReclamador: Es una página española con una interfaz intuitiva y fácil de usar. Solo necesitas introducir algunos datos de tu vuelo, y ellos se encargarán de todo el proceso de reclamación. Al igual que AirHelp, solo cobran una comisión si la reclamación resulta exitosa​.\n\nRefund.me: Esta empresa opera a nivel mundial y ofrece un proceso de reclamación eficiente y rápido a través de procesos automatizados. Aunque su trato puede ser menos personalizado, también solo cobran una comisión si la reclamación es exitosa​.\n\nFlightRight: Opera casi en todo el mundo y ofrece un trato personalizado. Calculan la indemnización para que tengas una idea de lo que te corresponde y envían el dinero de la indemnización de manera inmediata, aunque tienen una comisión más alta​.\n\nPopuletic: No solo se enfocan en vuelos retrasados o cancelados, sino también en problemas relacionados con overbooking, equipaje y otros aspectos del viaje​.\n\nMYFLYRIGHT: Ofrecen un servicio gratuito para comprobar si puedes reclamar una indemnización. Si decides utilizar su servicio, tramitarán tu reclamación sin riesgo financiero y solo aplicarán una comisión en caso de éxito. Además, ofrecen la opción de un pago inmediato con una comisión más alta​.\n\nEstas compañías te ahorran tiempo y esfuerzo al manejar todas las comunicaciones y negociaciones necesarias, aumentando las posibilidades de una resolución exitosa de tu reclamación."
        },
        {
            "user_input": "Quiero ir a buscar setas por la Sierra de Madrid, ¿qué recomendaciones puedes darme?",
            "retrieved_contexts": "<doc>\nEl primer consejo que se puede ofrecer ante esta cuestión es que si no tienes la certeza absoluta de que sea comestible, lo mejor es ser prudente y descartar su ingesta.\n\nLa Comunidad de Madrid tiene una entrada en su portal de comunicación en la que señala que \"las setas son un manjar que te puede salir muy caro. La mejor seta no vale una intoxicación\" y añade que \"en la Comunidad de Madrid existen setas muy tóxicas y mortales\". En esta entrada también ofrecen trucos para identificar qué setas silvestres no se deben recoger.\n\nPara profundizar y poder realizar esta actividad con mayor seguridad y conocimiento es recomendable realizar algún curso sobre setas, hongos o micología en general. La propia Comunidad de Madrid tiene una Red de Centros sobre educación ambiental que ofrece este tipo de formación, y también son muy recomendables las Jornadas Micológicas Sierra de Madrid, de la Central de Reservas de la Sierra de Guadarrama.\n\nY ya que sales a buscar setas, te recomendamos que aproveches el viaje y descubras algunos de los pueblos más bonitos de la Comunidad de Madrid porque puede que te pillen cerca.</doc><doc>\n10 Consejos Básicos para coger Setas en la Sierra Norte de Madrid\n\nCada vez más personas sienten la llamada de las setas. En otoño, la Sierra Norte de Madrid se convierte en un lugar ideal para la micología y cientos de personas que acuden en su búsqueda.\n\nSin duda, coger setas es una actividad muy sana, pues se está en contacto directo con la naturaleza, se camina y, además, es posible observar y valorar la gran variedad micológica existente en la sierra norte madrileña.\n\nSin embargo, para que la recogida de setas tenga un final feliz y se puedan degustar con total tranquilidad en casa, conviene tener en cuenta y seguir una serie de recomendaciones.\n\n\n\nEstos son los 10 consejos básicos para coger setas:\n\n1. Siempre hay que respetar el entorno natural\n\n2. </doc><doc>\nAl menos hasta ahora, cuando el frío comienza a hacer acto de presencia.\n\nCon el aviso de las primeras lluvias está claro que estamos en tiempo de setas. Un plan perfecto en una región como la madrileña con frondosos bosques y vaguadas ricas en este producto de temporada. Una recogida de setas que aúna la diversión de un paseo por el bosque con la experiencia gastronómica posterior.\n\nCaber apuntar que la Comunidad de Madrid tiene una entrada en su portal de comunicación en la que señala que \"las setas son un manjar que te puede salir muy caro. La mejor seta no vale una intoxicación\" y añade que \"en la Comunidad de Madrid existen setas muy tóxicas y mortales\". En esta entrada también ofrecen trucos para identificar qué setas silvestres no se deben recoger.\n\nPara profundizar y poder realizar esta actividad con mayor seguridad y conocimiento es recomendable realizar algún curso sobre setas, hongos o micología en general. La propia Comunidad de Madrid tiene una Red de Centros sobre educación ambiental que ofrece este tipo de formación, y también son muy recomendables las Jornadas Micológicas Sierra de Madrid, de la Central de Reservas de la Sierra de Guadarrama.\nPueblos y valles en los que recoger setas en Madrid\n\nAlameda del Valle\n\nEsta localidad es una de las más famosas dentro de la Comunidad de Madrid para buscar setas en los bosques cercanos, y donde podemos recoger setas como boletus, seta de cardo o perrechico. Hay que tener cuidado, ya que también podemos encontrar otras especies tóxicas que nos pueden confundir, por lo que debemos estar seguros de que la setas que estamos recolectando son comestibles.\n\nAlameda del Valle es un pequeño pueblo en el que viven unos 200 vecinos, situado en la Sierra Norte de Madrid. Se encuentra en un atractivo entorno natural, el Valle Alto del Lozoya, entre la Sierra de Guadarrama y los Altos de Hontanar, muy próximo al Puerto de Malagosto.\n\n</doc><doc>\nY es que estos parajes son fuente de vida y de belleza.\nAlgunas de las mejores rutas cerca de Madrid para buscar setas\n\nNo cabe duda de que la situación geográfica de la Comunidad de Madrid es privilegiada. Al estar situada en el centro pininsular tiene a su alrededor una gran variedad de zonas seteras. Algunas, de las mejores que podemos encontrar en la Península.\n\nSi quieres salir al monte a buscar una cesta de níscalos o boletus o simplemente a dar un paseo por el monte y oxigenarte te proponemos estas otras rutas para buscar setas Madrid.\n\nSetas en Alameda del valle.\n\nEste pequeño rincón de Madrid en el que viven alrededor de 200 vecinos, está situado al norte de la Comunidad, en la zona del Valle del Alto Lozoya. Es una de las mejores zonas para encontrar en primavera perrechico y también en otoño setas de cardo y boletus, aunque hay que ir alerta con otras especies incluso venenosas.\nSetas en Puerto de Canencia\n\nMás al sur de la Sierra de Guadarrama se encuentra este enclave setero donde podremos encontrar níscalos, boletus, setas de cardo y algunas otras setas comestibles. En esta maravilla natural abundan bosques y arroyos y alguna espectacular cascada como la Chorrera de Mojonavalle.\nSetas en el Valle del Paular\n\nOtro de los destinos preferidos de los madrileños para subir a buscar setas y hongos. Está situado en plena Sierra Guadarrama desde el Puerto de Cotos hasta el Monasterio del Paular. Pinares y bosques en perfecrto estado de conservación donde coger níscalos y champiñones silvestres entre otras especies.\n\nSetas en Puerto de Cotos\n\nConocido también como Puerto del Paular, estamos ante otro de los enclaves más apreciados por los aficionados a buscar setas en Madrid. Situado en la frontera entre Segovia y Madrid, en la Sierra de Guadarrama. Entre sus pinares abundan los robellones.\nSetas en Puerto de los Leones\n\nSituado muy cerca de Collado del Hornillo. El Valle de Pinares Llanos es una zona donde, en temporada, podremos encontrar níscalos y boletus. Situado entre la Sierra de Guadarrama y la Sierra de Malagón, cerca de Peguerinos, ya provincia de Ávila.\n\nEsta zona boscosa es conocida por la gran cantidad de setas que puedes encontrar, por lo que es una buena opción para salir a buscar setas en Madrid.\nSetas en Alto de Navahonda\n\nOtra preciosa zona llena de bellos rincones y muy valorada por los aficionados seteros. Abundan los champiñones silvestres y las setas de cardo, entre otras muchas especies de setas\nSetas en Monte Abantos\n\nPertenece a Guadarrama, en el término de San Lorenzo del Escorial. En otoño está en esplendor y son abundantes las setas, por lo que es muy visitado por los aficionados a la micologia. </doc><doc>\nEscaparse de Madrid para buscar setas\nBuscar setas en Madrid, la mejor opción\n\nHuir del ruido y de la vorágine de la gran ciudad, siempre apetece, y si es para buscar setas este 2023 en el monte aún más. Pero, a veces, no disponemos del tiempo ni el dinero que necesitamos para salir corriendo, por eso, os proponemos una rápida escapada, a tan sólo a unos kilómetros de Madrid.\n\nAunque no te lo creas, muy cerca de ti, hay parajes que esconden tesoros naturales. Grandes floradas de setas, que te están esperando, para que del campo lleguen hasta tu mesa y pasar un buen día, que te alejará del estrés.\n\nBuscar setas en Madrid, en la Sierra de Guadarrama\n\nA Madrid la rodea la Sierra de Guadarrama y ésta tiene un rey indiscutible en otoño, Boletus edulis, y un príncipe, el Boletus pinophilus. Ambos muy parecidos, con forma de tapón de champán y sus sombrerillos de color marrón, aunque, el pinophilus es más rojizo. </doc>",
            "response": "Para una experiencia de búsqueda de setas segura y exitosa en la Sierra de Madrid, es importante considerar varias recomendaciones y consejos basados en fuentes confiables. Aquí te ofrezco una guía detallada basada en información de diversas fuentes:\n\n    Respeto al entorno: Antes de comenzar a buscar, asegúrate de conocer y respetar las reglas del bosque. Evita quitar hojas nistradas, rociar agua innecesaria y no tocar las plantas con demasiada fuerza​.\n\n    Identificación de setas: Aprende a identificar las diferentes setas comestibles en la zona donde planeas buscar. Puedes hacerlo mediante recursos en línea, como libros o sitios web especializados, o bien, asistiendo a cursos de micología o botánica​.\n\n    Busca en áreas frescas y bien ventiladas: Las setas pueden desarrollarse en condiciones específicas, por lo que es importante buscar en lugares donde las hojas estén secas y las setas estén frescas. Además, busca áreas bien ventiladas para evitar la exposición a la humedad​.\n\n    Escoge el momento adecuado: Las setas pueden estar maduras en diferentes momentos, dependiendo de la zona y la época del año. Por ejemplo, en la Sierra de Madrid, las setas de cardo (Boletus cardus) pueden estar maduras en octubre​.\n\n    Planifica tu ruta: Decide en qué dirección te gustaría comenzar y cómo llegarás a esa dirección. Considera la distancia y el tiempo que tomará tu camino y asegúrate de tener suficiente combustible y agua​.\n\n    Descansa y relájate: La búsqueda de setas puede ser agotadora, así que asegúrate de tomar descansos regulares y disfrutar del paisaje natural que te rodea. La relajación y la concentración son clave para una buena recolección​.\n\n    Conserva tus setas: Si decides llevar tus setas de vuelta a casa, asegúrate de hacerlo de manera segura y apropiada. No coloques las setas en bolsas de plástico, ya que esto puede dañarlas. En su lugar, lleva tus setas en una bolsa de malla o una caja de cartón cerrada herméticamente​.\n\n    Busca en parques y senderos: Los parques y senderos son lugares comunes donde se encuentran las setas. Además, muchos de estos lugares tienen instalaciones para la recolección de setas, como mesas y contenedores limpios y secos​.\n\n    Evita la recolección en áreas expuestas a contaminación: Asegúrate de evitar las áreas donde la recolección podría afectar negativamente el medio ambiente o la fauna. Esto incluye áreas con alto tráfico humano, como calles y zonas industriales​.\n\n    Recuerda que la búsqueda de setas puede ser una actividad segura si se hace correctamente. Sin embargo, siempre es importante ser consciente de tus alrededores y respetar las reglas del bosque.",
            "reference": "Si estás interesado en buscar setas en la Sierra de Madrid, aquí tienes algunas recomendaciones basadas en diversas fuentes:\n\n    Respeto al Entorno Natural: Es esencial mantener el respeto por el entorno natural durante la recolección de setas. Esto implica no dañar la flora y fauna circundante y dejar el lugar tal como se encontró​.\n\nPreparación y Seguridad: Lleva siempre un teléfono móvil con la batería cargada en caso de emergencias. También es muy recomendable ir acompañado de un experto en micología, especialmente si no estás familiarizado con las diferentes especies de setas​​.\n\nIdentificación de las Setas: Solo debes recolectar las setas que conozcas y asegurarte de que son comestibles. Es importante recolectarlas con mesura y limitar la cantidad. En caso de duda, es mejor consultar a un experto​.\n\nTécnicas de Recolección: Los expertos sugieren recolectar las setas enteras, incluyendo la base del pie, pero con cuidado de no dañar el micelio. Deja atrás las setas viejas, en mal estado, o aquellas que se encuentren en sitios contaminados​.\n\nAlmacenamiento Adecuado: Usa cestas de mimbre o recipientes que permitan la dispersión de esporas y eviten el apelmazamiento o fermentación de las setas. Evita el uso de bolsas de plástico. Una vez recolectadas, se recomienda consumirlas pronto, ya que son perecederas​​.\n\nEvitar Falsas Creencias: No te fíes de reglas caseras o trucos para determinar si una seta es comestible. Estos métodos no son confiables y pueden ser peligrosos​.\n\nEn cuanto a lugares recomendados, puedes considerar la zona de Alameda del Valle​​, así como el área que va desde el Monasterio del Paular hasta el Puerto de Cotos, donde encontrarás numerosos pinares y bosques ricos en níscalos​.\n\nRecuerda que la recolección de setas debe hacerse de manera responsable y siempre priorizando la seguridad y el conocimiento sobre las diferentes especies."
        },
        {
            "user_input": "hola, vivo en madrid y me apetece recoger setas, a lo mejor por la sierra o por ahí. q puedo hacer?",
            "retrieved_contexts": "<doc>\nEl primer consejo que se puede ofrecer ante esta cuestión es que si no tienes la certeza absoluta de que sea comestible, lo mejor es ser prudente y descartar su ingesta.\n\nLa Comunidad de Madrid tiene una entrada en su portal de comunicación en la que señala que \"las setas son un manjar que te puede salir muy caro. La mejor seta no vale una intoxicación\" y añade que \"en la Comunidad de Madrid existen setas muy tóxicas y mortales\". En esta entrada también ofrecen trucos para identificar qué setas silvestres no se deben recoger.\n\nPara profundizar y poder realizar esta actividad con mayor seguridad y conocimiento es recomendable realizar algún curso sobre setas, hongos o micología en general. La propia Comunidad de Madrid tiene una Red de Centros sobre educación ambiental que ofrece este tipo de formación, y también son muy recomendables las Jornadas Micológicas Sierra de Madrid, de la Central de Reservas de la Sierra de Guadarrama.\n\nY ya que sales a buscar setas, te recomendamos que aproveches el viaje y descubras algunos de los pueblos más bonitos de la Comunidad de Madrid porque puede que te pillen cerca.</doc><doc>\nAl menos hasta ahora, cuando el frío comienza a hacer acto de presencia.\n\nCon el aviso de las primeras lluvias está claro que estamos en tiempo de setas. Un plan perfecto en una región como la madrileña con frondosos bosques y vaguadas ricas en este producto de temporada. Una recogida de setas que aúna la diversión de un paseo por el bosque con la experiencia gastronómica posterior.\n\nCaber apuntar que la Comunidad de Madrid tiene una entrada en su portal de comunicación en la que señala que \"las setas son un manjar que te puede salir muy caro. La mejor seta no vale una intoxicación\" y añade que \"en la Comunidad de Madrid existen setas muy tóxicas y mortales\". En esta entrada también ofrecen trucos para identificar qué setas silvestres no se deben recoger.\n\nPara profundizar y poder realizar esta actividad con mayor seguridad y conocimiento es recomendable realizar algún curso sobre setas, hongos o micología en general. La propia Comunidad de Madrid tiene una Red de Centros sobre educación ambiental que ofrece este tipo de formación, y también son muy recomendables las Jornadas Micológicas Sierra de Madrid, de la Central de Reservas de la Sierra de Guadarrama.\nPueblos y valles en los que recoger setas en Madrid\n\nAlameda del Valle\n\nEsta localidad es una de las más famosas dentro de la Comunidad de Madrid para buscar setas en los bosques cercanos, y donde podemos recoger setas como boletus, seta de cardo o perrechico. Hay que tener cuidado, ya que también podemos encontrar otras especies tóxicas que nos pueden confundir, por lo que debemos estar seguros de que la setas que estamos recolectando son comestibles.\n\nAlameda del Valle es un pequeño pueblo en el que viven unos 200 vecinos, situado en la Sierra Norte de Madrid. Se encuentra en un atractivo entorno natural, el Valle Alto del Lozoya, entre la Sierra de Guadarrama y los Altos de Hontanar, muy próximo al Puerto de Malagosto.\n\n</doc><doc>\nY es que estos parajes son fuente de vida y de belleza.\nAlgunas de las mejores rutas cerca de Madrid para buscar setas\n\nNo cabe duda de que la situación geográfica de la Comunidad de Madrid es privilegiada. Al estar situada en el centro pininsular tiene a su alrededor una gran variedad de zonas seteras. Algunas, de las mejores que podemos encontrar en la Península.\n\nSi quieres salir al monte a buscar una cesta de níscalos o boletus o simplemente a dar un paseo por el monte y oxigenarte te proponemos estas otras rutas para buscar setas Madrid.\n\nSetas en Alameda del valle.\n\nEste pequeño rincón de Madrid en el que viven alrededor de 200 vecinos, está situado al norte de la Comunidad, en la zona del Valle del Alto Lozoya. Es una de las mejores zonas para encontrar en primavera perrechico y también en otoño setas de cardo y boletus, aunque hay que ir alerta con otras especies incluso venenosas.\nSetas en Puerto de Canencia\n\nMás al sur de la Sierra de Guadarrama se encuentra este enclave setero donde podremos encontrar níscalos, boletus, setas de cardo y algunas otras setas comestibles. En esta maravilla natural abundan bosques y arroyos y alguna espectacular cascada como la Chorrera de Mojonavalle.\nSetas en el Valle del Paular\n\nOtro de los destinos preferidos de los madrileños para subir a buscar setas y hongos. Está situado en plena Sierra Guadarrama desde el Puerto de Cotos hasta el Monasterio del Paular. Pinares y bosques en perfecrto estado de conservación donde coger níscalos y champiñones silvestres entre otras especies.\n\nSetas en Puerto de Cotos\n\nConocido también como Puerto del Paular, estamos ante otro de los enclaves más apreciados por los aficionados a buscar setas en Madrid. Situado en la frontera entre Segovia y Madrid, en la Sierra de Guadarrama. Entre sus pinares abundan los robellones.\nSetas en Puerto de los Leones\n\nSituado muy cerca de Collado del Hornillo. El Valle de Pinares Llanos es una zona donde, en temporada, podremos encontrar níscalos y boletus. Situado entre la Sierra de Guadarrama y la Sierra de Malagón, cerca de Peguerinos, ya provincia de Ávila.\n\nEsta zona boscosa es conocida por la gran cantidad de setas que puedes encontrar, por lo que es una buena opción para salir a buscar setas en Madrid.\nSetas en Alto de Navahonda\n\nOtra preciosa zona llena de bellos rincones y muy valorada por los aficionados seteros. Abundan los champiñones silvestres y las setas de cardo, entre otras muchas especies de setas\nSetas en Monte Abantos\n\nPertenece a Guadarrama, en el término de San Lorenzo del Escorial. En otoño está en esplendor y son abundantes las setas, por lo que es muy visitado por los aficionados a la micologia. </doc><doc>\n10 Consejos Básicos para coger Setas en la Sierra Norte de Madrid\n\nCada vez más personas sienten la llamada de las setas. En otoño, la Sierra Norte de Madrid se convierte en un lugar ideal para la micología y cientos de personas que acuden en su búsqueda.\n\nSin duda, coger setas es una actividad muy sana, pues se está en contacto directo con la naturaleza, se camina y, además, es posible observar y valorar la gran variedad micológica existente en la sierra norte madrileña.\n\nSin embargo, para que la recogida de setas tenga un final feliz y se puedan degustar con total tranquilidad en casa, conviene tener en cuenta y seguir una serie de recomendaciones.\n\n\n\nEstos son los 10 consejos básicos para coger setas:\n\n1. Siempre hay que respetar el entorno natural\n\n2. </doc><doc>\nAlgunas de las especies que se pueden encontrar son boletus, senderuelas, setas de cardo o setas pie azul.\n\nSin duda, salir a buscar setas en Madrid es una de las mejores terapias que podemos hacer. Ideal para desintoxicarnos del ajetreo de una gran cuidad, y además lo tenemos a un paso, ya no nos quedan excusas.\n\n</doc>",
            "response": "Para recoger setas en la Sierra Norte de Madrid, es importante tener en cuenta varios consejos y recomendaciones para garantizar una experiencia segura y satisfactoria. Aquí te ofrezco una guía basada en información obtenida de diversas fuentes:\n\n    Respetar el Entorno Natural: Antes de comenzar a buscar setas, es fundamental recordar que debemos respetar el entorno natural. Esto significa evitar arrancar plantas, rocas o animales sin permiso, así como dejar el área en mejor estado que lo encontramos.\n\n    Buscar Setas en Temporada: Las mejores condiciones para recoger setas en la Sierra Norte de Madrid son en primavera y otoño, cuando las setas están en pleno desarrollo y son más fáciles de encontrar.\n\n    Identificación de las Setas: Aunque es atractivo buscar las setas más bellas y comestibles, es crucial recordar que no todas las setas son seguras o comestibles. Es recomendable consultar fuentes confiables de información y seguir las instrucciones de los expertos en micología antes de recoger una seta.\n\n    Curso de Micología: Para obtener una mejor comprensión de las setas y mejorar tus habilidades de recogida, considera tomar un curso de micología. La Comunidad de Madrid ofrece varias opciones en su red de centros educativos ambientales, como la Red de Centros sobre Educación Ambiental y las Jornadas Micológicas Sierra de Madrid.\n\n    Rutas y Destinos Preferidos: Algunas de las zonas seteras más populares en la Sierra Norte de Madrid incluyen Alameda del Valle, Puerto de Canaria, Valle del Paular, y Alto de Navahonda. Estas áreas ofrecen una variedad de setas y paisajes hermosos.\n\n    Recuerde, aunque la micología es una actividad segura en la mayoría de los casos, siempre es importante actuar con precaución y respetar las leyes y regulaciones en materia de setas y naturaleza.",
            "reference": "Si estás interesado en buscar setas en la Sierra de Madrid, aquí tienes algunas recomendaciones basadas en diversas fuentes:\n\n    Respeto al Entorno Natural: Es esencial mantener el respeto por el entorno natural durante la recolección de setas. Esto implica no dañar la flora y fauna circundante y dejar el lugar tal como se encontró​.\n\nPreparación y Seguridad: Lleva siempre un teléfono móvil con la batería cargada en caso de emergencias. También es muy recomendable ir acompañado de un experto en micología, especialmente si no estás familiarizado con las diferentes especies de setas​​.\n\nIdentificación de las Setas: Solo debes recolectar las setas que conozcas y asegurarte de que son comestibles. Es importante recolectarlas con mesura y limitar la cantidad. En caso de duda, es mejor consultar a un experto​.\n\nTécnicas de Recolección: Los expertos sugieren recolectar las setas enteras, incluyendo la base del pie, pero con cuidado de no dañar el micelio. Deja atrás las setas viejas, en mal estado, o aquellas que se encuentren en sitios contaminados​.\n\nAlmacenamiento Adecuado: Usa cestas de mimbre o recipientes que permitan la dispersión de esporas y eviten el apelmazamiento o fermentación de las setas. Evita el uso de bolsas de plástico. Una vez recolectadas, se recomienda consumirlas pronto, ya que son perecederas​​.\n\nEvitar Falsas Creencias: No te fíes de reglas caseras o trucos para determinar si una seta es comestible. Estos métodos no son confiables y pueden ser peligrosos​.\n\nEn cuanto a lugares recomendados, puedes considerar la zona de Alameda del Valle​​, así como el área que va desde el Monasterio del Paular hasta el Puerto de Cotos, donde encontrarás numerosos pinares y bosques ricos en níscalos​.\n\nRecuerda que la recolección de setas debe hacerse de manera responsable y siempre priorizando la seguridad y el conocimiento sobre las diferentes especies."
        },
        {
            "user_input": "¿Qué sería recomendable si alguien quiere ir a coger setas en el norte de Madrid?",
            "retrieved_contexts": "<doc>\n10 Consejos Básicos para coger Setas en la Sierra Norte de Madrid\n\nCada vez más personas sienten la llamada de las setas. En otoño, la Sierra Norte de Madrid se convierte en un lugar ideal para la micología y cientos de personas que acuden en su búsqueda.\n\nSin duda, coger setas es una actividad muy sana, pues se está en contacto directo con la naturaleza, se camina y, además, es posible observar y valorar la gran variedad micológica existente en la sierra norte madrileña.\n\nSin embargo, para que la recogida de setas tenga un final feliz y se puedan degustar con total tranquilidad en casa, conviene tener en cuenta y seguir una serie de recomendaciones.\n\n\n\nEstos son los 10 consejos básicos para coger setas:\n\n1. Siempre hay que respetar el entorno natural\n\n2. </doc><doc>\nEl primer consejo que se puede ofrecer ante esta cuestión es que si no tienes la certeza absoluta de que sea comestible, lo mejor es ser prudente y descartar su ingesta.\n\nLa Comunidad de Madrid tiene una entrada en su portal de comunicación en la que señala que \"las setas son un manjar que te puede salir muy caro. La mejor seta no vale una intoxicación\" y añade que \"en la Comunidad de Madrid existen setas muy tóxicas y mortales\". En esta entrada también ofrecen trucos para identificar qué setas silvestres no se deben recoger.\n\nPara profundizar y poder realizar esta actividad con mayor seguridad y conocimiento es recomendable realizar algún curso sobre setas, hongos o micología en general. La propia Comunidad de Madrid tiene una Red de Centros sobre educación ambiental que ofrece este tipo de formación, y también son muy recomendables las Jornadas Micológicas Sierra de Madrid, de la Central de Reservas de la Sierra de Guadarrama.\n\nY ya que sales a buscar setas, te recomendamos que aproveches el viaje y descubras algunos de los pueblos más bonitos de la Comunidad de Madrid porque puede que te pillen cerca.</doc><doc>\nAl menos hasta ahora, cuando el frío comienza a hacer acto de presencia.\n\nCon el aviso de las primeras lluvias está claro que estamos en tiempo de setas. Un plan perfecto en una región como la madrileña con frondosos bosques y vaguadas ricas en este producto de temporada. Una recogida de setas que aúna la diversión de un paseo por el bosque con la experiencia gastronómica posterior.\n\nCaber apuntar que la Comunidad de Madrid tiene una entrada en su portal de comunicación en la que señala que \"las setas son un manjar que te puede salir muy caro. La mejor seta no vale una intoxicación\" y añade que \"en la Comunidad de Madrid existen setas muy tóxicas y mortales\". En esta entrada también ofrecen trucos para identificar qué setas silvestres no se deben recoger.\n\nPara profundizar y poder realizar esta actividad con mayor seguridad y conocimiento es recomendable realizar algún curso sobre setas, hongos o micología en general. La propia Comunidad de Madrid tiene una Red de Centros sobre educación ambiental que ofrece este tipo de formación, y también son muy recomendables las Jornadas Micológicas Sierra de Madrid, de la Central de Reservas de la Sierra de Guadarrama.\nPueblos y valles en los que recoger setas en Madrid\n\nAlameda del Valle\n\nEsta localidad es una de las más famosas dentro de la Comunidad de Madrid para buscar setas en los bosques cercanos, y donde podemos recoger setas como boletus, seta de cardo o perrechico. Hay que tener cuidado, ya que también podemos encontrar otras especies tóxicas que nos pueden confundir, por lo que debemos estar seguros de que la setas que estamos recolectando son comestibles.\n\nAlameda del Valle es un pequeño pueblo en el que viven unos 200 vecinos, situado en la Sierra Norte de Madrid. Se encuentra en un atractivo entorno natural, el Valle Alto del Lozoya, entre la Sierra de Guadarrama y los Altos de Hontanar, muy próximo al Puerto de Malagosto.\n\n</doc><doc>\nY aunque está permitida siempre que sea de forma recreativa, es importante consultar los permisos y acotaciones de las diferentes zonas.\n\n    Puerto de Cotos\n    Alameda del Valle\n    Puerto de la Fuenfría\n    Puerto de Canencia\n    Monte Abantos\n    Valle de Lozoya\n    Valle del Paular\n    Puerto de los Leones\n\nRecomendaciones generales\n\n    Entre los aficionados a recoger setas en Madrid hay una serie de recomendaciones que casi son tomadas como dogmas o como obligaciones en la recolección:\n    Las setas se recogen en cestas y nunca en bolsas de plástico. De esta forma están ventiladas y sus esporas se reparten por el monte\n    No hay que ser avaricioso: la cantidad recolectada no debe exceder un número de setas que no sea razonable. </doc><doc>\nEmail: epidemiologia.vigilancia@salud.madrid.org \n\n    Durante las tardes, noches, sábados, domingos y festivos:  el Sistema de Alerta Rápida en Salud Pública (SARSP): llamando al 061.\n\n061 En Salud Pública respondemos\nDisfruta de las setas con seguridad\nLas setas son un manjar que te puede salir muy caro. La mejor seta no vale una intoxicación\n\nRecoger y comer setas silvestres es una actividad sana, divertida y en auge, pero todos los años tenemos que lamentar cientos de intoxicaciones e incluso algunas muertes debido al consumo de setas tóxicas.  En la Comunidad de Madrid existen setas muy tóxicas y mortales. En este vídeo de la Escuela de Salud puede aclarar sus dudas sobre este tema y poder evitar daños innecesarios.\nDisfruta de las setas con seguridad\nConsejos para recolectar setas silvestres\nRecogida\nTransporte\nComportamiento\nIdentificación\nAntes de consumirlas\nConsumo\nConservación\n\n    No recolectar ni aceptar setas que no conozcamos, con las que no estemos familiarizados, sin seguridad de que son comestibles. En caso de duda, consultar a un experto.\n    En el campo cortar por la base con un cuchillo o navaja las especies de setas comestibles.\n    No recolectar ejemplares jóvenes, pues se evita la multiplicación de la especie, su sabor y aroma es menor y es más fácil confundir con especies tóxicas.\n    No recolectar ejemplares muy maduros porque pueden estar alterados, parasitados y resultar indigestos.\n    No recolectar setas después de abundantes lluvias o heladas, habrán perdido parte de su sabor y aroma, tendrán un exceso de agua y su aspecto dificultará su identificación.\n    No recolectar setas en lugares contaminados: cerca de carreteras, áreas industriales, vertederos, cultivos, etc., los hongos absorben las sustancias nocivas y los metales pesados.\n    Estar atentos: pueden crecer setas tóxicas en los mismos lugares en los que hemos recolectado setas comestibles otros años, incluso mezcladas.\n\n    Transportarlas en cestas de mimbre u otros recipientes con agujeros, nunca en bolsas de plástico (se golpean y rompen, se calientan, se acelera su descomposición y se esparce más la suciedad), con la parte superior del sombrero hacia arriba, como se encuentran en el campo.\n    Antes de meterla en la cesta, limpiar bien con un cepillo, paño húmedo o el borde de la navaja los restos de arena, suciedad y vegetales adheridos en el sombrero y el pie. Toda la suciedad que entre en la cesta se va a esparcir por el resto de ejemplares.\n\n    No dejar huella de nuestro paso por el monte: no usar rastrillos u otros objetos para remover el suelo.\n    No destruir las setas venenosa o desconocidas, todas tienen su misión en el mantenimiento del ecosistema.\n\n    No identificar las setas siguiendo falsas creencias populares o por medio de personas inexpertas.\n    No identificar las setas mediante fotografías o dibujos de libros.\n\n    No identificar las setas únicamente por medio de aplicaciones informáticas (app) inteligentes, debido a que no se puede garantizar la ausencia de errores, con el gran riesgo que esto supone. La identificación debe ser verificada por personas con experiencia.​\n\n    Si hay dudas en la identificación, consultar a un experto o a una asociación micológica. En este caso, sacarla entera (no cortarla) metiendo la navaja en el suelo paralela al pie y haciendo palanca. Todas las partes de la seta tienen información para su correcta identificación. Se puede envolver en papel de aluminio y debe mantenerse separada del resto hasta el momento de llevársela a un experto.\n\n    Revisar una a una nuevamente en casa, asegurándose de que todas son comestibles.\n    </doc>",
            "response": "Para disfrutar de las setas en el norte de Madrid, es fundamental tener en cuenta ciertos consejos y prácticas para garantizar la seguridad y la calidad de la experiencia. Aquí te ofrezco una guía basada en información obtenida de diversas fuentes:\n\n    Respeto al entorno: Asegúrate de recoger setas en un lugar adecuado y respetar las especies y su entorno. Evita recoger setas en lugares contaminados o cerca de áreas industriales o urbanizadas​.\n\nIdentificación y precaución: Antes de recoger setas, es crucial conocer su identidad y cuáles son las que son seguras para consumir. No recojas setas que no conozcas, sean comestibles ni parezcan saludables. Siempre es recomendable consultar a un experto o una asociación micológica antes de recoger setas en un lugar desconocido​.\n\nTransporte seguro: No uses bolsas de plástico para transportar setas, ya que pueden ser perjudiciales para las especies y contener sustancias nocivas. Utiliza cestas de mimbre o recipientes con agujeros para permitir la respiración de las setas y evitar la propagación de hongos patóxicos​.\n\nRecolección responsable: No recojas setas que no conozcas, ya que esto puede exponerte a sustancias tóxicas o peligrosas para la salud. Además, trata de recolectar en cantidades razonables y no demasiadas a la vez, para evitar el exceso de agua y la posibilidad de que las setas se deterioren​.\n\nConservación adecuada: Después de recoger las setas, asegúrate de conservarlas correctamente. Mantén las setas en cestas o recipientes con agujeros para permitir la respiración y evita el uso de plásticos, que pueden ser perjudiciales. También es importante no exponer las setas a temperaturas extremadamente altas o bajas, ya que esto puede afectar su calidad​.\n\nRecuerda siempre consultar con profesionales o organizaciones especializadas en setas y hongos para obtener asesoramiento específico y evitar la exposición a sustancias peligrosas.",
            "reference": "Si estás interesado en buscar setas en la Sierra de Madrid, aquí tienes algunas recomendaciones basadas en diversas fuentes:\n\n    Respeto al Entorno Natural: Es esencial mantener el respeto por el entorno natural durante la recolección de setas. Esto implica no dañar la flora y fauna circundante y dejar el lugar tal como se encontró​.\n\nPreparación y Seguridad: Lleva siempre un teléfono móvil con la batería cargada en caso de emergencias. También es muy recomendable ir acompañado de un experto en micología, especialmente si no estás familiarizado con las diferentes especies de setas​​.\n\nIdentificación de las Setas: Solo debes recolectar las setas que conozcas y asegurarte de que son comestibles. Es importante recolectarlas con mesura y limitar la cantidad. En caso de duda, es mejor consultar a un experto​.\n\nTécnicas de Recolección: Los expertos sugieren recolectar las setas enteras, incluyendo la base del pie, pero con cuidado de no dañar el micelio. Deja atrás las setas viejas, en mal estado, o aquellas que se encuentren en sitios contaminados​.\n\nAlmacenamiento Adecuado: Usa cestas de mimbre o recipientes que permitan la dispersión de esporas y eviten el apelmazamiento o fermentación de las setas. Evita el uso de bolsas de plástico. Una vez recolectadas, se recomienda consumirlas pronto, ya que son perecederas​​.\n\nEvitar Falsas Creencias: No te fíes de reglas caseras o trucos para determinar si una seta es comestible. Estos métodos no son confiables y pueden ser peligrosos​.\n\nEn cuanto a lugares recomendados, puedes considerar la zona de Alameda del Valle​​, así como el área que va desde el Monasterio del Paular hasta el Puerto de Cotos, donde encontrarás numerosos pinares y bosques ricos en níscalos​.\n\nRecuerda que la recolección de setas debe hacerse de manera responsable y siempre priorizando la seguridad y el conocimiento sobre las diferentes especies."
        },
        {
            "user_input": "qué comidas puedo probar en mi viaje a Japón?",
            "retrieved_contexts": "<doc>\n3. Sashimi | 刺身\nOtro de los platos típicos de Japón que con total seguridad debes probar si visitas este país es el Sashimi. Se trata de finos cortes de pescado y marisco, acompañados por salsa de soja, jengibre y wasabi y servidos (normalmente) crudos. El objetivo del jengibre es tomarlo entre pieza y pieza de sashimi para limpiar el sabor de la boca y de este modo poder degustar mejor el sabor.\nPodríamos pensar que debido a la sencillez de preparación de este plato, no habrá ninguna diferencia entre probarlo en Japón o hacerlo en nuestro país de origen. </doc><doc>\n2. Onigiri | お握り\nSe trata de una deliciosa bola o triángulo de arroz con relleno en su interior, toppings en su exterior y un alga nori que sirve para agarrarlos. Tradicionalmente el Onigiri se solía rellenar de ciruela encurtida, salmón, kombu o atún. Pero, la flexibilidad que ofrece este plato japonés para experimentar con él hace que hoy en día se puedan encontrar un gran número de variantes y condimentos.\n\nSi viajas a Japón no puedes dejar pasar la oportunidad de probar un Onigiri, que además, es un excelente plato para comer de pie, mientras caminas o exploras la ciudad. Una cosa que debemos tener en cuenta con el Onigiri es que no se trata de una variedad de sushi puesto que la elaboración del arroz para este plato es diferente a la del sushi. Se trata únicamente de arroz sin más condimento que un poco de sal.\n</doc><doc>\n30 Platos típicos de Japón | Tienes que probarlos [Con Imágenes]\nCada vez son más las personas que deciden visitar «el país del Sol naciente» en sus vacaciones ¡Y no es de extrañar! Son muchos los motivos que hacen de este país uno de los destinos más interesantes del mundo: hay cientos de lugares que ver en Japón realmente fantásticos, es un país seguro, su gente es acogedora, la cultura japonesa es realmente fascinante y la gastronomía… ¡una auténtica maravilla! En este artículo precisamente queremos hablarte de ella a través de una selección de 20 platos típicos de Japón que tienes que probar. ¿Nos acompañas en este viaje gastronómico?\nGastronomía Japonesa | Breve introducción\nMuchas personas tienden a pensar que la gastronomía de Japón es Sushi, Ramen y poco más… ¡Nada más lejos de la realidad! Es cierto que estos platos son los más conocidos porque han conseguido implantarse en occidente a través de una gran multitud de restaurantes japoneses cuya oferta se limita a ellos. Pero podemos afirmar sin temor a equivocarnos que la gastronomía japonesa es una de las más ricas y variadas de todo el mundo.\n\nEn el pasado los platos típicos de Japón eran prácticamente una adaptación de la gastronomía china que tenía una gran influencia en el país. En cualquier caso, fue a partir de la Edad Media cuando la cocina japonesa comenzó a evolucionar, encontrar su propio camino y desarrollar la amplia variedad de platos y preparados que podemos encontrar hoy en día. No podemos olvidar que, especialmente en las ciudades japonesas, existe una gran tendencia a comer y cenar fuera de casa. </doc><doc>\nComida Japonesa – 35 platos tradicionales que comer en Japón\n¿Quieres saber más sobre la Comida y la Cocina Japonesas? Aquí tienes una lista de los 35 platos tradicionales que deberías comer cuando viajes a Japón.\n\nHe estado en Japón varias veces y, como puede que sepas por otros artículos, me encanta, y la comida japonesa es muy sabrosa. Ciertamente, no me gusta todo, pero es muy interesante porque la cultura gastronómica japonesa es muy diferente de la sueca.\nYakitori\n\nLas brochetas de pollo son un plato clásico en Japón. Se las conoce localmente como Yakitori y son deliciosas. Las brochetas se preparan a la parrilla sobre carbón y normalmente se sazonan con salsa tare o sal.\n\n¡Los Yakitori son, definitivamente, uno de mis platos favoritos cuando se trata de comida japonesa! </doc><doc>\nMuy sencillo, pero aun así delicioso.\n\nEdamame\n\nUn aperitivo popular en los Izakayas locales que normalmente se sirve junto con cerveza. El edamame es, en esencia, habas de soja verde preparados.\n\nUvas de Mar\n\nEste es uno de los alimentos japoneses más divertidos que se puede probar cuando se visita Okinawa. Realmente no son uvas, simplemente parecen uvas, pero en realidad es un tipo de alga especial que crece en Okinawa.\n\nYakisoba\n\nEl Yakisoba es un plato de noodles fritos que se prepara salteando o asando una combinación de noodles e ingredientes diversos. Es uno de mis platos japoneses favoritos y es todo un clásico.\n\nAunque este plato de noodles se llama Yakisoba, los noodles soba que se utilizan para este plato no contienen trigo sarraceno.\n\nShabu-shabu\n\nEs un plato servido en una olla caliente típica japonesa en el que te concinas tú mismo la comida en la mesa.\n\nNormalmente, hay muchos tipos distintos de marisco y de carne, así como trozos de tofu y verduras. Entonces tomas lo que quieras con los palillos, lo pones en la olla caliente y lo cocinas.\n\nEl Shabu Shabu es una gran experiencia gastronómica de Japón que tampoco deberías perderte. Si tienes la oportunidad de ir a un restaurante con un local, no la desaproveches, ya que probablemente tendrás una experiencia más gratificante si alguien te muestra cómo se hace de la forma tradicional.\n\nGyudon\n\nEl Gyudon es un plato japonés popular que consiste en un bol de arroz con ternera que se condimenta con varias especias. Sukiya es una cadena de restaurantes que se ha hecho famosa por sus Gyudon y tampoco es caro.\n\n</doc>",
            "response": "Japón es un país con una rica y diversa gastronomía, conocida por su innovación culinaria y su capacidad para combinar elementos de diversas culturas. Aquí te presento algunas de las comidas más populares y típicas de Japón:\n\n1. Sashimi: Este plato es uno de los más emblemáticos de la cocina japonesa. Se trata de finos cortes de pescado y marisco, acompañados por salsa de soja, jengibre y wasabi, y servidos crudos. El objetivo es aprovechar al máximo el sabor natural del pescado, sin exagerar con los condimentos.\n\n2. Onigiri: Un onigiri es una bola o triángulo de arroz relleno con toppings en su exterior y un alga nori que sirve para agarrarlo. Tradicionalmente se rellena de ciruela encurtida, salmón, kombu o atún, pero hoy en día se pueden encontrar una gran variedad de variantes y condimentos.\n\n3. Yakitori: Las brochetas de pollo son un plato clásico en Japón. Se las conoce localmente como Yakitori y son deliciosas. Las brochetas se preparan a la parrilla sobre carbón y normalmente se sazonan con salsa tare o sal.\n\n4. Edamame: Un aperitivo popular en los Izakayas locales que normalmente se sirve junto con cerveza. El edamame es, en esencia, habas de soja verde preparados.\n\n5. Uvas de Mar: Este es uno de los alimentos japoneses más divertidos que se puede probar cuando se visita Okinawa. Realmente no son uvas, simplemente parecen uvas, pero en realidad es un tipo de alga especial que crece en Okinawa.\n\n6. Yakisoba: El Yakisoba es un plato de noodles fritos que se prepara salteando o asando una combinación de noodles e ingredientes diversos. Es uno de mis platos japoneses favoritos y es todo un clásico.\n\n7. Shabu-Shabu: El Shabu Shabu es una gran experiencia gastronómica de Japón que tampoco deberías perderte. Si tienes la oportunidad de ir a un restaurante con un local, no la desaprovechas, ya que probablemente tendrás una experiencia más gratificante si alguien te muestra cómo se hace de la forma tradicional.\n\n8. Gyudon: El Gyudon es un plato japonés popular que consiste en un bol de arroz con ternera que se condimenta con varias especias. Sukiya es una cadena de restaurantes que se ha hecho famosa por sus Gyudon y tampoco es caro.\n\nEstos platos representan solo algunos de los muchos que se pueden disfrutar en Japón. La gastronomía japonesa es una mezcla única de tradición y experimentación, y es algo que vale la pena experimentar durante una visita al país.",
            "reference": "Durante tu viaje a Japón, hay una gran variedad de platos tradicionales que puedes probar. Aquí tienes algunas recomendaciones basadas en artículos en español:\n\n    Sushi: Este es el plato más internacional de Japón. Se basa en arroz cocido y adobado con vinagre de arroz, vino de arroz, azúcar y sal. Aunque se asocia comúnmente con pescado y mariscos, también hay variedades que incluyen tortilla, verduras y otros ingredientes. Existen varios tipos de sushi, como Maki, Nigiri y Oshi​\n\nOnigiri: Son bolas o triángulos de arroz con un relleno en su interior y toppings en el exterior, generalmente envueltos en alga nori. Tradicionalmente se rellenan con ciruela encurtida, salmón, kombu o atún, aunque hay muchas variantes disponibles​\n\nSashimi: Consiste en finos cortes de pescado y marisco crudos, normalmente acompañados de salsa de soja, jengibre y wasabi. La calidad de la materia prima es clave en este plato, y en Japón se utiliza pescado muy fresco​\n\nYakisoba: Son tallarines fritos preparados con verduras, carne y fideos de trigo sarraceno. Aunque de origen chino, este plato se ha integrado completamente en la gastronomía japonesa y es común en festivales tradicionales y tiendas de conveniencia​\n\nRamen: De origen chino pero adaptado a la cocina japonesa, el ramen incluye un caldo a base de miso, carne, algas y salsa de soja, acompañado de fideos de trigo. Hay varias versiones regionales en Japón​\n\nSopa de Miso: Hecha con pasta de miso (soja) y un caldo dashi, generalmente de mariscos, carne o pescado. Se acompaña con alga wakame, puerro, cebolleta y tofu​\n\nYakitori: Son brochetas de pollo asadas a la parrilla y sazonadas con salsa tare o sal. Es un plato clásico en Japón, especialmente popular en Tokio​\n\nYakiniku: Se refiere a cualquier tipo de carne a la parrilla, comúnmente ternera. Es un plato disfrutado ampliamente en Japón​\n\nKare Raisu (Arroz al Curry): Aunque se asocia más con la India, el curry japonés, introducido por los británicos, tiene su propia variante y es muy popular en Japón​\n\nTakoyaki: Bolas rellenas de pulpo, un plato tradicional de Osaka y una de las comidas callejeras más populares de Japón​\n\nTempura: Gambas o verduras fritas conocidas como tempura, servidas comúnmente con arroz. Es un plato clásico en Japón​\n\nEstos platos ofrecen un amplio espectro de sabores y texturas que son esenciales en la gastronomía japonesa, brindándote una experiencia culinaria auténtica y diversa durante tu viaje."
        },
        {
            "user_input": "me sugieres algún plato para cuando vaya a Japón?",
            "retrieved_contexts": "<doc>\n3. Sashimi | 刺身\nOtro de los platos típicos de Japón que con total seguridad debes probar si visitas este país es el Sashimi. Se trata de finos cortes de pescado y marisco, acompañados por salsa de soja, jengibre y wasabi y servidos (normalmente) crudos. El objetivo del jengibre es tomarlo entre pieza y pieza de sashimi para limpiar el sabor de la boca y de este modo poder degustar mejor el sabor.\nPodríamos pensar que debido a la sencillez de preparación de este plato, no habrá ninguna diferencia entre probarlo en Japón o hacerlo en nuestro país de origen. </doc><doc>\nComida Japonesa – 35 platos tradicionales que comer en Japón\n¿Quieres saber más sobre la Comida y la Cocina Japonesas? Aquí tienes una lista de los 35 platos tradicionales que deberías comer cuando viajes a Japón.\n\nHe estado en Japón varias veces y, como puede que sepas por otros artículos, me encanta, y la comida japonesa es muy sabrosa. Ciertamente, no me gusta todo, pero es muy interesante porque la cultura gastronómica japonesa es muy diferente de la sueca.\nYakitori\n\nLas brochetas de pollo son un plato clásico en Japón. Se las conoce localmente como Yakitori y son deliciosas. Las brochetas se preparan a la parrilla sobre carbón y normalmente se sazonan con salsa tare o sal.\n\n¡Los Yakitori son, definitivamente, uno de mis platos favoritos cuando se trata de comida japonesa! </doc><doc>\n2. Onigiri | お握り\nSe trata de una deliciosa bola o triángulo de arroz con relleno en su interior, toppings en su exterior y un alga nori que sirve para agarrarlos. Tradicionalmente el Onigiri se solía rellenar de ciruela encurtida, salmón, kombu o atún. Pero, la flexibilidad que ofrece este plato japonés para experimentar con él hace que hoy en día se puedan encontrar un gran número de variantes y condimentos.\n\nSi viajas a Japón no puedes dejar pasar la oportunidad de probar un Onigiri, que además, es un excelente plato para comer de pie, mientras caminas o exploras la ciudad. Una cosa que debemos tener en cuenta con el Onigiri es que no se trata de una variedad de sushi puesto que la elaboración del arroz para este plato es diferente a la del sushi. Se trata únicamente de arroz sin más condimento que un poco de sal.\n</doc><doc>\n8. Bentō | 弁当\n¡Imagínate la caja de almuerzo que te llevabas a la escuela cuando eras un niño y trasladado al mundo japonés! ¿Qué tenemos? El famoso bentō. Seguramente que tu madre no te preparaba tanta variedad de pequeñas delicias para tu almuerzo en el recreo pero es que los japoneses se toman la alimentación con mucha seriedad.\n\nEste plato consiste en un pequeñas raciones de comida organizadas en una caja de madera (tradicionalmente) para llevar. Aunque este plato tan común en la comida japonesa tenía precisamente el objetivo de ser transportado (al colegio, al trabajo, a la universidad…), la verdad es que se ha popularizado de tal manera que puedes ir a un restaurante y comerte fácilmente un bentō sentado en una silla.\n\n¿De qué está compuesto el bentō? Normalmente tiene una sección con arroz, una fuente de proteínas que hace de plato principal (pescado, carne, tofu) y diferentes guarniciones de acompañamiento. Para finalizar este menú tan variado, no suele faltar en los bentōs más tradicionales, unas piezas de fruta como postre.\n\nSi viajas a Japón te sorprenderá encontrar que en muchas tiendas de ultramarinos, también conocidos como combinis, se venden multitud de cajas bentō con ingredientes de toda clase. Seguro que si pruebas uno te encontrarás con alguna delicia que no serás capaz de identificar. </doc><doc>\n28. Kakigori | かき氷\nY si visitas Japón durante el verano, el siguiente cuenta dentro de los platos típicos de Japón y es perfecto para ti; a todos nos pasa que en esos calurosos días de verano anhelamos algo fresco que contrarreste la oleada ardiente de la temporada, pues bien, en puestos callejeros, restaurante e incluso tiendas especializadas hallarás el Kakigori, un postre hecho a base de hielo triturado por cuchillas.\n\nEl kakigori es muy similar a los raspado (o granizados, dependiendo de cómo lo llamen en tu país), es un cúmulo de hielo aderezado con jarabes de diversos sabores y leche condensada, en ocasiones suele acompañarse de frutas. Lo que diferencia al kakigori del raspado común es su fina consistencia, además, en Japón este siempre se come con cuchara.\n</doc>",
            "response": "Japón es conocido por sus deliciosas opciones culinarias, y algunos platos típicos que debes probar incluyen:\n\nSashimi: Este plato se compone de finos cortes de pescado y marisco, acompañados de salsa de soja, jengibre y wasabi, y suelen servirse crudos. El objetivo es limpiar la boca con jengibre para que puedas disfrutar mejor del sabor.\n\nOnigiri: Un onigiri es una deliciosa bola de arroz con relleno, toppings y un alga nori para agarrarla. Se pueden experimentar con diferentes toppings y condimentos, y es un plato ideal para comer de pie.\n\nKakigori: Un kakigori es un postre hecho a base de hielo triturado con jarabes de diversos sabores y leche condensada. Es diferente al raspado común, ya que tiene una consistencia fina y se come con cuchara.\n\nYakitori: Las brochetas de pollo son un plato clásico en Japón, preparadas a la parrilla con carbón y sazonadas con salsa tare o sal.\n\nBentō: Un bentō es una pequeña caja de almuerzo hecha de arroz con diferentes toppings, como plato principal (pescado, carne, tofu) y guarniciones. Es un plato ideal para llevar y experimentar con diferentes ingredientes.\n\nEstos platos ofrecen una buena representación de la diversidad culinaria japonesa, y cada uno tiene su propia historia y preparación única. ¡Disfruta de tu visita a Japón!",
            "reference": "Durante tu viaje a Japón, hay una gran variedad de platos tradicionales que puedes probar. Aquí tienes algunas recomendaciones basadas en artículos en español:\n\n    Sushi: Este es el plato más internacional de Japón. Se basa en arroz cocido y adobado con vinagre de arroz, vino de arroz, azúcar y sal. Aunque se asocia comúnmente con pescado y mariscos, también hay variedades que incluyen tortilla, verduras y otros ingredientes. Existen varios tipos de sushi, como Maki, Nigiri y Oshi​\n\nOnigiri: Son bolas o triángulos de arroz con un relleno en su interior y toppings en el exterior, generalmente envueltos en alga nori. Tradicionalmente se rellenan con ciruela encurtida, salmón, kombu o atún, aunque hay muchas variantes disponibles​\n\nSashimi: Consiste en finos cortes de pescado y marisco crudos, normalmente acompañados de salsa de soja, jengibre y wasabi. La calidad de la materia prima es clave en este plato, y en Japón se utiliza pescado muy fresco​\n\nYakisoba: Son tallarines fritos preparados con verduras, carne y fideos de trigo sarraceno. Aunque de origen chino, este plato se ha integrado completamente en la gastronomía japonesa y es común en festivales tradicionales y tiendas de conveniencia​\n\nRamen: De origen chino pero adaptado a la cocina japonesa, el ramen incluye un caldo a base de miso, carne, algas y salsa de soja, acompañado de fideos de trigo. Hay varias versiones regionales en Japón​\n\nSopa de Miso: Hecha con pasta de miso (soja) y un caldo dashi, generalmente de mariscos, carne o pescado. Se acompaña con alga wakame, puerro, cebolleta y tofu​\n\nYakitori: Son brochetas de pollo asadas a la parrilla y sazonadas con salsa tare o sal. Es un plato clásico en Japón, especialmente popular en Tokio​\n\nYakiniku: Se refiere a cualquier tipo de carne a la parrilla, comúnmente ternera. Es un plato disfrutado ampliamente en Japón​\n\nKare Raisu (Arroz al Curry): Aunque se asocia más con la India, el curry japonés, introducido por los británicos, tiene su propia variante y es muy popular en Japón​\n\nTakoyaki: Bolas rellenas de pulpo, un plato tradicional de Osaka y una de las comidas callejeras más populares de Japón​\n\nTempura: Gambas o verduras fritas conocidas como tempura, servidas comúnmente con arroz. Es un plato clásico en Japón​\n\nEstos platos ofrecen un amplio espectro de sabores y texturas que son esenciales en la gastronomía japonesa, brindándote una experiencia culinaria auténtica y diversa durante tu viaje."
        },
        {
            "user_input": "voy a ir a Japón dentro de unas semanas y quisiera saber cuáles son los platos típicos",
            "retrieved_contexts": "<doc>\n30 Platos típicos de Japón que debes probar\n1. Sushi | 寿司\nCómo no podía ser de otra manera, nuestra selección de platos típicos de Japón debía empezar por su plato más internacional: el sushi. Se trata de un plato cuya base es el arroz cocido y adobado con vinagre de arroz, vino de arroz, azúcar y sal; si bien es cierto que se suele asociar el sushi al pescado y el marisco como acompañantes, existen muchas variedades de sushi que están acompañadas de tortilla, verduras y otros alimentos.\n\nDe hecho, la palabra sushi hace referencia al método de preparación del arroz y no al acompañante, aunque este último es quién será el responsable de darle un sabor diferente a cada pieza. Otro ingrediente importante en el sushi es el Alga Nori, que a menudo se utiliza como envoltura o cinturón para sujetar el acompañamiento al arroz.\n\nComo ya sabrás existen muchos tipos de sushi, tanto por el acompañante, como por la forma de presentarlo. A continuación vamos a hacer un repaso de algunas de las variedades de sushi más conocidas según su presentación:\n\n    Maki: Los Makis son piezas de sushi presentadas en un rollo de alga nori, es sin duda la variedad más habitual en occidente, pero a su vez es una de las más variadas ya que existen también diferentes formas de presentar los makis, como por ejemplo: Futomaki (sushi de rollo grueso), Uramaki (maki con el arroz en el exterior), Temaki (sushi enrollado a mano con forma de cono)\n    Nigiri: Es la forma más común de presentar el sushi en Japón. Consiste en una pieza amasada de arroz de forma alargada, con la pieza de condimento en la parte superior, normalmente con un corte plano. </doc><doc>\n3. Sashimi | 刺身\nOtro de los platos típicos de Japón que con total seguridad debes probar si visitas este país es el Sashimi. Se trata de finos cortes de pescado y marisco, acompañados por salsa de soja, jengibre y wasabi y servidos (normalmente) crudos. El objetivo del jengibre es tomarlo entre pieza y pieza de sashimi para limpiar el sabor de la boca y de este modo poder degustar mejor el sabor.\nPodríamos pensar que debido a la sencillez de preparación de este plato, no habrá ninguna diferencia entre probarlo en Japón o hacerlo en nuestro país de origen. </doc><doc>\nComida Japonesa – 35 platos tradicionales que comer en Japón\n¿Quieres saber más sobre la Comida y la Cocina Japonesas? Aquí tienes una lista de los 35 platos tradicionales que deberías comer cuando viajes a Japón.\n\nHe estado en Japón varias veces y, como puede que sepas por otros artículos, me encanta, y la comida japonesa es muy sabrosa. Ciertamente, no me gusta todo, pero es muy interesante porque la cultura gastronómica japonesa es muy diferente de la sueca.\nYakitori\n\nLas brochetas de pollo son un plato clásico en Japón. Se las conoce localmente como Yakitori y son deliciosas. Las brochetas se preparan a la parrilla sobre carbón y normalmente se sazonan con salsa tare o sal.\n\n¡Los Yakitori son, definitivamente, uno de mis platos favoritos cuando se trata de comida japonesa! </doc><doc>\n14. Dango | 団子\nSin dejar las brochetas de lado pasamos a otro de los platos típicos de Japón: el dango. Se trata de un postre con una textura similar al mochi que consiste en varias bolitas de mochiko (harina de arroz), ensartadas en un stick de madera.\n\nAl igual que ocurre con los daifuku, los dangos también pueden ser de muchos sabores y su nombre variará dependiendo del sabor o condimento que los acompañe. Por ejemplo el Bocchan dango, uno de los más habituales, consiste en tres bolas de tres sabores diferentes: una tiene judías rojas, otra huevo y la tercera té verde.\n15. Monjayaki | もんじゃ焼き\nEl monjayaki es la versión tokiota del Okonomijaki del que hemos hablado más arriba. Una mezcla igualmente deliciosa que se diferencia en que se hace con una masa más líquida y diferentes proporciones de ingredientes, lo que le otorga una consistencia similar a la del queso cuando se funde.\n\nSi quieres comer un buen monjayaki te recomendamos que lo hagas entres los múltiples restaurantes que lo sirven en el barrio de Tsukishima en la ciudad de Tokio, de dónde se dice que es originario este delicioso plato japonés. Normalmente en estos restaurantes podrás comer tu monjayaki recién hecho y directamente sobre la plancha en la que se ha cocinado.\n16. Dorayaki | どら焼き\nOtro de los postres japoneses por excelencia es el Dorayaki, una entrada obligatoria en este listado sobre platos típicos de Japón. Si eres un fan de las series anime japonsesas seguro que habrás visto a sus personajes comiendo estos deliciosos bizcochos con forma redondeada y unidos por un relleno de diversos sabores. Por ejemplo el Doraemon, el gato robot, tenía una auténtica adicción a los dorayakis.\n\nHoy en día puedes disfrutarlos en cualquier parte de Japón ya que son unos dulces muy populares tanto entre niños como adultos. Aunque el relleno tradicional es la pasta azuki (pasta de judías rojas), existen muchas otras opciones de relleno como chocolate, fresa o crema. No tienes por qué decidirte por uno ¡Puedes probarlos todos!\n</doc><doc>\n10. Takoyaki | たこ焼き\nSi te gusta el pulpo… ¡adorarás el takoyaki! Estas pequeñas bolitas que parecen buñuelos están elaboradas a base de harina de trigo y pulpo. Son uno de los platos típicos de Japón más habituales en los puestos de comida ambulantes. </doc>",
            "response": "Claro, estaré encantado de ayudarte a encontrar algunos de los platos típicos de Japón que debes probar durante tu visita. Japón es conocido por su rica cultura culinaria y hay muchos platos únicos y deliciosos que vale la pena probar. Aquí te presento algunos de los platos más populares y comunes que puedes encontrar en los restaurantes y en las casas japonesas:\n\nSushi: El sushi es uno de los platos más famosos de Japón y es una de las principales contribuciones culinarias del país. El plato básico de sushi es el arroz cocido y adobado con vinagre de arroz, vino de arroz, azúcar y sal. Existen muchas variedades de sushi, desde los makis (rollos de alga nori con el arroz en el interior) hasta los nigiri (piezas amasadas de arroz de forma alargada con la pieza de condimento en la parte superior). El sashimi (cortes de pescado y marisco) es otro plato popular y crudo que se sirve con salsa de soja, jengibre y wasabi.\n\nSashimi: El sashimi es similar al sushi y consiste en finos cortes de pescado y marisco acompañados por salsa de soja, jengibre y wasabi. Se sirve crudo y es una opción popular para aquellos que buscan una experiencia culinaria única.\n\nYakitori: El yakitori es una forma de preparar pescado y mariscos a la parrilla sobre carbón. Las brochetas de pollo son una opción popular y se pueden comer con salsa tare o sal.\n\nMonjayaki: El monjayaki es una mezcla similar al yakitori que se prepara con una masa más líquida y diferentes proporciones de ingredientes. Es una opción popular y se puede comer directamente de la plancha.\n\nTakoyaki: El takoyaki es una versión del yakitori con arroz cocido y adobado con vinagre de arroz, vino de arroz, azúcar y sal. Es una opción popular y se puede comer crudo o con salsa.\n\nDorayaki: El dorayaki es un postre con forma redondeada y unidos por un relleno de diversos sabores. Es una opción popular y se puede comer con salsa de soja, jengibre y wasabi.\n\nTakoyaki: El takoyaki es una versión del dorayaki con arroz cocido y adobado con vinagre de arroz, vino de arroz, azúcar y sal. Es una opción popular y se puede comer crudo o con salsa.\n\nEstos platos son solo una pequeña muestra de la rica cultura culinaria japonesa. Hay muchos otros platos y bebidas japonesas que también son deliciosos y únicos. Espero que esto te ayude a disfrutar de tu visita a Japón. ¡Buen provecho!",
            "reference": "Durante tu viaje a Japón, hay una gran variedad de platos tradicionales que puedes probar. Aquí tienes algunas recomendaciones basadas en artículos en español:\n\n    Sushi: Este es el plato más internacional de Japón. Se basa en arroz cocido y adobado con vinagre de arroz, vino de arroz, azúcar y sal. Aunque se asocia comúnmente con pescado y mariscos, también hay variedades que incluyen tortilla, verduras y otros ingredientes. Existen varios tipos de sushi, como Maki, Nigiri y Oshi​\n\nOnigiri: Son bolas o triángulos de arroz con un relleno en su interior y toppings en el exterior, generalmente envueltos en alga nori. Tradicionalmente se rellenan con ciruela encurtida, salmón, kombu o atún, aunque hay muchas variantes disponibles​\n\nSashimi: Consiste en finos cortes de pescado y marisco crudos, normalmente acompañados de salsa de soja, jengibre y wasabi. La calidad de la materia prima es clave en este plato, y en Japón se utiliza pescado muy fresco​\n\nYakisoba: Son tallarines fritos preparados con verduras, carne y fideos de trigo sarraceno. Aunque de origen chino, este plato se ha integrado completamente en la gastronomía japonesa y es común en festivales tradicionales y tiendas de conveniencia​\n\nRamen: De origen chino pero adaptado a la cocina japonesa, el ramen incluye un caldo a base de miso, carne, algas y salsa de soja, acompañado de fideos de trigo. Hay varias versiones regionales en Japón​\n\nSopa de Miso: Hecha con pasta de miso (soja) y un caldo dashi, generalmente de mariscos, carne o pescado. Se acompaña con alga wakame, puerro, cebolleta y tofu​\n\nYakitori: Son brochetas de pollo asadas a la parrilla y sazonadas con salsa tare o sal. Es un plato clásico en Japón, especialmente popular en Tokio​\n\nYakiniku: Se refiere a cualquier tipo de carne a la parrilla, comúnmente ternera. Es un plato disfrutado ampliamente en Japón​\n\nKare Raisu (Arroz al Curry): Aunque se asocia más con la India, el curry japonés, introducido por los británicos, tiene su propia variante y es muy popular en Japón​\n\nTakoyaki: Bolas rellenas de pulpo, un plato tradicional de Osaka y una de las comidas callejeras más populares de Japón​\n\nTempura: Gambas o verduras fritas conocidas como tempura, servidas comúnmente con arroz. Es un plato clásico en Japón​\n\nEstos platos ofrecen un amplio espectro de sabores y texturas que son esenciales en la gastronomía japonesa, brindándote una experiencia culinaria auténtica y diversa durante tu viaje."
        },
        {
            "user_input": "oye sabes comidas para comer en japon",
            "retrieved_contexts": "<doc>\nComida Japonesa – 35 platos tradicionales que comer en Japón\n¿Quieres saber más sobre la Comida y la Cocina Japonesas? Aquí tienes una lista de los 35 platos tradicionales que deberías comer cuando viajes a Japón.\n\nHe estado en Japón varias veces y, como puede que sepas por otros artículos, me encanta, y la comida japonesa es muy sabrosa. Ciertamente, no me gusta todo, pero es muy interesante porque la cultura gastronómica japonesa es muy diferente de la sueca.\nYakitori\n\nLas brochetas de pollo son un plato clásico en Japón. Se las conoce localmente como Yakitori y son deliciosas. Las brochetas se preparan a la parrilla sobre carbón y normalmente se sazonan con salsa tare o sal.\n\n¡Los Yakitori son, definitivamente, uno de mis platos favoritos cuando se trata de comida japonesa! </doc><doc>\nSe prepara en una cazuela caliente (nabemono).\n\nMiso\n\nUna sopa clásica que consiste en un caldo dashi al que se le añade tofu, cebolla verde y algas. La sopa Miso normalmente se sirve como acompañamiento tanto para desayunar como para comer o cenar.\n\nGyoza\n\nLos dumplings japoneses son otra especialidad que no deberías perderte. Suelen rellenarse de cerdo picado, col, setas y cebolla verde.\n\nLos dumplings Gyoza normalmente se fríen por un lado y después se cocinan al vapor durante 2-3 minutos hasta asegurarse de que el relleno está cocinado y jugoso.\n\nOkonomiyaki\n\nLa tortita japonesa, ¡que es especialmente famosa en Osaka!\n\nSe hace mezclando col cortada a tiras y una masa, así como otros ingredientes, y se fríe como una tortita. Si visitas Osaka, verás restaurantes y puestos de Okonomiyaki en muchos lugares.\n\nTamagoyaki\n\nSi te gusta comer tortilla, es probable que también disfrutes de la Tamagoyaki, que básicamente es la versión japonesa de la tortilla. Se puede comer para desayunar, comer o cenar y se hace enrollando varias capas de huevo batido y cocinándolo.\n\nUnagi Kabayaki\n\nUn plato popular hecho de anguila de agua dulce que tiene su origen en el periodo de Edo. Se comía durante el verano. </doc><doc>\nMuy sencillo, pero aun así delicioso.\n\nEdamame\n\nUn aperitivo popular en los Izakayas locales que normalmente se sirve junto con cerveza. El edamame es, en esencia, habas de soja verde preparados.\n\nUvas de Mar\n\nEste es uno de los alimentos japoneses más divertidos que se puede probar cuando se visita Okinawa. Realmente no son uvas, simplemente parecen uvas, pero en realidad es un tipo de alga especial que crece en Okinawa.\n\nYakisoba\n\nEl Yakisoba es un plato de noodles fritos que se prepara salteando o asando una combinación de noodles e ingredientes diversos. Es uno de mis platos japoneses favoritos y es todo un clásico.\n\nAunque este plato de noodles se llama Yakisoba, los noodles soba que se utilizan para este plato no contienen trigo sarraceno.\n\nShabu-shabu\n\nEs un plato servido en una olla caliente típica japonesa en el que te concinas tú mismo la comida en la mesa.\n\nNormalmente, hay muchos tipos distintos de marisco y de carne, así como trozos de tofu y verduras. Entonces tomas lo que quieras con los palillos, lo pones en la olla caliente y lo cocinas.\n\nEl Shabu Shabu es una gran experiencia gastronómica de Japón que tampoco deberías perderte. Si tienes la oportunidad de ir a un restaurante con un local, no la desaproveches, ya que probablemente tendrás una experiencia más gratificante si alguien te muestra cómo se hace de la forma tradicional.\n\nGyudon\n\nEl Gyudon es un plato japonés popular que consiste en un bol de arroz con ternera que se condimenta con varias especias. Sukiya es una cadena de restaurantes que se ha hecho famosa por sus Gyudon y tampoco es caro.\n\n</doc><doc>\nPero son muy fáciles de distinguir. Básicamente, el sashimi es pescado crudo cortado a tiras finas que se sirve acompañado de salsa de soja.\n\nOnigiri\n\nUna comida popular para comer por el camino. Los onigiri consisten esencialmente en arroz envuelto en algas. Los encontrarás en todas las tiendas de conveniencia y son muy baratos.\n\nLos onigiri también son una opción popular para desayunar en Japón. A mí no me encantan, pero Christine comió bastantes, ya que ella no come carne.\n\nUdon\n\nUn tipo especial de noodles japoneses. Los noodles Udon son gruesos y gomosos, y normalmente se hacen con harina de trigo y agua salada. A mí me gustan mucho. </doc><doc>\nIncluso tienen la salsa tonkatsu. Como ya he mencionado, el tonkatsu es uno de los aderezos más comunes para el arroz al curry.\n\nDonburi\n\nSi quieres comer como los locales, el Donburi es una opción muy habitual para comer entre los trabajadores japoneses. Este plato se prepara friendo o hirviendo varios tipos de carne, pescado y verdura, y se sirve con arroz al vapor en grandes boles que se llaman Donburi.\n\nLos tipos más comunes de Donburi son el Gyudon, el Oyakodon y el Katsudon.\n\nNatto\n\nEl natto es el desayuno tradicional de Japón. Sin embargo, hoy en día se sirve sobre todo en hoteles, dado que los locales ya no tienen tiempo de preparar un plato que cuesta tanto de hacer.\n\nEn esencia, el natto consiste en habas de soja fermentadas. Tiene un olor fuerte que recuerda al queso mohoso y que no a todo el mundo le gusta, aunque, por otro lado, a muchos japoneses les encanta.\n\nOden\n\nEs un plato japonés clásico para comer durante el invierno. Es un estofado con diversas verduras y proteínas. </doc>",
            "response": "Claro, estaré encantado de ayudarte a conocer más sobre las comidas japonesas y los platos que puedes probar en Japón.\n\nJapón es conocido por su rica cultura culinaria, con una variedad de platos tradicionales y experimentales que varían según la región. Aquí te presento algunos de los platos más populares y comunes que puedes probar:\n\nYakitori: Las brochetas de pollo son un plato clásico en Japón. Se las conoce localmente como Yakitori y son deliciosas. Las brochetas se preparan a la parrilla sobre carbón y normalmente se sazonan con salsa tare o sal.\n\nMiso: Una sopa clásica que consiste en un caldo dashi al que se le añade tofu, cebolla verde y algas. La sopa Miso normalmente se sirve como acompañamiento tanto para desayunar como para comer o cenar.\n\nGyoza: Los dumplings japoneses son otra especialidad que no deberías perderte. Suelen rellenarse de cerdo picado, col, setas y cebolla verde.\n\nOkonomiyaki: La tortita japonesa, ¡que es especialmente famosa en Osaka!\n\nSe prepara en una cazuela caliente (nabemono).\n\nUvas de Mar: Este es uno de los alimentos japoneses más divertidos que se puede probar cuando se visita Okinawa. Realmente no son uvas, simplemente parecen uvas, pero en realidad es un tipo de alga especial que crece en Okinawa.\n\nEdamame: Un aperitivo popular en los Izakayas locales que normalmente se sirve junto con cerveza. El edamame es, en esencia, habas de soja verde preparados.\n\nOnigiri: Los onigiri consisten esencialmente en arroz envuelto en algas. Los encontrarás en todas las tiendas de conveniencia y son muy baratos.\n\nNatto: El natto es el desayuno tradicional de Japón. Sin embargo, hoy en día se sirve sobre todo en hoteles, dado que los locales ya no tienen tiempo de preparar un plato que cuesta tanto de hacer.\n\nOden: Es un plato japonés clásico para comer durante el invierno. Es un estofado con diversas verduras y proteínas.\n\nDonburi: Si quieres comer como los locales, el Donburi es una opción muy habitual para comer entre los trabajadores japoneses. Este plato se prepara friendo o hirviendo varios tipos de carne, pescado y verdura, y se sirve con arroz al vapor en grandes boles que se llaman Donburi.\n\nNatto: El natto es el desayuno tradicional de Japón. Sin embargo, hoy en día se sirve sobre todo en hoteles, dado que los locales ya no tienen tiempo de preparar un plato que cuesta tanto de hacer.\n\nYakitori: Las brochetas de pollo son un plato clásico en Japón. Se las conoce localmente como Yakitori y son deliciosas. Las brochetas se preparan a la parrilla sobre carbón y normalmente se sazonan con salsa tare o sal.\n\nMiso: Una sopa clásica que consiste en un caldo dashi al que se le añade tofu, cebolla verde y algas. La sopa Miso normalmente se sirve como acompañamiento tanto para desayunar como para comer o cenar.\n\nGyoza: Los dumplings japoneses son otra especialidad que no deberías perderte. Suelen rellenarse de cerdo picado, col, setas y cebolla verde.\n\nOkonomiyaki: La tortita japonesa, ¡que es especialmente famosa en Osaka!\n\nSe prepara en una cazuela caliente (nabemono).\n\nUvas de Mar: Este es uno de los alimentos japoneses más divertidos que se puede probar cuando se visita Okinawa. Realmente no son uvas, simplemente parecen uvas, pero en realidad es un tipo de alga especial que crece en Okinawa.\n\nEdamame: Un aperitivo popular en los Izakayas locales que normalmente se sirve junto con cerveza. El edamame es, en esencia, habas de soja verde preparados.\n\nOnigiri: Los onigiri consisten esencialmente en arroz envuelto en algas. Los encontrarás en todas las tiendas de conveniencia y son muy baratos.\n\nNatto: El natto es el desayuno tradicional de Japón. Sin embargo, hoy en día se sirve sobre todo en hoteles, dado que los locales ya no tienen tiempo de preparar un plato que cuesta tanto de hacer.\n\nYakitori: Las brochetas de pollo son un plato clásico en Japón. Se las conoce localmente como Yakitori y son deliciosas. Las brochetas se preparan a la parrilla sobre carbón y normalmente se sazonan con salsa tare o sal.\n\nMiso: Una sopa clásica que consiste en un caldo dashi al que se le añade tofu, cebolla verde y algas. La sopa Miso normalmente se sirve como acompañamiento tanto para desayunar como para comer o cenar.\n\nGyoza: Los dumplings japoneses son otra especialidad que no deberías perderte. Suelen rellenarse de cerdo picado, col, setas y cebolla verde.\n\nOkonomiyaki: La tortita japonesa, ¡que es especialmente famosa en Osaka!\n\nSe prepara en una cazuela caliente (nabemono).\n\nUvas de Mar: Este es uno de los alimentos japoneses más divertidos que se puede probar cuando se visita Okinawa. Realmente no son uvas, simplemente parecen uvas, pero en realidad es un tipo de alga especial que crece en Okinawa.\n\nEdamame: Un aperitivo popular en los Izakayas locales que normalmente se sirve junto con cerveza. El edamame es, en esencia, habas de soja verde preparados.\n\nOnigiri: Los onigiri consisten esencialmente en arroz envuelto en algas. Los encontrarás en todas las tiendas de conveniencia y son muy baratos.\n\nNatto: El natto es el desayuno tradicional de Japón. Sin embargo, hoy en día se sirve sobre todo en hoteles, dado que los locales ya no tienen tiempo de preparar un plato que cuesta tanto de hacer.\n\nYakitori: Las brochetas de pollo son un plato clásico en Japón. Se las conoce localmente como Yakitori y son deliciosas. Las brochetas se preparan a la parrilla sobre carbón y normalmente se sazonan con salsa tare o sal.\n\nMiso: Una sopa clásica que consiste en un caldo dashi al que se le añade tofu, cebolla verde y algas. La sopa Miso normalmente se sirve como acompañamiento tanto para desayunar como para comer o cenar.\n\nGyoza: Los dumplings japoneses son otra especialidad que no deberías perderte. Suelen rellenarse de cerdo picado, col, setas y cebolla verde.\n\nOkonomiyaki: La tortita japonesa, ¡que es especialmente famosa en Osaka!\n\nSe prepara en una cazuela caliente (nabemono).\n\nUvas de Mar: Este es uno de los alimentos japoneses más divertidos que se puede probar cuando se visita Okinawa. Realmente no son uvas, simplemente parecen uvas, pero en realidad es un tipo de alga especial que cre...\n\n",
            "reference": "Durante tu viaje a Japón, hay una gran variedad de platos tradicionales que puedes probar. Aquí tienes algunas recomendaciones basadas en artículos en español:\n\n    Sushi: Este es el plato más internacional de Japón. Se basa en arroz cocido y adobado con vinagre de arroz, vino de arroz, azúcar y sal. Aunque se asocia comúnmente con pescado y mariscos, también hay variedades que incluyen tortilla, verduras y otros ingredientes. Existen varios tipos de sushi, como Maki, Nigiri y Oshi​\n\nOnigiri: Son bolas o triángulos de arroz con un relleno en su interior y toppings en el exterior, generalmente envueltos en alga nori. Tradicionalmente se rellenan con ciruela encurtida, salmón, kombu o atún, aunque hay muchas variantes disponibles​\n\nSashimi: Consiste en finos cortes de pescado y marisco crudos, normalmente acompañados de salsa de soja, jengibre y wasabi. La calidad de la materia prima es clave en este plato, y en Japón se utiliza pescado muy fresco​\n\nYakisoba: Son tallarines fritos preparados con verduras, carne y fideos de trigo sarraceno. Aunque de origen chino, este plato se ha integrado completamente en la gastronomía japonesa y es común en festivales tradicionales y tiendas de conveniencia​\n\nRamen: De origen chino pero adaptado a la cocina japonesa, el ramen incluye un caldo a base de miso, carne, algas y salsa de soja, acompañado de fideos de trigo. Hay varias versiones regionales en Japón​\n\nSopa de Miso: Hecha con pasta de miso (soja) y un caldo dashi, generalmente de mariscos, carne o pescado. Se acompaña con alga wakame, puerro, cebolleta y tofu​\n\nYakitori: Son brochetas de pollo asadas a la parrilla y sazonadas con salsa tare o sal. Es un plato clásico en Japón, especialmente popular en Tokio​\n\nYakiniku: Se refiere a cualquier tipo de carne a la parrilla, comúnmente ternera. Es un plato disfrutado ampliamente en Japón​\n\nKare Raisu (Arroz al Curry): Aunque se asocia más con la India, el curry japonés, introducido por los británicos, tiene su propia variante y es muy popular en Japón​\n\nTakoyaki: Bolas rellenas de pulpo, un plato tradicional de Osaka y una de las comidas callejeras más populares de Japón​\n\nTempura: Gambas o verduras fritas conocidas como tempura, servidas comúnmente con arroz. Es un plato clásico en Japón​\n\nEstos platos ofrecen un amplio espectro de sabores y texturas que son esenciales en la gastronomía japonesa, brindándote una experiencia culinaria auténtica y diversa durante tu viaje."
        },
        {
            "user_input": "cómo puedo restaurar un mueble antiguo?",
            "retrieved_contexts": "<doc>\n¡La salud es lo primero!\nCómo restaurar un mueble. \nCómo restaurar un mueble antiguo paso a paso\nPaso 1. Limpia el mueble\n\nEs el primero paso para restaurar un mueble antiguo. Basta con pasarle un trapo humedecido en agua y un poco de jabón neutro, y dejarlo secar totalmente. Repasa las manchas en esquinas o molduras con un cepillo de dientes muy duro mojado en disolvente. El siguiente paso será eliminar la pintura o el barniz. Para ello, aplica decapante con una brocha y retíralo con una espátula. Repite la operación hasta eliminar el acabado, y limpia el mueble con un trapo y disolvente. Al final, pasa una lija fina.\n</doc><doc>\nCómo restaurar muebles antiguos\nSi tenéis un mueble antiguo en casa al que le queréis dar un aspecto más renovado, no os podéis perder el paso a paso de cómo restaurar muebles antiguos.\n\nSiguiendo este tutorial podréis restaurar cualquier mueble de madera de vuestro hogar.\n\nAdemás, en el ejemplo que os vamos a mostrar también vemos cómo tratar correctamente una pieza de madera que está afectada por la carcoma. ¡Toma nota!\nAntes de empezar a restaurar muebles, debemos realizar un estudio de los daños y desperfectos que tienen para saber cuales tendrán que ser los pasos a seguir.\n\nEn nuestro caso, tenemos un armario de madera con carcoma, así que lo primero que debemos hacer es acabar con estos bichitos.\nA continuación, reforzaremos la estructura con resina y reconstruiremos todas las partes deterioradas incluida la marquetería. </doc><doc>\nCómo restaurar muebles antiguos\nEn todas las casas hay muebles antiguos que se pueden restaurar. Ya sea porque se compraron y tienen demasiado tiempo o porque se heredaron y simplemente son demasiado viejos. Por norma general suelen terminar empolvados en un sótano, pero esto no tiene porqué ser así. Existen multitud de opciones para aprovechar estas antigüedades, así que hoy os explicamos cómo restaurar muebles antiguos usando varias técnicas.\nLo mejor de todo, es que aparte de recuperar tus muebles sin gastar demasiado, también le darás un toque retro e innovador que llenará de aire vintage tu hogar.\nTécnicas de restauración de muebles antiguos\nPrimero de todo, tenemos que ser conscientes que existen una gran variedad de técnicas de restauración de muebles antiguos. No obstante, hay algunas más complejas, utilizadas por profesionales y que necesitan herramientas especiales. </doc><doc>\nCómo Restaurar un Mueble Antiguo\nEn este post te mostraré paso a paso cómo restaurar un mueble antiguo con un resultado espectacular. Si te gustan los retos, pocas cosas hay mas increíbles que darle vida a lo viejo.\n\n¡Buenos días tizadict@s!\n\nEn este post os vamos a enseñar cómo restaurar un mueble antiguo y convertirlo en un bonito aparador con tapa de \"mármol\" incluida.\n\nAdemás hemos utilizado en un paso la pistola para pintar porque es algo que nos preguntáis a menudo y, aunque os grabaremos un tutorial especial para pintar de esa manera, vamos así abriendo boca 😉.\n\nLa semana pasada, reciclamos una mesa con el color Verde Lorca que ha sido el último en incorporarse a la familia De Tiza. Hoy hemos elegido el Casi Negro y un spray nuevo \"efecto mármol\" con el que vais a alucinar.\n\nEsta es la pieza que hemos rescatado de la basura y le hemos dado una segunda vida. </doc><doc>\nSeguid leyendo patra descubrir todos los secretos de la restauración de muebles de madera.\nCómo restaurar muebles antiguos de roble\n\nLa madera de roble, a pesar de ser muy resistente y brillante, necesita de una mano de pintura al año para evitar que se desgaste el color. En su defecto, podemos también utilizar algo de cera, pero si el mueble ya está desgastado, la cera no funcionará. Si es tu caso, entonces te explicamos cómo restaurar muebles antiguos de roble.\n\n    Primero de todo, usaremos una lija para retirar el barniz antiguo. En caso de que haya pintura, también podremos usar diluyente de pintura en cantidades pequeñas para no dañar el roble. En caso necesario utilizaremos una espátula para retirar la pintura y aplicaremos un suave lijado para obtener un mejor acabado.\n    Usaremos un poco de lana de acero para retirar la suciedad e imperfección de la madera y retiraremos la suciedad con un paño húmedo. No os preocupéis, el roble es muy resistente y no habrá problemas.\n    Ahora haremos una pasta para rellenar juntando un poco de aserrín o polvillo generado por el lijado con laca selladora.\n    Aprovecharemos la mezcla anterior para cubrir las zonas rotas de la madera usando una espátula para retirar excesos.\n    Una vez seco el roble, pasaremos otra mano de lija fina para eliminar exceso de mezclilla.\n    Aplicaremos barniz o sellador previo si pensamos utilizar pintura para el mueble.\n\nRestaurar muebles antiguos de castaño\n\nEl castaño tiene características parecidas al roble, no obstante, este tipo de madera es mucho menos resistente que la anterior. Es por esto, que se debe tener mucho cuidado al trabajar con este tipo de madera, evitando cualquier tipo de materiales demasiado fuertes como la lana de acero. </doc>",
            "response": "Para restaurar un mueble antiguo, es importante tener en cuenta varios factores clave. Aquí te presento tres aspectos fundamentales:\n\n    **Conocimiento y experiencia**: Trabajar con muebles antiguos requiere conocimientos específicos y experiencia. Es fundamental contar con la habilidad y el conocimiento adecuados para llevar a cabo los procedimientos de restauración de manera segura y efectiva.\n\n    **Diseño del proyecto**: Antes de comenzar, debes tener un plan bien definido. Esto incluye la identificación de las áreas dañadas, la determinación de los materiales necesarios y el diseño de los pasos a seguir.\n\n    **Protección del mueble**: Es crucial proteger el mueble durante el proceso de restauración. Esto implica el uso de protección contra el polvo, la suciedad y otros elementos que puedan dañarlo.\n\nEn cuanto a las técnicas de restauración, existen diversas opciones. Algunas de las más comunes incluyen:\n\n    **Decapado**: Este proceso implica quitar el acabado existente para revelar la madera subyacente. Puede ser realizado con una lija o una combinación de lija y decapante. Este método es especialmente útil para muebles de madera viejos y desgastados.\n\n    **Pintura y barniz**: Si deseas darle una nueva capa de pintura o barniz al mueble, es necesario seguir un proceso específico. Esto puede incluir la preparación de la superficie, la aplicación de la pintura o el barniz y la limpieza y pulido del mueble después de la aplicación.\n\n    **Reparación de daños**: En algunos casos, es necesario reparar daños en la madera. Esto puede incluir la reemplazación de tableros rotos, la reparación de grietas o la reubicación de piezas desgastadas.\n\n    **Conservación de la madera**: Para mantener el mueble en buenas condiciones, es importante conservar la madera subyacente. Esto puede incluir la aplicación de selladores y ceras para proteger la madera de la intemperie.\n\nEn resumen, la restauración de muebles antiguos requiere un enfoque cuidadoso y un conocimiento profundo de los materiales y las técnicas de restauración. Al seguir estos pasos y considerar el bienestar del mueble, puedes lograr un resultado satisfactorio y preservar la historia y la cultura de la madera.",
            "reference": "Para restaurar un mueble antiguo, sigue estos pasos generales basados en varias fuentes:\n\n    Preparación:\n        Evaluación de Daños: Antes de comenzar, examina los daños y desperfectos del mueble para determinar los pasos a seguir​\n        \nLimpieza: Limpia bien el mueble, preferentemente con un producto como Superclean. Si la superficie está en buenas condiciones, puede que no necesites lijar en este punto​\n\nHerramientas y Materiales Necesarios:\n\n    Necesitarás lijas de varios tamaños y durezas, pinceles, trapos de algodón, destornilladores, cuchillas, estropajos de aluminio, algodón y una espátula​\n\nOtros materiales pueden incluir pistola de pintura, tablero y listones redondos de madera DM, y cola para madera​\n\nRestauración:\n\n    Tratamiento de Carcoma: Si el mueble tiene carcoma, este es el primer problema que debes tratar​\n\nPintura: Mezcla agua y chalk paint según las indicaciones del fabricante y pinta el mueble. Después de pintar, elimina el exceso de humedad con un paño y espera a que la madera se seque antes de lijar​\n\nEstos pasos generales te guiarán en el proceso, pero ten en cuenta que cada mueble puede requerir atención específica según su condición y estilo."
        },
        {
            "user_input": "dime algun consejillo para restaurar un mueble que tengo antiguo",
            "retrieved_contexts": "<doc>\n¿Qué necesitas para restaurar un mueble? Materiales básicos\n\nLas herramientas básicas para restaurar un mueble son: lijas de varios tamaños y durezas, pinceles, trapos de algodón, destornilladores, cuchillas, estropajos de aluminio, algodón y una espátula.\n\nA la hora de ponerte manos a la obra con la restauración de tu mueble, evita trabajar al aire libre: el viento y el sol resecan la madera y la pintura. </doc><doc>\n¡La salud es lo primero!\nCómo restaurar un mueble. \nCómo restaurar un mueble antiguo paso a paso\nPaso 1. Limpia el mueble\n\nEs el primero paso para restaurar un mueble antiguo. Basta con pasarle un trapo humedecido en agua y un poco de jabón neutro, y dejarlo secar totalmente. Repasa las manchas en esquinas o molduras con un cepillo de dientes muy duro mojado en disolvente. El siguiente paso será eliminar la pintura o el barniz. Para ello, aplica decapante con una brocha y retíralo con una espátula. Repite la operación hasta eliminar el acabado, y limpia el mueble con un trapo y disolvente. Al final, pasa una lija fina.\n</doc><doc>\nCómo restaurar un mueblePaso 2\nEn nuestro caso, tenemos un mueble antiguo y una de las patas delanteras del escritorio está totalmente carcomida. La cortamos con una sierra de costilla.\n\nCómo restaurar un mueblePaso 3\nA continuación, repasamos bien toda la superficie de madera con la lijadora provista de una hoja de lija de grano fino siguiendo la dirección de la veta.\n\nCon esta tarea, además de limpiar la superficie conseguiremos abrir el poro de la madera.\n\nCómo restaurar un mueblePaso 4\nDespués de retirar el polvo producido al lijar, mezclamos en un recipiente aguarrás con vaselina, humedecemos la lana de acero y repasamos la superficie hasta retirar completamente la goma laca.\n\nPara realizar este trabajo, os recomendamos que uséis guantes de látex para protegeros las manos.\n\nCómo restaurar un mueblePaso 5\nSecamos bien el mueble y comenzamos con el tratamiento anticarcoma. En primer lugar, aplicamos generosamente el producto empleando una paletina.\n\nCómo restaurar un mueblePaso 6\nEn los orificios más pronunciados insertaremos el producto anticarcomal con una jeringuilla. A la hora de restaurar muebles, este tratamiento es fundamental aunque no tenga carcoma para así evitar su aparición y proteger el mueble.\n\nCómo restaurar un mueblePaso 7\nPara que el producto anticarcoma penetre profundamente en la madera, cubrimos el mueble con un plástico y lo cerramos perfectamente con una cinta adhesiva.\n\nNosotros nos hemos decantado por la cinta de carrocero, pero se puede utilizar otro cinta adhesiva.\n\nCómo restaurar un mueblePaso 8\nTranscurrido el tiempo que necesita el líquido para hacer su trabajo, retiramos el plástico y diluimos la resina con acetona.\n\nCuando el producto ya esté listo, llenamos la jeringuilla e introducimos la resina en los agujeros del mueble con el fin de consolidar la estructura.\n\nCómo restaurar un mueblePaso 9\nMientras el producto se seca, hacemos un agujero en la parte inferior del mueble utilizando el taladro y una broca-pala del diámetro adecuado, justo en el punto en el que irá la nueva pata delantera, .\n\nAplicamos cola de carpintero en las superficies a unir, insertamos el tubillón y fijamos la pata.\n\n</doc><doc>\nSeguid leyendo patra descubrir todos los secretos de la restauración de muebles de madera.\nCómo restaurar muebles antiguos de roble\n\nLa madera de roble, a pesar de ser muy resistente y brillante, necesita de una mano de pintura al año para evitar que se desgaste el color. En su defecto, podemos también utilizar algo de cera, pero si el mueble ya está desgastado, la cera no funcionará. Si es tu caso, entonces te explicamos cómo restaurar muebles antiguos de roble.\n\n    Primero de todo, usaremos una lija para retirar el barniz antiguo. En caso de que haya pintura, también podremos usar diluyente de pintura en cantidades pequeñas para no dañar el roble. En caso necesario utilizaremos una espátula para retirar la pintura y aplicaremos un suave lijado para obtener un mejor acabado.\n    Usaremos un poco de lana de acero para retirar la suciedad e imperfección de la madera y retiraremos la suciedad con un paño húmedo. No os preocupéis, el roble es muy resistente y no habrá problemas.\n    Ahora haremos una pasta para rellenar juntando un poco de aserrín o polvillo generado por el lijado con laca selladora.\n    Aprovecharemos la mezcla anterior para cubrir las zonas rotas de la madera usando una espátula para retirar excesos.\n    Una vez seco el roble, pasaremos otra mano de lija fina para eliminar exceso de mezclilla.\n    Aplicaremos barniz o sellador previo si pensamos utilizar pintura para el mueble.\n\nRestaurar muebles antiguos de castaño\n\nEl castaño tiene características parecidas al roble, no obstante, este tipo de madera es mucho menos resistente que la anterior. Es por esto, que se debe tener mucho cuidado al trabajar con este tipo de madera, evitando cualquier tipo de materiales demasiado fuertes como la lana de acero. </doc><doc>\nCómo Restaurar un Mueble Antiguo\nEn este post te mostraré paso a paso cómo restaurar un mueble antiguo con un resultado espectacular. Si te gustan los retos, pocas cosas hay mas increíbles que darle vida a lo viejo.\n\n¡Buenos días tizadict@s!\n\nEn este post os vamos a enseñar cómo restaurar un mueble antiguo y convertirlo en un bonito aparador con tapa de \"mármol\" incluida.\n\nAdemás hemos utilizado en un paso la pistola para pintar porque es algo que nos preguntáis a menudo y, aunque os grabaremos un tutorial especial para pintar de esa manera, vamos así abriendo boca 😉.\n\nLa semana pasada, reciclamos una mesa con el color Verde Lorca que ha sido el último en incorporarse a la familia De Tiza. Hoy hemos elegido el Casi Negro y un spray nuevo \"efecto mármol\" con el que vais a alucinar.\n\nEsta es la pieza que hemos rescatado de la basura y le hemos dado una segunda vida. </doc>",
            "response": "Para restaurar un mueble antiguo, es importante seguir un proceso cuidadoso y utilizar herramientas y materiales adecuados. Aquí te presento algunos consejos basados en diferentes fuentes:\n\n    Limpieza y preparación: El primer paso es limpiar el mueble con un trapo humedecido en agua y jabón neutro. Se pueden realizar manchas específicas con cepillos de dientes durones y disolventes. Después de la limpieza, se pueden aplicar productos para eliminar la pintura o el barniz, como decapante y sellador, para abrir los poros de la madera​.\n\nRestauración de la superficie: Una vez eliminada la pintura o el barniz, se procede a lijar la superficie con lijas de diferentes grados para ablandarla y facilitar su restauración. Esto también ayuda a abrir los poros de la madera. También se pueden aplicar pasta de aserrín o polvillo para rellenar zonas rotas y luego lijar para eliminar exceso​​.\n\nConservación y mantenimiento: Después de la restauración, es importante proteger el mueble con un barniz o sellador para proteger la madera del deterioro. Este producto también ayuda a conservar el acabado y prolonga la vida útil del mueble​.\n\nTécnicas y productos específicos: Algunas técnicas y productos que se utilizan para restaurar muebles incluyen la aplicación de pasta de aserrín o polvillo, el uso de productos anticarcoma y el tratamiento con resina epoxi. Estos productos ayudan a abrir los poros de la madera, a penetrar en la madera y a mantener la estructura intacta​.\n\nEn resumen, para restaurar un mueble antiguo, es crucial un enfoque cuidadoso y experimentado, utilizando herramientas y productos adecuados. Esto permitirá mantener la integridad estructural y estética del mueble, lo que lo hará valioso para la familia y para la historia de la artesanía local.",
            "reference": "Para restaurar un mueble antiguo, sigue estos pasos generales basados en varias fuentes:\n\n    Preparación:\n        Evaluación de Daños: Antes de comenzar, examina los daños y desperfectos del mueble para determinar los pasos a seguir​\n        \nLimpieza: Limpia bien el mueble, preferentemente con un producto como Superclean. Si la superficie está en buenas condiciones, puede que no necesites lijar en este punto​\n\nHerramientas y Materiales Necesarios:\n\n    Necesitarás lijas de varios tamaños y durezas, pinceles, trapos de algodón, destornilladores, cuchillas, estropajos de aluminio, algodón y una espátula​\n\nOtros materiales pueden incluir pistola de pintura, tablero y listones redondos de madera DM, y cola para madera​\n\nRestauración:\n\n    Tratamiento de Carcoma: Si el mueble tiene carcoma, este es el primer problema que debes tratar​\n\nPintura: Mezcla agua y chalk paint según las indicaciones del fabricante y pinta el mueble. Después de pintar, elimina el exceso de humedad con un paño y espera a que la madera se seque antes de lijar​\n\nEstos pasos generales te guiarán en el proceso, pero ten en cuenta que cada mueble puede requerir atención específica según su condición y estilo."
        },
        {
            "user_input": "me puedes decir qué pasos debo seguir para restaurar un mueble viejo?",
            "retrieved_contexts": "<doc>\n¡La salud es lo primero!\nCómo restaurar un mueble. \nCómo restaurar un mueble antiguo paso a paso\nPaso 1. Limpia el mueble\n\nEs el primero paso para restaurar un mueble antiguo. Basta con pasarle un trapo humedecido en agua y un poco de jabón neutro, y dejarlo secar totalmente. Repasa las manchas en esquinas o molduras con un cepillo de dientes muy duro mojado en disolvente. El siguiente paso será eliminar la pintura o el barniz. Para ello, aplica decapante con una brocha y retíralo con una espátula. Repite la operación hasta eliminar el acabado, y limpia el mueble con un trapo y disolvente. Al final, pasa una lija fina.\n</doc><doc>\nCola para madera.\n\nPasos para restaurar un mueble antiguo\n1.- Limpiar el mueble.\n\nEl primer paso de todo trabajo con pintura es el de limpiar bien el mueble con Superclean.\n\nNo hemos tenido que lijar porque la verdad es que la superficie estaba en bastantes buenas condiciones. </doc><doc>\nCómo restaurar muebles antiguos\nSi tenéis un mueble antiguo en casa al que le queréis dar un aspecto más renovado, no os podéis perder el paso a paso de cómo restaurar muebles antiguos.\n\nSiguiendo este tutorial podréis restaurar cualquier mueble de madera de vuestro hogar.\n\nAdemás, en el ejemplo que os vamos a mostrar también vemos cómo tratar correctamente una pieza de madera que está afectada por la carcoma. ¡Toma nota!\nAntes de empezar a restaurar muebles, debemos realizar un estudio de los daños y desperfectos que tienen para saber cuales tendrán que ser los pasos a seguir.\n\nEn nuestro caso, tenemos un armario de madera con carcoma, así que lo primero que debemos hacer es acabar con estos bichitos.\nA continuación, reforzaremos la estructura con resina y reconstruiremos todas las partes deterioradas incluida la marquetería. </doc><doc>\nPaso 10. Pule el mueble\nPara que el acabado final del mueble a restaurar sea más brillante, aplícale al menos una segunda capa, ya sea de barniz, de tinte o de goma laca. Es conveniente encerar la pieza una o dos veces al año para mantenerla en perfecto estado tras la restauración.\nPaso 11. Renueva la tapicería\n\nSi estás renovando una silla o una butaca y la tela no está muy deteriorada, basta con una puesta a punto para que esté como nueva. Desclávala con cuidado de la estructura y, para una limpieza a fondo, llévala a la tintorería. Posteriormente, grápala con una grapadora especial para tapizar. Si la tela original está inservible, créate una plantilla de la forma del tapizado original, recorta la nueva tela y grápala.\nCómo mantener un mueble restaurado\n\nEl mantenimiento de los muebles restaurados debe ser constante. En primer lugar, procura alejar el mueble de las fuentes de calor y humedad, y evita exponerlo al sol directo, ya que podría perder su color original. </doc><doc>\nCómo restaurar un mueblePaso 2\nEn nuestro caso, tenemos un mueble antiguo y una de las patas delanteras del escritorio está totalmente carcomida. La cortamos con una sierra de costilla.\n\nCómo restaurar un mueblePaso 3\nA continuación, repasamos bien toda la superficie de madera con la lijadora provista de una hoja de lija de grano fino siguiendo la dirección de la veta.\n\nCon esta tarea, además de limpiar la superficie conseguiremos abrir el poro de la madera.\n\nCómo restaurar un mueblePaso 4\nDespués de retirar el polvo producido al lijar, mezclamos en un recipiente aguarrás con vaselina, humedecemos la lana de acero y repasamos la superficie hasta retirar completamente la goma laca.\n\nPara realizar este trabajo, os recomendamos que uséis guantes de látex para protegeros las manos.\n\nCómo restaurar un mueblePaso 5\nSecamos bien el mueble y comenzamos con el tratamiento anticarcoma. En primer lugar, aplicamos generosamente el producto empleando una paletina.\n\nCómo restaurar un mueblePaso 6\nEn los orificios más pronunciados insertaremos el producto anticarcomal con una jeringuilla. A la hora de restaurar muebles, este tratamiento es fundamental aunque no tenga carcoma para así evitar su aparición y proteger el mueble.\n\nCómo restaurar un mueblePaso 7\nPara que el producto anticarcoma penetre profundamente en la madera, cubrimos el mueble con un plástico y lo cerramos perfectamente con una cinta adhesiva.\n\nNosotros nos hemos decantado por la cinta de carrocero, pero se puede utilizar otro cinta adhesiva.\n\nCómo restaurar un mueblePaso 8\nTranscurrido el tiempo que necesita el líquido para hacer su trabajo, retiramos el plástico y diluimos la resina con acetona.\n\nCuando el producto ya esté listo, llenamos la jeringuilla e introducimos la resina en los agujeros del mueble con el fin de consolidar la estructura.\n\nCómo restaurar un mueblePaso 9\nMientras el producto se seca, hacemos un agujero en la parte inferior del mueble utilizando el taladro y una broca-pala del diámetro adecuado, justo en el punto en el que irá la nueva pata delantera, .\n\nAplicamos cola de carpintero en las superficies a unir, insertamos el tubillón y fijamos la pata.\n\n</doc>",
            "response": "Claro, estaré encantado de ayudarte a restaurar un mueble antiguo. Aquí te presento un análisis paso a paso de cómo se pueden llevar a cabo estas tareas:\n\n    Limpieza y Reinserción de las Patas: Comienza limpiando bien el mueble con un limpiador superclean. Si detectas alguna mancha, puedes tratarla con disolventes o decapante según lo indique el fabricante. Una vez limpio, reemplaza las patas delanteras que están dañadas por la carcoma​.\n\nRestauración de la superficie: Aplica una primera capa de superclean sobre la superficie del mueble. Este producto ayuda a eliminar la suciedad y la grasa, preparándola para la aplicación de la pintura o el barniz. Luego, aplica una segunda capa de superclean y deja que se seque completamente​.\n\nReparación de la pintura o el barniz: Si el mueble tiene una superficie pintada o barnizzada, es necesario eliminarla. Aplica decapante y retira la pintura o el barniz utilizando una espátula. Finalmente, limpia el mueble con un trapo y disolvente para eliminar el disolvente​.\n\nReforzamiento de la estructura: Si el mueble tiene una estructura de madera débil, puedes reforzarla con resina. Esto implica cortar las partes deterioradas y reemplazarlas con piezas reforzadas. Luego, repite el proceso de lijado y pulido para abrir los poros de la madera​.\n\nTratamiento anticarcoma: Aplica un tratamiento anticarcoma en los orificos más pronunciados del mueble. Este tratamiento ayuda a prevenir la aparición de la carcoma y a conservar la madera. Es importante seguir las instrucciones del fabricante para aplicar este tratamiento correctamente​.\n\nMantenimiento posterior: Después de la restauración, es importante mantener el mueble en buen estado. Evita exponerlo a fuentes de calor y humedad, y asegúrate de limpiarlo regularmente para evitar la formación de moho o la corrosión. También puedes aplicar una segunda capa de superclean para mejorar el brillo final​​.\n\nEn resumen, la restauración de un mueble antiguo requiere un enfoque cuidadoso y detallado. Comience por limpiar y reparar las partes más dañadas, seguido de la aplicación de capas de superclean y pintura o barniz. Finalmente, asegúrese de realizar un tratamiento anticarcoma y un mantenimiento adecuado después de la restauración.",
            "reference": "Para restaurar un mueble antiguo, sigue estos pasos generales basados en varias fuentes:\n\n    Preparación:\n        Evaluación de Daños: Antes de comenzar, examina los daños y desperfectos del mueble para determinar los pasos a seguir​\n        \nLimpieza: Limpia bien el mueble, preferentemente con un producto como Superclean. Si la superficie está en buenas condiciones, puede que no necesites lijar en este punto​\n\nHerramientas y Materiales Necesarios:\n\n    Necesitarás lijas de varios tamaños y durezas, pinceles, trapos de algodón, destornilladores, cuchillas, estropajos de aluminio, algodón y una espátula​\n\nOtros materiales pueden incluir pistola de pintura, tablero y listones redondos de madera DM, y cola para madera​\n\nRestauración:\n\n    Tratamiento de Carcoma: Si el mueble tiene carcoma, este es el primer problema que debes tratar​\n\nPintura: Mezcla agua y chalk paint según las indicaciones del fabricante y pinta el mueble. Después de pintar, elimina el exceso de humedad con un paño y espera a que la madera se seque antes de lijar​\n\nEstos pasos generales te guiarán en el proceso, pero ten en cuenta que cada mueble puede requerir atención específica según su condición y estilo."
        },
        {
            "user_input": "indicaciones para restaurar mueble",
            "retrieved_contexts": "<doc>\n¿Qué necesitas para restaurar un mueble? Materiales básicos\n\nLas herramientas básicas para restaurar un mueble son: lijas de varios tamaños y durezas, pinceles, trapos de algodón, destornilladores, cuchillas, estropajos de aluminio, algodón y una espátula.\n\nA la hora de ponerte manos a la obra con la restauración de tu mueble, evita trabajar al aire libre: el viento y el sol resecan la madera y la pintura. </doc><doc>\nDespués de teñir la madera, puliremos la superficie para obtener un acabado perfecto. \nHerramientas para restaurar muebles\n\n    Palanqueta\n    Martillo\n    Sierra de costilla\n    Caja de ingletes\n    Lijadora\n    Lana de acero\n    Paletina\n    Jeringuilla\n    Taladro atornillador\n    Taco de lija de grano fino\n    Broca pala de Ø 20 mm\nMateriales para restaurar muebles\n\n    Aguarrás\n    Vaselina\n    Acetona\n    Alcohol 96º\n    Goma laca\n    Resina\n    Anilinas\n    Producto anticarcoma\n    Plástico\n    Cola blanca\n    Ceras\n    Trapos de algodón\n    Muñecas de algodón\n    Clavos de cabeza perdida\n    Tacos de madera de haya\n    Tubillón de Ø 20 mm\n    Tirafondos de 4 X 40 mm\n    Cinta de carrocero\n    Láminas de contrachapado\nPaso a paso para restaurar muebles\n\nCómo restaurar un mueblePaso 1\nPara restaurar muebles de madera cómodamente, debemos comenzar desmontando el mueble. Es conveniente numerar las piezas para que, a la hora de volver a colocarlas, saber exactamente donde van.\n\n</doc><doc>\nCómo restaurar un mueblePaso 10\nVamos ahora con las patas traseras. Empleando la sierra de costilla y una caja de ingletes, damos a los tacos la angulación necesaria. A continuación, aplicamos cola tanto en la base de las patas como en el mueble y ponemos las piezas.\n\nReforzamos las uniones con unos tirafondos. Tened en cuenta que el atornillador deberá tener una punta apropiada al tamaño y la forma de la cabeza del tirafondo.\n\nCómo restaurar un mueblePaso 11\nReconstruimos todas las piezas que estén deterioradas y las fijamos con cola de carpintero y tirafondos.\n\nNosotros, además de las patas, hemos tenido que hacer un nuevo travesaño, fijar bien los cajones y añadir alguna nueva pieza pequeña de madera.\n\nCómo restaurar un mueblePaso 12\nEs el turno de la marquetería. En la zona en la que el dibujo esté deteriorado, colocamos cinta de carrocero y marcamos con un lápiz la superficie que tenemos que renovar.\n\nCómo restaurar un mueblePaso 13\nA continuación, transportamos la cinta a la lámina de contrachapado y cortamos la pieza necesaria con la ayuda de un cortante. Emplearemos una regla o escuadra metálica a modo de guía.\n\nCómo restaurar un mueblePaso 14\nPegamos la chapa en el mueble con cola de carpintero y la amarramos con una pinza hasta que el producto se seque.\n\nDespués, retiramos la pinza y lijamos suavemente el borde. </doc><doc>\n¡La salud es lo primero!\nCómo restaurar un mueble. \nCómo restaurar un mueble antiguo paso a paso\nPaso 1. Limpia el mueble\n\nEs el primero paso para restaurar un mueble antiguo. Basta con pasarle un trapo humedecido en agua y un poco de jabón neutro, y dejarlo secar totalmente. Repasa las manchas en esquinas o molduras con un cepillo de dientes muy duro mojado en disolvente. El siguiente paso será eliminar la pintura o el barniz. Para ello, aplica decapante con una brocha y retíralo con una espátula. Repite la operación hasta eliminar el acabado, y limpia el mueble con un trapo y disolvente. Al final, pasa una lija fina.\n</doc><doc>\nPaso 10. Pule el mueble\nPara que el acabado final del mueble a restaurar sea más brillante, aplícale al menos una segunda capa, ya sea de barniz, de tinte o de goma laca. Es conveniente encerar la pieza una o dos veces al año para mantenerla en perfecto estado tras la restauración.\nPaso 11. Renueva la tapicería\n\nSi estás renovando una silla o una butaca y la tela no está muy deteriorada, basta con una puesta a punto para que esté como nueva. Desclávala con cuidado de la estructura y, para una limpieza a fondo, llévala a la tintorería. Posteriormente, grápala con una grapadora especial para tapizar. Si la tela original está inservible, créate una plantilla de la forma del tapizado original, recorta la nueva tela y grápala.\nCómo mantener un mueble restaurado\n\nEl mantenimiento de los muebles restaurados debe ser constante. En primer lugar, procura alejar el mueble de las fuentes de calor y humedad, y evita exponerlo al sol directo, ya que podría perder su color original. </doc>",
            "response": "Para restaurar un mueble, se necesitan materiales básicos y herramientas adecuadas. Los materiales básicos incluyen lijas de varios tamaños y durezas, pinceles, trapos de algodón, destornilladores, cuchillas, estropajos de aluminio, algodón y una espátula. Las herramientas básicas para restaurar muebles incluyen palanqueta, martillo, sierra de costilla, caja de ingletes, cinta de carrocero, láminas de contrachapado, y un truco de carpintero. Los materiales para restaurar muebles incluyen aguarrás, vaselina, acetona, alcohol 96º, goma laca, resina, anilinas, producto anticarcoma, plástico, cola blanca, cerdas, muñecas de algodón, clavos de cabeza perdida, tacos de madera de haya, tubillón de Ø 20 mm, tirafondos de 4 X 40 mm, cinta de carrocero, láminas de contrachapado. La restauración de muebles debe realizarse de manera cuidadosa y siguiendo un proceso paso a paso.",
            "reference": "Para restaurar un mueble antiguo, sigue estos pasos generales basados en varias fuentes:\n\n    Preparación:\n        Evaluación de Daños: Antes de comenzar, examina los daños y desperfectos del mueble para determinar los pasos a seguir​\n        \nLimpieza: Limpia bien el mueble, preferentemente con un producto como Superclean. Si la superficie está en buenas condiciones, puede que no necesites lijar en este punto​\n\nHerramientas y Materiales Necesarios:\n\n    Necesitarás lijas de varios tamaños y durezas, pinceles, trapos de algodón, destornilladores, cuchillas, estropajos de aluminio, algodón y una espátula​\n\nOtros materiales pueden incluir pistola de pintura, tablero y listones redondos de madera DM, y cola para madera​\n\nRestauración:\n\n    Tratamiento de Carcoma: Si el mueble tiene carcoma, este es el primer problema que debes tratar​\n\nPintura: Mezcla agua y chalk paint según las indicaciones del fabricante y pinta el mueble. Después de pintar, elimina el exceso de humedad con un paño y espera a que la madera se seque antes de lijar​\n\nEstos pasos generales te guiarán en el proceso, pero ten en cuenta que cada mueble puede requerir atención específica según su condición y estilo."
        },
        {
            "user_input": "Hola! ¿Podrías explicarme cuáles son los tres beneficios principales del Surya Namaskar?",
            "retrieved_contexts": "<doc>\nLa que practicamos en Satya es la variante de Hatha Yoga.\n\nSegún cita Satyananda en su libro \"Yogasanas – Pranayamas – Mudras – Bandhas» edición 1977, las 12 posturas de Surya Namakar y sus beneficios son los siguientes:\n\n \n\n \n\n    Pranamasana (postura de la oración): Establece un estado de concentración y calma como preparación para el siguiente ejercicio que ha de hacerse.\n    Jasta Uttanasana (postura de brazos levantados): Estira las vísceras abdominales, quitando el exceso de grasa y mejorando la digestión. Ejercita los músculos de los brazos y de los hombros. </doc><doc>\nPor otro lado, a nivel sutil, estimula y genera una gran distribución energética, eliminando así ciertos bloqueos. \n\nComo he comentado antes, puede practicarse como preparación para los asanas. En este caso, se puede empezar con un ritmo relativamente lento, sin intensificar las posturas. A medida que avanzamos en su práctica y ganamos flexibilidad, podemos ir aumentando tanto el ritmo como la intensidad, hasta conseguir una dinámica fluida, más parecida a una danza que a una secuencia de posturas separadas.\n\nEn cambio, si la finalidad es la práctica en sí misma, con un objetivo mental y espiritual, el ritmo será más lento. La respiración cobra más importancia y el movimiento se convierte en un acto espiritual de ofrenda, desarrollando la percepción y el contacto sutil.\n\nAdemás del goce de la práctica en sí misma, y de los beneficios de cada una de las posturas en particular, me sorprendió conocer los muchos e importantes beneficios que la secuencia completa de Surya Namaskar aporta a todos los niveles. \n\nHe aquí un resumen: \n\n    Flexibiliza la columna vertebral, así como las articulaciones en general.\n    </doc><doc>\nSaludo al sol o Surya Namaskar\nPor\nManuelMM\nSaludo-al-sol\n\nEl Saludo al sol, también llamado Surya Namaskar, es una secuencia de 12 posturas que se repiten varias veces. Cada movimiento está perfectamente sincronizado con la respiración. Además, este uno de los ejercicios del yoga más completos y aporta innumerables beneficios para el cuerpo y la mente.\n\nEl Saludo al Sol se suele realizar al comienzo de la práctica de yoga, ya que calienta y prepara el cuerpo para continuar con otros ejercicios. De hecho, puede formar parte de una sesión de yoga completa, pero también funcionar como ejercicio independiente.\n\n</doc><doc>\nSin duda alguna, es un excelente ritual para practicar por la mañana.\n\nNos permite conectar con nuestro cuerpo y con la energía del sol y del nuevo día. Precisamente de ahí viene su nombre: \"surya\" que significa sol y \"namaskar\" que significa saludo o prosternación.\n\nYo lo veo como una manera de honrar esta energía poderosa del sol y también como una forma de empezar el día desde una actitud de apertura, agradecimiento y  humildad.\n\nAunque practicarlo por la mañana es ideal, si nuestro horario no nos lo permite, merece la pena experimentar los beneficios de esta secuencia en cualquier otro momento del día.\n\nPor ejemplo, en las clases de yoga normalmente se practica al principio de la sesión como preparación para los asanas. Su propósito es calentar los músculos y articulaciones, tomar consciencia de la respiración y del propio cuerpo y calmar la mente.\nLos beneficios del saludo al sol\n\nSu práctica proporciona, al igual que el sol, una potente energía que va al cuerpo y a la mente.\n\nSe trata de un ejercicio super completo a nivel orgánico, ya que produce un beneficioso masaje interno, así como una mayor flexibilidad y resistencia.\n\n</doc><doc>\nEllo nos ayuda a realizar la práctica desde la consciencia.\nLos mantras de Surya Namaskar\n\n¿Sabías que asociada a cada una de las posturas de Surya Namakar hay un mantra?\n\nUn mantra es una composición de sílabas, palabras o frases, cuya repetición tiene una poderosa y penetrante influencia sobre la mente.\n\nEl mantra en el saludo al sol puede pronunciarse susurrando, en voz alta o mentalmente. Debido al efecto sutil que tienen las vibraciones de estos sonidos sobre la mente, sean o no audibles, su repetición potencia los efectos de la práctica.\n\nEn Satya nos gusta mucho practicar el saludo al sol de esta manera.\n\nEl mantra va marcando el ritmo a seguir y la vibración de cada mantra hace que la práctica sea más relajante y más profunda. \n\n Los mantras del sol o Surya mantras no son simplemente nombres, sino que cada una de las sílabas que los componen es un vehículo de una energía eterna esencial (Shakti) representada por el Sol mismo.\n\nLos mantras de cada postura se refieren a los diferentes nombres del dios Sol:\n\n    OM Mitraya namah (El amigo de todos)\n    OM Ravaye namah (Alabado por todos)\n    OM Suryaya namah (La guía de todos)\n    OM Bhanave namah (El dador de la belleza)\n    OM Khagaya namah (Estimulador de los sentidos)\n    OM Pushne namah (El sustentador de todo) \n    OM Hiranyagarbhaya namah (El creador)\n    OM Marichaye namah (Destructor enfermedad)\n    OM Adityaya namah (El inspirador)\n    OM Savitre namah (El purificador)\n    OM Arkaya namah (El radiante)\n    OM Bhaskaraya namah (El iluminador)\n\nEl \"om namah\" de cada frase significa «me postro o me inclino ante, saludo a».\n\nEn cuanto a la traducción de los mantras pueden encontrarse diferentes versiones o maneras de expresarlos manteniendo la misma esencia, que es honrar la energía del Sol, puedes ver un ejemplo en la ilustración anterior.\n</doc>",
            "response": "El Surya Namaskar es una serie de 12 posturas que se repiten varias veces, y cada una está perfectamente sincronizada con la respiración. Este ejercicio es muy completo y aporta varios beneficios para el cuerpo y la mente. Aquí te explico tres de los principales beneficios:\n\n    Calentamiento y Preparación para Asanas: Al practicar el Surya Namaskar, no solo se logra una mejor flexibilidad física, sino que también se calienta el cuerpo y la mente para poder realizar otros ejercicios de yoga o simplemente para el día a día. Esto es especialmente importante al principio de una sesión de yoga, ya que ayuda a preparar al cuerpo para los asanas más intensivos.\n\nBeneficios Orgánicos: El Surya Namaskar no solo es un ejercicio estético y visualmente atractivo, sino que también aporta varios beneficios orgánicos. Por ejemplo, puede ayudar a flexibilizar la columna vertebral y las articulaciones en general, lo que puede mejorar la movilidad y reducir el riesgo de lesiones. También puede ayudar a equilibrar los cuerpos vertebrales, lo que es beneficioso para la salud en general.\n\nEfecto Sólido: El Surya Namaskar también puede tener un efecto positivo en la energía y el bienestar emocional. Se cree que este ejercicio puede ayudar a conectar con la energía del sol y del nuevo día, lo que puede mejorar la energía y la motivación. Además, se dice que este ejercicio puede ayudar a purificar la mente y reducir el estrés.\n\nPráctica y Meditación: El Surya Namaskar se puede practicar tanto como ejercicio físico como como una práctica meditativa. Esto significa que no solo se trata de estirar y flexionar los músculos, sino que también se busca una conexión con la energía y la conciencia. Esto puede ayudar a mejorar la concentración y la claridad mental, así como a reducir el estrés y la ansiedad.\n\nEn resumen, el Surya Namaskar es un ejercicio completo y aporta varios beneficios para el cuerpo y la mente. Desde una perspectiva física hasta una espiritual, este ejercicio puede ayudar a mejorar la salud y el bienestar en general.",
            "reference": "Los tres beneficios principales del Surya Namaskar, o Saludo al Sol, son los siguientes:\n\n    Mejora de la Flexibilidad y la Fuerza:\n        El Surya Namaskar proporciona un estiramiento completo al cuerpo, mejorando la flexibilidad de la columna vertebral y las articulaciones.\n        Fortalece los músculos y articulaciones, mejorando la postura y reduciendo el riesgo de lesiones​.\n\nBeneficios para la Salud Mental y la Concentración:\n\n    La práctica del Saludo al Sol requiere un enfoque mental que mejora la concentración.\n    La coordinación de movimientos con la respiración durante esta secuencia ayuda a reducir el estrés y fomenta el bienestar espiritual​​.\n\nMejora de la Salud Física General:\n\n    Estimula y tonifica el sistema nervioso, revitalizándolo.\n    Equilibra el sistema endocrino, regulando las secreciones glandulares.\n    Mejora la digestión, asimilación y evacuación.\n    Normaliza la función renal.\n    Aumenta la capacidad pulmonar y mejora la circulación sanguínea​​.\n\nEstos beneficios reflejan cómo el Surya Namaskar actúa sobre el cuerpo, la mente y el espíritu, proporcionando un ejercicio completo y equilibrado."
        },
        {
            "user_input": "Cita tres beneficios que tiene la práctica del saludo al sol.",
            "retrieved_contexts": "<doc>\nSin duda alguna, es un excelente ritual para practicar por la mañana.\n\nNos permite conectar con nuestro cuerpo y con la energía del sol y del nuevo día. Precisamente de ahí viene su nombre: \"surya\" que significa sol y \"namaskar\" que significa saludo o prosternación.\n\nYo lo veo como una manera de honrar esta energía poderosa del sol y también como una forma de empezar el día desde una actitud de apertura, agradecimiento y  humildad.\n\nAunque practicarlo por la mañana es ideal, si nuestro horario no nos lo permite, merece la pena experimentar los beneficios de esta secuencia en cualquier otro momento del día.\n\nPor ejemplo, en las clases de yoga normalmente se practica al principio de la sesión como preparación para los asanas. Su propósito es calentar los músculos y articulaciones, tomar consciencia de la respiración y del propio cuerpo y calmar la mente.\nLos beneficios del saludo al sol\n\nSu práctica proporciona, al igual que el sol, una potente energía que va al cuerpo y a la mente.\n\nSe trata de un ejercicio super completo a nivel orgánico, ya que produce un beneficioso masaje interno, así como una mayor flexibilidad y resistencia.\n\n</doc><doc>\nSi este es tu caso, no te pierdas este artículo, porque hoy te explicaremos paso a paso cómo practicar este ejercicio de yoga en casa.\nBeneficios del Saludo al sol\n\nLas 12 posturas y las 7 asanas que conforman el Saludo al sol lo convierten en una práctica muy completa, con beneficios para el cuerpo, mente y espíritu. Algunas de las ventajas de esta práctica son:\n\n    Aporta mayor flexibilidad y fortaleza a los músculos y articulaciones.\n    </doc><doc>\nSaludo al sol o Surya Namaskar\nPor\nManuelMM\nSaludo-al-sol\n\nEl Saludo al sol, también llamado Surya Namaskar, es una secuencia de 12 posturas que se repiten varias veces. Cada movimiento está perfectamente sincronizado con la respiración. Además, este uno de los ejercicios del yoga más completos y aporta innumerables beneficios para el cuerpo y la mente.\n\nEl Saludo al Sol se suele realizar al comienzo de la práctica de yoga, ya que calienta y prepara el cuerpo para continuar con otros ejercicios. De hecho, puede formar parte de una sesión de yoga completa, pero también funcionar como ejercicio independiente.\n\n</doc><doc>\nAgudiza la memoria.\n\n¿Cómo se realiza el saludo al sol?\n\nEn realidad, existen muchas variantes de esta práctica. </doc><doc>\n¿Te animas a practicar el saludo al sol?\n\nEsta práctica es uno de los muchos legados que el yoga nos deja. A continuación te damos unos consejos para iniciarte en ella.\n\nSi nunca has realizado el saludo al sol, te sugerimos que empieces despacio, quedándote unos segundos respirando en cada postura. Así irás aprendiendo la secuencia y familiarizándote con cada asana.\n\nUna ronda completa de Surya Namaskar consiste en realizar las 12 posturas dos veces, una con cada pierna.\n\nEmpieza llevando la pierna izquierda atrás en la postura 2 y completa la secuencia volviendo con la pierna izquierda hacia delante en la postura 9.\n\nDespués, repite de nuevo la secuencia llevando la pierna derecha atrás en la postura 2 y, cuando vuelvas, la pierna derecha delante en la postura 9.\n\nRecuerda, cuando hayas completado los dos lados habrás hecho una ronda. Puedes practicar de este modo de 1 a 3 rondas para empezar.\n\nCuando ya te sepas las posturas, puedes empezar a practicarlo de forma dinámica, aumentando el ritmo progresivamente. Eso sí, ¡no te olvides nunca de la respiración!\n\nUna vez te salga de forma fluida, si quieres puedes introducir los mantras repitiéndolos mentalmente o en voz alta y así potenciar los beneficios de la práctica. También puedes practicar el saludo al sol con el mantra de fondo como hacemos en nuestro centro.\n\nPuedes practicarlo las veces que quieras ¡o las veces que el cuerpo te pida!\n\nNormalmente en las clases lo practicamos de 3 a 5 veces cuando la hacemos como preparación para la práctica. \n\nCuando consigas realizar el saludo al sol al ritmo del mantra y sincronizando la respiración con cada asana, ¡sus efectos en ti serán sorprendentes!\n\nSurya Namaskar es el ejercicio ideal para mejorar nuestra salud, por ello es recomendable a toda persona, esté enferma o sana, sea joven o vieja, niño o adulto, hombre o mujer… No hay límites para su práctica, cada uno hasta donde pueda llegar y a ritmo que sienta que debe seguir.\n¿Necesitas ayuda?\n\n</doc>",
            "response": "El saludo al sol, también conocido como Surya Namaskar, es una práctica de yoga que combina movimientos corporales y meditación consciente. Aquí te presento tres beneficios clave que ofrece:\n\n    Calentamiento y preparación: El saludo al sol puede ser utilizado como una práctica inicial en las clases de yoga, especialmente en las sesiones de preparación para asanas más avanzadas. Esta práctica ayuda a calentar los músculos y articulaciones, lo que es particularmente importante antes de realizar movimientos más agresivos.\n\n    Beneficios para el cuerpo y la mente: El saludo al sol no solo es un ejercicio de estiramiento y fortalecimiento muscular, sino que también aporta numerosos beneficios para el cuerpo y la mente. Esto se debe a que el saludo al sol es un ejercicio completo, que produce un masaje interno, mayor flexibilidad y resistencia. Por ejemplo, se ha observado que esta práctica ayuda a mejorar la flexibilidad y la fuerza muscular, así como reducir el riesgo de lesiones.\n\n    Practica y meditación: El saludo al sol puede ser practicado de diferentes maneras, como en silencio o con un mantra. Esta dualidad entre la práctica física y la meditación consciente es una característica clave de esta práctica. La meditación consciente es particularmente importante en el saludo al sol, ya que ayuda a conectar con el cuerpo y la energía del sol, lo que puede llevar a una mayor conexión con uno mismo y con la naturaleza.\n\nEn resumen, el saludo al sol es un ejercicio completo y poderoso que ofrece varios beneficios para la salud y la bienestar. Desde un punto de vista físico, puede ayudar a calentar y fortalecer los músculos, mientras que desde un punto de vista mental, puede mejorar la flexibilidad, la concentración y la conexión con la naturaleza.",
            "reference": "Los tres beneficios principales del Surya Namaskar, o Saludo al Sol, son los siguientes:\n\n    Mejora de la Flexibilidad y la Fuerza:\n        El Surya Namaskar proporciona un estiramiento completo al cuerpo, mejorando la flexibilidad de la columna vertebral y las articulaciones.\n        Fortalece los músculos y articulaciones, mejorando la postura y reduciendo el riesgo de lesiones​.\n\nBeneficios para la Salud Mental y la Concentración:\n\n    La práctica del Saludo al Sol requiere un enfoque mental que mejora la concentración.\n    La coordinación de movimientos con la respiración durante esta secuencia ayuda a reducir el estrés y fomenta el bienestar espiritual​​.\n\nMejora de la Salud Física General:\n\n    Estimula y tonifica el sistema nervioso, revitalizándolo.\n    Equilibra el sistema endocrino, regulando las secreciones glandulares.\n    Mejora la digestión, asimilación y evacuación.\n    Normaliza la función renal.\n    Aumenta la capacidad pulmonar y mejora la circulación sanguínea​​.\n\nEstos beneficios reflejan cómo el Surya Namaskar actúa sobre el cuerpo, la mente y el espíritu, proporcionando un ejercicio completo y equilibrado."
        },
        {
            "user_input": "¿Serías tan amable de explicarme los tres beneficios principales del saludo al sol en yoga, por favor?",
            "retrieved_contexts": "<doc>\nSi este es tu caso, no te pierdas este artículo, porque hoy te explicaremos paso a paso cómo practicar este ejercicio de yoga en casa.\nBeneficios del Saludo al sol\n\nLas 12 posturas y las 7 asanas que conforman el Saludo al sol lo convierten en una práctica muy completa, con beneficios para el cuerpo, mente y espíritu. Algunas de las ventajas de esta práctica son:\n\n    Aporta mayor flexibilidad y fortaleza a los músculos y articulaciones.\n    </doc><doc>\nSin duda alguna, es un excelente ritual para practicar por la mañana.\n\nNos permite conectar con nuestro cuerpo y con la energía del sol y del nuevo día. Precisamente de ahí viene su nombre: \"surya\" que significa sol y \"namaskar\" que significa saludo o prosternación.\n\nYo lo veo como una manera de honrar esta energía poderosa del sol y también como una forma de empezar el día desde una actitud de apertura, agradecimiento y  humildad.\n\nAunque practicarlo por la mañana es ideal, si nuestro horario no nos lo permite, merece la pena experimentar los beneficios de esta secuencia en cualquier otro momento del día.\n\nPor ejemplo, en las clases de yoga normalmente se practica al principio de la sesión como preparación para los asanas. Su propósito es calentar los músculos y articulaciones, tomar consciencia de la respiración y del propio cuerpo y calmar la mente.\nLos beneficios del saludo al sol\n\nSu práctica proporciona, al igual que el sol, una potente energía que va al cuerpo y a la mente.\n\nSe trata de un ejercicio super completo a nivel orgánico, ya que produce un beneficioso masaje interno, así como una mayor flexibilidad y resistencia.\n\n</doc><doc>\nSaludo al sol o Surya Namaskar\nPor\nManuelMM\nSaludo-al-sol\n\nEl Saludo al sol, también llamado Surya Namaskar, es una secuencia de 12 posturas que se repiten varias veces. Cada movimiento está perfectamente sincronizado con la respiración. Además, este uno de los ejercicios del yoga más completos y aporta innumerables beneficios para el cuerpo y la mente.\n\nEl Saludo al Sol se suele realizar al comienzo de la práctica de yoga, ya que calienta y prepara el cuerpo para continuar con otros ejercicios. De hecho, puede formar parte de una sesión de yoga completa, pero también funcionar como ejercicio independiente.\n\n</doc><doc>\n1. Pranamasana – Inhalar y exhalar\n\nEsta es la primera postura y la más sencilla del saludo al sol, también conocida como postura de la oración. Nos colocaremos de pie sobre la esterilla de yoga con la espalda recta y las piernas bien estiradas.\n\nJuntamos las palmas de las manos y las colocamos frente al pecho. Inhalamos y exhalamos profundamente.\n2. Urdhva hastasana – Inhalar\n\nLa siguiente es la postura de la flexión hacia atrás con los brazos levantados. Para llevarla a cabo mantenemos las manos juntas y levantamos los brazos mientras inhalamos profundamente.\n\nEstiramos todo lo que podamos el cuerpo, siempre con los músculos relajados. Después, arqueamos la espalda hacia atrás manteniendo los brazos levantados y empujamos la cadera hacia delante.\n</doc><doc>\n¿Te animas a practicar el saludo al sol?\n\nEsta práctica es uno de los muchos legados que el yoga nos deja. A continuación te damos unos consejos para iniciarte en ella.\n\nSi nunca has realizado el saludo al sol, te sugerimos que empieces despacio, quedándote unos segundos respirando en cada postura. Así irás aprendiendo la secuencia y familiarizándote con cada asana.\n\nUna ronda completa de Surya Namaskar consiste en realizar las 12 posturas dos veces, una con cada pierna.\n\nEmpieza llevando la pierna izquierda atrás en la postura 2 y completa la secuencia volviendo con la pierna izquierda hacia delante en la postura 9.\n\nDespués, repite de nuevo la secuencia llevando la pierna derecha atrás en la postura 2 y, cuando vuelvas, la pierna derecha delante en la postura 9.\n\nRecuerda, cuando hayas completado los dos lados habrás hecho una ronda. Puedes practicar de este modo de 1 a 3 rondas para empezar.\n\nCuando ya te sepas las posturas, puedes empezar a practicarlo de forma dinámica, aumentando el ritmo progresivamente. Eso sí, ¡no te olvides nunca de la respiración!\n\nUna vez te salga de forma fluida, si quieres puedes introducir los mantras repitiéndolos mentalmente o en voz alta y así potenciar los beneficios de la práctica. También puedes practicar el saludo al sol con el mantra de fondo como hacemos en nuestro centro.\n\nPuedes practicarlo las veces que quieras ¡o las veces que el cuerpo te pida!\n\nNormalmente en las clases lo practicamos de 3 a 5 veces cuando la hacemos como preparación para la práctica. \n\nCuando consigas realizar el saludo al sol al ritmo del mantra y sincronizando la respiración con cada asana, ¡sus efectos en ti serán sorprendentes!\n\nSurya Namaskar es el ejercicio ideal para mejorar nuestra salud, por ello es recomendable a toda persona, esté enferma o sana, sea joven o vieja, niño o adulto, hombre o mujer… No hay límites para su práctica, cada uno hasta donde pueda llegar y a ritmo que sienta que debe seguir.\n¿Necesitas ayuda?\n\n</doc>",
            "response": "El Saludo al Sol, también conocido como Surya Namaskar, es una práctica de yoga muy completa y completa que combina varios beneficios para el cuerpo, la mente y el espíritu. Aquí te explico tres de sus principales beneficios:\n\n    Flexibilidad y Fortaleza Muscular: El saludo al sol no solo es una forma de estirar y fortalecer los músculos y articulaciones, sino que también promueve la flexibilidad. Esto se logra a través de las posturas de estiramiento y la respiración profunda durante las sesiones de yoga​.\n\nEnergía Positiva y Gratitude: Este ejercicio se centra en la conexión con la energía del sol y el nuevo día, lo que puede ayudar a aumentar la energía positiva y fomentar la gratitud. Esto se logra mediante la práctica de la postura de la oración y la postura de la flexión hacia atrás con los brazos levantados​.\n\nCalma Mental y Concentración: La práctica del saludo al sol puede ayudar a calmar la mente y aumentar la concentración. Esto se logra a través de la respiración profunda y la conciencia plena durante las sesiones de yoga​.\n\nEn resumen, el saludo al sol es una práctica de yoga completa y completa que ofrece numerosos beneficios para el bienestar físico, mental y espiritual.",
            "reference": "Los tres beneficios principales del Surya Namaskar, o Saludo al Sol, son los siguientes:\n\n    Mejora de la Flexibilidad y la Fuerza:\n        El Surya Namaskar proporciona un estiramiento completo al cuerpo, mejorando la flexibilidad de la columna vertebral y las articulaciones.\n        Fortalece los músculos y articulaciones, mejorando la postura y reduciendo el riesgo de lesiones​.\n\nBeneficios para la Salud Mental y la Concentración:\n\n    La práctica del Saludo al Sol requiere un enfoque mental que mejora la concentración.\n    La coordinación de movimientos con la respiración durante esta secuencia ayuda a reducir el estrés y fomenta el bienestar espiritual​​.\n\nMejora de la Salud Física General:\n\n    Estimula y tonifica el sistema nervioso, revitalizándolo.\n    Equilibra el sistema endocrino, regulando las secreciones glandulares.\n    Mejora la digestión, asimilación y evacuación.\n    Normaliza la función renal.\n    Aumenta la capacidad pulmonar y mejora la circulación sanguínea​​.\n\nEstos beneficios reflejan cómo el Surya Namaskar actúa sobre el cuerpo, la mente y el espíritu, proporcionando un ejercicio completo y equilibrado."
        },
        {
            "user_input": "Buenas tardes, me gustaría ampliar un poco mis conocimientos sobre los beneficios del yoga, en concreto, de la práctica dle saludo al sol. ¿Podrías ayudarme con algo de información?",
            "retrieved_contexts": "<doc>\nSin duda alguna, es un excelente ritual para practicar por la mañana.\n\nNos permite conectar con nuestro cuerpo y con la energía del sol y del nuevo día. Precisamente de ahí viene su nombre: \"surya\" que significa sol y \"namaskar\" que significa saludo o prosternación.\n\nYo lo veo como una manera de honrar esta energía poderosa del sol y también como una forma de empezar el día desde una actitud de apertura, agradecimiento y  humildad.\n\nAunque practicarlo por la mañana es ideal, si nuestro horario no nos lo permite, merece la pena experimentar los beneficios de esta secuencia en cualquier otro momento del día.\n\nPor ejemplo, en las clases de yoga normalmente se practica al principio de la sesión como preparación para los asanas. Su propósito es calentar los músculos y articulaciones, tomar consciencia de la respiración y del propio cuerpo y calmar la mente.\nLos beneficios del saludo al sol\n\nSu práctica proporciona, al igual que el sol, una potente energía que va al cuerpo y a la mente.\n\nSe trata de un ejercicio super completo a nivel orgánico, ya que produce un beneficioso masaje interno, así como una mayor flexibilidad y resistencia.\n\n</doc><doc>\nSi este es tu caso, no te pierdas este artículo, porque hoy te explicaremos paso a paso cómo practicar este ejercicio de yoga en casa.\nBeneficios del Saludo al sol\n\nLas 12 posturas y las 7 asanas que conforman el Saludo al sol lo convierten en una práctica muy completa, con beneficios para el cuerpo, mente y espíritu. Algunas de las ventajas de esta práctica son:\n\n    Aporta mayor flexibilidad y fortaleza a los músculos y articulaciones.\n    </doc><doc>\nSaludo al sol o Surya Namaskar\nPor\nManuelMM\nSaludo-al-sol\n\nEl Saludo al sol, también llamado Surya Namaskar, es una secuencia de 12 posturas que se repiten varias veces. Cada movimiento está perfectamente sincronizado con la respiración. Además, este uno de los ejercicios del yoga más completos y aporta innumerables beneficios para el cuerpo y la mente.\n\nEl Saludo al Sol se suele realizar al comienzo de la práctica de yoga, ya que calienta y prepara el cuerpo para continuar con otros ejercicios. De hecho, puede formar parte de una sesión de yoga completa, pero también funcionar como ejercicio independiente.\n\n</doc><doc>\nNo te preocupes, sabemos que practicar el saludo al sol solo con la teoría es complicado. Por eso, aquí te dejamos un vídeo donde podrás ver la secuencia completa: \n\n \n\nY si con todo esto no es suficiente o simplemente quieres ser guiado por nosotros, puedes acudir a nuestras clases de yoga en Inca o bien apuntarte a nuestra escuela de yoga online . En ella podrás encontrar varios vídeos sobre Surya Namaskar, como por ejemplo: \n\n\"Aprendiendo Surya Namaskar – Estilo Hatha Yoga\" (23 minutos)\n\n\"Práctica Surya Namakar con mantra\" (25 minutos)\n\nAdemás, en nuestra escuela de yoga online tienes 14 días de prueba para poder asegurarte de que es lo que estabas buscando.\n\nY, como siempre, también puedes dejarme tu comentario aquí abajo.\n\n</doc><doc>\nComo ya sabes, no debes forzarte, llega hasta donde puedas.\nCómo hacer el Saludo al sol paso a paso\n\nYa conoces los beneficios de este ejercicio. ¿Estás listo/a para empezar? Hay diferentes tipos de yoga que realizan el Saludo al sol, con sus propias variaciones.\n\nA continuación, veremos el modo más extendido hoy en día, que es como se realiza en el Hatha yoga. Una vuelta completa son dos secuencias, una con el lado izquierdo y otra con el derecho.\n\n</doc>",
            "response": "Claro, estaré encantado de ayudarte a profundizar en los beneficios del yoga y en particular en la práctica del Saludo al sol. El yoga es una práctica integral que combina el cuerpo, la mente y el espíritu, y el Saludo al sol es una de sus formas más completas y beneficiosas.\n\nEl Saludo al sol, también conocido como Surya Namaskar, es una secuencia de 12 posturas que se repiten varias veces. Cada movimiento está perfectamente sincronizado con la respiración, lo que hace de este ejercicio un ejercicio de meditación y concentración. Este ejercicio tiene varios beneficios, entre los que se incluyen:\n\n    Calentamiento y preparación del cuerpo: El Saludo al sol ayuda a calentar y preparar el cuerpo para los ejercicios posteriores, lo que es especialmente importante en el yoga debido a su naturaleza fluida y fluidificante.\n\n    Mejora de la flexibilidad y resistencia: El Saludo al sol es un ejercicio completo que no solo fortalece los músculos y articulaciones, sino que también mejora la flexibilidad y la resistencia.\n\n    Aporta energía y bienestar emocional: El Saludo al sol es una forma de honrar y agradecer la energía del sol, lo que puede ayudar a aumentar la energía y mejorar el estado de ánimo.\n\n    Practicar el Saludo al sol al comienzo de una sesión de yoga puede ser una excelente manera de preparar el cuerpo y la mente para los ejercicios posteriores, lo que puede mejorar la calidad del ejercicio y reducir el riesgo de lesiones.\n\nPara practicar el Saludo al sol, sigue estos pasos:\n\n    Comienza con una postura de pie, como la postura del niño o la postura del niño sentado, para calentar los pies, las rodillas y los brazos.\n\n    Realiza la postura del niño sentado, que consiste en sentarse derecho y mantener la columna vertebral recta. Esto ayuda a estabilizar la espalda y a fortalecer los hombros y los brazos.\n\n    Prueba la postura del niño, que consiste en sentarse derecho y mantener la columna vertebral recta. Esto ayuda a estabilizar la espalda y a fortalecer los hombros y los brazos.\n\n    Realiza la postura del niño sentado, que consiste en sentarse derecho y mantener la columna vertebral recta. Esto ayuda a estabilizar la espalda y a fortalecer los hombros y los brazos.\n\n    Practica la postura del niño sentado, que consiste en sentarse derecho y mantener la columna vertebral recta. Esto ayuda a estabilizar la espalda y a fortalecer los hombros y los brazos.\n\n    Realiza la postura del niño sentado, que consiste en sentarse derecho y mantener la columna vertebral recta. Esto ayuda a estabilizar la espalda y a fortalecer los hombros y los brazos.\n\n    Practica la postura del niño sentado, que consiste en sentarse derecho y mantener la columna vertebral recta. Esto ayuda a estabilizar la espalda y a fortalecer los hombros y los brazos.\n\n    Realiza la postura del niño sentado, que consiste en sentarse derecho y mantener la columna vertebral recta. Esto ayuda a estabilizar la espalda y a fortalecer los hombros y los brazos.\n\n    Practica la postura del niño sentado, que consiste en sentarse derecho y mantener la columna vertebral recta. Esto ayuda a estabilizar la espalda y a fortalecer los hombros y los brazos.\n\n    Practica la postura del niño sentado, que consiste en sentarse derecho y mantener la columna vertebral recta. Esto ayuda a estabilizar la espalda y a fortalecer los hombros y los brazos.\n\n    Practica la postura del niño sentado, que consiste en sentarse derecho y mantener la columna vertebral recta. Esto ayuda a estabilizar la espalda y a fortalecer los hombros y los brazos.\n\n    Practica la postura del niño sentado, que consiste en sentarse derecho y mantener la columna vertebral recta. Esto ayuda a estabilizar la espalda y a fortalecer los hombros y los brazos.\n\n    Practica la postura del niño sentado, que consiste en sentarse derecho y mantener la columna vertebral recta. Esto ayuda a estabilizar la espalda y a fortalecer los hombros y los brazos.\n\n    Practica la postura del niño sentado, que consiste en sentarse derecho y mantener la columna vertebral recta. Esto ayuda a estabilizar la espalda y a fortalecer los hombros y los brazos.\n\n    Practica la postura del niño sentado, que consiste en sentarse derecho y mantener la columna vertebral recta. Esto ayuda a estabilizar la espalda y a fortalecer los hombros y los brazos.\n\n    Practica la postura del niño sentado, que consiste en sentarse derecho y mantener la columna vertebral recta. Esto ayuda a estabilizar la espalda y a fortalecer los hombros y los brazos.\n\n    Practica la postura del niño sentado, que consiste en sentarse derecho y mantener la columna vertebral recta. Esto ayuda a estabilizar la espalda y a fortalecer los hombros y los brazos.\n\n    Practica la postura del niño sentado, que consiste en sentarse derecho y mantener la columna vertebral recta. Esto ayuda a estabilizar la espalda y a fortalecer los hombros y los brazos.\n\n    Practica la postura del niño sentado, que consiste en sentarse derecho y mantener la columna vertebral recta. Esto ayuda a estabilizar la espalda y a fortalecer los hombros y los brazos.\n\n    Practica la postura del niño sentado, que consiste en sentarse derecho y mantener la columna vertebral recta. Esto ayuda a estabilizar la espalda y a fortalecer los hombros y los",
            "reference": "Los tres beneficios principales del Surya Namaskar, o Saludo al Sol, son los siguientes:\n\n    Mejora de la Flexibilidad y la Fuerza:\n        El Surya Namaskar proporciona un estiramiento completo al cuerpo, mejorando la flexibilidad de la columna vertebral y las articulaciones.\n        Fortalece los músculos y articulaciones, mejorando la postura y reduciendo el riesgo de lesiones​.\n\nBeneficios para la Salud Mental y la Concentración:\n\n    La práctica del Saludo al Sol requiere un enfoque mental que mejora la concentración.\n    La coordinación de movimientos con la respiración durante esta secuencia ayuda a reducir el estrés y fomenta el bienestar espiritual​​.\n\nMejora de la Salud Física General:\n\n    Estimula y tonifica el sistema nervioso, revitalizándolo.\n    Equilibra el sistema endocrino, regulando las secreciones glandulares.\n    Mejora la digestión, asimilación y evacuación.\n    Normaliza la función renal.\n    Aumenta la capacidad pulmonar y mejora la circulación sanguínea​​.\n\nEstos beneficios reflejan cómo el Surya Namaskar actúa sobre el cuerpo, la mente y el espíritu, proporcionando un ejercicio completo y equilibrado."
        },
        {
            "user_input": "necesito buscar un parking o algo en la calle Bailén o alrededores",
            "retrieved_contexts": "<doc>\nDESDE 15€/DÍA\n\nParking en madrid\nEncuentra el parking más cercano a tu destino.\nPARKING EN LA ZONA DE LA CALLE BAILÉN\nParking en la zona de la calle Bailén\nBuscar aparcamiento en Madrid se convierte, diariamente, en un problema para numerosos conductores. Tanto conductores que conocen la zona donde quieren aparcar, como otros que la visitan por primera vez, hallan innumerables problemas sobre todo en días de mucha afluencia de tráfico. Mediante un parking en la zona de la calle Bailén, todo aquel que desee estacionar en o cerca de esta importante calle de Madrid, podrá sentirse seguro al dejar su coche bajo la supervisión de profesionales.\n\nTecnología al servicio de la vigilancia en los parkings\n\nHoy en día los aparcamientos deben estar perfectamente acondicionados si se quiere disfrutar de espacios adecuados para todo tipo de coches. </doc><doc>\nEl parking subterráneo de la plaza es una opción segura para dejar tu vehículo, aunque puede resultar algo costoso.\n\nTipo de parking\tCoste por hora\tDificultad para aparcar\nParking subterráneo\t3,00eur.\tMedia\nCalle Bailén\nLa Calle Bailén, situada justo detrás del Palacio Real, es una zona de estacionamiento regulado, conocida como zona azul. Aunque suele tener bastante flujo de vehículos, si tienes paciencia es posible encontrar sitio. </doc><doc>\nParking Plaza de Oriente APK2\nCalle de Bailén, 6\n186 opiniones\nicon contactless\nEntrada y salida sin contacto\nPuedes entrar y salir de este parking de manera automática, sin necesidad de coger tícket o pasar por cabina de control.\n\nDetalles: Sobre el parking\nEl acceso principal del parking que va desde Plaza España hasta la calle Bailén está cortado por obras. Podrás acceder a este parking en la Plaza de Oriente: - Desde Puerta de Toledo hasta Calle Bailén. - Desde el Puente de Segovia, pasando por Cuesta de la Vega. </doc><doc>\n------------------------------ Aparcamiento situado dentro de MADRID CENTRAL. ¡No hay multas en Madrid Central si reservas con Parclick! Lo único que necesitas es tu reserva y tener pegada tu etiqueta medioambiental (0, ECO, C o B). Con este parking vigilado, el parking Plaza de Oriente vas a aparcar en el centro de Madrid y salir a las principales atracciones turísticas como el Palacio Real, la Plaza de Oriente, o la Catedral de la Almudena. Además, puedes aparcar tu autobús en el centro de Madrid en este parking cubierto. Un punto fuerte de este parking APK2 Plaza de Oriente es su fácil acceso, ya que tiene una entrada especialmente adaptada para autobuses. Entras en el túnel de la Calle Bailén, avanzas un poco y te desvías a la derecha, directo al parking. Una vez allí, tienes 30 plazas donde aparcar tu autobús. Esto te vendrá de perlas si vienes en grupo a Madrid y no quieres perder ni un segundo de tu tiempo en transporte. Además, es un parking abierto 24h, por lo que el horario de llegada no va a ser ningún problema para ti. Ahora que has visto que aparcar tu autobús en Madrid es posible y te hemos explicado las ventajas de aparcar en el APK2 Plaza de Oriente, ¿a qué estás esperando para reservar tu plaza ya? Reserva una plaza en el Parking APK2 Plaza de Oriente, ubicado en la Calle de Bailén, 6. \nParking Plaza de Oriente APK2 14218Parking Plaza de Oriente APK2 14219\n+5\nVer todas\n¿Cómo llegar?\nHORARIO DEL PARKING\nAbierto las 24 horas del díaIcon Marker\n\n¿Cómo acceder?\n</doc><doc>\nNota: Ten en cuenta que puede ser más difícil encontrar un lugar durante los días de partido o durante eventos especiales.\n\nEstacionamiento de la Universidad Politécnica de Madrid\nOtro lugar donde puedes aparcar gratis cerca de cerca dpalacio real es el estacionamiento de la Universidad Politécnica de Madrid, ubicada en Paseo Juan XXIII, 11. Este aparcamiento está a unos 30 minutos a pie de cerca dpalacio real, pero es una opción conveniente si no te importa caminar un poco.\n\nPara llegar desde cerca dpalacio real, toma Calle Bailén hacia el norte hasta llegar a Calle Mayor. Gira a la derecha en Calle Mayor y sigue hasta llegar a Plaza de la Villa. Gira a la izquierda en Plaza de la Villa y continúa hasta llegar a Calle de Segovia. Gira a la derecha en Calle de Segovia y sigue hasta llegar a Paseo de Extremadura.\n\nNota: Ten en cuenta que este aparcamiento puede estar más ocupado durante el día debido a la actividad universitaria, pero suele haber más disponibilidad por la noche y durante el fin de semana.</doc>",
            "response": "Para encontrar un parking en la zona de la calle Bailén en Madrid, hay varios lugares que puedes considerar:\n\n    Plaza de Oriente: Este parking cubierto se encuentra en la calle Bailén, cerca de la Plaza de Oriente. Ofrece una buena cantidad de plazas y es accesible tanto para vehículos como para autobuses, con una entrada especialmente adaptada para autobuses. El horario de llegada es flexible y el parking está abierto 24 horas​.\n\nParking de la Universidad Politécnica de Madrid: Si prefieres estacionar cerca del Palacio Real, el estacionamiento de la Universidad Politécnica de Madrid se encuentra en Paseo Juan XXIII, 11. Esta opción es conveniente si no te importa caminar un poco, y es más económica que otros parkings cercanos​.\n\nEstacionamiento de la Universidad Complutense de Madrid: Este aparcamiento se encuentra en la calle Mayor, y es accesible tanto para vehículos como para autobuses. La plaza de la Universidad Complutense de Madrid se encuentra a poca distancia, y es ideal para llegar al centro de Madrid​.\n\nEn general, es importante tener en cuenta que los parkings pueden estar ocupados durante los días de partido o durante eventos especiales, por lo que es recomendable verificar el horario y disponibilidad antes de llegar. Además, siempre es mejor llevar contigo un mapa o una aplicación de GPS para facilitar la ubicación y el acceso a los parkings.",
            "reference": "Para aparcar cerca de la calle Bailén en Madrid, tienes varias opciones:\n\nParking Público Cubierto cerca de Príncipe Pío: Está a solo 3 minutos a pie del centro comercial Príncipe Pío, seguro y accesible las 24 horas del día, los 7 días de la semana​​.\n\nZona Azul en la Calle Bailén: Esta área, justo detrás del Palacio Real, ofrece estacionamiento regulado. Aunque suele haber bastante flujo de vehículos, es posible encontrar sitio con paciencia​​.\n\nOtras Opciones de Parking en la Zona: Existen diferentes opciones con tarifas que comienzan desde los 15€ por día​​.\n\nParquímetros en la Calle de Bailén: También puedes encontrar tarifas de aparcamiento y horarios para los parquímetros en la Calle de Bailén​​.\n\nParking Plaza de Oriente APK2: Este parking se encuentra en la Calle de Bailén, 6, y se puede acceder a él desde varias rutas como Puerta de Toledo y Puente de Segovia​​."
        },
        {
            "user_input": "necesito buscar aparcamiento en la calle Bailén, me ayudas?",
            "retrieved_contexts": "<doc>\nDESDE 15€/DÍA\n\nParking en madrid\nEncuentra el parking más cercano a tu destino.\nPARKING EN LA ZONA DE LA CALLE BAILÉN\nParking en la zona de la calle Bailén\nBuscar aparcamiento en Madrid se convierte, diariamente, en un problema para numerosos conductores. Tanto conductores que conocen la zona donde quieren aparcar, como otros que la visitan por primera vez, hallan innumerables problemas sobre todo en días de mucha afluencia de tráfico. Mediante un parking en la zona de la calle Bailén, todo aquel que desee estacionar en o cerca de esta importante calle de Madrid, podrá sentirse seguro al dejar su coche bajo la supervisión de profesionales.\n\nTecnología al servicio de la vigilancia en los parkings\n\nHoy en día los aparcamientos deben estar perfectamente acondicionados si se quiere disfrutar de espacios adecuados para todo tipo de coches. </doc><doc>\nParking Plaza de Oriente APK2\nCalle de Bailén, 6\n186 opiniones\nicon contactless\nEntrada y salida sin contacto\nPuedes entrar y salir de este parking de manera automática, sin necesidad de coger tícket o pasar por cabina de control.\n\nDetalles: Sobre el parking\nEl acceso principal del parking que va desde Plaza España hasta la calle Bailén está cortado por obras. Podrás acceder a este parking en la Plaza de Oriente: - Desde Puerta de Toledo hasta Calle Bailén. - Desde el Puente de Segovia, pasando por Cuesta de la Vega. </doc><doc>\nEl parking subterráneo de la plaza es una opción segura para dejar tu vehículo, aunque puede resultar algo costoso.\n\nTipo de parking\tCoste por hora\tDificultad para aparcar\nParking subterráneo\t3,00eur.\tMedia\nCalle Bailén\nLa Calle Bailén, situada justo detrás del Palacio Real, es una zona de estacionamiento regulado, conocida como zona azul. Aunque suele tener bastante flujo de vehículos, si tienes paciencia es posible encontrar sitio. </doc><doc>\n------------------------------ Aparcamiento situado dentro de MADRID CENTRAL. ¡No hay multas en Madrid Central si reservas con Parclick! Lo único que necesitas es tu reserva y tener pegada tu etiqueta medioambiental (0, ECO, C o B). Con este parking vigilado, el parking Plaza de Oriente vas a aparcar en el centro de Madrid y salir a las principales atracciones turísticas como el Palacio Real, la Plaza de Oriente, o la Catedral de la Almudena. Además, puedes aparcar tu autobús en el centro de Madrid en este parking cubierto. Un punto fuerte de este parking APK2 Plaza de Oriente es su fácil acceso, ya que tiene una entrada especialmente adaptada para autobuses. Entras en el túnel de la Calle Bailén, avanzas un poco y te desvías a la derecha, directo al parking. Una vez allí, tienes 30 plazas donde aparcar tu autobús. Esto te vendrá de perlas si vienes en grupo a Madrid y no quieres perder ni un segundo de tu tiempo en transporte. Además, es un parking abierto 24h, por lo que el horario de llegada no va a ser ningún problema para ti. Ahora que has visto que aparcar tu autobús en Madrid es posible y te hemos explicado las ventajas de aparcar en el APK2 Plaza de Oriente, ¿a qué estás esperando para reservar tu plaza ya? Reserva una plaza en el Parking APK2 Plaza de Oriente, ubicado en la Calle de Bailén, 6. \nParking Plaza de Oriente APK2 14218Parking Plaza de Oriente APK2 14219\n+5\nVer todas\n¿Cómo llegar?\nHORARIO DEL PARKING\nAbierto las 24 horas del díaIcon Marker\n\n¿Cómo acceder?\n</doc><doc>\nA TU LLEGADA:\n\nSi llegas con más antelación, la barrera no se abrirá automáticamente y te aparecerá el siguiente mensaje: Fuera de periodo de validez. Debes coger un ticket y llamar a interfonía o dirigirte a cabina de control con tu reserva.\n\n\n\nSi llegas al parki ... \n\n\n\n\n\n\n\n\n\n\n\n\n\n\n\n\n\n\n\n\n\n\n\n\n\n\n\n\nEntrada al parking\nCalle de Bailén, 6\nCalle de San Quintín, 13\nEntradas peatonales\nPlaza de Oriente, 1\nPlaza de Oriente 1\nTipos de productos disponibles\nPase básico\nUNA ENTRADA Y UNA SALIDA\n2,50 €</doc>",
            "response": "Claro, estaré encantado de ayudarte a encontrar un aparcamiento en la calle Bailén. Aquí te proporciono dos opciones basadas en las opiniones de los usuarios:\n\n    Parkings en la Zona de la Calle Bailén\n    Parking en la Zona de la Calle Bailén\n\n    Parkings en la Zona de la Calle Bailén\n\n        Parkings en la Zona de la Calle Bailén\n\n        Busca aparcamiento en Madrid se convierte, diariamente, en un problema para numerosos conductores. Tanto conductores que conocen la zona donde quieren aparcar, como otros que la visitan por primera vez, hallan innumerables problemas sobre todo en días de mucha afluencia de tráfico. Mediante un parking en la zona de la calle Bailén, todo aquel que desee estacionar en o cerca de esta importante calle de Madrid, podrá sentirse seguro al dejar su coche bajo la supervisión de profesionales.\n\n    Tecnología al servicio de la vigilancia en los parkings\n\nHoy en día los aparcamientos deben estar perfectamente acondicionados si se quiere disfrutar de espacios adecuados para todo tipo de coches.\n\n    El acceso principal del parking que va desde Plaza España hasta la calle Bailén está cortado por obras. Podrás acceder a este parking en la Plaza de Oriente: - Desde Puerta de Toledo hasta Calle Bailén. - Desde el Puente de Segovia, pasando por Cuesta de la Vega.\n\n    La Calle Bailén, situada justo detrás del Palacio Real, es una zona de estacionamiento regulado, conocida como zona azul. Aunque suele tener bastante flujo de vehículos, si tienes paciencia es posible encontrar sitio.\n\n    El parking subterráneo de la plaza es una opción segura para dejar tu vehículo, aunque puede resultar algo costoso.\n\n    Tipo de parking\n    Coste por hora\n    Dificultad para aparcar\n    Parking subterráneo\n    3,00€\n    Media\n    Calle Bailén\n\n    La entrada al parking es en la calle de Bailén, 6. La Calle Bailén, situada justo detrás del Palacio Real, es una zona de estacionamiento regulado, conocida como zona azul. Aunque suele tener bastante flujo de vehículos, si tienes paciencia es posible encontrar sitio.\n\n    La Calle Bailén, situada justo detrás del Palacio Real, es una zona de estacionamiento regulado, conocida como zona azul. Aunque suele tener bastante flujo de vehículos, si tienes paciencia es posible encontrar sitio.\n\n    El parking subterráneo de la plaza es una opción segura para dejar tu vehículo, aunque puede resultar algo costoso.\n\n    Tipo de parking\n    Coste por hora\n    Dificultad para aparcar\n    Parking subterráneo\n    3,00€\n    Media\n    Calle Bailén\n\n    La entrada al parking es en la calle de Bailén, 6. La Calle Bailén, situada justo detrás del Palacio Real, es una zona de estacionamiento regulado, conocida como zona azul. Aunque suele tener bastante flujo de vehículos, si tienes paciencia es posible encontrar sitio.\n\n    La Calle Bailén, situada justo detrás del Palacio Real, es una zona de estacionamiento regulado, conocida como zona azul. Aunque suele tener bastante flujo de vehículos, si tienes paciencia es posible encontrar sitio.\n\n    El parking subterráneo de la plaza es una opción segura para dejar tu vehículo, aunque puede resultar algo costoso.\n\n    Tipo de parking\n    Coste por hora\n    Dificultad para aparcar\n    Parking subterráneo\n    3,00€\n    Media\n    Calle Bailén\n\n    La entrada al parking es en la calle de Bailén, 6. La Calle Bailén, situada justo detrás del Palacio Real, es una zona de estacionamiento regulado, conocida como zona azul. Aunque suele tener bastante flujo de vehículos, si tienes paciencia es posible encontrar sitio.\n\n    La Calle Bailén, situada justo detrás del Palacio Real, es una zona de estacionamiento regulado, conocida como zona azul. Aunque suele tener bastante flujo de vehículos, si tienes paciencia es posible encontrar sitio.\n\n    El parking subterráneo de la plaza es una opción segura para dejar tu vehículo, aunque puede resultar algo costoso.\n\n    Tipo de parking\n    Coste por hora\n    Dificultad para aparcar\n    Parking subterráneo\n    3,00€\n    Media\n    Calle Bailén\n\n    La entrada al parking es en la calle de Bailén, 6. La Calle Bailén, situada justo detrás del Palacio Real, es una zona de estacionamiento regulado, conocida como zona azul. Aunque suele tener bastante flujo de vehículos, si tienes paciencia es posible encontrar sitio.\n\n    La Calle Bailén, situada justo detrás del Palacio Real, es una zona de estacionamiento regulado, conocida como zona azul. Aunque suele tener bastante flujo de vehículos, si tienes paciencia es posible encontrar sitio.\n\n    El parking subterráneo de la plaza es una opción segura para dejar tu vehículo, aunque puede resultar algo costoso.\n\n    Tipo de parking\n    Coste por hora\n    Dificultad para aparcar\n    Parking subterráneo\n    3,00€\n    Media\n    Calle Bailén\n\n    La entrada al parking es en la calle de Bailén, 6. La Calle Bailén, situada justo detrás del Palacio Real, es una zona de estacionamiento regulado, conocida como zona azul. Aunque suele tener bastante flujo de vehículos, si tienes paciencia es posible encontrar sitio.\n\n    La Calle Bailén, situada justo detr\n\n    El parking subterráneo de la plaza es una opción segura para dejar tu vehículo, aunque puede resultar algo costoso.\n\n    Tipo de parking\n    Coste por hora\n    Dificultad para aparcar\n    Parking subterráneo\n    3,00€\n    Media\n    Calle Bailén\n\n    La entrada al parking es en la calle de Bailén, 6. La Calle Bailén, situada justo detr\n\n    La Calle Bailén, situada justo detr\n\n    La entrada al parking es en la calle de Bailén, 6. La Calle Bailén, situada justo detr\n\n    El parking subterráneo de la plaza es una opción segura para dejar tu vehículo, aunque puede resultar algo costoso.\n\n    Tipo de parking\n    Coste por hora\n    Dificultad para aparcar\n    Parking subterráneo\n    3,00€\n    Media\n    Calle Bailén\n\n    La entrada al parking es en la calle de Bailén, 6. La Calle Bailén, situada justo detr\n\n    La entrada al parking es en la calle de Bailén, 6. La Calle Bailén, situada justo detr\n\n    El parking subterráneo de la plaza es una opción segura para dejar tu vehículo, aunque puede resultar algo costoso.\n\n    Tipo de parking\n    Coste por hora\n    Dificultad para aparcar\n    Parking subterráneo\n    3,00€\n    Media\n    Calle Bailén\n\n    La entrada al parking es en la calle de Bailén, 6. La Calle Bailén, situada justo detr\n\n    La entrada al parking es en la calle de Bailén, 6. La Calle Bailén, situada justo detr\n\n    El parking subterráneo de la plaza es una opción segura para dejar tu vehículo, aunque puede resultar algo costoso.\n\n    Tipo de parking\n    Coste por hora\n    Dificultad para aparcar\n    Parking subterráneo\n    3,00€\n    Media\n    Calle Bailén\n\n    La entrada al parking es en la calle de Bailén, 6. La Calle Bailén, situada justo detr\n\n    La entrada al parking es en la calle de Bailén, 6. La Calle Bailén, situada justo detr\n\n    El parking subterráneo de la plaza es una opción segura para dejar tu vehículo, aunque puede resultar algo costoso.\n\n    Tipo de parking\n    Coste por hora\n    Dificultad para aparcar\n    Parking subterráneo\n    3,00€\n    Media\n    Calle Bailén\n\n    La entrada al parking es en la calle de Bailén, 6. La Calle Bailén, situada justo detr\n\n    La entrada al parking es en la calle de Bailén, 6. La Calle Bailén, situada justo detr\n\n    El parking subterráneo de la plaza es una opción segura para dejar tu vehículo, aunque puede resultar algo costoso.\n\n    Tipo de parking\n    Coste por hora\n    Dificultad para aparcar\n    Parking subterráneo\n    3,00€\n    Media\n    Calle Bail",
            "reference": "Para aparcar cerca de la calle Bailén en Madrid, tienes varias opciones:\n\nParking Público Cubierto cerca de Príncipe Pío: Está a solo 3 minutos a pie del centro comercial Príncipe Pío, seguro y accesible las 24 horas del día, los 7 días de la semana​​.\n\nZona Azul en la Calle Bailén: Esta área, justo detrás del Palacio Real, ofrece estacionamiento regulado. Aunque suele haber bastante flujo de vehículos, es posible encontrar sitio con paciencia​​.\n\nOtras Opciones de Parking en la Zona: Existen diferentes opciones con tarifas que comienzan desde los 15€ por día​​.\n\nParquímetros en la Calle de Bailén: También puedes encontrar tarifas de aparcamiento y horarios para los parquímetros en la Calle de Bailén​​.\n\nParking Plaza de Oriente APK2: Este parking se encuentra en la Calle de Bailén, 6, y se puede acceder a él desde varias rutas como Puerta de Toledo y Puente de Segovia​​."
        },
        {
            "user_input": "Hola, ¿dónde me recomiendas aparcar si voy a la calle Bailén?",
            "retrieved_contexts": "<doc>\nDESDE 15€/DÍA\n\nParking en madrid\nEncuentra el parking más cercano a tu destino.\nPARKING EN LA ZONA DE LA CALLE BAILÉN\nParking en la zona de la calle Bailén\nBuscar aparcamiento en Madrid se convierte, diariamente, en un problema para numerosos conductores. Tanto conductores que conocen la zona donde quieren aparcar, como otros que la visitan por primera vez, hallan innumerables problemas sobre todo en días de mucha afluencia de tráfico. Mediante un parking en la zona de la calle Bailén, todo aquel que desee estacionar en o cerca de esta importante calle de Madrid, podrá sentirse seguro al dejar su coche bajo la supervisión de profesionales.\n\nTecnología al servicio de la vigilancia en los parkings\n\nHoy en día los aparcamientos deben estar perfectamente acondicionados si se quiere disfrutar de espacios adecuados para todo tipo de coches. </doc><doc>\nEl parking subterráneo de la plaza es una opción segura para dejar tu vehículo, aunque puede resultar algo costoso.\n\nTipo de parking\tCoste por hora\tDificultad para aparcar\nParking subterráneo\t3,00eur.\tMedia\nCalle Bailén\nLa Calle Bailén, situada justo detrás del Palacio Real, es una zona de estacionamiento regulado, conocida como zona azul. Aunque suele tener bastante flujo de vehículos, si tienes paciencia es posible encontrar sitio. </doc><doc>\nParking Plaza de Oriente APK2\nCalle de Bailén, 6\n186 opiniones\nicon contactless\nEntrada y salida sin contacto\nPuedes entrar y salir de este parking de manera automática, sin necesidad de coger tícket o pasar por cabina de control.\n\nDetalles: Sobre el parking\nEl acceso principal del parking que va desde Plaza España hasta la calle Bailén está cortado por obras. Podrás acceder a este parking en la Plaza de Oriente: - Desde Puerta de Toledo hasta Calle Bailén. - Desde el Puente de Segovia, pasando por Cuesta de la Vega. </doc><doc>\nA TU LLEGADA:\n\nSi llegas con más antelación, la barrera no se abrirá automáticamente y te aparecerá el siguiente mensaje: Fuera de periodo de validez. Debes coger un ticket y llamar a interfonía o dirigirte a cabina de control con tu reserva.\n\n\n\nSi llegas al parki ... \n\n\n\n\n\n\n\n\n\n\n\n\n\n\n\n\n\n\n\n\n\n\n\n\n\n\n\n\nEntrada al parking\nCalle de Bailén, 6\nCalle de San Quintín, 13\nEntradas peatonales\nPlaza de Oriente, 1\nPlaza de Oriente 1\nTipos de productos disponibles\nPase básico\nUNA ENTRADA Y UNA SALIDA\n2,50 €</doc><doc>\n------------------------------ Aparcamiento situado dentro de MADRID CENTRAL. ¡No hay multas en Madrid Central si reservas con Parclick! Lo único que necesitas es tu reserva y tener pegada tu etiqueta medioambiental (0, ECO, C o B). Con este parking vigilado, el parking Plaza de Oriente vas a aparcar en el centro de Madrid y salir a las principales atracciones turísticas como el Palacio Real, la Plaza de Oriente, o la Catedral de la Almudena. Además, puedes aparcar tu autobús en el centro de Madrid en este parking cubierto. Un punto fuerte de este parking APK2 Plaza de Oriente es su fácil acceso, ya que tiene una entrada especialmente adaptada para autobuses. Entras en el túnel de la Calle Bailén, avanzas un poco y te desvías a la derecha, directo al parking. Una vez allí, tienes 30 plazas donde aparcar tu autobús. Esto te vendrá de perlas si vienes en grupo a Madrid y no quieres perder ni un segundo de tu tiempo en transporte. Además, es un parking abierto 24h, por lo que el horario de llegada no va a ser ningún problema para ti. Ahora que has visto que aparcar tu autobús en Madrid es posible y te hemos explicado las ventajas de aparcar en el APK2 Plaza de Oriente, ¿a qué estás esperando para reservar tu plaza ya? Reserva una plaza en el Parking APK2 Plaza de Oriente, ubicado en la Calle de Bailén, 6. \nParking Plaza de Oriente APK2 14218Parking Plaza de Oriente APK2 14219\n+5\nVer todas\n¿Cómo llegar?\nHORARIO DEL PARKING\nAbierto las 24 horas del díaIcon Marker\n\n¿Cómo acceder?\n</doc>",
            "response": "Para encontrar el mejor parking en la zona de la calle Bailén, es importante tener en cuenta varios factores:\n\n    Dificultad para aparcar: Algunas calles pueden tener dificultades específicas para el estacionamiento, como calles angostas o áreas reducidas. Busca un parking que ofrezca suficientes espacios y una buena accesibilidad​.\n\nCosto: Los precios por hora varían entre diferentes parkings, así que es importante comparar diferentes opciones para encontrar el que ofrece el mejor valor por tu dinero​.\n\nVigilancia y seguridad: Busca parkings con sistemas de vigilancia avanzados y cámaras para garantizar una seguridad adecuada. Esto incluye el acceso a un sistema de pago electrónico sin contacto y la posibilidad de pagar con tarjeta de crédito​.\n\nCalidad del espacio: Asegúrate de que el espacio esté limpio, bien iluminado y tenga las instalaciones necesarias, como lavaplatos, baños y cubiertos para el auto​.\n\nEn cuanto a la opción recomendada, te recomiendo el parking subterráneo de la plaza de Oriente. Este parking es seguro y cuenta con un sistema de pago electrónico sin contacto. Además, es accesible desde varias calles, lo que facilita su ubicación y acceso. Sin embargo, ten en cuenta que puede haber multas en Madrid Central si no reservas con Parclick, pero en este caso, la opción de reservar con Parclick no está disponible en este parking.",
            "reference": "Para aparcar cerca de la calle Bailén en Madrid, tienes varias opciones:\n\nParking Público Cubierto cerca de Príncipe Pío: Está a solo 3 minutos a pie del centro comercial Príncipe Pío, seguro y accesible las 24 horas del día, los 7 días de la semana​​.\n\nZona Azul en la Calle Bailén: Esta área, justo detrás del Palacio Real, ofrece estacionamiento regulado. Aunque suele haber bastante flujo de vehículos, es posible encontrar sitio con paciencia​​.\n\nOtras Opciones de Parking en la Zona: Existen diferentes opciones con tarifas que comienzan desde los 15€ por día​​.\n\nParquímetros en la Calle de Bailén: También puedes encontrar tarifas de aparcamiento y horarios para los parquímetros en la Calle de Bailén​​.\n\nParking Plaza de Oriente APK2: Este parking se encuentra en la Calle de Bailén, 6, y se puede acceder a él desde varias rutas como Puerta de Toledo y Puente de Segovia​​."
        },
        {
            "user_input": "Buenas, voy a la calle Bailén, qué opciones de aparcamiento hay?",
            "retrieved_contexts": "<doc>\nEl parking subterráneo de la plaza es una opción segura para dejar tu vehículo, aunque puede resultar algo costoso.\n\nTipo de parking\tCoste por hora\tDificultad para aparcar\nParking subterráneo\t3,00eur.\tMedia\nCalle Bailén\nLa Calle Bailén, situada justo detrás del Palacio Real, es una zona de estacionamiento regulado, conocida como zona azul. Aunque suele tener bastante flujo de vehículos, si tienes paciencia es posible encontrar sitio. </doc><doc>\nParking Plaza de Oriente APK2\nCalle de Bailén, 6\n186 opiniones\nicon contactless\nEntrada y salida sin contacto\nPuedes entrar y salir de este parking de manera automática, sin necesidad de coger tícket o pasar por cabina de control.\n\nDetalles: Sobre el parking\nEl acceso principal del parking que va desde Plaza España hasta la calle Bailén está cortado por obras. Podrás acceder a este parking en la Plaza de Oriente: - Desde Puerta de Toledo hasta Calle Bailén. - Desde el Puente de Segovia, pasando por Cuesta de la Vega. </doc><doc>\nDESDE 15€/DÍA\n\nParking en madrid\nEncuentra el parking más cercano a tu destino.\nPARKING EN LA ZONA DE LA CALLE BAILÉN\nParking en la zona de la calle Bailén\nBuscar aparcamiento en Madrid se convierte, diariamente, en un problema para numerosos conductores. Tanto conductores que conocen la zona donde quieren aparcar, como otros que la visitan por primera vez, hallan innumerables problemas sobre todo en días de mucha afluencia de tráfico. Mediante un parking en la zona de la calle Bailén, todo aquel que desee estacionar en o cerca de esta importante calle de Madrid, podrá sentirse seguro al dejar su coche bajo la supervisión de profesionales.\n\nTecnología al servicio de la vigilancia en los parkings\n\nHoy en día los aparcamientos deben estar perfectamente acondicionados si se quiere disfrutar de espacios adecuados para todo tipo de coches. </doc><doc>\nEs frecuente que la prisa propicie en los conductores la toma de malas decisiones, como es por ejemplo estacionar en doble fila.\nCategorias - Aparcamiento, blog, Madrid, Parking, Parking cerca de calle Bailén, Parking privado</doc><doc>\nA TU LLEGADA:\n\nSi llegas con más antelación, la barrera no se abrirá automáticamente y te aparecerá el siguiente mensaje: Fuera de periodo de validez. Debes coger un ticket y llamar a interfonía o dirigirte a cabina de control con tu reserva.\n\n\n\nSi llegas al parki ... \n\n\n\n\n\n\n\n\n\n\n\n\n\n\n\n\n\n\n\n\n\n\n\n\n\n\n\n\nEntrada al parking\nCalle de Bailén, 6\nCalle de San Quintín, 13\nEntradas peatonales\nPlaza de Oriente, 1\nPlaza de Oriente 1\nTipos de productos disponibles\nPase básico\nUNA ENTRADA Y UNA SALIDA\n2,50 €</doc>",
            "response": "Para encontrar el mejor aparcamiento cerca de la calle Bailén, es importante tener en cuenta varios factores, como la dificultad para aparcar, el tipo de aparcamiento (subterráneo o en la calle), y la disponibilidad de servicios adicionales. Aquí te presento tres opciones basadas en la información proporcionada:\n\n    Parkings en la Zona de la Calle Bailén:\n        - Pase básico: Un precio de 2,50 euros, que incluye una entrada y una salida.\n        - Pase con acceso a la zona azul: Este tipo de pase te permite estacionar en la zona azul, que es regulada y suele tener menos tráfico.\n        - Pase con acceso a la zona rosa: Este tipo de pase te permite estacionar en la zona rosa, que es la zona de aparcamiento reservado para vehículos de menos de 9,5 metros cúbicos.\n\nParkings en la Plaza de Oriente:\n    - Parking en la Plaza de Oriente: Este parking se encuentra en la calle Bailén, cerca de la Plaza de Oriente. Ofrece un tipo de pase con acceso a la zona rosa, que te permite estacionar en la zona reservada para vehículos de menos de 9,5 metros cúbicos.\n    - Parking en la Plaza de Oriente 1: También se encuentra en la calle Bailén, pero en la misma dirección que el primer parking. Ofrece un tipo de pase con acceso a la zona rosa, similar al primero.\n\nEstas opciones ofrecen diferentes precios y niveles de accesibilidad, especialmente si buscas un aparcamiento cerca de la calle Bailén. Recuerda verificar los horarios y condiciones de cada parking antes de llegar para asegurarte de elegir el mejor para tu situación.",
            "reference": "Para aparcar cerca de la calle Bailén en Madrid, tienes varias opciones:\n\nParking Público Cubierto cerca de Príncipe Pío: Está a solo 3 minutos a pie del centro comercial Príncipe Pío, seguro y accesible las 24 horas del día, los 7 días de la semana​​.\n\nZona Azul en la Calle Bailén: Esta área, justo detrás del Palacio Real, ofrece estacionamiento regulado. Aunque suele haber bastante flujo de vehículos, es posible encontrar sitio con paciencia​​.\n\nOtras Opciones de Parking en la Zona: Existen diferentes opciones con tarifas que comienzan desde los 15€ por día​​.\n\nParquímetros en la Calle de Bailén: También puedes encontrar tarifas de aparcamiento y horarios para los parquímetros en la Calle de Bailén​​.\n\nParking Plaza de Oriente APK2: Este parking se encuentra en la Calle de Bailén, 6, y se puede acceder a él desde varias rutas como Puerta de Toledo y Puente de Segovia​​."
        },
        {
            "user_input": "¿Cómo es el reciclaje en Tokio?",
            "retrieved_contexts": "<doc>\nEn Japón, el reciclaje se lleva a cabo bajo estrictas normas y regulaciones establecidas. Por ejemplo, los envases deben ser lavados y los productos deben ser doblados para ocupar el menor espacio posible. </doc><doc>\nPresentamos en este artículo algunas generalidades sobre los tipos de basura y la forma de sacarla, centrándonos en el caso de Tokio.\n\nEn Japón, el mes de diciembre es el señalado para hacer la gran limpieza anual de la casa, que debe quedar impoluta y ordenada para recibir dignamente, en el shōgatsu (día 1 de enero, Año Nuevo) al dios del año entrante.\n\nHay que limpiar y fregar ventanas y suelos, poner orden en el interior del frigorífico, cepillar el calzado, barrer bien el recibidor, deshacerse de los muebles y cacharros grandes que ya no se usan y dar un buen repaso, bayeta en mano, a todos los rincones de la casa para dejarla en condiciones. Esta movilización de fin de año, que se realiza puntualmente en la mayoría de los hogares japoneses, produce un gran volumen extra de basura. Hay que andarse con sumo cuidado, pues cada localidad tiene su propia normativa y los días de la semana y formas de sacar la basura varían de una zona a otra.\n\nSe ha señalado que los grandes almacenes y supermercados japoneses utilizan una cantidad excesiva de embalajes y envoltorios. La costumbre de intercambiar regalos, muy antigua en Japón, es en parte la responsable. Las frutas y verduras, la carne y el pescado, todo se envasa en poliestireno o vinilo, y se mete en bolsas al pasar por caja. Pese a que en 2018 el Gobierno de Japón ha decidido finalmente obligar a las tiendas a cobrar a sus clientes por las bolsas de plástico, es una incógnita hasta qué punto esta medida tendrá un impacto significativo sobre el total de plástico que se tira a la basura. También se consumen muchas botellas de plástico PET y latas, y el volumen total de basura no está reduciéndose.\n\nLos envases y embalajes desechados representan el 60 % de la basura que producen los hogares. Japón, país pobre en recursos naturales, se ha tomado el problema en serio y trata de dar nuevos usos a estos materiales, para lo que se ha dotado de una ley de reciclaje de envases y envoltorios. Sin embargo, aunque existen algunos municipios que realizan una recogida selectiva estableciendo un gran número de categorías y clases (13 y 45 en el caso del municipio de Kamikatsu, en la prefectura de Tokushima), en el conjunto del país no dejan de ser excepciones y no tenemos más remedio que decir que en el campo del reciclaje Japón sigue estando muy por detrás de Alemania o de los países nórdicos. La ciudadanía debería tener una conciencia más viva al respecto y algo parecido puede decirse también del Gobierno, sus organismos y las grandes empresas, de los que se esperaría un compromiso más activo.\n\n</doc><doc>\nValga decir que durante cerca de una semana entre finales de diciembre y principios de enero el servicio municipal de basuras descansa, por lo que es recomendable enterarse previamente de la fecha de reanudación del mismo.\n\nAlgunos sitios web que servirán de referencia\nSe han seleccionado algunos de los municipios (ku) del centro de Tokio que disponen de página en inglés.\n\n    Chūō-ku Everyday Life (PDF en inglés)\n    Shibuya-ku Garbage and Recycling\n    Katsushika-ku Garbage disposal, recycling\n    Nakano-ku How to Separate Recyclable Materials and Dispose of Them (PDF en inglés)\n    Setagaya-ku How to Properly Sort and Dispose of Garbage and Recyclable Resources (PDF en inglés)\n    Kita-ku Garbage Collection Procedures for Foreign Residents (PDF en inglés)\n    Shinagawa-ku How to Separate and Dispose of Waste and Recyclable Items (PDF en inglés)</doc><doc>\nSi no se sigue correctamente el proceso de reciclaje, la basura se devuelve al propietario con una nota que indica que se recicle correctamente. Esto demuestra el compromiso de Japón con el reciclaje y la importancia de seguir las normas establecidas.\nEl reciclaje en las casas y en las calles\n\nEn Japón, el reciclaje no es solo una responsabilidad de los hogares, sino también de las calles. Cada persona es responsable de los residuos que genera y es por eso que no se encuentran papeleras en las calles. </doc><doc>\nReciclaje en Japón: normas y eficiencia\n\nJapón es conocido por su compromiso con el reciclaje y la protección del medio ambiente. El país ha implementado un sistema de reciclaje altamente eficiente que ha sido adoptado por la mayoría de la población. Este sistema se basa en estrictas normas y regulaciones que se aplican tanto en los hogares como en las calles.\n\nTemas de los que Hablaremos\n\n    Cómo funciona el reciclaje en Japón\n    El reciclaje en las casas y en las calles\n    Cuánto se recicla en Japón\n    Consultas habituales sobre el reciclaje en Japón\n        ¿Qué materiales se reciclan en Japón?\n        ¿Cómo se promueve el reciclaje en Japón?\n        ¿Qué sucede con los residuos no reciclables en Japón?\n    Tabla de tasas de reciclaje en diferentes países\n\nCómo funciona el reciclaje en Japón\n\nEl sistema de reciclaje en Japón es altamente organizado y se lleva a cabo a nivel local. Cada barrio tiene sus propias reglas y regulaciones, por lo que es importante que los residentes conozcan las normas específicas de su área. Al registrarse como vecino en el ayuntamiento o junta de distrito, se proporciona a los extranjeros un folleto detallado que explica el proceso de reciclaje en su barrio.\n\nUna de las diferencias clave entre el sistema de reciclaje en Japón y otros países es que no se permite reciclar en cualquier momento y de cualquier manera. </doc>",
            "response": "El reciclaje en Japón es un tema de gran importancia y esculpido en la cultura nacional. El país ha implementado un sistema de reciclaje altamente eficiente que ha sido adoptado por la mayoría de la población. Este sistema se basa en estrictas normas y regulaciones que se aplican tanto en los hogares como en las calles.\n\nLa reciclaje en las casas y en las calles\n\nEn Japón, el reciclaje no es solo una responsabilidad de los hogares, sino también de las calles. Cada persona es responsable de los residuos que genera y es por eso que no se encuentran papeleras en las calles. Además, los municipios y las autoridades locales se encargan de recoger los residuos reciclados en determinados momentos del día, como por ejemplo, entre las 7:00 y las 9:00 horas.\n\nLa reciclaje en Japón\n\nEl sistema de reciclaje en Japón es altamente organizado y se lleva a cabo a nivel local. Cada barrio tiene sus propias reglas y regulaciones, por lo que es importante que los residentes conozcan las normas específicas de su área. Al registrarse como vecino en el ayuntamiento o junta de distrito, se proporciona a los extranjeros un folleto detallado que explica el proceso de reciclaje en su barrio.\n\nUna de las diferencias clave entre el sistema de reciclaje en Japón y otros países es que no se permite reciclar en cualquier momento y de cualquier manera. Esto significa que los residuos reciclados deben ser recogidos y separados de los residuos no reciclables en un momento específico y en un lugar específico. Además, los residuos reciclados deben ser recogidos y separados de los residuos no reciclables en diferentes contenedores y lugares.\n\nEl reciclaje en Japón es importante porque ayuda a reducir la cantidad de residuos que se desechan en los vertederos y en los ríos, lo que contribuye a la conservación del medio ambiente. Además, el reciclaje también ayuda a ahorrar energía y recursos naturales, ya que se utilizan materiales que se pueden reutilizar en lugar de producir nuevos productos.\n\nEn resumen, el reciclaje en Japón es un tema de gran importancia y esculpido en la cultura nacional. El país ha implementado un sistema de reciclaje altamente eficiente que ha sido adoptado por la mayoría de la población. Este sistema se basa en estrictas normas y regulaciones que se aplican tanto en los hogares como en las calles. Además, el reciclaje en Japón es importante porque ayuda a reducir la cantidad de residuos que se desechan en los vertederos y en los ríos, lo que contribuye a la conservación del medio ambiente.",
            "reference": "El reciclaje en Tokio, y en Japón en general, es un proceso altamente organizado y eficiente, respaldado por un fuerte compromiso público y gubernamental hacia la sostenibilidad y la gestión adecuada de residuos. La estructura del sistema de reciclaje en Tokio puede analizarse en varios aspectos clave:\n\n    Clasificación y Separación de Residuos: En Tokio, la basura se clasifica en varias categorías principales: combustibles (como restos de comida y papel), no combustibles (como cerámica y metales), reciclables (como botellas, latas, y papel), y basura voluminosa. Estas categorías se manejan de manera diferente en términos de recogida y procesamiento​.\n\nNormas Específicas por Área: La gestión de residuos y reciclaje varía de un barrio a otro dentro de la ciudad, con cada uno estableciendo sus propias reglas y regulaciones. Los residentes reciben información detallada sobre estas normas al registrarse en el ayuntamiento o junta de distrito​​.\n\nResponsabilidad Individual y Comunitaria: En Japón, cada persona es responsable de los residuos que genera, lo que se refleja en la falta de papeleras en las calles. En los hogares, se realiza una separación exhaustiva de residuos, y los materiales reciclables se clasifican y se recogen en días designados​.\n\nAltas Tasas de Reciclaje: Japón ha logrado una tasa de reciclaje impresionantemente alta. En el año fiscal 2017, la tasa de reciclaje fue del 84,8%, significativamente más alta que en muchas otras regiones del mundo​.\n\nVariedad de Materiales Reciclados: Se reciclan una amplia gama de materiales, incluyendo papel, cartón, vidrio, plástico, metal, y residuos especiales como aparatos electrónicos y pilas​.\n\nIncentivos y Campañas de Concienciación: El gobierno japonés promueve activamente el reciclaje a través de campañas de concienciación pública y ofrece incentivos para fomentar prácticas de reciclaje adecuadas. También se han establecido sistemas de recogida y reciclaje a nivel local y nacional para facilitar la separación y el procesamiento de los materiales reciclables​.\n\nManejo de Residuos No Reciclables: Los residuos que no son reciclables se envían a plantas de incineración para su eliminación segura, y el calor generado durante este proceso se utiliza para generar energía, ayudando a reducir la dependencia de Japón de los combustibles fósiles​​.\n\nEn resumen, el sistema de reciclaje en Tokio es un modelo de eficiencia y responsabilidad, caracterizado por una clasificación detallada de residuos, normas específicas por barrio, alta participación ciudadana, y fuerte apoyo gubernamental. Este enfoque ha resultado en tasas de reciclaje excepcionalmente altas y una gestión efectiva de residuos, lo que refleja el compromiso de Japón con la sostenibilidad y la protección del medio ambiente."
        },
        {
            "user_input": "Sabrías hacerme un resumen de cómo funciona el recliclado en Tokio, Japón?",
            "retrieved_contexts": "<doc>\nReciclaje en Japón: normas y eficiencia\n\nJapón es conocido por su compromiso con el reciclaje y la protección del medio ambiente. El país ha implementado un sistema de reciclaje altamente eficiente que ha sido adoptado por la mayoría de la población. Este sistema se basa en estrictas normas y regulaciones que se aplican tanto en los hogares como en las calles.\n\nTemas de los que Hablaremos\n\n    Cómo funciona el reciclaje en Japón\n    El reciclaje en las casas y en las calles\n    Cuánto se recicla en Japón\n    Consultas habituales sobre el reciclaje en Japón\n        ¿Qué materiales se reciclan en Japón?\n        ¿Cómo se promueve el reciclaje en Japón?\n        ¿Qué sucede con los residuos no reciclables en Japón?\n    Tabla de tasas de reciclaje en diferentes países\n\nCómo funciona el reciclaje en Japón\n\nEl sistema de reciclaje en Japón es altamente organizado y se lleva a cabo a nivel local. Cada barrio tiene sus propias reglas y regulaciones, por lo que es importante que los residentes conozcan las normas específicas de su área. Al registrarse como vecino en el ayuntamiento o junta de distrito, se proporciona a los extranjeros un folleto detallado que explica el proceso de reciclaje en su barrio.\n\nUna de las diferencias clave entre el sistema de reciclaje en Japón y otros países es que no se permite reciclar en cualquier momento y de cualquier manera. </doc><doc>\nValga decir que durante cerca de una semana entre finales de diciembre y principios de enero el servicio municipal de basuras descansa, por lo que es recomendable enterarse previamente de la fecha de reanudación del mismo.\n\nAlgunos sitios web que servirán de referencia\nSe han seleccionado algunos de los municipios (ku) del centro de Tokio que disponen de página en inglés.\n\n    Chūō-ku Everyday Life (PDF en inglés)\n    Shibuya-ku Garbage and Recycling\n    Katsushika-ku Garbage disposal, recycling\n    Nakano-ku How to Separate Recyclable Materials and Dispose of Them (PDF en inglés)\n    Setagaya-ku How to Properly Sort and Dispose of Garbage and Recyclable Resources (PDF en inglés)\n    Kita-ku Garbage Collection Procedures for Foreign Residents (PDF en inglés)\n    Shinagawa-ku How to Separate and Dispose of Waste and Recyclable Items (PDF en inglés)</doc><doc>\nEn los hogares, se realiza una separación exhaustiva de los residuos. Los materiales reciclables como el papel, el cartón, el vidrio y el plástico se clasifican y se colocan en bolsas o contenedores específicos. Estos residuos se recogen en días designados y se envían a las plantas de reciclaje correspondientes.\nReciclaje en otros países: sistemas eficientes y medidas sostenibles\n\nEn las calles, se espera que las personas se lleven su basura y la reciclen en casa. Esto se debe a la falta de papeleras en las calles y al énfasis en la responsabilidad individual en el manejo de los residuos.\nCuánto se recicla en Japón\n\nJapón ha logrado una tasa de reciclaje muy alta en comparación con otros países. En el año fiscal 2017, la tasa de reciclaje en Japón fue del 84,8%, superando el 40% registrado en la Unión Europea y el 20% en los Estados Unidos.\n\nUno de los ejemplos más destacados de reciclaje en Japón es el de las botellas de plástico PET. Cada año se despachan 2700 millones de botellas en Japón. La industria ha implementado tecnologías y procesos de fabricación para hacer más ligeras estas botellas y reducir la cantidad de residuos generados. Además, se ha establecido un sistema de recogida y reciclaje de botellas de plástico PET a nivel nacional.\n\nEn general, Japón se enorgullece de tener la tasa de reciclaje más alta del entorno y continúa trabajando para mejorar aún más sus prácticas de reciclaje.\n\nEl sistema de reciclaje en Japón es un ejemplo de eficiencia y compromiso con el medio ambiente. A través de normas estrictas y regulaciones, el país ha logrado una tasa de reciclaje muy alta y ha implementado tecnologías para reducir la cantidad de residuos generados. El reciclaje en Japón es una responsabilidad tanto de los hogares como de las calles, y se espera que cada persona cumpla con las normas establecidas. Con su enfoque en el reciclaje y la protección del medio ambiente, Japón sigue siendo un líder en el campo del reciclaje a nivel mundial.\nConsultas habituales sobre el reciclaje en Japón\n¿Qué materiales se reciclan en Japón?\n\nEn Japón se reciclan una amplia variedad de materiales, incluyendo papel, cartón, vidrio, plástico, metal y residuos especiales como aparatos electrónicos y pilas. Cada material tiene su propio proceso de reciclaje y se recoge en días designados.\nReciclaje de chatarra electrónica: procesos y beneficios\n¿Cómo se promueve el reciclaje en Japón?\n\nEl gobierno japonés ha implementado campañas de concienciación pública y ofrece incentivos para promover el reciclaje. Además, se han establecido sistemas de recogida y reciclaje a nivel local y nacional para facilitar la separación y el procesamiento de los materiales reciclables.\n</doc><doc>\nEn Japón, el reciclaje se lleva a cabo bajo estrictas normas y regulaciones establecidas. Por ejemplo, los envases deben ser lavados y los productos deben ser doblados para ocupar el menor espacio posible. </doc><doc>\nMás abajo explicaré cómo llegar a Nikkō.\n\n    </doc>",
            "response": "El reciclaje en Japón es un proceso que busca reducir la cantidad de residuos generados y maximizar la utilización de los materiales. Este sistema se basa en estrictas normas y regulaciones que se aplican tanto en los hogares como en las calles. Aquí te explico cómo funciona el reciclaje en Japón:\n\n    Seguimiento y clasificación de la basura: Al registrarse como vecino en el ayuntamiento o junta de distrito, se proporciona a los extranjeros un folleto detallado que explica el proceso de reciclaje en su barrio. Esta clasificación es crucial, ya que los residuos reciclables deben colocarse en bolsas o contenedores específicos.\n\nRecogida y separación de materiales: Las autoridades locales recogen los residuos en días designados y realizan una separación exhaustiva de los materiales reciclables. Esto incluye papel, cartón, vidrio, plástico, metal y residuos especiales como aparatos electrónicos y pilas.\n\nReciclaje: Los materiales reciclables se llevan a las plantas de reciclaje correspondientes. En Japón, la tasa de reciclaje es alta, alcanzando un 84,8% en el año fiscal 2017. Esto significa que casi el 85% de los residuos se reciclan en lugar de desecharse.\n\nEficiencia y compromiso con el medio ambiente: Japón se enorgullece de tener la tasa de reciclaje más alta del mundo. Este éxito se debe a la implementación de normas estrictas y regulaciones, así como a la responsabilidad individual de los ciudadanos en el manejo de los residuos. Además, el país ha desarrollado tecnologías y procesos para reducir la cantidad de residuos generados.\n\nEn resumen, el reciclaje en Japón es un proceso eficiente y sostenible que busca reducir la huella de carbono y maximizar la utilización de los recursos. A través de la clasificación exhaustiva de la basura, la separación y el reciclaje, se pueden reducir significativamente los residuos y maximizar la sostenibilidad ambiental.",
            "reference": "El reciclaje en Tokio, y en Japón en general, es un proceso altamente organizado y eficiente, respaldado por un fuerte compromiso público y gubernamental hacia la sostenibilidad y la gestión adecuada de residuos. La estructura del sistema de reciclaje en Tokio puede analizarse en varios aspectos clave:\n\n    Clasificación y Separación de Residuos: En Tokio, la basura se clasifica en varias categorías principales: combustibles (como restos de comida y papel), no combustibles (como cerámica y metales), reciclables (como botellas, latas, y papel), y basura voluminosa. Estas categorías se manejan de manera diferente en términos de recogida y procesamiento​.\n\nNormas Específicas por Área: La gestión de residuos y reciclaje varía de un barrio a otro dentro de la ciudad, con cada uno estableciendo sus propias reglas y regulaciones. Los residentes reciben información detallada sobre estas normas al registrarse en el ayuntamiento o junta de distrito​​.\n\nResponsabilidad Individual y Comunitaria: En Japón, cada persona es responsable de los residuos que genera, lo que se refleja en la falta de papeleras en las calles. En los hogares, se realiza una separación exhaustiva de residuos, y los materiales reciclables se clasifican y se recogen en días designados​.\n\nAltas Tasas de Reciclaje: Japón ha logrado una tasa de reciclaje impresionantemente alta. En el año fiscal 2017, la tasa de reciclaje fue del 84,8%, significativamente más alta que en muchas otras regiones del mundo​.\n\nVariedad de Materiales Reciclados: Se reciclan una amplia gama de materiales, incluyendo papel, cartón, vidrio, plástico, metal, y residuos especiales como aparatos electrónicos y pilas​.\n\nIncentivos y Campañas de Concienciación: El gobierno japonés promueve activamente el reciclaje a través de campañas de concienciación pública y ofrece incentivos para fomentar prácticas de reciclaje adecuadas. También se han establecido sistemas de recogida y reciclaje a nivel local y nacional para facilitar la separación y el procesamiento de los materiales reciclables​.\n\nManejo de Residuos No Reciclables: Los residuos que no son reciclables se envían a plantas de incineración para su eliminación segura, y el calor generado durante este proceso se utiliza para generar energía, ayudando a reducir la dependencia de Japón de los combustibles fósiles​​.\n\nEn resumen, el sistema de reciclaje en Tokio es un modelo de eficiencia y responsabilidad, caracterizado por una clasificación detallada de residuos, normas específicas por barrio, alta participación ciudadana, y fuerte apoyo gubernamental. Este enfoque ha resultado en tasas de reciclaje excepcionalmente altas y una gestión efectiva de residuos, lo que refleja el compromiso de Japón con la sostenibilidad y la protección del medio ambiente."
        },
        {
            "user_input": "como va el tema del reciclaje en la ciudad de tokio",
            "retrieved_contexts": "<doc>\nValga decir que durante cerca de una semana entre finales de diciembre y principios de enero el servicio municipal de basuras descansa, por lo que es recomendable enterarse previamente de la fecha de reanudación del mismo.\n\nAlgunos sitios web que servirán de referencia\nSe han seleccionado algunos de los municipios (ku) del centro de Tokio que disponen de página en inglés.\n\n    Chūō-ku Everyday Life (PDF en inglés)\n    Shibuya-ku Garbage and Recycling\n    Katsushika-ku Garbage disposal, recycling\n    Nakano-ku How to Separate Recyclable Materials and Dispose of Them (PDF en inglés)\n    Setagaya-ku How to Properly Sort and Dispose of Garbage and Recyclable Resources (PDF en inglés)\n    Kita-ku Garbage Collection Procedures for Foreign Residents (PDF en inglés)\n    Shinagawa-ku How to Separate and Dispose of Waste and Recyclable Items (PDF en inglés)</doc><doc>\nPresentamos en este artículo algunas generalidades sobre los tipos de basura y la forma de sacarla, centrándonos en el caso de Tokio.\n\nEn Japón, el mes de diciembre es el señalado para hacer la gran limpieza anual de la casa, que debe quedar impoluta y ordenada para recibir dignamente, en el shōgatsu (día 1 de enero, Año Nuevo) al dios del año entrante.\n\nHay que limpiar y fregar ventanas y suelos, poner orden en el interior del frigorífico, cepillar el calzado, barrer bien el recibidor, deshacerse de los muebles y cacharros grandes que ya no se usan y dar un buen repaso, bayeta en mano, a todos los rincones de la casa para dejarla en condiciones. Esta movilización de fin de año, que se realiza puntualmente en la mayoría de los hogares japoneses, produce un gran volumen extra de basura. Hay que andarse con sumo cuidado, pues cada localidad tiene su propia normativa y los días de la semana y formas de sacar la basura varían de una zona a otra.\n\nSe ha señalado que los grandes almacenes y supermercados japoneses utilizan una cantidad excesiva de embalajes y envoltorios. La costumbre de intercambiar regalos, muy antigua en Japón, es en parte la responsable. Las frutas y verduras, la carne y el pescado, todo se envasa en poliestireno o vinilo, y se mete en bolsas al pasar por caja. Pese a que en 2018 el Gobierno de Japón ha decidido finalmente obligar a las tiendas a cobrar a sus clientes por las bolsas de plástico, es una incógnita hasta qué punto esta medida tendrá un impacto significativo sobre el total de plástico que se tira a la basura. También se consumen muchas botellas de plástico PET y latas, y el volumen total de basura no está reduciéndose.\n\nLos envases y embalajes desechados representan el 60 % de la basura que producen los hogares. Japón, país pobre en recursos naturales, se ha tomado el problema en serio y trata de dar nuevos usos a estos materiales, para lo que se ha dotado de una ley de reciclaje de envases y envoltorios. Sin embargo, aunque existen algunos municipios que realizan una recogida selectiva estableciendo un gran número de categorías y clases (13 y 45 en el caso del municipio de Kamikatsu, en la prefectura de Tokushima), en el conjunto del país no dejan de ser excepciones y no tenemos más remedio que decir que en el campo del reciclaje Japón sigue estando muy por detrás de Alemania o de los países nórdicos. La ciudadanía debería tener una conciencia más viva al respecto y algo parecido puede decirse también del Gobierno, sus organismos y las grandes empresas, de los que se esperaría un compromiso más activo.\n\n</doc><doc>\n2. Cosas necesarias antes de tirar la basura\n\n    Bolsas de basura (de pago)\n    La basura debe ser seleccionada y separada antes de su recogida. En Tokio, cada uno de los 23 municipios (ku) que componen su centro urbano tiene bolsas diferentes. En algunos, las bolsas deben ser de un determinado color. </doc><doc>\nReciclaje en Japón: normas y eficiencia\n\nJapón es conocido por su compromiso con el reciclaje y la protección del medio ambiente. El país ha implementado un sistema de reciclaje altamente eficiente que ha sido adoptado por la mayoría de la población. Este sistema se basa en estrictas normas y regulaciones que se aplican tanto en los hogares como en las calles.\n\nTemas de los que Hablaremos\n\n    Cómo funciona el reciclaje en Japón\n    El reciclaje en las casas y en las calles\n    Cuánto se recicla en Japón\n    Consultas habituales sobre el reciclaje en Japón\n        ¿Qué materiales se reciclan en Japón?\n        ¿Cómo se promueve el reciclaje en Japón?\n        ¿Qué sucede con los residuos no reciclables en Japón?\n    Tabla de tasas de reciclaje en diferentes países\n\nCómo funciona el reciclaje en Japón\n\nEl sistema de reciclaje en Japón es altamente organizado y se lleva a cabo a nivel local. Cada barrio tiene sus propias reglas y regulaciones, por lo que es importante que los residentes conozcan las normas específicas de su área. Al registrarse como vecino en el ayuntamiento o junta de distrito, se proporciona a los extranjeros un folleto detallado que explica el proceso de reciclaje en su barrio.\n\nUna de las diferencias clave entre el sistema de reciclaje en Japón y otros países es que no se permite reciclar en cualquier momento y de cualquier manera. </doc><doc>\n¿Qué sucede con los residuos no reciclables en Japón?\n\nLos residuos no reciclables se envían a plantas de incineración para su eliminación segura. El calor generado durante el proceso de incineración se utiliza para generar energía, lo que ayuda a reducir la dependencia de Japón de los combustibles fósiles.\nTabla de tasas de reciclaje en diferentes países\nPaís\tTasa de reciclaje\nJapón\t84,8%\nUnión Europea\t40%\nEstados Unidos\t20%\n\nEl sistema de reciclaje en Japón ha demostrado ser altamente efectivo y ha llevado a una tasa de reciclaje significativamente más alta que en otros países. A través de una combinación de normas estrictas, regulaciones y concienciación pública, Japón continúa siendo un líder en el reciclaje y la protección del medio ambiente.\n\n</doc>",
            "response": "El reciclaje en la ciudad de Tokio se ha convertido en una parte integral de la vida cotidiana en este lugar, y se ha vuelto una práctica común entre la población. Este sistema se basa en estrictas normas y regulaciones que se aplican tanto en los hogares como en las calles, lo que ha contribuido a reducir significativamente la cantidad de residuos que se producen en la ciudad.\n\nLa reciclaje en Tokio se lleva a cabo a nivel local, con cada barrio teniendo sus propias reglas y regulaciones. Esto significa que cada persona y empresa tiene que cumplir con las normas específicas de su área, lo que garantiza que se reciclen los materiales adecuadamente y se eviten los desperdicios innecesarios.\n\nAdemás, el gobierno japonés ha implementado una serie de medidas para promover el reciclaje, como la obligación de las tiendas de cobrar a sus clientes por las bolsas de plástico. Esto ha ayudado a reducir la cantidad de plástico que se utiliza en la industria y se ve en los residuos domésticos.\n\nLa ciudadanía japonesa también desempeña un papel importante en el reciclaje, ya que muchos residentes y empresas participan en programas de reciclaje y se comprometen a reciclar los materiales adecuadamente. Esto contribuye a reducir la cantidad de residuos que se producen en la ciudad y a proteger los recursos naturales.\n\nEn resumen, el reciclaje en la ciudad de Tokio es un proceso integral que se lleva a cabo a nivel local y que se basa en estrictas normas y regulaciones. La participación de la ciudadanía y la industria también desempeñan un papel importante en este proceso, lo que ayuda a reducir la cantidad de residuos y a proteger los recursos naturales.",
            "reference": "El reciclaje en Tokio, y en Japón en general, es un proceso altamente organizado y eficiente, respaldado por un fuerte compromiso público y gubernamental hacia la sostenibilidad y la gestión adecuada de residuos. La estructura del sistema de reciclaje en Tokio puede analizarse en varios aspectos clave:\n\n    Clasificación y Separación de Residuos: En Tokio, la basura se clasifica en varias categorías principales: combustibles (como restos de comida y papel), no combustibles (como cerámica y metales), reciclables (como botellas, latas, y papel), y basura voluminosa. Estas categorías se manejan de manera diferente en términos de recogida y procesamiento​.\n\nNormas Específicas por Área: La gestión de residuos y reciclaje varía de un barrio a otro dentro de la ciudad, con cada uno estableciendo sus propias reglas y regulaciones. Los residentes reciben información detallada sobre estas normas al registrarse en el ayuntamiento o junta de distrito​​.\n\nResponsabilidad Individual y Comunitaria: En Japón, cada persona es responsable de los residuos que genera, lo que se refleja en la falta de papeleras en las calles. En los hogares, se realiza una separación exhaustiva de residuos, y los materiales reciclables se clasifican y se recogen en días designados​.\n\nAltas Tasas de Reciclaje: Japón ha logrado una tasa de reciclaje impresionantemente alta. En el año fiscal 2017, la tasa de reciclaje fue del 84,8%, significativamente más alta que en muchas otras regiones del mundo​.\n\nVariedad de Materiales Reciclados: Se reciclan una amplia gama de materiales, incluyendo papel, cartón, vidrio, plástico, metal, y residuos especiales como aparatos electrónicos y pilas​.\n\nIncentivos y Campañas de Concienciación: El gobierno japonés promueve activamente el reciclaje a través de campañas de concienciación pública y ofrece incentivos para fomentar prácticas de reciclaje adecuadas. También se han establecido sistemas de recogida y reciclaje a nivel local y nacional para facilitar la separación y el procesamiento de los materiales reciclables​.\n\nManejo de Residuos No Reciclables: Los residuos que no son reciclables se envían a plantas de incineración para su eliminación segura, y el calor generado durante este proceso se utiliza para generar energía, ayudando a reducir la dependencia de Japón de los combustibles fósiles​​.\n\nEn resumen, el sistema de reciclaje en Tokio es un modelo de eficiencia y responsabilidad, caracterizado por una clasificación detallada de residuos, normas específicas por barrio, alta participación ciudadana, y fuerte apoyo gubernamental. Este enfoque ha resultado en tasas de reciclaje excepcionalmente altas y una gestión efectiva de residuos, lo que refleja el compromiso de Japón con la sostenibilidad y la protección del medio ambiente."
        },
        {
            "user_input": "explícame cómo se recicla en tokyo",
            "retrieved_contexts": "<doc>\nPresentamos en este artículo algunas generalidades sobre los tipos de basura y la forma de sacarla, centrándonos en el caso de Tokio.\n\nEn Japón, el mes de diciembre es el señalado para hacer la gran limpieza anual de la casa, que debe quedar impoluta y ordenada para recibir dignamente, en el shōgatsu (día 1 de enero, Año Nuevo) al dios del año entrante.\n\nHay que limpiar y fregar ventanas y suelos, poner orden en el interior del frigorífico, cepillar el calzado, barrer bien el recibidor, deshacerse de los muebles y cacharros grandes que ya no se usan y dar un buen repaso, bayeta en mano, a todos los rincones de la casa para dejarla en condiciones. Esta movilización de fin de año, que se realiza puntualmente en la mayoría de los hogares japoneses, produce un gran volumen extra de basura. Hay que andarse con sumo cuidado, pues cada localidad tiene su propia normativa y los días de la semana y formas de sacar la basura varían de una zona a otra.\n\nSe ha señalado que los grandes almacenes y supermercados japoneses utilizan una cantidad excesiva de embalajes y envoltorios. La costumbre de intercambiar regalos, muy antigua en Japón, es en parte la responsable. Las frutas y verduras, la carne y el pescado, todo se envasa en poliestireno o vinilo, y se mete en bolsas al pasar por caja. Pese a que en 2018 el Gobierno de Japón ha decidido finalmente obligar a las tiendas a cobrar a sus clientes por las bolsas de plástico, es una incógnita hasta qué punto esta medida tendrá un impacto significativo sobre el total de plástico que se tira a la basura. También se consumen muchas botellas de plástico PET y latas, y el volumen total de basura no está reduciéndose.\n\nLos envases y embalajes desechados representan el 60 % de la basura que producen los hogares. Japón, país pobre en recursos naturales, se ha tomado el problema en serio y trata de dar nuevos usos a estos materiales, para lo que se ha dotado de una ley de reciclaje de envases y envoltorios. Sin embargo, aunque existen algunos municipios que realizan una recogida selectiva estableciendo un gran número de categorías y clases (13 y 45 en el caso del municipio de Kamikatsu, en la prefectura de Tokushima), en el conjunto del país no dejan de ser excepciones y no tenemos más remedio que decir que en el campo del reciclaje Japón sigue estando muy por detrás de Alemania o de los países nórdicos. La ciudadanía debería tener una conciencia más viva al respecto y algo parecido puede decirse también del Gobierno, sus organismos y las grandes empresas, de los que se esperaría un compromiso más activo.\n\n</doc><doc>\nValga decir que durante cerca de una semana entre finales de diciembre y principios de enero el servicio municipal de basuras descansa, por lo que es recomendable enterarse previamente de la fecha de reanudación del mismo.\n\nAlgunos sitios web que servirán de referencia\nSe han seleccionado algunos de los municipios (ku) del centro de Tokio que disponen de página en inglés.\n\n    Chūō-ku Everyday Life (PDF en inglés)\n    Shibuya-ku Garbage and Recycling\n    Katsushika-ku Garbage disposal, recycling\n    Nakano-ku How to Separate Recyclable Materials and Dispose of Them (PDF en inglés)\n    Setagaya-ku How to Properly Sort and Dispose of Garbage and Recyclable Resources (PDF en inglés)\n    Kita-ku Garbage Collection Procedures for Foreign Residents (PDF en inglés)\n    Shinagawa-ku How to Separate and Dispose of Waste and Recyclable Items (PDF en inglés)</doc><doc>\n2. Cosas necesarias antes de tirar la basura\n\n    Bolsas de basura (de pago)\n    La basura debe ser seleccionada y separada antes de su recogida. En Tokio, cada uno de los 23 municipios (ku) que componen su centro urbano tiene bolsas diferentes. En algunos, las bolsas deben ser de un determinado color. </doc><doc>\nEn los hogares, se realiza una separación exhaustiva de los residuos. Los materiales reciclables como el papel, el cartón, el vidrio y el plástico se clasifican y se colocan en bolsas o contenedores específicos. Estos residuos se recogen en días designados y se envían a las plantas de reciclaje correspondientes.\nReciclaje en otros países: sistemas eficientes y medidas sostenibles\n\nEn las calles, se espera que las personas se lleven su basura y la reciclen en casa. Esto se debe a la falta de papeleras en las calles y al énfasis en la responsabilidad individual en el manejo de los residuos.\nCuánto se recicla en Japón\n\nJapón ha logrado una tasa de reciclaje muy alta en comparación con otros países. En el año fiscal 2017, la tasa de reciclaje en Japón fue del 84,8%, superando el 40% registrado en la Unión Europea y el 20% en los Estados Unidos.\n\nUno de los ejemplos más destacados de reciclaje en Japón es el de las botellas de plástico PET. Cada año se despachan 2700 millones de botellas en Japón. La industria ha implementado tecnologías y procesos de fabricación para hacer más ligeras estas botellas y reducir la cantidad de residuos generados. Además, se ha establecido un sistema de recogida y reciclaje de botellas de plástico PET a nivel nacional.\n\nEn general, Japón se enorgullece de tener la tasa de reciclaje más alta del entorno y continúa trabajando para mejorar aún más sus prácticas de reciclaje.\n\nEl sistema de reciclaje en Japón es un ejemplo de eficiencia y compromiso con el medio ambiente. A través de normas estrictas y regulaciones, el país ha logrado una tasa de reciclaje muy alta y ha implementado tecnologías para reducir la cantidad de residuos generados. El reciclaje en Japón es una responsabilidad tanto de los hogares como de las calles, y se espera que cada persona cumpla con las normas establecidas. Con su enfoque en el reciclaje y la protección del medio ambiente, Japón sigue siendo un líder en el campo del reciclaje a nivel mundial.\nConsultas habituales sobre el reciclaje en Japón\n¿Qué materiales se reciclan en Japón?\n\nEn Japón se reciclan una amplia variedad de materiales, incluyendo papel, cartón, vidrio, plástico, metal y residuos especiales como aparatos electrónicos y pilas. Cada material tiene su propio proceso de reciclaje y se recoge en días designados.\nReciclaje de chatarra electrónica: procesos y beneficios\n¿Cómo se promueve el reciclaje en Japón?\n\nEl gobierno japonés ha implementado campañas de concienciación pública y ofrece incentivos para promover el reciclaje. Además, se han establecido sistemas de recogida y reciclaje a nivel local y nacional para facilitar la separación y el procesamiento de los materiales reciclables.\n</doc><doc>\nReciclaje en Japón: normas y eficiencia\n\nJapón es conocido por su compromiso con el reciclaje y la protección del medio ambiente. El país ha implementado un sistema de reciclaje altamente eficiente que ha sido adoptado por la mayoría de la población. Este sistema se basa en estrictas normas y regulaciones que se aplican tanto en los hogares como en las calles.\n\nTemas de los que Hablaremos\n\n    Cómo funciona el reciclaje en Japón\n    El reciclaje en las casas y en las calles\n    Cuánto se recicla en Japón\n    Consultas habituales sobre el reciclaje en Japón\n        ¿Qué materiales se reciclan en Japón?\n        ¿Cómo se promueve el reciclaje en Japón?\n        ¿Qué sucede con los residuos no reciclables en Japón?\n    Tabla de tasas de reciclaje en diferentes países\n\nCómo funciona el reciclaje en Japón\n\nEl sistema de reciclaje en Japón es altamente organizado y se lleva a cabo a nivel local. Cada barrio tiene sus propias reglas y regulaciones, por lo que es importante que los residentes conozcan las normas específicas de su área. Al registrarse como vecino en el ayuntamiento o junta de distrito, se proporciona a los extranjeros un folleto detallado que explica el proceso de reciclaje en su barrio.\n\nUna de las diferencias clave entre el sistema de reciclaje en Japón y otros países es que no se permite reciclar en cualquier momento y de cualquier manera. </doc>",
            "response": "El sistema de reciclaje en Tokio se basa en estrictas normas y regulaciones que se aplican tanto en los hogares como en las calles. Los materiales reciclables se clasifican y se colocan en bolsas o contenedores específicos. Estos residuos se recogen en días designados y se envían a las plantas de reciclaje correspondientes.\n\nLa separación exhaustiva de los residuos es una parte integral del sistema de reciclaje en Tokio. Los materiales reciclables como el papel, el cartón, el vidrio y el plástico se clasifican y se colocan en bolsas o contenedores específicos. Estos residuos se recogen en días designados y se envían a las plantas de reciclaje correspondientes.\n\nLos residuos no reciclables, como las botellas de plástico PET y las latas, se recogen en los contenedores de reciclaje correspondientes. Estos contenedores se encuentran en las calles y en los parques, donde las personas pueden recoger sus residuos y los llevar a casa para reciclarlos.\n\nEl reciclaje en Tokio es una responsabilidad tanto de los hogares como de las calles. Cada persona debe cumplir con las normas establecidas y reciclar los materiales reciclables en los contenedores correspondientes. Además, las empresas y los comerciantes también tienen la responsabilidad de reciclar los residuos no reciclables.\n\nEl sistema de reciclaje en Tokio también promueve la responsabilidad individual. Las personas se llevan su basura y la reciclan en casa, lo que ayuda a reducir la cantidad de residuos generados en las calles.\n\nEn resumen, el sistema de reciclaje en Tokio se basa en la separación exhaustiva de los residuos, la responsabilidad individual y la promoción de la reciclaje en las calles y los hogares.",
            "reference": "El reciclaje en Tokio, y en Japón en general, es un proceso altamente organizado y eficiente, respaldado por un fuerte compromiso público y gubernamental hacia la sostenibilidad y la gestión adecuada de residuos. La estructura del sistema de reciclaje en Tokio puede analizarse en varios aspectos clave:\n\n    Clasificación y Separación de Residuos: En Tokio, la basura se clasifica en varias categorías principales: combustibles (como restos de comida y papel), no combustibles (como cerámica y metales), reciclables (como botellas, latas, y papel), y basura voluminosa. Estas categorías se manejan de manera diferente en términos de recogida y procesamiento​.\n\nNormas Específicas por Área: La gestión de residuos y reciclaje varía de un barrio a otro dentro de la ciudad, con cada uno estableciendo sus propias reglas y regulaciones. Los residentes reciben información detallada sobre estas normas al registrarse en el ayuntamiento o junta de distrito​​.\n\nResponsabilidad Individual y Comunitaria: En Japón, cada persona es responsable de los residuos que genera, lo que se refleja en la falta de papeleras en las calles. En los hogares, se realiza una separación exhaustiva de residuos, y los materiales reciclables se clasifican y se recogen en días designados​.\n\nAltas Tasas de Reciclaje: Japón ha logrado una tasa de reciclaje impresionantemente alta. En el año fiscal 2017, la tasa de reciclaje fue del 84,8%, significativamente más alta que en muchas otras regiones del mundo​.\n\nVariedad de Materiales Reciclados: Se reciclan una amplia gama de materiales, incluyendo papel, cartón, vidrio, plástico, metal, y residuos especiales como aparatos electrónicos y pilas​.\n\nIncentivos y Campañas de Concienciación: El gobierno japonés promueve activamente el reciclaje a través de campañas de concienciación pública y ofrece incentivos para fomentar prácticas de reciclaje adecuadas. También se han establecido sistemas de recogida y reciclaje a nivel local y nacional para facilitar la separación y el procesamiento de los materiales reciclables​.\n\nManejo de Residuos No Reciclables: Los residuos que no son reciclables se envían a plantas de incineración para su eliminación segura, y el calor generado durante este proceso se utiliza para generar energía, ayudando a reducir la dependencia de Japón de los combustibles fósiles​​.\n\nEn resumen, el sistema de reciclaje en Tokio es un modelo de eficiencia y responsabilidad, caracterizado por una clasificación detallada de residuos, normas específicas por barrio, alta participación ciudadana, y fuerte apoyo gubernamental. Este enfoque ha resultado en tasas de reciclaje excepcionalmente altas y una gestión efectiva de residuos, lo que refleja el compromiso de Japón con la sostenibilidad y la protección del medio ambiente."
        },
        {
            "user_input": "¿Qué tengo que hacer si veo una persona desmayada en mi portal?",
            "retrieved_contexts": "<doc>\nPara reducir la probabilidad de que la persona vuelva a desmayarse, no la levantes demasiado rápido. Si la persona no recupera el conocimiento en un minuto, llama al 911 o al número local de emergencias.\n    Verifica si respira. </doc><doc>\nGeneralmente, el conocimiento se recupera rápidamente.\n\nPosiblemente, los desmayos no tengan importancia médica. O bien, la causa puede ser un trastorno grave, que ocasionalmente involucra al corazón. Por lo tanto, debes tratar la pérdida del conocimiento como si fuera una emergencia médica hasta que se alivien los síntomas y se identifique la causa. Habla con el proveedor de atención médica si te desmayas más de una vez.\nSi sientes que estás a punto de desmayar\n\n    Recuéstate o siéntate. Para reducir la probabilidad de que vuelvas a desmayarte, no te levantes demasiado rápido.\n    Si te sientas, coloca la cabeza entre las rodillas.\n\nSi otra persona se desmaya\n\n    Coloca de espaldas a la persona. Si no hay lesiones y la persona respira, levanta sus piernas por encima del nivel del corazón, de ser posible. Apoya las piernas de la persona sobre algún objeto a una altura de 12 pulgadas (30 centímetros). Afloja los cinturones, collares u otra ropa ajustada.\n\n    </doc><doc>\nRevisa si hay pulso y si la persona respira. Si la persona no respira, comienza a hacerle reanimación cardiopulmonar. Llama al 911 o al número de emergencia local. Continúa con la reanimación cardiopulmonar hasta que llegue la ayuda o hasta que la persona comience a respirar.\n\nSi la persona se lesionó en una caída a causa de un desmayo, trata de manera adecuada cualquier golpe, moretón o corte. </doc><doc>\nSu piel puede sentirse fría y húmeda. Puede perder el control de sus músculos y caerse.\n\nEl desmayo suele ocurrir cuando la presión sanguínea baja de repente y causa que el flujo de la sangre al cerebro disminuya. Esto es más común en las personas mayores. Entre las causas del desmayo se incluyen:\n\n    Calor o deshidratación\n    Angustia\n    Ponerse de pie demasiado rápido\n    Algunas medicinas\n    Descenso del nivel de azúcar en la sangre\n    Problemas del corazón\n\nSi alguien se desmaya, asegúrese que las vías respiratorias estén despejadas para que pueda respirar sin problemas. La persona debe quedarse acostada unos 10 a 15 minutos. La mayoría de la gente se recupera por completo. Por lo general, los desmayos no son nada de qué preocuparse, pero a veces, pueden ser una señal de algún problema serio. Si se desmayó, es importante que vea a un médico y descubra por qué ocurrió.\n\nNIH: Instituto Nacional de Trastornos Neurológicos y Accidentes Cerebrovasculares</doc><doc>\nDesmayo\nOtros nombres: Desvanecimiento, Síncope\nEnviar esta página a un amigo Imprimir Facebook Twitter Pinterest Suscríbase al RSS\nIntroducción\n\nEl desmayo (o síncope) es una pérdida temporal de la conciencia. Si se esta por desmayar, usted se sentirá mareado, con vértigo o con nauseas. </doc>",
            "response": "Si ves a una persona desmayada en tu portal, es importante que te mantengas tranquilo y sigas estos pasos para ayudarla:\n\n    Verifica si hay pulso y si la persona respira. Si la persona no respira, comienza a hacerle reanimación cardiopulmonar. Llama al 911 o al número de emergencia local. Continúa con la reanimación cardiopulmonar hasta que llegue la ayuda o hasta que la persona comience a respirar.\n\nSi la persona se lesionó en una caída a causa de un desmayo, trata de manera adecuada cualquier golpe, moretón o corte. La piel puede sentirse fría y húmeda. Puede perder el control de sus músculos y caerse.\n\nEl desmayo suele ocurrir cuando la presión sanguínea baja de repente y causa que el flujo de la sangre al cerebro disminuya. Esto es más común en las personas mayores. Entre las causas del desmayo se incluyen:\n\n    Calor o deshidratación\n    Angustia\n    Ponerse de pie demasiado rápido\n    Algunas medicinas\n    Descenso del nivel de azúcar en la sangre\n    Problemas del corazón\n\nSi alguien se desmaya, asegúrese que las vías respiratorias estén despejadas para que pueda respirar sin problemas. La persona debe quedarse acostada unos 10 a 15 minutos. La mayoría de la gente se recupera por completo. Por lo general, los desmayos no son nada de qué preocuparse, pero a veces, pueden ser una señal de algún problema serio. Si se desmayó, es importante que vea a un médico y descubra por qué ocurrió.\n\nNingún texto proporcionado parece estar directamente relacionado con la situación de la persona desmayada. Sin embargo, se recomienda seguir estos pasos generales para ayudar a la persona en caso de desmayo:\n\n    Mantener la calma y evitar movimientos bruscos: Es importante que la persona no se levante o se mueva bruscamente después de desmayarse, ya que esto podría provocar una mayor pérdida de energía y dificultad para recuperarse.\n\n    Colocar a la persona de espaldas: Si la persona se desmaya, es mejor colocarla de espaldas para evitar que se lesione aún más. Si la persona no se encuentra lesionada, pero respira, es mejor que coloques sus piernas por encima del nivel del corazón, de ser posible, para apoyarlas y facilitar su respiración.\n\n    Tratar de mantener la cabeza elevada: Si la persona se desmaya, es mejor que la coloques de lado o de costado para que su cabeza esté elevada. Esto ayuda a prevenir la asfixia y promueve la respiración normal.\n\n    Observar los síntomas: Algunos de los síntomas de desmayo incluyen mareo, vértigo y náuseas. Es importante que la persona sepa cómo ayudarla en caso de que se desmaye.\n\nEn resumen, si ves a una persona desmayada en tu portal, es importante que te mantengas calmado y sigas estos pasos para ayudarla. Aunque algunos de estos consejos pueden parecer obvios, es fundamental recordar que la salud y la seguridad de la persona son prioridades.",
            "reference": "Si encuentras a una persona desmayada, debes seguir estos pasos de primeros auxilios:\n\nColocar a la Persona de Espaldas: Si la persona está respirando y no presenta lesiones evidentes, colócala de espaldas. Si es posible, eleva sus piernas por encima del nivel del corazón, apoyándolas sobre algún objeto a una altura aproximada de 30 centímetros. Esto puede ayudar a mejorar la circulación de la sangre hacia el cerebro​.\n\nAflojar Ropa Ajustada: Afloja cinturones, collares u otra ropa ajustada para facilitar la respiración de la persona​.\n\nNo Levantar Rápidamente a la Persona: Evita levantar a la persona demasiado rápido para reducir la probabilidad de que vuelva a desmayarse. Si la persona no recupera el conocimiento en un minuto, llama inmediatamente al 911 o al número local de emergencias​.\n\nVerificar Respiración y Pulso: Revisa si la persona respira y si tiene pulso. Si la persona no respira, comienza a realizar reanimación cardiopulmonar (RCP) y llama al número de emergencia local. Continúa con la RCP hasta que llegue la ayuda o hasta que la persona comience a respirar​.\n\nTratar Lesiones Relacionadas con la Caída: Si la persona se ha lesionado al caerse, trata cualquier golpe, moretón o corte adecuadamente. Controla el sangrado aplicando presión directa​.\n\nMantener Despejadas las Vías Respiratorias: Asegúrate de que las vías respiratorias de la persona estén despejadas para que pueda respirar sin problemas. La persona debe permanecer acostada unos 10 a 15 minutos​.\n\nEs importante recordar que, aunque la mayoría de los desmayos no son motivo de preocupación grave, en algunos casos pueden ser señal de un problema serio. Por lo tanto, es importante que la persona vea a un médico después de un desmayo para descubrir la causa subyacente."
        },
        {
            "user_input": "¿Cuál es el protocolo de actuación a seguir si me encuentro una persona desmayada?",
            "retrieved_contexts": "<doc>\nGeneralmente, el conocimiento se recupera rápidamente.\n\nPosiblemente, los desmayos no tengan importancia médica. O bien, la causa puede ser un trastorno grave, que ocasionalmente involucra al corazón. Por lo tanto, debes tratar la pérdida del conocimiento como si fuera una emergencia médica hasta que se alivien los síntomas y se identifique la causa. Habla con el proveedor de atención médica si te desmayas más de una vez.\nSi sientes que estás a punto de desmayar\n\n    Recuéstate o siéntate. Para reducir la probabilidad de que vuelvas a desmayarte, no te levantes demasiado rápido.\n    Si te sientas, coloca la cabeza entre las rodillas.\n\nSi otra persona se desmaya\n\n    Coloca de espaldas a la persona. Si no hay lesiones y la persona respira, levanta sus piernas por encima del nivel del corazón, de ser posible. Apoya las piernas de la persona sobre algún objeto a una altura de 12 pulgadas (30 centímetros). Afloja los cinturones, collares u otra ropa ajustada.\n\n    </doc><doc>\nPara reducir la probabilidad de que la persona vuelva a desmayarse, no la levantes demasiado rápido. Si la persona no recupera el conocimiento en un minuto, llama al 911 o al número local de emergencias.\n    Verifica si respira. </doc><doc>\nRevisa si hay pulso y si la persona respira. Si la persona no respira, comienza a hacerle reanimación cardiopulmonar. Llama al 911 o al número de emergencia local. Continúa con la reanimación cardiopulmonar hasta que llegue la ayuda o hasta que la persona comience a respirar.\n\nSi la persona se lesionó en una caída a causa de un desmayo, trata de manera adecuada cualquier golpe, moretón o corte. </doc><doc>\nSu piel puede sentirse fría y húmeda. Puede perder el control de sus músculos y caerse.\n\nEl desmayo suele ocurrir cuando la presión sanguínea baja de repente y causa que el flujo de la sangre al cerebro disminuya. Esto es más común en las personas mayores. Entre las causas del desmayo se incluyen:\n\n    Calor o deshidratación\n    Angustia\n    Ponerse de pie demasiado rápido\n    Algunas medicinas\n    Descenso del nivel de azúcar en la sangre\n    Problemas del corazón\n\nSi alguien se desmaya, asegúrese que las vías respiratorias estén despejadas para que pueda respirar sin problemas. La persona debe quedarse acostada unos 10 a 15 minutos. La mayoría de la gente se recupera por completo. Por lo general, los desmayos no son nada de qué preocuparse, pero a veces, pueden ser una señal de algún problema serio. Si se desmayó, es importante que vea a un médico y descubra por qué ocurrió.\n\nNIH: Instituto Nacional de Trastornos Neurológicos y Accidentes Cerebrovasculares</doc><doc>\n¿Qué hacer en caso de intoxicación?\n\nSi sospecha que ha habido una intoxicación, por ejemplo, por aparición de síntomas gastrointestinales en varias personas que han coincidido en alguna comida:\n\n    Acuda al médico para valorar la necesidad de tratamiento. \n    No consuma los restos de alimentos sospechosos, pero no los tire a la basura inmediatamente por si fuera necesario analizarlos.\n    Evite que esas personas enfermas preparen alimentos, y en todo caso, mantenga las recomendaciones de higiene en la preparación de alimentos. </doc>",
            "response": "En caso de que una persona se desmaye, es fundamental actuar con calma y cuidado, ya que este tipo de desmayos pueden ser una señal de problemas médicos más graves. Aquí te explico el protocolo de actuación a seguir:\n\n    Verificación de signos vitales: Primero, verifica si la persona sigue respirando y tiene pulso. Si no es así, busca señales de que la persona está respirando, como el sonido de sus respiraciones o la presencia de sus pulmones moviéndose. Estos signos pueden indicar que la persona está respirando correctamente y que no necesita atención médica inmediata​.\n\nDesmayo repentino y emergencia médica: Si la persona se desmaya repentinamente y no presenta otros síntomas, como dolor abdominal o dificultad para respirar, lo primero es mantenerla acostada durante al menos 10 a 15 minutos. Esto ayudará a que su cuerpo se recupere lentamente y evitará que se desmaye de nuevo. Si la persona no respira después de 10 minutos, busca atención médica inmediata​.\n\nTratamiento en caso de desmayo repentino: Si la persona se desmaya y no presenta otros síntomas, pero respira y tiene pulso, es probable que solo tenga un desmayo repentino. Este tipo de desmayo es común y no requiere atención médica adicional. Sin embargo, si la persona presenta síntomas gastrointestinales después de haberse desmayado, como náuseas, vómitos o dolor abdominal, acude al médico para evaluar la necesidad de tratamiento​.\n\nDesmayo repentino y problemas de salud: Aunque los desmayos repentinos son comunes y no requieren atención médica inmediata, en algunos casos, pueden ser una señal de problemas de salud más graves. Por ejemplo, el desmayo repentino asociado con problemas cardiacos o neurológicos puede requerir atención médica inmediata. En estos casos, es importante buscar asesoramiento médico y seguir las recomendaciones de un profesional de la salud​.\n\nEn resumen, en caso de que una persona se desmaye, es fundamental actuar con calma y cuidado, verificar su estado físico y buscar atención médica si es necesario. El protocolo de actuación incluye la posibilidad de desmayos repentinos, pero también se deben tener en cuenta los desmayos asociados con problemas de salud más graves.",
            "reference": "Si encuentras a una persona desmayada, debes seguir estos pasos de primeros auxilios:\n\nColocar a la Persona de Espaldas: Si la persona está respirando y no presenta lesiones evidentes, colócala de espaldas. Si es posible, eleva sus piernas por encima del nivel del corazón, apoyándolas sobre algún objeto a una altura aproximada de 30 centímetros. Esto puede ayudar a mejorar la circulación de la sangre hacia el cerebro​.\n\nAflojar Ropa Ajustada: Afloja cinturones, collares u otra ropa ajustada para facilitar la respiración de la persona​.\n\nNo Levantar Rápidamente a la Persona: Evita levantar a la persona demasiado rápido para reducir la probabilidad de que vuelva a desmayarse. Si la persona no recupera el conocimiento en un minuto, llama inmediatamente al 911 o al número local de emergencias​.\n\nVerificar Respiración y Pulso: Revisa si la persona respira y si tiene pulso. Si la persona no respira, comienza a realizar reanimación cardiopulmonar (RCP) y llama al número de emergencia local. Continúa con la RCP hasta que llegue la ayuda o hasta que la persona comience a respirar​.\n\nTratar Lesiones Relacionadas con la Caída: Si la persona se ha lesionado al caerse, trata cualquier golpe, moretón o corte adecuadamente. Controla el sangrado aplicando presión directa​.\n\nMantener Despejadas las Vías Respiratorias: Asegúrate de que las vías respiratorias de la persona estén despejadas para que pueda respirar sin problemas. La persona debe permanecer acostada unos 10 a 15 minutos​.\n\nEs importante recordar que, aunque la mayoría de los desmayos no son motivo de preocupación grave, en algunos casos pueden ser señal de un problema serio. Por lo tanto, es importante que la persona vea a un médico después de un desmayo para descubrir la causa subyacente."
        },
        {
            "user_input": "Buenas tardes, me acabo de encontrar a una vecina desmayada en la calle y me gustaría saber qué tengo que hacer.",
            "retrieved_contexts": "<doc>\nGeneralmente, el conocimiento se recupera rápidamente.\n\nPosiblemente, los desmayos no tengan importancia médica. O bien, la causa puede ser un trastorno grave, que ocasionalmente involucra al corazón. Por lo tanto, debes tratar la pérdida del conocimiento como si fuera una emergencia médica hasta que se alivien los síntomas y se identifique la causa. Habla con el proveedor de atención médica si te desmayas más de una vez.\nSi sientes que estás a punto de desmayar\n\n    Recuéstate o siéntate. Para reducir la probabilidad de que vuelvas a desmayarte, no te levantes demasiado rápido.\n    Si te sientas, coloca la cabeza entre las rodillas.\n\nSi otra persona se desmaya\n\n    Coloca de espaldas a la persona. Si no hay lesiones y la persona respira, levanta sus piernas por encima del nivel del corazón, de ser posible. Apoya las piernas de la persona sobre algún objeto a una altura de 12 pulgadas (30 centímetros). Afloja los cinturones, collares u otra ropa ajustada.\n\n    </doc><doc>\nPara reducir la probabilidad de que la persona vuelva a desmayarse, no la levantes demasiado rápido. Si la persona no recupera el conocimiento en un minuto, llama al 911 o al número local de emergencias.\n    Verifica si respira. </doc><doc>\nRevisa si hay pulso y si la persona respira. Si la persona no respira, comienza a hacerle reanimación cardiopulmonar. Llama al 911 o al número de emergencia local. Continúa con la reanimación cardiopulmonar hasta que llegue la ayuda o hasta que la persona comience a respirar.\n\nSi la persona se lesionó en una caída a causa de un desmayo, trata de manera adecuada cualquier golpe, moretón o corte. </doc><doc>\nSu piel puede sentirse fría y húmeda. Puede perder el control de sus músculos y caerse.\n\nEl desmayo suele ocurrir cuando la presión sanguínea baja de repente y causa que el flujo de la sangre al cerebro disminuya. Esto es más común en las personas mayores. Entre las causas del desmayo se incluyen:\n\n    Calor o deshidratación\n    Angustia\n    Ponerse de pie demasiado rápido\n    Algunas medicinas\n    Descenso del nivel de azúcar en la sangre\n    Problemas del corazón\n\nSi alguien se desmaya, asegúrese que las vías respiratorias estén despejadas para que pueda respirar sin problemas. La persona debe quedarse acostada unos 10 a 15 minutos. La mayoría de la gente se recupera por completo. Por lo general, los desmayos no son nada de qué preocuparse, pero a veces, pueden ser una señal de algún problema serio. Si se desmayó, es importante que vea a un médico y descubra por qué ocurrió.\n\nNIH: Instituto Nacional de Trastornos Neurológicos y Accidentes Cerebrovasculares</doc><doc>\nDesmayo\nOtros nombres: Desvanecimiento, Síncope\nEnviar esta página a un amigo Imprimir Facebook Twitter Pinterest Suscríbase al RSS\nIntroducción\n\nEl desmayo (o síncope) es una pérdida temporal de la conciencia. Si se esta por desmayar, usted se sentirá mareado, con vértigo o con nauseas. </doc>",
            "response": "Lo siento, pero no puedo responder a esa pregunta porque no he encontrado información relevante en el contexto proporcionado. ¿Podría proporcionar más detalles o contexto? Estoy aquí para ayudarlo en lo que pueda.",
            "reference": "Si encuentras a una persona desmayada, debes seguir estos pasos de primeros auxilios:\n\nColocar a la Persona de Espaldas: Si la persona está respirando y no presenta lesiones evidentes, colócala de espaldas. Si es posible, eleva sus piernas por encima del nivel del corazón, apoyándolas sobre algún objeto a una altura aproximada de 30 centímetros. Esto puede ayudar a mejorar la circulación de la sangre hacia el cerebro​.\n\nAflojar Ropa Ajustada: Afloja cinturones, collares u otra ropa ajustada para facilitar la respiración de la persona​.\n\nNo Levantar Rápidamente a la Persona: Evita levantar a la persona demasiado rápido para reducir la probabilidad de que vuelva a desmayarse. Si la persona no recupera el conocimiento en un minuto, llama inmediatamente al 911 o al número local de emergencias​.\n\nVerificar Respiración y Pulso: Revisa si la persona respira y si tiene pulso. Si la persona no respira, comienza a realizar reanimación cardiopulmonar (RCP) y llama al número de emergencia local. Continúa con la RCP hasta que llegue la ayuda o hasta que la persona comience a respirar​.\n\nTratar Lesiones Relacionadas con la Caída: Si la persona se ha lesionado al caerse, trata cualquier golpe, moretón o corte adecuadamente. Controla el sangrado aplicando presión directa​.\n\nMantener Despejadas las Vías Respiratorias: Asegúrate de que las vías respiratorias de la persona estén despejadas para que pueda respirar sin problemas. La persona debe permanecer acostada unos 10 a 15 minutos​.\n\nEs importante recordar que, aunque la mayoría de los desmayos no son motivo de preocupación grave, en algunos casos pueden ser señal de un problema serio. Por lo tanto, es importante que la persona vea a un médico después de un desmayo para descubrir la causa subyacente."
        },
        {
            "user_input": "Cómo reaccionar si encuentro una persona desmayada en la calle",
            "retrieved_contexts": "<doc>\nPara reducir la probabilidad de que la persona vuelva a desmayarse, no la levantes demasiado rápido. Si la persona no recupera el conocimiento en un minuto, llama al 911 o al número local de emergencias.\n    Verifica si respira. </doc><doc>\nGeneralmente, el conocimiento se recupera rápidamente.\n\nPosiblemente, los desmayos no tengan importancia médica. O bien, la causa puede ser un trastorno grave, que ocasionalmente involucra al corazón. Por lo tanto, debes tratar la pérdida del conocimiento como si fuera una emergencia médica hasta que se alivien los síntomas y se identifique la causa. Habla con el proveedor de atención médica si te desmayas más de una vez.\nSi sientes que estás a punto de desmayar\n\n    Recuéstate o siéntate. Para reducir la probabilidad de que vuelvas a desmayarte, no te levantes demasiado rápido.\n    Si te sientas, coloca la cabeza entre las rodillas.\n\nSi otra persona se desmaya\n\n    Coloca de espaldas a la persona. Si no hay lesiones y la persona respira, levanta sus piernas por encima del nivel del corazón, de ser posible. Apoya las piernas de la persona sobre algún objeto a una altura de 12 pulgadas (30 centímetros). Afloja los cinturones, collares u otra ropa ajustada.\n\n    </doc><doc>\nRevisa si hay pulso y si la persona respira. Si la persona no respira, comienza a hacerle reanimación cardiopulmonar. Llama al 911 o al número de emergencia local. Continúa con la reanimación cardiopulmonar hasta que llegue la ayuda o hasta que la persona comience a respirar.\n\nSi la persona se lesionó en una caída a causa de un desmayo, trata de manera adecuada cualquier golpe, moretón o corte. </doc><doc>\nSu piel puede sentirse fría y húmeda. Puede perder el control de sus músculos y caerse.\n\nEl desmayo suele ocurrir cuando la presión sanguínea baja de repente y causa que el flujo de la sangre al cerebro disminuya. Esto es más común en las personas mayores. Entre las causas del desmayo se incluyen:\n\n    Calor o deshidratación\n    Angustia\n    Ponerse de pie demasiado rápido\n    Algunas medicinas\n    Descenso del nivel de azúcar en la sangre\n    Problemas del corazón\n\nSi alguien se desmaya, asegúrese que las vías respiratorias estén despejadas para que pueda respirar sin problemas. La persona debe quedarse acostada unos 10 a 15 minutos. La mayoría de la gente se recupera por completo. Por lo general, los desmayos no son nada de qué preocuparse, pero a veces, pueden ser una señal de algún problema serio. Si se desmayó, es importante que vea a un médico y descubra por qué ocurrió.\n\nNIH: Instituto Nacional de Trastornos Neurológicos y Accidentes Cerebrovasculares</doc><doc>\nGracias a la ayuda de un psiquiatra, el Dr. </doc>",
            "response": "En primer lugar, es importante recordar que un desmayo es una situación médica grave y potencialmente peligrosa. Si alguien se desmaya, es crucial actuar con calma y cuidado, ya que esto puede salvar la vida de la persona en cuestión. Aquí te presento tres maneras en las que puedes ayudar a una persona desmayada:\n\n    Verificación de signos vitales: La primera cosa que debes hacer es verificar si la persona está respirando y si tiene signos vitales como latido cardíaco y presión arterial. Si la persona no respira o tiene una presión arterial baja, debes actuar con urgencia.\n\n    Reanimación cardiopulmonar (RCP): Si la persona está desmayada, es probable que no esté respirando o tenga una presión arterial baja. En este caso, debes actuar con rapidez y realizar RCP para restaurar el flujo sanguíneo al cerebro. Esto incluye la administración de oxígeno y el apoyo respiratorio si es necesario.\n\n    Apoyo terapéutico: Si la persona está desmayada y no presenta signos vitales, puedes brindarle apoyo terapéutico para ayudarla a recuperar el conocimiento. Esto incluye la colocación de la persona en una posición cómoda y la provisión de agua y comida para mantenerla hidratada y confortable.\n\n    Tratamiento médico: Si la persona se desmaya y presenta signos vitales, debes buscar atención médica profesional para determinar la causa subyacente y brindar tratamiento adecuado.\n\nEn resumen, si encuentras a una persona desmayada en la calle, debes actuar con calma y cuidado, verificar su estado físico y brindar apoyo terapéutico para ayudarla a recuperar el conocimiento. Si la persona presenta signos vitales y no presenta lesiones, puedes brindarle atención médica profesional para determinar la causa subyacente y brindar tratamiento adecuado.",
            "reference": "Si encuentras a una persona desmayada, debes seguir estos pasos de primeros auxilios:\n\nColocar a la Persona de Espaldas: Si la persona está respirando y no presenta lesiones evidentes, colócala de espaldas. Si es posible, eleva sus piernas por encima del nivel del corazón, apoyándolas sobre algún objeto a una altura aproximada de 30 centímetros. Esto puede ayudar a mejorar la circulación de la sangre hacia el cerebro​.\n\nAflojar Ropa Ajustada: Afloja cinturones, collares u otra ropa ajustada para facilitar la respiración de la persona​.\n\nNo Levantar Rápidamente a la Persona: Evita levantar a la persona demasiado rápido para reducir la probabilidad de que vuelva a desmayarse. Si la persona no recupera el conocimiento en un minuto, llama inmediatamente al 911 o al número local de emergencias​.\n\nVerificar Respiración y Pulso: Revisa si la persona respira y si tiene pulso. Si la persona no respira, comienza a realizar reanimación cardiopulmonar (RCP) y llama al número de emergencia local. Continúa con la RCP hasta que llegue la ayuda o hasta que la persona comience a respirar​.\n\nTratar Lesiones Relacionadas con la Caída: Si la persona se ha lesionado al caerse, trata cualquier golpe, moretón o corte adecuadamente. Controla el sangrado aplicando presión directa​.\n\nMantener Despejadas las Vías Respiratorias: Asegúrate de que las vías respiratorias de la persona estén despejadas para que pueda respirar sin problemas. La persona debe permanecer acostada unos 10 a 15 minutos​.\n\nEs importante recordar que, aunque la mayoría de los desmayos no son motivo de preocupación grave, en algunos casos pueden ser señal de un problema serio. Por lo tanto, es importante que la persona vea a un médico después de un desmayo para descubrir la causa subyacente."
        },
        {
            "user_input": "hay gatos callejeros en mi comunidad, qué puedeo hacer? vivo en madrid",
            "retrieved_contexts": "<doc>\nInfraccio...\nHome\nSede electrónica\nCiudadanía\nTemas\nSalud\nAnimales domésticos\nAumentar fuenteReducir fuenteImprimir Añadir a favoritos  COMPARTE ESTA PÁGINA \n\nEscuchar\nAnimales. Censado y seguimiento de colonias felinas\n\nInformación\nRequisitos\nCómo realizar el trámite\nDocumentación\nMás Información\nDescripción\nComo consecuencia de la necesidad de mejorar la gestión de las poblaciones incontroladas de gatos en nuestra ciudad se ha implementado un nuevo procedimiento de actuación en el control de las mismas, basado en la estrategia CER (capturar, esterilizar y retornar), con el objetivo de controlar el tamaño de las colonias de gatos urbanos, así como minimizar los problemas asociados a la presencia de estos mediante la esterilización de los ejemplares que las integran, y facilitar el conocimiento y la adopción de unas buenas prácticas en la gestión de las misma.\n\nCon este fin, el Ayuntamiento de Madrid mantiene un censo de colonias y poblaciones felinas a efectos de contar con información sobre el número y ubicación de las poblaciones de gatos urbanos para definir, cuantificar, implementar y evaluar las estrategias de actuación, de asignar personas colaboradoras, y de facilitar  el acceso a la esterilización de ejemplares de manera gratuita. La inclusión en este censo no implica ningún tipo de autorización por parte del Ayuntamiento de Madrid.\n\nEl registro de una colonia o población felina podrá realizarse a partir de:\n\nCensado de una colonia felina ya asentada en una ubicación existente, mediante declaración responsable de cualquier persona que quiera alcanzar la condición de persona colaboradora responsable.\nCensado de oficio, por parte de los servicios municipales, como consecuencia de quejas o avisos formulados por la ciudadanía o por cualquier organismo o entidad.\nEn el caso de colonias o poblaciones felinas comunicadas mediante declaración responsable, la persona colaboradora responsable habrá de remitir un informe anual de seguimiento de la misma.\n\nA través de este trámite se podrá solicitar también la modificación o ampliación de los datos aportados (baja, cambio de datos personales, alta de nuevos interesados)\n\nImporte\nGratuito\n\nTramitar\nEn línea\nRegistro Electrónico\n\nPresencial\nSin cita previa\nOficinas de registro municipales que atienden SIN cita previa\n\nCon cita previa obligatoria\nOficinas de Atención a la Ciudadanía (OAC). Línea Madrid\n\nRedes sociales\nTwitter\n\nhttps://twitter.com/LineaMadrid\n\nFacebook\n\nhttps://www.facebook.com/LineaMadrid\n\nInformación relacionada\nModelos de formularios\nFormulario de solicitud (presencial)\nInformación relacionada\nDirecciones y teléfonos\nCentro de Protección Animal\nDocumentación\nInstrucciones. </doc><doc>\nComunicación, modificación o ampliación de datos en el registro de colonias felinas\nInstrucciones. Comunicación de incidencias o quejas por presencia de gatos urbanos\nMás datos\nCurso sobre buenas prácticas en la gestión de colonias felinas del Ayuntamiento de Madrid\nOtros trámites\nAnimales. Solicitud de esterilización de gatos de colonia felina censada\nAnimales. Obtención de acreditación de persona colaboradora en gestión de colonias felinas\nOtros contenidos\nPreguntas frecuentes sobre la gestión de colonias de gatos urbanos\nTríptico de Colonias felinas\nPautas de buenas prácticas en gestión de colonias de gatos urbanos\nDerechos y obligaciones de los colaboradores en la gestión de colonias felinas</doc><doc>\n9. Evita entrar en contacto con los areneros donde juegan los niños. Los gatos callejeros, más proclives a infectarse, pueden utilizarlos para hacer sus necesidades.\n10. </doc><doc>\nDeclaración responsable para la consolidación de colonias de gatos urbanos\nInstrucciones. </doc><doc>\nAlgunas de las especies que se pueden encontrar son boletus, senderuelas, setas de cardo o setas pie azul.\n\nSin duda, salir a buscar setas en Madrid es una de las mejores terapias que podemos hacer. Ideal para desintoxicarnos del ajetreo de una gran cuidad, y además lo tenemos a un paso, ya no nos quedan excusas.\n\n</doc>",
            "response": "Para abordar tu pregunta, primero es importante entender que los gatos callejeros en una comunidad pueden ser una amenaza para la salud y la seguridad de los residentes. Por lo tanto, es fundamental tomar medidas para controlar estas poblaciones y garantizar la seguridad de los habitantes.\n\nAquí te presento algunas estrategias y recomendaciones basadas en la información obtenida en diferentes fuentes:\n\n    Control de Colonias Felinas: El Ayuntamiento de Madrid ha implementado un nuevo procedimiento de actuación en el control de las colonias de gatos urbanos. Esta estrategia se basa en la captura, esterilización y devolución de los gatos para reducir el tamaño de las colonias y minimizar los problemas asociados a su presencia. Además, se busca facilitar el conocimiento y la adopción de buenas prácticas en la gestión de estas poblaciones​.\n\nEsterilización de Gatos Urbanos: Si tienes un gato callejero y deseas evitar que se reproduzca, puedes considerar la esterilización de tu mascota. Esto es especialmente importante si tu gato es de una especie que puede infectarse con enfermedades transmitidas por gatos, como el virus felino infeccioso (VFI)​.\n\nControl de Insectos: Los gatos callejeros pueden estar rodeados de insectos, como pulgas y garrapatas, que pueden transmitir enfermedades. Puedes tomar medidas para controlar estos insectos, como limpiar regularmente el entorno de tu gato y ofrecerle tratamiento preventivo contra pulgas y garrapatas​.\n\nSeguimiento y Registro: Es fundamental mantener un registro de las colonias de gatos en tu área para tener una idea de su tamaño y distribución. Esto te permitirá identificar áreas problemáticas y ajustar tus estrategias de control según sea necesario. Además, puedes participar en el censo de colonias felinas, lo que puede ayudar a obtener información valiosa sobre las poblaciones de gatos en tu comunidad​.\n\nRecuerda que la implementación de estas estrategias puede requerir tiempo y esfuerzo, pero trabajar juntos con otros residentes y autoridades locales puede ayudar a lograr un impacto positivo en la supervivencia de los gatos callejeros.",
            "reference": "Si te encuentras con gatos callejeros en tu comunidad en Madrid, hay varias acciones que puedes tomar:\n\nConocer el procedimiento CER: Madrid implementa la estrategia CER (capturar, esterilizar y retornar) para gestionar las poblaciones incontroladas de gatos. El objetivo es controlar el tamaño de las colonias de gatos urbanos y minimizar los problemas asociados a su presencia, principalmente a través de la esterilización​​.\n\nRegistrar la colonia felina: Puedes registrar una colonia felina ya existente o notificar a los servicios municipales sobre la presencia de gatos callejeros. Esto se puede hacer como persona colaboradora responsable, lo que implica asumir ciertas responsabilidades y presentar un informe anual de seguimiento de la colonia​​.\n\nRealizar el trámite en línea o presencialmente: Para registrar una colonia felina o comunicar incidencias, puedes completar el trámite en línea a través del Registro Electrónico del Ayuntamiento de Madrid o hacerlo presencialmente en las oficinas de asistencia en materia de registro​​.\n\nUtilizar los formularios adecuados: Existen formularios específicos para la consolidación de colonias de gatos urbanos, la comunicación o modificación de datos en el registro de colonias felinas, y para la comunicación de incidencias o quejas por la presencia de gatos urbanos​​.\n\nEs importante actuar de manera responsable y considerada hacia los animales y la comunidad, y seguir las pautas establecidas por las autoridades locales para garantizar el bienestar de los gatos callejeros."
        },
        {
            "user_input": "hay gatos que no son de nadie en mi comunidad, qué podemos hacer con ellos? vivimos en Madrid",
            "retrieved_contexts": "<doc>\nInfraccio...\nHome\nSede electrónica\nCiudadanía\nTemas\nSalud\nAnimales domésticos\nAumentar fuenteReducir fuenteImprimir Añadir a favoritos  COMPARTE ESTA PÁGINA \n\nEscuchar\nAnimales. Censado y seguimiento de colonias felinas\n\nInformación\nRequisitos\nCómo realizar el trámite\nDocumentación\nMás Información\nDescripción\nComo consecuencia de la necesidad de mejorar la gestión de las poblaciones incontroladas de gatos en nuestra ciudad se ha implementado un nuevo procedimiento de actuación en el control de las mismas, basado en la estrategia CER (capturar, esterilizar y retornar), con el objetivo de controlar el tamaño de las colonias de gatos urbanos, así como minimizar los problemas asociados a la presencia de estos mediante la esterilización de los ejemplares que las integran, y facilitar el conocimiento y la adopción de unas buenas prácticas en la gestión de las misma.\n\nCon este fin, el Ayuntamiento de Madrid mantiene un censo de colonias y poblaciones felinas a efectos de contar con información sobre el número y ubicación de las poblaciones de gatos urbanos para definir, cuantificar, implementar y evaluar las estrategias de actuación, de asignar personas colaboradoras, y de facilitar  el acceso a la esterilización de ejemplares de manera gratuita. La inclusión en este censo no implica ningún tipo de autorización por parte del Ayuntamiento de Madrid.\n\nEl registro de una colonia o población felina podrá realizarse a partir de:\n\nCensado de una colonia felina ya asentada en una ubicación existente, mediante declaración responsable de cualquier persona que quiera alcanzar la condición de persona colaboradora responsable.\nCensado de oficio, por parte de los servicios municipales, como consecuencia de quejas o avisos formulados por la ciudadanía o por cualquier organismo o entidad.\nEn el caso de colonias o poblaciones felinas comunicadas mediante declaración responsable, la persona colaboradora responsable habrá de remitir un informe anual de seguimiento de la misma.\n\nA través de este trámite se podrá solicitar también la modificación o ampliación de los datos aportados (baja, cambio de datos personales, alta de nuevos interesados)\n\nImporte\nGratuito\n\nTramitar\nEn línea\nRegistro Electrónico\n\nPresencial\nSin cita previa\nOficinas de registro municipales que atienden SIN cita previa\n\nCon cita previa obligatoria\nOficinas de Atención a la Ciudadanía (OAC). Línea Madrid\n\nRedes sociales\nTwitter\n\nhttps://twitter.com/LineaMadrid\n\nFacebook\n\nhttps://www.facebook.com/LineaMadrid\n\nInformación relacionada\nModelos de formularios\nFormulario de solicitud (presencial)\nInformación relacionada\nDirecciones y teléfonos\nCentro de Protección Animal\nDocumentación\nInstrucciones. </doc><doc>\nComunicación, modificación o ampliación de datos en el registro de colonias felinas\nInstrucciones. Comunicación de incidencias o quejas por presencia de gatos urbanos\nMás datos\nCurso sobre buenas prácticas en la gestión de colonias felinas del Ayuntamiento de Madrid\nOtros trámites\nAnimales. Solicitud de esterilización de gatos de colonia felina censada\nAnimales. Obtención de acreditación de persona colaboradora en gestión de colonias felinas\nOtros contenidos\nPreguntas frecuentes sobre la gestión de colonias de gatos urbanos\nTríptico de Colonias felinas\nPautas de buenas prácticas en gestión de colonias de gatos urbanos\nDerechos y obligaciones de los colaboradores en la gestión de colonias felinas</doc><doc>\n4. Puede que no sea de la raza que yo quiero\nLa raza no es lo más importante en vuestro camino, sino su carácter y cómo lo eduques tú. Aun así, también puedes adoptar animales de raza. Encuentra en Madrid o el resto de España el tuyo aquí.\n</doc><doc>\nAlgunas de las especies que se pueden encontrar son boletus, senderuelas, setas de cardo o setas pie azul.\n\nSin duda, salir a buscar setas en Madrid es una de las mejores terapias que podemos hacer. Ideal para desintoxicarnos del ajetreo de una gran cuidad, y además lo tenemos a un paso, ya no nos quedan excusas.\n\n</doc><doc>\nIncluso, si te pasas por uno de estos lugares, puedes conocerlos a todos y ver con cuál conectas.\n#5 Les das una nueva oportunidad\n\nRecuerda que también es muy importante adoptar a perros y gatos adultos o mayores. Éstos seguramente han sido abandonados y lo han pasado muy mal, les estás dando una nueva vida y oportunidad que agradecerán dándote todo el amor del mundo.\n\nAdemás, ten en cuenta que los perros y gatos con anteriores dueños es probable que se adapten mejor a tu casa porque ya han adoptado ciertas conductas de comportamiento.\n\n¡Su cariño mejorará tu salud, y el tuyo la suya!</doc>",
            "response": "En Madrid, existen diversas opciones para manejar con éxito a los gatos que no son de nadie en tu comunidad. Aquí te presento tres enfoques basados en diferentes fuentes:\n\n    Control de Colonias Felinas: El Ayuntamiento de Madrid mantiene un censo de colonias y poblaciones felinas para contar con información sobre el número y ubicación de estas. Esta información es valiosa para definir, cuantificar, implementar y evaluar estrategias de actuación, así como asignar personas colaboradoras. Además, la inclusión en este censo no implica ningún tipo de autorización por parte del Ayuntamiento​.\n\nEsterilización de Gatos: Si encuentras gatos callejeros sin dueño, puedes solicitar la esterilización de estos. Esta medida puede ayudar a reducir la población de gatos no queridos y a mejorar la salud de los gatos adultos o mayores que ya tienen dueños. Puedes hacerlo en la Oficina de Protección Animal de Madrid, donde se puede realizar una solicitud presencialmente o a través del Registro Electrónico​.\n\nGastronomía y Cultura Local: Salir a buscar setas en Madrid es una actividad disfrutable y ambiental, ofreciendo una conexión con la naturaleza y una forma de desconectar del estrés urbano. También, puedes adoptar animales de raza, como boletus, senderuelas, setas de cardo o setas pie azul, ofreciendo una oportunidad de conectar con la naturaleza y la cultura local.\n\nEn resumen, manejar gatos no de nadie en Madrid implica una combinación de estrategias tanto en términos de control de colonias felinas como de educación y amor hacia estos animales. Al aprovechar las oportunidades de aprendizaje y conexión con la naturaleza, podemos trabajar juntos para crear un entorno más saludable y armonioso para todos los involucrados.",
            "reference": "Si te encuentras con gatos callejeros en tu comunidad en Madrid, hay varias acciones que puedes tomar:\n\nConocer el procedimiento CER: Madrid implementa la estrategia CER (capturar, esterilizar y retornar) para gestionar las poblaciones incontroladas de gatos. El objetivo es controlar el tamaño de las colonias de gatos urbanos y minimizar los problemas asociados a su presencia, principalmente a través de la esterilización​​.\n\nRegistrar la colonia felina: Puedes registrar una colonia felina ya existente o notificar a los servicios municipales sobre la presencia de gatos callejeros. Esto se puede hacer como persona colaboradora responsable, lo que implica asumir ciertas responsabilidades y presentar un informe anual de seguimiento de la colonia​​.\n\nRealizar el trámite en línea o presencialmente: Para registrar una colonia felina o comunicar incidencias, puedes completar el trámite en línea a través del Registro Electrónico del Ayuntamiento de Madrid o hacerlo presencialmente en las oficinas de asistencia en materia de registro​​.\n\nUtilizar los formularios adecuados: Existen formularios específicos para la consolidación de colonias de gatos urbanos, la comunicación o modificación de datos en el registro de colonias felinas, y para la comunicación de incidencias o quejas por la presencia de gatos urbanos​​.\n\nEs importante actuar de manera responsable y considerada hacia los animales y la comunidad, y seguir las pautas establecidas por las autoridades locales para garantizar el bienestar de los gatos callejeros."
        },
        {
            "user_input": "si vivimos en Madrid y en nuestra comunidad de propietarios hay gatos callejeros, qué podemos hacer?",
            "retrieved_contexts": "<doc>\nInfraccio...\nHome\nSede electrónica\nCiudadanía\nTemas\nSalud\nAnimales domésticos\nAumentar fuenteReducir fuenteImprimir Añadir a favoritos  COMPARTE ESTA PÁGINA \n\nEscuchar\nAnimales. Censado y seguimiento de colonias felinas\n\nInformación\nRequisitos\nCómo realizar el trámite\nDocumentación\nMás Información\nDescripción\nComo consecuencia de la necesidad de mejorar la gestión de las poblaciones incontroladas de gatos en nuestra ciudad se ha implementado un nuevo procedimiento de actuación en el control de las mismas, basado en la estrategia CER (capturar, esterilizar y retornar), con el objetivo de controlar el tamaño de las colonias de gatos urbanos, así como minimizar los problemas asociados a la presencia de estos mediante la esterilización de los ejemplares que las integran, y facilitar el conocimiento y la adopción de unas buenas prácticas en la gestión de las misma.\n\nCon este fin, el Ayuntamiento de Madrid mantiene un censo de colonias y poblaciones felinas a efectos de contar con información sobre el número y ubicación de las poblaciones de gatos urbanos para definir, cuantificar, implementar y evaluar las estrategias de actuación, de asignar personas colaboradoras, y de facilitar  el acceso a la esterilización de ejemplares de manera gratuita. La inclusión en este censo no implica ningún tipo de autorización por parte del Ayuntamiento de Madrid.\n\nEl registro de una colonia o población felina podrá realizarse a partir de:\n\nCensado de una colonia felina ya asentada en una ubicación existente, mediante declaración responsable de cualquier persona que quiera alcanzar la condición de persona colaboradora responsable.\nCensado de oficio, por parte de los servicios municipales, como consecuencia de quejas o avisos formulados por la ciudadanía o por cualquier organismo o entidad.\nEn el caso de colonias o poblaciones felinas comunicadas mediante declaración responsable, la persona colaboradora responsable habrá de remitir un informe anual de seguimiento de la misma.\n\nA través de este trámite se podrá solicitar también la modificación o ampliación de los datos aportados (baja, cambio de datos personales, alta de nuevos interesados)\n\nImporte\nGratuito\n\nTramitar\nEn línea\nRegistro Electrónico\n\nPresencial\nSin cita previa\nOficinas de registro municipales que atienden SIN cita previa\n\nCon cita previa obligatoria\nOficinas de Atención a la Ciudadanía (OAC). Línea Madrid\n\nRedes sociales\nTwitter\n\nhttps://twitter.com/LineaMadrid\n\nFacebook\n\nhttps://www.facebook.com/LineaMadrid\n\nInformación relacionada\nModelos de formularios\nFormulario de solicitud (presencial)\nInformación relacionada\nDirecciones y teléfonos\nCentro de Protección Animal\nDocumentación\nInstrucciones. </doc><doc>\nComunicación, modificación o ampliación de datos en el registro de colonias felinas\nInstrucciones. Comunicación de incidencias o quejas por presencia de gatos urbanos\nMás datos\nCurso sobre buenas prácticas en la gestión de colonias felinas del Ayuntamiento de Madrid\nOtros trámites\nAnimales. Solicitud de esterilización de gatos de colonia felina censada\nAnimales. Obtención de acreditación de persona colaboradora en gestión de colonias felinas\nOtros contenidos\nPreguntas frecuentes sobre la gestión de colonias de gatos urbanos\nTríptico de Colonias felinas\nPautas de buenas prácticas en gestión de colonias de gatos urbanos\nDerechos y obligaciones de los colaboradores en la gestión de colonias felinas</doc><doc>\n9. Evita entrar en contacto con los areneros donde juegan los niños. Los gatos callejeros, más proclives a infectarse, pueden utilizarlos para hacer sus necesidades.\n10. </doc><doc>\nDeclaración responsable para la consolidación de colonias de gatos urbanos\nInstrucciones. </doc><doc>\nAlgunas de las especies que se pueden encontrar son boletus, senderuelas, setas de cardo o setas pie azul.\n\nSin duda, salir a buscar setas en Madrid es una de las mejores terapias que podemos hacer. Ideal para desintoxicarnos del ajetreo de una gran cuidad, y además lo tenemos a un paso, ya no nos quedan excusas.\n\n</doc>",
            "response": "Si vives en Madrid y en tu comunidad de propietarios hay gatos callejeros, hay varias acciones que puedes tomar para ayudar a mantener la salud y bienestar de estos animales. Aquí te presento algunas recomendaciones basadas en la información obtenida:\n\n    Control de Colonias Felinas: El Ayuntamiento de Madrid mantiene un censo de colonias y poblaciones felinas para monitorear el número y ubicación de estas en la ciudad. Puedes participar en este proceso registrando una colonia o población felina. Esto te permitirá conocer mejor las necesidades de estos animales y adaptar tus acciones de manera más efectiva​.\n\nEsterilización y Regreso: Una estrategia importante es la esterilización y regreso de los gatos callejeros. Esta técnica implica capturar al gato, esterilizarlo y devolverlo a su hogar. Al hacerlo, reduces el número de gatos sin hogar, disminuyendo así la población en general. Además, al devolver al gato a su hogar, se reduce el estrés que puede experimentar durante el traslado​.\n\nGestión de Colonias Felinas: La gestión de colonias felinas implica la identificación, control y eliminación de estas. Esto incluye la búsqueda de las colonias, la evaluación de su tamaño y ubicación, y la planificación de medidas para su control y eliminación. En tu comunidad, puedes ayudar al Ayuntamiento de Madrid y a los servicios de control de animales a gestionar las colonias felinas, asegurando que se manejan de manera segura y responsable​.\n\nInformación sobre Gatos Urbanos: Es importante conocer más sobre estos animales para poder brindarles la atención y apoyo adecuados. Algunas especies comunes que se encuentran en Madrid son gatos salvajes, gatos callejeros y gatos de compañía. Cada uno tiene sus propias necesidades y comportamientos, por lo que es fundamental abordarlos de manera individualizada​.\n\nRecuerda que, al participar en la gestión de colonias felinas y en la salud de los gatos callejeros, estás contribuyendo a un entorno más saludable y armonioso para todos.",
            "reference": "Si te encuentras con gatos callejeros en tu comunidad en Madrid, hay varias acciones que puedes tomar:\n\nConocer el procedimiento CER: Madrid implementa la estrategia CER (capturar, esterilizar y retornar) para gestionar las poblaciones incontroladas de gatos. El objetivo es controlar el tamaño de las colonias de gatos urbanos y minimizar los problemas asociados a su presencia, principalmente a través de la esterilización​​.\n\nRegistrar la colonia felina: Puedes registrar una colonia felina ya existente o notificar a los servicios municipales sobre la presencia de gatos callejeros. Esto se puede hacer como persona colaboradora responsable, lo que implica asumir ciertas responsabilidades y presentar un informe anual de seguimiento de la colonia​​.\n\nRealizar el trámite en línea o presencialmente: Para registrar una colonia felina o comunicar incidencias, puedes completar el trámite en línea a través del Registro Electrónico del Ayuntamiento de Madrid o hacerlo presencialmente en las oficinas de asistencia en materia de registro​​.\n\nUtilizar los formularios adecuados: Existen formularios específicos para la consolidación de colonias de gatos urbanos, la comunicación o modificación de datos en el registro de colonias felinas, y para la comunicación de incidencias o quejas por la presencia de gatos urbanos​​.\n\nEs importante actuar de manera responsable y considerada hacia los animales y la comunidad, y seguir las pautas establecidas por las autoridades locales para garantizar el bienestar de los gatos callejeros."
        },
        {
            "user_input": "Hola, me gustaría saber qué tengo que hacer si en mi comunidad  propietarios en la ciudad de Madrid hay gatos callejeros. muchas gracias",
            "retrieved_contexts": "<doc>\nInfraccio...\nHome\nSede electrónica\nCiudadanía\nTemas\nSalud\nAnimales domésticos\nAumentar fuenteReducir fuenteImprimir Añadir a favoritos  COMPARTE ESTA PÁGINA \n\nEscuchar\nAnimales. Censado y seguimiento de colonias felinas\n\nInformación\nRequisitos\nCómo realizar el trámite\nDocumentación\nMás Información\nDescripción\nComo consecuencia de la necesidad de mejorar la gestión de las poblaciones incontroladas de gatos en nuestra ciudad se ha implementado un nuevo procedimiento de actuación en el control de las mismas, basado en la estrategia CER (capturar, esterilizar y retornar), con el objetivo de controlar el tamaño de las colonias de gatos urbanos, así como minimizar los problemas asociados a la presencia de estos mediante la esterilización de los ejemplares que las integran, y facilitar el conocimiento y la adopción de unas buenas prácticas en la gestión de las misma.\n\nCon este fin, el Ayuntamiento de Madrid mantiene un censo de colonias y poblaciones felinas a efectos de contar con información sobre el número y ubicación de las poblaciones de gatos urbanos para definir, cuantificar, implementar y evaluar las estrategias de actuación, de asignar personas colaboradoras, y de facilitar  el acceso a la esterilización de ejemplares de manera gratuita. La inclusión en este censo no implica ningún tipo de autorización por parte del Ayuntamiento de Madrid.\n\nEl registro de una colonia o población felina podrá realizarse a partir de:\n\nCensado de una colonia felina ya asentada en una ubicación existente, mediante declaración responsable de cualquier persona que quiera alcanzar la condición de persona colaboradora responsable.\nCensado de oficio, por parte de los servicios municipales, como consecuencia de quejas o avisos formulados por la ciudadanía o por cualquier organismo o entidad.\nEn el caso de colonias o poblaciones felinas comunicadas mediante declaración responsable, la persona colaboradora responsable habrá de remitir un informe anual de seguimiento de la misma.\n\nA través de este trámite se podrá solicitar también la modificación o ampliación de los datos aportados (baja, cambio de datos personales, alta de nuevos interesados)\n\nImporte\nGratuito\n\nTramitar\nEn línea\nRegistro Electrónico\n\nPresencial\nSin cita previa\nOficinas de registro municipales que atienden SIN cita previa\n\nCon cita previa obligatoria\nOficinas de Atención a la Ciudadanía (OAC). Línea Madrid\n\nRedes sociales\nTwitter\n\nhttps://twitter.com/LineaMadrid\n\nFacebook\n\nhttps://www.facebook.com/LineaMadrid\n\nInformación relacionada\nModelos de formularios\nFormulario de solicitud (presencial)\nInformación relacionada\nDirecciones y teléfonos\nCentro de Protección Animal\nDocumentación\nInstrucciones. </doc><doc>\nComunicación, modificación o ampliación de datos en el registro de colonias felinas\nInstrucciones. Comunicación de incidencias o quejas por presencia de gatos urbanos\nMás datos\nCurso sobre buenas prácticas en la gestión de colonias felinas del Ayuntamiento de Madrid\nOtros trámites\nAnimales. Solicitud de esterilización de gatos de colonia felina censada\nAnimales. Obtención de acreditación de persona colaboradora en gestión de colonias felinas\nOtros contenidos\nPreguntas frecuentes sobre la gestión de colonias de gatos urbanos\nTríptico de Colonias felinas\nPautas de buenas prácticas en gestión de colonias de gatos urbanos\nDerechos y obligaciones de los colaboradores en la gestión de colonias felinas</doc><doc>\n9. Evita entrar en contacto con los areneros donde juegan los niños. Los gatos callejeros, más proclives a infectarse, pueden utilizarlos para hacer sus necesidades.\n10. </doc><doc>\nEl primer consejo que se puede ofrecer ante esta cuestión es que si no tienes la certeza absoluta de que sea comestible, lo mejor es ser prudente y descartar su ingesta.\n\nLa Comunidad de Madrid tiene una entrada en su portal de comunicación en la que señala que \"las setas son un manjar que te puede salir muy caro. La mejor seta no vale una intoxicación\" y añade que \"en la Comunidad de Madrid existen setas muy tóxicas y mortales\". En esta entrada también ofrecen trucos para identificar qué setas silvestres no se deben recoger.\n\nPara profundizar y poder realizar esta actividad con mayor seguridad y conocimiento es recomendable realizar algún curso sobre setas, hongos o micología en general. La propia Comunidad de Madrid tiene una Red de Centros sobre educación ambiental que ofrece este tipo de formación, y también son muy recomendables las Jornadas Micológicas Sierra de Madrid, de la Central de Reservas de la Sierra de Guadarrama.\n\nY ya que sales a buscar setas, te recomendamos que aproveches el viaje y descubras algunos de los pueblos más bonitos de la Comunidad de Madrid porque puede que te pillen cerca.</doc><doc>\nDeclaración responsable para la consolidación de colonias de gatos urbanos\nInstrucciones. </doc>",
            "response": "Si tienes gatos callejeros en tu comunidad de Madrid, es importante tener en cuenta algunas medidas de seguridad y precaución para proteger a los propietarios y a ti mismo. Aquí te presento algunos consejos basados en la información obtenida:\n\n    Control de Colonias Felinas: El Ayuntamiento de Madrid ha implementado un nuevo procedimiento de actuación en el control de las poblaciones incontroladas de gatos urbanos. Esta estrategia se basa en la captura, esterilización y devolución de los gatos para reducir el tamaño de las colonias y minimizar problemas asociados a la presencia de estos animales. Además, se busca facilitar el conocimiento y la adopción de buenas prácticas en la gestión de colonias felinas​.\n\nEsterilización de Gatos Urbanos: Si tienes una colonia de gatos callejeros censada, puedes solicitar la esterilización de algunos de ellos. Puedes hacerlo a través de un censo de colonias felinas, donde puedes presentar una declaración responsable de cualquier persona que quiera alcanzar la condición de persona colaboradora responsable. También puedes optar por un censado de oficio, realizado por los servicios municipales como resultado de quejas o avisos presentados por la ciudadanía o por cualquier organismo o entidad​.\n\nSeguridad y Conocimiento: Es fundamental tener cuidado al interactuar con gatos callejeros, especialmente si son más proclives a infectarse. Se recomienda ser prudente y descartar la ingesta de setas o hongos encontrados en lugares públicos, especialmente en zonas donde se cree que hay gatos callejeros. Además, se sugiere realizar cursos sobre setas y micología para obtener una mayor comprensión y seguridad al interactuar con flora natural​.\n\nRecuerde que la Comunidad de Madrid ha publicado una entrada en su portal de comunicación que advierte sobre setas tóxicas en la región. Siempre es importante actuar con precaución y estar informado sobre las condiciones locales antes de realizar actividades al aire libre.",
            "reference": "Si te encuentras con gatos callejeros en tu comunidad en Madrid, hay varias acciones que puedes tomar:\n\nConocer el procedimiento CER: Madrid implementa la estrategia CER (capturar, esterilizar y retornar) para gestionar las poblaciones incontroladas de gatos. El objetivo es controlar el tamaño de las colonias de gatos urbanos y minimizar los problemas asociados a su presencia, principalmente a través de la esterilización​​.\n\nRegistrar la colonia felina: Puedes registrar una colonia felina ya existente o notificar a los servicios municipales sobre la presencia de gatos callejeros. Esto se puede hacer como persona colaboradora responsable, lo que implica asumir ciertas responsabilidades y presentar un informe anual de seguimiento de la colonia​​.\n\nRealizar el trámite en línea o presencialmente: Para registrar una colonia felina o comunicar incidencias, puedes completar el trámite en línea a través del Registro Electrónico del Ayuntamiento de Madrid o hacerlo presencialmente en las oficinas de asistencia en materia de registro​​.\n\nUtilizar los formularios adecuados: Existen formularios específicos para la consolidación de colonias de gatos urbanos, la comunicación o modificación de datos en el registro de colonias felinas, y para la comunicación de incidencias o quejas por la presencia de gatos urbanos​​.\n\nEs importante actuar de manera responsable y considerada hacia los animales y la comunidad, y seguir las pautas establecidas por las autoridades locales para garantizar el bienestar de los gatos callejeros."
        },
        {
            "user_input": "Dime las diferencias entre una corchea y una negra.",
            "retrieved_contexts": "<doc>\nLas figuras y los signos musicales\nLas negras\n\nEmpecemos a leer ritmo con un ejemplo.\n\nLas negras: figuras y signos musicales\n\nComo pueden ver y escuchar, cada símbolo en la partitura suena con cada pulso del metrónomo. La duración de cada sonido se representa con un símbolo en el pentagrama que llamamos figura musical. En este ejemplo estamos usando una figura musical llamada negra, así que en la partitura tenemos 8 negras. Podemos concluir que cada pulso del metrónomo es igual a una negra.\n\nEsta figura musical se forma con una línea vertical que llamamos plica y un punto. La ubicación del punto determina la nota en el pentagrama. Si el punto está por debajo de la tercera línea del pentagrama, la plica irá hacia arriba y a la derecha del punto. Si el punto está hacia arriba de la tercera línea, la plica irá hacia abajo y a la izquierda del punto.\nLas corcheas\n\nPara el segundo ejemplo vamos a usar una nueva figura musical, escuchemos:\n\nLas corcheas: signos musicales\n\nEn el ejemplo tenemos 4 negras y luego 8 nuevas figuras musicales que llamaremos corcheas. Cada corchea durala mitad de una negra, por lo que se necesitan 2 corcheas para completar un pulso del metrónomo.Las corcheas se diferencian de las negras porque están unidas con una línea al final de la plica. Pero las corcheas no siempre tienen que estar unidas, las unimos para que se pueda leer fácilmente. </doc><doc>\nAl igual que las corcheas, las semicorcheas se pueden unir como se ve en el ejemplo para que se puedan leer fácilmente, pero también pueden estar separadas. Una semicorchea dura exactamente la mitad de una corchea, esto quiere decir que para completar la duración de una corchea necesitamos dos semicorcheas. Y para completar la duración de una negra necesitamos 4 semicorcheas.\nLas fusas y semifusas\n\nAhora veamos un nuevo ejemplo con una nueva figura musical que se llama fusa:\n\nLas fusas como símbolos musicales\n\nLa fusa dura la mitad de una semicorchea. Se diferencia porque se usan tres líneas para unirlas, aunque  también puede aparecer sola con 3 adornos al final de su plica. </doc><doc>\nComo músicos debemos aprender ahacer silencio con ritmo. Para cada figura musical existe un silencio correspondiente.\n\nLos silencios musicales y sus símbolos con valores\n\nEn este ejemplo tenemos 3 compases. En el primer compás tenemos dos negras, luego un silencio de negra, es decir que durante el tercer tiempo o pulso no debemos tocar nada, luego en el cuarto tiempo tenemos otra negra. El segundo compás tiene un silencio de redonda, es decir que durante cuatro tiempos no debemos tocar. En el último compás tenemos una blanca que dura dos tiempos y luego un silencio de blanca, es decir dos tiempos en silencio. El silencio de negra parece un rayo. El silencio de redonda es un pequeño rectángulo debajo de la cuarta línea del pentagrama, mientras que el silencio de blanca es el mismo rectángulo pero sobre la tercera línea del pentagrama.\n\nLos silencios de corcheas, semicorcheas, fusas y semifusas se representan como pueden ver en la siguiente imagen. </doc><doc>\nAsí se ven las corcheas separadas:\n\nLas corcheas separadas\n\nEl sonido es exactamente el mismo si están unidas o no, pero cuando las corcheas hacen parte de un mismo pulso,o hasta dos pulsos seguidos, debemos unirlas para facilitar la lectura.\nLas semicorcheas\n\nAhora aprendamos una nueva figura musical:\n\nLas semicorcheas y los símbolos musicales\n\nEn el ejemplo tenemos 2 negras, luego 4 corcheas y las 16figuras que vemos unidas con dos líneas se llaman semicorcheas. Se parecen a las corcheas, la diferencia está en que se unen al final de las plicas con dos líneas en lugar de una. </doc><doc>\nY un cuarto en matemáticas se escribe uno sobre cuatro. La corchea sería un octavo de nota por ser la octava parte o uno sobre ocho que es lo mismo. Y así con cada figura musical.\n</doc>",
            "response": "Las corcheas y las negras son dos figuras musicales comunes en la música clásica y en otros estilos musicales. Aunque tienen algunas similitudes, también hay diferencias significativas entre ellas.\n\nUna corchea es una figura musical que se une al final de la plica con dos líneas. Esta figura musical se diferencia de una negra en que se une al final de la plica, en lugar de unirse al principio. Por ejemplo, en el ejemplo de corcheas, se une al final de la plica con dos líneas, en lugar de unirse al principio.\n\nPor otro lado, una negra es una figura musical que se une al principio de la plica. Las negras se forman con una línea vertical llamada plica y un punto. La ubicación del punto determina la nota en el pentagrama. Cuando el punto está por debajo de la tercera línea del pentagrama, la plica irá hacia arriba y a la derecha del punto. Si el punto está hacia arriba de la tercera línea, la plica irá hacia abajo y a la izquierda del punto.\n\nEn resumen, la principal diferencia entre una corchea y una negra es la ubicación de la plica en relación con la nota. Una corchea se une al final de la plica, mientras que una negra se une al principio de la plica.",
            "reference": "Las diferencias principales entre una corchea y una negra en música son su valor de tiempo y su representación gráfica en la partitura.\n\n    Valor de Tiempo:\n        La negra tiene un valor equivalente a un cuarto de una redonda. En términos de pulsos, cada pulso del metrónomo equivale a una negra​.\nLa corchea, por otro lado, tiene un valor equivalente a la mitad de una negra, o lo que es lo mismo, un octavo de una redonda. Por lo tanto, se necesitan dos corcheas para completar el tiempo de un pulso del metrónomo, que es igual al tiempo de una negra​​.\n\nRepresentación Gráfica:\n\n    La negra se representa con un punto (la cabeza de la nota) y una línea vertical (la plica). La posición del punto en el pentagrama determina la nota musical específica. Si el punto está por debajo de la tercera línea del pentagrama, la plica se dirige hacia arriba y a la derecha del punto; si el punto está por encima de la tercera línea, la plica se dirige hacia abajo y a la izquierda del punto​.\nLas corcheas se diferencian de las negras porque, además de tener un punto y una plica, poseen una línea adicional en el extremo de la plica, llamada corchete. Las corcheas pueden estar unidas por este corchete o separadas. Cuando forman parte del mismo pulso o hasta dos pulsos seguidos, generalmente se unen para facilitar la lectura en la partitura​.\n\nEn resumen, la principal diferencia entre una negra y una corchea radica en su valor rítmico, siendo la corchea la mitad de la duración de una negra, y en su representación gráfica, donde las corcheas se distinguen por el corchete adicional en la plica."
        },
        {
            "user_input": "¿Cuál es la diferencia entre una corchea y una negra?",
            "retrieved_contexts": "<doc>\nLas figuras y los signos musicales\nLas negras\n\nEmpecemos a leer ritmo con un ejemplo.\n\nLas negras: figuras y signos musicales\n\nComo pueden ver y escuchar, cada símbolo en la partitura suena con cada pulso del metrónomo. La duración de cada sonido se representa con un símbolo en el pentagrama que llamamos figura musical. En este ejemplo estamos usando una figura musical llamada negra, así que en la partitura tenemos 8 negras. Podemos concluir que cada pulso del metrónomo es igual a una negra.\n\nEsta figura musical se forma con una línea vertical que llamamos plica y un punto. La ubicación del punto determina la nota en el pentagrama. Si el punto está por debajo de la tercera línea del pentagrama, la plica irá hacia arriba y a la derecha del punto. Si el punto está hacia arriba de la tercera línea, la plica irá hacia abajo y a la izquierda del punto.\nLas corcheas\n\nPara el segundo ejemplo vamos a usar una nueva figura musical, escuchemos:\n\nLas corcheas: signos musicales\n\nEn el ejemplo tenemos 4 negras y luego 8 nuevas figuras musicales que llamaremos corcheas. Cada corchea durala mitad de una negra, por lo que se necesitan 2 corcheas para completar un pulso del metrónomo.Las corcheas se diferencian de las negras porque están unidas con una línea al final de la plica. Pero las corcheas no siempre tienen que estar unidas, las unimos para que se pueda leer fácilmente. </doc><doc>\nAl igual que las corcheas, las semicorcheas se pueden unir como se ve en el ejemplo para que se puedan leer fácilmente, pero también pueden estar separadas. Una semicorchea dura exactamente la mitad de una corchea, esto quiere decir que para completar la duración de una corchea necesitamos dos semicorcheas. Y para completar la duración de una negra necesitamos 4 semicorcheas.\nLas fusas y semifusas\n\nAhora veamos un nuevo ejemplo con una nueva figura musical que se llama fusa:\n\nLas fusas como símbolos musicales\n\nLa fusa dura la mitad de una semicorchea. Se diferencia porque se usan tres líneas para unirlas, aunque  también puede aparecer sola con 3 adornos al final de su plica. </doc><doc>\nAsí se ven las corcheas separadas:\n\nLas corcheas separadas\n\nEl sonido es exactamente el mismo si están unidas o no, pero cuando las corcheas hacen parte de un mismo pulso,o hasta dos pulsos seguidos, debemos unirlas para facilitar la lectura.\nLas semicorcheas\n\nAhora aprendamos una nueva figura musical:\n\nLas semicorcheas y los símbolos musicales\n\nEn el ejemplo tenemos 2 negras, luego 4 corcheas y las 16figuras que vemos unidas con dos líneas se llaman semicorcheas. Se parecen a las corcheas, la diferencia está en que se unen al final de las plicas con dos líneas en lugar de una. </doc><doc>\nComo músicos debemos aprender ahacer silencio con ritmo. Para cada figura musical existe un silencio correspondiente.\n\nLos silencios musicales y sus símbolos con valores\n\nEn este ejemplo tenemos 3 compases. En el primer compás tenemos dos negras, luego un silencio de negra, es decir que durante el tercer tiempo o pulso no debemos tocar nada, luego en el cuarto tiempo tenemos otra negra. El segundo compás tiene un silencio de redonda, es decir que durante cuatro tiempos no debemos tocar. En el último compás tenemos una blanca que dura dos tiempos y luego un silencio de blanca, es decir dos tiempos en silencio. El silencio de negra parece un rayo. El silencio de redonda es un pequeño rectángulo debajo de la cuarta línea del pentagrama, mientras que el silencio de blanca es el mismo rectángulo pero sobre la tercera línea del pentagrama.\n\nLos silencios de corcheas, semicorcheas, fusas y semifusas se representan como pueden ver en la siguiente imagen. </doc><doc>\nY un cuarto en matemáticas se escribe uno sobre cuatro. La corchea sería un octavo de nota por ser la octava parte o uno sobre ocho que es lo mismo. Y así con cada figura musical.\n</doc>",
            "response": "Las corcheas y las negras son dos figuras musicales comunes en la música clásica y en otros estilos musicales. Aunque su apariencia y sonidos pueden parecer similares en algunas ocasiones, hay algunas diferencias clave entre ellas.\n\nCorcheas:\n\n- Son una figura musical que se une al final de la plica de una corchea, creando un sonido completo.\n- Las corcheas se diferencian de otras figuras musicales como las semicorcheas y las fusas, ya que se unen al final de la plica de la corchea, creando un sonido más completo.\n- Las corcheas se utilizan comúnmente en la música clásica y en otros estilos musicales, como el jazz y el swing, para crear un sonido más complejo y resonante.\n\nSemi-corcheas:\n\n- Son una figura musical que se une al final de la plica de una corchea, pero no crean un sonido completo.\n- Las semi-corcheas se utilizan en algunos estilos musicales, como el jazz, para crear un sonido más suave y fluido.\n- Las semi-corcheas se distinguen de otras figuras musicales como las corcheas y las fusas, ya que no se unen al final de la plica de la corchea, creando un sonido más ligero y sencillo.\n\nFusas:\n\n- Son una figura musical que se une al final de la plica de una corchea, creando un sonido completo.\n- Las fusas se utilizan en algunos estilos musicales, como el jazz, para crear un sonido más suave y fluido.\n- Las fusas se diferencian de otras figuras musicales como las corcheas y las semi-corcheas, ya que no se unen al final de la plica de la corchea, creando un sonido más simple y directo.\n\nSemicorcheas:\n\n- Son una figura musical que se une al final de la plica de una corchea, creando un sonido completo.\n- Las semicorcheas se utilizan en algunos estilos musicales, como el jazz, para crear un sonido más suave y fluido.\n- Las semicorcheas se diferencian de otras figuras musicales como las corcheas y las fusas, ya que no se unen al final de la plica de la corchea, creando un sonido más simple y directo.\n\nFugas:\n\n- Son una figura musical que se une al final de la plica de una corchea, creando un sonido completo.\n- Las fugas se utilizan en algunos estilos musicales, como el swing, para crear un sonido más suave y fluido.\n- Las fugas se diferencian de otras figuras musicales como las corcheas y las semicorcheas, ya que no se unen al final de la plica de la corchea, creando un sonido más simple y directo.\n\nEn resumen, las corcheas y las semicorcheas son figuras musicales que se unen al final de la plica de una corchea, creando un sonido completo. Las corcheas y las fusas son figuras musicales que se unen al final de la plica de una corchea, creando un sonido más suave y fluido. Las semicorcheas y las fugas son figuras musicales que se unen al final de la plica de una corchea, creando un sonido más simple y directo.",
            "reference": "Las diferencias principales entre una corchea y una negra en música son su valor de tiempo y su representación gráfica en la partitura.\n\n    Valor de Tiempo:\n        La negra tiene un valor equivalente a un cuarto de una redonda. En términos de pulsos, cada pulso del metrónomo equivale a una negra​.\nLa corchea, por otro lado, tiene un valor equivalente a la mitad de una negra, o lo que es lo mismo, un octavo de una redonda. Por lo tanto, se necesitan dos corcheas para completar el tiempo de un pulso del metrónomo, que es igual al tiempo de una negra​​.\n\nRepresentación Gráfica:\n\n    La negra se representa con un punto (la cabeza de la nota) y una línea vertical (la plica). La posición del punto en el pentagrama determina la nota musical específica. Si el punto está por debajo de la tercera línea del pentagrama, la plica se dirige hacia arriba y a la derecha del punto; si el punto está por encima de la tercera línea, la plica se dirige hacia abajo y a la izquierda del punto​.\nLas corcheas se diferencian de las negras porque, además de tener un punto y una plica, poseen una línea adicional en el extremo de la plica, llamada corchete. Las corcheas pueden estar unidas por este corchete o separadas. Cuando forman parte del mismo pulso o hasta dos pulsos seguidos, generalmente se unen para facilitar la lectura en la partitura​.\n\nEn resumen, la principal diferencia entre una negra y una corchea radica en su valor rítmico, siendo la corchea la mitad de la duración de una negra, y en su representación gráfica, donde las corcheas se distinguen por el corchete adicional en la plica."
        },
        {
            "user_input": "Hola, no comprendo bien qué es una corchea y qué es una negra. ¿Podrías, por favor, decirme las diferencias?",
            "retrieved_contexts": "<doc>\nLas figuras y los signos musicales\nLas negras\n\nEmpecemos a leer ritmo con un ejemplo.\n\nLas negras: figuras y signos musicales\n\nComo pueden ver y escuchar, cada símbolo en la partitura suena con cada pulso del metrónomo. La duración de cada sonido se representa con un símbolo en el pentagrama que llamamos figura musical. En este ejemplo estamos usando una figura musical llamada negra, así que en la partitura tenemos 8 negras. Podemos concluir que cada pulso del metrónomo es igual a una negra.\n\nEsta figura musical se forma con una línea vertical que llamamos plica y un punto. La ubicación del punto determina la nota en el pentagrama. Si el punto está por debajo de la tercera línea del pentagrama, la plica irá hacia arriba y a la derecha del punto. Si el punto está hacia arriba de la tercera línea, la plica irá hacia abajo y a la izquierda del punto.\nLas corcheas\n\nPara el segundo ejemplo vamos a usar una nueva figura musical, escuchemos:\n\nLas corcheas: signos musicales\n\nEn el ejemplo tenemos 4 negras y luego 8 nuevas figuras musicales que llamaremos corcheas. Cada corchea durala mitad de una negra, por lo que se necesitan 2 corcheas para completar un pulso del metrónomo.Las corcheas se diferencian de las negras porque están unidas con una línea al final de la plica. Pero las corcheas no siempre tienen que estar unidas, las unimos para que se pueda leer fácilmente. </doc><doc>\nAl igual que las corcheas, las semicorcheas se pueden unir como se ve en el ejemplo para que se puedan leer fácilmente, pero también pueden estar separadas. Una semicorchea dura exactamente la mitad de una corchea, esto quiere decir que para completar la duración de una corchea necesitamos dos semicorcheas. Y para completar la duración de una negra necesitamos 4 semicorcheas.\nLas fusas y semifusas\n\nAhora veamos un nuevo ejemplo con una nueva figura musical que se llama fusa:\n\nLas fusas como símbolos musicales\n\nLa fusa dura la mitad de una semicorchea. Se diferencia porque se usan tres líneas para unirlas, aunque  también puede aparecer sola con 3 adornos al final de su plica. </doc><doc>\nComo músicos debemos aprender ahacer silencio con ritmo. Para cada figura musical existe un silencio correspondiente.\n\nLos silencios musicales y sus símbolos con valores\n\nEn este ejemplo tenemos 3 compases. En el primer compás tenemos dos negras, luego un silencio de negra, es decir que durante el tercer tiempo o pulso no debemos tocar nada, luego en el cuarto tiempo tenemos otra negra. El segundo compás tiene un silencio de redonda, es decir que durante cuatro tiempos no debemos tocar. En el último compás tenemos una blanca que dura dos tiempos y luego un silencio de blanca, es decir dos tiempos en silencio. El silencio de negra parece un rayo. El silencio de redonda es un pequeño rectángulo debajo de la cuarta línea del pentagrama, mientras que el silencio de blanca es el mismo rectángulo pero sobre la tercera línea del pentagrama.\n\nLos silencios de corcheas, semicorcheas, fusas y semifusas se representan como pueden ver en la siguiente imagen. </doc><doc>\nAsí se ven las corcheas separadas:\n\nLas corcheas separadas\n\nEl sonido es exactamente el mismo si están unidas o no, pero cuando las corcheas hacen parte de un mismo pulso,o hasta dos pulsos seguidos, debemos unirlas para facilitar la lectura.\nLas semicorcheas\n\nAhora aprendamos una nueva figura musical:\n\nLas semicorcheas y los símbolos musicales\n\nEn el ejemplo tenemos 2 negras, luego 4 corcheas y las 16figuras que vemos unidas con dos líneas se llaman semicorcheas. Se parecen a las corcheas, la diferencia está en que se unen al final de las plicas con dos líneas en lugar de una. </doc><doc>\nY un cuarto en matemáticas se escribe uno sobre cuatro. La corchea sería un octavo de nota por ser la octava parte o uno sobre ocho que es lo mismo. Y así con cada figura musical.\n</doc>",
            "response": "Claro, con gusto te ayudaré a entender las diferencias entre una corchea y una negra.\n\nUna corchea es una figura musical que se une al final de la plica con dos líneas. Esta figura musical se diferencia de las negras en que se unen al final de la plica, en lugar de estar unidas con una línea al final de la plica. Por ejemplo, en el ejemplo que mencionaste, las corcheas se unen al final de la plica con dos líneas, lo que les permite ser más fáciles de leer y comprender.\n\nPor otro lado, una negra es una figura musical que se une al final de la plica con una línea. Las negras se unen al final de la plica, lo que hace que su duración sea más clara y fácil de identificar.\n\nEn resumen, la principal diferencia entre una corchea y una negra es que las corcheas se unen al final de la plica con dos líneas, mientras que las negras se unen al final de la plica con una línea.",
            "reference": "Las diferencias principales entre una corchea y una negra en música son su valor de tiempo y su representación gráfica en la partitura.\n\n    Valor de Tiempo:\n        La negra tiene un valor equivalente a un cuarto de una redonda. En términos de pulsos, cada pulso del metrónomo equivale a una negra​.\nLa corchea, por otro lado, tiene un valor equivalente a la mitad de una negra, o lo que es lo mismo, un octavo de una redonda. Por lo tanto, se necesitan dos corcheas para completar el tiempo de un pulso del metrónomo, que es igual al tiempo de una negra​​.\n\nRepresentación Gráfica:\n\n    La negra se representa con un punto (la cabeza de la nota) y una línea vertical (la plica). La posición del punto en el pentagrama determina la nota musical específica. Si el punto está por debajo de la tercera línea del pentagrama, la plica se dirige hacia arriba y a la derecha del punto; si el punto está por encima de la tercera línea, la plica se dirige hacia abajo y a la izquierda del punto​.\nLas corcheas se diferencian de las negras porque, además de tener un punto y una plica, poseen una línea adicional en el extremo de la plica, llamada corchete. Las corcheas pueden estar unidas por este corchete o separadas. Cuando forman parte del mismo pulso o hasta dos pulsos seguidos, generalmente se unen para facilitar la lectura en la partitura​.\n\nEn resumen, la principal diferencia entre una negra y una corchea radica en su valor rítmico, siendo la corchea la mitad de la duración de una negra, y en su representación gráfica, donde las corcheas se distinguen por el corchete adicional en la plica."
        },
        {
            "user_input": "Hola! Quiero saber cómo puedo renovar mi DNI-e, ¿podrías ayudarme paso a paso?",
            "retrieved_contexts": "<doc>\nRenovación del DNI\n\nComo dicta el Artículo 7 del Real Decreto 1553/2005 de 23 de diciembre, para solicitar la renovación del Documento Nacional de Identidad será imprescindible la presencia física de la persona a quien se haya de expedir, el abono en efectivo o a través de tarjeta de crédito/débito la tasa correspondiente, o utilizando el pago por vía telemática\ty aportar los siguientes documentos:\n\n    Una fotografía reciente en color del rostro del solicitante, tamaño 32x26 milímetros, con fondo uniforme blanco y liso, tomada de frente con la cabeza totalmente descubierta y sin gafas de cristales oscuros o cualquier otra prenda que pueda impedir o dificultar la identificación de la persona. (La fotografía deberá mostrar claramente el óvalo de la cara, que incluye cejas, ojos, nariz, boca y mentón, y deberá ser de alta resolución y en papel fotográfico de buena calidad)\n\n    El DNI anterior (En caso de pérdida o extravío se requerirá denuncia previa o comunicación de tal incidencia al equipo de expedición). En caso de caída del chip, el DNI-e deberá ser tratado como un documento deteriorado, estando su titular obligado a la obtención de un duplicado, tal y como se establece en el artículo 8 del Real Decreto 1553/2005, de 23 de diciembre, en el cual se preceptúa que \"los documentos sustituidos perderán el carácter de Documento Nacional de Identidad, así como los efectos que el ordenamiento jurídico atribuye a este con respecto a su titular\".\n\n    En caso de cambio de domicilio, respecto del que figure en el Documento anterior, certificado o volante de empadronamiento del Ayuntamiento donde el solicitante tenga su domicilio, expedido con una antelación máxima de tres meses a la fecha de la solicitud del Documento Nacional de Identidad. </doc><doc>\nEn caso de sustracción, extravío, deterioro o mal funcionamiento del chip electrónico, deberá renovarlo lo antes posible, y obtendrá un nuevo documento con su validez total cuando queden menos de 90 días para su caducidad. En el caso que superase los 90 días, obtendrá uno nuevo con la validez anterior.\n\nCIUDADANOS ESPAÑOLES RESIDENTES EN EL EXTRANJERO\t\nLos españoles que, residiendo en el extranjero, soliciten la renovación del Documento Nacional de Identidad deberán aportar, además de los mencionados, los siguientes documentos:\n\n    Si hay cambio de domicilio y el nuevo lo es también en el extranjero, el Certificado de acreditación de residencia, expedido por el Consulado español donde esté inscrito como residente, con especificación del país, localidad, calle y número donde esté domiciliado, (expedido con una antelación máxima de tres meses a la fecha de la renovación del DNI 3.0). No será necesaria la presentación de este Certificado para las renovaciones sin cambio de domicilio.\t\n\n</doc><doc>\nEstos documentos no serán necesarios si el interesado autoriza, en el momento de la tramitación, al equipo de expedición a consultar los datos del domicilio mediante acceso al Sistema de Verificación de Datos de residencia.\n\n    Si el alta en el Padrón Municipal se ha realizado en los dos últimos meses, es necesario aportar el certificado o volante de empadronamiento a que se hace referencia.\n\n    NOTA: Debido al posible retraso que se pueda producir en la actualización de los datos del domicilio en el sistema informático y en menor medida, a las posibles incidencias de carácter técnico (ajenas a Policía) en el acceso a los mismos, es recomendable que el ciudadano se provea con anterioridad del certificado o volante de empadronamiento.\n\n    Cuando el titular del DNI sea menor de 14 años o persona con capacidad judicialmente complementada se llevará a cabo en presencia de la persona que tenga encomendada la patria potestad o tutela, o persona apoderada por estas últimas. Puede descargar el modelo de apoderamiento\t, siendo importante leer la nota informativa que se descarga con el mismo.\n\n    En caso de variación de datos de filiación, Certificado del Registro Civil (expedido con una antelación máxima de seis meses a la fecha de la solicitud del DNI 3.0).\n\n    El extravío, sustracción, destrucción o deterioro del DNI 3.0, conllevará la obligación de su titular de proveerse inmediatamente de un duplicado (con los mismos datos y fotografía) cuya validez será la misma que tenía el documento al que sustituye, salvo que éste se halle dentro de los últimos 90 días de su vigencia, en cuyo caso se expedirá con los mismos requisitos y validez que si se tratase de una renovación. En los casos de extravío y/o sustracción, el ciudadano deberá informar en el inicio de la expedición del duplicado si ya ha interpuesto denuncia sobre dicha circunstancia (ante policía nacional, guardia civil, policía autonómica, policía local, juzgado de guardia, embajada o consulado, etc...); si no lo hubiese realizado o no la llevase consigo en este acto, el funcionario de expedición cumplimentará con antelación a la expedición, denuncia administrativa del extravío o sustracción del DNI, independientemente de que el ciudadano, si lo estimase oportuno, pudiera ejercer su derecho de interponer denuncia con posterioridad, respecto a cualesquiera otros objetos extraviados o sustraídos, sin incluir el DNI.\n\n    El DNI se deberá renovar dentro de los últimos 180 días de vigencia. </doc>",
            "response": "Claro, estaré encantado de ayudarte a renovar tu DNI-e. A continuación, te explico los pasos a seguir:\n\n    Solicitar la Renovación: Antes de comenzar, asegúrate de tener a mano tu DNI actualizado y cualquier otro documento requerido, como la fotografía reciente en color, el DNI anterior, y en caso de ser residente en el extranjero, el Certificado de acreditación de residencia.\n\n    Preparación de los Documentos: Reúne los documentos necesarios para la solicitud, asegurándote de que todos los datos sean precisos y actualizados.\n\n    Presentación de la Solicitud: Dirígete a la oficina de expedición de tu DNI o a la comisaría de policía de tu localidad, donde presentarás tu solicitud y los documentos requeridos. Puedes hacerlo en persona, por correo o por teléfono.\n\n    Entrega de la Renovación: Después de presentar tu solicitud, recibirás una notificación de la oficina de expedición indicando que has recibido tu DNI-e renovado. Asegúrate de guardar la notificación y cualquier otro documento de la que te hayan proporcionado durante la solicitud.\n\n    Requisitos adicionales: Si tienes un cambio de domicilio, debes presentar el certificado o volante de empadronamiento del Ayuntamiento donde tengas tu nueva dirección. También, si eres menor de 14 años o tienes capacidad judicialmente complementada, debes presentar el apoderamiento correspondiente.\n\n    Retrasos en la Actualización de Datos: Ten en cuenta que el sistema informático puede retrasarse en la actualización de los datos del domicilio, lo que podría afectar la verificación de tu residencia. Por lo tanto, es recomendable que te asegures de que tus datos sean precisos y actualizados antes de presentar tu solicitud.\n\nRecuerda que estos son los pasos generales y que pueden variar dependiendo de tu ubicación y de la oficina de expedición de tu DNI. Siempre es recomendable verificar la información específica en la página web de la Oficina de Explotación de tu DNI o en la oficina de expedición de tu DNI.",
            "reference": "Para renovar tu DNI electrónico (DNI-e) en España, sigue estos pasos, según la información oficial proporcionada por el portal del DNI electrónico:\nPresencia física y pago de la tasa: Debes presentarte físicamente y abonar la tasa correspondiente, ya sea en efectivo, con tarjeta de crédito/débito, o mediante pago telemático.\nDocumentación necesaria:\nFotografía reciente: En color, de 32x26 milímetros, con fondo blanco y liso. Debe ser de alta resolución y mostrar claramente el óvalo de la cara.\nDNI anterior: Si se ha perdido, es necesario presentar una denuncia previa o comunicar el incidente.\nCambio de domicilio: Si ha cambiado tu domicilio, necesitarás un certificado o volante de empadronamiento del Ayuntamiento donde residas, expedido en los últimos tres meses.\nMenores de 14 años o personas con capacidad judicialmente complementada: Deben estar acompañados por su tutor legal o una persona apoderada.\nVariación de datos de filiación: Necesitarás un certificado del Registro Civil.\nExtravío, sustracción, destrucción o deterioro del DNI: Debes solicitar un duplicado.\nPlazos para la renovación: El DNI se debe renovar dentro de los últimos 180 días de vigencia. En casos de extravío, sustracción, deterioro o mal funcionamiento del chip, se debe renovar lo antes posible​​.\nPara más detalles y el proceso completo, te recomiendo visitar el sitio oficial del DNI electrónico en España."
        },
        {
            "user_input": "Buenos días. ¿Serías tan amable de contarme paso a paso cómo puedo renovar el documento nacional de identidad DNI-e?",
            "retrieved_contexts": "<doc>\nRenovación del DNI\n\nComo dicta el Artículo 7 del Real Decreto 1553/2005 de 23 de diciembre, para solicitar la renovación del Documento Nacional de Identidad será imprescindible la presencia física de la persona a quien se haya de expedir, el abono en efectivo o a través de tarjeta de crédito/débito la tasa correspondiente, o utilizando el pago por vía telemática\ty aportar los siguientes documentos:\n\n    Una fotografía reciente en color del rostro del solicitante, tamaño 32x26 milímetros, con fondo uniforme blanco y liso, tomada de frente con la cabeza totalmente descubierta y sin gafas de cristales oscuros o cualquier otra prenda que pueda impedir o dificultar la identificación de la persona. (La fotografía deberá mostrar claramente el óvalo de la cara, que incluye cejas, ojos, nariz, boca y mentón, y deberá ser de alta resolución y en papel fotográfico de buena calidad)\n\n    El DNI anterior (En caso de pérdida o extravío se requerirá denuncia previa o comunicación de tal incidencia al equipo de expedición). En caso de caída del chip, el DNI-e deberá ser tratado como un documento deteriorado, estando su titular obligado a la obtención de un duplicado, tal y como se establece en el artículo 8 del Real Decreto 1553/2005, de 23 de diciembre, en el cual se preceptúa que \"los documentos sustituidos perderán el carácter de Documento Nacional de Identidad, así como los efectos que el ordenamiento jurídico atribuye a este con respecto a su titular\".\n\n    En caso de cambio de domicilio, respecto del que figure en el Documento anterior, certificado o volante de empadronamiento del Ayuntamiento donde el solicitante tenga su domicilio, expedido con una antelación máxima de tres meses a la fecha de la solicitud del Documento Nacional de Identidad. </doc><doc>\nEn caso de sustracción, extravío, deterioro o mal funcionamiento del chip electrónico, deberá renovarlo lo antes posible, y obtendrá un nuevo documento con su validez total cuando queden menos de 90 días para su caducidad. En el caso que superase los 90 días, obtendrá uno nuevo con la validez anterior.\n\nCIUDADANOS ESPAÑOLES RESIDENTES EN EL EXTRANJERO\t\nLos españoles que, residiendo en el extranjero, soliciten la renovación del Documento Nacional de Identidad deberán aportar, además de los mencionados, los siguientes documentos:\n\n    Si hay cambio de domicilio y el nuevo lo es también en el extranjero, el Certificado de acreditación de residencia, expedido por el Consulado español donde esté inscrito como residente, con especificación del país, localidad, calle y número donde esté domiciliado, (expedido con una antelación máxima de tres meses a la fecha de la renovación del DNI 3.0). No será necesaria la presentación de este Certificado para las renovaciones sin cambio de domicilio.\t\n\n</doc><doc>\nEstos documentos no serán necesarios si el interesado autoriza, en el momento de la tramitación, al equipo de expedición a consultar los datos del domicilio mediante acceso al Sistema de Verificación de Datos de residencia.\n\n    Si el alta en el Padrón Municipal se ha realizado en los dos últimos meses, es necesario aportar el certificado o volante de empadronamiento a que se hace referencia.\n\n    NOTA: Debido al posible retraso que se pueda producir en la actualización de los datos del domicilio en el sistema informático y en menor medida, a las posibles incidencias de carácter técnico (ajenas a Policía) en el acceso a los mismos, es recomendable que el ciudadano se provea con anterioridad del certificado o volante de empadronamiento.\n\n    Cuando el titular del DNI sea menor de 14 años o persona con capacidad judicialmente complementada se llevará a cabo en presencia de la persona que tenga encomendada la patria potestad o tutela, o persona apoderada por estas últimas. Puede descargar el modelo de apoderamiento\t, siendo importante leer la nota informativa que se descarga con el mismo.\n\n    En caso de variación de datos de filiación, Certificado del Registro Civil (expedido con una antelación máxima de seis meses a la fecha de la solicitud del DNI 3.0).\n\n    El extravío, sustracción, destrucción o deterioro del DNI 3.0, conllevará la obligación de su titular de proveerse inmediatamente de un duplicado (con los mismos datos y fotografía) cuya validez será la misma que tenía el documento al que sustituye, salvo que éste se halle dentro de los últimos 90 días de su vigencia, en cuyo caso se expedirá con los mismos requisitos y validez que si se tratase de una renovación. En los casos de extravío y/o sustracción, el ciudadano deberá informar en el inicio de la expedición del duplicado si ya ha interpuesto denuncia sobre dicha circunstancia (ante policía nacional, guardia civil, policía autonómica, policía local, juzgado de guardia, embajada o consulado, etc...); si no lo hubiese realizado o no la llevase consigo en este acto, el funcionario de expedición cumplimentará con antelación a la expedición, denuncia administrativa del extravío o sustracción del DNI, independientemente de que el ciudadano, si lo estimase oportuno, pudiera ejercer su derecho de interponer denuncia con posterioridad, respecto a cualesquiera otros objetos extraviados o sustraídos, sin incluir el DNI.\n\n    El DNI se deberá renovar dentro de los últimos 180 días de vigencia. </doc>",
            "response": "Para renovar el DNI-e, sigue estos pasos:\n\n    Solicita la renovación: Antes de que expire el DNI actual, el solicitante debe solicitar la renovación. Esto puede hacerse en la Oficina de Extranjería o en la Comisaría de Policía de la provincia donde reside. Si el DNI ha perdido chip, debes solicitar un DNI-e nuevo, incluso si el DNI anterior está intacto, ya que los documentos sustituidos perderán su carácter de Documento Nacional de Identidad​.\n\nAporta los documentos necesarios: Debes aportar los siguientes documentos:\n    Una fotografía reciente en color del rostro, tamaño 32x26 milímetros, con fondo uniforme blanco y liso, tomada de frente con la cabeza totalmente descubierta y sin gafas de cristales oscuros o cualquier otra prenda que pueda impedir o dificultar la identificación de la persona. (La fotografía deberá mostrar claramente el óvalo de la cara, que incluye cejas, ojos, nariz, boca y mentón, y deberá ser de alta resolución y en papel fotográfico de buena calidad)\n\n    Un DNI anterior, en caso de pérdida o extravío. Si has perdido o has perdido tu DNI, debes denunciarlo previamente al equipo de expedición. Si tu DNI ha caído en chip, debes solicitar un DNI-e nuevo, incluso si el DNI anterior está intacto, ya que los documentos sustituidos perderán su carácter de Documento Nacional de Identidad​.\n\nSi tienes un cambio de domicilio, debes presentar un certificado o volante de empadronamiento del Ayuntamiento donde resides, expedido con una antelación máxima de tres meses a la fecha de la solicitud del DNI 3.0. Este documento no será necesario para las renovaciones sin cambio de domicilio.\n\nSi eres menor de 14 años o tienes capacidad judicialmente complementada, debes contar con la presencia de una persona que tenga encomendada la patria potestad o tutela, o una persona apoderada por estas últimas. Esto se aplica especialmente en el caso de que el DNI sea de menor edad o si tienes capacidad judicialmente complementada.\n\nEl DNI debe renovarse dentro de los últimos 180 días de vigencia. Si vives en un país donde la renovación se realice en un plazo más corto, debes cumplir con este plazo. Si no puedes hacerlo, debes solicitar una prórroga.\n\nRecuerda que, si tu DNI ha perdido chip, debes solicitar un DNI-e nuevo, incluso si el DNI anterior está intacto, ya que los documentos sustituidos perderán su carácter de Documento Nacional de Identidad​.",
            "reference": "Para renovar tu DNI electrónico (DNI-e) en España, sigue estos pasos, según la información oficial proporcionada por el portal del DNI electrónico:\nPresencia física y pago de la tasa: Debes presentarte físicamente y abonar la tasa correspondiente, ya sea en efectivo, con tarjeta de crédito/débito, o mediante pago telemático.\nDocumentación necesaria:\nFotografía reciente: En color, de 32x26 milímetros, con fondo blanco y liso. Debe ser de alta resolución y mostrar claramente el óvalo de la cara.\nDNI anterior: Si se ha perdido, es necesario presentar una denuncia previa o comunicar el incidente.\nCambio de domicilio: Si ha cambiado tu domicilio, necesitarás un certificado o volante de empadronamiento del Ayuntamiento donde residas, expedido en los últimos tres meses.\nMenores de 14 años o personas con capacidad judicialmente complementada: Deben estar acompañados por su tutor legal o una persona apoderada.\nVariación de datos de filiación: Necesitarás un certificado del Registro Civil.\nExtravío, sustracción, destrucción o deterioro del DNI: Debes solicitar un duplicado.\nPlazos para la renovación: El DNI se debe renovar dentro de los últimos 180 días de vigencia. En casos de extravío, sustracción, deterioro o mal funcionamiento del chip, se debe renovar lo antes posible​​.\nPara más detalles y el proceso completo, te recomiendo visitar el sitio oficial del DNI electrónico en España."
        },
        {
            "user_input": "Kiero renobar mi dni, ¿q tngo q acer?",
            "retrieved_contexts": "<doc>\nRenovación del DNI\n\nComo dicta el Artículo 7 del Real Decreto 1553/2005 de 23 de diciembre, para solicitar la renovación del Documento Nacional de Identidad será imprescindible la presencia física de la persona a quien se haya de expedir, el abono en efectivo o a través de tarjeta de crédito/débito la tasa correspondiente, o utilizando el pago por vía telemática\ty aportar los siguientes documentos:\n\n    Una fotografía reciente en color del rostro del solicitante, tamaño 32x26 milímetros, con fondo uniforme blanco y liso, tomada de frente con la cabeza totalmente descubierta y sin gafas de cristales oscuros o cualquier otra prenda que pueda impedir o dificultar la identificación de la persona. (La fotografía deberá mostrar claramente el óvalo de la cara, que incluye cejas, ojos, nariz, boca y mentón, y deberá ser de alta resolución y en papel fotográfico de buena calidad)\n\n    El DNI anterior (En caso de pérdida o extravío se requerirá denuncia previa o comunicación de tal incidencia al equipo de expedición). En caso de caída del chip, el DNI-e deberá ser tratado como un documento deteriorado, estando su titular obligado a la obtención de un duplicado, tal y como se establece en el artículo 8 del Real Decreto 1553/2005, de 23 de diciembre, en el cual se preceptúa que \"los documentos sustituidos perderán el carácter de Documento Nacional de Identidad, así como los efectos que el ordenamiento jurídico atribuye a este con respecto a su titular\".\n\n    En caso de cambio de domicilio, respecto del que figure en el Documento anterior, certificado o volante de empadronamiento del Ayuntamiento donde el solicitante tenga su domicilio, expedido con una antelación máxima de tres meses a la fecha de la solicitud del Documento Nacional de Identidad. </doc><doc>\n¿Buscas más opciones? </doc><doc>\n¿Qué os parece el cambio?\n\n</doc><doc>\nMira el vídeo tutorial e inspírate renueves este mueble u otro.</doc><doc>\n¿tengo la obligación de asegurarla? </doc>",
            "response": "Para solicitar la renovación del DNI, es necesario cumplir con ciertos requisitos y presentar ciertos documentos. A continuación, te explico los pasos a seguir:\n\n    Verifica tu elegibilidad: Antes de solicitar la renovación, asegúrate de cumplir con los requisitos establecidos en el Real Decreto 1553/2005, de 23 de diciembre. Estos requisitos incluyen tener al menos 16 años de edad, no tener antecedentes penales en España ni en los países con los que España tenga firmado un convenio para el retorno de extranjeros, y no tener prohibida la adquisición de un DNI.\n\n    Prepara los documentos necesarios: Necesitarás presentar una fotografía reciente en color del rostro, el DNI anterior (en caso de pérdida o extravío, debes denunciarlo previamente al equipo de expedición) y un certificado o volante de empadronamiento del Ayuntamiento donde tengas tu domicilio actual. También deberás aportar la tasa correspondiente para la renovación del DNI.\n\n    Solicita la renovación: Puedes hacerlo en la Oficina de Extranjería o en la Comisaría de Policía de la provincia donde tengas tu domicilio. Si tu DNI está en trámite, deberás presentar tu solicitud en la Oficina de Extranjería o en la Comisaría de Policía de la provincia donde se encuentre tu domicilio actual. Si tu DNI está en reposo, deberás presentar tu solicitud en la Oficina de Extranjería o en la Comisaría de Policía de la provincia donde se encuentre tu domicilio actual.\n\n    Espera la renovación: Una vez presentada tu solicitud, la Oficina de Extranjería o la Comisaría de Policía te notificará la resolución en un plazo máximo de tres meses. Si tu DNI está en trámite, recibirás una nueva tarjeta de identidad de extranjero (TIE) con una validez de cinco años. Si tu DNI está en reposo, recibirás una nueva tarjeta de identidad de extranjero (TIE) con una validez de dos años.\n\nEn cuanto a la renovación del DNI, existen algunas opciones adicionales que puedes considerar:\n\n    Renovación por correo: Puedes solicitar la renovación por correo, lo que significa que el documento se enviará a tu domicilio y podrás recogerlo allí. Esta opción es ideal si no puedes acudir a la Oficina de Extranjería o a la Comisaría de Policía en el momento en que presentas tu solicitud.\n\n    Renovación en línea: Puedes realizar la renovación en línea en la página web del Ministerio del Interior. Esta opción es más rápida y conveniente, ya que no tienes que acudir a la Oficina de Extranjería o a la Comisaría de Policía.\n\n    Renovación por teléfono: Puedes solicitar la renovación por teléfono, lo que significa que puedes llamar a la Oficina de Extranjería o a la Comisaría de Policía y solicitar la renovación. Esta opción es ideal si no puedes acudir a la Oficina de Extranjería o a la Comisaría de Policía en el momento en que presentas tu solicitud.\n\nEn resumen, para renovar tu DNI, debes verificar tu elegibilidad, preparar los documentos necesarios, solicitar la renovación en la Oficina de Extranjería o en la Comisaría de Policía, y esperar la resolución. Además, existen opciones adicionales para la renovación, como la renovación por correo, la renovación en línea y la renovación por teléfono.",
            "reference": "Para renovar tu DNI electrónico (DNI-e) en España, sigue estos pasos, según la información oficial proporcionada por el portal del DNI electrónico:\nPresencia física y pago de la tasa: Debes presentarte físicamente y abonar la tasa correspondiente, ya sea en efectivo, con tarjeta de crédito/débito, o mediante pago telemático.\nDocumentación necesaria:\nFotografía reciente: En color, de 32x26 milímetros, con fondo blanco y liso. Debe ser de alta resolución y mostrar claramente el óvalo de la cara.\nDNI anterior: Si se ha perdido, es necesario presentar una denuncia previa o comunicar el incidente.\nCambio de domicilio: Si ha cambiado tu domicilio, necesitarás un certificado o volante de empadronamiento del Ayuntamiento donde residas, expedido en los últimos tres meses.\nMenores de 14 años o personas con capacidad judicialmente complementada: Deben estar acompañados por su tutor legal o una persona apoderada.\nVariación de datos de filiación: Necesitarás un certificado del Registro Civil.\nExtravío, sustracción, destrucción o deterioro del DNI: Debes solicitar un duplicado.\nPlazos para la renovación: El DNI se debe renovar dentro de los últimos 180 días de vigencia. En casos de extravío, sustracción, deterioro o mal funcionamiento del chip, se debe renovar lo antes posible​​.\nPara más detalles y el proceso completo, te recomiendo visitar el sitio oficial del DNI electrónico en España."
        },
        {
            "user_input": "Hola! Acabo de empezar a esquiar y quiero saber qué esquís me puedo comprar",
            "retrieved_contexts": "<doc>\nComprando esquís para principiantes\nSi eres un esquiador principiante y estás preparado para comprar tu primer par de esquís, aquí tienes una guía para guiarte en la dirección correcta. Para mantener las cosas simples, le ayudaremos a identificar qué tipo de esquís sería el mejor para usted, qué longitud elegir y alguna información adicional sobre la anchura del esquí. \nAntes de tomar la decisión final es importante buscar esquís apropiados para su nivel de habilidad en la categoría de principiante. Esto le llevará a esquís que están diseñados para ser más tolerantes y fáciles de controlar. Los esquís para principiantes también incluirán fijaciones de tamaño ajustable y fáciles de usar.\nComprar tu propio par de esquís te permite familiarizarte con cómo se sienten y te responden, lo que puede ser una de las principales ventajas frente a alquilarlos.\nESQUÍES DE PISTA – Los mejores esquís de carving en pistas preparadas\nComo su nombre indica, los esquís están diseñados para ser utilizados en pista. Los esquiadores principiantes pasan todo su tiempo en pista, donde pueden aprender lo básico, por lo que los esquís de pista son una opción ideal. Incluso una vez que haya dominado las pistas fáciles, los esquís de pista pueden llevarle al siguiente nivel. Los esquís son generalmente estrechos, lo que aumenta su capacidad de agarre a la nieve.\nESQUÍES DE MONTAÑA – Los mejores esquís polivalentes\nEstos esquís versátiles están hechos para una serie de condiciones. Se comportan de forma excelente en la pista, pero también pueden manejar algo de esquí fuera de ella. </doc><doc>\nSi es algo que te interesa, te recomendamos que leas nuestro artículo Comprar esquís para esquiadores experimentados donde entramos en más detalle.\nElige la longitud de esquí adecuada\nA la hora de elegir la longitud de tus esquís deberás conocer tu altura y tu nivel de habilidad. Como principiante, debes seleccionar un esquí que esté cerca de la altura de tu nariz. Cada modelo de esquí se fabrica en una variedad de longitudes, por lo que tendrás que elegir uno que se acerque a tu longitud recomendada. (3 cm más largo o más corto que esto no es un problema).\nLa tabla de tallas indica que cuanto menos experiencia tengas esquiando, más cortos deben ser los esquís. Esto se debe a que los esquís más cortos son más fáciles de controlar, lo cual es importante mientras se aprende.\nTu peso es un factor secundario que puede guiarte hacia la talla correcta. Si su peso es considerablemente más ligero o más pesado que el de una persona promedio, también puede considerar la elección de esquís más cortos o más largos. Esquís más largos para personas más pesadas y más cortos para personas más ligeras.\nAncho de los esquís\nLa anchura de los esquís puede indicarte cómo se comportarán en diferentes tipos de terreno. La regla general es que los esquís estrechos son para nieve dura y los anchos para nieve blanda. La anchura de los esquís se describe en 3 números y se refieren a las medidas punta – cintura – cola.\nLa anchura de la cintura es la que revela más detalles y siempre es el número del medio. Ejemplo: 132/78/113\nEsta medida se muestra en nuestra página web bajo las especificaciones de cada uno de nuestros esquís.\nLos esquís con un ancho de cintura entre 70 y 82mm son perfectos si vas a pasar la mayor parte del tiempo en la pista ya que están diseñados para agarrarse a la nieve firme. Por eso son la opción perfecta para los esquiadores principiantes.\n</doc><doc>\nEsquís Nordica NRGY 90 5. Esquís Salomón QST 85Si te enganchaste al esquí después de alquilar un par de esquís un puñado de veces, es probablemente el momento adecuado para hacer tu inversión en el deporte. No importa si eres hombre o mujer, tener un par de esquís para principiantes tiene algunos beneficios bastante importantes. Ya no tendrá que esperar en largas colas para el alquiler, especialmente en los fines de semana más ajetreados. Una vez que los compres, puedes tomar tu equipo y dirigirte directamente a las pistas donde te divertirás como nunca.Además, tener los esquís en lugar de alquilarlos también te ayudará a mejorar rápidamente. Cuando tienes tus esquíes, te familiarizas con la forma en que reaccionan y lo que se necesita para controlarlos, aumentando tu confianza mucho más rápido. Cuando se aprende a esquiar, es difícil mantener el equilibrio, doblar las rodillas en un ángulo incómodo y concentrarse en no comer nieve. Al leer toda nuestra guía basada en las revisiones de los esquís para principiantes, podrá tomar la decisión correcta al elegir los esquís adecuados para usted. Vamos a ello: Cómo elegir los mejores esquís para principiantes – Guía de compra Los esquís para principiantes son una plataforma fácil donde aprenderás los fundamentos del esquí, como el giro, el equilibrio y el control. En resumen, un par de esquís para principiantes hará más fácil aprender la técnica adecuada en menos tiempo. Además, estos modelos para principiantes vienen como un sistema integrado con fijaciones o como un esquí plano que requiere la compra de fijaciones por separado.Al comprar esquís para principiantes, hay que tener en cuenta que los esquís vienen en modelos para hombres y mujeres. Los esquís específicos para cada sexo están diseñados no sólo para adaptarse al tamaño de una persona, sino también para tener en cuenta la forma en que una persona se mueve o carga su peso. Aunque estas diferencias de diseño son sutiles, para la mayoría de los esquiadores principiantes, marcan una gran diferencia. Por lo tanto, antes de comprar el mejor par de esquíes para principiantes, debe considerar algunos factores importantes.TamañoEl dimensionamiento de un esquí es un proceso relativamente simple, pero muy importante, necesario para que se disfrute al máximo en las pistas. Un tamaño de esquí adecuado también te dará la mejor experiencia de aprendizaje en la montaña. Un mito popular es que los esquís muy cortos para principiantes son más fáciles de controlar. El hecho es que, si tienes un esquí demasiado corto para tu peso, puede quitarte mucho control y hacer el proceso de aprendizaje mucho más difícil.Los esquíes deben ser del tamaño adecuado para su altura, peso y estilo y habilidad de esquí. No hay una fórmula mágica para determinar el tamaño correcto de los esquís para ti. En general, la longitud adecuada de los esquíes está entre tu barbilla y la parte superior de tu cabeza. Por ejemplo, un esquiador de 1,80 m de altura querrá buscar esquís de entre 170 y 190 cm. El tamaño exacto adecuado para ti dependerá de tu habilidad y estilo de esquí.Factores como la altura y el peso proporcionarán un excelente punto de partida para la mejor elección de los esquís. Hay muchas otras cosas que también debe considerar, como la categoría del esquí, el tipo de nieve, el terreno y la preferencia personal. Puedes encontrar calculadoras en línea donde introduces los parámetros de tu cuerpo y recibirás el tamaño de esquí adecuado para ti. Todos los esquíes vienen en una tabla de tallas universales.LongitudDejando el mito a un lado, elegir un par de esquís un poco más cortos que los que usaría un experto es un buen primer paso. Generalmente, los esquís más cortos son más fáciles de controlar, ya que responden mejor al girar y al detenerse, estas son las dos habilidades principales que todo esquiador principiante debe tratar de aprender. Elija esquís que, cuando se colocan verticalmente en el suelo en la punta de los dedos de los pies, llegan a algún lugar entre la barbilla y la frente. Esto no tiene que ser perfecto, pero lo más cerca posible de la punta de la nariz es una regla común.Esta es una buena estimación para los principiantes, pero es una regla empírica y no siempre será perfectamente cierta, ya que muchos otros factores pueden afectar a la longitud óptima de los esquíes. Hay guías en línea que pueden ayudaros, a los principiantes, considerablemente. </doc><doc>\nAsí que, en general, busquen esquís que sean ligeramente más flexibles que los que usaría un esquiador experimentado. Te darán un mejor rendimiento y las condiciones para volverte hábil a través de la prueba y el error.Balancín, Camber y HíbridosCon tantos avances e innovaciones que llegan al mercado cada temporada, los esquíes vienen con una variedad de características que tienen por objeto hacer que la navegación por ciertos tipos de terreno, a ciertas velocidades, bajo ciertas condiciones sea lo más fácil y agradable posible. Muchos esquiadores avanzados tienen más de un par de esquís por estas razones. Sin embargo, como principiante, querrá invertir en un par, un par de esquíes que le permitirán manejar sus giros y sentirse más estable y capaz de avanzar con un solo par de esquíes.Como principiante, uno de los principales factores que le ayudará a elegir el mejor par de esquís para usted es el perfil de esquí. El perfil de un esquí puede dividirse en tres categorías principales: camber, rocker y un mixto rocker/camber. Hay otras, incluyendo los esquíes con una forma de fondo plano, pero las tres que se enumeran a continuación son las más populares. </doc><doc>\nLos tipos de esquí exóticos, como los de doble punta, los de parque o los de polvo, pueden no ser una opción apropiada. Estos esquíes pueden hacer mucho más difícil el aprendizaje de buenas técnicas como esquiador principiante.Los esquiadores principiantes deben elegir un esquí flexible y suave, con una cintura estrecha para facilitar el giro. Hasta que no domine un puñado de habilidades esenciales, no se aventurará a través de los árboles o en la nieve polvo, por lo que el uso de un esquí en polvo es inútil para un principiantePreguntas frecuentes P: ¿Por qué los principiantes necesitan sus propios esquís?A:Hay muchos beneficios al poseer tu par de esquíes. Tener un par de esquíes es un cambio en el juego para los esquiadores que buscan progresar rápidamente: cuando tienes tus esquíes, te familiarizas con la forma en que reaccionan y lo que se necesita para controlarlos, lo que significa que aumentarás tu confianza mucho más rápido.Además, ya no tendrás que esperar en largas colas de alquiler, especialmente en fines de semana muy ocupados. Los esquís de alquiler suelen tener una lámina superior mucho más gruesa, lo que ralentiza la curva de aprendizaje de los esquiadores al inhibir la flexión del esquí. </doc>",
            "response": "Para comenzar a esquiar, es importante elegir los esquís adecuados para tu nivel de habilidad y estilo de esquí. Aquí te presento tres opciones populares y su descripción de los esquís:Esquíes de pista: Estos esquís están diseñados para ser utilizados en pista, donde los esquiadores pasan la mayor parte del tiempo. Son generalmente estrechos, lo que aumenta su capacidad de agarre a la nieve. Son una opción excelente para principiantes debido a su mayor comodidad y control en la nieve firme. Esquíes de pista son ideales para los esquiadores que buscan mejorar su técnica en la pista y avanzar en su experiencia en el esquí. Esquíes de pista suelen tener una longitud de entre 160 y 180 cm, dependiendo de tu altura y peso. Esquíes de pista suelen venir con una tabla de tallas, que te indica cuánto más largo debes elegir según tu altura y peso. Esquíes de pista son ideales para principiantes debido a su mayor comodidad y control en la nieve firme. Esquíes de pista suelen tener una tabla de tallas, que te indica cuánto más largo debes elegir según tu altura y peso. Esquíes de pista son ideales para principiantes debido a su mayor comodidad y control en la nieve firme. Esquíes de pista suelen tener una tabla de tallas, que te indica cuánto más largo debes elegir según tu altura y peso. Esquíes de pista son ideales para principiantes debido a su mayor comodidad y control en la nieve firme. Esquíes de pista suelen tener una tabla de tallas, que te indica cuánto más largo debes elegir según tu altura y peso. Esquíes de pista son ideales para principiantes debido a su mayor comodidad y control en la nieve firme. Esquíes de pista suelen tener una tabla de tallas, que te indica cuánto más largo debes elegir según tu altura y peso. Esquíes de pista son ideales para principiantes debido a su mayor comodidad y control en la nieve firme. Esquíes de pista suelen tener una tabla de tallas, que te indica cuánto más largo debes elegir según tu altura y peso. Esquíes de pista son ideales para principiantes debido a su mayor comodidad y control en la nieve firme. Esquíes de pista suelen tener una tabla de tallas, que te indica cuánto más largo debes elegir según tu altura y peso. Esquíes de pista son ideales para principiantes debido a su mayor comodidad y control en la nieve firme. Esquíes de pista suelen tener una tabla de tallas, que te indica cuánto más largo debes elegir según tu altura y peso. Esquíes de pista son ideales para principiantes debido a su mayor comodidad y control en la nieve firme. Esquíes de pista suelen tener una tabla de tallas, que te indica cuánto más largo debes elegir según tu altura y peso. Esquíes de pista son ideales para principiantes debido a su mayor comodidad y control en la nieve firme. Esquíes de pista suelen tener una tabla de tallas, que te indica cuánto más largo debes elegir según tu altura y peso. Esquíes de pista son ideales para principiantes debido a su mayor comodidad y control en la nieve firme. Esquíes de pista suelen tener una tabla de tallas, que te indica cuánto más largo debes elegir según tu altura y peso. Esquíes de pista son ideales para principiantes debido a su mayor comodidad y control en la nieve firme. Esquíes de pista suelen tener una tabla de tallas, que te indica cuánto más largo debes elegir según tu altura y peso. Esquíes de pista son ideales para principiantes debido a su mayor comodidad y control en la nieve firme. Esquíes de pista suelen tener una tabla de tallas, que te indica cuánto más largo debes elegir según tu altura y peso. Esquíes de pista son ideales para principiantes debido a su mayor comodidad y control en la nieve firme. Esquíes de pista suelen tener una tabla de tallas, que te indica cuánto más largo debes elegir según tu altura y peso. Esquíes de",
            "reference": "Para seleccionar los esquís adecuados como principiante en el esquí, hay varios aspectos importantes a considerar:\n\n1. Elección del Tipo de Esquí:\n   - Esquís de Pista: Ideales para principiantes, ya que están diseñados para ser utilizados en pistas preparadas. Son generalmente estrechos, lo que aumenta su capacidad de agarre a la nieve, facilitando el aprendizaje de los movimientos básicos.\n   - Esquís All Mountain: Versátiles para una variedad de condiciones. Funcionan bien tanto en pista como fuera de ella. Son adecuados si ya has esquiado algunas veces y buscas esquís no limitados a pistas preparadas.\n\n2. Longitud de los Esquís:\n   - Como principiante, es recomendable elegir esquís que estén cerca de la altura de tu nariz. Los esquís más cortos son más fáciles de controlar, lo cual es crucial mientras aprendes. Sin embargo, la elección también debe tener en cuenta tu peso, ya que esquís demasiado cortos pueden quitarte control si eres una persona más pesada.\n\n3. Ancho de los Esquís:\n   - Los esquís con un ancho de cintura entre 70 y 80 mm son ideales para principiantes, especialmente si pasarás la mayor parte del tiempo en pistas. Estos esquís están diseñados para agarrarse bien a la nieve firme.\n\n4. Flexibilidad:\n   - Los esquís más flexibles son recomendados para principiantes, ya que son más fáciles de girar y más indulgentes en caso de detenciones o caídas repentinas. La flexibilidad permite al esquiador sentir más el terreno y aprender a controlar mejor los esquís.\n\n5. Perfil del Esquí:\n   - Camber: Diseño tradicional que proporciona un contacto uniforme con la nieve y un control superior del borde, ideal para principiantes.\n   - Rocker: Diseño con las puntas levantadas que facilita iniciar giros, útil para principiantes.\n   - Mixto Rocker/Camber: Combina las ventajas del camber y el rocker, ofreciendo facilidad para girar y buena sujeción de los bordes.\n\n6. Sistemas Integrados:\n   - Algunos modelos para principiantes vienen con fijaciones integradas, lo que puede ser una opción conveniente y segura.\n\nAl elegir tus esquís, es esencial considerar estos factores para asegurar que tengas una experiencia de aprendizaje positiva y segura. También es recomendable asesorarse con profesionales en tiendas de esquí para encontrar el equipo que mejor se adapte a tus necesidades específicas."
        },
        {
            "user_input": "Obtener recomendaciones de esquís para principiantes",
            "retrieved_contexts": "<doc>\nLos mejores esquís para principiantesLos mejores esquís para principiantes Los mejores esquís para principiantes 1. Rossignol Smash 7 Men Skis 2. </doc><doc>\nComprando esquís para principiantes\nSi eres un esquiador principiante y estás preparado para comprar tu primer par de esquís, aquí tienes una guía para guiarte en la dirección correcta. Para mantener las cosas simples, le ayudaremos a identificar qué tipo de esquís sería el mejor para usted, qué longitud elegir y alguna información adicional sobre la anchura del esquí. \nAntes de tomar la decisión final es importante buscar esquís apropiados para su nivel de habilidad en la categoría de principiante. Esto le llevará a esquís que están diseñados para ser más tolerantes y fáciles de controlar. Los esquís para principiantes también incluirán fijaciones de tamaño ajustable y fáciles de usar.\nComprar tu propio par de esquís te permite familiarizarte con cómo se sienten y te responden, lo que puede ser una de las principales ventajas frente a alquilarlos.\nESQUÍES DE PISTA – Los mejores esquís de carving en pistas preparadas\nComo su nombre indica, los esquís están diseñados para ser utilizados en pista. Los esquiadores principiantes pasan todo su tiempo en pista, donde pueden aprender lo básico, por lo que los esquís de pista son una opción ideal. Incluso una vez que haya dominado las pistas fáciles, los esquís de pista pueden llevarle al siguiente nivel. Los esquís son generalmente estrechos, lo que aumenta su capacidad de agarre a la nieve.\nESQUÍES DE MONTAÑA – Los mejores esquís polivalentes\nEstos esquís versátiles están hechos para una serie de condiciones. Se comportan de forma excelente en la pista, pero también pueden manejar algo de esquí fuera de ella. </doc><doc>\nEsquís Nordica NRGY 90 5. Esquís Salomón QST 85Si te enganchaste al esquí después de alquilar un par de esquís un puñado de veces, es probablemente el momento adecuado para hacer tu inversión en el deporte. No importa si eres hombre o mujer, tener un par de esquís para principiantes tiene algunos beneficios bastante importantes. Ya no tendrá que esperar en largas colas para el alquiler, especialmente en los fines de semana más ajetreados. Una vez que los compres, puedes tomar tu equipo y dirigirte directamente a las pistas donde te divertirás como nunca.Además, tener los esquís en lugar de alquilarlos también te ayudará a mejorar rápidamente. Cuando tienes tus esquíes, te familiarizas con la forma en que reaccionan y lo que se necesita para controlarlos, aumentando tu confianza mucho más rápido. Cuando se aprende a esquiar, es difícil mantener el equilibrio, doblar las rodillas en un ángulo incómodo y concentrarse en no comer nieve. Al leer toda nuestra guía basada en las revisiones de los esquís para principiantes, podrá tomar la decisión correcta al elegir los esquís adecuados para usted. Vamos a ello: Cómo elegir los mejores esquís para principiantes – Guía de compra Los esquís para principiantes son una plataforma fácil donde aprenderás los fundamentos del esquí, como el giro, el equilibrio y el control. En resumen, un par de esquís para principiantes hará más fácil aprender la técnica adecuada en menos tiempo. Además, estos modelos para principiantes vienen como un sistema integrado con fijaciones o como un esquí plano que requiere la compra de fijaciones por separado.Al comprar esquís para principiantes, hay que tener en cuenta que los esquís vienen en modelos para hombres y mujeres. Los esquís específicos para cada sexo están diseñados no sólo para adaptarse al tamaño de una persona, sino también para tener en cuenta la forma en que una persona se mueve o carga su peso. Aunque estas diferencias de diseño son sutiles, para la mayoría de los esquiadores principiantes, marcan una gran diferencia. Por lo tanto, antes de comprar el mejor par de esquíes para principiantes, debe considerar algunos factores importantes.TamañoEl dimensionamiento de un esquí es un proceso relativamente simple, pero muy importante, necesario para que se disfrute al máximo en las pistas. Un tamaño de esquí adecuado también te dará la mejor experiencia de aprendizaje en la montaña. Un mito popular es que los esquís muy cortos para principiantes son más fáciles de controlar. El hecho es que, si tienes un esquí demasiado corto para tu peso, puede quitarte mucho control y hacer el proceso de aprendizaje mucho más difícil.Los esquíes deben ser del tamaño adecuado para su altura, peso y estilo y habilidad de esquí. No hay una fórmula mágica para determinar el tamaño correcto de los esquís para ti. En general, la longitud adecuada de los esquíes está entre tu barbilla y la parte superior de tu cabeza. Por ejemplo, un esquiador de 1,80 m de altura querrá buscar esquís de entre 170 y 190 cm. El tamaño exacto adecuado para ti dependerá de tu habilidad y estilo de esquí.Factores como la altura y el peso proporcionarán un excelente punto de partida para la mejor elección de los esquís. Hay muchas otras cosas que también debe considerar, como la categoría del esquí, el tipo de nieve, el terreno y la preferencia personal. Puedes encontrar calculadoras en línea donde introduces los parámetros de tu cuerpo y recibirás el tamaño de esquí adecuado para ti. Todos los esquíes vienen en una tabla de tallas universales.LongitudDejando el mito a un lado, elegir un par de esquís un poco más cortos que los que usaría un experto es un buen primer paso. Generalmente, los esquís más cortos son más fáciles de controlar, ya que responden mejor al girar y al detenerse, estas son las dos habilidades principales que todo esquiador principiante debe tratar de aprender. Elija esquís que, cuando se colocan verticalmente en el suelo en la punta de los dedos de los pies, llegan a algún lugar entre la barbilla y la frente. Esto no tiene que ser perfecto, pero lo más cerca posible de la punta de la nariz es una regla común.Esta es una buena estimación para los principiantes, pero es una regla empírica y no siempre será perfectamente cierta, ya que muchos otros factores pueden afectar a la longitud óptima de los esquíes. Hay guías en línea que pueden ayudaros, a los principiantes, considerablemente. </doc><doc>\nPuedes encontrar instrucciones y tutoriales y hacer ese trabajo tú mismo. Así que, contestado sin rodeos, como principiante deberías recibir tus esquíes como un paquete con fijaciones incluidas!P: ¿Qué tamaño de radio de giro es bueno para los principiantes?A:Los principiantes siempre deben buscar el menor radio de giro posible. Un buen esquí de cintura estrecha debe ser capaz de hacer un giro de 11-13m con facilidad. Aprender a esquiar con un esquí grueso que tiene un radio de giro pobre suele significar que el esquí carecerá de otras características que serán cruciales para desarrollar buenas habilidades como principiante.Es posible ser un gran esquiador en tablas de polvo grueso, pero demasiados principiantes comienzan allí sin desarrollar nunca un conjunto redondeado de habilidades para controlar adecuadamente sus esquís. Los esquíes con un radio de giro más pequeño tienden a ser más ágiles y más fáciles de controlar una vez que se dominan los diversos aspectos de la gestión de su esquí con éxito. Si te metes en un paquete duro o en el hielo en un esquí de cintura estrecha, será mucho más fácil morderlo y mantenerse seguro también.P: ¿Debo ir con un puntaje doble o con un esquí direccional?A:Como principiante, hay algunos aspectos que debería considerar. Los esquís de doble punta tienden a tener un borde efectivo más corto, lo que significa que la cola del esquí aparece antes. Eso significa que será más fácil salir de la curva, y podrás rodar en la siguiente sin atascarte en la cola del esquí.Sin embargo, menos ventaja también significa menos control en las carreras arregladas, donde tú, como principiante, probablemente pasarás la mayor parte del tiempo durante un tiempo. Además, no esquiarás hacia atrás por un tiempo, así que no es necesario dar dos consejos.Una excepción es que si eres un esquiador principiante, y sólo quieres esquiar en un parque, podrías empezar con dos consejos. Necesitarás consejos gemelos en el parque, así que podrías empezar de inmediato con ellos.P: ¿Qué longitud de esquí es buena para los principiantes?A:Dado que los esquís largos son más difíciles de controlar y de aprender, se recomienda que los esquís sean un poco más cortos que el promedio. La mayoría de la gente le dirá que sus esquís deben ser tan altos como su barbilla. Sin embargo, pruebe esquís que sean tan altos como su clavícula. Los esquís más largos son más estables a altas velocidades y le darán más flotación en la nieve profunda como el polvo. Pero como principiante, no deberías hacer ninguna de esas cosas. Por eso un par de esquís más cortos tiene mucho más sentido.El único inconveniente de esto es que eventualmente querrás un par de esquís más largos. Por esa razón, puedes comprar tu primer par de esquís usados para ahorrar dinero y eventualmente comprar unos más largos. Una vez que hayas superado la etapa de principiante, opta por la longitud de la barbilla.Visión general de Globo SurferPara empezar a esquiar hay que divertirse, dominar las habilidades vitales y hacer que la experiencia sea lo más agradable posible. Por esas razones, hemos esbozado las mejores formas de empezar a elegir un esquí para principiantes.Recuerda evitar gastar demasiado y tomarte el tiempo necesario para aprender las técnicas y habilidades adecuadas para esquiar, de modo que puedas esquiar de forma segura y productiva. </doc><doc>\nLos tipos de esquí exóticos, como los de doble punta, los de parque o los de polvo, pueden no ser una opción apropiada. Estos esquíes pueden hacer mucho más difícil el aprendizaje de buenas técnicas como esquiador principiante.Los esquiadores principiantes deben elegir un esquí flexible y suave, con una cintura estrecha para facilitar el giro. Hasta que no domine un puñado de habilidades esenciales, no se aventurará a través de los árboles o en la nieve polvo, por lo que el uso de un esquí en polvo es inútil para un principiantePreguntas frecuentes P: ¿Por qué los principiantes necesitan sus propios esquís?A:Hay muchos beneficios al poseer tu par de esquíes. Tener un par de esquíes es un cambio en el juego para los esquiadores que buscan progresar rápidamente: cuando tienes tus esquíes, te familiarizas con la forma en que reaccionan y lo que se necesita para controlarlos, lo que significa que aumentarás tu confianza mucho más rápido.Además, ya no tendrás que esperar en largas colas de alquiler, especialmente en fines de semana muy ocupados. Los esquís de alquiler suelen tener una lámina superior mucho más gruesa, lo que ralentiza la curva de aprendizaje de los esquiadores al inhibir la flexión del esquí. </doc>",
            "response": "Para comenzar a esquiar, es fundamental elegir los esquís adecuados para tu nivel de habilidad. Existen diferentes tipos de esquíes, cada uno con sus propias características y necesidades. Aquí te presento tres opciones populares para principiantes:\n\n    Rossignol Smash 7 Men Skis: Este esquí es ideal para principiantes debido a su tamaño pequeño y su cintura estrecha, lo que facilita el giro y la curva. Es más ligero y fácil de controlar, lo que lo hace ideal para aprender a esquiar​.\n\nSalomon QST 85: Este esquí es más largo que los demás, lo que le da más estabilidad a velocidades más bajas y le permite hacer un mejor uso de la curva. También es más resistente y duradero, lo que lo hace ideal para principiantes que quieren experimentar en terrenos más difíciles​.\n\nNordic NRGY 90 5: Estos esquíes son versátiles y pueden ser utilizados tanto en pistas como en montañas. Son más anchos que los otros esquíes, lo que les permite ofrecer mayor estabilidad y control en terrenos empinados​.\n\nEn cuanto a la longitud, es recomendable elegir esquís que lleguen hasta la mitad de tu altura. Esto te permitirá tener un mayor control y una mayor estabilidad en la curva. Además, si prefieres esquiar en polvo, opta por esquís más cortos para facilitar la curva y evitar atascarte en la cola del esquí​​.\n\nEn resumen, para principiantes, es recomendable optar por esquís flexibles y suaves, con una cintura estrecha, para facilitar el giro y la curva. Y si prefieres esquiar en polvo, opta por esquís más anchos para ofrecer mayor estabilidad y control en terrenos empinados.",
            "reference": "Para seleccionar los esquís adecuados como principiante en el esquí, hay varios aspectos importantes a considerar:\n\n1. Elección del Tipo de Esquí:\n   - Esquís de Pista: Ideales para principiantes, ya que están diseñados para ser utilizados en pistas preparadas. Son generalmente estrechos, lo que aumenta su capacidad de agarre a la nieve, facilitando el aprendizaje de los movimientos básicos.\n   - Esquís All Mountain: Versátiles para una variedad de condiciones. Funcionan bien tanto en pista como fuera de ella. Son adecuados si ya has esquiado algunas veces y buscas esquís no limitados a pistas preparadas.\n\n2. Longitud de los Esquís:\n   - Como principiante, es recomendable elegir esquís que estén cerca de la altura de tu nariz. Los esquís más cortos son más fáciles de controlar, lo cual es crucial mientras aprendes. Sin embargo, la elección también debe tener en cuenta tu peso, ya que esquís demasiado cortos pueden quitarte control si eres una persona más pesada.\n\n3. Ancho de los Esquís:\n   - Los esquís con un ancho de cintura entre 70 y 80 mm son ideales para principiantes, especialmente si pasarás la mayor parte del tiempo en pistas. Estos esquís están diseñados para agarrarse bien a la nieve firme.\n\n4. Flexibilidad:\n   - Los esquís más flexibles son recomendados para principiantes, ya que son más fáciles de girar y más indulgentes en caso de detenciones o caídas repentinas. La flexibilidad permite al esquiador sentir más el terreno y aprender a controlar mejor los esquís.\n\n5. Perfil del Esquí:\n   - Camber: Diseño tradicional que proporciona un contacto uniforme con la nieve y un control superior del borde, ideal para principiantes.\n   - Rocker: Diseño con las puntas levantadas que facilita iniciar giros, útil para principiantes.\n   - Mixto Rocker/Camber: Combina las ventajas del camber y el rocker, ofreciendo facilidad para girar y buena sujeción de los bordes.\n\n6. Sistemas Integrados:\n   - Algunos modelos para principiantes vienen con fijaciones integradas, lo que puede ser una opción conveniente y segura.\n\nAl elegir tus esquís, es esencial considerar estos factores para asegurar que tengas una experiencia de aprendizaje positiva y segura. También es recomendable asesorarse con profesionales en tiendas de esquí para encontrar el equipo que mejor se adapte a tus necesidades específicas."
        },
        {
            "user_input": "que tipo de esquis puedo comprarme para nivel principante?",
            "retrieved_contexts": "<doc>\nComprando esquís para principiantes\nSi eres un esquiador principiante y estás preparado para comprar tu primer par de esquís, aquí tienes una guía para guiarte en la dirección correcta. Para mantener las cosas simples, le ayudaremos a identificar qué tipo de esquís sería el mejor para usted, qué longitud elegir y alguna información adicional sobre la anchura del esquí. \nAntes de tomar la decisión final es importante buscar esquís apropiados para su nivel de habilidad en la categoría de principiante. Esto le llevará a esquís que están diseñados para ser más tolerantes y fáciles de controlar. Los esquís para principiantes también incluirán fijaciones de tamaño ajustable y fáciles de usar.\nComprar tu propio par de esquís te permite familiarizarte con cómo se sienten y te responden, lo que puede ser una de las principales ventajas frente a alquilarlos.\nESQUÍES DE PISTA – Los mejores esquís de carving en pistas preparadas\nComo su nombre indica, los esquís están diseñados para ser utilizados en pista. Los esquiadores principiantes pasan todo su tiempo en pista, donde pueden aprender lo básico, por lo que los esquís de pista son una opción ideal. Incluso una vez que haya dominado las pistas fáciles, los esquís de pista pueden llevarle al siguiente nivel. Los esquís son generalmente estrechos, lo que aumenta su capacidad de agarre a la nieve.\nESQUÍES DE MONTAÑA – Los mejores esquís polivalentes\nEstos esquís versátiles están hechos para una serie de condiciones. Se comportan de forma excelente en la pista, pero también pueden manejar algo de esquí fuera de ella. </doc><doc>\nAsí que, en general, busquen esquís que sean ligeramente más flexibles que los que usaría un esquiador experimentado. Te darán un mejor rendimiento y las condiciones para volverte hábil a través de la prueba y el error.Balancín, Camber y HíbridosCon tantos avances e innovaciones que llegan al mercado cada temporada, los esquíes vienen con una variedad de características que tienen por objeto hacer que la navegación por ciertos tipos de terreno, a ciertas velocidades, bajo ciertas condiciones sea lo más fácil y agradable posible. Muchos esquiadores avanzados tienen más de un par de esquís por estas razones. Sin embargo, como principiante, querrá invertir en un par, un par de esquíes que le permitirán manejar sus giros y sentirse más estable y capaz de avanzar con un solo par de esquíes.Como principiante, uno de los principales factores que le ayudará a elegir el mejor par de esquís para usted es el perfil de esquí. El perfil de un esquí puede dividirse en tres categorías principales: camber, rocker y un mixto rocker/camber. Hay otras, incluyendo los esquíes con una forma de fondo plano, pero las tres que se enumeran a continuación son las más populares. </doc><doc>\nEsquís Nordica NRGY 90 5. Esquís Salomón QST 85Si te enganchaste al esquí después de alquilar un par de esquís un puñado de veces, es probablemente el momento adecuado para hacer tu inversión en el deporte. No importa si eres hombre o mujer, tener un par de esquís para principiantes tiene algunos beneficios bastante importantes. Ya no tendrá que esperar en largas colas para el alquiler, especialmente en los fines de semana más ajetreados. Una vez que los compres, puedes tomar tu equipo y dirigirte directamente a las pistas donde te divertirás como nunca.Además, tener los esquís en lugar de alquilarlos también te ayudará a mejorar rápidamente. Cuando tienes tus esquíes, te familiarizas con la forma en que reaccionan y lo que se necesita para controlarlos, aumentando tu confianza mucho más rápido. Cuando se aprende a esquiar, es difícil mantener el equilibrio, doblar las rodillas en un ángulo incómodo y concentrarse en no comer nieve. Al leer toda nuestra guía basada en las revisiones de los esquís para principiantes, podrá tomar la decisión correcta al elegir los esquís adecuados para usted. Vamos a ello: Cómo elegir los mejores esquís para principiantes – Guía de compra Los esquís para principiantes son una plataforma fácil donde aprenderás los fundamentos del esquí, como el giro, el equilibrio y el control. En resumen, un par de esquís para principiantes hará más fácil aprender la técnica adecuada en menos tiempo. Además, estos modelos para principiantes vienen como un sistema integrado con fijaciones o como un esquí plano que requiere la compra de fijaciones por separado.Al comprar esquís para principiantes, hay que tener en cuenta que los esquís vienen en modelos para hombres y mujeres. Los esquís específicos para cada sexo están diseñados no sólo para adaptarse al tamaño de una persona, sino también para tener en cuenta la forma en que una persona se mueve o carga su peso. Aunque estas diferencias de diseño son sutiles, para la mayoría de los esquiadores principiantes, marcan una gran diferencia. Por lo tanto, antes de comprar el mejor par de esquíes para principiantes, debe considerar algunos factores importantes.TamañoEl dimensionamiento de un esquí es un proceso relativamente simple, pero muy importante, necesario para que se disfrute al máximo en las pistas. Un tamaño de esquí adecuado también te dará la mejor experiencia de aprendizaje en la montaña. Un mito popular es que los esquís muy cortos para principiantes son más fáciles de controlar. El hecho es que, si tienes un esquí demasiado corto para tu peso, puede quitarte mucho control y hacer el proceso de aprendizaje mucho más difícil.Los esquíes deben ser del tamaño adecuado para su altura, peso y estilo y habilidad de esquí. No hay una fórmula mágica para determinar el tamaño correcto de los esquís para ti. En general, la longitud adecuada de los esquíes está entre tu barbilla y la parte superior de tu cabeza. Por ejemplo, un esquiador de 1,80 m de altura querrá buscar esquís de entre 170 y 190 cm. El tamaño exacto adecuado para ti dependerá de tu habilidad y estilo de esquí.Factores como la altura y el peso proporcionarán un excelente punto de partida para la mejor elección de los esquís. Hay muchas otras cosas que también debe considerar, como la categoría del esquí, el tipo de nieve, el terreno y la preferencia personal. Puedes encontrar calculadoras en línea donde introduces los parámetros de tu cuerpo y recibirás el tamaño de esquí adecuado para ti. Todos los esquíes vienen en una tabla de tallas universales.LongitudDejando el mito a un lado, elegir un par de esquís un poco más cortos que los que usaría un experto es un buen primer paso. Generalmente, los esquís más cortos son más fáciles de controlar, ya que responden mejor al girar y al detenerse, estas son las dos habilidades principales que todo esquiador principiante debe tratar de aprender. Elija esquís que, cuando se colocan verticalmente en el suelo en la punta de los dedos de los pies, llegan a algún lugar entre la barbilla y la frente. Esto no tiene que ser perfecto, pero lo más cerca posible de la punta de la nariz es una regla común.Esta es una buena estimación para los principiantes, pero es una regla empírica y no siempre será perfectamente cierta, ya que muchos otros factores pueden afectar a la longitud óptima de los esquíes. Hay guías en línea que pueden ayudaros, a los principiantes, considerablemente. </doc><doc>\nLos tipos de esquí exóticos, como los de doble punta, los de parque o los de polvo, pueden no ser una opción apropiada. Estos esquíes pueden hacer mucho más difícil el aprendizaje de buenas técnicas como esquiador principiante.Los esquiadores principiantes deben elegir un esquí flexible y suave, con una cintura estrecha para facilitar el giro. Hasta que no domine un puñado de habilidades esenciales, no se aventurará a través de los árboles o en la nieve polvo, por lo que el uso de un esquí en polvo es inútil para un principiantePreguntas frecuentes P: ¿Por qué los principiantes necesitan sus propios esquís?A:Hay muchos beneficios al poseer tu par de esquíes. Tener un par de esquíes es un cambio en el juego para los esquiadores que buscan progresar rápidamente: cuando tienes tus esquíes, te familiarizas con la forma en que reaccionan y lo que se necesita para controlarlos, lo que significa que aumentarás tu confianza mucho más rápido.Además, ya no tendrás que esperar en largas colas de alquiler, especialmente en fines de semana muy ocupados. Los esquís de alquiler suelen tener una lámina superior mucho más gruesa, lo que ralentiza la curva de aprendizaje de los esquiadores al inhibir la flexión del esquí. </doc><doc>\nLos mejores esquís para principiantesLos mejores esquís para principiantes Los mejores esquís para principiantes 1. Rossignol Smash 7 Men Skis 2. </doc>",
            "response": "Para elegir los mejores esquís para principiantes, es importante considerar varios factores clave. Aquí te presento una guía basada en la información obtenida de diversas fuentes:\n\n    Calidad y Durabilidad: Busca esquís que tengan una construcción de alta calidad y que estén hechos de materiales duraderos. Esto incluye no solo la calidad del esquí, sino también la durabilidad del material utilizado para fabricarlos​.\n\nPerfiles de Esquí: Los esquís de pista suelen tener un perfil más ancho y largo, mientras que los esquís de montaña suelen tener un perfil más fino y angosto. Elige un perfil que se adapte a tus necesidades, ya sea para pista o para montaña​.\n\nAncho de los Esquís: El ancho de los esquís es importante porque afecta al control y al manejo. Los esquís más anchos suelen ser más fáciles de controlar y girar​.\n\nLongitud de los Esquís: La longitud de los esquís es un factor importante, ya que los esquís más cortos son más fáciles de controlar y de usar en terrenos empinados​.\n\nTalla: La talla de los esquís es importante porque afecta al tamaño de la punta de los dedos de los pies. Un esquí demasiado grande puede ser difícil de usar y requerir una posición incorrecta, mientras que un esquí demasiado pequeño puede ser difícil de controlar​.\n\nEstructura: La estructura del esquí también es importante, ya que afecta al agarre y al control. Los esquís con una base más ancha y gruesa suelen ofrecer mejores agarres y control​.\n\nPrincipales marcas y modelos: Hay varias marcas y modelos de esquís disponibles en el mercado, cada una con sus propias características y beneficios. Algunas marcas populares incluyen Rossignol, Salomon, Nordica y刃形.\n\nAl considerar estos factores, podrás elegir un par de esquís que se adapten a tus necesidades y niveles de habilidad, y que te brinden la mejor experiencia de esquí.",
            "reference": "Para seleccionar los esquís adecuados como principiante en el esquí, hay varios aspectos importantes a considerar:\n\n1. Elección del Tipo de Esquí:\n   - Esquís de Pista: Ideales para principiantes, ya que están diseñados para ser utilizados en pistas preparadas. Son generalmente estrechos, lo que aumenta su capacidad de agarre a la nieve, facilitando el aprendizaje de los movimientos básicos.\n   - Esquís All Mountain: Versátiles para una variedad de condiciones. Funcionan bien tanto en pista como fuera de ella. Son adecuados si ya has esquiado algunas veces y buscas esquís no limitados a pistas preparadas.\n\n2. Longitud de los Esquís:\n   - Como principiante, es recomendable elegir esquís que estén cerca de la altura de tu nariz. Los esquís más cortos son más fáciles de controlar, lo cual es crucial mientras aprendes. Sin embargo, la elección también debe tener en cuenta tu peso, ya que esquís demasiado cortos pueden quitarte control si eres una persona más pesada.\n\n3. Ancho de los Esquís:\n   - Los esquís con un ancho de cintura entre 70 y 80 mm son ideales para principiantes, especialmente si pasarás la mayor parte del tiempo en pistas. Estos esquís están diseñados para agarrarse bien a la nieve firme.\n\n4. Flexibilidad:\n   - Los esquís más flexibles son recomendados para principiantes, ya que son más fáciles de girar y más indulgentes en caso de detenciones o caídas repentinas. La flexibilidad permite al esquiador sentir más el terreno y aprender a controlar mejor los esquís.\n\n5. Perfil del Esquí:\n   - Camber: Diseño tradicional que proporciona un contacto uniforme con la nieve y un control superior del borde, ideal para principiantes.\n   - Rocker: Diseño con las puntas levantadas que facilita iniciar giros, útil para principiantes.\n   - Mixto Rocker/Camber: Combina las ventajas del camber y el rocker, ofreciendo facilidad para girar y buena sujeción de los bordes.\n\n6. Sistemas Integrados:\n   - Algunos modelos para principiantes vienen con fijaciones integradas, lo que puede ser una opción conveniente y segura.\n\nAl elegir tus esquís, es esencial considerar estos factores para asegurar que tengas una experiencia de aprendizaje positiva y segura. También es recomendable asesorarse con profesionales en tiendas de esquí para encontrar el equipo que mejor se adapte a tus necesidades específicas."
        },
        {
            "user_input": "Recomiéndame unos esquís para debutantes",
            "retrieved_contexts": "<doc>\nComprando esquís para principiantes\nSi eres un esquiador principiante y estás preparado para comprar tu primer par de esquís, aquí tienes una guía para guiarte en la dirección correcta. Para mantener las cosas simples, le ayudaremos a identificar qué tipo de esquís sería el mejor para usted, qué longitud elegir y alguna información adicional sobre la anchura del esquí. \nAntes de tomar la decisión final es importante buscar esquís apropiados para su nivel de habilidad en la categoría de principiante. Esto le llevará a esquís que están diseñados para ser más tolerantes y fáciles de controlar. Los esquís para principiantes también incluirán fijaciones de tamaño ajustable y fáciles de usar.\nComprar tu propio par de esquís te permite familiarizarte con cómo se sienten y te responden, lo que puede ser una de las principales ventajas frente a alquilarlos.\nESQUÍES DE PISTA – Los mejores esquís de carving en pistas preparadas\nComo su nombre indica, los esquís están diseñados para ser utilizados en pista. Los esquiadores principiantes pasan todo su tiempo en pista, donde pueden aprender lo básico, por lo que los esquís de pista son una opción ideal. Incluso una vez que haya dominado las pistas fáciles, los esquís de pista pueden llevarle al siguiente nivel. Los esquís son generalmente estrechos, lo que aumenta su capacidad de agarre a la nieve.\nESQUÍES DE MONTAÑA – Los mejores esquís polivalentes\nEstos esquís versátiles están hechos para una serie de condiciones. Se comportan de forma excelente en la pista, pero también pueden manejar algo de esquí fuera de ella. </doc><doc>\nEsquís Nordica NRGY 90 5. Esquís Salomón QST 85Si te enganchaste al esquí después de alquilar un par de esquís un puñado de veces, es probablemente el momento adecuado para hacer tu inversión en el deporte. No importa si eres hombre o mujer, tener un par de esquís para principiantes tiene algunos beneficios bastante importantes. Ya no tendrá que esperar en largas colas para el alquiler, especialmente en los fines de semana más ajetreados. Una vez que los compres, puedes tomar tu equipo y dirigirte directamente a las pistas donde te divertirás como nunca.Además, tener los esquís en lugar de alquilarlos también te ayudará a mejorar rápidamente. Cuando tienes tus esquíes, te familiarizas con la forma en que reaccionan y lo que se necesita para controlarlos, aumentando tu confianza mucho más rápido. Cuando se aprende a esquiar, es difícil mantener el equilibrio, doblar las rodillas en un ángulo incómodo y concentrarse en no comer nieve. Al leer toda nuestra guía basada en las revisiones de los esquís para principiantes, podrá tomar la decisión correcta al elegir los esquís adecuados para usted. Vamos a ello: Cómo elegir los mejores esquís para principiantes – Guía de compra Los esquís para principiantes son una plataforma fácil donde aprenderás los fundamentos del esquí, como el giro, el equilibrio y el control. En resumen, un par de esquís para principiantes hará más fácil aprender la técnica adecuada en menos tiempo. Además, estos modelos para principiantes vienen como un sistema integrado con fijaciones o como un esquí plano que requiere la compra de fijaciones por separado.Al comprar esquís para principiantes, hay que tener en cuenta que los esquís vienen en modelos para hombres y mujeres. Los esquís específicos para cada sexo están diseñados no sólo para adaptarse al tamaño de una persona, sino también para tener en cuenta la forma en que una persona se mueve o carga su peso. Aunque estas diferencias de diseño son sutiles, para la mayoría de los esquiadores principiantes, marcan una gran diferencia. Por lo tanto, antes de comprar el mejor par de esquíes para principiantes, debe considerar algunos factores importantes.TamañoEl dimensionamiento de un esquí es un proceso relativamente simple, pero muy importante, necesario para que se disfrute al máximo en las pistas. Un tamaño de esquí adecuado también te dará la mejor experiencia de aprendizaje en la montaña. Un mito popular es que los esquís muy cortos para principiantes son más fáciles de controlar. El hecho es que, si tienes un esquí demasiado corto para tu peso, puede quitarte mucho control y hacer el proceso de aprendizaje mucho más difícil.Los esquíes deben ser del tamaño adecuado para su altura, peso y estilo y habilidad de esquí. No hay una fórmula mágica para determinar el tamaño correcto de los esquís para ti. En general, la longitud adecuada de los esquíes está entre tu barbilla y la parte superior de tu cabeza. Por ejemplo, un esquiador de 1,80 m de altura querrá buscar esquís de entre 170 y 190 cm. El tamaño exacto adecuado para ti dependerá de tu habilidad y estilo de esquí.Factores como la altura y el peso proporcionarán un excelente punto de partida para la mejor elección de los esquís. Hay muchas otras cosas que también debe considerar, como la categoría del esquí, el tipo de nieve, el terreno y la preferencia personal. Puedes encontrar calculadoras en línea donde introduces los parámetros de tu cuerpo y recibirás el tamaño de esquí adecuado para ti. Todos los esquíes vienen en una tabla de tallas universales.LongitudDejando el mito a un lado, elegir un par de esquís un poco más cortos que los que usaría un experto es un buen primer paso. Generalmente, los esquís más cortos son más fáciles de controlar, ya que responden mejor al girar y al detenerse, estas son las dos habilidades principales que todo esquiador principiante debe tratar de aprender. Elija esquís que, cuando se colocan verticalmente en el suelo en la punta de los dedos de los pies, llegan a algún lugar entre la barbilla y la frente. Esto no tiene que ser perfecto, pero lo más cerca posible de la punta de la nariz es una regla común.Esta es una buena estimación para los principiantes, pero es una regla empírica y no siempre será perfectamente cierta, ya que muchos otros factores pueden afectar a la longitud óptima de los esquíes. Hay guías en línea que pueden ayudaros, a los principiantes, considerablemente. </doc><doc>\nLos tipos de esquí exóticos, como los de doble punta, los de parque o los de polvo, pueden no ser una opción apropiada. Estos esquíes pueden hacer mucho más difícil el aprendizaje de buenas técnicas como esquiador principiante.Los esquiadores principiantes deben elegir un esquí flexible y suave, con una cintura estrecha para facilitar el giro. Hasta que no domine un puñado de habilidades esenciales, no se aventurará a través de los árboles o en la nieve polvo, por lo que el uso de un esquí en polvo es inútil para un principiantePreguntas frecuentes P: ¿Por qué los principiantes necesitan sus propios esquís?A:Hay muchos beneficios al poseer tu par de esquíes. Tener un par de esquíes es un cambio en el juego para los esquiadores que buscan progresar rápidamente: cuando tienes tus esquíes, te familiarizas con la forma en que reaccionan y lo que se necesita para controlarlos, lo que significa que aumentarás tu confianza mucho más rápido.Además, ya no tendrás que esperar en largas colas de alquiler, especialmente en fines de semana muy ocupados. Los esquís de alquiler suelen tener una lámina superior mucho más gruesa, lo que ralentiza la curva de aprendizaje de los esquiadores al inhibir la flexión del esquí. </doc><doc>\nAsí que, en general, busquen esquís que sean ligeramente más flexibles que los que usaría un esquiador experimentado. Te darán un mejor rendimiento y las condiciones para volverte hábil a través de la prueba y el error.Balancín, Camber y HíbridosCon tantos avances e innovaciones que llegan al mercado cada temporada, los esquíes vienen con una variedad de características que tienen por objeto hacer que la navegación por ciertos tipos de terreno, a ciertas velocidades, bajo ciertas condiciones sea lo más fácil y agradable posible. Muchos esquiadores avanzados tienen más de un par de esquís por estas razones. Sin embargo, como principiante, querrá invertir en un par, un par de esquíes que le permitirán manejar sus giros y sentirse más estable y capaz de avanzar con un solo par de esquíes.Como principiante, uno de los principales factores que le ayudará a elegir el mejor par de esquís para usted es el perfil de esquí. El perfil de un esquí puede dividirse en tres categorías principales: camber, rocker y un mixto rocker/camber. Hay otras, incluyendo los esquíes con una forma de fondo plano, pero las tres que se enumeran a continuación son las más populares. </doc><doc>\nLos mejores esquís para principiantesLos mejores esquís para principiantes Los mejores esquís para principiantes 1. Rossignol Smash 7 Men Skis 2. </doc>",
            "response": "Para recomendaciones de esquís para principiantes, es importante considerar varios factores clave, como el tamaño, la longitud, la flexibilidad, y la calidad general. Aquí te presento una selección de esquís recomendados para principiantes, basada en la información obtenida de diversas fuentes:\n\n    Rossignol Smash 7 Men Skis: Este esquí es una excelente opción para principiantes debido a su tamaño compacto (160 mm) y su flexibilidad en una variedad de condiciones. También cuenta con una buena calidad de material y un diseño ergonómico​.\n\nSalomon QST 85: Estos esquíes son ideales para principiantes debido a su tamaño (160 mm) y su flexibilidad en diferentes terrenos. Además, tienen una buena calidad de material y un diseño ligero y fácil de manejar​.\n\nNordic NRGY 90: Estos esquíes son excelentes para principiantes debido a su tamaño (160 mm) y su flexibilidad en diferentes terrenos. También cuentan con una buena calidad de material y un diseño ligero y fácil de manejar​.\n\nSi bien estos esquís son una excelente opción para principiantes, es importante recordar que la elección de los esquís adecuados para cada persona depende de varios factores, como el tamaño, el peso, y la preferencia personal. Por lo tanto, es recomendable probar diferentes modelos antes de tomar una decisión final.",
            "reference": "Para seleccionar los esquís adecuados como principiante en el esquí, hay varios aspectos importantes a considerar:\n\n1. Elección del Tipo de Esquí:\n   - Esquís de Pista: Ideales para principiantes, ya que están diseñados para ser utilizados en pistas preparadas. Son generalmente estrechos, lo que aumenta su capacidad de agarre a la nieve, facilitando el aprendizaje de los movimientos básicos.\n   - Esquís All Mountain: Versátiles para una variedad de condiciones. Funcionan bien tanto en pista como fuera de ella. Son adecuados si ya has esquiado algunas veces y buscas esquís no limitados a pistas preparadas.\n\n2. Longitud de los Esquís:\n   - Como principiante, es recomendable elegir esquís que estén cerca de la altura de tu nariz. Los esquís más cortos son más fáciles de controlar, lo cual es crucial mientras aprendes. Sin embargo, la elección también debe tener en cuenta tu peso, ya que esquís demasiado cortos pueden quitarte control si eres una persona más pesada.\n\n3. Ancho de los Esquís:\n   - Los esquís con un ancho de cintura entre 70 y 80 mm son ideales para principiantes, especialmente si pasarás la mayor parte del tiempo en pistas. Estos esquís están diseñados para agarrarse bien a la nieve firme.\n\n4. Flexibilidad:\n   - Los esquís más flexibles son recomendados para principiantes, ya que son más fáciles de girar y más indulgentes en caso de detenciones o caídas repentinas. La flexibilidad permite al esquiador sentir más el terreno y aprender a controlar mejor los esquís.\n\n5. Perfil del Esquí:\n   - Camber: Diseño tradicional que proporciona un contacto uniforme con la nieve y un control superior del borde, ideal para principiantes.\n   - Rocker: Diseño con las puntas levantadas que facilita iniciar giros, útil para principiantes.\n   - Mixto Rocker/Camber: Combina las ventajas del camber y el rocker, ofreciendo facilidad para girar y buena sujeción de los bordes.\n\n6. Sistemas Integrados:\n   - Algunos modelos para principiantes vienen con fijaciones integradas, lo que puede ser una opción conveniente y segura.\n\nAl elegir tus esquís, es esencial considerar estos factores para asegurar que tengas una experiencia de aprendizaje positiva y segura. También es recomendable asesorarse con profesionales en tiendas de esquí para encontrar el equipo que mejor se adapte a tus necesidades específicas."
        },
        {
            "user_input": "Explícame cómo se inventó la receta de judiones de la Granja.",
            "retrieved_contexts": "<doc>\nLas judías eran de color oscuro y fueron aclarándose a lo largo de los siglos hasta poseer el blanco actual. En la actualidad el cultivo de esta legumbre se ha extendido a otras partes de Castilla. El día 15 de octubre de 1955, Tomás Urrialde ofreció por primera vez el plato de los judiones de La Granja, con la receta creada por él mismo, a la denominada Cofradía de los 12 Apóstoles. Suele realizarse una fiesta conmemorativa en La Granja en torno a los judiones el día 25 de agosto, día de San Luis.\nCultivo y características\n\nSe cultiva en un área cercana a Real Sitio de San Ildefonso (144,81 km²) en la sierra de Guadarrama. El tamaño de las judías es grande y tras una cocción prolongada en agua mantienen su textura intacta hasta ser introducidas bajo el paladar. Suele haber entre cuarenta y cincuenta granos en cada 100 gramos. Suelen ser de color blanco (blanco de España) o amarillento. La planta suele alcanzar un tamaño superior a los dos metros.\nUsos y preparación\n\nSe suele emplear en platos regionales de Segovia tales como estofados, cocidos, etc. en los que interviene carne en forma de embutido como puede ser chorizo, la mayoría de ellos cocinados en tradicionales ollas de barro. Es posible encontrar recetas con estas judías basadas en ave: una de las más populares es con perdiz. No tiene nada que ver el judión de La Granja con la faba de la Granja, que se utiliza para hacer la fabada asturiana.\n\nLos ingredientes para la elaboración de la receta tradicional1​2​ de este plato son: judiones de La Granja, oreja de cerdo, morcilla, chorizo de Cantimpalos, cebolla, laurel, ajo, aceite de oliva, sal y pimentón dulce. En algunos casos se utiliza manita de cerdo para darle más sabor y harina para espesar el caldo.\n\nPara la preparación de este plato, la legumbre debe de ponerse en remojo el día anterior. Posteriormente se cuecen con la oreja de cerdo, morcilla y chorizo. Al mismo tiempo, en una sartén se preparan los ajos, el aceite de oliva y el pimentón. Posteriormente se mezcla todo y se deja cocer durante largo tiempo. Esta receta conlleva una cocción muy lenta y larga hasta conseguir que la legumbre esté tierna y lista para comer.\nVéase también\n\n    Judiones de El Barco de Ávila\n    Gastronomía de la provincia de Segovia\n\nReferencias\n\n«Receta Judiones de La Granja». cocidocastellano.blogspot.com. </doc><doc>\nEsos espacios posteriormente fueron parcelados, convertidos en huertas y entregados a los sirvientes de palacio con el objeto de compensar sus rentas y facilitar la producción de hortalizas de estación. En sus manos, la progresiva selección del judión, dio lugar a ese famoso proceso de «aclareamiento», pues estas legumbres primero fueron de un color morado negruzco, mas tarde morado claro con pintas negras, para pasar después a morado suave, hasta que, finalmente, adquirieron la característica albura que presentan en la actualidad.\n\nA partir del núcleo de San Ildefonso, donde actualmente encontramos la mayor concentración de huertos dedicados a este cultivo, la siembra del judión se ha extendido, por las vegas del Eresma y, secundariamente, por las del Pirón.\n\nPosteriormente alguien decidió probarlas y desde entonces se dedicaron también al consumo humano.\n\nEl judión de La Granja es en la actualidad la legumbre más importante de Segovia junto al garbanzo de Valseca. Se cultiva en pocas hectáreas llegando a alcanzar altas cotizaciones.\nVer también\nReceta de Pechuga de pollo en escabeche de manzanilla\nRecetas de Cocina\nPechuga de pollo en escabeche de manzanilla\nElaboración tradicional de los Judiones de la Granja.\n\nJudiones de la Granja, por jlastras\n\nJudiones de la Granja\nEsta receta tiene todo lo necesario para ser plato único. </doc><doc>\nLas plantas se aclimataron a las laderas de la sierra del Guadarrama y con el tiempo estas judías de enorme tamaño fueron seleccionándose -desde su color oscuro inicial al color blanco actual, entre otras características- para acabar siendo consumidas también por los humanos (por aquí ya lo usamos en este salteado de judiones con berberechos).\n\nLos judiones estofados con chacinas los introdujo en la restauración de la zona el cocinero segoviano Tomás Urrialde, dicen que sobre 1955, convirtiéndose a partir de entonces en un plato tipiquísimo en los restaurantes de La Granja de San Ildefonso y extendiéndose por toda la provincia. ¿Qué hace falta para elaborar unos judiones de La Granja de aúpa? Es obvio que necesitas unos judiones de La Granja secos de calidad, del mismo año y no del pleistoceno, y ya sabes, debes empezar la elaboración el día anterior puesto que necesitan remojo. Acompáñalos de buenas carnes curadas y cuece al chup chup, con paciencia y mimo, las horas que haga falta y podrás reconfortarte como es debido después de una buena caminata por la sierra. La receta en la que me baso procede del Asador Duque, local de mucha solera en la capital segoviana.</doc><doc>\nMotivo: aún no se han proporcionado motivos para el renombrado.\nDetalle del judión de La Granja\nJudiones de La Granja cocidos\nJudiones de la Granja en Real Sitio de San Ildefonso\n\nSe denomina judiones de La Granja a una variedad de judía de gran tamaño que se cultiva en el Real Sitio de San Ildefonso (provincia de Segovia, Castilla y León, España), la Phaseolus coccineus, también denominada Phaseolus multiflorus Willd., que se cree que fue traída de América y plantada en La Granja a comienzos del siglo XVIII.\nHistoria\n\nLa judía habría sido traída de América y utilizada por Isabel de Farnesio (mujer de Felipe V) para alimentar los faisanes que cuidaba en los jardines de la Granja de San Ildefonso. </doc><doc>\nSu origen está asociado a la construcción del palacio de La Granja. La compra por parte de Felipe V de las edificaciones que en estos parajes tenían los Jerónimos, así como las nuevas construcciones realizadas por el monarca a partir de 1721 para acondicionar lo que sería su ‘sitio» de retiro veraniego, trajeron a este lugar a gentes que provenían de distintos lugares de Europa para participar en los trabajos. Parece que fueron los jardineros franceses los que introdujeron en este Real Sitio unas judías procedentes de Sudamérica, cuya principal característica era su tamaño, con el objeto de aclimatarlas y que sirvieran de base para la alimentación del ganado.\n\nPalacio Real de la Granja\n\nTambién se dice que El origen de estas leguminosas se centra en Sudamérica y Centroamérica desde hace más de dos mil años. En España y Europa se introdujeron durante la Edad Moderna con fines diferentes. Cuenta la tradición oral, que el cultivo del judión en La Granja data del siglo XVIII, cuando la reina Isabel de Farnesio, esposa de Felipe V y muy aficionada a los faisanes, trajo estas legumbres desde América del Sur (Uruguay) para el alimento de estas aves.\n\nLas huertas del palacio y posteriormente el espacio dedicado a vivero para los jardines, sirvieron de base para la siembra de un judión que se segaba en verde y era consumido como forraje por caballos y faisanes. </doc>",
            "response": "La receta de judiones de la Granja se originó como resultado de una combinación de factores históricos y culturales. Comenzó con la importación de judías de América por parte de la reina Isabel de Farnesio, esposa de Felipe V, quien estaba interesada en alimentar a los faisanes en su palacio real de La Granja. Estas judías, que se conocían como \"judiones de la Granja\", fueron plantadas en el Real Sitio de San Ildefonso, ubicado en la provincia de Segovia, Castilla y León, España, y se convirtieron en una base para la alimentación de los ganados.\n\nA medida que el palacio y los jardines del Real Sitio se desarrollaban, se comenzó a importar judías de otras partes del mundo, lo que resultó en la selección y el aclaramiento de las judías de la Granja. Esto hizo que las judías fueran de un color más claro y suaves, adoptando la característica blanca que tienen en la actualidad.\n\nLa receta de judiones de la Granja se popularizó en los restaurantes de La Granja de San Ildefonso, y se ha convertido en un plato típico en los restaurantes de la provincia de Segovia. La receta se basa en judiones de la Granja secos de calidad del mismo año y se cuecen con judiones de la Granja, judiones de la Granja cocidos, judiones de la Granja en Real Sitio de San Ildefonso, y otros ingredientes como carnes curadas y caldos. La cocción de las judías requiere paciencia y cuidado, ya que las judías deben estar tiernas antes de servirse.",
            "reference": "La receta de los judiones de La Granja tiene una historia interesante y se remonta a varios siglos atrás:\n\n    Orígenes de los Judiones en La Granja:\n        Los judiones fueron introducidos inicialmente en el Palacio Real de La Granja de San Ildefonso en el siglo XVIII. Originalmente, estas legumbres, traídas de América del Sur, se usaban como forraje para los animales, incluidos los faisanes que se criaban en los jardines del palacio​.\nIsabel de Farnesio, esposa de Felipe V, jugó un papel importante en la introducción de estas judías en La Granja para alimentar a los faisanes que cuidaba. Con el tiempo, los judiones, que inicialmente eran de color oscuro, se aclimataron y evolucionaron a un color blanco​.\n\nEvolución del Cultivo y la Receta:\n\n    La siembra y selección progresiva de estos judiones por parte de los sirvientes del palacio llevó a su aclimatación y cambio de color, pasando de morado negruzco a blanco. Originalmente utilizados como forraje, con el tiempo comenzaron a ser consumidos por humanos​.\nLa receta de los judiones estofados con chacinas, tal como se conoce hoy, fue introducida en la restauración de la zona por el cocinero segoviano Tomás Urrialde, aproximadamente en 1955. Desde entonces, se ha convertido en un plato típico en los restaurantes de La Granja de San Ildefonso y se ha extendido por toda la provincia de Segovia​.\n\nCelebración Cultural y Reconocimiento:\n\n    La popularidad de los judiones de La Granja ha llevado a la celebración de festividades en torno a este plato, como una fiesta conmemorativa que se realiza en La Granja cada 25 de agosto, día de San Luis​.\n\nEn resumen, los judiones de La Granja, originalmente traídos de América del Sur y usados como alimento para animales, se han transformado en un componente esencial de la gastronomía segoviana. Esta evolución se debe a la adaptación de las legumbres al clima local y a la innovación culinaria de cocineros locales como Tomás Urrialde. La receta ha ganado tal reconocimiento que se ha convertido en un símbolo de la cocina regional y es celebrada culturalmente."
        },
        {
            "user_input": "Buenas tardes, estoy interesada en saber cuál en el origen de la receta de los judiones de La Granja.",
            "retrieved_contexts": "<doc>\nLas judías eran de color oscuro y fueron aclarándose a lo largo de los siglos hasta poseer el blanco actual. En la actualidad el cultivo de esta legumbre se ha extendido a otras partes de Castilla. El día 15 de octubre de 1955, Tomás Urrialde ofreció por primera vez el plato de los judiones de La Granja, con la receta creada por él mismo, a la denominada Cofradía de los 12 Apóstoles. Suele realizarse una fiesta conmemorativa en La Granja en torno a los judiones el día 25 de agosto, día de San Luis.\nCultivo y características\n\nSe cultiva en un área cercana a Real Sitio de San Ildefonso (144,81 km²) en la sierra de Guadarrama. El tamaño de las judías es grande y tras una cocción prolongada en agua mantienen su textura intacta hasta ser introducidas bajo el paladar. Suele haber entre cuarenta y cincuenta granos en cada 100 gramos. Suelen ser de color blanco (blanco de España) o amarillento. La planta suele alcanzar un tamaño superior a los dos metros.\nUsos y preparación\n\nSe suele emplear en platos regionales de Segovia tales como estofados, cocidos, etc. en los que interviene carne en forma de embutido como puede ser chorizo, la mayoría de ellos cocinados en tradicionales ollas de barro. Es posible encontrar recetas con estas judías basadas en ave: una de las más populares es con perdiz. No tiene nada que ver el judión de La Granja con la faba de la Granja, que se utiliza para hacer la fabada asturiana.\n\nLos ingredientes para la elaboración de la receta tradicional1​2​ de este plato son: judiones de La Granja, oreja de cerdo, morcilla, chorizo de Cantimpalos, cebolla, laurel, ajo, aceite de oliva, sal y pimentón dulce. En algunos casos se utiliza manita de cerdo para darle más sabor y harina para espesar el caldo.\n\nPara la preparación de este plato, la legumbre debe de ponerse en remojo el día anterior. Posteriormente se cuecen con la oreja de cerdo, morcilla y chorizo. Al mismo tiempo, en una sartén se preparan los ajos, el aceite de oliva y el pimentón. Posteriormente se mezcla todo y se deja cocer durante largo tiempo. Esta receta conlleva una cocción muy lenta y larga hasta conseguir que la legumbre esté tierna y lista para comer.\nVéase también\n\n    Judiones de El Barco de Ávila\n    Gastronomía de la provincia de Segovia\n\nReferencias\n\n«Receta Judiones de La Granja». cocidocastellano.blogspot.com. </doc><doc>\nMotivo: aún no se han proporcionado motivos para el renombrado.\nDetalle del judión de La Granja\nJudiones de La Granja cocidos\nJudiones de la Granja en Real Sitio de San Ildefonso\n\nSe denomina judiones de La Granja a una variedad de judía de gran tamaño que se cultiva en el Real Sitio de San Ildefonso (provincia de Segovia, Castilla y León, España), la Phaseolus coccineus, también denominada Phaseolus multiflorus Willd., que se cree que fue traída de América y plantada en La Granja a comienzos del siglo XVIII.\nHistoria\n\nLa judía habría sido traída de América y utilizada por Isabel de Farnesio (mujer de Felipe V) para alimentar los faisanes que cuidaba en los jardines de la Granja de San Ildefonso. </doc><doc>\nEsos espacios posteriormente fueron parcelados, convertidos en huertas y entregados a los sirvientes de palacio con el objeto de compensar sus rentas y facilitar la producción de hortalizas de estación. En sus manos, la progresiva selección del judión, dio lugar a ese famoso proceso de «aclareamiento», pues estas legumbres primero fueron de un color morado negruzco, mas tarde morado claro con pintas negras, para pasar después a morado suave, hasta que, finalmente, adquirieron la característica albura que presentan en la actualidad.\n\nA partir del núcleo de San Ildefonso, donde actualmente encontramos la mayor concentración de huertos dedicados a este cultivo, la siembra del judión se ha extendido, por las vegas del Eresma y, secundariamente, por las del Pirón.\n\nPosteriormente alguien decidió probarlas y desde entonces se dedicaron también al consumo humano.\n\nEl judión de La Granja es en la actualidad la legumbre más importante de Segovia junto al garbanzo de Valseca. Se cultiva en pocas hectáreas llegando a alcanzar altas cotizaciones.\nVer también\nReceta de Pechuga de pollo en escabeche de manzanilla\nRecetas de Cocina\nPechuga de pollo en escabeche de manzanilla\nElaboración tradicional de los Judiones de la Granja.\n\nJudiones de la Granja, por jlastras\n\nJudiones de la Granja\nEsta receta tiene todo lo necesario para ser plato único. </doc><doc>\nLas plantas se aclimataron a las laderas de la sierra del Guadarrama y con el tiempo estas judías de enorme tamaño fueron seleccionándose -desde su color oscuro inicial al color blanco actual, entre otras características- para acabar siendo consumidas también por los humanos (por aquí ya lo usamos en este salteado de judiones con berberechos).\n\nLos judiones estofados con chacinas los introdujo en la restauración de la zona el cocinero segoviano Tomás Urrialde, dicen que sobre 1955, convirtiéndose a partir de entonces en un plato tipiquísimo en los restaurantes de La Granja de San Ildefonso y extendiéndose por toda la provincia. ¿Qué hace falta para elaborar unos judiones de La Granja de aúpa? Es obvio que necesitas unos judiones de La Granja secos de calidad, del mismo año y no del pleistoceno, y ya sabes, debes empezar la elaboración el día anterior puesto que necesitan remojo. Acompáñalos de buenas carnes curadas y cuece al chup chup, con paciencia y mimo, las horas que haga falta y podrás reconfortarte como es debido después de una buena caminata por la sierra. La receta en la que me baso procede del Asador Duque, local de mucha solera en la capital segoviana.</doc><doc>\nSu origen está asociado a la construcción del palacio de La Granja. La compra por parte de Felipe V de las edificaciones que en estos parajes tenían los Jerónimos, así como las nuevas construcciones realizadas por el monarca a partir de 1721 para acondicionar lo que sería su ‘sitio» de retiro veraniego, trajeron a este lugar a gentes que provenían de distintos lugares de Europa para participar en los trabajos. Parece que fueron los jardineros franceses los que introdujeron en este Real Sitio unas judías procedentes de Sudamérica, cuya principal característica era su tamaño, con el objeto de aclimatarlas y que sirvieran de base para la alimentación del ganado.\n\nPalacio Real de la Granja\n\nTambién se dice que El origen de estas leguminosas se centra en Sudamérica y Centroamérica desde hace más de dos mil años. En España y Europa se introdujeron durante la Edad Moderna con fines diferentes. Cuenta la tradición oral, que el cultivo del judión en La Granja data del siglo XVIII, cuando la reina Isabel de Farnesio, esposa de Felipe V y muy aficionada a los faisanes, trajo estas legumbres desde América del Sur (Uruguay) para el alimento de estas aves.\n\nLas huertas del palacio y posteriormente el espacio dedicado a vivero para los jardines, sirvieron de base para la siembra de un judión que se segaba en verde y era consumido como forraje por caballos y faisanes. </doc>",
            "response": "La receta de los judiones de La Granja se originó en la provincia de Segovia, en España, específicamente en la zona de San Ildefonso. Este plato se conoce como Phaseolus coccineus, también conocido como Phaseolus multiflorus Willd. Originalmente, la legumbre se cultivaba en pequeñas cantidades en el Real Sitio de San Ildefonso, pero con el tiempo se ha extendido a otras áreas de la provincia, como la sierra de Guadarrama. La judía de La Granja se aclimata bien en las laderas de la sierra y se cosecha principalmente en el mes de octubre, aunque también se cultiva en otros meses según la época del año.\n\nEn cuanto a la receta, se preparan los judiones de La Granja secos de calidad del mismo año y se cuecen con carnes curadas. Se suele servir el plato acompañado de una salsa de manzana y pimentón, aunque también se pueden añadir otros condimentos según la preferencia personal. La preparación de los judiones de La Granja puede llevar mucho tiempo, ya que se requiere una cocción prolongada en agua para suavizarlas y obtener la textura deseada.\n\nEn resumen, la receta de los judiones de La Granja se basa en la siembra de judiones de gran tamaño en las laderas de la sierra de Guadarrama, su aclimatación y consumo. Además, se pueden añadir otros condimentos y salsas según la preferencia personal.",
            "reference": "La receta de los judiones de La Granja tiene una historia interesante y se remonta a varios siglos atrás:\n\n    Orígenes de los Judiones en La Granja:\n        Los judiones fueron introducidos inicialmente en el Palacio Real de La Granja de San Ildefonso en el siglo XVIII. Originalmente, estas legumbres, traídas de América del Sur, se usaban como forraje para los animales, incluidos los faisanes que se criaban en los jardines del palacio​.\nIsabel de Farnesio, esposa de Felipe V, jugó un papel importante en la introducción de estas judías en La Granja para alimentar a los faisanes que cuidaba. Con el tiempo, los judiones, que inicialmente eran de color oscuro, se aclimataron y evolucionaron a un color blanco​.\n\nEvolución del Cultivo y la Receta:\n\n    La siembra y selección progresiva de estos judiones por parte de los sirvientes del palacio llevó a su aclimatación y cambio de color, pasando de morado negruzco a blanco. Originalmente utilizados como forraje, con el tiempo comenzaron a ser consumidos por humanos​.\nLa receta de los judiones estofados con chacinas, tal como se conoce hoy, fue introducida en la restauración de la zona por el cocinero segoviano Tomás Urrialde, aproximadamente en 1955. Desde entonces, se ha convertido en un plato típico en los restaurantes de La Granja de San Ildefonso y se ha extendido por toda la provincia de Segovia​.\n\nCelebración Cultural y Reconocimiento:\n\n    La popularidad de los judiones de La Granja ha llevado a la celebración de festividades en torno a este plato, como una fiesta conmemorativa que se realiza en La Granja cada 25 de agosto, día de San Luis​.\n\nEn resumen, los judiones de La Granja, originalmente traídos de América del Sur y usados como alimento para animales, se han transformado en un componente esencial de la gastronomía segoviana. Esta evolución se debe a la adaptación de las legumbres al clima local y a la innovación culinaria de cocineros locales como Tomás Urrialde. La receta ha ganado tal reconocimiento que se ha convertido en un símbolo de la cocina regional y es celebrada culturalmente."
        },
        {
            "user_input": "¿Podrías explicarme cuál es el origen de la receta de judiones de la Granja?",
