user_input,retrieved_contexts,response,reference,answer_relevancy,context_precision,faithfulness,context_recall
¿Cuál es la forma más fácil de reclamar cuando un vuelo que sale de España se ha retrasado?,"['País del aeropuerto de salida\n    País del aeropuerto de llegada\n    Sede de la compañía aérea\n\nEn España la competencia de los tribunales se determina por las siguientes reglas:\n\n    El domicilio social de la compañía aérea\n    El lugar donde el contrato de transporte fue celebrado o donde la compañía aérea prestó efectivamente o debía haber prestado su servicio, siempre y cuando la compañía aérea tenga en dicha localidad un establecimiento permanente abierto al público ( reconociendo como tal por la jurisprudencia el mostrador de atención al cliente del aeropuerto)\n    Lugar de salida o de llegada del vuelo\n    Domicilio del pasajero, únicamente si la reclamación se hace por el propio pasajero\n\nEl siguiente cuadro ofrece una visión general de los plazos de prescripción en una muestra de países europeos:\n\nPaís Plazos de prescripción\nSuecia 10 años\nReino Unido 6 años\nFrancia 5 años\nEspaña 5 años\nAlemania 3 años\nAustria 3 años\nRumania 3 años\nItalia 2 años\nBélgica 1 año\n\nAsí pues, para muchos pasajeros todavía hay tiempo suficiente para hacer su reclamación. No es necesario entrar en pánico en el aeropuerto ni dejar que el estrés afecte a tu viaje. A pesar de ello, siempre es una buena idea presentar tu reclamación lo antes posible para asegurarte de que no se te olvidan los detalles del caso ni se extravían los documentos. Reúne todas las pruebas que pueda, y así aumentarás las probabilidades de que tu reclamación contra la compañía aérea tenga éxito.\nRetraso del vuelo: Lista de comprobación para reclamar\n\nLista de comprobación: Información y documentos importantes en caso de denegación de embarque\n\n    Tarjeta de embarque con el número de vuelo\n    Confirmación de reserva\n    Billetes de transportación alternativa\n    Vouchers\n    Documentación de costes adicionales\n    Fotografías con sello de fecha o de la pantalla del embarque\n    Si es possible, confirmación por escrito/o declaraciones de la línea aérea de los motivos de retraso del vuelo\n\nMYFLYRIGHT te ayudará encantado en cualquier caso, incluso mucho tiempo después de la emisión del vuelo y sin mucha burocracia, para hacer valer tus derechos de pasajero.\nCompensación por retraso de vuelo: Paquete y viaje de negocios\n\nCuando viajas hacia esas esperadas vacaciones o la conferencia de tu carrera y el vuelo se retrasa, nunca es un buen comienzo. Además, los retrasos pueden hacer que se pierda por completo encuentros familiares, reuniones importantes o actividades reservadas con antelación.\n\nAunque el dinero no compensa totalmente las molestias causadas por un retraso de vuelo, al menos siempre puedes reclamar la indemnización que te corresponde. Incluso en el caso de los viajes combinados y los viajes de negocios, tienes los mismos derechos como pasajero que los viajeros individuales.\nCompensación de la UE por retraso de un vuelo durante un viaje combinado\n\nSi tu vuelo se retrasa durante un viaje combinado, puedes reclamar tanto a tu operador turístico como a la compañía aérea. El factor clave es el tiempo de retraso en el aeropuerto de destino:\n\n    Los pasajeros tienen derecho a una indemnización de la aerolínea con un retraso del vuelo en el destino de más de 3 horas.\n    Con un retraso del vuelo de más de 4 horas en el destino, los pasajeros tienen derecho no sólo a una indemnización de la compañía aérea, sino también a una reducción del precio del paquete por parte del operador turístico.\n\nHay que recordar que para poder reclamar, el retraso no debe haber sido causado por circunstancias extraordinarias.\nReclamación por retraso de vuelo: viajes de negocios\n\nUn retraso en un vuelo durante un viaje de negocios puede tener graves consecuencias. Perder reuniones, perder clientes o llegar tarde a una presentación clave son cosas que perjudican a tu empresa.', '2. ¿Cuáles son los derechos que tienes cuando se retraso un vuelo y las compensaciones que puedes reclamar?\n\nAdemás de lo expuesto referente a la normativa europea CE 261, también existen otros derechos de los pasajeros que debes conocer. Los pasajeros no solo tienen derecho a realizar una reclamación por retraso de vuelo y posiblemente recibir una indemnización. Los otros derechos que los pasajeros tienen son los siguientes:\n\nDerecho a reembolso o vuelo alternativo: además de la indemnización por retraso de vuelo fijada por CE 261, si tu retraso es superior a 5 horas tienes derecho a un reembolso total o parcial de tu billete original y a un vuelo de vuelta a tu lugar de origen en caso necesario.\n\nDerecho a asistencia: se refiere a comidas y refrescos durante el retraso, acceso a comunicaciones como 2 llamadas de teléfono, mensajes de fax e e-mail. Además, si es necesario pasar la noche deberán ofrecerte una habitación de hotel y el desplazamiento tanto de ida como de vuelta al aeropuerto. Tienes derecho a asistencia con 2 horas o más de retraso para todos los vuelos de 1.500 km o menos; con 3 horas o más para vuelos dentro de la UE de más de 1.500 km, así como vuelos fuera de la UE de entre 1.500 y 3.500 km; y con 4 horas de retraso o más para vuelos dentro de la UE de más de 3.500 km.\n\n    Aumento o reducción de prestaciones: Si la aerolínea te ofrece un vuelo alternativo y te colocan en una clase superior al que tenías no podrán cargarte ningún pago adicional por ello. Por el contrario, si la clase del vuelo alternativo es inferior, puedes obtener un reembolso de entre el 30% y el 75% del precio que abonaste. \n\n3. ¿Como reclamar el retraso de los vuelos?\n\nAhora viene la parte que puedes considerar ‘más complicada’, pero que no tiene por qué asustarte, ya que precisamente desde AirHelp trabajamos para facilitarte el trabajo y poder ayudarte a como reclamar el retraso de tu vuelo en caso de que tu caso cumpla con los requisitos. Primero te explicaremos todo lo que necesitarías para presentar una reclamación por vuelos retrasados, incluso para reclamaciones con Iberia. En el caso en que decidieras hacerlo tú mismo, y después te mostraremos cómo nuestra ayuda puede evitarte perder un tiempo precioso en papeleo y negociaciones con las compañías, porque lo podemos hacer por ti. Siempre estamos disponibles para ayudar a que recibas la indemnización que se te debe cuando reclamas el retraso de vuelo.\nReclamaciones por retrasos de vuelos en la UE\n\nSi vas a presentar una reclamación por un retraso de vuelo para recibir una indemnización acogiéndote a la normativa europea CE 261 tienes que seguir los siguientes pasos:\n\nConserva tu tarjeta de embarque y cualquier otro documento: es válido también cualquier documento que contenga el código de confirmación de la reserva. Esto es importante para realizar reclamaciones por retrasos de vuelos.\n\nPide información del retraso al personal de tierra: cuanto más específica sea la razón mejor, porque será importante para presentar la reclamación de retraso. Tenlo en cuenta también para reclamaciones a Tap Air Portugal.\n\nAnotaciones y fotografías: incluye en tus anotaciones la hora de llegada al destino final (recuerda que no es cuando aterriza el avión, sino cuando se encuentra en la puerta de embarque y se abren las puertas), y fotos como la pantalla de salidas del aeropuerto.\n\nPide a la aerolínea que te cubra las dietas: en el caso en que tengas que esperar dependiendo del tiempo de retraso y de la duración del vuelo. Es lo que te hemos explicado antes como derecho a la asistencia.\n\nNo firmes ni aceptes ofertas que puedan mermar tus derechos: como por ejemplo futuros vales de viajes u otras gratificaciones porque puedes estar renunciando al derecho sobre cualquier tipo de compensación adicional. Al aceptar estos acuerdos, puedes perder los derechos que tienes para reclamar el retraso del vuelo y recibir tu indemnización.', 'Indemnización retraso vuelo\n\nNavegación por el Retraso en el vuelo\n\n    La indemnización por retraso de vuelo y los derechos en breve\n    ¿Tu vuelo se ha retrasado? Condiciones de indemnización\n    Indemnización por retraso de vuelo: Derechos de los pasajeros de la UE\n    Indemnización por retraso de vuelo: Paquete y viaje de negocios\n    Retraso del vuelo: Cómo reclamar una indemnización\n    Estado de los vuelos: Estadísticas de la UE sobre retrasos\n\nIndemnizaciones y derechos en caso de retraso de un vuelo\n\nLos retrasos de los vuelos, tanto si te vas de vacaciones como si viajas por negocios, no sólo son un inconveniente sino que son extremadamente estresantes. Puede resultar confuso para los pasajeros saber qué hacer en esta situación, que por desgracia se está convirtiendo en un problema cada vez más común en los viajes aéreos.\n\nLa buena noticia es que tienes varias opciones cuando tu vuelo se retrasa, pero la cuantía de la indemnización que puedes recibir depende de varios factores. Cuando tu vuelo llega al aeropuerto de destino con un retraso de más de 3 horas, tienes derecho a 250 euros, 400 euros o 600 euros, dependiendo de la distancia del vuelo. Con un retraso de más de 5 horas, puedes reclamar una indemnización por el precio del billete si ya no quieres coger el vuelo. La aerolínea debe ofrecerte servicios que incluyen comidas, refrescos y alojamiento gratuitos, según la duración del retraso.\n\nSólo el 65% de los vuelos con un retraso de más de 3 horas en la UE tienen derecho a una indemnización por parte de la compañía aérea. La procedencia o no de una reclamación depende de si la compañía aérea podía haber evitado el retraso del vuelo o si este se debió a circunstancias extraordinarias. Cuando el motivo del retraso del vuelo se considera una circunstancia extraordinaria -por ejemplo, la caída de un rayo-, la compañía aérea no puede ser considerada responsable del retraso.\n\nEl 80% de los pasajeros desconocen sus derechos en caso de retraso de los vuelos. Sólo una parte -aproximadamente el 5% de los afectados - consigue hacer valer sus reclamaciones por su cuenta, ya que las compañías aéreas suelen aprovecharse de la ingenuidad de los pasajeros para no indemnizarlos.\n\nMYFLYRIGHT, expertos en derechos de los viajeros, pretenden poner fin a esta práctica injusta. Con MYFLYRIGHT, comprobar si puedes reclamar una indemnización por el retraso de tu vuelo es gratis. Si decides utilizar el servicio, MYFLYRIGHT tramitará tu reclamación contra la compañía aérea sin ningún riesgo financiero. Sólo en caso de éxito se aplica una comisión del 25% más IVA, ahorrándote tiempo, esfuerzo y estrés. Si tenemos que contratar a nuestros abogados externos, cobramos un recargo del 10%. En algunos casos, se ofrece un pago inmediato, en el que la indemnización se abona en las 24 horas siguientes a la recepción de todos los documentos pertinentes. En este caso, se aplica una comisión del 35% más IVA.\n\n¿Tu vuelo se ha retrasado? Condiciones de indemnización\n\nTras sufrir las molestias de un retraso de vuelo, los pasajeros pueden tener derecho a una indemnización.\n\nEl importe de la indemnización depende de dos factores: la distancia del vuelo y el número de horas de retraso. Hay que tener en cuenta que para recibir la indemnización, el vuelo debe tener un retraso superior a 3 horas.\n\nEste pago se suma a los servicios que la compañía aérea está obligada a ofrecer en determinados casos. Las compañías aéreas deben ofrecer servicios adicionales a partir de los retrasos de más de 2 horas, y con un retraso de más de 5 horas también se puede recibir el reembolso completo del billete']","Para reclamar un retraso de vuelo en España, sigue estos pasos:

1. Conserva tu tarjeta de embarque y cualquier otro documento que contenga el código de confirmación de la reserva. Estos son importantes para presentar la reclamación.

2. Pide información al personal de tierra. La aerolínea debe informarte sobre el retraso y los servicios adicionales que están obligados a ofrecer en caso de retraso.

3. Anota y toma fotos del retraso. Esto te ayudará a presentar una mejor reclamación.

4. Solicita a la aerolínea que te cubra las dietas. Si tienes que esperar, especialmente si es un vuelo largo, esto puede ayudar a aliviar el estrés.

5. No firmes ni aceptes ofertas que puedan mermar tus derechos. Al aceptar estas ofertas, puedes perder los derechos que tienes para reclamar el retraso de vuelo y recibir tu indemnización.

Recuerda que la indemnización por retraso de vuelo y los derechos en breve están regulados por la normativa europea CE 261. Sin embargo, en la UE, la mayoría de los vuelos con un retraso de más de 3 horas tienen derecho a una indemnización por parte de la compañía aérea. La procedencia o no de una reclamación depende de si la compañía aérea pudo haber evitado el retraso del vuelo o si este se debió a circunstancias extraordinarias. Cuando el motivo del retraso del vuelo se considera una circunstancia extraordinaria, la compañía aérea no puede ser considerada responsable del retraso.

Si decides utilizar el servicio de MYFLYRIGHT, que proporciona comprobación gratuita de la posibilidad de reclamar una indemnización por el retraso de tu vuelo, tendrás que pagar una comisión del 25% más IVA. Si tu reclamación es exitosa, la comisión será del 25% más IVA. Si necesitas contratar a abogados externos, la comisión será del 10%. En algunos casos, se ofrece un pago inmediato, en el que la indemnización se pagará en las 24 horas siguientes a la recepción de todos los documentos pertinentes. En este caso, se aplicará una comisión del 35% más IVA.","La opción más fácil y eficaz para reclamar una indemnización por retraso de vuelo en Europa es utilizar los servicios de compañías especializadas en reclamaciones de derechos de pasajeros. Estas compañías ofrecen un proceso simplificado y asistencia profesional, eliminando la necesidad de que el pasajero se involucre en trámites complicados y negociaciones con las aerolíneas. Aquí te presento algunas opciones recomendadas:

    AirHelp: Esta empresa ha ayudado a más de 16 millones de pasajeros y opera en 30 países. Ofrecen un proceso sencillo donde solo necesitas introducir los detalles de tu vuelo en su calculadora online para comprobar si tienes derecho a compensación. Si es así, gestionarán todo el proceso de reclamación, incluyendo negociaciones con las aerolíneas, y te enviarán la compensación directamente. Solo cobran una comisión si la reclamación es exitosa​​.

Reclamador: Es una página española con una interfaz intuitiva y fácil de usar. Solo necesitas introducir algunos datos de tu vuelo, y ellos se encargarán de todo el proceso de reclamación. Al igual que AirHelp, solo cobran una comisión si la reclamación resulta exitosa​.

Refund.me: Esta empresa opera a nivel mundial y ofrece un proceso de reclamación eficiente y rápido a través de procesos automatizados. Aunque su trato puede ser menos personalizado, también solo cobran una comisión si la reclamación es exitosa​.

FlightRight: Opera casi en todo el mundo y ofrece un trato personalizado. Calculan la indemnización para que tengas una idea de lo que te corresponde y envían el dinero de la indemnización de manera inmediata, aunque tienen una comisión más alta​.

Populetic: No solo se enfocan en vuelos retrasados o cancelados, sino también en problemas relacionados con overbooking, equipaje y otros aspectos del viaje​.

MYFLYRIGHT: Ofrecen un servicio gratuito para comprobar si puedes reclamar una indemnización. Si decides utilizar su servicio, tramitarán tu reclamación sin riesgo financiero y solo aplicarán una comisión en caso de éxito. Además, ofrecen la opción de un pago inmediato con una comisión más alta​.

Estas compañías te ahorran tiempo y esfuerzo al manejar todas las comunicaciones y negociaciones necesarias, aumentando las posibilidades de una resolución exitosa de tu reclamación.",0.9493019858254422,0.9999999999666667,1.0,1.0
"hola mi vuelo a Alemania se ha retrasado mucho y me gustaría que me dieran una indemnización pero sin complicaciones, cómo reclamo?","['Hay que recordar que para poder reclamar, el retraso no debe haber sido causado por circunstancias extraordinarias.\nReclamación por retraso de vuelo: viajes de negocios\n\nUn retraso en un vuelo durante un viaje de negocios puede tener graves consecuencias. Perder reuniones, perder clientes o llegar tarde a una presentación clave son cosas que perjudican a tu empresa.\n\nPero cuando se viaja por negocios, ¿quién recibe la indemnización: tú o tu empresa?\n\nLa indemnización se paga siempre al viajero. Se proporciona para compensar las molestias sufridas por el pasajero, por lo que es irrelevante quién hizo la reserva. Sin embargo, algunas empresas incluyen una cláusula en el contrato de trabajo que establece que son ellas las que tienen derecho a esta indemnización y no el empleado; si tu contrato de trabajo tiene esta cláusula, lamentablemente no recibirías la indemnización.\nRetraso del vuelo: Cómo reclamar la indemnización\n\nTienes varias opciones a la hora de reclamar a la compañía aérea. O bien opta por hacer la reclamación por tu cuenta o bien delega la tarea en otra persona. Si optas por lo primero, es más que probable que tengas que buscar ayuda legal, ya que la compañía aérea podrá argumentar hábilmente contra tu reclamación con ayuda de su equipo jurídico. Si optas por hacer valer su reclamación de forma independiente, te ahorrarás la comisión aplicada por MYFLYRIGHT en caso de éxito, pero te costará mucho más tiempo y nervios.\n\nTeniendo en cuenta el tiempo que se tarda en reunir todos los documentos necesarios, que puede ser de varias horas, así como lo estresante que es tratar con las compañías aéreas, puede merecer la pena hacer su reclamación con MYFLYRIGHT en su lugar. Según nuestra experiencia, alrededor del 50% de los casos que recibimos son resueltos por los tribunales, un largo proceso que puede evitarse utilizando los servicios de MYFLYRIGHT.\n\nReclamar de forma independiente es un proceso arriesgado, ya que las compañías aéreas no suelen revelar toda la información relativa a un retraso. Un ejemplo de ello es cuando presentas una reclamación contra la aerolínea por cuestiones técnicas, mientras que el retraso fue causado por un impacto de ave, en cuyo caso la aerolínea no tiene que pagar la indemnización. Cuando esto se conoce, ya has gastado una cantidad considerable de tiempo, esfuerzo y dinero.\n\nSin embargo, en caso de llevar a cabo tu reclamación a través de MYFLYRIGHT, no hay que preocuparse por los costes, ya que la comisión sólo se cobra cuando hay un resultado satisfactorio. La siguiente tabla muestra los costes de un caso en Alemania en el que dos personas reclaman una indemnización por valor de 400 euros cada una:\nCantiadad a reembolsar/cuantía de demanda 800.00 €\nAcuerdo No hay\nPrimera Instancia\nTasas judiciales: 159.00 €\nAbogado(demandante): 261.80 €\nAbogado(demandado): 261.80 €\nTotal (riesgo de costas): 682.60 €\n\nComo puede ser muy costoso reclamar por su cuenta a la compañía aérea, muchos pasajeros renuncian a esta opción. Las compañías aéreas tienen experiencia en la tramitación de múltiples reclamaciones y son expertas en eludir el pago de indemnizaciones. Para evitar el riesgo financiero, así como la naturaleza lenta y estresante del proceso, puedes encomendar tu caso a MYFLYRIGHT. Somos expertos en los derechos de los pasajeros y podemos ayudarte a obtener la indemnización que te corresponde. Si, por el contrario, quieres hacer la reclamación por tu cuenta, los siguientes consejos y el modelo de carta te serán de utilidad.\nModelo de carta de indemnización por retraso en el vuelo\n\nA la hora de hacer valer tus derechos de pasajero frente a la aerolínea de forma independiente, hay varios puntos para tener en cuenta y pasos a seguir.', 'A la hora de hacer valer tus derechos de pasajero frente a la aerolínea de forma independiente, hay varios puntos para tener en cuenta y pasos a seguir.\n\nPaso 1. Escribe una carta. Puedes escribir tu propia carta o utilizar nuestra plantilla de carta. Si optas por nuestra plantilla, puedes rellenarla en línea y enviarla por correo electrónico directamente a la compañía aérea o imprimirla, rellenarla y enviarla por correo. Si optas por enviar tu carta por correo, asegúrate de optar por el correo certificado para saber cuándo la recibe la compañía aérea, ya que puede ser una prueba importante en el tribunal.\n\nDebes incluir la siguiente información en tu carta o correo electrónico:\nDireccion de la atención al cliente de aerolínea Fecha de salida\nHora de salida programada Ruta del vuelo\nNúmero de vuelo Aeropuerto de salida\nHora de llegada programada Importe de compensación\nNúmero de reserva Aeropuerto de conexión (si hay)\nHora de llegada real Costes adicionales (con prueba)\nIrregularidad ocurrida Aeropuerto de llegada\nDistancia del vuelo en km Información del numero de cuenta bancaria\n\nEs una buena idea fijar un plazo límite en que se debe resolver tu reclamación. El plazo estándar es de 2 a 3 semanas. Si no has recibido respuesta de la compañía aérea en ese plazo, pasa al paso 2.\n\nPaso 2. Ahora puedes solicitar la ayuda de los servicios jurídicos o dar a la compañía aérea otra oportunidad de responder enviando una segunda carta. Una vez más, fija un plazo de 2 a 3 semanas a partir de tu envío y recuerda utilizar el correo certificado si decides enviar tu carta.\n\nIMPORTANTE: Si en cualquier momento la derolínea rechaza tu reclamación de compensación, puedes iniciar las acciones legales de inmediato y no tienes que esperar a que se acabe el plazo. No permitas que los argumentos de aerolínea te desanimen. Antes de rendirte, recuerda siempre que todavía puedes hacer valer tu reclamación a través de MYFLYRIGHT.\n\nPaso 3. Si tu segunda carta no es seguida de una respuesta de la aerolínea, es el momento de llevar tu caso a los tribunales. Las aerolíneas están obligadas a responder a una demanda, por lo que no podrán evitar tu reclamación por más tiempo. Ten en cuenta todos los costes que conlleva antes de recurrir a los servicios jurídicos. Por ejemplo, en Alemania, si tu caso es rechazado en los tribunales, deberás pagar todas las tasas legales y judiciales.\n\nPuedes evitar este frustrante y costoso procedimiento eligiendo MYFLYRIGHT, donde podrás hacer tu reclamación sin ningún riesgo de coste.\nEstado del vuelo: Estadísticas de la UE sobre retrasos\n\nLos retrasos de los vuelos se producen por una gran variedad de razones, muchas de las cuales no son responsabilidad de las compañías aéreas; al fin y al cabo, los procedimientos judiciales son costosos y requieren mucho tiempo para ambas partes. A pesar de ello, muchos vuelos sufren retrasos a diario y esto se ha convertido en un trastorno habitual para los pasajeros aéreos de todo el mundo.\nRetrasos en los vuelos: Estadísticas de los aeropuertos alemanes', 'Conoce las compensaciones cuando se retrasa tu vuelo\n\nLlegas al aeropuerto y tu vuelo va con retraso, ¿conoces cuáles son tus derechos y si puedes pedir reclamar una compensación? Desde AirHelp te ayudamos con los trámites para que tu viaje no se convierta en una pesadilla y puedas conocer todos los casos en los que puedes hacer una reclamación y el plazo para realizar los reclamos. ¡Te ayudaremos a reclamar tu indemnización por si tu vuelo se retrasa!\n\nDesplazarse en avión es para muchas personas un trámite casi diario por cuestiones profesionales, y para muchas otras el comienzo o final de sus esperadas vacaciones. Sea cual sea el motivo, volar debería ser una buena experiencia placentera para todos los pasajeros en cualquier parte del mundo, pero en algunas ocasiones no todo sale como esperábamos y surgen imprevistos como puede ser el retraso de un vuelo. Ante dicha circunstancia, ¿conoces los derechos que tienes como pasajero si tu vuelo se ha retrasado?, ¿sabes en qué casos podrías reclamar el retraso del vuelo para recibir una compensación económica o de otra índole?, y ¿sabes cuáles son los pasos a seguir para realizar la reclamación para conseguir la indemnización por el retraso del vuelo? Nosotros te ayudamos para que sepas como reclamar cualquier retraso de vuelo que cumpla con los requisitos.\n\nEn AirHelp queremos ayudarte no solo a que los conozcas con detalle, también podemos realizar todos los trámites por ti en caso de que te corresponda una indemnización por retraso de vuelo. Así que vamos a ver, paso a paso, qué es lo que debes hacer para reclamar si tu vuelo se ha retrasado.\n1. ¿Qué indemnizaciones tienes derecho por el retraso de tu vuelo?\n\nEn primer lugar, dependiendo de donde te encuentres y a dónde te dirijas, tus derechos como pasajero aéreo en los casos de vuelos con retraso serán diferentes, ya que se aplican distintas normativas. No siempre vas a poder reclamar cuando el vuelo no salga a horario, pero a continuación vamos a cubrir las instancias donde tienes derecho a reclamar una indemnización por retraso de vuelo, ya sea un vuelo internacional o nacional.\nVuelos dentro de la UE\n\nLa ley europea relacionada con los derechos de los pasajeros aéreos se conoce como Reglamento (CE) Nº 261/2004 del Parlamento Europeo y del Consejo del 11 de febrero de 2004. A partir de ahora nos referiremos a ella como CE 261, y nos centraremos en las compensaciones que los pasajeros pueden reclamar en casos de que sus vuelos tengan retrasos. Incluye no sólo el espacio aéreo de la UE, sino también Islandia, Noruega, Suiza y la llamada «región ultraperiférica» (La Guayana francesa y Martinica, Mayotte, Guadalupe y La Reunión, San Martín, Madeira y Azores y las Islas Canarias).\n\n¿Qué vuelos están cubiertos para poder reclamar?: Todos aquellos en los que vueles dentro de la UE tanto si la aerolínea es europea como si no lo es. Además, también están cubiertos los vuelos que partan de la UE hacia un lugar fuera de la UE, sin importar la procedencia de la aerolínea. Ahora bien, si vuelas desde un aeropuerto de fuera de la UE hacia ella solo está cubierto el retraso en caso de que la aerolínea sea europea. Por último, si vuelas desde fuera de la UE directamente a un lugar que no sea europeo no estaría cubierto en ningún caso. Como se puede observar, hay varias circunstancias donde los pasajeros podrán recibir una indemnización por retraso de vuelo internacional.']","Para reclamar una indemnización por retraso de vuelo en Alemania, debes seguir los siguientes pasos:

1. Determina si tu vuelo está cubierto: Verifica si tu vuelo está cubierto para reclamar una indemnización por retraso de vuelo en Alemania. Esto se aplica a todos los vuelos internacionales que partan de la UE, incluidos los que partan de aeropuertos de fuera de la UE hacia un lugar dentro de la UE. Si tu vuelo parte de un aeropuerto de fuera de la UE hacia un lugar dentro de la UE, el retraso estará cubierto.

2. Revisa tu itinerario: Asegúrate de tener un itinerario completo de tu viaje, incluyendo el vuelo con retraso. Esto te ayudará a determinar cuánto tiempo has perdido y cuánto tiempo has perdido en total.

3. Comprueba el número de reserva: Verifica el número de reserva de tu vuelo con retraso. Esto te ayudará a determinar cuánto tiempo has perdido en total.

4. Comprueba los costes adicionales: Si tu vuelo se retrasó y hubo costes adicionales, como gastos de hotel o transporte, verifica estos costes adicionales en tu itinerario.

5. Reúne la documentación: Reúne toda la documentación relevante, como tu itinerario, factura de vuelo con retraso, y cualquier otro documento que pueda ayudar a apoyar tu reclamación.

6. Contacta a la aerolínea: Contacta a la aerolínea que operó tu vuelo con retraso. Pide hablar con un representante de servicio al cliente y explícale tu situación. Asegúrate de tener una copia de tu itinerario y cualquier otro documento relevante.

7. Solicita una compensación: Pide una compensación por el retraso de tu vuelo. La compensación se basa en el tiempo que has perdido y los costes adicionales que hayas sufrido. La compensación puede incluir una reducción en el precio del próximo vuelo, una compensación económica o una combinación de ambas.

8. Considera presentar una reclamación: Si la aerolínea no acepta tu reclamación o si no estás satisfecho con la compensación que te ofrezcan, considera presentar una reclamación. Esto puede incluir presentar una demanda ante un tribunal o una entidad reguladora.

Recuerda que es importante que sigas estos pasos cuidadosamente y que tengas una copia de tu itinerario y cualquier otro documento relevante. También es recomendable contar con la asesoría de un abogado especializado en derecho de pasajeros aéreos o un representante de servicio al cliente de la aerolínea.","La opción más fácil y eficaz para reclamar una indemnización por retraso de vuelo en Europa es utilizar los servicios de compañías especializadas en reclamaciones de derechos de pasajeros. Estas compañías ofrecen un proceso simplificado y asistencia profesional, eliminando la necesidad de que el pasajero se involucre en trámites complicados y negociaciones con las aerolíneas. Aquí te presento algunas opciones recomendadas:

    AirHelp: Esta empresa ha ayudado a más de 16 millones de pasajeros y opera en 30 países. Ofrecen un proceso sencillo donde solo necesitas introducir los detalles de tu vuelo en su calculadora online para comprobar si tienes derecho a compensación. Si es así, gestionarán todo el proceso de reclamación, incluyendo negociaciones con las aerolíneas, y te enviarán la compensación directamente. Solo cobran una comisión si la reclamación es exitosa​​.

Reclamador: Es una página española con una interfaz intuitiva y fácil de usar. Solo necesitas introducir algunos datos de tu vuelo, y ellos se encargarán de todo el proceso de reclamación. Al igual que AirHelp, solo cobran una comisión si la reclamación resulta exitosa​.

Refund.me: Esta empresa opera a nivel mundial y ofrece un proceso de reclamación eficiente y rápido a través de procesos automatizados. Aunque su trato puede ser menos personalizado, también solo cobran una comisión si la reclamación es exitosa​.

FlightRight: Opera casi en todo el mundo y ofrece un trato personalizado. Calculan la indemnización para que tengas una idea de lo que te corresponde y envían el dinero de la indemnización de manera inmediata, aunque tienen una comisión más alta​.

Populetic: No solo se enfocan en vuelos retrasados o cancelados, sino también en problemas relacionados con overbooking, equipaje y otros aspectos del viaje​.

MYFLYRIGHT: Ofrecen un servicio gratuito para comprobar si puedes reclamar una indemnización. Si decides utilizar su servicio, tramitarán tu reclamación sin riesgo financiero y solo aplicarán una comisión en caso de éxito. Además, ofrecen la opción de un pago inmediato con una comisión más alta​.

Estas compañías te ahorran tiempo y esfuerzo al manejar todas las comunicaciones y negociaciones necesarias, aumentando las posibilidades de una resolución exitosa de tu reclamación.",0.9076529125770444,0.9999999999666667,,1.0
cómo puedo poner una reclamación para que me den la indemnización si mi vuelo ha salido con retraso (viajo a Florencia),"['Hay que recordar que para poder reclamar, el retraso no debe haber sido causado por circunstancias extraordinarias.\nReclamación por retraso de vuelo: viajes de negocios\n\nUn retraso en un vuelo durante un viaje de negocios puede tener graves consecuencias. Perder reuniones, perder clientes o llegar tarde a una presentación clave son cosas que perjudican a tu empresa.\n\nPero cuando se viaja por negocios, ¿quién recibe la indemnización: tú o tu empresa?\n\nLa indemnización se paga siempre al viajero. Se proporciona para compensar las molestias sufridas por el pasajero, por lo que es irrelevante quién hizo la reserva. Sin embargo, algunas empresas incluyen una cláusula en el contrato de trabajo que establece que son ellas las que tienen derecho a esta indemnización y no el empleado; si tu contrato de trabajo tiene esta cláusula, lamentablemente no recibirías la indemnización.\nRetraso del vuelo: Cómo reclamar la indemnización\n\nTienes varias opciones a la hora de reclamar a la compañía aérea. O bien opta por hacer la reclamación por tu cuenta o bien delega la tarea en otra persona. Si optas por lo primero, es más que probable que tengas que buscar ayuda legal, ya que la compañía aérea podrá argumentar hábilmente contra tu reclamación con ayuda de su equipo jurídico. Si optas por hacer valer su reclamación de forma independiente, te ahorrarás la comisión aplicada por MYFLYRIGHT en caso de éxito, pero te costará mucho más tiempo y nervios.\n\nTeniendo en cuenta el tiempo que se tarda en reunir todos los documentos necesarios, que puede ser de varias horas, así como lo estresante que es tratar con las compañías aéreas, puede merecer la pena hacer su reclamación con MYFLYRIGHT en su lugar. Según nuestra experiencia, alrededor del 50% de los casos que recibimos son resueltos por los tribunales, un largo proceso que puede evitarse utilizando los servicios de MYFLYRIGHT.\n\nReclamar de forma independiente es un proceso arriesgado, ya que las compañías aéreas no suelen revelar toda la información relativa a un retraso. Un ejemplo de ello es cuando presentas una reclamación contra la aerolínea por cuestiones técnicas, mientras que el retraso fue causado por un impacto de ave, en cuyo caso la aerolínea no tiene que pagar la indemnización. Cuando esto se conoce, ya has gastado una cantidad considerable de tiempo, esfuerzo y dinero.\n\nSin embargo, en caso de llevar a cabo tu reclamación a través de MYFLYRIGHT, no hay que preocuparse por los costes, ya que la comisión sólo se cobra cuando hay un resultado satisfactorio. La siguiente tabla muestra los costes de un caso en Alemania en el que dos personas reclaman una indemnización por valor de 400 euros cada una:\nCantiadad a reembolsar/cuantía de demanda 800.00 €\nAcuerdo No hay\nPrimera Instancia\nTasas judiciales: 159.00 €\nAbogado(demandante): 261.80 €\nAbogado(demandado): 261.80 €\nTotal (riesgo de costas): 682.60 €\n\nComo puede ser muy costoso reclamar por su cuenta a la compañía aérea, muchos pasajeros renuncian a esta opción. Las compañías aéreas tienen experiencia en la tramitación de múltiples reclamaciones y son expertas en eludir el pago de indemnizaciones. Para evitar el riesgo financiero, así como la naturaleza lenta y estresante del proceso, puedes encomendar tu caso a MYFLYRIGHT. Somos expertos en los derechos de los pasajeros y podemos ayudarte a obtener la indemnización que te corresponde. Si, por el contrario, quieres hacer la reclamación por tu cuenta, los siguientes consejos y el modelo de carta te serán de utilidad.\nModelo de carta de indemnización por retraso en el vuelo\n\nA la hora de hacer valer tus derechos de pasajero frente a la aerolínea de forma independiente, hay varios puntos para tener en cuenta y pasos a seguir.', 'Indemnización retraso vuelo\n\nNavegación por el Retraso en el vuelo\n\n    La indemnización por retraso de vuelo y los derechos en breve\n    ¿Tu vuelo se ha retrasado? Condiciones de indemnización\n    Indemnización por retraso de vuelo: Derechos de los pasajeros de la UE\n    Indemnización por retraso de vuelo: Paquete y viaje de negocios\n    Retraso del vuelo: Cómo reclamar una indemnización\n    Estado de los vuelos: Estadísticas de la UE sobre retrasos\n\nIndemnizaciones y derechos en caso de retraso de un vuelo\n\nLos retrasos de los vuelos, tanto si te vas de vacaciones como si viajas por negocios, no sólo son un inconveniente sino que son extremadamente estresantes. Puede resultar confuso para los pasajeros saber qué hacer en esta situación, que por desgracia se está convirtiendo en un problema cada vez más común en los viajes aéreos.\n\nLa buena noticia es que tienes varias opciones cuando tu vuelo se retrasa, pero la cuantía de la indemnización que puedes recibir depende de varios factores. Cuando tu vuelo llega al aeropuerto de destino con un retraso de más de 3 horas, tienes derecho a 250 euros, 400 euros o 600 euros, dependiendo de la distancia del vuelo. Con un retraso de más de 5 horas, puedes reclamar una indemnización por el precio del billete si ya no quieres coger el vuelo. La aerolínea debe ofrecerte servicios que incluyen comidas, refrescos y alojamiento gratuitos, según la duración del retraso.\n\nSólo el 65% de los vuelos con un retraso de más de 3 horas en la UE tienen derecho a una indemnización por parte de la compañía aérea. La procedencia o no de una reclamación depende de si la compañía aérea podía haber evitado el retraso del vuelo o si este se debió a circunstancias extraordinarias. Cuando el motivo del retraso del vuelo se considera una circunstancia extraordinaria -por ejemplo, la caída de un rayo-, la compañía aérea no puede ser considerada responsable del retraso.\n\nEl 80% de los pasajeros desconocen sus derechos en caso de retraso de los vuelos. Sólo una parte -aproximadamente el 5% de los afectados - consigue hacer valer sus reclamaciones por su cuenta, ya que las compañías aéreas suelen aprovecharse de la ingenuidad de los pasajeros para no indemnizarlos.\n\nMYFLYRIGHT, expertos en derechos de los viajeros, pretenden poner fin a esta práctica injusta. Con MYFLYRIGHT, comprobar si puedes reclamar una indemnización por el retraso de tu vuelo es gratis. Si decides utilizar el servicio, MYFLYRIGHT tramitará tu reclamación contra la compañía aérea sin ningún riesgo financiero. Sólo en caso de éxito se aplica una comisión del 25% más IVA, ahorrándote tiempo, esfuerzo y estrés. Si tenemos que contratar a nuestros abogados externos, cobramos un recargo del 10%. En algunos casos, se ofrece un pago inmediato, en el que la indemnización se abona en las 24 horas siguientes a la recepción de todos los documentos pertinentes. En este caso, se aplica una comisión del 35% más IVA.\n\n¿Tu vuelo se ha retrasado? Condiciones de indemnización\n\nTras sufrir las molestias de un retraso de vuelo, los pasajeros pueden tener derecho a una indemnización.\n\nEl importe de la indemnización depende de dos factores: la distancia del vuelo y el número de horas de retraso. Hay que tener en cuenta que para recibir la indemnización, el vuelo debe tener un retraso superior a 3 horas.\n\nEste pago se suma a los servicios que la compañía aérea está obligada a ofrecer en determinados casos. Las compañías aéreas deben ofrecer servicios adicionales a partir de los retrasos de más de 2 horas, y con un retraso de más de 5 horas también se puede recibir el reembolso completo del billete', 'No firmes ni aceptes ofertas que puedan mermar tus derechos: como por ejemplo futuros vales de viajes u otras gratificaciones porque puedes estar renunciando al derecho sobre cualquier tipo de compensación adicional. Al aceptar estos acuerdos, puedes perder los derechos que tienes para reclamar el retraso del vuelo y recibir tu indemnización.\n\nSi tu retraso es superior a 5 horas: tienes la opción de solicitar un reembolso completo además de un vuelo de vuelta a tu punto de partida si fuera necesario sin coste alguno.\n\n    Guarda las facturas si tienes gastos extras por el retraso: en el caso de los vuelos internacionales, incluso dentro de la UE, puede que recuperes los gastos adicionales resultantes del vuelo afectado.\n\nReclamaciones por retrasos de vuelos en EE. UU.\n\nPara vuelos nacionales en Estados Unidos, si quieres presentar una reclamación por retraso de vuelo tienes que:\n\nConservar la tarjeta de embarque o cualquier otro documento.\n\nDurante las 2 primeras horas de espera en pista: pide comida, agua y descansos para ir al baño. A partir de las 3 horas (4 para vuelos internacionales) puede solicitar bajar del avión.\n\n    Negocia con la aerolínea la compensación por las molestias causadas: aunque como te hemos mostrado antes, no están obligadas a darte nada.\n\nIndemnización por retraso de vuelo internacional\n\nPara vuelos internacionales incluidos dentro del Convenio de Montreal debes hacer lo siguiente:\n\nConservar la tarjeta de embarque o cualquier documento con el código de confirmación de reserva. Si no tienes esto, puede complicar cuando vas a reclamar el retraso del vuelo y tu indemnización.\n\nPreguntar por qué se ha retrasado el vuelo: con los detalles de la incidencia.\n\nGuardar los recibos: si tienes gastos extraordinarios por el retraso. Es posible que estos gastos también los puedes incluir cuando vas a reclamar el retraso de vuelo.\n\n    Vuelo con escalas: si tu vuelo internacional tiene escala en la UE puede que tengas derecho también a una compensación adicional. Depende de como el retraso de vuelo afecta el resto de tu viaje, pero también podrás recibir una indemnización en estos casos cuando reclamas el retraso de vuelo.\n\nTiempo límite para presentar las reclamaciones de vuelos\n\nEl tiempo máximo para optar a tu derecho de compensación dentro de la Unión Europea varía de un país a otro y además está determinado por la ubicación de la sede central de la aerolínea o por el tribunal que tiene jurisdicción en casos relacionados con la compañía. En AirHelp tenemos una tabla en la que puedes consultar los plazos de prescripción en Europa. Debes tener en cuanto los plazos y tiempos límites para las reclamaciones, ya que no quieres pasar y perder tu derecho a reclamar tu debida indemnización por el retraso de tu vuelo internacional o nacional.\n\nEn cuanto a los vuelos internacionales, el Convenio de Montreal establece un límite de 2 años para presentar una reclamación de gastos provocados por una incidencia en un vuelo.\n\n¿Cómo puede ayudarte AirHelp a reclamar tu indemnización por retraso de vuelo?\n\nEn AirHelp hemos ayudado a más de 16 millones de pasajeros, y es que con tan sólo introducir los detalles de tu vuelo podremos comprobar si tienes derecho a una compensación por retraso. Puedes optar por hacerlo a través de nuestro calculador gratuito.\n\nEn ambos casos si tienes derecho a una indemnización, AirHelp gestionará la reclamación de tus vuelos enviando actualizaciones durante todo el proceso y finalmente te enviaremos el dinero de tu compensación por el método que elijas.\n\nCon la garantía de contar con profesionales expertos, AirHelp no te cobrará nada si no consigues ganar la reclamación de tu vuelo. Así que estamos dispuestos a hacer el ‘trabajo duro’ por ti para mejorar tu experiencia como pasajero si tu vuelo se retrasa.\n\nEn tan sólo dos minutos podremos comprobar tus derechos y hacerlos valer de inmediato frente a las aerolíneas, con las que estamos acostumbrados a negociar e interactuar en igualdad de condiciones.']","Si tu vuelo ha salido con un retraso, puedes reclamar una indemnización por el retraso de tu vuelo desde el sitio web de AirHelp. Aquí te explico cómo hacerlo:

1. Introduce los detalles de tu vuelo: Puedes hacerlo en el sitio web de AirHelp. Solo necesitas proporcionar los detalles de tu vuelo, como el número de vuelo, la fecha de salida y la fecha de llegada.

2. Comprueba tus derechos: AirHelp revisará tus derechos y te informará si tienes derecho a una compensación por el retraso. Esto se basa en la legislación de la Unión Europea y el Convenio de Montreal.

3. Haz una reclamación: Si tienes derecho a una compensación, AirHelp gestionará la reclamación de tu vuelo. Esto significa que ellos se encargarán de enviar actualizaciones durante todo el proceso y te devolverán el dinero de tu compensación por el método que elijas.

Es importante tener en cuenta que AirHelp no cobrará ningún costo si no consigues ganar la reclamación de tu vuelo. Están dispuestos a hacer el trabajo duro por ti para mejorar tu experiencia como pasajero si tu vuelo se retrasa. Además, si tu vuelo es internacional, puedes tener derecho a una compensación adicional según la legislación de la Unión Europea y el Convenio de Montreal.","La opción más fácil y eficaz para reclamar una indemnización por retraso de vuelo en Europa es utilizar los servicios de compañías especializadas en reclamaciones de derechos de pasajeros. Estas compañías ofrecen un proceso simplificado y asistencia profesional, eliminando la necesidad de que el pasajero se involucre en trámites complicados y negociaciones con las aerolíneas. Aquí te presento algunas opciones recomendadas:

    AirHelp: Esta empresa ha ayudado a más de 16 millones de pasajeros y opera en 30 países. Ofrecen un proceso sencillo donde solo necesitas introducir los detalles de tu vuelo en su calculadora online para comprobar si tienes derecho a compensación. Si es así, gestionarán todo el proceso de reclamación, incluyendo negociaciones con las aerolíneas, y te enviarán la compensación directamente. Solo cobran una comisión si la reclamación es exitosa​​.

Reclamador: Es una página española con una interfaz intuitiva y fácil de usar. Solo necesitas introducir algunos datos de tu vuelo, y ellos se encargarán de todo el proceso de reclamación. Al igual que AirHelp, solo cobran una comisión si la reclamación resulta exitosa​.

Refund.me: Esta empresa opera a nivel mundial y ofrece un proceso de reclamación eficiente y rápido a través de procesos automatizados. Aunque su trato puede ser menos personalizado, también solo cobran una comisión si la reclamación es exitosa​.

FlightRight: Opera casi en todo el mundo y ofrece un trato personalizado. Calculan la indemnización para que tengas una idea de lo que te corresponde y envían el dinero de la indemnización de manera inmediata, aunque tienen una comisión más alta​.

Populetic: No solo se enfocan en vuelos retrasados o cancelados, sino también en problemas relacionados con overbooking, equipaje y otros aspectos del viaje​.

MYFLYRIGHT: Ofrecen un servicio gratuito para comprobar si puedes reclamar una indemnización. Si decides utilizar su servicio, tramitarán tu reclamación sin riesgo financiero y solo aplicarán una comisión en caso de éxito. Además, ofrecen la opción de un pago inmediato con una comisión más alta​.

Estas compañías te ahorran tiempo y esfuerzo al manejar todas las comunicaciones y negociaciones necesarias, aumentando las posibilidades de una resolución exitosa de tu reclamación.",0.8426222335994211,0.9999999999666667,0.7,0.9090909090909091
forma eficaz de reclamar a aerolinea por retraso en vuelo europeo,"['2. ¿Cuáles son los derechos que tienes cuando se retraso un vuelo y las compensaciones que puedes reclamar?\n\nAdemás de lo expuesto referente a la normativa europea CE 261, también existen otros derechos de los pasajeros que debes conocer. Los pasajeros no solo tienen derecho a realizar una reclamación por retraso de vuelo y posiblemente recibir una indemnización. Los otros derechos que los pasajeros tienen son los siguientes:\n\nDerecho a reembolso o vuelo alternativo: además de la indemnización por retraso de vuelo fijada por CE 261, si tu retraso es superior a 5 horas tienes derecho a un reembolso total o parcial de tu billete original y a un vuelo de vuelta a tu lugar de origen en caso necesario.\n\nDerecho a asistencia: se refiere a comidas y refrescos durante el retraso, acceso a comunicaciones como 2 llamadas de teléfono, mensajes de fax e e-mail. Además, si es necesario pasar la noche deberán ofrecerte una habitación de hotel y el desplazamiento tanto de ida como de vuelta al aeropuerto. Tienes derecho a asistencia con 2 horas o más de retraso para todos los vuelos de 1.500 km o menos; con 3 horas o más para vuelos dentro de la UE de más de 1.500 km, así como vuelos fuera de la UE de entre 1.500 y 3.500 km; y con 4 horas de retraso o más para vuelos dentro de la UE de más de 3.500 km.\n\n    Aumento o reducción de prestaciones: Si la aerolínea te ofrece un vuelo alternativo y te colocan en una clase superior al que tenías no podrán cargarte ningún pago adicional por ello. Por el contrario, si la clase del vuelo alternativo es inferior, puedes obtener un reembolso de entre el 30% y el 75% del precio que abonaste. \n\n3. ¿Como reclamar el retraso de los vuelos?\n\nAhora viene la parte que puedes considerar ‘más complicada’, pero que no tiene por qué asustarte, ya que precisamente desde AirHelp trabajamos para facilitarte el trabajo y poder ayudarte a como reclamar el retraso de tu vuelo en caso de que tu caso cumpla con los requisitos. Primero te explicaremos todo lo que necesitarías para presentar una reclamación por vuelos retrasados, incluso para reclamaciones con Iberia. En el caso en que decidieras hacerlo tú mismo, y después te mostraremos cómo nuestra ayuda puede evitarte perder un tiempo precioso en papeleo y negociaciones con las compañías, porque lo podemos hacer por ti. Siempre estamos disponibles para ayudar a que recibas la indemnización que se te debe cuando reclamas el retraso de vuelo.\nReclamaciones por retrasos de vuelos en la UE\n\nSi vas a presentar una reclamación por un retraso de vuelo para recibir una indemnización acogiéndote a la normativa europea CE 261 tienes que seguir los siguientes pasos:\n\nConserva tu tarjeta de embarque y cualquier otro documento: es válido también cualquier documento que contenga el código de confirmación de la reserva. Esto es importante para realizar reclamaciones por retrasos de vuelos.\n\nPide información del retraso al personal de tierra: cuanto más específica sea la razón mejor, porque será importante para presentar la reclamación de retraso. Tenlo en cuenta también para reclamaciones a Tap Air Portugal.\n\nAnotaciones y fotografías: incluye en tus anotaciones la hora de llegada al destino final (recuerda que no es cuando aterriza el avión, sino cuando se encuentra en la puerta de embarque y se abren las puertas), y fotos como la pantalla de salidas del aeropuerto.\n\nPide a la aerolínea que te cubra las dietas: en el caso en que tengas que esperar dependiendo del tiempo de retraso y de la duración del vuelo. Es lo que te hemos explicado antes como derecho a la asistencia.\n\nNo firmes ni aceptes ofertas que puedan mermar tus derechos: como por ejemplo futuros vales de viajes u otras gratificaciones porque puedes estar renunciando al derecho sobre cualquier tipo de compensación adicional. Al aceptar estos acuerdos, puedes perder los derechos que tienes para reclamar el retraso del vuelo y recibir tu indemnización.', 'A la hora de hacer valer tus derechos de pasajero frente a la aerolínea de forma independiente, hay varios puntos para tener en cuenta y pasos a seguir.\n\nPaso 1. Escribe una carta. Puedes escribir tu propia carta o utilizar nuestra plantilla de carta. Si optas por nuestra plantilla, puedes rellenarla en línea y enviarla por correo electrónico directamente a la compañía aérea o imprimirla, rellenarla y enviarla por correo. Si optas por enviar tu carta por correo, asegúrate de optar por el correo certificado para saber cuándo la recibe la compañía aérea, ya que puede ser una prueba importante en el tribunal.\n\nDebes incluir la siguiente información en tu carta o correo electrónico:\nDireccion de la atención al cliente de aerolínea Fecha de salida\nHora de salida programada Ruta del vuelo\nNúmero de vuelo Aeropuerto de salida\nHora de llegada programada Importe de compensación\nNúmero de reserva Aeropuerto de conexión (si hay)\nHora de llegada real Costes adicionales (con prueba)\nIrregularidad ocurrida Aeropuerto de llegada\nDistancia del vuelo en km Información del numero de cuenta bancaria\n\nEs una buena idea fijar un plazo límite en que se debe resolver tu reclamación. El plazo estándar es de 2 a 3 semanas. Si no has recibido respuesta de la compañía aérea en ese plazo, pasa al paso 2.\n\nPaso 2. Ahora puedes solicitar la ayuda de los servicios jurídicos o dar a la compañía aérea otra oportunidad de responder enviando una segunda carta. Una vez más, fija un plazo de 2 a 3 semanas a partir de tu envío y recuerda utilizar el correo certificado si decides enviar tu carta.\n\nIMPORTANTE: Si en cualquier momento la derolínea rechaza tu reclamación de compensación, puedes iniciar las acciones legales de inmediato y no tienes que esperar a que se acabe el plazo. No permitas que los argumentos de aerolínea te desanimen. Antes de rendirte, recuerda siempre que todavía puedes hacer valer tu reclamación a través de MYFLYRIGHT.\n\nPaso 3. Si tu segunda carta no es seguida de una respuesta de la aerolínea, es el momento de llevar tu caso a los tribunales. Las aerolíneas están obligadas a responder a una demanda, por lo que no podrán evitar tu reclamación por más tiempo. Ten en cuenta todos los costes que conlleva antes de recurrir a los servicios jurídicos. Por ejemplo, en Alemania, si tu caso es rechazado en los tribunales, deberás pagar todas las tasas legales y judiciales.\n\nPuedes evitar este frustrante y costoso procedimiento eligiendo MYFLYRIGHT, donde podrás hacer tu reclamación sin ningún riesgo de coste.\nEstado del vuelo: Estadísticas de la UE sobre retrasos\n\nLos retrasos de los vuelos se producen por una gran variedad de razones, muchas de las cuales no son responsabilidad de las compañías aéreas; al fin y al cabo, los procedimientos judiciales son costosos y requieren mucho tiempo para ambas partes. A pesar de ello, muchos vuelos sufren retrasos a diario y esto se ha convertido en un trastorno habitual para los pasajeros aéreos de todo el mundo.\nRetrasos en los vuelos: Estadísticas de los aeropuertos alemanes', '5 páginas donde poder reclamar tus vuelos por retraso o cancelación de manera gratuita\nIrina Pérez\n\n    En muchas ocasiones no se realiza la reclamación de un vuelo por retraso o cancelación, porque se desconocen los derechos como pasajeros y la manera de realizar el trámite. \n    Por ello, aquí van 5 reclamadores online que te ayudarán a conseguir una indemnización por tu vuelo, sin que tengas que desplazarte ni hacer papeleos.\n    Descubre más historias en Business Insider España.\n\nVolar es siempre sinónimo de nervios, normalmente ir al aeropuerto con tiempo, las colas en facturación, o cualquier imprevisto, hacen que a veces viajar sea una odisea. En el peor de los casos tu vuelo puede sufrir retrasos e incluso cancelarse. Pero, ¿sabías que tienes derecho a una compensación económica cuando esto ocurre?\n\nEn muchas ocasiones reclamar, es algo que se deja pasar porque es tedioso, y requiere hacer papeleo, desplazamientos y temas burocráticos que ocupan mucho tiempo. Por eso, es necesario que conozcas las páginas web que harán todo esto por ti, y que solo se llevaran una comisión si consiguen la remuneración, si no lo consiguen, no tendrás que pagar nada.\n#1. Airhelp\n\nLa empresa Airhelp fue fundada en 2013 y ha logrado posicionarse como uno de las mejores opciones para defender los derechos de los pasajeros. Tienen más de 6 años de experiencia y han ayudado a 16 millones de personas, operando en 30 países. Pueden conseguir una compensación de hasta 600 euros. \n#2. Reclamador\n\nEs una página española creada por un pasajero cansado de que le pusieran trabas en realizar una reclamación. Por eso Pablo Rabanal pensó en cuantas personas estarían pasando por lo mismo y decidió emprender un nuevo proyecto para ayudarlas.\n\nReclamador se caracteriza por tener una interfaz intuitiva y sencilla así que te será muy fácil utilizarla. Tan sólo debes introducir ciertos datos del vuelo en el que has sufrido el inconveniente y ellos se encargarán de hacer el trabajo.\n\n\nDe igual manera, solo se llevarán una comisión si ganan la reclamación. \n#3. Refund.me\n\nEsta empresa de reclamaciones opera en todo el mundo. Mediante su equipo de profesionales Refund.me se encargan de estudiar cada caso en particular ejerciendo los reclamos necesarios y logrando un proceso eficaz y rápido a través de procesos automatizados. \n\nEn la página del Kit Viajero, tan solo ponen un inconveniente, no tienen un trato tan cercano, y se llevan una comisión un poco más alta que en otras páginas de reclamadores. \n#4. FlightRight\n\nFlightright nació en 2010, con misma idea que los demás reclamadores, ayudar al usuario de una manera rápida y sencilla. Y lo consiguieron de una manera muy eficaz, operan en casi todo el mundo, y tiene un trato muy personalizado. Además calculan la indemnización para que puedas tener una idea de lo que te corresponde, y tienen un plus, te envían el dinero de manera inmediata. \n\nLa única pega, es que tiene la comisión más alta de los reclamadores de esta lista. \n#5. Populetic\n\nEs un reclamador europeo, lo interesante de usar Populetic es que no solo se enfoca en vuelos retrasados o cancelados, sino que un equipo de profesionales abarcan todos los problemas relacionados con tu vuelo, overbooking e incluso temas relacionados con las maletas y el equipaje.\n\nAdemás en su página web puedes encontrar información relevante sobre derechos de pasajeros.']","Para reclamar un vuelo retrasado o cancelado en Europa, hay varias opciones disponibles. Aquí te presento tres opciones efectivas:

    Airhelp: Airhelp es una empresa española que se especializa en reclamar derechos a pasajeros. Ofrecen una amplia gama de servicios, incluyendo la reclamación de retrasos y cancelaciones de vuelos. Su sitio web es intuitivo y fácil de usar, y solo se llevan una comisión si consiguen una compensación. También tienen una base de datos de reclamaciones anteriores, lo que les permite identificar patrones y ofrecer recomendaciones personalizadas.

Reclamador: Este es un reclamador español que se centra en ayudar a las personas a reclamar derechos. Ofrecen una interfaz fácil de usar y solo se llevan una comisión si consiguen una compensación. También tienen una amplia gama de vuelos y aeropuertos cubiertos, lo que les permite ofrecer una cobertura más amplia.

Refund.me: Esta empresa opera en todo el mundo y se especializa en reclamar derechos a pasajeros. Ofrecen un proceso eficiente y rápido, y solo se llevan una comisión si consiguen una compensación. Además, tienen un equipo de profesionales que pueden ayudarte a entender tus opciones y seleccionar la mejor opción para tu caso.

Populetic: Este es un reclamador europeo que se enfoca en una variedad de problemas relacionados con los vuelos, incluyendo el overbooking y la gestión de maletas. Ofrecen una amplia gama de opciones y recomiendan planes personalizados basados en tus necesidades. Sin embargo, también tienen una comisión más alta que otras opciones.

Estas empresas ofrecen una variedad de opciones para reclamar un vuelo retrasado o cancelado en Europa. Al elegir una, asegúrate de leer y entender sus políticas y procedimientos cuidadosamente para asegurarte de obtener los mejores resultados.","La opción más fácil y eficaz para reclamar una indemnización por retraso de vuelo en Europa es utilizar los servicios de compañías especializadas en reclamaciones de derechos de pasajeros. Estas compañías ofrecen un proceso simplificado y asistencia profesional, eliminando la necesidad de que el pasajero se involucre en trámites complicados y negociaciones con las aerolíneas. Aquí te presento algunas opciones recomendadas:

    AirHelp: Esta empresa ha ayudado a más de 16 millones de pasajeros y opera en 30 países. Ofrecen un proceso sencillo donde solo necesitas introducir los detalles de tu vuelo en su calculadora online para comprobar si tienes derecho a compensación. Si es así, gestionarán todo el proceso de reclamación, incluyendo negociaciones con las aerolíneas, y te enviarán la compensación directamente. Solo cobran una comisión si la reclamación es exitosa​​.

Reclamador: Es una página española con una interfaz intuitiva y fácil de usar. Solo necesitas introducir algunos datos de tu vuelo, y ellos se encargarán de todo el proceso de reclamación. Al igual que AirHelp, solo cobran una comisión si la reclamación resulta exitosa​.

Refund.me: Esta empresa opera a nivel mundial y ofrece un proceso de reclamación eficiente y rápido a través de procesos automatizados. Aunque su trato puede ser menos personalizado, también solo cobran una comisión si la reclamación es exitosa​.

FlightRight: Opera casi en todo el mundo y ofrece un trato personalizado. Calculan la indemnización para que tengas una idea de lo que te corresponde y envían el dinero de la indemnización de manera inmediata, aunque tienen una comisión más alta​.

Populetic: No solo se enfocan en vuelos retrasados o cancelados, sino también en problemas relacionados con overbooking, equipaje y otros aspectos del viaje​.

MYFLYRIGHT: Ofrecen un servicio gratuito para comprobar si puedes reclamar una indemnización. Si decides utilizar su servicio, tramitarán tu reclamación sin riesgo financiero y solo aplicarán una comisión en caso de éxito. Además, ofrecen la opción de un pago inmediato con una comisión más alta​.

Estas compañías te ahorran tiempo y esfuerzo al manejar todas las comunicaciones y negociaciones necesarias, aumentando las posibilidades de una resolución exitosa de tu reclamación.",0.8637261388787637,0.9999999999666667,0.7083333333333334,1.0
hay alguna forma de reclamar por retrasos en vuelos que sea cómoda y fácil de hacer,"['5 páginas donde poder reclamar tus vuelos por retraso o cancelación de manera gratuita\nIrina Pérez\n\n    En muchas ocasiones no se realiza la reclamación de un vuelo por retraso o cancelación, porque se desconocen los derechos como pasajeros y la manera de realizar el trámite. \n    Por ello, aquí van 5 reclamadores online que te ayudarán a conseguir una indemnización por tu vuelo, sin que tengas que desplazarte ni hacer papeleos.\n    Descubre más historias en Business Insider España.\n\nVolar es siempre sinónimo de nervios, normalmente ir al aeropuerto con tiempo, las colas en facturación, o cualquier imprevisto, hacen que a veces viajar sea una odisea. En el peor de los casos tu vuelo puede sufrir retrasos e incluso cancelarse. Pero, ¿sabías que tienes derecho a una compensación económica cuando esto ocurre?\n\nEn muchas ocasiones reclamar, es algo que se deja pasar porque es tedioso, y requiere hacer papeleo, desplazamientos y temas burocráticos que ocupan mucho tiempo. Por eso, es necesario que conozcas las páginas web que harán todo esto por ti, y que solo se llevaran una comisión si consiguen la remuneración, si no lo consiguen, no tendrás que pagar nada.\n#1. Airhelp\n\nLa empresa Airhelp fue fundada en 2013 y ha logrado posicionarse como uno de las mejores opciones para defender los derechos de los pasajeros. Tienen más de 6 años de experiencia y han ayudado a 16 millones de personas, operando en 30 países. Pueden conseguir una compensación de hasta 600 euros. \n#2. Reclamador\n\nEs una página española creada por un pasajero cansado de que le pusieran trabas en realizar una reclamación. Por eso Pablo Rabanal pensó en cuantas personas estarían pasando por lo mismo y decidió emprender un nuevo proyecto para ayudarlas.\n\nReclamador se caracteriza por tener una interfaz intuitiva y sencilla así que te será muy fácil utilizarla. Tan sólo debes introducir ciertos datos del vuelo en el que has sufrido el inconveniente y ellos se encargarán de hacer el trabajo.\n\n\nDe igual manera, solo se llevarán una comisión si ganan la reclamación. \n#3. Refund.me\n\nEsta empresa de reclamaciones opera en todo el mundo. Mediante su equipo de profesionales Refund.me se encargan de estudiar cada caso en particular ejerciendo los reclamos necesarios y logrando un proceso eficaz y rápido a través de procesos automatizados. \n\nEn la página del Kit Viajero, tan solo ponen un inconveniente, no tienen un trato tan cercano, y se llevan una comisión un poco más alta que en otras páginas de reclamadores. \n#4. FlightRight\n\nFlightright nació en 2010, con misma idea que los demás reclamadores, ayudar al usuario de una manera rápida y sencilla. Y lo consiguieron de una manera muy eficaz, operan en casi todo el mundo, y tiene un trato muy personalizado. Además calculan la indemnización para que puedas tener una idea de lo que te corresponde, y tienen un plus, te envían el dinero de manera inmediata. \n\nLa única pega, es que tiene la comisión más alta de los reclamadores de esta lista. \n#5. Populetic\n\nEs un reclamador europeo, lo interesante de usar Populetic es que no solo se enfoca en vuelos retrasados o cancelados, sino que un equipo de profesionales abarcan todos los problemas relacionados con tu vuelo, overbooking e incluso temas relacionados con las maletas y el equipaje.\n\nAdemás en su página web puedes encontrar información relevante sobre derechos de pasajeros.', 'No firmes ni aceptes ofertas que puedan mermar tus derechos: como por ejemplo futuros vales de viajes u otras gratificaciones porque puedes estar renunciando al derecho sobre cualquier tipo de compensación adicional. Al aceptar estos acuerdos, puedes perder los derechos que tienes para reclamar el retraso del vuelo y recibir tu indemnización.\n\nSi tu retraso es superior a 5 horas: tienes la opción de solicitar un reembolso completo además de un vuelo de vuelta a tu punto de partida si fuera necesario sin coste alguno.\n\n    Guarda las facturas si tienes gastos extras por el retraso: en el caso de los vuelos internacionales, incluso dentro de la UE, puede que recuperes los gastos adicionales resultantes del vuelo afectado.\n\nReclamaciones por retrasos de vuelos en EE. UU.\n\nPara vuelos nacionales en Estados Unidos, si quieres presentar una reclamación por retraso de vuelo tienes que:\n\nConservar la tarjeta de embarque o cualquier otro documento.\n\nDurante las 2 primeras horas de espera en pista: pide comida, agua y descansos para ir al baño. A partir de las 3 horas (4 para vuelos internacionales) puede solicitar bajar del avión.\n\n    Negocia con la aerolínea la compensación por las molestias causadas: aunque como te hemos mostrado antes, no están obligadas a darte nada.\n\nIndemnización por retraso de vuelo internacional\n\nPara vuelos internacionales incluidos dentro del Convenio de Montreal debes hacer lo siguiente:\n\nConservar la tarjeta de embarque o cualquier documento con el código de confirmación de reserva. Si no tienes esto, puede complicar cuando vas a reclamar el retraso del vuelo y tu indemnización.\n\nPreguntar por qué se ha retrasado el vuelo: con los detalles de la incidencia.\n\nGuardar los recibos: si tienes gastos extraordinarios por el retraso. Es posible que estos gastos también los puedes incluir cuando vas a reclamar el retraso de vuelo.\n\n    Vuelo con escalas: si tu vuelo internacional tiene escala en la UE puede que tengas derecho también a una compensación adicional. Depende de como el retraso de vuelo afecta el resto de tu viaje, pero también podrás recibir una indemnización en estos casos cuando reclamas el retraso de vuelo.\n\nTiempo límite para presentar las reclamaciones de vuelos\n\nEl tiempo máximo para optar a tu derecho de compensación dentro de la Unión Europea varía de un país a otro y además está determinado por la ubicación de la sede central de la aerolínea o por el tribunal que tiene jurisdicción en casos relacionados con la compañía. En AirHelp tenemos una tabla en la que puedes consultar los plazos de prescripción en Europa. Debes tener en cuanto los plazos y tiempos límites para las reclamaciones, ya que no quieres pasar y perder tu derecho a reclamar tu debida indemnización por el retraso de tu vuelo internacional o nacional.\n\nEn cuanto a los vuelos internacionales, el Convenio de Montreal establece un límite de 2 años para presentar una reclamación de gastos provocados por una incidencia en un vuelo.\n\n¿Cómo puede ayudarte AirHelp a reclamar tu indemnización por retraso de vuelo?\n\nEn AirHelp hemos ayudado a más de 16 millones de pasajeros, y es que con tan sólo introducir los detalles de tu vuelo podremos comprobar si tienes derecho a una compensación por retraso. Puedes optar por hacerlo a través de nuestro calculador gratuito.\n\nEn ambos casos si tienes derecho a una indemnización, AirHelp gestionará la reclamación de tus vuelos enviando actualizaciones durante todo el proceso y finalmente te enviaremos el dinero de tu compensación por el método que elijas.\n\nCon la garantía de contar con profesionales expertos, AirHelp no te cobrará nada si no consigues ganar la reclamación de tu vuelo. Así que estamos dispuestos a hacer el ‘trabajo duro’ por ti para mejorar tu experiencia como pasajero si tu vuelo se retrasa.\n\nEn tan sólo dos minutos podremos comprobar tus derechos y hacerlos valer de inmediato frente a las aerolíneas, con las que estamos acostumbrados a negociar e interactuar en igualdad de condiciones.', 'A la hora de hacer valer tus derechos de pasajero frente a la aerolínea de forma independiente, hay varios puntos para tener en cuenta y pasos a seguir.\n\nPaso 1. Escribe una carta. Puedes escribir tu propia carta o utilizar nuestra plantilla de carta. Si optas por nuestra plantilla, puedes rellenarla en línea y enviarla por correo electrónico directamente a la compañía aérea o imprimirla, rellenarla y enviarla por correo. Si optas por enviar tu carta por correo, asegúrate de optar por el correo certificado para saber cuándo la recibe la compañía aérea, ya que puede ser una prueba importante en el tribunal.\n\nDebes incluir la siguiente información en tu carta o correo electrónico:\nDireccion de la atención al cliente de aerolínea Fecha de salida\nHora de salida programada Ruta del vuelo\nNúmero de vuelo Aeropuerto de salida\nHora de llegada programada Importe de compensación\nNúmero de reserva Aeropuerto de conexión (si hay)\nHora de llegada real Costes adicionales (con prueba)\nIrregularidad ocurrida Aeropuerto de llegada\nDistancia del vuelo en km Información del numero de cuenta bancaria\n\nEs una buena idea fijar un plazo límite en que se debe resolver tu reclamación. El plazo estándar es de 2 a 3 semanas. Si no has recibido respuesta de la compañía aérea en ese plazo, pasa al paso 2.\n\nPaso 2. Ahora puedes solicitar la ayuda de los servicios jurídicos o dar a la compañía aérea otra oportunidad de responder enviando una segunda carta. Una vez más, fija un plazo de 2 a 3 semanas a partir de tu envío y recuerda utilizar el correo certificado si decides enviar tu carta.\n\nIMPORTANTE: Si en cualquier momento la derolínea rechaza tu reclamación de compensación, puedes iniciar las acciones legales de inmediato y no tienes que esperar a que se acabe el plazo. No permitas que los argumentos de aerolínea te desanimen. Antes de rendirte, recuerda siempre que todavía puedes hacer valer tu reclamación a través de MYFLYRIGHT.\n\nPaso 3. Si tu segunda carta no es seguida de una respuesta de la aerolínea, es el momento de llevar tu caso a los tribunales. Las aerolíneas están obligadas a responder a una demanda, por lo que no podrán evitar tu reclamación por más tiempo. Ten en cuenta todos los costes que conlleva antes de recurrir a los servicios jurídicos. Por ejemplo, en Alemania, si tu caso es rechazado en los tribunales, deberás pagar todas las tasas legales y judiciales.\n\nPuedes evitar este frustrante y costoso procedimiento eligiendo MYFLYRIGHT, donde podrás hacer tu reclamación sin ningún riesgo de coste.\nEstado del vuelo: Estadísticas de la UE sobre retrasos\n\nLos retrasos de los vuelos se producen por una gran variedad de razones, muchas de las cuales no son responsabilidad de las compañías aéreas; al fin y al cabo, los procedimientos judiciales son costosos y requieren mucho tiempo para ambas partes. A pesar de ello, muchos vuelos sufren retrasos a diario y esto se ha convertido en un trastorno habitual para los pasajeros aéreos de todo el mundo.\nRetrasos en los vuelos: Estadísticas de los aeropuertos alemanes']","Claro, puedo ayudarte con eso. Aquí te presento 5 opciones de reclamadores online que pueden ayudarte a reclamar por retrasos de vuelos y cancelaciones:

    Airhelp: Esta empresa ofrece una plataforma de reclamación en línea que te permite presentar una reclamación por retrasos de vuelo y cancelación. Para ello, primero debes conservar la tarjeta de embarque y cualquier otro documento relevante. Después, puedes presentar tu reclamación en línea o por correo electrónico. Si consigues una compensación, Airhelp gestionará la reclamación de tu vuelo para ti. La comisión que pueden cobrar varía según la situación, pero generalmente no te cobrarán si no consigues una compensación​.

Reclamador: Esta es una página española que te permite presentar una reclamación por retrasos de vuelo y cancelación. La interfaz es intuitiva y sencilla, y puedes utilizarla para presentar los detalles de tu vuelo y solicitar una compensación. Solo se llevan una comisión si consiguen la indemnización. Esta es una opción popular debido a su facilidad y la garantía de que no tendrás que preocuparte por los trámites burocráticos​.

Refund.me: Esta empresa opera en todo el mundo y te permite presentar una reclamación por retrasos de vuelo y cancelación. Su equipo de profesionales se encarga de estudiar cada caso y te ayudará a reclamar los gastos adicionales resultantes del retraso. La comisión que pueden cobrar varía según la situación, pero generalmente no te cobrarán si no consigues una compensación​.

FlightRight: Esta empresa nació en 2010 y opera en casi todo el mundo. Ofrecen un trato personalizado y calculan la indemnización para que puedas tener una idea de lo que te corresponde. Sin embargo, tienen la comisión más alta de los reclamadores de esta lista​.

Populetic: Esta es un reclamador europeo que opera en varios países y te permite presentar una reclamación por retrasos de vuelo y cancelación. Además, si tu vuelo internacional tiene escalas en la UE, puedes tener derecho a una compensación adicional. La comisión que pueden cobrar varía según la situación, pero generalmente no te cobrarán si no consigues una compensación​.

En cuanto a cómo puedes reclamar por retrasos de vuelos, hay algunos pasos que debes seguir:

    Escribe una carta: Puedes escribir tu propia carta o utilizar la plantilla de carta proporcionada por la compañía aérea. Si optas por la plantilla, puedes rellenarla en línea y enviarla por correo electrónico directamente a la compañía aérea, o imprimirla, rellenarla y enviarla por correo. Si decides enviar tu carta por correo, asegúrate de optar por el correo certificado para tener una prueba de que la recibió la compañía aérea. El plazo estándar para presentar una reclamación es de 2 a 3 semanas​.

Asegúrate de que tu reclamación esté completa y bien escrita. Incluye toda la información relevante, como la fecha de salida, la hora de salida programada, la ruta del vuelo, el número de vuelo, el aeropuerto de salida, la hora de llegada programada, la hora de llegada real, los costes adicionales y la irregularidad ocurrida. También debes indicar el aeropuerto de llegada y la distancia del vuelo en kilómetros​.

Si tu segunda carta no es respondida en el plazo de 2 a 3 semanas, puedes llevar tu caso a los tribunales. Esto puede ser costoso, pero es una opción si no has recibido una respuesta de la compañía aérea en tu segunda carta​.

Recuerda que es importante conservar la documentación relevante, como la tarjeta de embarque, para tus reclamaciones. También debes asegurarte de que tu reclamación esté completa y bien escrita antes de enviarla.","La opción más fácil y eficaz para reclamar una indemnización por retraso de vuelo en Europa es utilizar los servicios de compañías especializadas en reclamaciones de derechos de pasajeros. Estas compañías ofrecen un proceso simplificado y asistencia profesional, eliminando la necesidad de que el pasajero se involucre en trámites complicados y negociaciones con las aerolíneas. Aquí te presento algunas opciones recomendadas:

    AirHelp: Esta empresa ha ayudado a más de 16 millones de pasajeros y opera en 30 países. Ofrecen un proceso sencillo donde solo necesitas introducir los detalles de tu vuelo en su calculadora online para comprobar si tienes derecho a compensación. Si es así, gestionarán todo el proceso de reclamación, incluyendo negociaciones con las aerolíneas, y te enviarán la compensación directamente. Solo cobran una comisión si la reclamación es exitosa​​.

Reclamador: Es una página española con una interfaz intuitiva y fácil de usar. Solo necesitas introducir algunos datos de tu vuelo, y ellos se encargarán de todo el proceso de reclamación. Al igual que AirHelp, solo cobran una comisión si la reclamación resulta exitosa​.

Refund.me: Esta empresa opera a nivel mundial y ofrece un proceso de reclamación eficiente y rápido a través de procesos automatizados. Aunque su trato puede ser menos personalizado, también solo cobran una comisión si la reclamación es exitosa​.

FlightRight: Opera casi en todo el mundo y ofrece un trato personalizado. Calculan la indemnización para que tengas una idea de lo que te corresponde y envían el dinero de la indemnización de manera inmediata, aunque tienen una comisión más alta​.

Populetic: No solo se enfocan en vuelos retrasados o cancelados, sino también en problemas relacionados con overbooking, equipaje y otros aspectos del viaje​.

MYFLYRIGHT: Ofrecen un servicio gratuito para comprobar si puedes reclamar una indemnización. Si decides utilizar su servicio, tramitarán tu reclamación sin riesgo financiero y solo aplicarán una comisión en caso de éxito. Además, ofrecen la opción de un pago inmediato con una comisión más alta​.

Estas compañías te ahorran tiempo y esfuerzo al manejar todas las comunicaciones y negociaciones necesarias, aumentando las posibilidades de una resolución exitosa de tu reclamación.",0.8965555483824196,0.9999999999666667,1.0,0.3333333333333333
"Quiero ir a buscar setas por la Sierra de Madrid, ¿qué recomendaciones puedes darme?","['Los mejores lugares para buscar setas en la Comunidad de Madrid\n\nEmpieza la temporada fetiche de los micólogos: las setas ya han llegado a los bosques de toda España.\n\nMadrid Secreto Madrid Secreto\t• septiembre 30, 2022\nLos mejores lugares para buscar setas en la Comunidad de Madrid\n\nEl 23 de septiembre empieza el otoño y con él la temporada estrella de uno de los manjares de la gastronomía castellana: las setas. En España hay una larga y fuerte tradición micológica y en Madrid, en concreto, una gran cultura en lo que se refiere a la búsqueda de setas. Tras las últimas (y casi primeras) lluvias de verano, surgen los primeros níscalos en los bosques de la región. Además, desde septiembre y hasta diciembre las escapadas a la sierra madrileña en cercanías son gratis.\n¿Dónde recoger setas en la Comunidad de Madrid?\n\nComo en cualquier ámbito de la vida, cada maestrillo tiene su librillo y cada aficionado a la recolección de setas tiene sus sitios predilectos. No hay las mismas variedades de setas en cada zona, ni tampoco la misma afluencia de gente. No obstante, estos son algunos de los parques, puertos, montes, valles o bosques de Madrid donde más posibilidades tienes de llevarte un buen puñado de hongos.\n\nPero antes hay que tener en cuenta que esta actividad está regulada por Uso y Gestión del Parque Nacional de la Sierra de Guadarrama en su artículo 59. Y aunque está permitida siempre que sea de forma recreativa, es importante consultar los permisos y acotaciones de las diferentes zonas.\n\n    Puerto de Cotos\n    Alameda del Valle\n    Puerto de la Fuenfría\n    Puerto de Canencia\n    Monte Abantos\n    Valle de Lozoya\n    Valle del Paular\n    Puerto de los Leones\n\nRecomendaciones generales\n\n    Entre los aficionados a recoger setas en Madrid hay una serie de recomendaciones que casi son tomadas como dogmas o como obligaciones en la recolección:\n    Las setas se recogen en cestas y nunca en bolsas de plástico. De esta forma están ventiladas y sus esporas se reparten por el monte\n    No hay que ser avaricioso: la cantidad recolectada no debe exceder un número de setas que no sea razonable. Esto puede llegar a estar regulado en un máximo de 5 kg.\n    Las setas se cortan por el tallo (por eso es aconsejable ir acompañado de un cuchillo o navaja). Nunca hay que arrancarla. De este modo se consigue que vuelvan a crecer.\n    Es importante no recolectar ejemplares jóvenes porque al hacerlo se evita la multiplicación. Lo mismo ocurre con los ejemplares muy maduros.\n    Deja el monte tal y como te lo encontraste: hay que respetar el entorno.\n\n¿Cómo saber si son comestibles?\n\nEl primer consejo que se puede ofrecer ante esta cuestión es que si no tienes la certeza absoluta de que sea comestible, lo mejor es ser prudente y descartar su ingesta.\n\nLa Comunidad de Madrid tiene una entrada en su portal de comunicación en la que señala que ""las setas son un manjar que te puede salir muy caro. La mejor seta no vale una intoxicación"" y añade que ""en la Comunidad de Madrid existen setas muy tóxicas y mortales"". En esta entrada también ofrecen trucos para identificar qué setas silvestres no se deben recoger.\n\nPara profundizar y poder realizar esta actividad con mayor seguridad y conocimiento es recomendable realizar algún curso sobre setas, hongos o micología en general. La propia Comunidad de Madrid tiene una Red de Centros sobre educación ambiental que ofrece este tipo de formación, y también son muy recomendables las Jornadas Micológicas Sierra de Madrid, de la Central de Reservas de la Sierra de Guadarrama.\n\nY ya que sales a buscar setas, te recomendamos que aproveches el viaje y descubras algunos de los pueblos más bonitos de la Comunidad de Madrid porque puede que te pillen cerca.', '10 Consejos Básicos para coger Setas en la Sierra Norte de Madrid\n\nCada vez más personas sienten la llamada de las setas. En otoño, la Sierra Norte de Madrid se convierte en un lugar ideal para la micología y cientos de personas que acuden en su búsqueda.\n\nSin duda, coger setas es una actividad muy sana, pues se está en contacto directo con la naturaleza, se camina y, además, es posible observar y valorar la gran variedad micológica existente en la sierra norte madrileña.\n\nSin embargo, para que la recogida de setas tenga un final feliz y se puedan degustar con total tranquilidad en casa, conviene tener en cuenta y seguir una serie de recomendaciones.\n\n\n\nEstos son los 10 consejos básicos para coger setas:\n\n1. Siempre hay que respetar el entorno natural\n\n2. Es recomendable llevar el teléfono móvil, con la batería cargada, por si surge algún imprevisto\n\n3. Es muy conveniente ir acompañado por algún experto\n\n4. Solo hay que coger las setas que se conozcan y hacerlo con mesura, en cantidad limitada\n\n5. Aunque se conozca perfectamente la especie recolectada, se recomienda dejar las setas viejas o en malas condiciones, así como las que estén en sitios contaminados o próximos a ellos.\n\n6. Los expertos recomiendan coger las setas enteras (no cortarlas), con la base del pie incluida, pero teniendo especial cuidado para no dañar el micelio.\n\n7. Para guardar las setas que se vayan recogiendo hay que utilizar cestas de mimbre o recipientes adecuados para que las setas puedan dispersar sus esporas, y para que no se apelmacen o fermenten. No hay que usar bolsas de plástico.\n\n8. Una vez recolectadas las setas, aunque se guarden en el frigorífico, conviene consumirlas pronto porque son perecederas.\n\n9. No hay que hacer caso a falsas reglas ni usar trucos caseros para ver si una seta es comestible o no.\n\n10. Si las setas son para estudio y análisis por parte de algún especialista, conviene llevar las setas completas (sin cortar), pero solo los ejemplares estrictamente necesarios.', 'Sin duda, salir a buscar setas en Madrid es una de las mejores terapias que podemos hacer. Ideal para desintoxicarnos del ajetreo de una gran cuidad, y además lo tenemos a un paso, ya no nos quedan excusas.\n\n¿Has estado en alguna de estas zonas? Cuéntanoslo en nuestra página de facebook.\n\n¡Salud y setas!']","Para encontrar setas en la Sierra de Madrid, es importante tener en cuenta varios factores, como la época del año, la ubicación geográfica y la experiencia y habilidad del buscador. Aquí te presento algunas recomendaciones basadas en información obtenida de diversas fuentes:

    Duración y Clima: La temporada de setas en la Sierra de Madrid varía según la zona. Generalmente, se recomienda buscar setas entre septiembre y diciembre, cuando las setas maduran y se encuentran en su punto máximo de belleza. Si prefieres buscar setas en verano, puedes hacerlo en zonas boscosas cercanas a la ciudad, como el Parque Natural de los Montes de Oso​.

Entorno y Experiencia: Es fundamental considerar el entorno en el que buscarás setas. Buscar en áreas abiertas y boscosas es ideal, ya que esto aumenta las posibilidades de encontrar una variedad amplia de setas. Además, si eres un buscador experimentado, puedes explorar zonas menos visitadas o menos desarrolladas, donde es posible encontrar una mayor diversidad de setas​.

Habilidades y Experiencia: La habilidad y experiencia del buscador son cruciales para encontrar setas. Si eres nuevo en la búsqueda de setas, es recomendable comenzar en zonas menos pobladas y fácilmente accesibles. Como se menciona en el contexto, para encontrar setas, es importante ser cuidadoso y evitar lugares contaminados. También es importante conocer las diferencias entre las setas comestibles y las no comestibles, ya que la diferencia en su apariencia y textura puede hacer que sea difícil distinguirlas​.

Formación y Asesoramiento: Si eres un buscador más experimentado, puede ser útil tomar cursos o participar en programas de micología para mejorar tus habilidades y aprender más sobre las setas. Además, es recomendable buscar asesoramiento de expertos en la zona donde planeas buscar setas, como guías turísticos o centros de información local​.

En resumen, para encontrar setas en la Sierra de Madrid, es importante tener paciencia, ser consciente del entorno y de tus habilidades, y estar dispuesto a aprender y experimentar. Con la práctica y la dedicación, podrás disfrutar de la maravilla de la búsqueda de setas y su asociación con la naturaleza.","Si estás interesado en buscar setas en la Sierra de Madrid, aquí tienes algunas recomendaciones basadas en diversas fuentes:

    Respeto al Entorno Natural: Es esencial mantener el respeto por el entorno natural durante la recolección de setas. Esto implica no dañar la flora y fauna circundante y dejar el lugar tal como se encontró​.

Preparación y Seguridad: Lleva siempre un teléfono móvil con la batería cargada en caso de emergencias. También es muy recomendable ir acompañado de un experto en micología, especialmente si no estás familiarizado con las diferentes especies de setas​​.

Identificación de las Setas: Solo debes recolectar las setas que conozcas y asegurarte de que son comestibles. Es importante recolectarlas con mesura y limitar la cantidad. En caso de duda, es mejor consultar a un experto​.

Técnicas de Recolección: Los expertos sugieren recolectar las setas enteras, incluyendo la base del pie, pero con cuidado de no dañar el micelio. Deja atrás las setas viejas, en mal estado, o aquellas que se encuentren en sitios contaminados​.

Almacenamiento Adecuado: Usa cestas de mimbre o recipientes que permitan la dispersión de esporas y eviten el apelmazamiento o fermentación de las setas. Evita el uso de bolsas de plástico. Una vez recolectadas, se recomienda consumirlas pronto, ya que son perecederas​​.

Evitar Falsas Creencias: No te fíes de reglas caseras o trucos para determinar si una seta es comestible. Estos métodos no son confiables y pueden ser peligrosos​.

En cuanto a lugares recomendados, puedes considerar la zona de Alameda del Valle​​, así como el área que va desde el Monasterio del Paular hasta el Puerto de Cotos, donde encontrarás numerosos pinares y bosques ricos en níscalos​.

Recuerda que la recolección de setas debe hacerse de manera responsable y siempre priorizando la seguridad y el conocimiento sobre las diferentes especies.",0.8897067794388471,0.9999999999666667,0.8,1.0
"hola, vivo en madrid y me apetece recoger setas, a lo mejor por la sierra o por ahí. q puedo hacer?","['Sin duda, salir a buscar setas en Madrid es una de las mejores terapias que podemos hacer. Ideal para desintoxicarnos del ajetreo de una gran cuidad, y además lo tenemos a un paso, ya no nos quedan excusas.\n\n¿Has estado en alguna de estas zonas? Cuéntanoslo en nuestra página de facebook.\n\n¡Salud y setas!', 'Los mejores lugares para buscar setas en la Comunidad de Madrid\n\nEmpieza la temporada fetiche de los micólogos: las setas ya han llegado a los bosques de toda España.\n\nMadrid Secreto Madrid Secreto\t• septiembre 30, 2022\nLos mejores lugares para buscar setas en la Comunidad de Madrid\n\nEl 23 de septiembre empieza el otoño y con él la temporada estrella de uno de los manjares de la gastronomía castellana: las setas. En España hay una larga y fuerte tradición micológica y en Madrid, en concreto, una gran cultura en lo que se refiere a la búsqueda de setas. Tras las últimas (y casi primeras) lluvias de verano, surgen los primeros níscalos en los bosques de la región. Además, desde septiembre y hasta diciembre las escapadas a la sierra madrileña en cercanías son gratis.\n¿Dónde recoger setas en la Comunidad de Madrid?\n\nComo en cualquier ámbito de la vida, cada maestrillo tiene su librillo y cada aficionado a la recolección de setas tiene sus sitios predilectos. No hay las mismas variedades de setas en cada zona, ni tampoco la misma afluencia de gente. No obstante, estos son algunos de los parques, puertos, montes, valles o bosques de Madrid donde más posibilidades tienes de llevarte un buen puñado de hongos.\n\nPero antes hay que tener en cuenta que esta actividad está regulada por Uso y Gestión del Parque Nacional de la Sierra de Guadarrama en su artículo 59. Y aunque está permitida siempre que sea de forma recreativa, es importante consultar los permisos y acotaciones de las diferentes zonas.\n\n    Puerto de Cotos\n    Alameda del Valle\n    Puerto de la Fuenfría\n    Puerto de Canencia\n    Monte Abantos\n    Valle de Lozoya\n    Valle del Paular\n    Puerto de los Leones\n\nRecomendaciones generales\n\n    Entre los aficionados a recoger setas en Madrid hay una serie de recomendaciones que casi son tomadas como dogmas o como obligaciones en la recolección:\n    Las setas se recogen en cestas y nunca en bolsas de plástico. De esta forma están ventiladas y sus esporas se reparten por el monte\n    No hay que ser avaricioso: la cantidad recolectada no debe exceder un número de setas que no sea razonable. Esto puede llegar a estar regulado en un máximo de 5 kg.\n    Las setas se cortan por el tallo (por eso es aconsejable ir acompañado de un cuchillo o navaja). Nunca hay que arrancarla. De este modo se consigue que vuelvan a crecer.\n    Es importante no recolectar ejemplares jóvenes porque al hacerlo se evita la multiplicación. Lo mismo ocurre con los ejemplares muy maduros.\n    Deja el monte tal y como te lo encontraste: hay que respetar el entorno.\n\n¿Cómo saber si son comestibles?\n\nEl primer consejo que se puede ofrecer ante esta cuestión es que si no tienes la certeza absoluta de que sea comestible, lo mejor es ser prudente y descartar su ingesta.\n\nLa Comunidad de Madrid tiene una entrada en su portal de comunicación en la que señala que ""las setas son un manjar que te puede salir muy caro. La mejor seta no vale una intoxicación"" y añade que ""en la Comunidad de Madrid existen setas muy tóxicas y mortales"". En esta entrada también ofrecen trucos para identificar qué setas silvestres no se deben recoger.\n\nPara profundizar y poder realizar esta actividad con mayor seguridad y conocimiento es recomendable realizar algún curso sobre setas, hongos o micología en general. La propia Comunidad de Madrid tiene una Red de Centros sobre educación ambiental que ofrece este tipo de formación, y también son muy recomendables las Jornadas Micológicas Sierra de Madrid, de la Central de Reservas de la Sierra de Guadarrama.\n\nY ya que sales a buscar setas, te recomendamos que aproveches el viaje y descubras algunos de los pueblos más bonitos de la Comunidad de Madrid porque puede que te pillen cerca.', 'Escaparse de Madrid para buscar setas\nBuscar setas en Madrid, la mejor opción\n\nHuir del ruido y de la vorágine de la gran ciudad, siempre apetece, y si es para buscar setas este 2023 en el monte aún más. Pero, a veces, no disponemos del tiempo ni el dinero que necesitamos para salir corriendo, por eso, os proponemos una rápida escapada, a tan sólo a unos kilómetros de Madrid.\n\nAunque no te lo creas, muy cerca de ti, hay parajes que esconden tesoros naturales. Grandes floradas de setas, que te están esperando, para que del campo lleguen hasta tu mesa y pasar un buen día, que te alejará del estrés.\n\nBuscar setas en Madrid, en la Sierra de Guadarrama\n\nA Madrid la rodea la Sierra de Guadarrama y ésta tiene un rey indiscutible en otoño, Boletus edulis, y un príncipe, el Boletus pinophilus. Ambos muy parecidos, con forma de tapón de champán y sus sombrerillos de color marrón, aunque, el pinophilus es más rojizo. Conforme van madurando se van tornando en amarillos verdosos. Los dos son setas comestibles de primera clase.\nSetas de la Sierra de Guadarrama\n\nEl edulis o hongo calabaza crece en los robledales y hayedos, desde el final de verano hasta el otoño y el Boletus  pinophilus aparece a finales de primavera hasta principio de esta estación, en pinares maduros con ejemplares viejos, siendo más escaso en los bosques jóvenes.\n\nPero, además, podemos encontrarnos en los jarales los parasoles (Macrolepiota procera), en los pinares los níscalos (Lactarius deliciosus, y en los prados, los champiñones por citar algunas de las setas y hongos más comunes.\n\nUna maravilla de entornos, no sólo por nuestro tesoro culinario, sino, porque en esta época del año en la que las hojas empiezan a cambiar de tonalidad, van adquiriendo lentamente un hermoso color amarillo hasta que se vuelven totalmente marrones. Una transformación del paisaje que hace que estemos en un lugar mágico, y para colmo es temporada alta de setas y hongos.\n\nNo se puede pedir más, desde cumbres nevadas a valles, desde pedrizas a piscinas naturales, desde pinos a encinas, en la Sierra de Guadarrama la naturaleza es generosa en sus formas, su vegetación y su fauna.\n\nNuestras rutas para buscar setas en la Sierra de Guadarrama\n\nLa Sierra de Guadarrama tiene una extensión de 339, 6 kilómetros cuadrados, se expande a caballo entre la provincia madrileña y la segoviana. Por eso, con tal extensión, no tendrás suficiente con una sola excursión. Necesitarás varias jornadas, así que si quieres descubrirla de verdad, te proponemos varias rutas, que busques setas en los cuatro puntos cardinales.\n\nEn el Norte (zona de Lozoya y Rascafría) podemos encontrar durante el verano rebozuelos. Pero, a partir de septiembre puedes buscar, si las tormentas lo han permitido, la amanita de los césares y el Boletus aereus, y ahora el boleto poblará estos ricos ecosistemas.\n\nEntre el Sur y el Este de esta Sierra, los castañares abundan menos, sin embargo, cuando la temporada es buena, se multiplican las setas, en especial nuestras apreciados Boletus edulis y la Amanita caesarea.\n\n\nY en el corazón de esta cadena montañosa, en el Parque Regional de la Cuenca Alta del Manzanares, poblado de encinares, rebollares o cascajares crecen distintas variedades del Boletus.']","Hola! Me alegra que te interese la idea de buscar setas en Madrid. Aquí te presento algunas opciones y consejos basados en información obtenida de diversas fuentes:

    Localización y Requisitos: Buscar setas en Madrid puede ser un pasatiempo tanto en grupo como individual, pero es importante tener en cuenta que siempre es recomendable buscar en zonas bien iluminadas y seguras. Además, es importante conocer las leyes y regulaciones locales en cuanto a la recolección de setas​.

    Recolección de Setas: Existen diferentes tipos de setas y hongos que se pueden encontrar en Madrid, algunos de los más comunes son el Boletus edulis, el Boletus pinophilus y la Amanita caesarea. Es importante tener en cuenta que algunas variedades pueden ser venenosas y que es recomendable seguir las precauciones adecuadas al recogerlas​.

    Recolección Recreativa: Otra opción es la recolección recreativa, en la que se toman las setas como algo atractivo y no como una fuente de alimento. Esta opción es ideal para aquellos que buscan disfrutar de la naturaleza y la experiencia de la recolección, sin la preocupación de llevar las setas a casa​.

    Formación y Recursos: Para mejorar la experiencia de la recolección de setas, es recomendable buscar cursos y recursos en línea. La Comunidad de Madrid tiene una Red de Centros sobre educación ambiental que ofrece formación en micología y setas, mientras que las Jornadas Micológicas Sierra de Madrid organizadas por la Central de Reservas de la Sierra de Guadarrama ofrecen información y consejos prácticos​.

    Escapadas y Zonas Naturales: Para explorar zonas naturales y encontrar setas, puedes planificar una escapada. Por ejemplo, puedes visitar el Parque Regional de la Cuenca Alta del Manzanares, donde se encuentran diferentes variedades de setas y hongos. También puedes explorar los bosques cercanos a Madrid, como el Parque Natural de los Montes de San Miguel, donde se pueden encontrar diversos tipos de setas​.

    Escapes de Madrid: Si no tienes tiempo para una excursión larga, también puedes planificar un escape de Madrid. Hay muchas ciudades y pueblos cercanos que ofrecen paisajes naturales impresionantes y recursos para la recolección de setas. Por ejemplo, puedes visitar el Parque Natural de los Montes de San Miguel, donde se pueden encontrar diversos tipos de setas y hongos​.

En conclusión, hay muchas opciones para la recolección de setas en Madrid, tanto recreativos como con fines medicinales o culinarios. Es importante recordar siempre las precauciones y el respeto hacia la naturaleza al realizar estas actividades.","Si estás interesado en buscar setas en la Sierra de Madrid, aquí tienes algunas recomendaciones basadas en diversas fuentes:

    Respeto al Entorno Natural: Es esencial mantener el respeto por el entorno natural durante la recolección de setas. Esto implica no dañar la flora y fauna circundante y dejar el lugar tal como se encontró​.

Preparación y Seguridad: Lleva siempre un teléfono móvil con la batería cargada en caso de emergencias. También es muy recomendable ir acompañado de un experto en micología, especialmente si no estás familiarizado con las diferentes especies de setas​​.

Identificación de las Setas: Solo debes recolectar las setas que conozcas y asegurarte de que son comestibles. Es importante recolectarlas con mesura y limitar la cantidad. En caso de duda, es mejor consultar a un experto​.

Técnicas de Recolección: Los expertos sugieren recolectar las setas enteras, incluyendo la base del pie, pero con cuidado de no dañar el micelio. Deja atrás las setas viejas, en mal estado, o aquellas que se encuentren en sitios contaminados​.

Almacenamiento Adecuado: Usa cestas de mimbre o recipientes que permitan la dispersión de esporas y eviten el apelmazamiento o fermentación de las setas. Evita el uso de bolsas de plástico. Una vez recolectadas, se recomienda consumirlas pronto, ya que son perecederas​​.

Evitar Falsas Creencias: No te fíes de reglas caseras o trucos para determinar si una seta es comestible. Estos métodos no son confiables y pueden ser peligrosos​.

En cuanto a lugares recomendados, puedes considerar la zona de Alameda del Valle​​, así como el área que va desde el Monasterio del Paular hasta el Puerto de Cotos, donde encontrarás numerosos pinares y bosques ricos en níscalos​.

Recuerda que la recolección de setas debe hacerse de manera responsable y siempre priorizando la seguridad y el conocimiento sobre las diferentes especies.",0.7456867413782972,0.9999999999666667,0.47619047619047616,0.75
¿Qué sería recomendable si alguien quiere ir a coger setas en el norte de Madrid?,"['Los mejores lugares para buscar setas en la Comunidad de Madrid\n\nEmpieza la temporada fetiche de los micólogos: las setas ya han llegado a los bosques de toda España.\n\nMadrid Secreto Madrid Secreto\t• septiembre 30, 2022\nLos mejores lugares para buscar setas en la Comunidad de Madrid\n\nEl 23 de septiembre empieza el otoño y con él la temporada estrella de uno de los manjares de la gastronomía castellana: las setas. En España hay una larga y fuerte tradición micológica y en Madrid, en concreto, una gran cultura en lo que se refiere a la búsqueda de setas. Tras las últimas (y casi primeras) lluvias de verano, surgen los primeros níscalos en los bosques de la región. Además, desde septiembre y hasta diciembre las escapadas a la sierra madrileña en cercanías son gratis.\n¿Dónde recoger setas en la Comunidad de Madrid?\n\nComo en cualquier ámbito de la vida, cada maestrillo tiene su librillo y cada aficionado a la recolección de setas tiene sus sitios predilectos. No hay las mismas variedades de setas en cada zona, ni tampoco la misma afluencia de gente. No obstante, estos son algunos de los parques, puertos, montes, valles o bosques de Madrid donde más posibilidades tienes de llevarte un buen puñado de hongos.\n\nPero antes hay que tener en cuenta que esta actividad está regulada por Uso y Gestión del Parque Nacional de la Sierra de Guadarrama en su artículo 59. Y aunque está permitida siempre que sea de forma recreativa, es importante consultar los permisos y acotaciones de las diferentes zonas.\n\n    Puerto de Cotos\n    Alameda del Valle\n    Puerto de la Fuenfría\n    Puerto de Canencia\n    Monte Abantos\n    Valle de Lozoya\n    Valle del Paular\n    Puerto de los Leones\n\nRecomendaciones generales\n\n    Entre los aficionados a recoger setas en Madrid hay una serie de recomendaciones que casi son tomadas como dogmas o como obligaciones en la recolección:\n    Las setas se recogen en cestas y nunca en bolsas de plástico. De esta forma están ventiladas y sus esporas se reparten por el monte\n    No hay que ser avaricioso: la cantidad recolectada no debe exceder un número de setas que no sea razonable. Esto puede llegar a estar regulado en un máximo de 5 kg.\n    Las setas se cortan por el tallo (por eso es aconsejable ir acompañado de un cuchillo o navaja). Nunca hay que arrancarla. De este modo se consigue que vuelvan a crecer.\n    Es importante no recolectar ejemplares jóvenes porque al hacerlo se evita la multiplicación. Lo mismo ocurre con los ejemplares muy maduros.\n    Deja el monte tal y como te lo encontraste: hay que respetar el entorno.\n\n¿Cómo saber si son comestibles?\n\nEl primer consejo que se puede ofrecer ante esta cuestión es que si no tienes la certeza absoluta de que sea comestible, lo mejor es ser prudente y descartar su ingesta.\n\nLa Comunidad de Madrid tiene una entrada en su portal de comunicación en la que señala que ""las setas son un manjar que te puede salir muy caro. La mejor seta no vale una intoxicación"" y añade que ""en la Comunidad de Madrid existen setas muy tóxicas y mortales"". En esta entrada también ofrecen trucos para identificar qué setas silvestres no se deben recoger.\n\nPara profundizar y poder realizar esta actividad con mayor seguridad y conocimiento es recomendable realizar algún curso sobre setas, hongos o micología en general. La propia Comunidad de Madrid tiene una Red de Centros sobre educación ambiental que ofrece este tipo de formación, y también son muy recomendables las Jornadas Micológicas Sierra de Madrid, de la Central de Reservas de la Sierra de Guadarrama.\n\nY ya que sales a buscar setas, te recomendamos que aproveches el viaje y descubras algunos de los pueblos más bonitos de la Comunidad de Madrid porque puede que te pillen cerca.', '10 Consejos Básicos para coger Setas en la Sierra Norte de Madrid\n\nCada vez más personas sienten la llamada de las setas. En otoño, la Sierra Norte de Madrid se convierte en un lugar ideal para la micología y cientos de personas que acuden en su búsqueda.\n\nSin duda, coger setas es una actividad muy sana, pues se está en contacto directo con la naturaleza, se camina y, además, es posible observar y valorar la gran variedad micológica existente en la sierra norte madrileña.\n\nSin embargo, para que la recogida de setas tenga un final feliz y se puedan degustar con total tranquilidad en casa, conviene tener en cuenta y seguir una serie de recomendaciones.\n\n\n\nEstos son los 10 consejos básicos para coger setas:\n\n1. Siempre hay que respetar el entorno natural\n\n2. Es recomendable llevar el teléfono móvil, con la batería cargada, por si surge algún imprevisto\n\n3. Es muy conveniente ir acompañado por algún experto\n\n4. Solo hay que coger las setas que se conozcan y hacerlo con mesura, en cantidad limitada\n\n5. Aunque se conozca perfectamente la especie recolectada, se recomienda dejar las setas viejas o en malas condiciones, así como las que estén en sitios contaminados o próximos a ellos.\n\n6. Los expertos recomiendan coger las setas enteras (no cortarlas), con la base del pie incluida, pero teniendo especial cuidado para no dañar el micelio.\n\n7. Para guardar las setas que se vayan recogiendo hay que utilizar cestas de mimbre o recipientes adecuados para que las setas puedan dispersar sus esporas, y para que no se apelmacen o fermenten. No hay que usar bolsas de plástico.\n\n8. Una vez recolectadas las setas, aunque se guarden en el frigorífico, conviene consumirlas pronto porque son perecederas.\n\n9. No hay que hacer caso a falsas reglas ni usar trucos caseros para ver si una seta es comestible o no.\n\n10. Si las setas son para estudio y análisis por parte de algún especialista, conviene llevar las setas completas (sin cortar), pero solo los ejemplares estrictamente necesarios.', 'Los mejores lugares para buscar setas en Madrid (y encontrarlas)\nBoletus, champiñones silvestres o setas de cardo son codiciadas por todos aquellos que, con las primeras lluvias, se lanzan a recorrer Canencia, Cotos, La Fuenfría o tantos otros lugares de la geografía micológica de la región\n\nEstamos en otoño. Bueno, en realidad estamos en otoño desde hace mucho, otra cosa es que las temperaturas no acompañaran a la estación y fueran más propias del verano o la primavera. Al menos hasta ahora, cuando el frío comienza a hacer acto de presencia.\n\nCon el aviso de las primeras lluvias está claro que estamos en tiempo de setas. Un plan perfecto en una región como la madrileña con frondosos bosques y vaguadas ricas en este producto de temporada. Una recogida de setas que aúna la diversión de un paseo por el bosque con la experiencia gastronómica posterior.\n\nCaber apuntar que la Comunidad de Madrid tiene una entrada en su portal de comunicación en la que señala que ""las setas son un manjar que te puede salir muy caro. La mejor seta no vale una intoxicación"" y añade que ""en la Comunidad de Madrid existen setas muy tóxicas y mortales"". En esta entrada también ofrecen trucos para identificar qué setas silvestres no se deben recoger.\n\nPara profundizar y poder realizar esta actividad con mayor seguridad y conocimiento es recomendable realizar algún curso sobre setas, hongos o micología en general. La propia Comunidad de Madrid tiene una Red de Centros sobre educación ambiental que ofrece este tipo de formación, y también son muy recomendables las Jornadas Micológicas Sierra de Madrid, de la Central de Reservas de la Sierra de Guadarrama.\nPueblos y valles en los que recoger setas en Madrid\n\nAlameda del Valle\n\nEsta localidad es una de las más famosas dentro de la Comunidad de Madrid para buscar setas en los bosques cercanos, y donde podemos recoger setas como boletus, seta de cardo o perrechico. Hay que tener cuidado, ya que también podemos encontrar otras especies tóxicas que nos pueden confundir, por lo que debemos estar seguros de que la setas que estamos recolectando son comestibles.\n\nAlameda del Valle es un pequeño pueblo en el que viven unos 200 vecinos, situado en la Sierra Norte de Madrid. Se encuentra en un atractivo entorno natural, el Valle Alto del Lozoya, entre la Sierra de Guadarrama y los Altos de Hontanar, muy próximo al Puerto de Malagosto.\n\nPuerto de Canencia\n\nPuerto de Canencia es otro de los parajes en los que abundan las setas, ubicada en la vertiente sur de la Sierra de Guadarrama y a unos 9 kilómetros de la localidad del mismo nombre, Canencia. En esta zona podemos encontrar boletus edulis, setas de fraile, níscalos o seta de cardo entre otras, aunque podemos toparnos con muchas más especies.\n\nValle del Paular\n\nConocido también con el nombre de Valle del Lozoya, está situado en la Sierra de Guadarrama y es otro de los destinos ideales para quienes desean recoger setas.\n\nUn lugar perfecto para quienes quieran buscar setas está situado entre el Monasterio del Paular hasta el Puerto de Cotos donde encontraremos numerosos pinares y bosques llenos de níscalos o champiñones silvestres. En esta zona también existen numerosas setas toxicas, por lo que deberemos tener cuidado con las que recogemos.\n\nPuerto de Cotos\n\nEl Puerto de Cotos es otro de los paraísos que pueden encontrar los buscadores de setas en la comunidad madrileña. Se halla en plena Sierra de Guadarrama, en la frontera entre Madrid y Segovia. En esta zona podemos encontrar principalmente níscalos en los pinares de la zona.\n\nPuerto de los Leones\n\nEs otro de los principales lugares de la comunidad madrileña para encontrar abundantes y diversos tipos de setas donde veremos boletus edulis y níscalos, en el Valle de Pinares Llanos, muy cerca de la zona de Collado del Hornillo.']","Si alguien quiere ir a coger setas en el norte de Madrid, hay varios lugares recomendados que se encuentran en la Comunidad de Madrid y que ofrecen una amplia variedad de setas. Aquí te presento tres opciones:

1. Puente de Cotos: Este paraje se encuentra en la Sierra de Guadarrama y es conocido por su rica flora y fauna. En particular, se pueden encontrar níscalos y setas de cardo. Es importante tener en cuenta que es recomendable ir acompañado por un experto y solo recoger las setas que se conozcan y hacerlo con moderación, ya que algunas especies pueden ser tóxicas.

2. Puerto de Canencia: Esta localidad se encuentra en la vertiente sur de la Sierra de Guadarrama y es un destino popular para buscar setas. En particular, se pueden encontrar boletus edulis, setas de fraile y níscalos. Sin embargo, es importante tener cuidado con las especies tóxicas que pueden encontrarse en esta zona.

3. Valle del Paular: Este parque se encuentra en la Sierra de Guadarrama y es conocido por su rica flora y fauna. En particular, se pueden encontrar boletus edulis y níscalos. Sin embargo, es importante tener en cuenta que es recomendable ir acompañado por un experto y solo recoger las setas que se conozcan y hacerlo con moderación, ya que algunas especies pueden ser tóxicas.

En resumen, si alguien desea ir a coger setas en el norte de Madrid, es recomendable elegir alguno de estos lugares, ya que ofrecen una amplia variedad de setas y están bien protegidos por la ley.","Si estás interesado en buscar setas en la Sierra de Madrid, aquí tienes algunas recomendaciones basadas en diversas fuentes:

    Respeto al Entorno Natural: Es esencial mantener el respeto por el entorno natural durante la recolección de setas. Esto implica no dañar la flora y fauna circundante y dejar el lugar tal como se encontró​.

Preparación y Seguridad: Lleva siempre un teléfono móvil con la batería cargada en caso de emergencias. También es muy recomendable ir acompañado de un experto en micología, especialmente si no estás familiarizado con las diferentes especies de setas​​.

Identificación de las Setas: Solo debes recolectar las setas que conozcas y asegurarte de que son comestibles. Es importante recolectarlas con mesura y limitar la cantidad. En caso de duda, es mejor consultar a un experto​.

Técnicas de Recolección: Los expertos sugieren recolectar las setas enteras, incluyendo la base del pie, pero con cuidado de no dañar el micelio. Deja atrás las setas viejas, en mal estado, o aquellas que se encuentren en sitios contaminados​.

Almacenamiento Adecuado: Usa cestas de mimbre o recipientes que permitan la dispersión de esporas y eviten el apelmazamiento o fermentación de las setas. Evita el uso de bolsas de plástico. Una vez recolectadas, se recomienda consumirlas pronto, ya que son perecederas​​.

Evitar Falsas Creencias: No te fíes de reglas caseras o trucos para determinar si una seta es comestible. Estos métodos no son confiables y pueden ser peligrosos​.

En cuanto a lugares recomendados, puedes considerar la zona de Alameda del Valle​​, así como el área que va desde el Monasterio del Paular hasta el Puerto de Cotos, donde encontrarás numerosos pinares y bosques ricos en níscalos​.

Recuerda que la recolección de setas debe hacerse de manera responsable y siempre priorizando la seguridad y el conocimiento sobre las diferentes especies.",,0.9999999999666667,0.5833333333333334,1.0
qué comidas puedo probar en mi viaje a Japón?,"['Onigiri\n\nUna comida popular para comer por el camino. Los onigiri consisten esencialmente en arroz envuelto en algas. Los encontrarás en todas las tiendas de conveniencia y son muy baratos.\n\nLos onigiri también son una opción popular para desayunar en Japón. A mí no me encantan, pero Christine comió bastantes, ya que ella no come carne.\n\nUdon\n\nUn tipo especial de noodles japoneses. Los noodles Udon son gruesos y gomosos, y normalmente se hacen con harina de trigo y agua salada. A mí me gustan mucho. En los restaurantes hay muchas recetas distintas de noodles Udon.\n\nUno de los platos japoneses con noodles Udon más comunes es el Kitsune Udon.\n\nRamen\n\nOtro tipo de noodles japoneses que se han hecho famosos en el mundo entero. El Ramen es una sopa de noodles con sabroso caldo y se le considera una de las comidas japonesas más populares. A los habitants locales les encanta.\n\nHay restaurantes de ramen prácticamente por todo Japón. Te pueden servir Ramen con varios ingredientes como carne, huevo y verduras.\n\nSoba\n\nEl tercer tipo de noodle que es popular en Japón es el Soba, también conocido como noodle de trigo sarraceno. Pueden servirse en sopas con otros ingredientes o fríos con guarnición.\n\nSin embargo, a la mayoría de locales les gustan los Soba calientes, y yo también los prefiero así.\n\nTernera Wagyu/Kobe\n\nLa carne más cara del mundo, conocida como ternera de Kobe o Wagyu. Otra especialidad japonesa. La he probado varias veces y, aunque es muy cara, es la mejor carne que he comido en toda mi vida. Se deshace en la boca de una forma ridícula.\n\nTonkatsu\n\nLa chuleta de cerdo empanada y frita es una comida típica japonesa. La introdujeron originariamente los europeos, pero los japoneses la hicieron suya.\n\nIncluso tienen la salsa tonkatsu. Como ya he mencionado, el tonkatsu es uno de los aderezos más comunes para el arroz al curry.\n\nDonburi\n\nSi quieres comer como los locales, el Donburi es una opción muy habitual para comer entre los trabajadores japoneses. Este plato se prepara friendo o hirviendo varios tipos de carne, pescado y verdura, y se sirve con arroz al vapor en grandes boles que se llaman Donburi.\n\nLos tipos más comunes de Donburi son el Gyudon, el Oyakodon y el Katsudon.\n\nNatto\n\nEl natto es el desayuno tradicional de Japón. Sin embargo, hoy en día se sirve sobre todo en hoteles, dado que los locales ya no tienen tiempo de preparar un plato que cuesta tanto de hacer.\n\nEn esencia, el natto consiste en habas de soja fermentadas. Tiene un olor fuerte que recuerda al queso mohoso y que no a todo el mundo le gusta, aunque, por otro lado, a muchos japoneses les encanta.\n\nOden\n\nEs un plato japonés clásico para comer durante el invierno. Es un estofado con diversas verduras y proteínas. Se prepara en una cazuela caliente (nabemono).\n\nMiso\n\nUna sopa clásica que consiste en un caldo dashi al que se le añade tofu, cebolla verde y algas. La sopa Miso normalmente se sirve como acompañamiento tanto para desayunar como para comer o cenar.\n\nGyoza\n\nLos dumplings japoneses son otra especialidad que no deberías perderte. Suelen rellenarse de cerdo picado, col, setas y cebolla verde.\n\nLos dumplings Gyoza normalmente se fríen por un lado y después se cocinan al vapor durante 2-3 minutos hasta asegurarse de que el relleno está cocinado y jugoso.\n\nOkonomiyaki\n\nLa tortita japonesa, ¡que es especialmente famosa en Osaka!\n\nSe hace mezclando col cortada a tiras y una masa, así como otros ingredientes, y se fríe como una tortita. Si visitas Osaka, verás restaurantes y puestos de Okonomiyaki en muchos lugares.', 'Comida Japonesa – 35 platos tradicionales que comer en Japón\n¿Quieres saber más sobre la Comida y la Cocina Japonesas? Aquí tienes una lista de los 35 platos tradicionales que deberías comer cuando viajes a Japón.\n\nHe estado en Japón varias veces y, como puede que sepas por otros artículos, me encanta, y la comida japonesa es muy sabrosa. Ciertamente, no me gusta todo, pero es muy interesante porque la cultura gastronómica japonesa es muy diferente de la sueca.\nYakitori\n\nLas brochetas de pollo son un plato clásico en Japón. Se las conoce localmente como Yakitori y son deliciosas. Las brochetas se preparan a la parrilla sobre carbón y normalmente se sazonan con salsa tare o sal.\n\n¡Los Yakitori son, definitivamente, uno de mis platos favoritos cuando se trata de comida japonesa! Si viajas a Tokio, deberías ir a Omoide Yokocho, en Shinjuku, famoso por sus pequeños puestos de Yakitori.\n\nYakiniku\n\nPor otra parte, Yakiniku es cualquier tipo de carne a la parrilla, aunque normalmente es ternera.\nKare raisu\n\nPuede que parezca que el arroz al curry, o el curry en general, no sea muy japonés, ya que se asocia principalmente a la India. Pero el curry japonés no es como el curry indio y, en realidad, fue introducido por los británicos.\n\nExisten curris japoneses de varios tipos, con y sin carne, o curry vegetariano o vegano. Aunque el arroz al curry más clásico va acompañado de chuletas de cerdo fritas.\n\nEn casi cualquier ciudad japonesa, encontrarás casas de curry. Suelen ser bastante baratas y, definitivamente, una de las mejores comidas japonesas que comer con poco presupuesto. Las grandes comidas cuestan a partir de 500-700 yenes.\n\nTakoyaki\n\nPuede que sea uno de los platos tradicionales más raros de Japón. Los Takoyaki son un tipo de comida de Osaka y se sirven con orgullo.\n\nSe presentan como bolas rellenas de pulpo picado o en dados. Y eso no es tan extraño, pero el aderezo que le ponen encima se mueve como si fuesen ""gusanos"" cuando te lo comes. Aparte de eso, los Takoyaki son una de las mejores comidas callejeras de Japón.\n\nTempura\n\nA las gambas o verduras fritas se las conoce como tempura. Hay varias cadenas de comida rápida que solo sirven varios tipos de tempura con arroz. Es uno de los platos japoneses clásicos y no deberías perdértelo.\n\nSushi\n\nEl rey de toda la comida japonesa, el sushi, famoso en todo el mundo. El sushi básicamente es pescado servido encima de arroz avinagrado preparado.\n\nAlgunos de los tipos más famosos de sushi incluyen salmón, atún, seriola y rollos de maki, que se enrollan con algas alrededor del arroz. El sushi solía ser muy caro antes de que se comercializara a través de las cintas transportadoras de sushi.\n\nUno de mis restaurantes de sushi favoritos es el Genki Sushi, una cadena japonesa conocida por ofrecer gran calidad a precios bajos. Es un restaurante de cinta transportadora de sushi, pero pides en una pantalla de ordenador y entonces te preparan el sushi.\n\nLos precios empiezan a partir de los 108 yenes por 2 piezas, que es menos de 1 EUR.\n\nSashimi\n\nA veces los extranjeros confundimos sashimi con sushi. Pero son muy fáciles de distinguir. Básicamente, el sashimi es pescado crudo cortado a tiras finas que se sirve acompañado de salsa de soja.\n\nOnigiri\n\nUna comida popular para comer por el camino. Los onigiri consisten esencialmente en arroz envuelto en algas. Los encontrarás en todas las tiendas de conveniencia y son muy baratos.\n\nLos onigiri también son una opción popular para desayunar en Japón. A mí no me encantan, pero Christine comió bastantes, ya que ella no come carne.\n\nUdon', '30 Platos típicos de Japón | Tienes que probarlos [Con Imágenes]\nCada vez son más las personas que deciden visitar «el país del Sol naciente» en sus vacaciones ¡Y no es de extrañar! Son muchos los motivos que hacen de este país uno de los destinos más interesantes del mundo: hay cientos de lugares que ver en Japón realmente fantásticos, es un país seguro, su gente es acogedora, la cultura japonesa es realmente fascinante y la gastronomía… ¡una auténtica maravilla! En este artículo precisamente queremos hablarte de ella a través de una selección de 20 platos típicos de Japón que tienes que probar. ¿Nos acompañas en este viaje gastronómico?\nGastronomía Japonesa | Breve introducción\nMuchas personas tienden a pensar que la gastronomía de Japón es Sushi, Ramen y poco más… ¡Nada más lejos de la realidad! Es cierto que estos platos son los más conocidos porque han conseguido implantarse en occidente a través de una gran multitud de restaurantes japoneses cuya oferta se limita a ellos. Pero podemos afirmar sin temor a equivocarnos que la gastronomía japonesa es una de las más ricas y variadas de todo el mundo.\n\nEn el pasado los platos típicos de Japón eran prácticamente una adaptación de la gastronomía china que tenía una gran influencia en el país. En cualquier caso, fue a partir de la Edad Media cuando la cocina japonesa comenzó a evolucionar, encontrar su propio camino y desarrollar la amplia variedad de platos y preparados que podemos encontrar hoy en día. No podemos olvidar que, especialmente en las ciudades japonesas, existe una gran tendencia a comer y cenar fuera de casa. Esto propicia la aparición de un gran volumen de restaurantes, tabernas y puestos de street food, que a su vez, enriquecen la gastronomía japonesa.\nEn líneas generales, el arroz y la sopa de miso son considerados como los ingredientes base en la cocina japonesa, mientas que el pescado, el marisco, los encurtidos y las tempuras son algunas de las guarniciones más habituales. A pesar de ello, debido a la gran variedad de platos japoneses, que incluso varía por regiones, es difícil englobar bajo una misma definición todo lo que cobija.\n30 Platos típicos de Japón que debes probar\n1. Sushi | 寿司\nCómo no podía ser de otra manera, nuestra selección de platos típicos de Japón debía empezar por su plato más internacional: el sushi. Se trata de un plato cuya base es el arroz cocido y adobado con vinagre de arroz, vino de arroz, azúcar y sal; si bien es cierto que se suele asociar el sushi al pescado y el marisco como acompañantes, existen muchas variedades de sushi que están acompañadas de tortilla, verduras y otros alimentos.\n\nDe hecho, la palabra sushi hace referencia al método de preparación del arroz y no al acompañante, aunque este último es quién será el responsable de darle un sabor diferente a cada pieza. Otro ingrediente importante en el sushi es el Alga Nori, que a menudo se utiliza como envoltura o cinturón para sujetar el acompañamiento al arroz.\n\nComo ya sabrás existen muchos tipos de sushi, tanto por el acompañante, como por la forma de presentarlo. A continuación vamos a hacer un repaso de algunas de las variedades de sushi más conocidas según su presentación:']","Comida Japonesa - 35 platos tradicionales que comer en Japón

¿Quieres saber más sobre la Comida y la Cocina Japonesas? Aquí tienes una lista de los 35 platos tradicionales que deberías comer cuando viajes a Japón.

He estado en Japón varias veces y, como puede que sepas por otros artículos, me encanta, y la comida japonesa es muy sabrosa. Ciertamente, no me gusta todo, pero es muy interesante porque la cultura gastronómica japonesa es muy diferente de la sueca.

Yakitori

Las brochetas de pollo son un plato clásico en Japón. Se las conoce localmente como Yakitori y son deliciosas. Las brochetas se preparan a la parrilla sobre carbón y normalmente se sazonan con salsa tare o sal.

¡Los Yakitori son, definitivamente, uno de mis platos favoritos cuando se trata de comida japonesa! Si viajas a Tokio, deberías ir a Omoide Yokocho, en Shinjuku, famoso por sus pequeños puestos de Yakitori.

Yakiniku

Por otra parte, Yakiniku es cualquier tipo de carne a la parrilla, aunque normalmente es ternera.

Kare raisu

Puede que parezca que el arroz al curry, o el curry en general, no es muy japonés, ya que se asocia principalmente a la India. Pero el curry japonés no es como el curry indio y, en realidad, fue introducido por los británicos.

Existen curris japoneses de varios tipos, con y sin carne, o curry vegetariano o vegano. Aunque el arroz al curry más clásico va acompañado de chuletas de cerdo fritas.

En casi cualquier ciudad japonesa, encontrarás casas de curry. Suelen ser bastante baratas y, definitivamente, una de las mejores comidas japonesas que comer con poco presupuesto. Las grandes comidas cuestan a partir de 500-700 yenes.

Takoyaki

Puede que sea uno de los platos tradicionales más raros de Japón. Los Takoyaki son un tipo de comida de Osaka y se sirven con orgullo.

Se presentan como bolas rellenas de pulpo picado o en dados. Y eso no es tan extraño, pero el aderezo que le ponen encima se mueve como si fuesen ""gusanos"" cuando te lo comes. Aparte de eso, los Takoyaki son una de las mejores comidas callejeras de Japón.

Tempura

A las gambas o verduras fritas se las conoce como tempura. Hay varias cadenas de comida rápida que solo sirven varios tipos de tempura con arroz. Es uno de los platos japoneses clásicos y no deberías perdértelo.

Sushi

El rey de toda la comida japonesa, el sushi, famoso en todo el mundo. El sushi básicamente es pescado servido encima de arroz avinagrado preparado.

Algunos de los tipos más famosos de sushi incluyen salmón, atún, seriola y rollos de maki, que se enrollan con algas alrededor del arroz. El sushi solía ser muy caro antes de que se comercializara a través de las cintas transportadoras de sushi.

Uno de mis restaurantes de sushi favoritos es el Genki Sushi, una cadena japonesa conocida por ofrecer gran calidad a precios bajos. Es un restaurante de cinta transportadora de sushi, pero pides en una pantalla de ordenador y entonces te preparan el sushi.

Los precios empiezan a partir de los 108 yenes por 2 piezas, que es menos de 1 EUR.

Sashimi

A veces los extranjeros confundimos sashimi con sushi. Pero son muy fáciles de distinguir. Básicamente, el sashimi es pescado crudo cortado a tiras finas que se sirve acompañado de salsa de soja.

Onigiri

A veces los extranjeros confundimos sashimi con sushi. Pero son muy fáciles de distinguir. Básicamente, el onigiri es arroz envuelto en algas. Los encontrarás en todas las tiendas de conveniencia y son muy baratos.

Los onigiri también son una opción popular para desayunar en Japón. A mí no me encantan, pero Christine comió bastantes, ya que ella no come carne.

Udon

Un tipo especial de noodles japoneses. Los noodles Udon son gruesos y gomosos, y normalmente se hacen con harina de trigo y agua salada. A mí me gustan mucho. En los restaurantes hay muchas recetas distintas de noodles Udon.

Uno de los platos japoneses con noodles Udon más comunes es el Kitsune Udon.

Ramen

Otro tipo de noodles japoneses que se han hecho famosos en el mundo entero. El Ramen es una sopa de noodles con sabroso caldo y se le considera una de las comidas japonesas más populares. A los habitants locales les encanta.

Hay restaurantes de ramen prácticamente por todo Japón. Te pueden servir Ramen con varios ingredientes como carne, huevo y verduras.

Soba

El tercer tipo de noodle que es popular en Japón es el Soba, también conocido como noodle de trigo sarraceno. Pueden servirse en sopas con otros ingredientes o fríos con guarnición.

Sin embargo, a la mayoría de locales les gustan los Soba calientes, y yo también los prefiero así.

Ternera Wagyu/Kobe

La carne más cara del mundo, conocida como ternera de Kobe o Wagyu. Otra especialidad japonesa. La he probado varias veces y, aunque es muy cara, es la mejor carne que he comido en toda mi vida. Se deshace en la boca de una forma ridícula.

Tonkatsu

La chuleta de cerdo empanada y frita es una comida típica japonesa. La introdujeron originariamente los europeos, pero los japoneses la hicieron suya.

Incluso tienen la salsa tonkatsu. Como ya he mencionado, el tonkatsu es uno de los aderezos más comunes para el arroz al curry.

Donburi

Si quieres comer como los locales, el Donburi es una opción muy habitual para comer entre los trabajadores japoneses. Este plato se prepara friendo o hirviendo varios tipos de carne, pescado y verdura, y se sirve con arroz al vapor en grandes boles que se llaman Donburi.

Los tipos más comunes de Donburi son el Gyudon, el Oyakodon y el Katsudon.

Natto

El natto es el desayuno tradicional de Japón. Sin embargo, hoy en día se sirve sobre todo en hoteles, dado que los locales ya no tienen tiempo de preparar un plato que cuesta tanto de hacer.

En esencia, el natto consiste en habas de soja fermentadas. Tiene un olor fuerte que recuerda al queso mohoso y que no a todo el mundo le gusta, aunque, por otro lado, a muchos japoneses les encanta.

Oden

Es un plato japonés clásico para comer durante el invierno. Es un estofado con diversas verduras y proteínas. Se prepara en una cazuela caliente (nabemono).

Miso

Una sopa clásica que consiste en un caldo dashi al que se le añade tofu, cebolla verde y algas. La sopa Miso normalmente se sirve como acompañamiento tanto para desayunar como para comer o cenar.

Gyoza

Los dumplings japoneses son otra especialidad que no deberías perderte. Suelen rellenarse de cerdo picado, col, setas y cebolla verde.

Los dumplings Gyoza normalmente se fríen por un lado y después se cocinan al vapor durante 2-3 minutos hasta asegurarse de que el relleno está cocinado y jugoso.

Okonomiyaki

La tortita japonesa, ¡que es especialmente famosa en Osaka!

Se hace mezclando col cortada a tiras y una masa, así como otros ingredientes, y se fríe como una tortita. Si visitas Osaka, verás restaurantes y puestos de Okonomiyaki en muchos lugares.","Durante tu viaje a Japón, hay una gran variedad de platos tradicionales que puedes probar. Aquí tienes algunas recomendaciones basadas en artículos en español:

    Sushi: Este es el plato más internacional de Japón. Se basa en arroz cocido y adobado con vinagre de arroz, vino de arroz, azúcar y sal. Aunque se asocia comúnmente con pescado y mariscos, también hay variedades que incluyen tortilla, verduras y otros ingredientes. Existen varios tipos de sushi, como Maki, Nigiri y Oshi​

Onigiri: Son bolas o triángulos de arroz con un relleno en su interior y toppings en el exterior, generalmente envueltos en alga nori. Tradicionalmente se rellenan con ciruela encurtida, salmón, kombu o atún, aunque hay muchas variantes disponibles​

Sashimi: Consiste en finos cortes de pescado y marisco crudos, normalmente acompañados de salsa de soja, jengibre y wasabi. La calidad de la materia prima es clave en este plato, y en Japón se utiliza pescado muy fresco​

Yakisoba: Son tallarines fritos preparados con verduras, carne y fideos de trigo sarraceno. Aunque de origen chino, este plato se ha integrado completamente en la gastronomía japonesa y es común en festivales tradicionales y tiendas de conveniencia​

Ramen: De origen chino pero adaptado a la cocina japonesa, el ramen incluye un caldo a base de miso, carne, algas y salsa de soja, acompañado de fideos de trigo. Hay varias versiones regionales en Japón​

Sopa de Miso: Hecha con pasta de miso (soja) y un caldo dashi, generalmente de mariscos, carne o pescado. Se acompaña con alga wakame, puerro, cebolleta y tofu​

Yakitori: Son brochetas de pollo asadas a la parrilla y sazonadas con salsa tare o sal. Es un plato clásico en Japón, especialmente popular en Tokio​

Yakiniku: Se refiere a cualquier tipo de carne a la parrilla, comúnmente ternera. Es un plato disfrutado ampliamente en Japón​

Kare Raisu (Arroz al Curry): Aunque se asocia más con la India, el curry japonés, introducido por los británicos, tiene su propia variante y es muy popular en Japón​

Takoyaki: Bolas rellenas de pulpo, un plato tradicional de Osaka y una de las comidas callejeras más populares de Japón​

Tempura: Gambas o verduras fritas conocidas como tempura, servidas comúnmente con arroz. Es un plato clásico en Japón​

Estos platos ofrecen un amplio espectro de sabores y texturas que son esenciales en la gastronomía japonesa, brindándote una experiencia culinaria auténtica y diversa durante tu viaje.",0.7041386942410169,0.9999999999666667,1.0,0.9230769230769231
me sugieres algún plato para cuando vaya a Japón?,"['30 Platos típicos de Japón | Tienes que probarlos [Con Imágenes]\nCada vez son más las personas que deciden visitar «el país del Sol naciente» en sus vacaciones ¡Y no es de extrañar! Son muchos los motivos que hacen de este país uno de los destinos más interesantes del mundo: hay cientos de lugares que ver en Japón realmente fantásticos, es un país seguro, su gente es acogedora, la cultura japonesa es realmente fascinante y la gastronomía… ¡una auténtica maravilla! En este artículo precisamente queremos hablarte de ella a través de una selección de 20 platos típicos de Japón que tienes que probar. ¿Nos acompañas en este viaje gastronómico?\nGastronomía Japonesa | Breve introducción\nMuchas personas tienden a pensar que la gastronomía de Japón es Sushi, Ramen y poco más… ¡Nada más lejos de la realidad! Es cierto que estos platos son los más conocidos porque han conseguido implantarse en occidente a través de una gran multitud de restaurantes japoneses cuya oferta se limita a ellos. Pero podemos afirmar sin temor a equivocarnos que la gastronomía japonesa es una de las más ricas y variadas de todo el mundo.\n\nEn el pasado los platos típicos de Japón eran prácticamente una adaptación de la gastronomía china que tenía una gran influencia en el país. En cualquier caso, fue a partir de la Edad Media cuando la cocina japonesa comenzó a evolucionar, encontrar su propio camino y desarrollar la amplia variedad de platos y preparados que podemos encontrar hoy en día. No podemos olvidar que, especialmente en las ciudades japonesas, existe una gran tendencia a comer y cenar fuera de casa. Esto propicia la aparición de un gran volumen de restaurantes, tabernas y puestos de street food, que a su vez, enriquecen la gastronomía japonesa.\nEn líneas generales, el arroz y la sopa de miso son considerados como los ingredientes base en la cocina japonesa, mientas que el pescado, el marisco, los encurtidos y las tempuras son algunas de las guarniciones más habituales. A pesar de ello, debido a la gran variedad de platos japoneses, que incluso varía por regiones, es difícil englobar bajo una misma definición todo lo que cobija.\n30 Platos típicos de Japón que debes probar\n1. Sushi | 寿司\nCómo no podía ser de otra manera, nuestra selección de platos típicos de Japón debía empezar por su plato más internacional: el sushi. Se trata de un plato cuya base es el arroz cocido y adobado con vinagre de arroz, vino de arroz, azúcar y sal; si bien es cierto que se suele asociar el sushi al pescado y el marisco como acompañantes, existen muchas variedades de sushi que están acompañadas de tortilla, verduras y otros alimentos.\n\nDe hecho, la palabra sushi hace referencia al método de preparación del arroz y no al acompañante, aunque este último es quién será el responsable de darle un sabor diferente a cada pieza. Otro ingrediente importante en el sushi es el Alga Nori, que a menudo se utiliza como envoltura o cinturón para sujetar el acompañamiento al arroz.\n\nComo ya sabrás existen muchos tipos de sushi, tanto por el acompañante, como por la forma de presentarlo. A continuación vamos a hacer un repaso de algunas de las variedades de sushi más conocidas según su presentación:', 'Chawanmushi\n\nChawanmushi significa, literalmente, taza de té al vapor, y es un plato de crema de huevo único de Japón. A diferencia de otras cremas de huevo, no es dulce sino que se sirve con ingredientes como setas shiitake, kamaboko, ginkgo y gamba hervida.\n\nSe sirve en un recipiente que parece una taza de té, y de ahí el nombre de Chawanmushi.\n\nTeppanyaki\n\nOtra experiencia gastronómica tradicional de Japón que no deberías perderte es el Teppanyaki, que es, en esencia, una cena en la que el chef cocina la comida delante de ti.\n\nNo hay normas sobre lo que se puede servir, pero normalmente hay un menú cerrado del que elegir. ¡Seguro que será un recuerdo divertido!\n\nSukiyaki\n\nOtro plato japonés famoso que consiste en carne cortada en finas tiras que se cuecen o se cocinan lentamente en la mesa. Se sirven al estilo nabemono (olla caliente japonesa).\n\nKaiseki – Elegante cena japonesa\n\nSi quieres comer como los reyes japoneses en un entorno tradicional, deberías probar el Kaiseki, un tipo de cena elegante japonesa en la que se sirve una cena de muchos platos.\n\n¿Qué comen los japoneses para desayunar?\n\nBien, hay una gran diferencia entre el desayuno japonés tradicional y lo que la mayoría de locales comen hoy en día. Esto se debe a lo rápido que ha cambiado el funcionamiento de la sociedad, y a que actualmente la mayoría de la gente dispone de un tiempo limitado, por lo que eligen opciones de comida más rápidas.\nAntaño era común que la mujer preparara el desayuno. Hoy en día, tanto las mujeres como los hombres suelen trabajar en trabajos a tiempo completo y, en consecuencia, muchos japoneses compran comida preparada en tiendas de conveniencia para comer por el camino.\nAlgunos platos tradicionales para desayunar en Japón\n\n    Natto\n    Gohan\n    Miso Shiru\n    Tamago Kake Gohan\n    Postres japoneses\n\nAdemás de postres dulces, también hay varias frutas endémicas de Japón que a los locales les encantan y que comen como postres.\n\n    Wagashi\n    Mochi\n    Daifuku\n    Dango\n    Ammitsu\n    Higashi\n    Namagashi\n    Yokan\n    Helado de Matcha\n\nLicores y bebidas japonesas\n\n    Sake\n    Awamori\n    Whiskey japonés\n    Chuhai\n    Kombucha\n    Té sakura\n    Té matcha\n    \nMás sobre la Gastronomía Japonesa\n\nLa gastronomía japonesa consiste tanto en platos regionales como en comida tradicional de Japón. La comida es muy importante y crear comidas sabrosas y elegantes está considerado un arte. El marisco es muy común, así como otros tipos de carne.\n\nSin embargo, hay varios platos tradicionales que son vegetarianos debido al budismo. El sushi es la comida japonesa más conocida alrededor del mundo, pero otras especialidades como el Ramen, la Tempura y los Yakitori, que también se están haciendo famosos.\n\nDesde 2018, Japón es el país con más restaurantes con 3 estrellas Michelin del mundo, siendo Tokio la ciudad donde se encuentran la mayoría de ellos.\n¿La comida japonesa es saludable?\n\nLos platos más tradicionales de Japón se consideran saludables y el nivel de obesidad es uno de los más bajos del mundo. Por otro lado, en las Islas de Okinawa, los locales tiene una de las esperanzas de vida más largas del mundo.\nSin embargo, también hay comida rápida en Japón, que no es particularmente saludable, pero que tampoco es tan poco sana como la comida rápida americana, por ejemplo.']","Claro, aquí te presento algunos platos típicos de Japón que te recomiendo probar:

    Sushi: Este plato es una de las opciones culinarias más conocidas de Japón y se caracteriza por el uso de arroz y aderezos como el aceite de sésamo y el vinagre de arroz. Hay muchos tipos de sushi disponibles, desde los simples y básicos hasta los más elaborados y ricos.

    Chawanmushi: Un plato de crema de huevo con arroz y otros ingredientes como setas y pescado, que se sirve en un recipiente similar a una taza de té.

    Sukiyaki: Una cena en la que se cocina la comida al estilo nabemono, una olla caliente con salsa de soja y carne picada.

    Kaiseki: Una cena elegante japonesa que incluye una variedad de platos y se sirven en un ambiente formal.

    Natto: Un plato de sabor a pescado con un sabor fuerte y amargo, que es una de las bebidas y alimentos más populares en Japón.

    Gohan: Un plato de arroz con carne y verduras, que es una de las principales recetas japonesas.

    Miso Shiru: Un plato de arroz con salsa de miso y otros condimentos.

    Tamago Kake Gohan: Un plato de arroz con carne y verduras, acompañado de una salsa de miso.

    Postres japoneses: Japón es conocido por sus postres, como el wagashi, el mochi, el daifuku, el dango, el ammitsu, el higashi, el namagashi y el yokan.

    Licores y bebidas japonesas: Japón es conocido por sus licores y bebidas, como el sake, el awamori, el whiskey japonés, el chuhai, el kombucha, el té sakura y el té matcha.

Estos platos son solo algunos de los muchos que se pueden disfrutar en Japón, pero te darán una buena idea de la rica y diversa gastronomía del país.","Durante tu viaje a Japón, hay una gran variedad de platos tradicionales que puedes probar. Aquí tienes algunas recomendaciones basadas en artículos en español:

    Sushi: Este es el plato más internacional de Japón. Se basa en arroz cocido y adobado con vinagre de arroz, vino de arroz, azúcar y sal. Aunque se asocia comúnmente con pescado y mariscos, también hay variedades que incluyen tortilla, verduras y otros ingredientes. Existen varios tipos de sushi, como Maki, Nigiri y Oshi​

Onigiri: Son bolas o triángulos de arroz con un relleno en su interior y toppings en el exterior, generalmente envueltos en alga nori. Tradicionalmente se rellenan con ciruela encurtida, salmón, kombu o atún, aunque hay muchas variantes disponibles​

Sashimi: Consiste en finos cortes de pescado y marisco crudos, normalmente acompañados de salsa de soja, jengibre y wasabi. La calidad de la materia prima es clave en este plato, y en Japón se utiliza pescado muy fresco​

Yakisoba: Son tallarines fritos preparados con verduras, carne y fideos de trigo sarraceno. Aunque de origen chino, este plato se ha integrado completamente en la gastronomía japonesa y es común en festivales tradicionales y tiendas de conveniencia​

Ramen: De origen chino pero adaptado a la cocina japonesa, el ramen incluye un caldo a base de miso, carne, algas y salsa de soja, acompañado de fideos de trigo. Hay varias versiones regionales en Japón​

Sopa de Miso: Hecha con pasta de miso (soja) y un caldo dashi, generalmente de mariscos, carne o pescado. Se acompaña con alga wakame, puerro, cebolleta y tofu​

Yakitori: Son brochetas de pollo asadas a la parrilla y sazonadas con salsa tare o sal. Es un plato clásico en Japón, especialmente popular en Tokio​

Yakiniku: Se refiere a cualquier tipo de carne a la parrilla, comúnmente ternera. Es un plato disfrutado ampliamente en Japón​

Kare Raisu (Arroz al Curry): Aunque se asocia más con la India, el curry japonés, introducido por los británicos, tiene su propia variante y es muy popular en Japón​

Takoyaki: Bolas rellenas de pulpo, un plato tradicional de Osaka y una de las comidas callejeras más populares de Japón​

Tempura: Gambas o verduras fritas conocidas como tempura, servidas comúnmente con arroz. Es un plato clásico en Japón​

Estos platos ofrecen un amplio espectro de sabores y texturas que son esenciales en la gastronomía japonesa, brindándote una experiencia culinaria auténtica y diversa durante tu viaje.",,0.99999999995,0.8148148148148148,0.9285714285714286
voy a ir a Japón dentro de unas semanas y quisiera saber cuáles son los platos típicos,"['30 Platos típicos de Japón | Tienes que probarlos [Con Imágenes]\nCada vez son más las personas que deciden visitar «el país del Sol naciente» en sus vacaciones ¡Y no es de extrañar! Son muchos los motivos que hacen de este país uno de los destinos más interesantes del mundo: hay cientos de lugares que ver en Japón realmente fantásticos, es un país seguro, su gente es acogedora, la cultura japonesa es realmente fascinante y la gastronomía… ¡una auténtica maravilla! En este artículo precisamente queremos hablarte de ella a través de una selección de 20 platos típicos de Japón que tienes que probar. ¿Nos acompañas en este viaje gastronómico?\nGastronomía Japonesa | Breve introducción\nMuchas personas tienden a pensar que la gastronomía de Japón es Sushi, Ramen y poco más… ¡Nada más lejos de la realidad! Es cierto que estos platos son los más conocidos porque han conseguido implantarse en occidente a través de una gran multitud de restaurantes japoneses cuya oferta se limita a ellos. Pero podemos afirmar sin temor a equivocarnos que la gastronomía japonesa es una de las más ricas y variadas de todo el mundo.\n\nEn el pasado los platos típicos de Japón eran prácticamente una adaptación de la gastronomía china que tenía una gran influencia en el país. En cualquier caso, fue a partir de la Edad Media cuando la cocina japonesa comenzó a evolucionar, encontrar su propio camino y desarrollar la amplia variedad de platos y preparados que podemos encontrar hoy en día. No podemos olvidar que, especialmente en las ciudades japonesas, existe una gran tendencia a comer y cenar fuera de casa. Esto propicia la aparición de un gran volumen de restaurantes, tabernas y puestos de street food, que a su vez, enriquecen la gastronomía japonesa.\nEn líneas generales, el arroz y la sopa de miso son considerados como los ingredientes base en la cocina japonesa, mientas que el pescado, el marisco, los encurtidos y las tempuras son algunas de las guarniciones más habituales. A pesar de ello, debido a la gran variedad de platos japoneses, que incluso varía por regiones, es difícil englobar bajo una misma definición todo lo que cobija.\n30 Platos típicos de Japón que debes probar\n1. Sushi | 寿司\nCómo no podía ser de otra manera, nuestra selección de platos típicos de Japón debía empezar por su plato más internacional: el sushi. Se trata de un plato cuya base es el arroz cocido y adobado con vinagre de arroz, vino de arroz, azúcar y sal; si bien es cierto que se suele asociar el sushi al pescado y el marisco como acompañantes, existen muchas variedades de sushi que están acompañadas de tortilla, verduras y otros alimentos.\n\nDe hecho, la palabra sushi hace referencia al método de preparación del arroz y no al acompañante, aunque este último es quién será el responsable de darle un sabor diferente a cada pieza. Otro ingrediente importante en el sushi es el Alga Nori, que a menudo se utiliza como envoltura o cinturón para sujetar el acompañamiento al arroz.\n\nComo ya sabrás existen muchos tipos de sushi, tanto por el acompañante, como por la forma de presentarlo. A continuación vamos a hacer un repaso de algunas de las variedades de sushi más conocidas según su presentación:', 'Consiste en una chuleta de cerdo, un corte que no sobrepasa un centímetro de ancho, cubierto con Panko y adobado con sal, pimienta y harina, pero lo que en verdad le otorga el particular sabor es la salsa tonkatsu, una salsa compuesta a base de soja, de un exquisito sabor y una espesa textura que convierten a esta chuleta en toda una experiencia exótica. Suele comerse sola, aunque también se puede acompañar de arroz u otras cosas.\n28. Kakigori | かき氷\nY si visitas Japón durante el verano, el siguiente cuenta dentro de los platos típicos de Japón y es perfecto para ti; a todos nos pasa que en esos calurosos días de verano anhelamos algo fresco que contrarreste la oleada ardiente de la temporada, pues bien, en puestos callejeros, restaurante e incluso tiendas especializadas hallarás el Kakigori, un postre hecho a base de hielo triturado por cuchillas.\n\nEl kakigori es muy similar a los raspado (o granizados, dependiendo de cómo lo llamen en tu país), es un cúmulo de hielo aderezado con jarabes de diversos sabores y leche condensada, en ocasiones suele acompañarse de frutas. Lo que diferencia al kakigori del raspado común es su fina consistencia, además, en Japón este siempre se come con cuchara.\n29. Gyoza | 餃子\nSin duda alguna, este es de los platillos más famosos de la cultura japonesa y, por tanto, una entrada obligatoria en este listado de platos típicos de Japón, se trata de las gyozas, unas suculentas empanadillas rellenas de carne de cerdo, col, cebollino, jengibre y una infinidad de cosas más. La particularidad de estas gyozas es su harina, la cual las diferencia de los dumplings de China, pues es más delgada y su textura es distinta.\n\nOtro de los encantos de estas empanadillas consiste en su estética presentación, probablemente halles por internet infinidad de recetas para cocinar gyozas en casa, sin embargo el cerrado de la harina con los ingredientes adentro es todo un arte, no es algo que vayas a conseguir de la noche a la mañana. Estas empanadillas suelen servirse en gran número y se organizan para configurar formas de distintos carácteres (como la flor de loto).\n30. Momiji Manju | 饅頭\nY cerrando este listado de platos típicos de Japón, llega el delicioso Momiji Manju, un exquisito postre que te hará chuparte los dedos. Este postrecillo es una especialidad en Hiroshima, específicamente en la isla de Itsukushima, suele tener todo tipo de rellenos dulces, como chocolate o pasta de judías dulces e incluso pasta de frijol rojo. La masa está hecha a base de alforfón y arroz y es sin duda una absoluta delicia.\n\nPero lo que diferencia a este manju de otros es su encantadora forma, todo un despliegue de estetismo que nos revela que la comida japonesa no es solo placer para el gusto y para el olfato, lo es también para la vista: la masa adquiere una refinada forma de hoja de arce japonesa, suelen servirse varias y en ocasiones intentan consolidar el arce completo. ¡Toda una maravilla!\n\nEsperamos que hayas disfrutado de esta selección de platos típicos japoneses que hemos preparado y que si viajas a Japón, puedas disfrutarlos todos. ¿Cuál es el que más te ha llamado la atención? ¿Crees que nos hemos dejado otros platos típicos de Japón por nombrar? ¡Déjanos un comentario! Descubre más curiosidades de Japón en este artículo de nuestro blog Supercurioso.']","Claro, estaré encantado de ayudarte a descubrir algunos de los platos típicos de Japón que podrías probar durante tu visita. Japón es conocido por su diversa y rica gastronomía, que combina elementos de la cocina china, asiática y occidental. Aquí te presento una selección de 20 platos típicos de Japón que debes probar:

    Sushi: Este es el plato más conocido de Japón y se trata de un plato de arroz cocido y adobado con vinagre de arroz, vino de arroz, azúcar y sal. El acompañante más común es el pescado y el marisco, pero existen muchas variedades de sushi que están acompañadas de tortilla, verduras y otros alimentos.

Kakigori: El kakigori es un postre hecho a base de hielo triturado por cuchillas, que se consume comúnmente en Japón durante los meses de verano. Es una mezcla de hielo, jarabe y leche condensada, con una textura cremosa y esponjosa.

Gyoza: Las gyozas son empanadillas rellenas de carne de cerdo, col, cebollino, jengibre y una infinidad de otros ingredientes. Son una de las especialidades culinarias de Japón, especialmente de la región de Osaka.

Momiji Manju: El momiji manju es un postre hecho a base de alforfón y arroz, con una masa fina y delgada y una forma peculiar. Es una de las maravillas culinarias de Japón.

Estos son solo algunos de los platos típicos de Japón que debes probar. Hay muchos otros platos y bebidas que puedes explorar, como el ramen, el tempura, el yakitori, el sake, el miso, entre otros. ¡Disfruta de tu visita a Japón y experimenta la magia de la comida!","Durante tu viaje a Japón, hay una gran variedad de platos tradicionales que puedes probar. Aquí tienes algunas recomendaciones basadas en artículos en español:

    Sushi: Este es el plato más internacional de Japón. Se basa en arroz cocido y adobado con vinagre de arroz, vino de arroz, azúcar y sal. Aunque se asocia comúnmente con pescado y mariscos, también hay variedades que incluyen tortilla, verduras y otros ingredientes. Existen varios tipos de sushi, como Maki, Nigiri y Oshi​

Onigiri: Son bolas o triángulos de arroz con un relleno en su interior y toppings en el exterior, generalmente envueltos en alga nori. Tradicionalmente se rellenan con ciruela encurtida, salmón, kombu o atún, aunque hay muchas variantes disponibles​

Sashimi: Consiste en finos cortes de pescado y marisco crudos, normalmente acompañados de salsa de soja, jengibre y wasabi. La calidad de la materia prima es clave en este plato, y en Japón se utiliza pescado muy fresco​

Yakisoba: Son tallarines fritos preparados con verduras, carne y fideos de trigo sarraceno. Aunque de origen chino, este plato se ha integrado completamente en la gastronomía japonesa y es común en festivales tradicionales y tiendas de conveniencia​

Ramen: De origen chino pero adaptado a la cocina japonesa, el ramen incluye un caldo a base de miso, carne, algas y salsa de soja, acompañado de fideos de trigo. Hay varias versiones regionales en Japón​

Sopa de Miso: Hecha con pasta de miso (soja) y un caldo dashi, generalmente de mariscos, carne o pescado. Se acompaña con alga wakame, puerro, cebolleta y tofu​

Yakitori: Son brochetas de pollo asadas a la parrilla y sazonadas con salsa tare o sal. Es un plato clásico en Japón, especialmente popular en Tokio​

Yakiniku: Se refiere a cualquier tipo de carne a la parrilla, comúnmente ternera. Es un plato disfrutado ampliamente en Japón​

Kare Raisu (Arroz al Curry): Aunque se asocia más con la India, el curry japonés, introducido por los británicos, tiene su propia variante y es muy popular en Japón​

Takoyaki: Bolas rellenas de pulpo, un plato tradicional de Osaka y una de las comidas callejeras más populares de Japón​

Tempura: Gambas o verduras fritas conocidas como tempura, servidas comúnmente con arroz. Es un plato clásico en Japón​

Estos platos ofrecen un amplio espectro de sabores y texturas que son esenciales en la gastronomía japonesa, brindándote una experiencia culinaria auténtica y diversa durante tu viaje.",0.8240162721803922,0.9999999999,0.68,1.0
oye sabes comidas para comer en japon,"['Onigiri\n\nUna comida popular para comer por el camino. Los onigiri consisten esencialmente en arroz envuelto en algas. Los encontrarás en todas las tiendas de conveniencia y son muy baratos.\n\nLos onigiri también son una opción popular para desayunar en Japón. A mí no me encantan, pero Christine comió bastantes, ya que ella no come carne.\n\nUdon\n\nUn tipo especial de noodles japoneses. Los noodles Udon son gruesos y gomosos, y normalmente se hacen con harina de trigo y agua salada. A mí me gustan mucho. En los restaurantes hay muchas recetas distintas de noodles Udon.\n\nUno de los platos japoneses con noodles Udon más comunes es el Kitsune Udon.\n\nRamen\n\nOtro tipo de noodles japoneses que se han hecho famosos en el mundo entero. El Ramen es una sopa de noodles con sabroso caldo y se le considera una de las comidas japonesas más populares. A los habitants locales les encanta.\n\nHay restaurantes de ramen prácticamente por todo Japón. Te pueden servir Ramen con varios ingredientes como carne, huevo y verduras.\n\nSoba\n\nEl tercer tipo de noodle que es popular en Japón es el Soba, también conocido como noodle de trigo sarraceno. Pueden servirse en sopas con otros ingredientes o fríos con guarnición.\n\nSin embargo, a la mayoría de locales les gustan los Soba calientes, y yo también los prefiero así.\n\nTernera Wagyu/Kobe\n\nLa carne más cara del mundo, conocida como ternera de Kobe o Wagyu. Otra especialidad japonesa. La he probado varias veces y, aunque es muy cara, es la mejor carne que he comido en toda mi vida. Se deshace en la boca de una forma ridícula.\n\nTonkatsu\n\nLa chuleta de cerdo empanada y frita es una comida típica japonesa. La introdujeron originariamente los europeos, pero los japoneses la hicieron suya.\n\nIncluso tienen la salsa tonkatsu. Como ya he mencionado, el tonkatsu es uno de los aderezos más comunes para el arroz al curry.\n\nDonburi\n\nSi quieres comer como los locales, el Donburi es una opción muy habitual para comer entre los trabajadores japoneses. Este plato se prepara friendo o hirviendo varios tipos de carne, pescado y verdura, y se sirve con arroz al vapor en grandes boles que se llaman Donburi.\n\nLos tipos más comunes de Donburi son el Gyudon, el Oyakodon y el Katsudon.\n\nNatto\n\nEl natto es el desayuno tradicional de Japón. Sin embargo, hoy en día se sirve sobre todo en hoteles, dado que los locales ya no tienen tiempo de preparar un plato que cuesta tanto de hacer.\n\nEn esencia, el natto consiste en habas de soja fermentadas. Tiene un olor fuerte que recuerda al queso mohoso y que no a todo el mundo le gusta, aunque, por otro lado, a muchos japoneses les encanta.\n\nOden\n\nEs un plato japonés clásico para comer durante el invierno. Es un estofado con diversas verduras y proteínas. Se prepara en una cazuela caliente (nabemono).\n\nMiso\n\nUna sopa clásica que consiste en un caldo dashi al que se le añade tofu, cebolla verde y algas. La sopa Miso normalmente se sirve como acompañamiento tanto para desayunar como para comer o cenar.\n\nGyoza\n\nLos dumplings japoneses son otra especialidad que no deberías perderte. Suelen rellenarse de cerdo picado, col, setas y cebolla verde.\n\nLos dumplings Gyoza normalmente se fríen por un lado y después se cocinan al vapor durante 2-3 minutos hasta asegurarse de que el relleno está cocinado y jugoso.\n\nOkonomiyaki\n\nLa tortita japonesa, ¡que es especialmente famosa en Osaka!\n\nSe hace mezclando col cortada a tiras y una masa, así como otros ingredientes, y se fríe como una tortita. Si visitas Osaka, verás restaurantes y puestos de Okonomiyaki en muchos lugares.', 'Chawanmushi\n\nChawanmushi significa, literalmente, taza de té al vapor, y es un plato de crema de huevo único de Japón. A diferencia de otras cremas de huevo, no es dulce sino que se sirve con ingredientes como setas shiitake, kamaboko, ginkgo y gamba hervida.\n\nSe sirve en un recipiente que parece una taza de té, y de ahí el nombre de Chawanmushi.\n\nTeppanyaki\n\nOtra experiencia gastronómica tradicional de Japón que no deberías perderte es el Teppanyaki, que es, en esencia, una cena en la que el chef cocina la comida delante de ti.\n\nNo hay normas sobre lo que se puede servir, pero normalmente hay un menú cerrado del que elegir. ¡Seguro que será un recuerdo divertido!\n\nSukiyaki\n\nOtro plato japonés famoso que consiste en carne cortada en finas tiras que se cuecen o se cocinan lentamente en la mesa. Se sirven al estilo nabemono (olla caliente japonesa).\n\nKaiseki – Elegante cena japonesa\n\nSi quieres comer como los reyes japoneses en un entorno tradicional, deberías probar el Kaiseki, un tipo de cena elegante japonesa en la que se sirve una cena de muchos platos.\n\n¿Qué comen los japoneses para desayunar?\n\nBien, hay una gran diferencia entre el desayuno japonés tradicional y lo que la mayoría de locales comen hoy en día. Esto se debe a lo rápido que ha cambiado el funcionamiento de la sociedad, y a que actualmente la mayoría de la gente dispone de un tiempo limitado, por lo que eligen opciones de comida más rápidas.\nAntaño era común que la mujer preparara el desayuno. Hoy en día, tanto las mujeres como los hombres suelen trabajar en trabajos a tiempo completo y, en consecuencia, muchos japoneses compran comida preparada en tiendas de conveniencia para comer por el camino.\nAlgunos platos tradicionales para desayunar en Japón\n\n    Natto\n    Gohan\n    Miso Shiru\n    Tamago Kake Gohan\n    Postres japoneses\n\nAdemás de postres dulces, también hay varias frutas endémicas de Japón que a los locales les encantan y que comen como postres.\n\n    Wagashi\n    Mochi\n    Daifuku\n    Dango\n    Ammitsu\n    Higashi\n    Namagashi\n    Yokan\n    Helado de Matcha\n\nLicores y bebidas japonesas\n\n    Sake\n    Awamori\n    Whiskey japonés\n    Chuhai\n    Kombucha\n    Té sakura\n    Té matcha\n    \nMás sobre la Gastronomía Japonesa\n\nLa gastronomía japonesa consiste tanto en platos regionales como en comida tradicional de Japón. La comida es muy importante y crear comidas sabrosas y elegantes está considerado un arte. El marisco es muy común, así como otros tipos de carne.\n\nSin embargo, hay varios platos tradicionales que son vegetarianos debido al budismo. El sushi es la comida japonesa más conocida alrededor del mundo, pero otras especialidades como el Ramen, la Tempura y los Yakitori, que también se están haciendo famosos.\n\nDesde 2018, Japón es el país con más restaurantes con 3 estrellas Michelin del mundo, siendo Tokio la ciudad donde se encuentran la mayoría de ellos.\n¿La comida japonesa es saludable?\n\nLos platos más tradicionales de Japón se consideran saludables y el nivel de obesidad es uno de los más bajos del mundo. Por otro lado, en las Islas de Okinawa, los locales tiene una de las esperanzas de vida más largas del mundo.\nSin embargo, también hay comida rápida en Japón, que no es particularmente saludable, pero que tampoco es tan poco sana como la comida rápida americana, por ejemplo.', '30 Platos típicos de Japón | Tienes que probarlos [Con Imágenes]\nCada vez son más las personas que deciden visitar «el país del Sol naciente» en sus vacaciones ¡Y no es de extrañar! Son muchos los motivos que hacen de este país uno de los destinos más interesantes del mundo: hay cientos de lugares que ver en Japón realmente fantásticos, es un país seguro, su gente es acogedora, la cultura japonesa es realmente fascinante y la gastronomía… ¡una auténtica maravilla! En este artículo precisamente queremos hablarte de ella a través de una selección de 20 platos típicos de Japón que tienes que probar. ¿Nos acompañas en este viaje gastronómico?\nGastronomía Japonesa | Breve introducción\nMuchas personas tienden a pensar que la gastronomía de Japón es Sushi, Ramen y poco más… ¡Nada más lejos de la realidad! Es cierto que estos platos son los más conocidos porque han conseguido implantarse en occidente a través de una gran multitud de restaurantes japoneses cuya oferta se limita a ellos. Pero podemos afirmar sin temor a equivocarnos que la gastronomía japonesa es una de las más ricas y variadas de todo el mundo.\n\nEn el pasado los platos típicos de Japón eran prácticamente una adaptación de la gastronomía china que tenía una gran influencia en el país. En cualquier caso, fue a partir de la Edad Media cuando la cocina japonesa comenzó a evolucionar, encontrar su propio camino y desarrollar la amplia variedad de platos y preparados que podemos encontrar hoy en día. No podemos olvidar que, especialmente en las ciudades japonesas, existe una gran tendencia a comer y cenar fuera de casa. Esto propicia la aparición de un gran volumen de restaurantes, tabernas y puestos de street food, que a su vez, enriquecen la gastronomía japonesa.\nEn líneas generales, el arroz y la sopa de miso son considerados como los ingredientes base en la cocina japonesa, mientas que el pescado, el marisco, los encurtidos y las tempuras son algunas de las guarniciones más habituales. A pesar de ello, debido a la gran variedad de platos japoneses, que incluso varía por regiones, es difícil englobar bajo una misma definición todo lo que cobija.\n30 Platos típicos de Japón que debes probar\n1. Sushi | 寿司\nCómo no podía ser de otra manera, nuestra selección de platos típicos de Japón debía empezar por su plato más internacional: el sushi. Se trata de un plato cuya base es el arroz cocido y adobado con vinagre de arroz, vino de arroz, azúcar y sal; si bien es cierto que se suele asociar el sushi al pescado y el marisco como acompañantes, existen muchas variedades de sushi que están acompañadas de tortilla, verduras y otros alimentos.\n\nDe hecho, la palabra sushi hace referencia al método de preparación del arroz y no al acompañante, aunque este último es quién será el responsable de darle un sabor diferente a cada pieza. Otro ingrediente importante en el sushi es el Alga Nori, que a menudo se utiliza como envoltura o cinturón para sujetar el acompañamiento al arroz.\n\nComo ya sabrás existen muchos tipos de sushi, tanto por el acompañante, como por la forma de presentarlo. A continuación vamos a hacer un repaso de algunas de las variedades de sushi más conocidas según su presentación:']","Claro, estaré encantado de ayudarte a encontrar platos típicos de Japón que debes probar. Aquí te presento una selección de 20 platos típicos de Japón que debes probar:

    Sushi: Este plato es uno de los más conocidos de Japón y se trata de un plato de arroz cocido y adobado con vinagre de arroz, vino de arroz, azúcar y sal. Se puede acompañar con pescado, mariscos o vegetales.

    Ramen: La ramen es una sopa de noodle con caldo de pollo o de soja, y se sirve con diversos ingredientes como carne, huevo y verduras.

    Tempura: Esta es una especie de fritada japonesa que se prepara con patatas, cordero o pollo frito y adobado en aceite.

    Okonomiyaki: Esta es una tortita japonesa que se prepara mezclando col cortada a tiras y una masa, así como otros ingredientes, y se frie como una tortita.

    Gyudon: Este plato es similar al okonomiyaki, pero se sirve con carne y verduras.

    Yakitori: Este plato es una especie de hamburguesa japonesa que se prepara con pollo o cerdo picado y se frie en aceite.

    Tonkatsu: Esta es una chuleta de cerdo empanada y frita, que se sirve con salsa teriyaki.

    Donburi: Este plato es similar al gyudon, pero se sirve en una olla caliente (nabemono) en lugar de una sartén.

    Miso: Esta es una sopa de caldo dashi al que se le añaden tofu, cebolla verde y algas.

    Sukiyaki: Esta es una sopa de noodles con carne, huevo y verduras.

    Kaiseki: Esta es una cena elegante japonesa en la que se sirve una cena de muchos platos.

    Okonomiyaki: Esta es una tortita japonesa que se prepara mezclando col cortada a tiras y una masa, así como otros ingredientes, y se frie como una tortita.

    Gyoza: Este plato es una especie de dumplings japoneses que se rellenan de cerdo picado, col, setas y cebolla verde.

    Okonomiyaki: Esta es una tortita japonesa que se prepara mezclando col cortada a tiras y una masa, así como otros ingredientes, y se frie como una tortita.

    Okonomiyaki: Esta es una tortita japonesa que se prepara mezclando col cortada a tiras y una masa, así como otros ingredientes, y se frie como una tortita.

    Okonomiyaki: Esta es una tortita japonesa que se prepara mezclando col cortada a tiras y una masa, así como otros ingredientes, y se frie como una tortita.

    Okonomiyaki: Esta es una tortita japonesa que se prepara mezclando col cortada a tiras y una masa, así como otros ingredientes, y se frie como una tortita.

    Okonomiyaki: Esta es una tortita japonesa que se prepara mezclando col cortada a tiras y una masa, así como otros ingredientes, y se frie como una tortita.

    Okonomiyaki: Esta es una tortita japonesa que se prepara mezclando col cortada a tiras y una masa, así como otros ingredientes, y se frie como una tortita.

    Okonomiyaki: Esta es una tortita japonesa que se prepara mezclando col cortada a tiras y una masa, así como otros ingredientes, y se frie como una tortita.

    Okonomiyaki: Esta es una tortita japonesa que se prepara mezclando col cortada a tiras y una masa, así como otros ingredientes, y se frie como una tortita.

    Okonomiyaki: Esta es una tortita japonesa que se prepara mezclando col cortada a tiras y una masa, así como otros ingredientes, y se frie como una tortita.

    Okonomiyaki: Esta es una tortita japonesa que se prepara mezclando col cortada a tiras y una masa, así como otros ingredientes, y se frie como una tortita.

    Okonomiyaki: Esta es una tortita japonesa que se prepara mezclando col cortada a tiras y una masa, así como otros ingredientes, y se frie como una tortita.

    Okonomiyaki: Esta es una tortita japonesa que se prepara mezclando col cortada a tiras y una masa, así como otros ingredientes, y se frie como una tortita.

    Okonomiyaki: Esta es una tortita japonesa que se prepara mezclando col cortada a tiras y una masa, así como otros ingredientes, y se frie como una tortita.

    Okonomiyaki: Esta es una tortita japonesa que se prepara mezclando col cortada a tiras y una masa, así como otros ingredientes, y se frie como una tortita.

    Okonomiyaki: Esta es una tortita japonesa que se prepara mezclando col cortada a tiras y una masa, así como otros ingredientes, y se frie como una tortita.

    Okonomiyaki: Esta es una tortita japonesa que se prepara mezclando col cortada a tiras y una masa, así como otros ingredientes, y se frie como una tortita.

    Okonomiyaki: Esta es una tortita japonesa que se prepara mezclando col cortada a tiras y una masa, así como otros ingredientes, y se frie como una tortita.

    Okonomiyaki: Esta es una tortita japonesa que se prepara mezclando col cortada a tiras y una masa, así como otros ingredientes, y se frie como una tortita.

    Okonomiyaki: Esta es una tortita japonesa que se prepara mezclando col cortada a tiras y una masa, así como otros ingredientes, y se frie como una tortita.

    Okonomiyaki: Esta es una tortita japonesa que se prepara mezclando col cortada a tiras y una masa, así como otros ingredientes, y se frie como una tortita.

    Okonomiyaki: Esta es una tortita japonesa que se prepara mezclando col cortada a tiras y una masa, así como otros ingredientes, y se frie como una tortita.

    Okonomiyaki: Esta es una tortita japonesa que se prepara mezclando col cortada a tiras y una masa, así como otros ingredientes, y se frie como una tortita.

    Okonomiyaki: Esta es una tortita japonesa que se prepara mezclando col cortada a tiras y una masa, así como otros ingredientes, y se frie como una tortita.

    Okonomiyaki: Esta es una tortita japonesa que se prepara mezclando col cortada a tiras y una masa, así como otros ingredientes, y se frie como una tortita.

    Okonomiyaki: Esta es una tortita japonesa que se prepara mezclando col cortada a tiras y una masa, así como otros ingredientes, y se frie como una tortita.

    Okonomiyaki: Esta es una tortita japonesa que se prepara mezclando col cortada a tiras y una masa, así como otros ingredientes, y se frie como una tortita.

    Okonomiyaki: Esta es una tortita japonesa que se prepara mezclando col cortada a tiras y una masa, así como otros ingredientes, y se frie como una tortita.

    Okonomiyaki: Esta es una tortita japonesa que se prepara mezclando col cortada a tiras y una masa, así como otros ingredientes, y se frie como una tortita.

    Okonomiyaki: Esta es una tortita japonesa que se prepara mezclando col cortada a tiras y una masa, así como otros ingredientes, y se frie como una tortita.

    Okonomiyaki: Esta es una tortita japonesa que se prepara mezclando col cortada a tiras y una masa, así como otros ingredientes, y se frie como una tortita.

    Okonomiyaki: Esta es una tortita japonesa que se prepara mezclando col cortada a tiras y una masa, así como otros ingredientes, y se frie como una tortita.

    Okonomiyaki: Esta es una tortita japonesa que se prepara mezclando col cortada a tiras y una masa, así como otros ingredientes, y se frie como una tortita.

    Okonomiyaki: Esta es una tortita japonesa que se prepara mezclando col cortada a tiras","Durante tu viaje a Japón, hay una gran variedad de platos tradicionales que puedes probar. Aquí tienes algunas recomendaciones basadas en artículos en español:

    Sushi: Este es el plato más internacional de Japón. Se basa en arroz cocido y adobado con vinagre de arroz, vino de arroz, azúcar y sal. Aunque se asocia comúnmente con pescado y mariscos, también hay variedades que incluyen tortilla, verduras y otros ingredientes. Existen varios tipos de sushi, como Maki, Nigiri y Oshi​

Onigiri: Son bolas o triángulos de arroz con un relleno en su interior y toppings en el exterior, generalmente envueltos en alga nori. Tradicionalmente se rellenan con ciruela encurtida, salmón, kombu o atún, aunque hay muchas variantes disponibles​

Sashimi: Consiste en finos cortes de pescado y marisco crudos, normalmente acompañados de salsa de soja, jengibre y wasabi. La calidad de la materia prima es clave en este plato, y en Japón se utiliza pescado muy fresco​

Yakisoba: Son tallarines fritos preparados con verduras, carne y fideos de trigo sarraceno. Aunque de origen chino, este plato se ha integrado completamente en la gastronomía japonesa y es común en festivales tradicionales y tiendas de conveniencia​

Ramen: De origen chino pero adaptado a la cocina japonesa, el ramen incluye un caldo a base de miso, carne, algas y salsa de soja, acompañado de fideos de trigo. Hay varias versiones regionales en Japón​

Sopa de Miso: Hecha con pasta de miso (soja) y un caldo dashi, generalmente de mariscos, carne o pescado. Se acompaña con alga wakame, puerro, cebolleta y tofu​

Yakitori: Son brochetas de pollo asadas a la parrilla y sazonadas con salsa tare o sal. Es un plato clásico en Japón, especialmente popular en Tokio​

Yakiniku: Se refiere a cualquier tipo de carne a la parrilla, comúnmente ternera. Es un plato disfrutado ampliamente en Japón​

Kare Raisu (Arroz al Curry): Aunque se asocia más con la India, el curry japonés, introducido por los británicos, tiene su propia variante y es muy popular en Japón​

Takoyaki: Bolas rellenas de pulpo, un plato tradicional de Osaka y una de las comidas callejeras más populares de Japón​

Tempura: Gambas o verduras fritas conocidas como tempura, servidas comúnmente con arroz. Es un plato clásico en Japón​

Estos platos ofrecen un amplio espectro de sabores y texturas que son esenciales en la gastronomía japonesa, brindándote una experiencia culinaria auténtica y diversa durante tu viaje.",0.7427083032668639,0.9999999999666667,1.0,0.9333333333333333
cómo puedo restaurar un mueble antiguo?,"['Cómo Restaurar un Mueble Antiguo\nEn este post te mostraré paso a paso cómo restaurar un mueble antiguo con un resultado espectacular. Si te gustan los retos, pocas cosas hay mas increíbles que darle vida a lo viejo.\n\n¡Buenos días tizadict@s!\n\nEn este post os vamos a enseñar cómo restaurar un mueble antiguo y convertirlo en un bonito aparador con tapa de ""mármol"" incluida.\n\nAdemás hemos utilizado en un paso la pistola para pintar porque es algo que nos preguntáis a menudo y, aunque os grabaremos un tutorial especial para pintar de esa manera, vamos así abriendo boca 😉.\n\nLa semana pasada, reciclamos una mesa con el color Verde Lorca que ha sido el último en incorporarse a la familia De Tiza. Hoy hemos elegido el Casi Negro y un spray nuevo ""efecto mármol"" con el que vais a alucinar.\n\nEsta es la pieza que hemos rescatado de la basura y le hemos dado una segunda vida. Como podéis ver le faltan un par de cajones y los tiradores, además de que la tapa estaba rota.\nMateriales necesarios para restaurar muebles antiguos\n\n    Superclean y estropajo.\n    Primer.\n    Chalk Paint Casi Negro.\n    Essential Casi negro.\n    Pátina Castaño.\n    Spray Marble Effect.\n    Protector con brillo.\n    Minirodillo 10cm.\n    Brocha plana De Tiza.\n    Brocha redonda De Tiza.\n    Lija almohadilla grano medio.\n    Sierra de calar.\n    Pistola de pintura.\n    Tablero y listones redondos DM madera.\n    Cola para madera.\n\nPasos para restaurar un mueble antiguo\n1.- Limpiar el mueble.\n\nEl primer paso de todo trabajo con pintura es el de limpiar bien el mueble con Superclean.\n\nNo hemos tenido que lijar porque la verdad es que la superficie estaba en bastantes buenas condiciones. Pero ya sabéis que si hay alguna parte astillada o rota, antes de nada hay que lijarlo y dejarlo liso porque si no arruinará el resultado.\n\nHemos usado en esta ocasión un estropajo para sacar bien toda la suciedad acumulada de los años. Recordad aclarar con agua. \n2.- Reparar desperfectos.\n\nAhora le toca el turno a los desperfectos, golpes o roturas.\n\nEn este caso nuestro mueble tiene muy deteriorada la parte superior, así que cogeremos la medida de la tapa y del frontal de un cajón para posteriormente cortar y preparar.\n\nComo a este mueble le faltaban dos cajones, podríamos haberlos hecho nuevos pero para darle otro aire ya que además tenemos tres cajones abajo, hemos decidido dejar los dos primeros huecos de cajón ciegos y adornarlos con unos listones que os enseño más abajo.\n3- Aplicación del Primer.\n\nPreparamos el Primer con las indicaciones de la pistola que vayamos a utilizar.\n\nEs muy importante que esté bien diluido para que la pintura no se atasque. Yo he usado un medidor donde lo he mezclado con la cantidad de agua necesaria y ya de ahí lo he pasado al depósito de la pistola.\n\nEl porcentaje de agua irá en función de la pistola.\nLa distancia a la que pintamos con pistola es más o menos un palmo del mueble.\n\nOs hemos querido ""introducir"" en el mundo de pintar con pistola con el Primer porque creo que es una buena forma de ir cogiendo experiencia y familiarizándose con ella antes de meternos de lleno en la pintura.\nUna cosa que debéis tener en cuenta es que cuando pintamos a pistola, es normal que al principio nos chorree un poquito por lo que, aún en fresco, le pasamos con el rodillo para evitar que después se nos quede ahí todo el chorreón.\nY os preguntaréis: ""¿Por qué le damos Primer si vamos a pintar con Chalk?"".\n\nPues muy sencillo, porque en los muebles de melamina es muy recomendado preparar el mueble con la imprimación antes de pintar ya que si no el mueble se terminará estropeando.\n4.- Deja secar.', 'Cómo restaurar un mueble antiguo paso a paso para que quede como nuevo\n¿Eres un apasionado de los mercadillos de antigüedades y quieres saber cómo restaurar un mueble? Te explicamos qué necesitas y cómo hacerlo paso a paso. ¡Manos a la obra!Ese armario ropero que te dejó en herencia tu abuela o la cómoda francesa medio rota que encontraste en el mercado aux puces de París puede convertirse en un pequeño tesoro con una buena restauración. Además, restaurar muebles de madera es contribuir a fomentar el consumo responsable. Si te animas a probarlo, te ayudamos con este paso a paso… Y te avisamos: ¡restaurar muebles es un hobby que engancha!\n\nAntes de que empieces la restauración del mueble, es importante someterlo a un chequeo completo para valorar si vale o no vale la pena restaurarlo. Siempre es mejor que el número de piezas que debas cambiar no supere a las que se pueden conservar.\n¿Qué necesitas para restaurar un mueble? Materiales básicos\n\nLas herramientas básicas para restaurar un mueble son: lijas de varios tamaños y durezas, pinceles, trapos de algodón, destornilladores, cuchillas, estropajos de aluminio, algodón y una espátula.\n\nA la hora de ponerte manos a la obra con la restauración de tu mueble, evita trabajar al aire libre: el viento y el sol resecan la madera y la pintura. Lo ideal es trabajar en una estancia con temperatura estable y lejos de focos de calor o frío. Y no olvides protegerte con una mascarilla y guantes de goma. ¡La salud es lo primero!\nCómo restaurar un mueble. \nCómo restaurar un mueble antiguo paso a paso\nPaso 1. Limpia el mueble\n\nEs el primero paso para restaurar un mueble antiguo. Basta con pasarle un trapo humedecido en agua y un poco de jabón neutro, y dejarlo secar totalmente. Repasa las manchas en esquinas o molduras con un cepillo de dientes muy duro mojado en disolvente. El siguiente paso será eliminar la pintura o el barniz. Para ello, aplica decapante con una brocha y retíralo con una espátula. Repite la operación hasta eliminar el acabado, y limpia el mueble con un trapo y disolvente. Al final, pasa una lija fina.\nPaso 2. Erradica la carcoma\n\nEs fácil de detectar en un mueble: su superficie presentará pequeños agujeros. Para eliminar la carcoma, aplica un producto especial para esta tarea con una brocha en cada hueco, y envuelve el mueble con plástico. Es importante cubrir por completo el agujero. Se recomienda renovar el plástico cada 48 horas y dejarlo tapado un mínimo de cuatro días.\nPaso 3. Repara los golpes\n\nLas hendiduras ligeras de la madera desaparecen si colocas un trapo mojado en agua o en leche caliente sobre la zona afectada. Sujétalo fuerte con una cinta y déjalo actuar unas horas. También puedes tapar las fisuras con masilla o cera natural para disimular arañazos e imperfecciones. Rellénalos con una espátula, luego lija la superficie y repite la operación hasta que la fisura desaparezca. Para devolverle su color original, píntala con óleos de la tonalidad de la madera.\nPaso 4. Arregla puertas y cajones descolgados\n\nSi el mueble que quieres restaurar tiene la puerta descolgada, cambia la bisagra por una más grande. Para que la nueva se ajuste, amplía el cajeado con un formón. Una opción más fácil es pegar la bisagra antigua al mueble con cola rápida. Si los cajones no se deslizan bien, aplica un poco de jabón a las guías, o lija los laterales.\nPaso 5. Restaura cerraduras y herrajes', 'Cómo restaurar muebles antiguos\nSi tenéis un mueble antiguo en casa al que le queréis dar un aspecto más renovado, no os podéis perder el paso a paso de cómo restaurar muebles antiguos.\n\nSiguiendo este tutorial podréis restaurar cualquier mueble de madera de vuestro hogar.\n\nAdemás, en el ejemplo que os vamos a mostrar también vemos cómo tratar correctamente una pieza de madera que está afectada por la carcoma. ¡Toma nota!\nAntes de empezar a restaurar muebles, debemos realizar un estudio de los daños y desperfectos que tienen para saber cuales tendrán que ser los pasos a seguir.\n\nEn nuestro caso, tenemos un armario de madera con carcoma, así que lo primero que debemos hacer es acabar con estos bichitos.\nA continuación, reforzaremos la estructura con resina y reconstruiremos todas las partes deterioradas incluida la marquetería. Después de teñir la madera, puliremos la superficie para obtener un acabado perfecto. \nHerramientas para restaurar muebles\n\n    Palanqueta\n    Martillo\n    Sierra de costilla\n    Caja de ingletes\n    Lijadora\n    Lana de acero\n    Paletina\n    Jeringuilla\n    Taladro atornillador\n    Taco de lija de grano fino\n    Broca pala de Ø 20 mm\nMateriales para restaurar muebles\n\n    Aguarrás\n    Vaselina\n    Acetona\n    Alcohol 96º\n    Goma laca\n    Resina\n    Anilinas\n    Producto anticarcoma\n    Plástico\n    Cola blanca\n    Ceras\n    Trapos de algodón\n    Muñecas de algodón\n    Clavos de cabeza perdida\n    Tacos de madera de haya\n    Tubillón de Ø 20 mm\n    Tirafondos de 4 X 40 mm\n    Cinta de carrocero\n    Láminas de contrachapado\nPaso a paso para restaurar muebles\n\nCómo restaurar un mueblePaso 1\nPara restaurar muebles de madera cómodamente, debemos comenzar desmontando el mueble. Es conveniente numerar las piezas para que, a la hora de volver a colocarlas, saber exactamente donde van.\n\nCómo restaurar un mueblePaso 2\nEn nuestro caso, tenemos un mueble antiguo y una de las patas delanteras del escritorio está totalmente carcomida. La cortamos con una sierra de costilla.\n\nCómo restaurar un mueblePaso 3\nA continuación, repasamos bien toda la superficie de madera con la lijadora provista de una hoja de lija de grano fino siguiendo la dirección de la veta.\n\nCon esta tarea, además de limpiar la superficie conseguiremos abrir el poro de la madera.\n\nCómo restaurar un mueblePaso 4\nDespués de retirar el polvo producido al lijar, mezclamos en un recipiente aguarrás con vaselina, humedecemos la lana de acero y repasamos la superficie hasta retirar completamente la goma laca.\n\nPara realizar este trabajo, os recomendamos que uséis guantes de látex para protegeros las manos.\n\nCómo restaurar un mueblePaso 5\nSecamos bien el mueble y comenzamos con el tratamiento anticarcoma. En primer lugar, aplicamos generosamente el producto empleando una paletina.\n\nCómo restaurar un mueblePaso 6\nEn los orificios más pronunciados insertaremos el producto anticarcomal con una jeringuilla. A la hora de restaurar muebles, este tratamiento es fundamental aunque no tenga carcoma para así evitar su aparición y proteger el mueble.\n\nCómo restaurar un mueblePaso 7\nPara que el producto anticarcoma penetre profundamente en la madera, cubrimos el mueble con un plástico y lo cerramos perfectamente con una cinta adhesiva.\n\nNosotros nos hemos decantado por la cinta de carrocero, pero se puede utilizar otro cinta adhesiva.\n\nCómo restaurar un mueblePaso 8\nTranscurrido el tiempo que necesita el líquido para hacer su trabajo, retiramos el plástico y diluimos la resina con acetona.']","Para restaurar un mueble antiguo, es importante seguir un proceso cuidadoso y detallado. Aquí te explico cómo puedes hacerlo:

    Preparación del mueble: Antes de comenzar, asegúrate de que el mueble esté completamente limpio y libre de manchas persistentes. Si tienes un mueble con carcoma, como en el ejemplo, puedes tratar de eliminarla siguiendo los pasos proporcionados en el contexto. Esto implica aplicar un producto especial para esta tarea, como decapante, y luego cubrir el agujero con plástico para que la resina pueda penetrar sin interferencia​.

Selección de materiales y herramientas: Necesitarás una variedad de herramientas y materiales específicos para el proceso de restauración. Algunos de los materiales necesarios incluyen lijas de varios tamaños y durezas, pinceles, trapos de algodón, destornilladores, cuchillas, estropajos de aluminio, algodón y una espátula. Es importante elegir herramientas adecuadas para el tipo de madera y el material que planeas usar para el trabajo​​.

Proceso de restauración:

    Aplicación de la resina: Comienza aplicando resina en las áreas afectadas por la carcoma o daños. Aplica la resina con una brocha y deja que se seque según las instrucciones del fabricante. La resina es un material flexible que se adhiere a la madera, por lo que es importante aplicarla uniformemente y dejar que se cure correctamente​.

Pulido y acabado: Una vez que la resina haya curado, pulirá la superficie con una lija de grano fino para nivelarla y eliminar cualquier burbuja. Luego, aplica una capa de pintura o barniz para completar el trabajo. Es importante elegir una pintura o barniz que combine con la madera y tenga una textura similar para lograr un acabado uniforme​.

Cuidados posteriores: Después de la restauración, es crucial mantener el mueble limpio y protegido para evitar daños futuros. Esto incluye evitar el contacto directo con la resina y pulir la superficie regularmente para mantener su brillo. También es importante almacenar el mueble en un lugar fresco y seco para evitar la formación de moho​.

En resumen, restaurar un mueble antiguo requiere una combinación de conocimientos técnicos y habilidades. Sin embargo, siguiendo estos pasos y utilizando las herramientas y materiales adecuados, puedes lograr un resultado excelente.","Para restaurar un mueble antiguo, sigue estos pasos generales basados en varias fuentes:

    Preparación:
        Evaluación de Daños: Antes de comenzar, examina los daños y desperfectos del mueble para determinar los pasos a seguir​
        
Limpieza: Limpia bien el mueble, preferentemente con un producto como Superclean. Si la superficie está en buenas condiciones, puede que no necesites lijar en este punto​

Herramientas y Materiales Necesarios:

    Necesitarás lijas de varios tamaños y durezas, pinceles, trapos de algodón, destornilladores, cuchillas, estropajos de aluminio, algodón y una espátula​

Otros materiales pueden incluir pistola de pintura, tablero y listones redondos de madera DM, y cola para madera​

Restauración:

    Tratamiento de Carcoma: Si el mueble tiene carcoma, este es el primer problema que debes tratar​

Pintura: Mezcla agua y chalk paint según las indicaciones del fabricante y pinta el mueble. Después de pintar, elimina el exceso de humedad con un paño y espera a que la madera se seque antes de lijar​

Estos pasos generales te guiarán en el proceso, pero ten en cuenta que cada mueble puede requerir atención específica según su condición y estilo.",0.97534598079076,0.9999999999666667,0.4444444444444444,0.6
dime algun consejillo para restaurar un mueble que tengo antiguo,"['Por muy vieja que sea una pieza, podemos recuperarla siguiendo los pasos adecuados y seguir disfrutando de los muebles de madera antiguos que tengamos en casa. Además, si queréis aclarar la madera, podéis seguir estos consejos sobre cómo cambiar el color de un mueble oscuro a claro.\n\nIdeas para restaurar muebles\n\nPintar un armario muy oscuro y envejecido\n\nTeníamos un armario oscuro muy envejecido ocupando toda la pared del salón y lo hemos pintado de blanco. El cambio es impresionante y la habitación parece mucho más luminosa y grande. ¿Qué os parece el cambio?\n\nUno de los mejores cambios de pintar muebles antes y después.\n\nPuedes ver el paso a paso completo aquí: cómo decorar un salón nórdico moderno y luminoso.\nDar color a una cómoda antigua\n\nLos muebles antiguos de madera son muy resistentes y duraderos. Con el paso del tiempo, es probable que nos cansemos de su aspecto y queramos adaptarlo a la decoración de nuestro hogar.\n\n¿Y si lo pintamos de varios colores?\n\nEn nuestro caso, nos hemos decantado por pintar la cómoda en color blanco y los cajones de colores para dar un toque de color. Además, también podemos cambiar los tiradores o darles brillo.', 'Si estás teniendo problemas con el óxido, puedes retirar las partes metálicas de tus muebles con un destornillador, lavarlas con jabón utilizando un cepillo y luego sumergir las mismas en vinagre normal unas 24 horas. Pasado este tiempo, solo tienes que enjuagar y retirar el óxido sobrante con un cepillo.\nDónde restaurar muebles antiguos\n\nSi leyendo toda esta guía no acabas de verlo claro y te decides por dejar la restauración de muebles antiguos a un profesional, tienes que tener en cuenta varios aspectos.Existen infinidad de opciones dónde restaurar muebles antiguos, pero deberas tener claro que es lo que buscas. Puedes optar por restauradores de muebles profesionales o bien por carpinteros especializados en la materia. En el caso de los carpinteros van a tener un mejor trato hacía la madera, pero si el mueble contiene otros materiales es posible que necesites de un restaurador profesional. De la misma forma, los restauradores profesionales tienen más conocimientos en decoración y podrán asesorarte más en función del estilo de tu hogar.\nAprender a restaurar muebles antiguos\nComo vemos, aprender a restaurar muebles antiguos no es demasiado complicado. Solo necesitamos de algunas herramientas y productos, pero nada del otro mundo que no podamos llevar a cabo. Eso sí, si pretendemos dedicarnos profesionalmente a la restauración de muebles antiguos, deberemos buscar opciones de formación más profesionales en plataformas como eMagister o Udemy.']","Para restaurar un mueble antiguo, es importante tener en cuenta varios aspectos clave. Aquí te ofrezco algunos consejos basados en fuentes confiables:

    Conservación y preservación de la madera: Los muebles antiguos de madera pueden verse afectados por factores como la humedad, la luz solar directa y la oxidación. Es crucial proteger la madera de daños preventivos, como aplicar un barnizado adecuado y realizar limpiezas regulares​.

Reparación y mejora: En algunos casos, los muebles antiguos pueden presentar daños estructurales o funcionales que requieren reparaciones o incluso actualizaciones. Estas mejoras pueden mejorar la funcionalidad del mueble y añadir valor estético​.

Restauración profesional: Para trabajos más complejos o muebles con múltiples partes, es recomendable buscar la asesoría de profesionales capacitados en restauración de muebles antiguos. Esto incluye la limpieza, pulido y conservación de los detalles más delicados​.

Cambio de color y personalización: Aunque la mayoría de los muebles antiguos pueden conservarse con buen aspecto, añadir un toque de color o personalizarlos puede ser una excelente forma de dar vida a estos objetos valiosos. Por ejemplo, pintar un armario oscuro de madera de blanco puede crear un nuevo escenario para la decoración de la habitación​.

Consideraciones específicas: Algunos muebles antiguos pueden tener requisitos especiales, como muebles históricos o piezas de arte, que requieren un trato cuidadoso y precaución durante la restauración. Es importante investigar y evaluar estas particularidades antes de comenzar cualquier proyecto de restauración​.

En resumen, para restaurar un mueble antiguo, es crucial un enfoque integral y personalizado. Combina conservación y preservación con reparaciones y personalización, y busca la asesoría de profesionales calificados para garantizar la calidad y durabilidad del trabajo.","Para restaurar un mueble antiguo, sigue estos pasos generales basados en varias fuentes:

    Preparación:
        Evaluación de Daños: Antes de comenzar, examina los daños y desperfectos del mueble para determinar los pasos a seguir​
        
Limpieza: Limpia bien el mueble, preferentemente con un producto como Superclean. Si la superficie está en buenas condiciones, puede que no necesites lijar en este punto​

Herramientas y Materiales Necesarios:

    Necesitarás lijas de varios tamaños y durezas, pinceles, trapos de algodón, destornilladores, cuchillas, estropajos de aluminio, algodón y una espátula​

Otros materiales pueden incluir pistola de pintura, tablero y listones redondos de madera DM, y cola para madera​

Restauración:

    Tratamiento de Carcoma: Si el mueble tiene carcoma, este es el primer problema que debes tratar​

Pintura: Mezcla agua y chalk paint según las indicaciones del fabricante y pinta el mueble. Después de pintar, elimina el exceso de humedad con un paño y espera a que la madera se seque antes de lijar​

Estos pasos generales te guiarán en el proceso, pero ten en cuenta que cada mueble puede requerir atención específica según su condición y estilo.",0.8267554674467738,0.99999999995,1.0,1.0
me puedes decir qué pasos debo seguir para restaurar un mueble viejo?,"['Cómo restaurar un mueble antiguo paso a paso para que quede como nuevo\n¿Eres un apasionado de los mercadillos de antigüedades y quieres saber cómo restaurar un mueble? Te explicamos qué necesitas y cómo hacerlo paso a paso. ¡Manos a la obra!Ese armario ropero que te dejó en herencia tu abuela o la cómoda francesa medio rota que encontraste en el mercado aux puces de París puede convertirse en un pequeño tesoro con una buena restauración. Además, restaurar muebles de madera es contribuir a fomentar el consumo responsable. Si te animas a probarlo, te ayudamos con este paso a paso… Y te avisamos: ¡restaurar muebles es un hobby que engancha!\n\nAntes de que empieces la restauración del mueble, es importante someterlo a un chequeo completo para valorar si vale o no vale la pena restaurarlo. Siempre es mejor que el número de piezas que debas cambiar no supere a las que se pueden conservar.\n¿Qué necesitas para restaurar un mueble? Materiales básicos\n\nLas herramientas básicas para restaurar un mueble son: lijas de varios tamaños y durezas, pinceles, trapos de algodón, destornilladores, cuchillas, estropajos de aluminio, algodón y una espátula.\n\nA la hora de ponerte manos a la obra con la restauración de tu mueble, evita trabajar al aire libre: el viento y el sol resecan la madera y la pintura. Lo ideal es trabajar en una estancia con temperatura estable y lejos de focos de calor o frío. Y no olvides protegerte con una mascarilla y guantes de goma. ¡La salud es lo primero!\nCómo restaurar un mueble. \nCómo restaurar un mueble antiguo paso a paso\nPaso 1. Limpia el mueble\n\nEs el primero paso para restaurar un mueble antiguo. Basta con pasarle un trapo humedecido en agua y un poco de jabón neutro, y dejarlo secar totalmente. Repasa las manchas en esquinas o molduras con un cepillo de dientes muy duro mojado en disolvente. El siguiente paso será eliminar la pintura o el barniz. Para ello, aplica decapante con una brocha y retíralo con una espátula. Repite la operación hasta eliminar el acabado, y limpia el mueble con un trapo y disolvente. Al final, pasa una lija fina.\nPaso 2. Erradica la carcoma\n\nEs fácil de detectar en un mueble: su superficie presentará pequeños agujeros. Para eliminar la carcoma, aplica un producto especial para esta tarea con una brocha en cada hueco, y envuelve el mueble con plástico. Es importante cubrir por completo el agujero. Se recomienda renovar el plástico cada 48 horas y dejarlo tapado un mínimo de cuatro días.\nPaso 3. Repara los golpes\n\nLas hendiduras ligeras de la madera desaparecen si colocas un trapo mojado en agua o en leche caliente sobre la zona afectada. Sujétalo fuerte con una cinta y déjalo actuar unas horas. También puedes tapar las fisuras con masilla o cera natural para disimular arañazos e imperfecciones. Rellénalos con una espátula, luego lija la superficie y repite la operación hasta que la fisura desaparezca. Para devolverle su color original, píntala con óleos de la tonalidad de la madera.\nPaso 4. Arregla puertas y cajones descolgados\n\nSi el mueble que quieres restaurar tiene la puerta descolgada, cambia la bisagra por una más grande. Para que la nueva se ajuste, amplía el cajeado con un formón. Una opción más fácil es pegar la bisagra antigua al mueble con cola rápida. Si los cajones no se deslizan bien, aplica un poco de jabón a las guías, o lija los laterales.\nPaso 5. Restaura cerraduras y herrajes', 'Si el mueble que quieres restaurar tiene la puerta descolgada, cambia la bisagra por una más grande. Para que la nueva se ajuste, amplía el cajeado con un formón. Una opción más fácil es pegar la bisagra antigua al mueble con cola rápida. Si los cajones no se deslizan bien, aplica un poco de jabón a las guías, o lija los laterales.\nPaso 5. Restaura cerraduras y herrajes\n\nAl restaurar un mueble, presta atención también a los herrajes de bronce. Se limpian con agua y jabón. El resto de metales repásalos con un cepillo de cerdas suaves, humedecido en vinagre o en un refresco de cola. Las cerraduras repásalas con aceite y frótalas con un cepillo metálico de cerdas suaves.\nPaso 6. Sustituye los elementos estropeados o rotos\n\nSi te animas cambiar pequeñas piezas al restaurar tu mueble antiguo, como por ejemplo patas y molduras, retíralas y dibújalas en papel. Ponlas sobre un tablero (de pino para los muebles con veta y de haya para los que no la tienen) y recórtalas con una segueta. Lija los bordes y tíñela del color más parecido al mueble.\n\nPara encolar las nuevas piezas, retira las antiguas y elimina los restos del antiguo pegamento. Aplica cola blanca, sujeta la pieza con un gato o con cuerdas y déjala secar 24 horas. Si solo quieres encolar la pieza original y te cuesta quitarla de la estructura, aplica directamente la cola.\nPaso 7. Barniza y encera el mueble\n\nAplica una capa de barniz -mate o satinado-, deja secar 24 horas, lija el mueble, limpia el polvo y aplica otra mano en el sentido de la veta. Luego, con algodón, aplica una capa de cera incolora: le dará un aspecto mucho más natural.\nPaso 8. ¿Teñir o no teñir?\n\nSi tu mueble antiguo ha perdido el color o quieres dale un aire completamente renovado, es aconsejable teñirlo. Líjala, límpiala y aplica con una brocha suave que no suelte pelo una capa de tinte. Para oscurecerla, pásale varias capas hasta acertar con el tono.\nPaso 9. Acabado en goma laca\n\nSe recomienda solo cuando el mueble a restaurar presenta este acabado originalmente. Su textura viscosa tapa los poros de la madera y, además, le da brillo. En acabado transparente o ámbar, debes aplicar unas 15 capas con una brocha especial para este producto.\nPaso 10. Pule el mueble\nPara que el acabado final del mueble a restaurar sea más brillante, aplícale al menos una segunda capa, ya sea de barniz, de tinte o de goma laca. Es conveniente encerar la pieza una o dos veces al año para mantenerla en perfecto estado tras la restauración.\nPaso 11. Renueva la tapicería\n\nSi estás renovando una silla o una butaca y la tela no está muy deteriorada, basta con una puesta a punto para que esté como nueva. Desclávala con cuidado de la estructura y, para una limpieza a fondo, llévala a la tintorería. Posteriormente, grápala con una grapadora especial para tapizar. Si la tela original está inservible, créate una plantilla de la forma del tapizado original, recorta la nueva tela y grápala.\nCómo mantener un mueble restaurado', 'Cómo restaurar muebles antiguos\nSi tenéis un mueble antiguo en casa al que le queréis dar un aspecto más renovado, no os podéis perder el paso a paso de cómo restaurar muebles antiguos.\n\nSiguiendo este tutorial podréis restaurar cualquier mueble de madera de vuestro hogar.\n\nAdemás, en el ejemplo que os vamos a mostrar también vemos cómo tratar correctamente una pieza de madera que está afectada por la carcoma. ¡Toma nota!\nAntes de empezar a restaurar muebles, debemos realizar un estudio de los daños y desperfectos que tienen para saber cuales tendrán que ser los pasos a seguir.\n\nEn nuestro caso, tenemos un armario de madera con carcoma, así que lo primero que debemos hacer es acabar con estos bichitos.\nA continuación, reforzaremos la estructura con resina y reconstruiremos todas las partes deterioradas incluida la marquetería. Después de teñir la madera, puliremos la superficie para obtener un acabado perfecto. \nHerramientas para restaurar muebles\n\n    Palanqueta\n    Martillo\n    Sierra de costilla\n    Caja de ingletes\n    Lijadora\n    Lana de acero\n    Paletina\n    Jeringuilla\n    Taladro atornillador\n    Taco de lija de grano fino\n    Broca pala de Ø 20 mm\nMateriales para restaurar muebles\n\n    Aguarrás\n    Vaselina\n    Acetona\n    Alcohol 96º\n    Goma laca\n    Resina\n    Anilinas\n    Producto anticarcoma\n    Plástico\n    Cola blanca\n    Ceras\n    Trapos de algodón\n    Muñecas de algodón\n    Clavos de cabeza perdida\n    Tacos de madera de haya\n    Tubillón de Ø 20 mm\n    Tirafondos de 4 X 40 mm\n    Cinta de carrocero\n    Láminas de contrachapado\nPaso a paso para restaurar muebles\n\nCómo restaurar un mueblePaso 1\nPara restaurar muebles de madera cómodamente, debemos comenzar desmontando el mueble. Es conveniente numerar las piezas para que, a la hora de volver a colocarlas, saber exactamente donde van.\n\nCómo restaurar un mueblePaso 2\nEn nuestro caso, tenemos un mueble antiguo y una de las patas delanteras del escritorio está totalmente carcomida. La cortamos con una sierra de costilla.\n\nCómo restaurar un mueblePaso 3\nA continuación, repasamos bien toda la superficie de madera con la lijadora provista de una hoja de lija de grano fino siguiendo la dirección de la veta.\n\nCon esta tarea, además de limpiar la superficie conseguiremos abrir el poro de la madera.\n\nCómo restaurar un mueblePaso 4\nDespués de retirar el polvo producido al lijar, mezclamos en un recipiente aguarrás con vaselina, humedecemos la lana de acero y repasamos la superficie hasta retirar completamente la goma laca.\n\nPara realizar este trabajo, os recomendamos que uséis guantes de látex para protegeros las manos.\n\nCómo restaurar un mueblePaso 5\nSecamos bien el mueble y comenzamos con el tratamiento anticarcoma. En primer lugar, aplicamos generosamente el producto empleando una paletina.\n\nCómo restaurar un mueblePaso 6\nEn los orificios más pronunciados insertaremos el producto anticarcomal con una jeringuilla. A la hora de restaurar muebles, este tratamiento es fundamental aunque no tenga carcoma para así evitar su aparición y proteger el mueble.\n\nCómo restaurar un mueblePaso 7\nPara que el producto anticarcoma penetre profundamente en la madera, cubrimos el mueble con un plástico y lo cerramos perfectamente con una cinta adhesiva.\n\nNosotros nos hemos decantado por la cinta de carrocero, pero se puede utilizar otro cinta adhesiva.\n\nCómo restaurar un mueblePaso 8\nTranscurrido el tiempo que necesita el líquido para hacer su trabajo, retiramos el plástico y diluimos la resina con acetona.']","Claro, estaré encantado de ayudarte. Aquí tienes una lista de los pasos que debes seguir para restaurar un mueble antiguo:

    Preparación del mueble: Antes de comenzar, asegúrate de que el mueble esté completamente desmontado y listo para la restauración. Esto implica retirar todas las piezas y los accesorios, y limpiar la superficie con un limpiador químico para eliminar la grasa y la suciedad.

    Limpieza y pulido: Aplica una solución de agua y vinagre a las áreas afectadas por la carcoma, y deja que se asienten durante unos minutos antes de limpiar con un paño húmedo. También puedes usar un pulidor químico para mejorar la apariencia del mueble.

    Restauración de la madera: Aplica una capa de resina para restaurar la madera en las áreas afectadas por la carcoma. Esto ayudará a proteger la madera de daños futuros y mejorará su apariencia.

    Reparación de daños: Si el mueble tiene daños graves, como agujeros o rasguños, puedes repararlos con materiales como clavos de cabeza perdida, tornillos de madera, y cinta de carrocero. Estos materiales se pueden comprar en tiendas de antigüedades o en ferias de antigüedades.

    Mantenimiento y pulido: Una vez que hayas restaurado el mueble, es importante mantenerlo en buen estado. Esto implica pulir la superficie con regularidad para evitar la oxidación y la corrosión. También puedes aplicar una capa de barniz para proteger la madera de la intemperie.

    Consejos adicionales: Para evitar daños futuros, es importante mantener el mueble alejado de la luz solar directa y el calor excesivo. También puedes aplicar un protector de madera para proteger la madera de la intemperie y prolongar su vida útil.","Para restaurar un mueble antiguo, sigue estos pasos generales basados en varias fuentes:

    Preparación:
        Evaluación de Daños: Antes de comenzar, examina los daños y desperfectos del mueble para determinar los pasos a seguir​
        
Limpieza: Limpia bien el mueble, preferentemente con un producto como Superclean. Si la superficie está en buenas condiciones, puede que no necesites lijar en este punto​

Herramientas y Materiales Necesarios:

    Necesitarás lijas de varios tamaños y durezas, pinceles, trapos de algodón, destornilladores, cuchillas, estropajos de aluminio, algodón y una espátula​

Otros materiales pueden incluir pistola de pintura, tablero y listones redondos de madera DM, y cola para madera​

Restauración:

    Tratamiento de Carcoma: Si el mueble tiene carcoma, este es el primer problema que debes tratar​

Pintura: Mezcla agua y chalk paint según las indicaciones del fabricante y pinta el mueble. Después de pintar, elimina el exceso de humedad con un paño y espera a que la madera se seque antes de lijar​

Estos pasos generales te guiarán en el proceso, pero ten en cuenta que cada mueble puede requerir atención específica según su condición y estilo.",0.9174186120459861,0.9999999999666667,0.35294117647058826,0.7142857142857143
indicaciones para restaurar mueble,"['Cómo restaurar un mueblePaso 7\nPara que el producto anticarcoma penetre profundamente en la madera, cubrimos el mueble con un plástico y lo cerramos perfectamente con una cinta adhesiva.\n\nNosotros nos hemos decantado por la cinta de carrocero, pero se puede utilizar otro cinta adhesiva.\n\nCómo restaurar un mueblePaso 8\nTranscurrido el tiempo que necesita el líquido para hacer su trabajo, retiramos el plástico y diluimos la resina con acetona.\n\nCuando el producto ya esté listo, llenamos la jeringuilla e introducimos la resina en los agujeros del mueble con el fin de consolidar la estructura.\n\nCómo restaurar un mueblePaso 9\nMientras el producto se seca, hacemos un agujero en la parte inferior del mueble utilizando el taladro y una broca-pala del diámetro adecuado, justo en el punto en el que irá la nueva pata delantera, .\n\nAplicamos cola de carpintero en las superficies a unir, insertamos el tubillón y fijamos la pata.\n\nCómo restaurar un mueblePaso 10\nVamos ahora con las patas traseras. Empleando la sierra de costilla y una caja de ingletes, damos a los tacos la angulación necesaria. A continuación, aplicamos cola tanto en la base de las patas como en el mueble y ponemos las piezas.\n\nReforzamos las uniones con unos tirafondos. Tened en cuenta que el atornillador deberá tener una punta apropiada al tamaño y la forma de la cabeza del tirafondo.\n\nCómo restaurar un mueblePaso 11\nReconstruimos todas las piezas que estén deterioradas y las fijamos con cola de carpintero y tirafondos.\n\nNosotros, además de las patas, hemos tenido que hacer un nuevo travesaño, fijar bien los cajones y añadir alguna nueva pieza pequeña de madera.\n\nCómo restaurar un mueblePaso 12\nEs el turno de la marquetería. En la zona en la que el dibujo esté deteriorado, colocamos cinta de carrocero y marcamos con un lápiz la superficie que tenemos que renovar.\n\nCómo restaurar un mueblePaso 13\nA continuación, transportamos la cinta a la lámina de contrachapado y cortamos la pieza necesaria con la ayuda de un cortante. Emplearemos una regla o escuadra metálica a modo de guía.\n\nCómo restaurar un mueblePaso 14\nPegamos la chapa en el mueble con cola de carpintero y la amarramos con una pinza hasta que el producto se seque.\n\nDespués, retiramos la pinza y lijamos suavemente el borde. Hacemos lo mismo en todas las zonas dañadas de la decoración.\n\nCómo restaurar un mueblePaso 15\nEl siguiente paso consiste en rellenar las grietas con ceras de diferentes tonalidades.\n\nCómo restaurar un mueblePaso 16\nLuego, mezclamos las anilinas con agua hasta conseguir el tono que necesitemos en cada caso y teñimos las distintas zonas del mueble empleando la paletina.\n\nUna vez seco, preparamos la goma-laca y la aplicamos a muñequilla en toda la superficie.\n\nCómo restaurar un mueblePaso 17\nRematamos el trabajo sacando brillo a la madera con el taladro y un cepillo para pulir.\n\nCómo restaurar un mueblePaso 18\nPara terminar, sólo nos queda montar de nuevo el mueble. Ya veis de qué forma tan sencilla hemos conseguido restaurar un mueble antiguo de madera recuperando este escritorio que fue construido hace ya 157 años.\n\nPor muy vieja que sea una pieza, podemos recuperarla siguiendo los pasos adecuados y seguir disfrutando de los muebles de madera antiguos que tengamos en casa. Además, si queréis aclarar la madera, podéis seguir estos consejos sobre cómo cambiar el color de un mueble oscuro a claro.\n\nIdeas para restaurar muebles\n\nPintar un armario muy oscuro y envejecido', 'Cómo restaurar un mueble antiguo paso a paso para que quede como nuevo\n¿Eres un apasionado de los mercadillos de antigüedades y quieres saber cómo restaurar un mueble? Te explicamos qué necesitas y cómo hacerlo paso a paso. ¡Manos a la obra!Ese armario ropero que te dejó en herencia tu abuela o la cómoda francesa medio rota que encontraste en el mercado aux puces de París puede convertirse en un pequeño tesoro con una buena restauración. Además, restaurar muebles de madera es contribuir a fomentar el consumo responsable. Si te animas a probarlo, te ayudamos con este paso a paso… Y te avisamos: ¡restaurar muebles es un hobby que engancha!\n\nAntes de que empieces la restauración del mueble, es importante someterlo a un chequeo completo para valorar si vale o no vale la pena restaurarlo. Siempre es mejor que el número de piezas que debas cambiar no supere a las que se pueden conservar.\n¿Qué necesitas para restaurar un mueble? Materiales básicos\n\nLas herramientas básicas para restaurar un mueble son: lijas de varios tamaños y durezas, pinceles, trapos de algodón, destornilladores, cuchillas, estropajos de aluminio, algodón y una espátula.\n\nA la hora de ponerte manos a la obra con la restauración de tu mueble, evita trabajar al aire libre: el viento y el sol resecan la madera y la pintura. Lo ideal es trabajar en una estancia con temperatura estable y lejos de focos de calor o frío. Y no olvides protegerte con una mascarilla y guantes de goma. ¡La salud es lo primero!\nCómo restaurar un mueble. \nCómo restaurar un mueble antiguo paso a paso\nPaso 1. Limpia el mueble\n\nEs el primero paso para restaurar un mueble antiguo. Basta con pasarle un trapo humedecido en agua y un poco de jabón neutro, y dejarlo secar totalmente. Repasa las manchas en esquinas o molduras con un cepillo de dientes muy duro mojado en disolvente. El siguiente paso será eliminar la pintura o el barniz. Para ello, aplica decapante con una brocha y retíralo con una espátula. Repite la operación hasta eliminar el acabado, y limpia el mueble con un trapo y disolvente. Al final, pasa una lija fina.\nPaso 2. Erradica la carcoma\n\nEs fácil de detectar en un mueble: su superficie presentará pequeños agujeros. Para eliminar la carcoma, aplica un producto especial para esta tarea con una brocha en cada hueco, y envuelve el mueble con plástico. Es importante cubrir por completo el agujero. Se recomienda renovar el plástico cada 48 horas y dejarlo tapado un mínimo de cuatro días.\nPaso 3. Repara los golpes\n\nLas hendiduras ligeras de la madera desaparecen si colocas un trapo mojado en agua o en leche caliente sobre la zona afectada. Sujétalo fuerte con una cinta y déjalo actuar unas horas. También puedes tapar las fisuras con masilla o cera natural para disimular arañazos e imperfecciones. Rellénalos con una espátula, luego lija la superficie y repite la operación hasta que la fisura desaparezca. Para devolverle su color original, píntala con óleos de la tonalidad de la madera.\nPaso 4. Arregla puertas y cajones descolgados\n\nSi el mueble que quieres restaurar tiene la puerta descolgada, cambia la bisagra por una más grande. Para que la nueva se ajuste, amplía el cajeado con un formón. Una opción más fácil es pegar la bisagra antigua al mueble con cola rápida. Si los cajones no se deslizan bien, aplica un poco de jabón a las guías, o lija los laterales.\nPaso 5. Restaura cerraduras y herrajes']","Para restaurar un mueble antiguo, es importante seguir un proceso cuidadoso y detallado. Aquí te explico cómo hacerlo paso a paso:Preparación y limpieza: Antes de comenzar, asegúrate de que el mueble esté completamente limpio y libre de polvo, suciedad y pintura. Puedes hacer esto pasando el mueble bajo un trapo húmedo con jabón y agua, y luego secándolo con un trapo limpio. También puedes considerar la aplicación de un decapante para quitar el barniz o la pintura anterior.Para eliminar la carcoma: Si ves pequeños agujeros en la madera, puedes aplicar un producto especial para eliminar la carcoma. Aplica el producto en los huecos con una brocha y cubre el mueble con plástico para evitar que se seque. Déjalo actuar durante varias horas antes de limpiar y lijar la superficie.Restauración de la superficie: Si el mueble presenta rasguños o manchas, puedes tratarlas de la siguiente manera:Aplica un producto especial para eliminar la carcoma en los huecos. Cubre el mueble con plástico y deja que se seque durante varias horas.Aplique una solución de agua y leche caliente en las hendidras ligeras de la madera. Envuelve el mueble con plástico y déjalo actuar durante varias horas. Lija la superficie y repite la operación hasta que la fisura desaparezca.Para devolverle su color original, píntalo con óleos de la tonalidad de la madera. Esto ayudará a mantener la madera fresca y protegerla de la oxidación.¡Y eso es todo! Con estos pasos, podrás restaurar tu mueble antiguo y disfrutarlo por muchos años más. Recuerda siempre proteger tu hogar de la contaminación y el polvo, y asegúrate de que el mueble esté bien ventilado mientras trabajas.","Para restaurar un mueble antiguo, sigue estos pasos generales basados en varias fuentes:

    Preparación:
        Evaluación de Daños: Antes de comenzar, examina los daños y desperfectos del mueble para determinar los pasos a seguir​
        
Limpieza: Limpia bien el mueble, preferentemente con un producto como Superclean. Si la superficie está en buenas condiciones, puede que no necesites lijar en este punto​

Herramientas y Materiales Necesarios:

    Necesitarás lijas de varios tamaños y durezas, pinceles, trapos de algodón, destornilladores, cuchillas, estropajos de aluminio, algodón y una espátula​

Otros materiales pueden incluir pistola de pintura, tablero y listones redondos de madera DM, y cola para madera​

Restauración:

    Tratamiento de Carcoma: Si el mueble tiene carcoma, este es el primer problema que debes tratar​

Pintura: Mezcla agua y chalk paint según las indicaciones del fabricante y pinta el mueble. Después de pintar, elimina el exceso de humedad con un paño y espera a que la madera se seque antes de lijar​

Estos pasos generales te guiarán en el proceso, pero ten en cuenta que cada mueble puede requerir atención específica según su condición y estilo.",0.8016279185304267,0.99999999995,0.09090909090909091,1.0
Hola! ¿Podrías explicarme cuáles son los tres beneficios principales del Surya Namaskar?,"['Surya Namaskar: la mejor forma de empezar el día\n\nEl Saludo al Sol o Surya Namaskar es una de las prácticas más conocidas en yoga.\n\nTodavía recuerdo cuando lo practiqué por primera vez… ¡vaya lío!\n\nUno tiene que poner a prueba su concentración y estar completamente presente para poder seguir el ritmo (¡y no perderse por el camino!).\n\nEso sí, se aprende rápido y, una vez aprendido, difícilmente se olvida.\n\nAdemás, debo confesar que fue, y sigue siendo, una de mis prácticas de yoga favoritas.\n¿Qué es Surya Namaskar?\n\nEl saludo al sol es una secuencia dinámica de 12 asanas (posturas de yoga) sincronizadas con nuestra respiración. Por tanto, debe practicarse siempre desde la consciencia.\n\nSin duda alguna, es un excelente ritual para practicar por la mañana.\n\nNos permite conectar con nuestro cuerpo y con la energía del sol y del nuevo día. Precisamente de ahí viene su nombre: ""surya"" que significa sol y ""namaskar"" que significa saludo o prosternación.\n\nYo lo veo como una manera de honrar esta energía poderosa del sol y también como una forma de empezar el día desde una actitud de apertura, agradecimiento y  humildad.\n\nAunque practicarlo por la mañana es ideal, si nuestro horario no nos lo permite, merece la pena experimentar los beneficios de esta secuencia en cualquier otro momento del día.\n\nPor ejemplo, en las clases de yoga normalmente se practica al principio de la sesión como preparación para los asanas. Su propósito es calentar los músculos y articulaciones, tomar consciencia de la respiración y del propio cuerpo y calmar la mente.\nLos beneficios del saludo al sol\n\nSu práctica proporciona, al igual que el sol, una potente energía que va al cuerpo y a la mente.\n\nSe trata de un ejercicio super completo a nivel orgánico, ya que produce un beneficioso masaje interno, así como una mayor flexibilidad y resistencia.\n\nPor otro lado, a nivel sutil, estimula y genera una gran distribución energética, eliminando así ciertos bloqueos. \n\nComo he comentado antes, puede practicarse como preparación para los asanas. En este caso, se puede empezar con un ritmo relativamente lento, sin intensificar las posturas. A medida que avanzamos en su práctica y ganamos flexibilidad, podemos ir aumentando tanto el ritmo como la intensidad, hasta conseguir una dinámica fluida, más parecida a una danza que a una secuencia de posturas separadas.\n\nEn cambio, si la finalidad es la práctica en sí misma, con un objetivo mental y espiritual, el ritmo será más lento. La respiración cobra más importancia y el movimiento se convierte en un acto espiritual de ofrenda, desarrollando la percepción y el contacto sutil.\n\nAdemás del goce de la práctica en sí misma, y de los beneficios de cada una de las posturas en particular, me sorprendió conocer los muchos e importantes beneficios que la secuencia completa de Surya Namaskar aporta a todos los niveles. \n\nHe aquí un resumen: \n\n    Flexibiliza la columna vertebral, así como las articulaciones en general.\n    Corrige las curvaturas vertebrales excesivas.\n    Elimina dolores en la espalda. \n    Estimula y tonifica el sistema nervioso revitalizándolo.\n    Equilibra el sistema endocrino regulando las secreciones glandulares.\n    Mejora la digestión, asimilación y evacuación.\n    Normaliza la función renal.\n    Gran oxigenación y aumento de la capacidad respiratoria.\n    Activa la circulación sanguínea.\n    Aumenta las facultades cerebrales.\n    Agudiza la memoria.\n\n¿Cómo se realiza el saludo al sol?\n\nEn realidad, existen muchas variantes de esta práctica. La que practicamos en Satya es la variante de Hatha Yoga.\n\nSegún cita Satyananda en su libro ""Yogasanas – Pranayamas – Mudras – Bandhas» edición 1977, las 12 posturas de Surya Namakar y sus beneficios son los siguientes:', 'Saludo al sol o Surya Namaskar\nPor\nManuelMM\nSaludo-al-sol\n\nEl Saludo al sol, también llamado Surya Namaskar, es una secuencia de 12 posturas que se repiten varias veces. Cada movimiento está perfectamente sincronizado con la respiración. Además, este uno de los ejercicios del yoga más completos y aporta innumerables beneficios para el cuerpo y la mente.\n\nEl Saludo al Sol se suele realizar al comienzo de la práctica de yoga, ya que calienta y prepara el cuerpo para continuar con otros ejercicios. De hecho, puede formar parte de una sesión de yoga completa, pero también funcionar como ejercicio independiente.\n\nPor su sencillez, es uno de los primeros ejercicios que se enseñan a los yoguis principiantes. Si este es tu caso, no te pierdas este artículo, porque hoy te explicaremos paso a paso cómo practicar este ejercicio de yoga en casa.\nBeneficios del Saludo al sol\n\nLas 12 posturas y las 7 asanas que conforman el Saludo al sol lo convierten en una práctica muy completa, con beneficios para el cuerpo, mente y espíritu. Algunas de las ventajas de esta práctica son:\n\n    Aporta mayor flexibilidad y fortaleza a los músculos y articulaciones.\n    Ayuda a mejorar la postura y a fortalecer la espalda para reducir el riesgo de lesiones.\n    Es muy útil para lograr mayor estabilidad y equilibrio.\n    El control de la respiración favorece la concentración y reduce el estrés.\n    Ayuda a alcanzar el bienestar espiritual.\n    También aumenta la capacidad pulmonar y mejora la circulación de la sangre.\n    Es ideal para empezar el día llenos de energía y buen humor.\n\nAdemás, esta secuencia de ejercicios es apropiada para embarazadas. Eso sí, si es tu caso, recuerda consultar siempre con tu médico antes. Como ya sabes, no debes forzarte, llega hasta donde puedas.\nCómo hacer el Saludo al sol paso a paso\n\nYa conoces los beneficios de este ejercicio. ¿Estás listo/a para empezar? Hay diferentes tipos de yoga que realizan el Saludo al sol, con sus propias variaciones.\n\nA continuación, veremos el modo más extendido hoy en día, que es como se realiza en el Hatha yoga. Una vuelta completa son dos secuencias, una con el lado izquierdo y otra con el derecho.\n\n¡No te lo pierdas!\n1. Pranamasana – Inhalar y exhalar\n\nEsta es la primera postura y la más sencilla del saludo al sol, también conocida como postura de la oración. Nos colocaremos de pie sobre la esterilla de yoga con la espalda recta y las piernas bien estiradas.\n\nJuntamos las palmas de las manos y las colocamos frente al pecho. Inhalamos y exhalamos profundamente.\n2. Urdhva hastasana – Inhalar\n\nLa siguiente es la postura de la flexión hacia atrás con los brazos levantados. Para llevarla a cabo mantenemos las manos juntas y levantamos los brazos mientras inhalamos profundamente.\n\nEstiramos todo lo que podamos el cuerpo, siempre con los músculos relajados. Después, arqueamos la espalda hacia atrás manteniendo los brazos levantados y empujamos la cadera hacia delante.\n3. Uttanasana – Exhalar\n\nEn la Postura de la pinza de pie, Uttanasana o Padahastasana –que es una variante en la que se colocan las manos debajo de los pies— nos inclinamos hacia delante y expulsamos el aire lentamente.\n\nCon las manos colocadas a los lados de los pies y la cabeza tocando las rodillas, intentaremos tocar la esterilla con los dedos.\n\nSi no llegas puedes flexionar un poco las rodillas. No te preocupes, esta postura requiere un poco más de flexibilidad, pero con el tiempo y la práctica la lograrás.\n\n▶ Como sabemos que much@s queréis mejorar la flexibilidad, pásate por nuetro artículo donde te damos 10 consejos para que mejores la flexibilidad poco a poco! Pincha aqui.\n4. Ashwa Sanchalanasana – Inhalar']","El Surya Namaskar es una de las prácticas más conocidas en el yoga y es considerado uno de los ejercicios más completos y beneficiosos para el cuerpo, la mente y el espíritu. Aquí te explico tres de sus tres principales beneficios:

    Flexibilidad y Fortaleza Muscular: El Surya Namaskar no solo ayuda a mejorar la flexibilidad física, sino que también fortalece los músculos y articulaciones. Esto se debe a que cada movimiento está sincronizado con la respiración, lo que ayuda a calentar y preparar el cuerpo para los ejercicios posteriores. Además, la práctica regular de este ejercicio puede ayudar a fortalecer la espalda y reducir el riesgo de lesiones​.

Mejora de la Postura y Fortalecimiento de la Espalda: Practicar el Surya Namaskar puede ayudar a corregir las curvaturas vertebrales excesivas y reducir el dolor en la espalda. Esto se debe a que este ejercicio trabaja principalmente los músculos abdominales y la zona lumbar, que son importantes para mantener una buena postura​.

Espíritu y Bienestar: El Surya Namaskar también puede ayudar a alcanzar el bienestar espiritual. Se trata de un ejercicio que se practica con la respiración y la conciencia, lo que puede ayudar a conectar con la energía del sol y del nuevo día. Esto puede ayudar a aumentar la energía y mejorar el estado de ánimo​.

En resumen, el Surya Namaskar es una práctica completa y beneficiosas que puede ayudar a mejorar la flexibilidad, la fuerza muscular, la postura y el bienestar espiritual.","Los tres beneficios principales del Surya Namaskar, o Saludo al Sol, son los siguientes:

    Mejora de la Flexibilidad y la Fuerza:
        El Surya Namaskar proporciona un estiramiento completo al cuerpo, mejorando la flexibilidad de la columna vertebral y las articulaciones.
        Fortalece los músculos y articulaciones, mejorando la postura y reduciendo el riesgo de lesiones​.

Beneficios para la Salud Mental y la Concentración:

    La práctica del Saludo al Sol requiere un enfoque mental que mejora la concentración.
    La coordinación de movimientos con la respiración durante esta secuencia ayuda a reducir el estrés y fomenta el bienestar espiritual​​.

Mejora de la Salud Física General:

    Estimula y tonifica el sistema nervioso, revitalizándolo.
    Equilibra el sistema endocrino, regulando las secreciones glandulares.
    Mejora la digestión, asimilación y evacuación.
    Normaliza la función renal.
    Aumenta la capacidad pulmonar y mejora la circulación sanguínea​​.

Estos beneficios reflejan cómo el Surya Namaskar actúa sobre el cuerpo, la mente y el espíritu, proporcionando un ejercicio completo y equilibrado.",0.9684262920647582,0.99999999995,0.9565217391304348,1.0
Cita tres beneficios que tiene la práctica del saludo al sol.,"['Surya Namaskar: la mejor forma de empezar el día\n\nEl Saludo al Sol o Surya Namaskar es una de las prácticas más conocidas en yoga.\n\nTodavía recuerdo cuando lo practiqué por primera vez… ¡vaya lío!\n\nUno tiene que poner a prueba su concentración y estar completamente presente para poder seguir el ritmo (¡y no perderse por el camino!).\n\nEso sí, se aprende rápido y, una vez aprendido, difícilmente se olvida.\n\nAdemás, debo confesar que fue, y sigue siendo, una de mis prácticas de yoga favoritas.\n¿Qué es Surya Namaskar?\n\nEl saludo al sol es una secuencia dinámica de 12 asanas (posturas de yoga) sincronizadas con nuestra respiración. Por tanto, debe practicarse siempre desde la consciencia.\n\nSin duda alguna, es un excelente ritual para practicar por la mañana.\n\nNos permite conectar con nuestro cuerpo y con la energía del sol y del nuevo día. Precisamente de ahí viene su nombre: ""surya"" que significa sol y ""namaskar"" que significa saludo o prosternación.\n\nYo lo veo como una manera de honrar esta energía poderosa del sol y también como una forma de empezar el día desde una actitud de apertura, agradecimiento y  humildad.\n\nAunque practicarlo por la mañana es ideal, si nuestro horario no nos lo permite, merece la pena experimentar los beneficios de esta secuencia en cualquier otro momento del día.\n\nPor ejemplo, en las clases de yoga normalmente se practica al principio de la sesión como preparación para los asanas. Su propósito es calentar los músculos y articulaciones, tomar consciencia de la respiración y del propio cuerpo y calmar la mente.\nLos beneficios del saludo al sol\n\nSu práctica proporciona, al igual que el sol, una potente energía que va al cuerpo y a la mente.\n\nSe trata de un ejercicio super completo a nivel orgánico, ya que produce un beneficioso masaje interno, así como una mayor flexibilidad y resistencia.\n\nPor otro lado, a nivel sutil, estimula y genera una gran distribución energética, eliminando así ciertos bloqueos. \n\nComo he comentado antes, puede practicarse como preparación para los asanas. En este caso, se puede empezar con un ritmo relativamente lento, sin intensificar las posturas. A medida que avanzamos en su práctica y ganamos flexibilidad, podemos ir aumentando tanto el ritmo como la intensidad, hasta conseguir una dinámica fluida, más parecida a una danza que a una secuencia de posturas separadas.\n\nEn cambio, si la finalidad es la práctica en sí misma, con un objetivo mental y espiritual, el ritmo será más lento. La respiración cobra más importancia y el movimiento se convierte en un acto espiritual de ofrenda, desarrollando la percepción y el contacto sutil.\n\nAdemás del goce de la práctica en sí misma, y de los beneficios de cada una de las posturas en particular, me sorprendió conocer los muchos e importantes beneficios que la secuencia completa de Surya Namaskar aporta a todos los niveles. \n\nHe aquí un resumen: \n\n    Flexibiliza la columna vertebral, así como las articulaciones en general.\n    Corrige las curvaturas vertebrales excesivas.\n    Elimina dolores en la espalda. \n    Estimula y tonifica el sistema nervioso revitalizándolo.\n    Equilibra el sistema endocrino regulando las secreciones glandulares.\n    Mejora la digestión, asimilación y evacuación.\n    Normaliza la función renal.\n    Gran oxigenación y aumento de la capacidad respiratoria.\n    Activa la circulación sanguínea.\n    Aumenta las facultades cerebrales.\n    Agudiza la memoria.\n\n¿Cómo se realiza el saludo al sol?\n\nEn realidad, existen muchas variantes de esta práctica. La que practicamos en Satya es la variante de Hatha Yoga.\n\nSegún cita Satyananda en su libro ""Yogasanas – Pranayamas – Mudras – Bandhas» edición 1977, las 12 posturas de Surya Namakar y sus beneficios son los siguientes:', 'Saludo al sol o Surya Namaskar\nPor\nManuelMM\nSaludo-al-sol\n\nEl Saludo al sol, también llamado Surya Namaskar, es una secuencia de 12 posturas que se repiten varias veces. Cada movimiento está perfectamente sincronizado con la respiración. Además, este uno de los ejercicios del yoga más completos y aporta innumerables beneficios para el cuerpo y la mente.\n\nEl Saludo al Sol se suele realizar al comienzo de la práctica de yoga, ya que calienta y prepara el cuerpo para continuar con otros ejercicios. De hecho, puede formar parte de una sesión de yoga completa, pero también funcionar como ejercicio independiente.\n\nPor su sencillez, es uno de los primeros ejercicios que se enseñan a los yoguis principiantes. Si este es tu caso, no te pierdas este artículo, porque hoy te explicaremos paso a paso cómo practicar este ejercicio de yoga en casa.\nBeneficios del Saludo al sol\n\nLas 12 posturas y las 7 asanas que conforman el Saludo al sol lo convierten en una práctica muy completa, con beneficios para el cuerpo, mente y espíritu. Algunas de las ventajas de esta práctica son:\n\n    Aporta mayor flexibilidad y fortaleza a los músculos y articulaciones.\n    Ayuda a mejorar la postura y a fortalecer la espalda para reducir el riesgo de lesiones.\n    Es muy útil para lograr mayor estabilidad y equilibrio.\n    El control de la respiración favorece la concentración y reduce el estrés.\n    Ayuda a alcanzar el bienestar espiritual.\n    También aumenta la capacidad pulmonar y mejora la circulación de la sangre.\n    Es ideal para empezar el día llenos de energía y buen humor.\n\nAdemás, esta secuencia de ejercicios es apropiada para embarazadas. Eso sí, si es tu caso, recuerda consultar siempre con tu médico antes. Como ya sabes, no debes forzarte, llega hasta donde puedas.\nCómo hacer el Saludo al sol paso a paso\n\nYa conoces los beneficios de este ejercicio. ¿Estás listo/a para empezar? Hay diferentes tipos de yoga que realizan el Saludo al sol, con sus propias variaciones.\n\nA continuación, veremos el modo más extendido hoy en día, que es como se realiza en el Hatha yoga. Una vuelta completa son dos secuencias, una con el lado izquierdo y otra con el derecho.\n\n¡No te lo pierdas!\n1. Pranamasana – Inhalar y exhalar\n\nEsta es la primera postura y la más sencilla del saludo al sol, también conocida como postura de la oración. Nos colocaremos de pie sobre la esterilla de yoga con la espalda recta y las piernas bien estiradas.\n\nJuntamos las palmas de las manos y las colocamos frente al pecho. Inhalamos y exhalamos profundamente.\n2. Urdhva hastasana – Inhalar\n\nLa siguiente es la postura de la flexión hacia atrás con los brazos levantados. Para llevarla a cabo mantenemos las manos juntas y levantamos los brazos mientras inhalamos profundamente.\n\nEstiramos todo lo que podamos el cuerpo, siempre con los músculos relajados. Después, arqueamos la espalda hacia atrás manteniendo los brazos levantados y empujamos la cadera hacia delante.\n3. Uttanasana – Exhalar\n\nEn la Postura de la pinza de pie, Uttanasana o Padahastasana –que es una variante en la que se colocan las manos debajo de los pies— nos inclinamos hacia delante y expulsamos el aire lentamente.\n\nCon las manos colocadas a los lados de los pies y la cabeza tocando las rodillas, intentaremos tocar la esterilla con los dedos.\n\nSi no llegas puedes flexionar un poco las rodillas. No te preocupes, esta postura requiere un poco más de flexibilidad, pero con el tiempo y la práctica la lograrás.\n\n▶ Como sabemos que much@s queréis mejorar la flexibilidad, pásate por nuetro artículo donde te damos 10 consejos para que mejores la flexibilidad poco a poco! Pincha aqui.\n4. Ashwa Sanchalanasana – Inhalar']","El Saludo al Sol, también conocido como Surya Namaskar, es una de las prácticas más conocidas en el yoga. Esta secuencia de 12 asanas (posturas de yoga) sincronizadas con la respiración debe practicarse siempre desde la conciencia. A continuación, se presentan tres beneficios destacados de esta práctica:

    Calentamiento y preparación física: El Saludo al Sol no solo ofrece beneficios para el cuerpo, sino que también ayuda a prepararlo para otros ejercicios. Al comenzar con esta práctica, se puede reducir el riesgo de lesiones y mejorar la movilidad y la flexibilidad.

    Mejora de la postura y fortalecimiento de la espalda: Las posturas de este ejercicio, como la postura de la oración y la postura de la pinza de pie, ayudan a fortalecer la espalda y a mejorar su postura. Esto es especialmente importante para aquellos que buscan reducir el riesgo de lesiones en la espalda.

    Espíritu y bienestar: Además de los beneficios físicos, el Saludo al Sol también puede ayudar a alcanzar un estado de bienestar espiritual. Al practicar esta práctica, se puede conectar con la energía del sol y del nuevo día, lo que puede ayudar a mejorar la salud emocional y mental.

En resumen, el Saludo al Sol es una práctica completa y aporta numerosos beneficios para el cuerpo, la mente y el espíritu. Desde la flexibilidad y la fortaleza muscular hasta el bienestar espiritual, esta práctica es recomendable para cualquier practicante de yoga que busque un desafío físico y espiritual.","Los tres beneficios principales del Surya Namaskar, o Saludo al Sol, son los siguientes:

    Mejora de la Flexibilidad y la Fuerza:
        El Surya Namaskar proporciona un estiramiento completo al cuerpo, mejorando la flexibilidad de la columna vertebral y las articulaciones.
        Fortalece los músculos y articulaciones, mejorando la postura y reduciendo el riesgo de lesiones​.

Beneficios para la Salud Mental y la Concentración:

    La práctica del Saludo al Sol requiere un enfoque mental que mejora la concentración.
    La coordinación de movimientos con la respiración durante esta secuencia ayuda a reducir el estrés y fomenta el bienestar espiritual​​.

Mejora de la Salud Física General:

    Estimula y tonifica el sistema nervioso, revitalizándolo.
    Equilibra el sistema endocrino, regulando las secreciones glandulares.
    Mejora la digestión, asimilación y evacuación.
    Normaliza la función renal.
    Aumenta la capacidad pulmonar y mejora la circulación sanguínea​​.

Estos beneficios reflejan cómo el Surya Namaskar actúa sobre el cuerpo, la mente y el espíritu, proporcionando un ejercicio completo y equilibrado.",0.6798509538795084,0.99999999995,0.8125,1.0
"¿Serías tan amable de explicarme los tres beneficios principales del saludo al sol en yoga, por favor?","['Saludo al sol o Surya Namaskar\nPor\nManuelMM\nSaludo-al-sol\n\nEl Saludo al sol, también llamado Surya Namaskar, es una secuencia de 12 posturas que se repiten varias veces. Cada movimiento está perfectamente sincronizado con la respiración. Además, este uno de los ejercicios del yoga más completos y aporta innumerables beneficios para el cuerpo y la mente.\n\nEl Saludo al Sol se suele realizar al comienzo de la práctica de yoga, ya que calienta y prepara el cuerpo para continuar con otros ejercicios. De hecho, puede formar parte de una sesión de yoga completa, pero también funcionar como ejercicio independiente.\n\nPor su sencillez, es uno de los primeros ejercicios que se enseñan a los yoguis principiantes. Si este es tu caso, no te pierdas este artículo, porque hoy te explicaremos paso a paso cómo practicar este ejercicio de yoga en casa.\nBeneficios del Saludo al sol\n\nLas 12 posturas y las 7 asanas que conforman el Saludo al sol lo convierten en una práctica muy completa, con beneficios para el cuerpo, mente y espíritu. Algunas de las ventajas de esta práctica son:\n\n    Aporta mayor flexibilidad y fortaleza a los músculos y articulaciones.\n    Ayuda a mejorar la postura y a fortalecer la espalda para reducir el riesgo de lesiones.\n    Es muy útil para lograr mayor estabilidad y equilibrio.\n    El control de la respiración favorece la concentración y reduce el estrés.\n    Ayuda a alcanzar el bienestar espiritual.\n    También aumenta la capacidad pulmonar y mejora la circulación de la sangre.\n    Es ideal para empezar el día llenos de energía y buen humor.\n\nAdemás, esta secuencia de ejercicios es apropiada para embarazadas. Eso sí, si es tu caso, recuerda consultar siempre con tu médico antes. Como ya sabes, no debes forzarte, llega hasta donde puedas.\nCómo hacer el Saludo al sol paso a paso\n\nYa conoces los beneficios de este ejercicio. ¿Estás listo/a para empezar? Hay diferentes tipos de yoga que realizan el Saludo al sol, con sus propias variaciones.\n\nA continuación, veremos el modo más extendido hoy en día, que es como se realiza en el Hatha yoga. Una vuelta completa son dos secuencias, una con el lado izquierdo y otra con el derecho.\n\n¡No te lo pierdas!\n1. Pranamasana – Inhalar y exhalar\n\nEsta es la primera postura y la más sencilla del saludo al sol, también conocida como postura de la oración. Nos colocaremos de pie sobre la esterilla de yoga con la espalda recta y las piernas bien estiradas.\n\nJuntamos las palmas de las manos y las colocamos frente al pecho. Inhalamos y exhalamos profundamente.\n2. Urdhva hastasana – Inhalar\n\nLa siguiente es la postura de la flexión hacia atrás con los brazos levantados. Para llevarla a cabo mantenemos las manos juntas y levantamos los brazos mientras inhalamos profundamente.\n\nEstiramos todo lo que podamos el cuerpo, siempre con los músculos relajados. Después, arqueamos la espalda hacia atrás manteniendo los brazos levantados y empujamos la cadera hacia delante.\n3. Uttanasana – Exhalar\n\nEn la Postura de la pinza de pie, Uttanasana o Padahastasana –que es una variante en la que se colocan las manos debajo de los pies— nos inclinamos hacia delante y expulsamos el aire lentamente.\n\nCon las manos colocadas a los lados de los pies y la cabeza tocando las rodillas, intentaremos tocar la esterilla con los dedos.\n\nSi no llegas puedes flexionar un poco las rodillas. No te preocupes, esta postura requiere un poco más de flexibilidad, pero con el tiempo y la práctica la lograrás.\n\n▶ Como sabemos que much@s queréis mejorar la flexibilidad, pásate por nuetro artículo donde te damos 10 consejos para que mejores la flexibilidad poco a poco! Pincha aqui.\n4. Ashwa Sanchalanasana – Inhalar', 'Surya Namaskar: la mejor forma de empezar el día\n\nEl Saludo al Sol o Surya Namaskar es una de las prácticas más conocidas en yoga.\n\nTodavía recuerdo cuando lo practiqué por primera vez… ¡vaya lío!\n\nUno tiene que poner a prueba su concentración y estar completamente presente para poder seguir el ritmo (¡y no perderse por el camino!).\n\nEso sí, se aprende rápido y, una vez aprendido, difícilmente se olvida.\n\nAdemás, debo confesar que fue, y sigue siendo, una de mis prácticas de yoga favoritas.\n¿Qué es Surya Namaskar?\n\nEl saludo al sol es una secuencia dinámica de 12 asanas (posturas de yoga) sincronizadas con nuestra respiración. Por tanto, debe practicarse siempre desde la consciencia.\n\nSin duda alguna, es un excelente ritual para practicar por la mañana.\n\nNos permite conectar con nuestro cuerpo y con la energía del sol y del nuevo día. Precisamente de ahí viene su nombre: ""surya"" que significa sol y ""namaskar"" que significa saludo o prosternación.\n\nYo lo veo como una manera de honrar esta energía poderosa del sol y también como una forma de empezar el día desde una actitud de apertura, agradecimiento y  humildad.\n\nAunque practicarlo por la mañana es ideal, si nuestro horario no nos lo permite, merece la pena experimentar los beneficios de esta secuencia en cualquier otro momento del día.\n\nPor ejemplo, en las clases de yoga normalmente se practica al principio de la sesión como preparación para los asanas. Su propósito es calentar los músculos y articulaciones, tomar consciencia de la respiración y del propio cuerpo y calmar la mente.\nLos beneficios del saludo al sol\n\nSu práctica proporciona, al igual que el sol, una potente energía que va al cuerpo y a la mente.\n\nSe trata de un ejercicio super completo a nivel orgánico, ya que produce un beneficioso masaje interno, así como una mayor flexibilidad y resistencia.\n\nPor otro lado, a nivel sutil, estimula y genera una gran distribución energética, eliminando así ciertos bloqueos. \n\nComo he comentado antes, puede practicarse como preparación para los asanas. En este caso, se puede empezar con un ritmo relativamente lento, sin intensificar las posturas. A medida que avanzamos en su práctica y ganamos flexibilidad, podemos ir aumentando tanto el ritmo como la intensidad, hasta conseguir una dinámica fluida, más parecida a una danza que a una secuencia de posturas separadas.\n\nEn cambio, si la finalidad es la práctica en sí misma, con un objetivo mental y espiritual, el ritmo será más lento. La respiración cobra más importancia y el movimiento se convierte en un acto espiritual de ofrenda, desarrollando la percepción y el contacto sutil.\n\nAdemás del goce de la práctica en sí misma, y de los beneficios de cada una de las posturas en particular, me sorprendió conocer los muchos e importantes beneficios que la secuencia completa de Surya Namaskar aporta a todos los niveles. \n\nHe aquí un resumen: \n\n    Flexibiliza la columna vertebral, así como las articulaciones en general.\n    Corrige las curvaturas vertebrales excesivas.\n    Elimina dolores en la espalda. \n    Estimula y tonifica el sistema nervioso revitalizándolo.\n    Equilibra el sistema endocrino regulando las secreciones glandulares.\n    Mejora la digestión, asimilación y evacuación.\n    Normaliza la función renal.\n    Gran oxigenación y aumento de la capacidad respiratoria.\n    Activa la circulación sanguínea.\n    Aumenta las facultades cerebrales.\n    Agudiza la memoria.\n\n¿Cómo se realiza el saludo al sol?\n\nEn realidad, existen muchas variantes de esta práctica. La que practicamos en Satya es la variante de Hatha Yoga.\n\nSegún cita Satyananda en su libro ""Yogasanas – Pranayamas – Mudras – Bandhas» edición 1977, las 12 posturas de Surya Namakar y sus beneficios son los siguientes:']","Claro, con gusto te explicaré los tres beneficios principales del Saludo al Sol en Yoga:

    Calentamiento y Concentración: Practicar el Saludo al Sol puede ayudar a calentar los músculos y articulaciones, lo que es especialmente importante para evitar lesiones. Además, la práctica regular puede ayudar a mantener la mente enfocada y aumentar la concentración.

    Beneficios Orgánicos: El Saludo al Sol no solo es una forma de honrar al sol y a la energía del nuevo día, sino que también puede tener un impacto positivo en el cuerpo y la mente. Se ha demostrado que esta práctica ayuda a mejorar la flexibilidad, la resistencia y la distribución energética, lo que puede reducir los bloqueos y mejorar la salud en general.

    Beneficios Espirituales: Además de los beneficios orgánicos, el Saludo al Sol también puede ser utilizado para cultivar la conexión con el espíritu y la espiritualidad. Al centrarse en la respiración y la conciencia, se puede establecer un estado de paz interior y de gratitud por lo que tenemos. Esto puede llevar a una mayor comprensión y conexión con el universo.

En cuanto a la práctica del Saludo al Sol, existen varias formas y variaciones. La variante de Hatha Yoga es la más conocida y consiste en 12 posturas sincronizadas con la respiración. Esta práctica es adecuada tanto para principiantes como para profesionales, y puede ser adaptada según las necesidades individuales.","Los tres beneficios principales del Surya Namaskar, o Saludo al Sol, son los siguientes:

    Mejora de la Flexibilidad y la Fuerza:
        El Surya Namaskar proporciona un estiramiento completo al cuerpo, mejorando la flexibilidad de la columna vertebral y las articulaciones.
        Fortalece los músculos y articulaciones, mejorando la postura y reduciendo el riesgo de lesiones​.

Beneficios para la Salud Mental y la Concentración:

    La práctica del Saludo al Sol requiere un enfoque mental que mejora la concentración.
    La coordinación de movimientos con la respiración durante esta secuencia ayuda a reducir el estrés y fomenta el bienestar espiritual​​.

Mejora de la Salud Física General:

    Estimula y tonifica el sistema nervioso, revitalizándolo.
    Equilibra el sistema endocrino, regulando las secreciones glandulares.
    Mejora la digestión, asimilación y evacuación.
    Normaliza la función renal.
    Aumenta la capacidad pulmonar y mejora la circulación sanguínea​​.

Estos beneficios reflejan cómo el Surya Namaskar actúa sobre el cuerpo, la mente y el espíritu, proporcionando un ejercicio completo y equilibrado.",0.9219670879096519,0.99999999995,0.9230769230769231,1.0
"Buenas tardes, me gustaría ampliar un poco mis conocimientos sobre los beneficios del yoga, en concreto, de la práctica dle saludo al sol. ¿Podrías ayudarme con algo de información?","['Saludo al sol o Surya Namaskar\nPor\nManuelMM\nSaludo-al-sol\n\nEl Saludo al sol, también llamado Surya Namaskar, es una secuencia de 12 posturas que se repiten varias veces. Cada movimiento está perfectamente sincronizado con la respiración. Además, este uno de los ejercicios del yoga más completos y aporta innumerables beneficios para el cuerpo y la mente.\n\nEl Saludo al Sol se suele realizar al comienzo de la práctica de yoga, ya que calienta y prepara el cuerpo para continuar con otros ejercicios. De hecho, puede formar parte de una sesión de yoga completa, pero también funcionar como ejercicio independiente.\n\nPor su sencillez, es uno de los primeros ejercicios que se enseñan a los yoguis principiantes. Si este es tu caso, no te pierdas este artículo, porque hoy te explicaremos paso a paso cómo practicar este ejercicio de yoga en casa.\nBeneficios del Saludo al sol\n\nLas 12 posturas y las 7 asanas que conforman el Saludo al sol lo convierten en una práctica muy completa, con beneficios para el cuerpo, mente y espíritu. Algunas de las ventajas de esta práctica son:\n\n    Aporta mayor flexibilidad y fortaleza a los músculos y articulaciones.\n    Ayuda a mejorar la postura y a fortalecer la espalda para reducir el riesgo de lesiones.\n    Es muy útil para lograr mayor estabilidad y equilibrio.\n    El control de la respiración favorece la concentración y reduce el estrés.\n    Ayuda a alcanzar el bienestar espiritual.\n    También aumenta la capacidad pulmonar y mejora la circulación de la sangre.\n    Es ideal para empezar el día llenos de energía y buen humor.\n\nAdemás, esta secuencia de ejercicios es apropiada para embarazadas. Eso sí, si es tu caso, recuerda consultar siempre con tu médico antes. Como ya sabes, no debes forzarte, llega hasta donde puedas.\nCómo hacer el Saludo al sol paso a paso\n\nYa conoces los beneficios de este ejercicio. ¿Estás listo/a para empezar? Hay diferentes tipos de yoga que realizan el Saludo al sol, con sus propias variaciones.\n\nA continuación, veremos el modo más extendido hoy en día, que es como se realiza en el Hatha yoga. Una vuelta completa son dos secuencias, una con el lado izquierdo y otra con el derecho.\n\n¡No te lo pierdas!\n1. Pranamasana – Inhalar y exhalar\n\nEsta es la primera postura y la más sencilla del saludo al sol, también conocida como postura de la oración. Nos colocaremos de pie sobre la esterilla de yoga con la espalda recta y las piernas bien estiradas.\n\nJuntamos las palmas de las manos y las colocamos frente al pecho. Inhalamos y exhalamos profundamente.\n2. Urdhva hastasana – Inhalar\n\nLa siguiente es la postura de la flexión hacia atrás con los brazos levantados. Para llevarla a cabo mantenemos las manos juntas y levantamos los brazos mientras inhalamos profundamente.\n\nEstiramos todo lo que podamos el cuerpo, siempre con los músculos relajados. Después, arqueamos la espalda hacia atrás manteniendo los brazos levantados y empujamos la cadera hacia delante.\n3. Uttanasana – Exhalar\n\nEn la Postura de la pinza de pie, Uttanasana o Padahastasana –que es una variante en la que se colocan las manos debajo de los pies— nos inclinamos hacia delante y expulsamos el aire lentamente.\n\nCon las manos colocadas a los lados de los pies y la cabeza tocando las rodillas, intentaremos tocar la esterilla con los dedos.\n\nSi no llegas puedes flexionar un poco las rodillas. No te preocupes, esta postura requiere un poco más de flexibilidad, pero con el tiempo y la práctica la lograrás.\n\n▶ Como sabemos que much@s queréis mejorar la flexibilidad, pásate por nuetro artículo donde te damos 10 consejos para que mejores la flexibilidad poco a poco! Pincha aqui.\n4. Ashwa Sanchalanasana – Inhalar', 'Surya Namaskar: la mejor forma de empezar el día\n\nEl Saludo al Sol o Surya Namaskar es una de las prácticas más conocidas en yoga.\n\nTodavía recuerdo cuando lo practiqué por primera vez… ¡vaya lío!\n\nUno tiene que poner a prueba su concentración y estar completamente presente para poder seguir el ritmo (¡y no perderse por el camino!).\n\nEso sí, se aprende rápido y, una vez aprendido, difícilmente se olvida.\n\nAdemás, debo confesar que fue, y sigue siendo, una de mis prácticas de yoga favoritas.\n¿Qué es Surya Namaskar?\n\nEl saludo al sol es una secuencia dinámica de 12 asanas (posturas de yoga) sincronizadas con nuestra respiración. Por tanto, debe practicarse siempre desde la consciencia.\n\nSin duda alguna, es un excelente ritual para practicar por la mañana.\n\nNos permite conectar con nuestro cuerpo y con la energía del sol y del nuevo día. Precisamente de ahí viene su nombre: ""surya"" que significa sol y ""namaskar"" que significa saludo o prosternación.\n\nYo lo veo como una manera de honrar esta energía poderosa del sol y también como una forma de empezar el día desde una actitud de apertura, agradecimiento y  humildad.\n\nAunque practicarlo por la mañana es ideal, si nuestro horario no nos lo permite, merece la pena experimentar los beneficios de esta secuencia en cualquier otro momento del día.\n\nPor ejemplo, en las clases de yoga normalmente se practica al principio de la sesión como preparación para los asanas. Su propósito es calentar los músculos y articulaciones, tomar consciencia de la respiración y del propio cuerpo y calmar la mente.\nLos beneficios del saludo al sol\n\nSu práctica proporciona, al igual que el sol, una potente energía que va al cuerpo y a la mente.\n\nSe trata de un ejercicio super completo a nivel orgánico, ya que produce un beneficioso masaje interno, así como una mayor flexibilidad y resistencia.\n\nPor otro lado, a nivel sutil, estimula y genera una gran distribución energética, eliminando así ciertos bloqueos. \n\nComo he comentado antes, puede practicarse como preparación para los asanas. En este caso, se puede empezar con un ritmo relativamente lento, sin intensificar las posturas. A medida que avanzamos en su práctica y ganamos flexibilidad, podemos ir aumentando tanto el ritmo como la intensidad, hasta conseguir una dinámica fluida, más parecida a una danza que a una secuencia de posturas separadas.\n\nEn cambio, si la finalidad es la práctica en sí misma, con un objetivo mental y espiritual, el ritmo será más lento. La respiración cobra más importancia y el movimiento se convierte en un acto espiritual de ofrenda, desarrollando la percepción y el contacto sutil.\n\nAdemás del goce de la práctica en sí misma, y de los beneficios de cada una de las posturas en particular, me sorprendió conocer los muchos e importantes beneficios que la secuencia completa de Surya Namaskar aporta a todos los niveles. \n\nHe aquí un resumen: \n\n    Flexibiliza la columna vertebral, así como las articulaciones en general.\n    Corrige las curvaturas vertebrales excesivas.\n    Elimina dolores en la espalda. \n    Estimula y tonifica el sistema nervioso revitalizándolo.\n    Equilibra el sistema endocrino regulando las secreciones glandulares.\n    Mejora la digestión, asimilación y evacuación.\n    Normaliza la función renal.\n    Gran oxigenación y aumento de la capacidad respiratoria.\n    Activa la circulación sanguínea.\n    Aumenta las facultades cerebrales.\n    Agudiza la memoria.\n\n¿Cómo se realiza el saludo al sol?\n\nEn realidad, existen muchas variantes de esta práctica. La que practicamos en Satya es la variante de Hatha Yoga.\n\nSegún cita Satyananda en su libro ""Yogasanas – Pranayamas – Mudras – Bandhas» edición 1977, las 12 posturas de Surya Namakar y sus beneficios son los siguientes:']","Claro, estaré encantado de ayudarte a expandir tus conocimientos sobre el yoga y en particular sobre la práctica del Saludo al Sol.

El Saludo al Sol, también conocido como Surya Namaskar, es una secuencia de 12 posturas que se repiten varias veces. Cada movimiento está perfectamente sincronizado con la respiración. Este es uno de los ejercicios del yoga más completos y aporta numerosos beneficios para el cuerpo y la mente.

Algunos de los beneficios más destacados de la práctica del Saludo al Sol incluyen:

    Mayor flexibilidad y fortaleza en los músculos y articulaciones.
    Mejora de la postura y fortalecimiento de la espalda para reducir el riesgo de lesiones.
    Aumento de la estabilidad y equilibrio.
    Control de la respiración para la concentración y reducción del estrés.
    Aumento de la capacidad pulmonar y mejora la circulación sanguínea.
    Mejora en la salud mental y espiritual.

Además, este ejercicio es adecuado para embarazadas, ya que calienta y prepara el cuerpo para otros ejercicios. Sin embargo, si eres embarazada, es importante consultar siempre con tu médico antes de comenzar cualquier nueva práctica de yoga o ejercicio.

En cuanto a la práctica del Saludo al Sol, existen diferentes formas y variaciones. Uno de los más extendidos es el Hatha yoga, que utiliza una postura más fluida y dinámica. Aquí te presento los pasos para realizarlo:

    Pranamasana - Inhalar y exhalar
    Urdhva hastasana - Inhalar
    Uttanasana - Exhalar
    Ashva Sanchalanasana - Inhalar
    
    Estas posturas deben realizarse con cuidado y precisión, asegurándose de que la respiración sea profunda y uniforme. También es importante mantener una postura erguida y equilibrada durante la práctica.

En resumen, el Saludo al Sol es una práctica del yoga muy completa y beneficiosas para el cuerpo y la mente. Con un poco de práctica y dedicación, podrás experimentar los muchos beneficios que ofrece este ejercicio.","Los tres beneficios principales del Surya Namaskar, o Saludo al Sol, son los siguientes:

    Mejora de la Flexibilidad y la Fuerza:
        El Surya Namaskar proporciona un estiramiento completo al cuerpo, mejorando la flexibilidad de la columna vertebral y las articulaciones.
        Fortalece los músculos y articulaciones, mejorando la postura y reduciendo el riesgo de lesiones​.

Beneficios para la Salud Mental y la Concentración:

    La práctica del Saludo al Sol requiere un enfoque mental que mejora la concentración.
    La coordinación de movimientos con la respiración durante esta secuencia ayuda a reducir el estrés y fomenta el bienestar espiritual​​.

Mejora de la Salud Física General:

    Estimula y tonifica el sistema nervioso, revitalizándolo.
    Equilibra el sistema endocrino, regulando las secreciones glandulares.
    Mejora la digestión, asimilación y evacuación.
    Normaliza la función renal.
    Aumenta la capacidad pulmonar y mejora la circulación sanguínea​​.

Estos beneficios reflejan cómo el Surya Namaskar actúa sobre el cuerpo, la mente y el espíritu, proporcionando un ejercicio completo y equilibrado.",0.7554515572776177,0.99999999995,1.0,0.0
necesito buscar un parking o algo en la calle Bailén o alrededores,"['DESDE 15€/DÍA\n\nParking en madrid\nEncuentra el parking más cercano a tu destino.\nPARKING EN LA ZONA DE LA CALLE BAILÉN\nParking en la zona de la calle Bailén\nBuscar aparcamiento en Madrid se convierte, diariamente, en un problema para numerosos conductores. Tanto conductores que conocen la zona donde quieren aparcar, como otros que la visitan por primera vez, hallan innumerables problemas sobre todo en días de mucha afluencia de tráfico. Mediante un parking en la zona de la calle Bailén, todo aquel que desee estacionar en o cerca de esta importante calle de Madrid, podrá sentirse seguro al dejar su coche bajo la supervisión de profesionales.\n\nTecnología al servicio de la vigilancia en los parkings\n\nHoy en día los aparcamientos deben estar perfectamente acondicionados si se quiere disfrutar de espacios adecuados para todo tipo de coches. La tecnología, en forma de cámaras de TV, está al servicio de la vigilancia en los parkings. Los circuitos de cámaras se coordinan y son controlados por personal especializados, quien también realiza comprobaciones personales del buen estado de todas las instalaciones. Los lugares en donde se estacionan los vehículos, también han de ser vigilados periódicamente, de manera que nadie con intenciones sospechosas logre sus objetivos. Los ladrones no darían el paso de robar en aparcamientos vigilados, ni, por supuesto los gamberros perpetrarían actos vandálicos en estos espacios. Los circuitos cerrados de TV se hallan coordinados para que el control sea total.\n\nAhorrar con un parking\n\nLos conductores se ven en la posibilidad de ahorrar con un parking, un lugar que les evitará desperdiciar combustible. Este hecho se da normalmente cuando los conductores circulan en búsqueda de una plaza en la calle o en explanadas habilitadas para estacionar. En muchas situaciones, el tráfico hace que sea imposible hallar el tan ansiado hueco, de manera que no quede más solución que contar con una plaza de parking privado. Se ahorrará gasolina, gasoil o electricidad, pero también se ahorrará en multas. Es frecuente que la prisa propicie en los conductores la toma de malas decisiones, como es por ejemplo estacionar en doble fila.\nCategorias - Aparcamiento, blog, Madrid, Parking, Parking cerca de calle Bailén, Parking privado', '¿DÓNDE APARCAR CERCA DEL PALACIO REAL?\nPlaza de Oriente\nCompartir:\n\ntwitter | Total Renting\nfacebook | Total Renting\nlinkedin in | Total Renting\nwhatsapp | Total Renting\nenvelope solid | Total Renting\n+\n−\nLeaflet, © OpenStreetMap colaboradores\n\nPlaza de Oriente\nLa Plaza de Oriente es un lugar emblemático en Madrid, justo frente al Palacio Real. Aunque es una zona muy concurrida por turistas, cuenta con varias opciones de aparcamiento en sus alrededores. El parking subterráneo de la plaza es una opción segura para dejar tu vehículo, aunque puede resultar algo costoso.\n\nTipo de parking\tCoste por hora\tDificultad para aparcar\nParking subterráneo\t3,00eur.\tMedia\nCalle Bailén\nLa Calle Bailén, situada justo detrás del Palacio Real, es una zona de estacionamiento regulado, conocida como zona azul. Aunque suele tener bastante flujo de vehículos, si tienes paciencia es posible encontrar sitio. Recuerda que debes pagar en los parquímetros y respetar el tiempo máximo permitido.\n\nTipo de parking\tCoste por hora\tDificultad para aparcar\nZona azul\t2,00eur.\tAlta\nJardines de Sabatini\nLos Jardines de Sabatini, ubicados al norte del Palacio Real, cuentan con un aparcamiento subterráneo. Es una opción cómoda y segura, aunque es probable que durante los fines de semana y festivos esté bastante concurrido.\n\nTipo de parking\tCoste por hora\tDificultad para aparcar\nParking subterráneo\t2,50eur.\tAlta\nCuesta de San Vicente\nLa Cuesta de San Vicente, que desemboca en la Plaza de España, es una calle amplia con numerosas plazas de aparcamiento en zona verde. Esta zona es más económica que la azul, pero también tiene limitación horaria.\n\nTipo de parking\tCoste por hora\tDificultad para aparcar\nZona verde\t1,50eur.\tMedia\nDonde aparcar gratis en Cerca Dpalacio Real\nEstadio Vicente Calderón\nEl antiguo Estadio Vicente Calderón, ubicado en Paseo Virgen del Puerto, 67, está aproximadamente a 20 minutos a pie de cerca dpalacio real. Aunque el estadio ya no está en uso, su aparcamiento sigue siendo gratuito y suele tener bastante espacio disponible, especialmente durante el fin de semana.\n\nPara llegar desde cerca dpalacio real, toma Calle Bailén hacia el sur hasta llegar a Calle Segovia. Gira a la derecha en Calle Segovia y sigue hasta llegar a Paseo de los Pontones. Gira a la izquierda en Paseo de los Pontones y continúa hasta llegar al estadio. Aunque el aparcamiento está un poco alejado, la ventaja es que es una zona segura y tranquiliza donde dejar tu vehículo.\n\nNota: Ten en cuenta que puede ser más difícil encontrar un lugar durante los días de partido o durante eventos especiales.\n\nEstacionamiento de la Universidad Politécnica de Madrid\nOtro lugar donde puedes aparcar gratis cerca de cerca dpalacio real es el estacionamiento de la Universidad Politécnica de Madrid, ubicada en Paseo Juan XXIII, 11. Este aparcamiento está a unos 30 minutos a pie de cerca dpalacio real, pero es una opción conveniente si no te importa caminar un poco.\n\nPara llegar desde cerca dpalacio real, toma Calle Bailén hacia el norte hasta llegar a Calle Mayor. Gira a la derecha en Calle Mayor y sigue hasta llegar a Plaza de la Villa. Gira a la izquierda en Plaza de la Villa y continúa hasta llegar a Calle de Segovia. Gira a la derecha en Calle de Segovia y sigue hasta llegar a Paseo de Extremadura.\n\nNota: Ten en cuenta que este aparcamiento puede estar más ocupado durante el día debido a la actividad universitaria, pero suele haber más disponibilidad por la noche y durante el fin de semana.', 'Parking Plaza de Oriente APK2\nCalle de Bailén, 6\n186 opiniones\nicon contactless\nEntrada y salida sin contacto\nPuedes entrar y salir de este parking de manera automática, sin necesidad de coger tícket o pasar por cabina de control.\n\nDetalles: Sobre el parking\nEl acceso principal del parking que va desde Plaza España hasta la calle Bailén está cortado por obras. Podrás acceder a este parking en la Plaza de Oriente: - Desde Puerta de Toledo hasta Calle Bailén. - Desde el Puente de Segovia, pasando por Cuesta de la Vega. - Desde la Cuesta de San Vicente, pasando por la Calle Leganitos, siguiendo por la Cuesta de Santo Domingo. - Desde Argüelles, pasando por Gran Vía, hasta llegar a la Calle San Bernardo. Haz click aquí para ver las indicaciones en el mapa. ------------------------------ Aparcamiento situado dentro de MADRID CENTRAL. ¡No hay multas en Madrid Central si reservas con Parclick! Lo único que necesitas es tu reserva y tener pegada tu etiqueta medioambiental (0, ECO, C o B). Con este parking vigilado, el parking Plaza de Oriente vas a aparcar en el centro de Madrid y salir a las principales atracciones turísticas como el Palacio Real, la Plaza de Oriente, o la Catedral de la Almudena. Además, puedes aparcar tu autobús en el centro de Madrid en este parking cubierto. Un punto fuerte de este parking APK2 Plaza de Oriente es su fácil acceso, ya que tiene una entrada especialmente adaptada para autobuses. Entras en el túnel de la Calle Bailén, avanzas un poco y te desvías a la derecha, directo al parking. Una vez allí, tienes 30 plazas donde aparcar tu autobús. Esto te vendrá de perlas si vienes en grupo a Madrid y no quieres perder ni un segundo de tu tiempo en transporte. Además, es un parking abierto 24h, por lo que el horario de llegada no va a ser ningún problema para ti. Ahora que has visto que aparcar tu autobús en Madrid es posible y te hemos explicado las ventajas de aparcar en el APK2 Plaza de Oriente, ¿a qué estás esperando para reservar tu plaza ya? Reserva una plaza en el Parking APK2 Plaza de Oriente, ubicado en la Calle de Bailén, 6. \nParking Plaza de Oriente APK2 14218Parking Plaza de Oriente APK2 14219\n+5\nVer todas\n¿Cómo llegar?\nHORARIO DEL PARKING\nAbierto las 24 horas del díaIcon Marker\n\n¿Cómo acceder?\nA TU LLEGADA:\n\nSi llegas con más antelación, la barrera no se abrirá automáticamente y te aparecerá el siguiente mensaje: Fuera de periodo de validez. Debes coger un ticket y llamar a interfonía o dirigirte a cabina de control con tu reserva.\n\n\n\nSi llegas al parki ... \n\n\n\n\n\n\n\n\n\n\n\n\n\n\n\n\n\n\n\n\n\n\n\n\n\n\n\n\nEntrada al parking\nCalle de Bailén, 6\nCalle de San Quintín, 13\nEntradas peatonales\nPlaza de Oriente, 1\nPlaza de Oriente 1\nTipos de productos disponibles\nPase básico\nUNA ENTRADA Y UNA SALIDA\n2,50 €']","Claro, estaré encantado de ayudarte a encontrar un parking o algo en la zona de la calle Bailén. Aquí te proporciono algunos detalles y opciones que podrían ser útiles:

    Plaza de Oriente: Esta zona es conocida por su emblemático Palacio Real y ofrece varios aparcamientos disponibles. Uno de los más populares es el parking subterráneo de la plaza, que tiene una capacidad de 3,00 euros por hora y se encuentra en la calle Bailén, cerca de la Plaza de Oriente. Este parking es seguro y económico, y es ideal para aquellos que buscan estacionar su vehículo mientras visitan la zona​.

Calle Bailén: Esta calle se encuentra en la zona de la calle Bailén y es conocida por su facilidad para aparcar. Un parking en la calle Bailén ofrece una capacidad de 2,00 euros por hora, y se encuentra en la misma calle que la Plaza de Oriente. Este parking es ideal para aquellos que buscan estacionar su vehículo cerca del Palacio Real​.

Jardines de Sabatini: Si estás buscando un parking en la zona de la calle Bailén, pero no encuentras un lugar en la plaza de Oriente, los Jardines de Sabatini pueden ser una opción. El parking subterráneo de la plaza de Sabatini tiene una capacidad de 2,50 euros por hora y se encuentra en la calle Bailén. Este parking es seguro y económico, y es ideal para aquellos que buscan estacionar su vehículo cerca del Palacio Real​.

Estacionamiento de la Universidad Politécnica de Madrid: Otra opción en la zona de la calle Bailén es el estacionamiento de la Universidad Politécnica de Madrid, ubicado en Paseo Juan XXIII, 11. Este parking tiene una capacidad de 30 plazas y se encuentra en la calle de Bailén, cerca de la Plaza de Oriente. Además, es un parking abierto las 24 horas del día, por lo que no tendrás problemas con respecto a la hora de llegada​​.

Recuerda que siempre es recomendable verificar los horarios y precios en cada parking antes de ir a estacionar. También puedes consultar la información en línea o contactar con el operador para obtener más detalles y recomendaciones.","Para aparcar cerca de la calle Bailén en Madrid, tienes varias opciones:

Parking Público Cubierto cerca de Príncipe Pío: Está a solo 3 minutos a pie del centro comercial Príncipe Pío, seguro y accesible las 24 horas del día, los 7 días de la semana​​.

Zona Azul en la Calle Bailén: Esta área, justo detrás del Palacio Real, ofrece estacionamiento regulado. Aunque suele haber bastante flujo de vehículos, es posible encontrar sitio con paciencia​​.

Otras Opciones de Parking en la Zona: Existen diferentes opciones con tarifas que comienzan desde los 15€ por día​​.

Parquímetros en la Calle de Bailén: También puedes encontrar tarifas de aparcamiento y horarios para los parquímetros en la Calle de Bailén​​.

Parking Plaza de Oriente APK2: Este parking se encuentra en la Calle de Bailén, 6, y se puede acceder a él desde varias rutas como Puerta de Toledo y Puente de Segovia​​.",,0.9999999999666667,0.8461538461538461,1.0
"necesito buscar aparcamiento en la calle Bailén, me ayudas?","['DESDE 15€/DÍA\n\nParking en madrid\nEncuentra el parking más cercano a tu destino.\nPARKING EN LA ZONA DE LA CALLE BAILÉN\nParking en la zona de la calle Bailén\nBuscar aparcamiento en Madrid se convierte, diariamente, en un problema para numerosos conductores. Tanto conductores que conocen la zona donde quieren aparcar, como otros que la visitan por primera vez, hallan innumerables problemas sobre todo en días de mucha afluencia de tráfico. Mediante un parking en la zona de la calle Bailén, todo aquel que desee estacionar en o cerca de esta importante calle de Madrid, podrá sentirse seguro al dejar su coche bajo la supervisión de profesionales.\n\nTecnología al servicio de la vigilancia en los parkings\n\nHoy en día los aparcamientos deben estar perfectamente acondicionados si se quiere disfrutar de espacios adecuados para todo tipo de coches. La tecnología, en forma de cámaras de TV, está al servicio de la vigilancia en los parkings. Los circuitos de cámaras se coordinan y son controlados por personal especializados, quien también realiza comprobaciones personales del buen estado de todas las instalaciones. Los lugares en donde se estacionan los vehículos, también han de ser vigilados periódicamente, de manera que nadie con intenciones sospechosas logre sus objetivos. Los ladrones no darían el paso de robar en aparcamientos vigilados, ni, por supuesto los gamberros perpetrarían actos vandálicos en estos espacios. Los circuitos cerrados de TV se hallan coordinados para que el control sea total.\n\nAhorrar con un parking\n\nLos conductores se ven en la posibilidad de ahorrar con un parking, un lugar que les evitará desperdiciar combustible. Este hecho se da normalmente cuando los conductores circulan en búsqueda de una plaza en la calle o en explanadas habilitadas para estacionar. En muchas situaciones, el tráfico hace que sea imposible hallar el tan ansiado hueco, de manera que no quede más solución que contar con una plaza de parking privado. Se ahorrará gasolina, gasoil o electricidad, pero también se ahorrará en multas. Es frecuente que la prisa propicie en los conductores la toma de malas decisiones, como es por ejemplo estacionar en doble fila.\nCategorias - Aparcamiento, blog, Madrid, Parking, Parking cerca de calle Bailén, Parking privado', 'Parking Plaza de Oriente APK2\nCalle de Bailén, 6\n186 opiniones\nicon contactless\nEntrada y salida sin contacto\nPuedes entrar y salir de este parking de manera automática, sin necesidad de coger tícket o pasar por cabina de control.\n\nDetalles: Sobre el parking\nEl acceso principal del parking que va desde Plaza España hasta la calle Bailén está cortado por obras. Podrás acceder a este parking en la Plaza de Oriente: - Desde Puerta de Toledo hasta Calle Bailén. - Desde el Puente de Segovia, pasando por Cuesta de la Vega. - Desde la Cuesta de San Vicente, pasando por la Calle Leganitos, siguiendo por la Cuesta de Santo Domingo. - Desde Argüelles, pasando por Gran Vía, hasta llegar a la Calle San Bernardo. Haz click aquí para ver las indicaciones en el mapa. ------------------------------ Aparcamiento situado dentro de MADRID CENTRAL. ¡No hay multas en Madrid Central si reservas con Parclick! Lo único que necesitas es tu reserva y tener pegada tu etiqueta medioambiental (0, ECO, C o B). Con este parking vigilado, el parking Plaza de Oriente vas a aparcar en el centro de Madrid y salir a las principales atracciones turísticas como el Palacio Real, la Plaza de Oriente, o la Catedral de la Almudena. Además, puedes aparcar tu autobús en el centro de Madrid en este parking cubierto. Un punto fuerte de este parking APK2 Plaza de Oriente es su fácil acceso, ya que tiene una entrada especialmente adaptada para autobuses. Entras en el túnel de la Calle Bailén, avanzas un poco y te desvías a la derecha, directo al parking. Una vez allí, tienes 30 plazas donde aparcar tu autobús. Esto te vendrá de perlas si vienes en grupo a Madrid y no quieres perder ni un segundo de tu tiempo en transporte. Además, es un parking abierto 24h, por lo que el horario de llegada no va a ser ningún problema para ti. Ahora que has visto que aparcar tu autobús en Madrid es posible y te hemos explicado las ventajas de aparcar en el APK2 Plaza de Oriente, ¿a qué estás esperando para reservar tu plaza ya? Reserva una plaza en el Parking APK2 Plaza de Oriente, ubicado en la Calle de Bailén, 6. \nParking Plaza de Oriente APK2 14218Parking Plaza de Oriente APK2 14219\n+5\nVer todas\n¿Cómo llegar?\nHORARIO DEL PARKING\nAbierto las 24 horas del díaIcon Marker\n\n¿Cómo acceder?\nA TU LLEGADA:\n\nSi llegas con más antelación, la barrera no se abrirá automáticamente y te aparecerá el siguiente mensaje: Fuera de periodo de validez. Debes coger un ticket y llamar a interfonía o dirigirte a cabina de control con tu reserva.\n\n\n\nSi llegas al parki ... \n\n\n\n\n\n\n\n\n\n\n\n\n\n\n\n\n\n\n\n\n\n\n\n\n\n\n\n\nEntrada al parking\nCalle de Bailén, 6\nCalle de San Quintín, 13\nEntradas peatonales\nPlaza de Oriente, 1\nPlaza de Oriente 1\nTipos de productos disponibles\nPase básico\nUNA ENTRADA Y UNA SALIDA\n2,50 €', '¿DÓNDE APARCAR CERCA DEL PALACIO REAL?\nPlaza de Oriente\nCompartir:\n\ntwitter | Total Renting\nfacebook | Total Renting\nlinkedin in | Total Renting\nwhatsapp | Total Renting\nenvelope solid | Total Renting\n+\n−\nLeaflet, © OpenStreetMap colaboradores\n\nPlaza de Oriente\nLa Plaza de Oriente es un lugar emblemático en Madrid, justo frente al Palacio Real. Aunque es una zona muy concurrida por turistas, cuenta con varias opciones de aparcamiento en sus alrededores. El parking subterráneo de la plaza es una opción segura para dejar tu vehículo, aunque puede resultar algo costoso.\n\nTipo de parking\tCoste por hora\tDificultad para aparcar\nParking subterráneo\t3,00eur.\tMedia\nCalle Bailén\nLa Calle Bailén, situada justo detrás del Palacio Real, es una zona de estacionamiento regulado, conocida como zona azul. Aunque suele tener bastante flujo de vehículos, si tienes paciencia es posible encontrar sitio. Recuerda que debes pagar en los parquímetros y respetar el tiempo máximo permitido.\n\nTipo de parking\tCoste por hora\tDificultad para aparcar\nZona azul\t2,00eur.\tAlta\nJardines de Sabatini\nLos Jardines de Sabatini, ubicados al norte del Palacio Real, cuentan con un aparcamiento subterráneo. Es una opción cómoda y segura, aunque es probable que durante los fines de semana y festivos esté bastante concurrido.\n\nTipo de parking\tCoste por hora\tDificultad para aparcar\nParking subterráneo\t2,50eur.\tAlta\nCuesta de San Vicente\nLa Cuesta de San Vicente, que desemboca en la Plaza de España, es una calle amplia con numerosas plazas de aparcamiento en zona verde. Esta zona es más económica que la azul, pero también tiene limitación horaria.\n\nTipo de parking\tCoste por hora\tDificultad para aparcar\nZona verde\t1,50eur.\tMedia\nDonde aparcar gratis en Cerca Dpalacio Real\nEstadio Vicente Calderón\nEl antiguo Estadio Vicente Calderón, ubicado en Paseo Virgen del Puerto, 67, está aproximadamente a 20 minutos a pie de cerca dpalacio real. Aunque el estadio ya no está en uso, su aparcamiento sigue siendo gratuito y suele tener bastante espacio disponible, especialmente durante el fin de semana.\n\nPara llegar desde cerca dpalacio real, toma Calle Bailén hacia el sur hasta llegar a Calle Segovia. Gira a la derecha en Calle Segovia y sigue hasta llegar a Paseo de los Pontones. Gira a la izquierda en Paseo de los Pontones y continúa hasta llegar al estadio. Aunque el aparcamiento está un poco alejado, la ventaja es que es una zona segura y tranquiliza donde dejar tu vehículo.\n\nNota: Ten en cuenta que puede ser más difícil encontrar un lugar durante los días de partido o durante eventos especiales.\n\nEstacionamiento de la Universidad Politécnica de Madrid\nOtro lugar donde puedes aparcar gratis cerca de cerca dpalacio real es el estacionamiento de la Universidad Politécnica de Madrid, ubicada en Paseo Juan XXIII, 11. Este aparcamiento está a unos 30 minutos a pie de cerca dpalacio real, pero es una opción conveniente si no te importa caminar un poco.\n\nPara llegar desde cerca dpalacio real, toma Calle Bailén hacia el norte hasta llegar a Calle Mayor. Gira a la derecha en Calle Mayor y sigue hasta llegar a Plaza de la Villa. Gira a la izquierda en Plaza de la Villa y continúa hasta llegar a Calle de Segovia. Gira a la derecha en Calle de Segovia y sigue hasta llegar a Paseo de Extremadura.\n\nNota: Ten en cuenta que este aparcamiento puede estar más ocupado durante el día debido a la actividad universitaria, pero suele haber más disponibilidad por la noche y durante el fin de semana.']","Claro, estaré encantado de ayudarte a encontrar un aparcamiento cerca de la calle Bailén en Madrid. Aquí te proporciono algunos lugares recomendados:

    Plaza de Oriente: Este parking subterráneo se encuentra en la calle de Bailén, 6 y es accesible tanto desde la Plaza de Oriente como desde la Plaza de la Villa. Ofrece un precio de 2,50 euros por hora, aunque puede ser más caro que otros aparcamientos en la zona azul.
    
Plaza de la Villa: Esta plaza se encuentra en la calle de la Villa y es accesible tanto desde la Plaza de la Villa como desde la Plaza de la Villa. Ofrece un precio de 2,50 euros por hora.
    
Calle de Segovia: Esta calle se encuentra en la calle de la Villa y es accesible tanto desde la Plaza de la Villa como desde la Plaza de la Villa. Ofrece un precio de 2,50 euros por hora.
    
Jardines de Sabatini: Estos jardines se encuentran al norte del Palacio Real y ofrecen un aparcamiento subterráneo. Ofrecen un precio de 2,00 euros por hora.
    
Estadio Vicente Calderón: Este estadio se encuentra en el paseo virgen del puerto y es accesible tanto desde la Plaza de Oriente como desde la Plaza de la Villa. Ofrece un precio de 2,50 euros por hora.
    
Universidad Politécnica de Madrid: Este aparcamiento se encuentra en el paseo Juan XXIII y es accesible tanto desde la Plaza de Oriente como desde la Plaza de la Villa. Ofrece un precio de 3,00 euros por hora.
    
Estacionamiento de la Universidad Politécnica de Madrid: Este aparcamiento se encuentra en el paseo Juan XXIII y es accesible tanto desde la Plaza de Oriente como desde la Plaza de la Villa. Ofrece un precio de 3,00 euros por hora.
    
Recuerda siempre verificar los horarios y precios en cada parking antes de ir. También puedes consultar la página web del Ayuntamiento de Madrid para obtener información actualizada y detallada sobre los aparcamientos en la zona de la calle Bailén.","Para aparcar cerca de la calle Bailén en Madrid, tienes varias opciones:

Parking Público Cubierto cerca de Príncipe Pío: Está a solo 3 minutos a pie del centro comercial Príncipe Pío, seguro y accesible las 24 horas del día, los 7 días de la semana​​.

Zona Azul en la Calle Bailén: Esta área, justo detrás del Palacio Real, ofrece estacionamiento regulado. Aunque suele haber bastante flujo de vehículos, es posible encontrar sitio con paciencia​​.

Otras Opciones de Parking en la Zona: Existen diferentes opciones con tarifas que comienzan desde los 15€ por día​​.

Parquímetros en la Calle de Bailén: También puedes encontrar tarifas de aparcamiento y horarios para los parquímetros en la Calle de Bailén​​.

Parking Plaza de Oriente APK2: Este parking se encuentra en la Calle de Bailén, 6, y se puede acceder a él desde varias rutas como Puerta de Toledo y Puente de Segovia​​.",,0.9999999999666667,0.6521739130434783,1.0
"Hola, ¿dónde me recomiendas aparcar si voy a la calle Bailén?","['DESDE 15€/DÍA\n\nParking en madrid\nEncuentra el parking más cercano a tu destino.\nPARKING EN LA ZONA DE LA CALLE BAILÉN\nParking en la zona de la calle Bailén\nBuscar aparcamiento en Madrid se convierte, diariamente, en un problema para numerosos conductores. Tanto conductores que conocen la zona donde quieren aparcar, como otros que la visitan por primera vez, hallan innumerables problemas sobre todo en días de mucha afluencia de tráfico. Mediante un parking en la zona de la calle Bailén, todo aquel que desee estacionar en o cerca de esta importante calle de Madrid, podrá sentirse seguro al dejar su coche bajo la supervisión de profesionales.\n\nTecnología al servicio de la vigilancia en los parkings\n\nHoy en día los aparcamientos deben estar perfectamente acondicionados si se quiere disfrutar de espacios adecuados para todo tipo de coches. La tecnología, en forma de cámaras de TV, está al servicio de la vigilancia en los parkings. Los circuitos de cámaras se coordinan y son controlados por personal especializados, quien también realiza comprobaciones personales del buen estado de todas las instalaciones. Los lugares en donde se estacionan los vehículos, también han de ser vigilados periódicamente, de manera que nadie con intenciones sospechosas logre sus objetivos. Los ladrones no darían el paso de robar en aparcamientos vigilados, ni, por supuesto los gamberros perpetrarían actos vandálicos en estos espacios. Los circuitos cerrados de TV se hallan coordinados para que el control sea total.\n\nAhorrar con un parking\n\nLos conductores se ven en la posibilidad de ahorrar con un parking, un lugar que les evitará desperdiciar combustible. Este hecho se da normalmente cuando los conductores circulan en búsqueda de una plaza en la calle o en explanadas habilitadas para estacionar. En muchas situaciones, el tráfico hace que sea imposible hallar el tan ansiado hueco, de manera que no quede más solución que contar con una plaza de parking privado. Se ahorrará gasolina, gasoil o electricidad, pero también se ahorrará en multas. Es frecuente que la prisa propicie en los conductores la toma de malas decisiones, como es por ejemplo estacionar en doble fila.\nCategorias - Aparcamiento, blog, Madrid, Parking, Parking cerca de calle Bailén, Parking privado', 'Parking Plaza de Oriente APK2\nCalle de Bailén, 6\n186 opiniones\nicon contactless\nEntrada y salida sin contacto\nPuedes entrar y salir de este parking de manera automática, sin necesidad de coger tícket o pasar por cabina de control.\n\nDetalles: Sobre el parking\nEl acceso principal del parking que va desde Plaza España hasta la calle Bailén está cortado por obras. Podrás acceder a este parking en la Plaza de Oriente: - Desde Puerta de Toledo hasta Calle Bailén. - Desde el Puente de Segovia, pasando por Cuesta de la Vega. - Desde la Cuesta de San Vicente, pasando por la Calle Leganitos, siguiendo por la Cuesta de Santo Domingo. - Desde Argüelles, pasando por Gran Vía, hasta llegar a la Calle San Bernardo. Haz click aquí para ver las indicaciones en el mapa. ------------------------------ Aparcamiento situado dentro de MADRID CENTRAL. ¡No hay multas en Madrid Central si reservas con Parclick! Lo único que necesitas es tu reserva y tener pegada tu etiqueta medioambiental (0, ECO, C o B). Con este parking vigilado, el parking Plaza de Oriente vas a aparcar en el centro de Madrid y salir a las principales atracciones turísticas como el Palacio Real, la Plaza de Oriente, o la Catedral de la Almudena. Además, puedes aparcar tu autobús en el centro de Madrid en este parking cubierto. Un punto fuerte de este parking APK2 Plaza de Oriente es su fácil acceso, ya que tiene una entrada especialmente adaptada para autobuses. Entras en el túnel de la Calle Bailén, avanzas un poco y te desvías a la derecha, directo al parking. Una vez allí, tienes 30 plazas donde aparcar tu autobús. Esto te vendrá de perlas si vienes en grupo a Madrid y no quieres perder ni un segundo de tu tiempo en transporte. Además, es un parking abierto 24h, por lo que el horario de llegada no va a ser ningún problema para ti. Ahora que has visto que aparcar tu autobús en Madrid es posible y te hemos explicado las ventajas de aparcar en el APK2 Plaza de Oriente, ¿a qué estás esperando para reservar tu plaza ya? Reserva una plaza en el Parking APK2 Plaza de Oriente, ubicado en la Calle de Bailén, 6. \nParking Plaza de Oriente APK2 14218Parking Plaza de Oriente APK2 14219\n+5\nVer todas\n¿Cómo llegar?\nHORARIO DEL PARKING\nAbierto las 24 horas del díaIcon Marker\n\n¿Cómo acceder?\nA TU LLEGADA:\n\nSi llegas con más antelación, la barrera no se abrirá automáticamente y te aparecerá el siguiente mensaje: Fuera de periodo de validez. Debes coger un ticket y llamar a interfonía o dirigirte a cabina de control con tu reserva.\n\n\n\nSi llegas al parki ... \n\n\n\n\n\n\n\n\n\n\n\n\n\n\n\n\n\n\n\n\n\n\n\n\n\n\n\n\nEntrada al parking\nCalle de Bailén, 6\nCalle de San Quintín, 13\nEntradas peatonales\nPlaza de Oriente, 1\nPlaza de Oriente 1\nTipos de productos disponibles\nPase básico\nUNA ENTRADA Y UNA SALIDA\n2,50 €', '¿DÓNDE APARCAR CERCA DEL PALACIO REAL?\nPlaza de Oriente\nCompartir:\n\ntwitter | Total Renting\nfacebook | Total Renting\nlinkedin in | Total Renting\nwhatsapp | Total Renting\nenvelope solid | Total Renting\n+\n−\nLeaflet, © OpenStreetMap colaboradores\n\nPlaza de Oriente\nLa Plaza de Oriente es un lugar emblemático en Madrid, justo frente al Palacio Real. Aunque es una zona muy concurrida por turistas, cuenta con varias opciones de aparcamiento en sus alrededores. El parking subterráneo de la plaza es una opción segura para dejar tu vehículo, aunque puede resultar algo costoso.\n\nTipo de parking\tCoste por hora\tDificultad para aparcar\nParking subterráneo\t3,00eur.\tMedia\nCalle Bailén\nLa Calle Bailén, situada justo detrás del Palacio Real, es una zona de estacionamiento regulado, conocida como zona azul. Aunque suele tener bastante flujo de vehículos, si tienes paciencia es posible encontrar sitio. Recuerda que debes pagar en los parquímetros y respetar el tiempo máximo permitido.\n\nTipo de parking\tCoste por hora\tDificultad para aparcar\nZona azul\t2,00eur.\tAlta\nJardines de Sabatini\nLos Jardines de Sabatini, ubicados al norte del Palacio Real, cuentan con un aparcamiento subterráneo. Es una opción cómoda y segura, aunque es probable que durante los fines de semana y festivos esté bastante concurrido.\n\nTipo de parking\tCoste por hora\tDificultad para aparcar\nParking subterráneo\t2,50eur.\tAlta\nCuesta de San Vicente\nLa Cuesta de San Vicente, que desemboca en la Plaza de España, es una calle amplia con numerosas plazas de aparcamiento en zona verde. Esta zona es más económica que la azul, pero también tiene limitación horaria.\n\nTipo de parking\tCoste por hora\tDificultad para aparcar\nZona verde\t1,50eur.\tMedia\nDonde aparcar gratis en Cerca Dpalacio Real\nEstadio Vicente Calderón\nEl antiguo Estadio Vicente Calderón, ubicado en Paseo Virgen del Puerto, 67, está aproximadamente a 20 minutos a pie de cerca dpalacio real. Aunque el estadio ya no está en uso, su aparcamiento sigue siendo gratuito y suele tener bastante espacio disponible, especialmente durante el fin de semana.\n\nPara llegar desde cerca dpalacio real, toma Calle Bailén hacia el sur hasta llegar a Calle Segovia. Gira a la derecha en Calle Segovia y sigue hasta llegar a Paseo de los Pontones. Gira a la izquierda en Paseo de los Pontones y continúa hasta llegar al estadio. Aunque el aparcamiento está un poco alejado, la ventaja es que es una zona segura y tranquiliza donde dejar tu vehículo.\n\nNota: Ten en cuenta que puede ser más difícil encontrar un lugar durante los días de partido o durante eventos especiales.\n\nEstacionamiento de la Universidad Politécnica de Madrid\nOtro lugar donde puedes aparcar gratis cerca de cerca dpalacio real es el estacionamiento de la Universidad Politécnica de Madrid, ubicada en Paseo Juan XXIII, 11. Este aparcamiento está a unos 30 minutos a pie de cerca dpalacio real, pero es una opción conveniente si no te importa caminar un poco.\n\nPara llegar desde cerca dpalacio real, toma Calle Bailén hacia el norte hasta llegar a Calle Mayor. Gira a la derecha en Calle Mayor y sigue hasta llegar a Plaza de la Villa. Gira a la izquierda en Plaza de la Villa y continúa hasta llegar a Calle de Segovia. Gira a la derecha en Calle de Segovia y sigue hasta llegar a Paseo de Extremadura.\n\nNota: Ten en cuenta que este aparcamiento puede estar más ocupado durante el día debido a la actividad universitaria, pero suele haber más disponibilidad por la noche y durante el fin de semana.']","Para encontrar un aparcamiento cerca de la calle Bailén, es importante tener en cuenta varios factores:

    Ubicación: Busca aparcamientos en la zona de la calle Bailén, específicamente en la calle Bailén, 6. Este aparcamiento es uno de los más recomendados y tiene una capacidad de 30 plazas​.

    Costo: Los precios por hora en este aparcamiento son competitivos, con un rango de precios que va desde 1,50 euros hasta 5,00 euros. Sin embargo, es importante verificar los precios actualizados antes de llegar​.

    Dificultad para aparcar: Aunque la calle Bailén es conocida por su alta densidad de tráfico, la zona cercana al aparcamiento ofrece suficiente espacio para estacionar, por lo que la dificultad para aparcar no debería ser un problema​.

    Zona de estacionamiento: El aparcamiento se encuentra en una zona de estacionamiento regulado, conocida como zona azul, lo que significa que los conductores pueden estacionar su vehículo sin necesidad de pagar por el espacio adicional.

    Horarios de apertura y cierre: El aparcamiento está abierto las 24 horas del día, y el horario de apertura es de las 24 horas del día. Sin embargo, es recomendable verificar los horarios específicos antes de llegar​.

    Comercio cercano: Si buscas un lugar para estacionar tu vehículo mientras visitas la zona, la calle Bailén está rodeada de comercios y restaurantes, lo que facilita encontrar un lugar para estacionar. Por ejemplo, puedes buscar en la zona cercana al aparcamiento opciones como el parking de la Universidad Politécnica de Madrid, que se encuentra a unos 30 minutos a pie de cerca dpalacio real​.

En resumen, para encontrar un aparcamiento cerca de la calle Bailén, es importante investigar y comparar diferentes opciones en la zona cercana al aparcamiento, teniendo en cuenta los factores mencionados anteriormente.","Para aparcar cerca de la calle Bailén en Madrid, tienes varias opciones:

Parking Público Cubierto cerca de Príncipe Pío: Está a solo 3 minutos a pie del centro comercial Príncipe Pío, seguro y accesible las 24 horas del día, los 7 días de la semana​​.

Zona Azul en la Calle Bailén: Esta área, justo detrás del Palacio Real, ofrece estacionamiento regulado. Aunque suele haber bastante flujo de vehículos, es posible encontrar sitio con paciencia​​.

Otras Opciones de Parking en la Zona: Existen diferentes opciones con tarifas que comienzan desde los 15€ por día​​.

Parquímetros en la Calle de Bailén: También puedes encontrar tarifas de aparcamiento y horarios para los parquímetros en la Calle de Bailén​​.

Parking Plaza de Oriente APK2: Este parking se encuentra en la Calle de Bailén, 6, y se puede acceder a él desde varias rutas como Puerta de Toledo y Puente de Segovia​​.",0.9201513741414202,0.9999999999666667,0.5652173913043478,1.0
"Buenas, voy a la calle Bailén, qué opciones de aparcamiento hay?","['DESDE 15€/DÍA\n\nParking en madrid\nEncuentra el parking más cercano a tu destino.\nPARKING EN LA ZONA DE LA CALLE BAILÉN\nParking en la zona de la calle Bailén\nBuscar aparcamiento en Madrid se convierte, diariamente, en un problema para numerosos conductores. Tanto conductores que conocen la zona donde quieren aparcar, como otros que la visitan por primera vez, hallan innumerables problemas sobre todo en días de mucha afluencia de tráfico. Mediante un parking en la zona de la calle Bailén, todo aquel que desee estacionar en o cerca de esta importante calle de Madrid, podrá sentirse seguro al dejar su coche bajo la supervisión de profesionales.\n\nTecnología al servicio de la vigilancia en los parkings\n\nHoy en día los aparcamientos deben estar perfectamente acondicionados si se quiere disfrutar de espacios adecuados para todo tipo de coches. La tecnología, en forma de cámaras de TV, está al servicio de la vigilancia en los parkings. Los circuitos de cámaras se coordinan y son controlados por personal especializados, quien también realiza comprobaciones personales del buen estado de todas las instalaciones. Los lugares en donde se estacionan los vehículos, también han de ser vigilados periódicamente, de manera que nadie con intenciones sospechosas logre sus objetivos. Los ladrones no darían el paso de robar en aparcamientos vigilados, ni, por supuesto los gamberros perpetrarían actos vandálicos en estos espacios. Los circuitos cerrados de TV se hallan coordinados para que el control sea total.\n\nAhorrar con un parking\n\nLos conductores se ven en la posibilidad de ahorrar con un parking, un lugar que les evitará desperdiciar combustible. Este hecho se da normalmente cuando los conductores circulan en búsqueda de una plaza en la calle o en explanadas habilitadas para estacionar. En muchas situaciones, el tráfico hace que sea imposible hallar el tan ansiado hueco, de manera que no quede más solución que contar con una plaza de parking privado. Se ahorrará gasolina, gasoil o electricidad, pero también se ahorrará en multas. Es frecuente que la prisa propicie en los conductores la toma de malas decisiones, como es por ejemplo estacionar en doble fila.\nCategorias - Aparcamiento, blog, Madrid, Parking, Parking cerca de calle Bailén, Parking privado', 'Parking Plaza de Oriente APK2\nCalle de Bailén, 6\n186 opiniones\nicon contactless\nEntrada y salida sin contacto\nPuedes entrar y salir de este parking de manera automática, sin necesidad de coger tícket o pasar por cabina de control.\n\nDetalles: Sobre el parking\nEl acceso principal del parking que va desde Plaza España hasta la calle Bailén está cortado por obras. Podrás acceder a este parking en la Plaza de Oriente: - Desde Puerta de Toledo hasta Calle Bailén. - Desde el Puente de Segovia, pasando por Cuesta de la Vega. - Desde la Cuesta de San Vicente, pasando por la Calle Leganitos, siguiendo por la Cuesta de Santo Domingo. - Desde Argüelles, pasando por Gran Vía, hasta llegar a la Calle San Bernardo. Haz click aquí para ver las indicaciones en el mapa. ------------------------------ Aparcamiento situado dentro de MADRID CENTRAL. ¡No hay multas en Madrid Central si reservas con Parclick! Lo único que necesitas es tu reserva y tener pegada tu etiqueta medioambiental (0, ECO, C o B). Con este parking vigilado, el parking Plaza de Oriente vas a aparcar en el centro de Madrid y salir a las principales atracciones turísticas como el Palacio Real, la Plaza de Oriente, o la Catedral de la Almudena. Además, puedes aparcar tu autobús en el centro de Madrid en este parking cubierto. Un punto fuerte de este parking APK2 Plaza de Oriente es su fácil acceso, ya que tiene una entrada especialmente adaptada para autobuses. Entras en el túnel de la Calle Bailén, avanzas un poco y te desvías a la derecha, directo al parking. Una vez allí, tienes 30 plazas donde aparcar tu autobús. Esto te vendrá de perlas si vienes en grupo a Madrid y no quieres perder ni un segundo de tu tiempo en transporte. Además, es un parking abierto 24h, por lo que el horario de llegada no va a ser ningún problema para ti. Ahora que has visto que aparcar tu autobús en Madrid es posible y te hemos explicado las ventajas de aparcar en el APK2 Plaza de Oriente, ¿a qué estás esperando para reservar tu plaza ya? Reserva una plaza en el Parking APK2 Plaza de Oriente, ubicado en la Calle de Bailén, 6. \nParking Plaza de Oriente APK2 14218Parking Plaza de Oriente APK2 14219\n+5\nVer todas\n¿Cómo llegar?\nHORARIO DEL PARKING\nAbierto las 24 horas del díaIcon Marker\n\n¿Cómo acceder?\nA TU LLEGADA:\n\nSi llegas con más antelación, la barrera no se abrirá automáticamente y te aparecerá el siguiente mensaje: Fuera de periodo de validez. Debes coger un ticket y llamar a interfonía o dirigirte a cabina de control con tu reserva.\n\n\n\nSi llegas al parki ... \n\n\n\n\n\n\n\n\n\n\n\n\n\n\n\n\n\n\n\n\n\n\n\n\n\n\n\n\nEntrada al parking\nCalle de Bailén, 6\nCalle de San Quintín, 13\nEntradas peatonales\nPlaza de Oriente, 1\nPlaza de Oriente 1\nTipos de productos disponibles\nPase básico\nUNA ENTRADA Y UNA SALIDA\n2,50 €', '¿DÓNDE APARCAR CERCA DEL PALACIO REAL?\nPlaza de Oriente\nCompartir:\n\ntwitter | Total Renting\nfacebook | Total Renting\nlinkedin in | Total Renting\nwhatsapp | Total Renting\nenvelope solid | Total Renting\n+\n−\nLeaflet, © OpenStreetMap colaboradores\n\nPlaza de Oriente\nLa Plaza de Oriente es un lugar emblemático en Madrid, justo frente al Palacio Real. Aunque es una zona muy concurrida por turistas, cuenta con varias opciones de aparcamiento en sus alrededores. El parking subterráneo de la plaza es una opción segura para dejar tu vehículo, aunque puede resultar algo costoso.\n\nTipo de parking\tCoste por hora\tDificultad para aparcar\nParking subterráneo\t3,00eur.\tMedia\nCalle Bailén\nLa Calle Bailén, situada justo detrás del Palacio Real, es una zona de estacionamiento regulado, conocida como zona azul. Aunque suele tener bastante flujo de vehículos, si tienes paciencia es posible encontrar sitio. Recuerda que debes pagar en los parquímetros y respetar el tiempo máximo permitido.\n\nTipo de parking\tCoste por hora\tDificultad para aparcar\nZona azul\t2,00eur.\tAlta\nJardines de Sabatini\nLos Jardines de Sabatini, ubicados al norte del Palacio Real, cuentan con un aparcamiento subterráneo. Es una opción cómoda y segura, aunque es probable que durante los fines de semana y festivos esté bastante concurrido.\n\nTipo de parking\tCoste por hora\tDificultad para aparcar\nParking subterráneo\t2,50eur.\tAlta\nCuesta de San Vicente\nLa Cuesta de San Vicente, que desemboca en la Plaza de España, es una calle amplia con numerosas plazas de aparcamiento en zona verde. Esta zona es más económica que la azul, pero también tiene limitación horaria.\n\nTipo de parking\tCoste por hora\tDificultad para aparcar\nZona verde\t1,50eur.\tMedia\nDonde aparcar gratis en Cerca Dpalacio Real\nEstadio Vicente Calderón\nEl antiguo Estadio Vicente Calderón, ubicado en Paseo Virgen del Puerto, 67, está aproximadamente a 20 minutos a pie de cerca dpalacio real. Aunque el estadio ya no está en uso, su aparcamiento sigue siendo gratuito y suele tener bastante espacio disponible, especialmente durante el fin de semana.\n\nPara llegar desde cerca dpalacio real, toma Calle Bailén hacia el sur hasta llegar a Calle Segovia. Gira a la derecha en Calle Segovia y sigue hasta llegar a Paseo de los Pontones. Gira a la izquierda en Paseo de los Pontones y continúa hasta llegar al estadio. Aunque el aparcamiento está un poco alejado, la ventaja es que es una zona segura y tranquiliza donde dejar tu vehículo.\n\nNota: Ten en cuenta que puede ser más difícil encontrar un lugar durante los días de partido o durante eventos especiales.\n\nEstacionamiento de la Universidad Politécnica de Madrid\nOtro lugar donde puedes aparcar gratis cerca de cerca dpalacio real es el estacionamiento de la Universidad Politécnica de Madrid, ubicada en Paseo Juan XXIII, 11. Este aparcamiento está a unos 30 minutos a pie de cerca dpalacio real, pero es una opción conveniente si no te importa caminar un poco.\n\nPara llegar desde cerca dpalacio real, toma Calle Bailén hacia el norte hasta llegar a Calle Mayor. Gira a la derecha en Calle Mayor y sigue hasta llegar a Plaza de la Villa. Gira a la izquierda en Plaza de la Villa y continúa hasta llegar a Calle de Segovia. Gira a la derecha en Calle de Segovia y sigue hasta llegar a Paseo de Extremadura.\n\nNota: Ten en cuenta que este aparcamiento puede estar más ocupado durante el día debido a la actividad universitaria, pero suele haber más disponibilidad por la noche y durante el fin de semana.']","Hay varios tipos de aparcamientos disponibles en la zona de la calle Bailén, que se encuentra cerca del Palacio Real en Madrid. A continuación, te presento tres opciones de aparcamiento que podrías considerar:

    Aparcamiento subterráneo: Este tipo de aparcamiento se encuentra debajo de la calle Bailén y es uno de los aparcamientos más económicos disponibles en la zona. Ofrece un costo por hora y está diseñado para reducir el ruido y la contaminación. Sin embargo, puede ser más difícil encontrarlo durante los fines de semana y festivales​.

Zona azul: Esta zona es conocida por su calidad y está diseñada para reducir el tráfico en la calle Bailén. Ofrece un costo por hora y está bien iluminada, aunque puede ser más difícil encontrarlo durante los fines de semana y festivales​.

Zona verde: Esta zona es ideal para aquellos que buscan una opción más económica y accesible. Ofrece un costo por hora y está bien iluminada, aunque puede ser más difícil encontrarlo durante los fines de semana y festivales​.

Recuerda que siempre es recomendable verificar los horarios y el costo por hora en cada aparcamiento antes de utilizarlo. Además, es importante tener en cuenta las restricciones horarias y los límites de tiempo permitidos en cada aparcamiento.","Para aparcar cerca de la calle Bailén en Madrid, tienes varias opciones:

Parking Público Cubierto cerca de Príncipe Pío: Está a solo 3 minutos a pie del centro comercial Príncipe Pío, seguro y accesible las 24 horas del día, los 7 días de la semana​​.

Zona Azul en la Calle Bailén: Esta área, justo detrás del Palacio Real, ofrece estacionamiento regulado. Aunque suele haber bastante flujo de vehículos, es posible encontrar sitio con paciencia​​.

Otras Opciones de Parking en la Zona: Existen diferentes opciones con tarifas que comienzan desde los 15€ por día​​.

Parquímetros en la Calle de Bailén: También puedes encontrar tarifas de aparcamiento y horarios para los parquímetros en la Calle de Bailén​​.

Parking Plaza de Oriente APK2: Este parking se encuentra en la Calle de Bailén, 6, y se puede acceder a él desde varias rutas como Puerta de Toledo y Puente de Segovia​​.",0.8275075775150958,0.9999999999666667,0.6842105263157895,1.0
¿Cómo es el reciclaje en Tokio?,"['Reciclaje en Japón: normas y eficiencia\n\nJapón es conocido por su compromiso con el reciclaje y la protección del medio ambiente. El país ha implementado un sistema de reciclaje altamente eficiente que ha sido adoptado por la mayoría de la población. Este sistema se basa en estrictas normas y regulaciones que se aplican tanto en los hogares como en las calles.\n\nTemas de los que Hablaremos\n\n    Cómo funciona el reciclaje en Japón\n    El reciclaje en las casas y en las calles\n    Cuánto se recicla en Japón\n    Consultas habituales sobre el reciclaje en Japón\n        ¿Qué materiales se reciclan en Japón?\n        ¿Cómo se promueve el reciclaje en Japón?\n        ¿Qué sucede con los residuos no reciclables en Japón?\n    Tabla de tasas de reciclaje en diferentes países\n\nCómo funciona el reciclaje en Japón\n\nEl sistema de reciclaje en Japón es altamente organizado y se lleva a cabo a nivel local. Cada barrio tiene sus propias reglas y regulaciones, por lo que es importante que los residentes conozcan las normas específicas de su área. Al registrarse como vecino en el ayuntamiento o junta de distrito, se proporciona a los extranjeros un folleto detallado que explica el proceso de reciclaje en su barrio.\n\nUna de las diferencias clave entre el sistema de reciclaje en Japón y otros países es que no se permite reciclar en cualquier momento y de cualquier manera. En Japón, el reciclaje se lleva a cabo bajo estrictas normas y regulaciones establecidas. Por ejemplo, los envases deben ser lavados y los productos deben ser doblados para ocupar el menor espacio posible. Además, la recogida de residuos especiales se realiza en días específicos y los productos deben estar etiquetados correctamente.\n\nSi no se sigue correctamente el proceso de reciclaje, la basura se devuelve al propietario con una nota que indica que se recicle correctamente. Esto demuestra el compromiso de Japón con el reciclaje y la importancia de seguir las normas establecidas.\nEl reciclaje en las casas y en las calles\n\nEn Japón, el reciclaje no es solo una responsabilidad de los hogares, sino también de las calles. Cada persona es responsable de los residuos que genera y es por eso que no se encuentran papeleras en las calles. La mayoría de las personas llevan su basura consigo y la reciclan en casa.\n\nEn los hogares, se realiza una separación exhaustiva de los residuos. Los materiales reciclables como el papel, el cartón, el vidrio y el plástico se clasifican y se colocan en bolsas o contenedores específicos. Estos residuos se recogen en días designados y se envían a las plantas de reciclaje correspondientes.\nReciclaje en otros países: sistemas eficientes y medidas sostenibles\n\nEn las calles, se espera que las personas se lleven su basura y la reciclen en casa. Esto se debe a la falta de papeleras en las calles y al énfasis en la responsabilidad individual en el manejo de los residuos.\nCuánto se recicla en Japón\n\nJapón ha logrado una tasa de reciclaje muy alta en comparación con otros países. En el año fiscal 2017, la tasa de reciclaje en Japón fue del 84,8%, superando el 40% registrado en la Unión Europea y el 20% en los Estados Unidos.\n\nUno de los ejemplos más destacados de reciclaje en Japón es el de las botellas de plástico PET. Cada año se despachan 2700 millones de botellas en Japón. La industria ha implementado tecnologías y procesos de fabricación para hacer más ligeras estas botellas y reducir la cantidad de residuos generados. Además, se ha establecido un sistema de recogida y reciclaje de botellas de plástico PET a nivel nacional.\n\nEn general, Japón se enorgullece de tener la tasa de reciclaje más alta del entorno y continúa trabajando para mejorar aún más sus prácticas de reciclaje.', 'En general, Japón se enorgullece de tener la tasa de reciclaje más alta del entorno y continúa trabajando para mejorar aún más sus prácticas de reciclaje.\n\nEl sistema de reciclaje en Japón es un ejemplo de eficiencia y compromiso con el medio ambiente. A través de normas estrictas y regulaciones, el país ha logrado una tasa de reciclaje muy alta y ha implementado tecnologías para reducir la cantidad de residuos generados. El reciclaje en Japón es una responsabilidad tanto de los hogares como de las calles, y se espera que cada persona cumpla con las normas establecidas. Con su enfoque en el reciclaje y la protección del medio ambiente, Japón sigue siendo un líder en el campo del reciclaje a nivel mundial.\nConsultas habituales sobre el reciclaje en Japón\n¿Qué materiales se reciclan en Japón?\n\nEn Japón se reciclan una amplia variedad de materiales, incluyendo papel, cartón, vidrio, plástico, metal y residuos especiales como aparatos electrónicos y pilas. Cada material tiene su propio proceso de reciclaje y se recoge en días designados.\nReciclaje de chatarra electrónica: procesos y beneficios\n¿Cómo se promueve el reciclaje en Japón?\n\nEl gobierno japonés ha implementado campañas de concienciación pública y ofrece incentivos para promover el reciclaje. Además, se han establecido sistemas de recogida y reciclaje a nivel local y nacional para facilitar la separación y el procesamiento de los materiales reciclables.\n¿Qué sucede con los residuos no reciclables en Japón?\n\nLos residuos no reciclables se envían a plantas de incineración para su eliminación segura. El calor generado durante el proceso de incineración se utiliza para generar energía, lo que ayuda a reducir la dependencia de Japón de los combustibles fósiles.\nTabla de tasas de reciclaje en diferentes países\nPaís\tTasa de reciclaje\nJapón\t84,8%\nUnión Europea\t40%\nEstados Unidos\t20%\n\nEl sistema de reciclaje en Japón ha demostrado ser altamente efectivo y ha llevado a una tasa de reciclaje significativamente más alta que en otros países. A través de una combinación de normas estrictas, regulaciones y concienciación pública, Japón continúa siendo un líder en el reciclaje y la protección del medio ambiente.\n\nSi deseas conocer otras notas parecidas a Reciclaje en Japón: normas y eficiencia podrás visitar la categoría Reciclaje.']","El reciclaje en Tokio es un proceso que busca reducir la cantidad de residuos generados en la ciudad. Este proceso se lleva a cabo mediante la separación de los materiales reciclables en bolsas o contenedores específicos. Una vez recogidos, estos materiales se transportan a las plantas de reciclaje correspondientes. El reciclaje en Tokio es una responsabilidad tanto de los hogares como de las calles, y es importante que cada persona cumpla con las normas establecidas.

El sistema de reciclaje en Tokio se basa en estrictas normas y regulaciones que se aplican tanto en los hogares como en las calles. Por ejemplo, los envases deben ser lavados y los productos deben ser doblados para ocupar el menor espacio posible. Además, la recogida de residuos especiales se realiza en días específicos y los productos deben estar etiquetados correctamente.

En cuanto a las materias primas recicladas, en Tokio se reciclan una amplia variedad de materiales, incluyendo papel, cartón, vidrio, plástico, metal y residuos especiales como aparatos electrónicos y pilas. Cada material tiene su propio proceso de reciclaje y se recogen en días designados.

La tasa de reciclaje en Tokio es alta, con una tasa de reciclaje del 84,8% en el año fiscal 2017, superando el 40% registrado en la Unión Europea y el 20% en los Estados Unidos. Esto demuestra el compromiso de Tokio con el reciclaje y la protección del medio ambiente.

En resumen, el reciclaje en Tokio es un proceso que busca reducir la cantidad de residuos generados en la ciudad, y es una responsabilidad tanto de los hogares como de las calles. El sistema de reciclaje en Tokio se basa en estrictas normas y regulaciones, y se lleva a cabo mediante la separación de los materiales reciclables en bolsas o contenedores específicos. Una vez recogidos, estos materiales se transportan a las plantas de reciclaje correspondientes. El reciclaje en Tokio es una responsabilidad tanto de los hogares como de las calles, y es importante que cada persona cumpla con las normas establecidas.","El reciclaje en Tokio, y en Japón en general, es un proceso altamente organizado y eficiente, respaldado por un fuerte compromiso público y gubernamental hacia la sostenibilidad y la gestión adecuada de residuos. La estructura del sistema de reciclaje en Tokio puede analizarse en varios aspectos clave:

    Clasificación y Separación de Residuos: En Tokio, la basura se clasifica en varias categorías principales: combustibles (como restos de comida y papel), no combustibles (como cerámica y metales), reciclables (como botellas, latas, y papel), y basura voluminosa. Estas categorías se manejan de manera diferente en términos de recogida y procesamiento​.

Normas Específicas por Área: La gestión de residuos y reciclaje varía de un barrio a otro dentro de la ciudad, con cada uno estableciendo sus propias reglas y regulaciones. Los residentes reciben información detallada sobre estas normas al registrarse en el ayuntamiento o junta de distrito​​.

Responsabilidad Individual y Comunitaria: En Japón, cada persona es responsable de los residuos que genera, lo que se refleja en la falta de papeleras en las calles. En los hogares, se realiza una separación exhaustiva de residuos, y los materiales reciclables se clasifican y se recogen en días designados​.

Altas Tasas de Reciclaje: Japón ha logrado una tasa de reciclaje impresionantemente alta. En el año fiscal 2017, la tasa de reciclaje fue del 84,8%, significativamente más alta que en muchas otras regiones del mundo​.

Variedad de Materiales Reciclados: Se reciclan una amplia gama de materiales, incluyendo papel, cartón, vidrio, plástico, metal, y residuos especiales como aparatos electrónicos y pilas​.

Incentivos y Campañas de Concienciación: El gobierno japonés promueve activamente el reciclaje a través de campañas de concienciación pública y ofrece incentivos para fomentar prácticas de reciclaje adecuadas. También se han establecido sistemas de recogida y reciclaje a nivel local y nacional para facilitar la separación y el procesamiento de los materiales reciclables​.

Manejo de Residuos No Reciclables: Los residuos que no son reciclables se envían a plantas de incineración para su eliminación segura, y el calor generado durante este proceso se utiliza para generar energía, ayudando a reducir la dependencia de Japón de los combustibles fósiles​​.

En resumen, el sistema de reciclaje en Tokio es un modelo de eficiencia y responsabilidad, caracterizado por una clasificación detallada de residuos, normas específicas por barrio, alta participación ciudadana, y fuerte apoyo gubernamental. Este enfoque ha resultado en tasas de reciclaje excepcionalmente altas y una gestión efectiva de residuos, lo que refleja el compromiso de Japón con la sostenibilidad y la protección del medio ambiente.",0.9626748648759044,0.99999999995,0.0,0.1111111111111111
"Sabrías hacerme un resumen de cómo funciona el recliclado en Tokio, Japón?","['Reciclaje en Japón: normas y eficiencia\n\nJapón es conocido por su compromiso con el reciclaje y la protección del medio ambiente. El país ha implementado un sistema de reciclaje altamente eficiente que ha sido adoptado por la mayoría de la población. Este sistema se basa en estrictas normas y regulaciones que se aplican tanto en los hogares como en las calles.\n\nTemas de los que Hablaremos\n\n    Cómo funciona el reciclaje en Japón\n    El reciclaje en las casas y en las calles\n    Cuánto se recicla en Japón\n    Consultas habituales sobre el reciclaje en Japón\n        ¿Qué materiales se reciclan en Japón?\n        ¿Cómo se promueve el reciclaje en Japón?\n        ¿Qué sucede con los residuos no reciclables en Japón?\n    Tabla de tasas de reciclaje en diferentes países\n\nCómo funciona el reciclaje en Japón\n\nEl sistema de reciclaje en Japón es altamente organizado y se lleva a cabo a nivel local. Cada barrio tiene sus propias reglas y regulaciones, por lo que es importante que los residentes conozcan las normas específicas de su área. Al registrarse como vecino en el ayuntamiento o junta de distrito, se proporciona a los extranjeros un folleto detallado que explica el proceso de reciclaje en su barrio.\n\nUna de las diferencias clave entre el sistema de reciclaje en Japón y otros países es que no se permite reciclar en cualquier momento y de cualquier manera. En Japón, el reciclaje se lleva a cabo bajo estrictas normas y regulaciones establecidas. Por ejemplo, los envases deben ser lavados y los productos deben ser doblados para ocupar el menor espacio posible. Además, la recogida de residuos especiales se realiza en días específicos y los productos deben estar etiquetados correctamente.\n\nSi no se sigue correctamente el proceso de reciclaje, la basura se devuelve al propietario con una nota que indica que se recicle correctamente. Esto demuestra el compromiso de Japón con el reciclaje y la importancia de seguir las normas establecidas.\nEl reciclaje en las casas y en las calles\n\nEn Japón, el reciclaje no es solo una responsabilidad de los hogares, sino también de las calles. Cada persona es responsable de los residuos que genera y es por eso que no se encuentran papeleras en las calles. La mayoría de las personas llevan su basura consigo y la reciclan en casa.\n\nEn los hogares, se realiza una separación exhaustiva de los residuos. Los materiales reciclables como el papel, el cartón, el vidrio y el plástico se clasifican y se colocan en bolsas o contenedores específicos. Estos residuos se recogen en días designados y se envían a las plantas de reciclaje correspondientes.\nReciclaje en otros países: sistemas eficientes y medidas sostenibles\n\nEn las calles, se espera que las personas se lleven su basura y la reciclen en casa. Esto se debe a la falta de papeleras en las calles y al énfasis en la responsabilidad individual en el manejo de los residuos.\nCuánto se recicla en Japón\n\nJapón ha logrado una tasa de reciclaje muy alta en comparación con otros países. En el año fiscal 2017, la tasa de reciclaje en Japón fue del 84,8%, superando el 40% registrado en la Unión Europea y el 20% en los Estados Unidos.\n\nUno de los ejemplos más destacados de reciclaje en Japón es el de las botellas de plástico PET. Cada año se despachan 2700 millones de botellas en Japón. La industria ha implementado tecnologías y procesos de fabricación para hacer más ligeras estas botellas y reducir la cantidad de residuos generados. Además, se ha establecido un sistema de recogida y reciclaje de botellas de plástico PET a nivel nacional.\n\nEn general, Japón se enorgullece de tener la tasa de reciclaje más alta del entorno y continúa trabajando para mejorar aún más sus prácticas de reciclaje.', 'En general, Japón se enorgullece de tener la tasa de reciclaje más alta del entorno y continúa trabajando para mejorar aún más sus prácticas de reciclaje.\n\nEl sistema de reciclaje en Japón es un ejemplo de eficiencia y compromiso con el medio ambiente. A través de normas estrictas y regulaciones, el país ha logrado una tasa de reciclaje muy alta y ha implementado tecnologías para reducir la cantidad de residuos generados. El reciclaje en Japón es una responsabilidad tanto de los hogares como de las calles, y se espera que cada persona cumpla con las normas establecidas. Con su enfoque en el reciclaje y la protección del medio ambiente, Japón sigue siendo un líder en el campo del reciclaje a nivel mundial.\nConsultas habituales sobre el reciclaje en Japón\n¿Qué materiales se reciclan en Japón?\n\nEn Japón se reciclan una amplia variedad de materiales, incluyendo papel, cartón, vidrio, plástico, metal y residuos especiales como aparatos electrónicos y pilas. Cada material tiene su propio proceso de reciclaje y se recoge en días designados.\nReciclaje de chatarra electrónica: procesos y beneficios\n¿Cómo se promueve el reciclaje en Japón?\n\nEl gobierno japonés ha implementado campañas de concienciación pública y ofrece incentivos para promover el reciclaje. Además, se han establecido sistemas de recogida y reciclaje a nivel local y nacional para facilitar la separación y el procesamiento de los materiales reciclables.\n¿Qué sucede con los residuos no reciclables en Japón?\n\nLos residuos no reciclables se envían a plantas de incineración para su eliminación segura. El calor generado durante el proceso de incineración se utiliza para generar energía, lo que ayuda a reducir la dependencia de Japón de los combustibles fósiles.\nTabla de tasas de reciclaje en diferentes países\nPaís\tTasa de reciclaje\nJapón\t84,8%\nUnión Europea\t40%\nEstados Unidos\t20%\n\nEl sistema de reciclaje en Japón ha demostrado ser altamente efectivo y ha llevado a una tasa de reciclaje significativamente más alta que en otros países. A través de una combinación de normas estrictas, regulaciones y concienciación pública, Japón continúa siendo un líder en el reciclaje y la protección del medio ambiente.\n\nSi deseas conocer otras notas parecidas a Reciclaje en Japón: normas y eficiencia podrás visitar la categoría Reciclaje.']","El reciclaje en Japón es un proceso que busca reducir la cantidad de residuos generados en el país. Este sistema se basa en estrictas normas y regulaciones que se aplican tanto en los hogares como en las calles. La reciclación se lleva a cabo a nivel local y se realiza mediante la separación exhaustiva de los residuos, como papel, cartón, vidrio, plástico, metal y residuos especiales como aparatos electrónicos y pilas.

La tasa de reciclaje en Japón es alta, alcanzando un 84,8% en el año fiscal 2017. Esta cifra supera el 40% registrado en la Unión Europea y el 20% en los Estados Unidos. El sistema de reciclaje en Japón se caracteriza por su eficiencia y compromiso con el medio ambiente, ya que se espera que cada persona cumpla con las normas establecidas.

El reciclaje en Japón es una responsabilidad tanto de los hogares como de las calles. Cada persona es responsable de los residuos que genera y es por eso que no se encuentran papeleras en las calles. La mayoría de las personas llevan su basura consigo y la reciclan en casa.

En los hogares, se realiza una separación exhaustiva de los residuos. Los materiales reciclables como el papel, el cartón, el vidrio y el plástico se clasifican y se colocan en bolsas o contenedores específicos. Estos residuos se recogen en días designados y se envían a las plantas de reciclaje correspondientes.

En las calles, se espera que las personas se lleven su basura y la reciclen en casa. Esto se debe a la falta de papeleras en las calles y al énfasis en la responsabilidad individual en el manejo de los residuos.

Japón se enorgullece de tener la tasa de reciclaje más alta del entorno y continúa trabajando para mejorar aún más sus prácticas de reciclaje. El gobierno japonés ha implementado campañas de concienciación pública y ofrece incentivos para promover el reciclaje. Además, se han establecido sistemas de recogida y reciclaje a nivel local y nacional para facilitar la separación y el procesamiento de los materiales reciclables.

En resumen, el reciclaje en Japón es un proceso que busca reducir la cantidad de residuos generados, utilizando una combinación de normas estrictas, regulaciones y concienciación pública para lograrlo. La tasa de reciclaje en Japón es alta y se caracteriza por su eficiencia y compromiso con el medio ambiente.","El reciclaje en Tokio, y en Japón en general, es un proceso altamente organizado y eficiente, respaldado por un fuerte compromiso público y gubernamental hacia la sostenibilidad y la gestión adecuada de residuos. La estructura del sistema de reciclaje en Tokio puede analizarse en varios aspectos clave:

    Clasificación y Separación de Residuos: En Tokio, la basura se clasifica en varias categorías principales: combustibles (como restos de comida y papel), no combustibles (como cerámica y metales), reciclables (como botellas, latas, y papel), y basura voluminosa. Estas categorías se manejan de manera diferente en términos de recogida y procesamiento​.

Normas Específicas por Área: La gestión de residuos y reciclaje varía de un barrio a otro dentro de la ciudad, con cada uno estableciendo sus propias reglas y regulaciones. Los residentes reciben información detallada sobre estas normas al registrarse en el ayuntamiento o junta de distrito​​.

Responsabilidad Individual y Comunitaria: En Japón, cada persona es responsable de los residuos que genera, lo que se refleja en la falta de papeleras en las calles. En los hogares, se realiza una separación exhaustiva de residuos, y los materiales reciclables se clasifican y se recogen en días designados​.

Altas Tasas de Reciclaje: Japón ha logrado una tasa de reciclaje impresionantemente alta. En el año fiscal 2017, la tasa de reciclaje fue del 84,8%, significativamente más alta que en muchas otras regiones del mundo​.

Variedad de Materiales Reciclados: Se reciclan una amplia gama de materiales, incluyendo papel, cartón, vidrio, plástico, metal, y residuos especiales como aparatos electrónicos y pilas​.

Incentivos y Campañas de Concienciación: El gobierno japonés promueve activamente el reciclaje a través de campañas de concienciación pública y ofrece incentivos para fomentar prácticas de reciclaje adecuadas. También se han establecido sistemas de recogida y reciclaje a nivel local y nacional para facilitar la separación y el procesamiento de los materiales reciclables​.

Manejo de Residuos No Reciclables: Los residuos que no son reciclables se envían a plantas de incineración para su eliminación segura, y el calor generado durante este proceso se utiliza para generar energía, ayudando a reducir la dependencia de Japón de los combustibles fósiles​​.

En resumen, el sistema de reciclaje en Tokio es un modelo de eficiencia y responsabilidad, caracterizado por una clasificación detallada de residuos, normas específicas por barrio, alta participación ciudadana, y fuerte apoyo gubernamental. Este enfoque ha resultado en tasas de reciclaje excepcionalmente altas y una gestión efectiva de residuos, lo que refleja el compromiso de Japón con la sostenibilidad y la protección del medio ambiente.",0.6187285393050478,0.99999999995,1.0,0.1111111111111111
como va el tema del reciclaje en la ciudad de tokio,"['En general, Japón se enorgullece de tener la tasa de reciclaje más alta del entorno y continúa trabajando para mejorar aún más sus prácticas de reciclaje.\n\nEl sistema de reciclaje en Japón es un ejemplo de eficiencia y compromiso con el medio ambiente. A través de normas estrictas y regulaciones, el país ha logrado una tasa de reciclaje muy alta y ha implementado tecnologías para reducir la cantidad de residuos generados. El reciclaje en Japón es una responsabilidad tanto de los hogares como de las calles, y se espera que cada persona cumpla con las normas establecidas. Con su enfoque en el reciclaje y la protección del medio ambiente, Japón sigue siendo un líder en el campo del reciclaje a nivel mundial.\nConsultas habituales sobre el reciclaje en Japón\n¿Qué materiales se reciclan en Japón?\n\nEn Japón se reciclan una amplia variedad de materiales, incluyendo papel, cartón, vidrio, plástico, metal y residuos especiales como aparatos electrónicos y pilas. Cada material tiene su propio proceso de reciclaje y se recoge en días designados.\nReciclaje de chatarra electrónica: procesos y beneficios\n¿Cómo se promueve el reciclaje en Japón?\n\nEl gobierno japonés ha implementado campañas de concienciación pública y ofrece incentivos para promover el reciclaje. Además, se han establecido sistemas de recogida y reciclaje a nivel local y nacional para facilitar la separación y el procesamiento de los materiales reciclables.\n¿Qué sucede con los residuos no reciclables en Japón?\n\nLos residuos no reciclables se envían a plantas de incineración para su eliminación segura. El calor generado durante el proceso de incineración se utiliza para generar energía, lo que ayuda a reducir la dependencia de Japón de los combustibles fósiles.\nTabla de tasas de reciclaje en diferentes países\nPaís\tTasa de reciclaje\nJapón\t84,8%\nUnión Europea\t40%\nEstados Unidos\t20%\n\nEl sistema de reciclaje en Japón ha demostrado ser altamente efectivo y ha llevado a una tasa de reciclaje significativamente más alta que en otros países. A través de una combinación de normas estrictas, regulaciones y concienciación pública, Japón continúa siendo un líder en el reciclaje y la protección del medio ambiente.\n\nSi deseas conocer otras notas parecidas a Reciclaje en Japón: normas y eficiencia podrás visitar la categoría Reciclaje.', 'Reciclaje en Japón: normas y eficiencia\n\nJapón es conocido por su compromiso con el reciclaje y la protección del medio ambiente. El país ha implementado un sistema de reciclaje altamente eficiente que ha sido adoptado por la mayoría de la población. Este sistema se basa en estrictas normas y regulaciones que se aplican tanto en los hogares como en las calles.\n\nTemas de los que Hablaremos\n\n    Cómo funciona el reciclaje en Japón\n    El reciclaje en las casas y en las calles\n    Cuánto se recicla en Japón\n    Consultas habituales sobre el reciclaje en Japón\n        ¿Qué materiales se reciclan en Japón?\n        ¿Cómo se promueve el reciclaje en Japón?\n        ¿Qué sucede con los residuos no reciclables en Japón?\n    Tabla de tasas de reciclaje en diferentes países\n\nCómo funciona el reciclaje en Japón\n\nEl sistema de reciclaje en Japón es altamente organizado y se lleva a cabo a nivel local. Cada barrio tiene sus propias reglas y regulaciones, por lo que es importante que los residentes conozcan las normas específicas de su área. Al registrarse como vecino en el ayuntamiento o junta de distrito, se proporciona a los extranjeros un folleto detallado que explica el proceso de reciclaje en su barrio.\n\nUna de las diferencias clave entre el sistema de reciclaje en Japón y otros países es que no se permite reciclar en cualquier momento y de cualquier manera. En Japón, el reciclaje se lleva a cabo bajo estrictas normas y regulaciones establecidas. Por ejemplo, los envases deben ser lavados y los productos deben ser doblados para ocupar el menor espacio posible. Además, la recogida de residuos especiales se realiza en días específicos y los productos deben estar etiquetados correctamente.\n\nSi no se sigue correctamente el proceso de reciclaje, la basura se devuelve al propietario con una nota que indica que se recicle correctamente. Esto demuestra el compromiso de Japón con el reciclaje y la importancia de seguir las normas establecidas.\nEl reciclaje en las casas y en las calles\n\nEn Japón, el reciclaje no es solo una responsabilidad de los hogares, sino también de las calles. Cada persona es responsable de los residuos que genera y es por eso que no se encuentran papeleras en las calles. La mayoría de las personas llevan su basura consigo y la reciclan en casa.\n\nEn los hogares, se realiza una separación exhaustiva de los residuos. Los materiales reciclables como el papel, el cartón, el vidrio y el plástico se clasifican y se colocan en bolsas o contenedores específicos. Estos residuos se recogen en días designados y se envían a las plantas de reciclaje correspondientes.\nReciclaje en otros países: sistemas eficientes y medidas sostenibles\n\nEn las calles, se espera que las personas se lleven su basura y la reciclen en casa. Esto se debe a la falta de papeleras en las calles y al énfasis en la responsabilidad individual en el manejo de los residuos.\nCuánto se recicla en Japón\n\nJapón ha logrado una tasa de reciclaje muy alta en comparación con otros países. En el año fiscal 2017, la tasa de reciclaje en Japón fue del 84,8%, superando el 40% registrado en la Unión Europea y el 20% en los Estados Unidos.\n\nUno de los ejemplos más destacados de reciclaje en Japón es el de las botellas de plástico PET. Cada año se despachan 2700 millones de botellas en Japón. La industria ha implementado tecnologías y procesos de fabricación para hacer más ligeras estas botellas y reducir la cantidad de residuos generados. Además, se ha establecido un sistema de recogida y reciclaje de botellas de plástico PET a nivel nacional.\n\nEn general, Japón se enorgullece de tener la tasa de reciclaje más alta del entorno y continúa trabajando para mejorar aún más sus prácticas de reciclaje.']","La ciudad de Tokio, capital de Japón, es conocida por su compromiso con el reciclaje y la protección del medio ambiente. El sistema de reciclaje en Tokio es altamente eficiente y se lleva a cabo a nivel local. Cada barrio tiene sus propias reglas y regulaciones, por lo que es importante que los residentes conozcan las normas específicas de su área.

Una de las diferencias clave entre el sistema de reciclaje en Tokio y otros países es que no se permite reciclar en cualquier momento y de cualquier manera. En Japón, el reciclaje se lleva a cabo bajo estrictas normas y regulaciones establecidas. Por ejemplo, los envases deben ser lavados y los productos deben ser doblados para ocupar el menor espacio posible. Además, la recogida de residuos especiales se realiza en días específicos y los productos deben estar etiquetados correctamente.

Si no se sigue correctamente el proceso de reciclaje, la basura se devuelve al propietario con una nota que indica que se recicle correctamente. Esto demuestra el compromiso de Japón con el reciclaje y la importancia de seguir las normas establecidas.

El reciclaje en Tokio se lleva a cabo a través de la separación exhaustiva de los residuos. Los materiales reciclables como el papel, el cartón, el vidrio y el plástico se clasifican y se colocan en bolsas o contenedores específicos. Estos residuos se recogen en días designados y se envían a las plantas de reciclaje correspondientes.

En cuanto a las tasas de reciclaje en Tokio, la tasa de reciclaje en el año fiscal 2017 fue del 84,8%, superando el 40% registrado en la Unión Europea y el 20% en los Estados Unidos. Este alto nivel de reciclaje se debe a la implementación de tecnologías y procesos de fabricación más eficientes, así como a la concienciación pública y la responsabilidad individual en el manejo de los residuos.

En resumen, el sistema de reciclaje en Tokio es altamente eficiente y se lleva a cabo bajo estrictas normas y regulaciones. La separación exhaustiva de los residuos y la concienciación pública son factores clave en el éxito del sistema de reciclaje en Tokio.","El reciclaje en Tokio, y en Japón en general, es un proceso altamente organizado y eficiente, respaldado por un fuerte compromiso público y gubernamental hacia la sostenibilidad y la gestión adecuada de residuos. La estructura del sistema de reciclaje en Tokio puede analizarse en varios aspectos clave:

    Clasificación y Separación de Residuos: En Tokio, la basura se clasifica en varias categorías principales: combustibles (como restos de comida y papel), no combustibles (como cerámica y metales), reciclables (como botellas, latas, y papel), y basura voluminosa. Estas categorías se manejan de manera diferente en términos de recogida y procesamiento​.

Normas Específicas por Área: La gestión de residuos y reciclaje varía de un barrio a otro dentro de la ciudad, con cada uno estableciendo sus propias reglas y regulaciones. Los residentes reciben información detallada sobre estas normas al registrarse en el ayuntamiento o junta de distrito​​.

Responsabilidad Individual y Comunitaria: En Japón, cada persona es responsable de los residuos que genera, lo que se refleja en la falta de papeleras en las calles. En los hogares, se realiza una separación exhaustiva de residuos, y los materiales reciclables se clasifican y se recogen en días designados​.

Altas Tasas de Reciclaje: Japón ha logrado una tasa de reciclaje impresionantemente alta. En el año fiscal 2017, la tasa de reciclaje fue del 84,8%, significativamente más alta que en muchas otras regiones del mundo​.

Variedad de Materiales Reciclados: Se reciclan una amplia gama de materiales, incluyendo papel, cartón, vidrio, plástico, metal, y residuos especiales como aparatos electrónicos y pilas​.

Incentivos y Campañas de Concienciación: El gobierno japonés promueve activamente el reciclaje a través de campañas de concienciación pública y ofrece incentivos para fomentar prácticas de reciclaje adecuadas. También se han establecido sistemas de recogida y reciclaje a nivel local y nacional para facilitar la separación y el procesamiento de los materiales reciclables​.

Manejo de Residuos No Reciclables: Los residuos que no son reciclables se envían a plantas de incineración para su eliminación segura, y el calor generado durante este proceso se utiliza para generar energía, ayudando a reducir la dependencia de Japón de los combustibles fósiles​​.

En resumen, el sistema de reciclaje en Tokio es un modelo de eficiencia y responsabilidad, caracterizado por una clasificación detallada de residuos, normas específicas por barrio, alta participación ciudadana, y fuerte apoyo gubernamental. Este enfoque ha resultado en tasas de reciclaje excepcionalmente altas y una gestión efectiva de residuos, lo que refleja el compromiso de Japón con la sostenibilidad y la protección del medio ambiente.",0.7664572391874902,0.99999999995,1.0,0.1111111111111111
explícame cómo se recicla en tokyo,"['Reciclaje en Japón: normas y eficiencia\n\nJapón es conocido por su compromiso con el reciclaje y la protección del medio ambiente. El país ha implementado un sistema de reciclaje altamente eficiente que ha sido adoptado por la mayoría de la población. Este sistema se basa en estrictas normas y regulaciones que se aplican tanto en los hogares como en las calles.\n\nTemas de los que Hablaremos\n\n    Cómo funciona el reciclaje en Japón\n    El reciclaje en las casas y en las calles\n    Cuánto se recicla en Japón\n    Consultas habituales sobre el reciclaje en Japón\n        ¿Qué materiales se reciclan en Japón?\n        ¿Cómo se promueve el reciclaje en Japón?\n        ¿Qué sucede con los residuos no reciclables en Japón?\n    Tabla de tasas de reciclaje en diferentes países\n\nCómo funciona el reciclaje en Japón\n\nEl sistema de reciclaje en Japón es altamente organizado y se lleva a cabo a nivel local. Cada barrio tiene sus propias reglas y regulaciones, por lo que es importante que los residentes conozcan las normas específicas de su área. Al registrarse como vecino en el ayuntamiento o junta de distrito, se proporciona a los extranjeros un folleto detallado que explica el proceso de reciclaje en su barrio.\n\nUna de las diferencias clave entre el sistema de reciclaje en Japón y otros países es que no se permite reciclar en cualquier momento y de cualquier manera. En Japón, el reciclaje se lleva a cabo bajo estrictas normas y regulaciones establecidas. Por ejemplo, los envases deben ser lavados y los productos deben ser doblados para ocupar el menor espacio posible. Además, la recogida de residuos especiales se realiza en días específicos y los productos deben estar etiquetados correctamente.\n\nSi no se sigue correctamente el proceso de reciclaje, la basura se devuelve al propietario con una nota que indica que se recicle correctamente. Esto demuestra el compromiso de Japón con el reciclaje y la importancia de seguir las normas establecidas.\nEl reciclaje en las casas y en las calles\n\nEn Japón, el reciclaje no es solo una responsabilidad de los hogares, sino también de las calles. Cada persona es responsable de los residuos que genera y es por eso que no se encuentran papeleras en las calles. La mayoría de las personas llevan su basura consigo y la reciclan en casa.\n\nEn los hogares, se realiza una separación exhaustiva de los residuos. Los materiales reciclables como el papel, el cartón, el vidrio y el plástico se clasifican y se colocan en bolsas o contenedores específicos. Estos residuos se recogen en días designados y se envían a las plantas de reciclaje correspondientes.\nReciclaje en otros países: sistemas eficientes y medidas sostenibles\n\nEn las calles, se espera que las personas se lleven su basura y la reciclen en casa. Esto se debe a la falta de papeleras en las calles y al énfasis en la responsabilidad individual en el manejo de los residuos.\nCuánto se recicla en Japón\n\nJapón ha logrado una tasa de reciclaje muy alta en comparación con otros países. En el año fiscal 2017, la tasa de reciclaje en Japón fue del 84,8%, superando el 40% registrado en la Unión Europea y el 20% en los Estados Unidos.\n\nUno de los ejemplos más destacados de reciclaje en Japón es el de las botellas de plástico PET. Cada año se despachan 2700 millones de botellas en Japón. La industria ha implementado tecnologías y procesos de fabricación para hacer más ligeras estas botellas y reducir la cantidad de residuos generados. Además, se ha establecido un sistema de recogida y reciclaje de botellas de plástico PET a nivel nacional.\n\nEn general, Japón se enorgullece de tener la tasa de reciclaje más alta del entorno y continúa trabajando para mejorar aún más sus prácticas de reciclaje.', 'En general, Japón se enorgullece de tener la tasa de reciclaje más alta del entorno y continúa trabajando para mejorar aún más sus prácticas de reciclaje.\n\nEl sistema de reciclaje en Japón es un ejemplo de eficiencia y compromiso con el medio ambiente. A través de normas estrictas y regulaciones, el país ha logrado una tasa de reciclaje muy alta y ha implementado tecnologías para reducir la cantidad de residuos generados. El reciclaje en Japón es una responsabilidad tanto de los hogares como de las calles, y se espera que cada persona cumpla con las normas establecidas. Con su enfoque en el reciclaje y la protección del medio ambiente, Japón sigue siendo un líder en el campo del reciclaje a nivel mundial.\nConsultas habituales sobre el reciclaje en Japón\n¿Qué materiales se reciclan en Japón?\n\nEn Japón se reciclan una amplia variedad de materiales, incluyendo papel, cartón, vidrio, plástico, metal y residuos especiales como aparatos electrónicos y pilas. Cada material tiene su propio proceso de reciclaje y se recoge en días designados.\nReciclaje de chatarra electrónica: procesos y beneficios\n¿Cómo se promueve el reciclaje en Japón?\n\nEl gobierno japonés ha implementado campañas de concienciación pública y ofrece incentivos para promover el reciclaje. Además, se han establecido sistemas de recogida y reciclaje a nivel local y nacional para facilitar la separación y el procesamiento de los materiales reciclables.\n¿Qué sucede con los residuos no reciclables en Japón?\n\nLos residuos no reciclables se envían a plantas de incineración para su eliminación segura. El calor generado durante el proceso de incineración se utiliza para generar energía, lo que ayuda a reducir la dependencia de Japón de los combustibles fósiles.\nTabla de tasas de reciclaje en diferentes países\nPaís\tTasa de reciclaje\nJapón\t84,8%\nUnión Europea\t40%\nEstados Unidos\t20%\n\nEl sistema de reciclaje en Japón ha demostrado ser altamente efectivo y ha llevado a una tasa de reciclaje significativamente más alta que en otros países. A través de una combinación de normas estrictas, regulaciones y concienciación pública, Japón continúa siendo un líder en el reciclaje y la protección del medio ambiente.\n\nSi deseas conocer otras notas parecidas a Reciclaje en Japón: normas y eficiencia podrás visitar la categoría Reciclaje.']","El sistema de reciclaje en Tokio se basa en estrictas normas y regulaciones que se aplican tanto en los hogares como en las calles. Esta forma de reciclaje se ha convertido en una parte integral de la cultura japonesa y ha sido adoptada por la mayoría de la población.

La reciclación en las casas y en las calles es un proceso que se lleva a cabo de manera sistemática y se realiza en días específicos. Cada persona es responsable de los residuos que genera y es por esta razón que no se encuentran papeleras en las calles. La mayoría de las personas llevan su basura consigo y la reciclan en casa.

En el caso de las botellas de plástico PET, cada año se despachan 2700 millones de botellas en Japón. La industria ha implementado tecnologías y procesos de fabricación para hacer más ligeras estas botellas y reducir la cantidad de residuos generados. Además, se ha establecido un sistema de recogida y reciclaje de botellas de plástico PET a nivel nacional.

La tasa de reciclaje en Japón es muy alta, superando el 84,8% en comparación con el 40% en la Unión Europea y el 20% en los Estados Unidos. Este éxito se debe a una combinación de normas estrictas, regulaciones y concienciación pública. Japón se enorgullece de tener la tasa de reciclaje más alta del entorno y continúa trabajando para mejorar aún más sus prácticas de reciclaje.

En resumen, el sistema de reciclaje en Tokio se basa en una combinación de normas estrictas, regulaciones y concienciación pública, lo que ha llevado a una tasa de reciclaje significativamente más alta que en otros países. A través de una combinación de estos factores, Japón se ha convertido en un líder en el reciclaje y la protección del medio ambiente.","El reciclaje en Tokio, y en Japón en general, es un proceso altamente organizado y eficiente, respaldado por un fuerte compromiso público y gubernamental hacia la sostenibilidad y la gestión adecuada de residuos. La estructura del sistema de reciclaje en Tokio puede analizarse en varios aspectos clave:

    Clasificación y Separación de Residuos: En Tokio, la basura se clasifica en varias categorías principales: combustibles (como restos de comida y papel), no combustibles (como cerámica y metales), reciclables (como botellas, latas, y papel), y basura voluminosa. Estas categorías se manejan de manera diferente en términos de recogida y procesamiento​.

Normas Específicas por Área: La gestión de residuos y reciclaje varía de un barrio a otro dentro de la ciudad, con cada uno estableciendo sus propias reglas y regulaciones. Los residentes reciben información detallada sobre estas normas al registrarse en el ayuntamiento o junta de distrito​​.

Responsabilidad Individual y Comunitaria: En Japón, cada persona es responsable de los residuos que genera, lo que se refleja en la falta de papeleras en las calles. En los hogares, se realiza una separación exhaustiva de residuos, y los materiales reciclables se clasifican y se recogen en días designados​.

Altas Tasas de Reciclaje: Japón ha logrado una tasa de reciclaje impresionantemente alta. En el año fiscal 2017, la tasa de reciclaje fue del 84,8%, significativamente más alta que en muchas otras regiones del mundo​.

Variedad de Materiales Reciclados: Se reciclan una amplia gama de materiales, incluyendo papel, cartón, vidrio, plástico, metal, y residuos especiales como aparatos electrónicos y pilas​.

Incentivos y Campañas de Concienciación: El gobierno japonés promueve activamente el reciclaje a través de campañas de concienciación pública y ofrece incentivos para fomentar prácticas de reciclaje adecuadas. También se han establecido sistemas de recogida y reciclaje a nivel local y nacional para facilitar la separación y el procesamiento de los materiales reciclables​.

Manejo de Residuos No Reciclables: Los residuos que no son reciclables se envían a plantas de incineración para su eliminación segura, y el calor generado durante este proceso se utiliza para generar energía, ayudando a reducir la dependencia de Japón de los combustibles fósiles​​.

En resumen, el sistema de reciclaje en Tokio es un modelo de eficiencia y responsabilidad, caracterizado por una clasificación detallada de residuos, normas específicas por barrio, alta participación ciudadana, y fuerte apoyo gubernamental. Este enfoque ha resultado en tasas de reciclaje excepcionalmente altas y una gestión efectiva de residuos, lo que refleja el compromiso de Japón con la sostenibilidad y la protección del medio ambiente.",0.8503794195043722,0.99999999995,0.9166666666666666,0.1111111111111111
¿Qué tengo que hacer si veo una persona desmayada en mi portal?,"['¿Qué hacer con una hoja de reclamaciones después de solicitarla en la tienda?\nÓscar F. Civieta\n\n    En ocasiones, directamente, no se pide porque pensamos que no servirá de nada. En otras sí se reclama, pero luego no sabemos qué hacer con la hoja de reclamaciones.\n    Te explicamos, paso a paso, dónde y cómo has de presentar esta queja si no estás conforme con un producto o servicio recibido.\n    Descubre más historias en Business Insider España.\n\n""No va a servir de nada, prefiero pasar del tema"". ""Vaya lío, y encima va a dar igual, mejor déjalo"". Cuántas veces hemos dicho (o hemos oído decir) este tipo de frases y similares después de padecer un mal servicio en un establecimiento (al menos bajo nuestra versión). A veces se renuncia a la queja porque no sabemos qué hacer con la hoja de reclamaciones; otras, debido a que está muy generalizada la creencia de que no tienen ningún tipo de utilidad. Y, aunque muchas veces se quede en el intento, hay ocasiones en las que llegan a buen término y te deparan una agradable sorpresa al término de las gestiones e indagaciones.\n\nEso sí, antes de profundizar en el asunto, hay que advertir algo: incluso cuando te den la razón, la hoja de reclamaciones por sí misma no garantiza que el consumidor vaya a ser indemnizado. En algunos casos, para alcanzar ese extremo es necesario recurrir a la vía judicial. \n\nCada comunidad autónoma tiene una legislación propia sobre el funcionamiento de estas hojas de reclamaciones. Sin embargo, como veremos, los trámites que hay que seguir con ellas una vez rellenadas son los mismos. \nEl medio extrajudicial para mostrar disconformidad con un producto o servicio\n\nEn la web de Legálitas definen las hojas de reclamaciones como ""impresos oficiales que ponen a disposición de los usuarios las Comunidades Autónomas y de obligada tenencia para todas las empresas o personas físicas que desarrollen una actividad empresarial y comercialicen bienes o servicios"". Son, continúan, ""el medio extrajudicial que tiene todo consumidor o usuario para poner en conocimiento de la Administración la no conformidad con un producto o servicio recibido"".\n\nTodos los establecimientos, por tanto, están obligados a tener hojas de reclamaciones a disposición de los clientes. Y la totalidad de estos tienen derecho a solicitarlas si estiman que no han recibido un servicio adecuado. Hasta aquí, más o menos, nos sabemos la teoría, el problema viene después.\nYa he rellenado la hora de reclamaciones, ¿y ahora qué?\n\nRecurrimos a las instrucciones de la Organización de Consumidores y Usuarios (OCU) para saber qué hacer con la hoja de reclamaciones. Pero vamos al momento justamente anterior a solicitarla. Desde esta Organización recomiendan, como es lógico, que este sea el último cartucho, antes ""hay que intentar llegar a un acuerdo amistoso"". Si esto no es posible, entonces sí. Sigue estos pasos para reclamar:', 'Consultas en Mayo Clinic\n\nMayo Clinic ofrece consultas en Arizona, Florida y Minnesota, y en las ubicaciones que cuentan con el Sistema de Salud de Mayo Clinic.\nSolicitar una consulta\nprimeros auxilios\nDesmayo\n\n    Información básica\n    Más información\n\nProductos y servicios\nLa Dieta de Mayo Clinic: ¿cuál es tu meta de pérdida de peso? De 5 a 10 lb (2,2 a 4,5 kg), de 11 a 25 lb (4,9 a 11,3 kg) o más de 25 lb (más de 11,3 kg)\nEscrito por el personal de Mayo Clinic\n\nLos desmayos ocurren cuando el cerebro no recibe suficiente sangre durante un tiempo breve. Esto ocasiona la pérdida del conocimiento. Generalmente, el conocimiento se recupera rápidamente.\n\nPosiblemente, los desmayos no tengan importancia médica. O bien, la causa puede ser un trastorno grave, que ocasionalmente involucra al corazón. Por lo tanto, debes tratar la pérdida del conocimiento como si fuera una emergencia médica hasta que se alivien los síntomas y se identifique la causa. Habla con el proveedor de atención médica si te desmayas más de una vez.\nSi sientes que estás a punto de desmayar\n\n    Recuéstate o siéntate. Para reducir la probabilidad de que vuelvas a desmayarte, no te levantes demasiado rápido.\n    Si te sientas, coloca la cabeza entre las rodillas.\n\nSi otra persona se desmaya\n\n    Coloca de espaldas a la persona. Si no hay lesiones y la persona respira, levanta sus piernas por encima del nivel del corazón, de ser posible. Apoya las piernas de la persona sobre algún objeto a una altura de 12 pulgadas (30 centímetros). Afloja los cinturones, collares u otra ropa ajustada.\n\n    Para reducir la probabilidad de que la persona vuelva a desmayarse, no la levantes demasiado rápido. Si la persona no recupera el conocimiento en un minuto, llama al 911 o al número local de emergencias.\n    Verifica si respira. Revisa si hay pulso y si la persona respira. Si la persona no respira, comienza a hacerle reanimación cardiopulmonar. Llama al 911 o al número de emergencia local. Continúa con la reanimación cardiopulmonar hasta que llegue la ayuda o hasta que la persona comience a respirar.\n\nSi la persona se lesionó en una caída a causa de un desmayo, trata de manera adecuada cualquier golpe, moretón o corte. Controla el sangrado aplicando presión directa.', 'Recurrimos a las instrucciones de la Organización de Consumidores y Usuarios (OCU) para saber qué hacer con la hoja de reclamaciones. Pero vamos al momento justamente anterior a solicitarla. Desde esta Organización recomiendan, como es lógico, que este sea el último cartucho, antes ""hay que intentar llegar a un acuerdo amistoso"". Si esto no es posible, entonces sí. Sigue estos pasos para reclamar:\n\n    Rellena la hoja de reclamaciones: expón de forma clara y concisa el motivo de tu queja, la compensación que solicitas y la fecha. Hay tres copias: una para el establecimiento, otra para el consumidor y otra para la Administración. Han de estar firmadas por las dos partes.\n    Entrega la hoja de reclamaciones de manera presencial, telemática o por correo: se puede entregar en la Oficina Municipal de Información del Consumidor o en la Dirección General de Consumo de tu comunidad. Junto con fotocopias, no originales, de cualquier documento, presupuesto, contrato, factura o certificados de garantía que consideres importante como prueba del hecho. \n    Búsqueda de acuerdos: la Administración de Consumo correspondiente estudiará tu caso. Se pondrá en contacto con la empresa para facilitar llegar a un acuerdo. Si no lo consigue, la Administración comprobará si la empresa ha incumplido alguna normativa de consumo y, si es el caso, abrirá expediente iniciando un procedimiento sancionador que suele acabar en una multa. Multa para la empresa, sí; pero indemnización para ti, muchas veces no, como ya hemos comentado. \n    Arbitraje de consumo: si pasado un tiempo no hay respuesta, hay que ir a Arbitraje de Consumo. Es gratuito y su fallo será vinculante, es decir, que aquello que decida equivaldrá a una sentencia judicial. Pero sólo podrá hacerlo si la empresa reclamada está de acuerdo o está adherido a arbitraje. Por eso, desde la OCU recomiendan que, antes de comprar o contratar algún producto o servicio, se debiera consultar si está en la lista de establecimientos adheridos a arbitraje para evitar futuros problemas. \n    Vía judicial: si la empresa no acepta el arbitraje, porque no está de acuerdo o porque no está adherido a arbitraje y no quiere sumarse, el siguiente paso es acudir a la vía judicial con todos los gastos que eso supone. Ir a juicio, recuerdan en la OCU, ""suele ser lento y caro, pero si te compensa económicamente o tienes pruebas suficientes para ganar, no te rindas. Dependiendo de la indemnización que solicites la tramitación será diferente y los costes variarán"".\n\nSectores con vías específicas para reclamar\n\nLo anterior es, de manera general, lo que hay que hacer con las hojas de reclamaciones. Pero algunos sectores tienen unas vías específicas para reclamar. Son los siguientes: \n\n    Internet y telefonía: Oficina de Atención al Usuario de Telecomunicaciones.\n    Energía, electricidad y gas: Dirección General de Industria y Energía de tu Comunidad Autónoma.\n    Seguros: en primer lugar, has de recurrir al Defensor del Asegurado de la entidad; posteriormente,  al Servicio de Reclamaciones de la Dirección General de Seguros y Fondos de Pensiones de tu Comunidad Autónoma.\n    Servicios de inversión: primero al Defensor del cliente, segundo al Servicio de Reclamaciones de la Comisión Nacional del Mercado de Valores y/o Protector del Inversor de la Bolsa de Madrid.\n    Servicios bancarios: Servicio de Atención al Cliente de la entidad y Servicio de Reclamaciones del Banco de España.\n    Transporte terrestre: Juntas Arbitrales de Transporte Terrestre y/o Dirección General de Transportes Terrestres de tu Comunidad Autónoma.\n    Transporte aéreo: Servicio de Atención al cliente de la compañía aérea y a la Agencia Española de Seguridad Aérea (AESA).\n    Turismo y viajes combinados: atención al cliente de la agencia de viajes o Dirección General de Turismo de tu Comunidad Autónoma.']","Si ves a alguien desmayándose en tu portal, sigue estos pasos para ayudar a la persona:

    Coloca a la persona de espaldas y apoya sus piernas sobre un objeto a una altura de 12 pulgadas (30 centímetros). Afloja los cinturones, collares u otra ropa ajustada para reducir la probabilidad de que vuelva a desmayarse.
    Verifica si respira y si tiene pulso. Si no respira, llama al 911 o al número local de emergencias.
    Trata de manera adecuada cualquier lesión, como moretones o cortes, para evitar sangrado excesivo.
    Intenta llegar a un acuerdo amistoso con la persona desmayada. Si esto no es posible, sigue los siguientes pasos.

    Búsqueda de acuerdos: la Administración de Consumo correspondiente estudiará tu caso y buscará un acuerdo con la empresa. Si no se logra un acuerdo, la Administración puede iniciar un procedimiento sancionador que podría resultar en una multa para la empresa.

    Arbitraje de consumo: si no hay respuesta después de un tiempo, puedes considerar la opción de ir a Arbitraje de Consumo. Este es gratuito y su fallo será vinculante, lo que significa que la decisión sería similar a una sentencia judicial.

    Vía judicial: si ninguna de las anteriores opciones funciona, puedes presentar una demanda judicial contra la empresa. Esto puede ser lento y costoso, pero si tienes pruebas suficientes para demostrar que la empresa incumplió las leyes de consumo, es posible que ganes y obtengas una indemnización para ti.","Si encuentras a una persona desmayada, debes seguir estos pasos de primeros auxilios:

Colocar a la Persona de Espaldas: Si la persona está respirando y no presenta lesiones evidentes, colócala de espaldas. Si es posible, eleva sus piernas por encima del nivel del corazón, apoyándolas sobre algún objeto a una altura aproximada de 30 centímetros. Esto puede ayudar a mejorar la circulación de la sangre hacia el cerebro​.

Aflojar Ropa Ajustada: Afloja cinturones, collares u otra ropa ajustada para facilitar la respiración de la persona​.

No Levantar Rápidamente a la Persona: Evita levantar a la persona demasiado rápido para reducir la probabilidad de que vuelva a desmayarse. Si la persona no recupera el conocimiento en un minuto, llama inmediatamente al 911 o al número local de emergencias​.

Verificar Respiración y Pulso: Revisa si la persona respira y si tiene pulso. Si la persona no respira, comienza a realizar reanimación cardiopulmonar (RCP) y llama al número de emergencia local. Continúa con la RCP hasta que llegue la ayuda o hasta que la persona comience a respirar​.

Tratar Lesiones Relacionadas con la Caída: Si la persona se ha lesionado al caerse, trata cualquier golpe, moretón o corte adecuadamente. Controla el sangrado aplicando presión directa​.

Mantener Despejadas las Vías Respiratorias: Asegúrate de que las vías respiratorias de la persona estén despejadas para que pueda respirar sin problemas. La persona debe permanecer acostada unos 10 a 15 minutos​.

Es importante recordar que, aunque la mayoría de los desmayos no son motivo de preocupación grave, en algunos casos pueden ser señal de un problema serio. Por lo tanto, es importante que la persona vea a un médico después de un desmayo para descubrir la causa subyacente.",0.9072161009671716,0.49999999995,0.3870967741935484,0.875
¿Cuál es el protocolo de actuación a seguir si me encuentro una persona desmayada?,"['Consultas en Mayo Clinic\n\nMayo Clinic ofrece consultas en Arizona, Florida y Minnesota, y en las ubicaciones que cuentan con el Sistema de Salud de Mayo Clinic.\nSolicitar una consulta\nprimeros auxilios\nDesmayo\n\n    Información básica\n    Más información\n\nProductos y servicios\nLa Dieta de Mayo Clinic: ¿cuál es tu meta de pérdida de peso? De 5 a 10 lb (2,2 a 4,5 kg), de 11 a 25 lb (4,9 a 11,3 kg) o más de 25 lb (más de 11,3 kg)\nEscrito por el personal de Mayo Clinic\n\nLos desmayos ocurren cuando el cerebro no recibe suficiente sangre durante un tiempo breve. Esto ocasiona la pérdida del conocimiento. Generalmente, el conocimiento se recupera rápidamente.\n\nPosiblemente, los desmayos no tengan importancia médica. O bien, la causa puede ser un trastorno grave, que ocasionalmente involucra al corazón. Por lo tanto, debes tratar la pérdida del conocimiento como si fuera una emergencia médica hasta que se alivien los síntomas y se identifique la causa. Habla con el proveedor de atención médica si te desmayas más de una vez.\nSi sientes que estás a punto de desmayar\n\n    Recuéstate o siéntate. Para reducir la probabilidad de que vuelvas a desmayarte, no te levantes demasiado rápido.\n    Si te sientas, coloca la cabeza entre las rodillas.\n\nSi otra persona se desmaya\n\n    Coloca de espaldas a la persona. Si no hay lesiones y la persona respira, levanta sus piernas por encima del nivel del corazón, de ser posible. Apoya las piernas de la persona sobre algún objeto a una altura de 12 pulgadas (30 centímetros). Afloja los cinturones, collares u otra ropa ajustada.\n\n    Para reducir la probabilidad de que la persona vuelva a desmayarse, no la levantes demasiado rápido. Si la persona no recupera el conocimiento en un minuto, llama al 911 o al número local de emergencias.\n    Verifica si respira. Revisa si hay pulso y si la persona respira. Si la persona no respira, comienza a hacerle reanimación cardiopulmonar. Llama al 911 o al número de emergencia local. Continúa con la reanimación cardiopulmonar hasta que llegue la ayuda o hasta que la persona comience a respirar.\n\nSi la persona se lesionó en una caída a causa de un desmayo, trata de manera adecuada cualquier golpe, moretón o corte. Controla el sangrado aplicando presión directa.', '¿Qué hacer con una hoja de reclamaciones después de solicitarla en la tienda?\nÓscar F. Civieta\n\n    En ocasiones, directamente, no se pide porque pensamos que no servirá de nada. En otras sí se reclama, pero luego no sabemos qué hacer con la hoja de reclamaciones.\n    Te explicamos, paso a paso, dónde y cómo has de presentar esta queja si no estás conforme con un producto o servicio recibido.\n    Descubre más historias en Business Insider España.\n\n""No va a servir de nada, prefiero pasar del tema"". ""Vaya lío, y encima va a dar igual, mejor déjalo"". Cuántas veces hemos dicho (o hemos oído decir) este tipo de frases y similares después de padecer un mal servicio en un establecimiento (al menos bajo nuestra versión). A veces se renuncia a la queja porque no sabemos qué hacer con la hoja de reclamaciones; otras, debido a que está muy generalizada la creencia de que no tienen ningún tipo de utilidad. Y, aunque muchas veces se quede en el intento, hay ocasiones en las que llegan a buen término y te deparan una agradable sorpresa al término de las gestiones e indagaciones.\n\nEso sí, antes de profundizar en el asunto, hay que advertir algo: incluso cuando te den la razón, la hoja de reclamaciones por sí misma no garantiza que el consumidor vaya a ser indemnizado. En algunos casos, para alcanzar ese extremo es necesario recurrir a la vía judicial. \n\nCada comunidad autónoma tiene una legislación propia sobre el funcionamiento de estas hojas de reclamaciones. Sin embargo, como veremos, los trámites que hay que seguir con ellas una vez rellenadas son los mismos. \nEl medio extrajudicial para mostrar disconformidad con un producto o servicio\n\nEn la web de Legálitas definen las hojas de reclamaciones como ""impresos oficiales que ponen a disposición de los usuarios las Comunidades Autónomas y de obligada tenencia para todas las empresas o personas físicas que desarrollen una actividad empresarial y comercialicen bienes o servicios"". Son, continúan, ""el medio extrajudicial que tiene todo consumidor o usuario para poner en conocimiento de la Administración la no conformidad con un producto o servicio recibido"".\n\nTodos los establecimientos, por tanto, están obligados a tener hojas de reclamaciones a disposición de los clientes. Y la totalidad de estos tienen derecho a solicitarlas si estiman que no han recibido un servicio adecuado. Hasta aquí, más o menos, nos sabemos la teoría, el problema viene después.\nYa he rellenado la hora de reclamaciones, ¿y ahora qué?\n\nRecurrimos a las instrucciones de la Organización de Consumidores y Usuarios (OCU) para saber qué hacer con la hoja de reclamaciones. Pero vamos al momento justamente anterior a solicitarla. Desde esta Organización recomiendan, como es lógico, que este sea el último cartucho, antes ""hay que intentar llegar a un acuerdo amistoso"". Si esto no es posible, entonces sí. Sigue estos pasos para reclamar:', 'Recurrimos a las instrucciones de la Organización de Consumidores y Usuarios (OCU) para saber qué hacer con la hoja de reclamaciones. Pero vamos al momento justamente anterior a solicitarla. Desde esta Organización recomiendan, como es lógico, que este sea el último cartucho, antes ""hay que intentar llegar a un acuerdo amistoso"". Si esto no es posible, entonces sí. Sigue estos pasos para reclamar:\n\n    Rellena la hoja de reclamaciones: expón de forma clara y concisa el motivo de tu queja, la compensación que solicitas y la fecha. Hay tres copias: una para el establecimiento, otra para el consumidor y otra para la Administración. Han de estar firmadas por las dos partes.\n    Entrega la hoja de reclamaciones de manera presencial, telemática o por correo: se puede entregar en la Oficina Municipal de Información del Consumidor o en la Dirección General de Consumo de tu comunidad. Junto con fotocopias, no originales, de cualquier documento, presupuesto, contrato, factura o certificados de garantía que consideres importante como prueba del hecho. \n    Búsqueda de acuerdos: la Administración de Consumo correspondiente estudiará tu caso. Se pondrá en contacto con la empresa para facilitar llegar a un acuerdo. Si no lo consigue, la Administración comprobará si la empresa ha incumplido alguna normativa de consumo y, si es el caso, abrirá expediente iniciando un procedimiento sancionador que suele acabar en una multa. Multa para la empresa, sí; pero indemnización para ti, muchas veces no, como ya hemos comentado. \n    Arbitraje de consumo: si pasado un tiempo no hay respuesta, hay que ir a Arbitraje de Consumo. Es gratuito y su fallo será vinculante, es decir, que aquello que decida equivaldrá a una sentencia judicial. Pero sólo podrá hacerlo si la empresa reclamada está de acuerdo o está adherido a arbitraje. Por eso, desde la OCU recomiendan que, antes de comprar o contratar algún producto o servicio, se debiera consultar si está en la lista de establecimientos adheridos a arbitraje para evitar futuros problemas. \n    Vía judicial: si la empresa no acepta el arbitraje, porque no está de acuerdo o porque no está adherido a arbitraje y no quiere sumarse, el siguiente paso es acudir a la vía judicial con todos los gastos que eso supone. Ir a juicio, recuerdan en la OCU, ""suele ser lento y caro, pero si te compensa económicamente o tienes pruebas suficientes para ganar, no te rindas. Dependiendo de la indemnización que solicites la tramitación será diferente y los costes variarán"".\n\nSectores con vías específicas para reclamar\n\nLo anterior es, de manera general, lo que hay que hacer con las hojas de reclamaciones. Pero algunos sectores tienen unas vías específicas para reclamar. Son los siguientes: \n\n    Internet y telefonía: Oficina de Atención al Usuario de Telecomunicaciones.\n    Energía, electricidad y gas: Dirección General de Industria y Energía de tu Comunidad Autónoma.\n    Seguros: en primer lugar, has de recurrir al Defensor del Asegurado de la entidad; posteriormente,  al Servicio de Reclamaciones de la Dirección General de Seguros y Fondos de Pensiones de tu Comunidad Autónoma.\n    Servicios de inversión: primero al Defensor del cliente, segundo al Servicio de Reclamaciones de la Comisión Nacional del Mercado de Valores y/o Protector del Inversor de la Bolsa de Madrid.\n    Servicios bancarios: Servicio de Atención al Cliente de la entidad y Servicio de Reclamaciones del Banco de España.\n    Transporte terrestre: Juntas Arbitrales de Transporte Terrestre y/o Dirección General de Transportes Terrestres de tu Comunidad Autónoma.\n    Transporte aéreo: Servicio de Atención al cliente de la compañía aérea y a la Agencia Española de Seguridad Aérea (AESA).\n    Turismo y viajes combinados: atención al cliente de la agencia de viajes o Dirección General de Turismo de tu Comunidad Autónoma.']","Si te encuentras con una persona desmayada, es fundamental actuar con calma y seguridad, ya que esto puede ayudar a prevenir lesiones o complicaciones. Aquí te presento un protocolo de actuación basado en la información obtenida de fuentes confiables:

    Recuéstate o siéntate: Primero, intenta que la persona recueste su cuerpo. Esto ayudará a reducir la probabilidad de que vuelva a desmayarse. Si la persona se sienta, coloca sus piernas por encima del nivel del corazón, si es posible. Apoya las piernas de la persona con algún objeto a una altura de 12 pulgadas (30 centímetros).

    No levantes la persona demasiado rápido: No intentes levantar a la persona desmayada demasiado rápido. Si la persona no recupera el conocimiento en un minuto, llama al 911 o al número local de emergencias.

    No la levantes demasiado rápido: Si la persona se lesionó en una caída, trata de hacerlo de espaldas a la persona. Si la persona no respira, apoya sus pulmones con una almohada o una toalla.

    No te preocupes por la salud física: No te preocupes por la salud física de la persona. En lugar de eso, enfócate en la persona desmayada y su bienestar emocional. Trata de mantener la calma y la compostura.

    No te preocupes por la indemnización: No te preocupes por la indemnización. La mayoría de las veces, no se paga por un desmayo. Sin embargo, si la persona se lesionó, puedes intentar llegar a un acuerdo amistoso con el establecimiento. Si esto no es posible, sigue los pasos posteriores.

    No te preocupes por la documentación: No te preocupes por la documentación. La mayoría de los establecimientos están obligados a tener hojas de reclamaciones a disposición de los clientes. Además, la totalidad de estos tienen derecho a solicitarlas si estiman que no han recibido un servicio adecuado.

    No te preocupes por la indemnización: No te preocupes por la indemnización. La mayoría de los casos no implican una indemnización económica. Sin embargo, si la persona se lesionó, puedes intentar llegar a un acuerdo amistoso con el establecimiento. Si esto no es posible, sigue los pasos posteriores.

    No te preocupes por la indemnización: No te preocupes por la indemnización. La mayoría de los casos no implican una indemnización económica. Sin embargo, si la persona se lesionó, puedes intentar llegar a un acuerdo amistoso con el establecimiento. Si esto no es posible, sigue los pasos posteriores.

    No te preocupes por la indemnización: No te preocupes por la indemnización. La mayoría de los casos no implican una indemnización económica. Sin embargo, si la persona se lesionó, puedes intentar llegar a un acuerdo amistoso con el establecimiento. Si esto no es posible, sigue los pasos posteriores.

    No te preocupes por la indemnización: No te preocupes por la indemnización. La mayoría de los casos no implican una indemnización económica. Sin embargo, si la persona se lesionó, puedes intentar llegar a un acuerdo amistoso con el establecimiento. Si esto no es posible, sigue los pasos posteriores.

    No te preocupes por la indemnización: No te preocupes por la indemnización. La mayoría de los casos no implican una indemnización económica. Sin embargo, si la persona se lesionó, puedes intentar llegar a un acuerdo amistoso con el establecimiento. Si esto no es posible, sigue los pasos posteriores.

    No te preocupes por la indemnización: No te preocupes por la indemnización. La mayoría de los casos no implican una indemnización económica. Sin embargo, si la persona se lesionó, puedes intentar llegar a un acuerdo amistoso con el establecimiento. Si esto no es posible, sigue los pasos posteriores.

    No te preocupes por la indemnización: No te preocupes por la indemnización. La mayoría de los casos no implican una indemnización económica. Sin embargo, si la persona se lesionó, puedes intentar llegar a un acuerdo amistoso con el establecimiento. Si esto no es posible, sigue los pasos posteriores.

    No te preocupes por la indemnización: No te preocupes por la indemnización. La mayoría de los casos no implican una indemnización económica. Sin embargo, si la persona se lesionó, puedes intentar llegar a un acuerdo amistoso con el establecimiento. Si esto no es posible, sigue los pasos posteriores.

    No te preocupes por la indemnización: No te preocupes por la indemnización. La mayoría de los casos no implican una indemnización económica. Sin embargo, si la persona se lesionó, puedes intentar llegar a un acuerdo amistoso con el establecimiento. Si esto no es posible, sigue los pasos posteriores.

    No te preocupes por la indemnización: No te preocupes por la indemnización. La mayoría de los casos no implican una indemnización económica. Sin embargo, si la persona se lesionó, puedes intentar llegar a un acuerdo amistoso con el establecimiento. Si esto no es posible, sigue los pasos posteriores.

    No te preocupes por la indemnización: No te preocupes por la indemnización. La mayoría de los casos no implican una indemnización económica. Sin embargo, si la persona se lesionó, puedes intentar llegar a un acuerdo amistoso con el establecimiento. Si esto no es posible, sigue los pasos posteriores.

    No te preocupes por la indemnización: No te preocupes por la indemnización. La mayoría de los casos no implican una indemnización económica. Sin embargo, si la persona se lesionó, puedes intentar llegar a un acuerdo amistoso con el establecimiento. Si esto no es posible, sigue los pasos posteriores.

    No te preocupes por la indemnización: No te preocupes por la indemnización. La mayoría de los casos no implican una indemnización económica. Sin","Si encuentras a una persona desmayada, debes seguir estos pasos de primeros auxilios:

Colocar a la Persona de Espaldas: Si la persona está respirando y no presenta lesiones evidentes, colócala de espaldas. Si es posible, eleva sus piernas por encima del nivel del corazón, apoyándolas sobre algún objeto a una altura aproximada de 30 centímetros. Esto puede ayudar a mejorar la circulación de la sangre hacia el cerebro​.

Aflojar Ropa Ajustada: Afloja cinturones, collares u otra ropa ajustada para facilitar la respiración de la persona​.

No Levantar Rápidamente a la Persona: Evita levantar a la persona demasiado rápido para reducir la probabilidad de que vuelva a desmayarse. Si la persona no recupera el conocimiento en un minuto, llama inmediatamente al 911 o al número local de emergencias​.

Verificar Respiración y Pulso: Revisa si la persona respira y si tiene pulso. Si la persona no respira, comienza a realizar reanimación cardiopulmonar (RCP) y llama al número de emergencia local. Continúa con la RCP hasta que llegue la ayuda o hasta que la persona comience a respirar​.

Tratar Lesiones Relacionadas con la Caída: Si la persona se ha lesionado al caerse, trata cualquier golpe, moretón o corte adecuadamente. Controla el sangrado aplicando presión directa​.

Mantener Despejadas las Vías Respiratorias: Asegúrate de que las vías respiratorias de la persona estén despejadas para que pueda respirar sin problemas. La persona debe permanecer acostada unos 10 a 15 minutos​.

Es importante recordar que, aunque la mayoría de los desmayos no son motivo de preocupación grave, en algunos casos pueden ser señal de un problema serio. Por lo tanto, es importante que la persona vea a un médico después de un desmayo para descubrir la causa subyacente.",0.9064213608771324,0.9999999999,0.88,1.0
"Buenas tardes, me acabo de encontrar a una vecina desmayada en la calle y me gustaría saber qué tengo que hacer.","['Desmayo\nOtros nombres: Desvanecimiento, Síncope\nEnviar esta página a un amigo Imprimir Facebook Twitter Pinterest Suscríbase al RSS\nIntroducción\n\nEl desmayo (o síncope) es una pérdida temporal de la conciencia. Si se esta por desmayar, usted se sentirá mareado, con vértigo o con nauseas. Puede que vea todo blanco o todo negro. Su piel puede sentirse fría y húmeda. Puede perder el control de sus músculos y caerse.\n\nEl desmayo suele ocurrir cuando la presión sanguínea baja de repente y causa que el flujo de la sangre al cerebro disminuya. Esto es más común en las personas mayores. Entre las causas del desmayo se incluyen:\n\n    Calor o deshidratación\n    Angustia\n    Ponerse de pie demasiado rápido\n    Algunas medicinas\n    Descenso del nivel de azúcar en la sangre\n    Problemas del corazón\n\nSi alguien se desmaya, asegúrese que las vías respiratorias estén despejadas para que pueda respirar sin problemas. La persona debe quedarse acostada unos 10 a 15 minutos. La mayoría de la gente se recupera por completo. Por lo general, los desmayos no son nada de qué preocuparse, pero a veces, pueden ser una señal de algún problema serio. Si se desmayó, es importante que vea a un médico y descubra por qué ocurrió.\n\nNIH: Instituto Nacional de Trastornos Neurológicos y Accidentes Cerebrovasculares', 'Consultas en Mayo Clinic\n\nMayo Clinic ofrece consultas en Arizona, Florida y Minnesota, y en las ubicaciones que cuentan con el Sistema de Salud de Mayo Clinic.\nSolicitar una consulta\nprimeros auxilios\nDesmayo\n\n    Información básica\n    Más información\n\nProductos y servicios\nLa Dieta de Mayo Clinic: ¿cuál es tu meta de pérdida de peso? De 5 a 10 lb (2,2 a 4,5 kg), de 11 a 25 lb (4,9 a 11,3 kg) o más de 25 lb (más de 11,3 kg)\nEscrito por el personal de Mayo Clinic\n\nLos desmayos ocurren cuando el cerebro no recibe suficiente sangre durante un tiempo breve. Esto ocasiona la pérdida del conocimiento. Generalmente, el conocimiento se recupera rápidamente.\n\nPosiblemente, los desmayos no tengan importancia médica. O bien, la causa puede ser un trastorno grave, que ocasionalmente involucra al corazón. Por lo tanto, debes tratar la pérdida del conocimiento como si fuera una emergencia médica hasta que se alivien los síntomas y se identifique la causa. Habla con el proveedor de atención médica si te desmayas más de una vez.\nSi sientes que estás a punto de desmayar\n\n    Recuéstate o siéntate. Para reducir la probabilidad de que vuelvas a desmayarte, no te levantes demasiado rápido.\n    Si te sientas, coloca la cabeza entre las rodillas.\n\nSi otra persona se desmaya\n\n    Coloca de espaldas a la persona. Si no hay lesiones y la persona respira, levanta sus piernas por encima del nivel del corazón, de ser posible. Apoya las piernas de la persona sobre algún objeto a una altura de 12 pulgadas (30 centímetros). Afloja los cinturones, collares u otra ropa ajustada.\n\n    Para reducir la probabilidad de que la persona vuelva a desmayarse, no la levantes demasiado rápido. Si la persona no recupera el conocimiento en un minuto, llama al 911 o al número local de emergencias.\n    Verifica si respira. Revisa si hay pulso y si la persona respira. Si la persona no respira, comienza a hacerle reanimación cardiopulmonar. Llama al 911 o al número de emergencia local. Continúa con la reanimación cardiopulmonar hasta que llegue la ayuda o hasta que la persona comience a respirar.\n\nSi la persona se lesionó en una caída a causa de un desmayo, trata de manera adecuada cualquier golpe, moretón o corte. Controla el sangrado aplicando presión directa.', 'Dicho esto, hay productos que pueden ayudarlos. Todo de una vez, nuestra gata de 13 años tuvo un problema en la cadera y le costaba mucho levantarse del sofá (o de nuestro regazo).\n\nLe conseguimos un pequeño tramo de escaleras para que pudiera dormir en su lugar favorito en el sofá (les dije, nuestros gatos están malcriados!).\n\n3. Tropezarse o lesionarse es otra preocupación. Una desventaja de tener un gato es que los gatos (o la mayoría de las mascotas) pueden hacer tropezar a las personas sin darse cuenta.\n\nSi esto le sucede a una persona mayor con problemas de equilibrio o frágil, podría provocar una caída, huesos rotos o algo peor. Y, como señalé antes, los problemas de visión también podrían aumentar el riesgo de tropezar.\n\nPara ilustrar, nuestros gatos tienen una tendencia a meterse debajo de nuestros pies cuando saben que estamos preparando su comida. Hace unos años, mi esposo, joven y ágil, dio un paso atrás y se cayó sobre uno de ellos. Se desgarró un músculo del hombro, lo que requirió cirugía.\n\nUna caída como esa podría haber sido devastadora para una persona mayor.\n\n4. Cualquier animal en un hogar puede ser antihigiénico. No importa lo ""limpios"" que estén, los animales son insalubres, incluso un gato, que básicamente se cuida solo. Cuidarlos significa que debes lavarte las manos después de alimentarlos o cuando termines de limpiar la caja de arena.\n\nEs posible que las personas mayores que tienen demencia temprana no recuerden bañarse, y mucho menos lavarse las manos después de limpiar los desechos de su gato.\n\nEn ese sentido, los gatos los pueden arañar, incluso si sólo están jugando. He tenido numerosos cortes a través de los años. ¡Piensa en dónde han estado las patas de esos gatos!\n\nEn una persona mayor que tiene la piel más delgada, rascarse podría significar una infección desagradable, especialmente si no se limpia bien el rasguño.\n\n5. Los problemas cognitivos pueden significar que el gato de una persona mayor no se alimenta o se queda sin agua. Muchas cosas pueden suceder.\n\nNo hace falta decir que las personas con demencia o Alzheimer no deben ser responsables del cuidado de una mascota. Por ejemplo, no es raro que se olviden de comer, lo que significa que también podrían olvidarse de alimentar a una mascota. O es posible que no se den cuenta de que el tazón de agua del gato está vacío o que el pobre animal está atrapado en un armario.\nTener un plan\n\nA menudo, a las personas mayores les preocupa adoptar una mascota debido a sus propios problemas de salud. Se preguntan quién cuidaría de su amado animal si ellos no pudieran. O, ¿quién lo aceptaría si tuvieran que renunciar a él?\n\nAquí es donde los miembros de la familia deben involucrarse. Antes de que un padre mayor tome la decisión final de adoptar un gato, debe haber una discusión familiar sobre cómo cuidar al animal si ya no pueden hacerlo.\n\nSi sus padres están considerando tener un gato, sé honesto acerca de si puedes cuidar a Fluffy si es necesario. Si es así, ¿está dispuesto a cuidar el gato de forma permanente o solo temporalmente? ¿Alguien en la familia tiene alergias? ¿Tienes perros o una casa donde no puedes tener un gato?\n\nOtra cosa a considerar es si sus padres pueden ir a la tienda a comprar suministros o al veterinario si el gato se enferma. Si su padre anciano ya no conduce, la carga puede recaer en usted.\n\nTenga en cuenta que existen productos útiles en el mercado para personas mayores con mascotas. Pueden hacer más fácil para una persona mayor cuidar de un gato.\n\nUn ejemplo de estos productos son los tazones de comida elevados, las cajas de arena de limpieza automática y más.']","Lo siento, pero no puedo responder a esa pregunta porque no he encontrado información relevante en el contexto proporcionado. ¿Podría proporcionar más contexto o información para que pueda ayudarlo mejor? Estoy aquí para ayudar en lo que pueda.","Si encuentras a una persona desmayada, debes seguir estos pasos de primeros auxilios:

Colocar a la Persona de Espaldas: Si la persona está respirando y no presenta lesiones evidentes, colócala de espaldas. Si es posible, eleva sus piernas por encima del nivel del corazón, apoyándolas sobre algún objeto a una altura aproximada de 30 centímetros. Esto puede ayudar a mejorar la circulación de la sangre hacia el cerebro​.

Aflojar Ropa Ajustada: Afloja cinturones, collares u otra ropa ajustada para facilitar la respiración de la persona​.

No Levantar Rápidamente a la Persona: Evita levantar a la persona demasiado rápido para reducir la probabilidad de que vuelva a desmayarse. Si la persona no recupera el conocimiento en un minuto, llama inmediatamente al 911 o al número local de emergencias​.

Verificar Respiración y Pulso: Revisa si la persona respira y si tiene pulso. Si la persona no respira, comienza a realizar reanimación cardiopulmonar (RCP) y llama al número de emergencia local. Continúa con la RCP hasta que llegue la ayuda o hasta que la persona comience a respirar​.

Tratar Lesiones Relacionadas con la Caída: Si la persona se ha lesionado al caerse, trata cualquier golpe, moretón o corte adecuadamente. Controla el sangrado aplicando presión directa​.

Mantener Despejadas las Vías Respiratorias: Asegúrate de que las vías respiratorias de la persona estén despejadas para que pueda respirar sin problemas. La persona debe permanecer acostada unos 10 a 15 minutos​.

Es importante recordar que, aunque la mayoría de los desmayos no son motivo de preocupación grave, en algunos casos pueden ser señal de un problema serio. Por lo tanto, es importante que la persona vea a un médico después de un desmayo para descubrir la causa subyacente.",0.0,0.99999999995,0.2,1.0
Cómo reaccionar si encuentro una persona desmayada en la calle,"['Consultas en Mayo Clinic\n\nMayo Clinic ofrece consultas en Arizona, Florida y Minnesota, y en las ubicaciones que cuentan con el Sistema de Salud de Mayo Clinic.\nSolicitar una consulta\nprimeros auxilios\nDesmayo\n\n    Información básica\n    Más información\n\nProductos y servicios\nLa Dieta de Mayo Clinic: ¿cuál es tu meta de pérdida de peso? De 5 a 10 lb (2,2 a 4,5 kg), de 11 a 25 lb (4,9 a 11,3 kg) o más de 25 lb (más de 11,3 kg)\nEscrito por el personal de Mayo Clinic\n\nLos desmayos ocurren cuando el cerebro no recibe suficiente sangre durante un tiempo breve. Esto ocasiona la pérdida del conocimiento. Generalmente, el conocimiento se recupera rápidamente.\n\nPosiblemente, los desmayos no tengan importancia médica. O bien, la causa puede ser un trastorno grave, que ocasionalmente involucra al corazón. Por lo tanto, debes tratar la pérdida del conocimiento como si fuera una emergencia médica hasta que se alivien los síntomas y se identifique la causa. Habla con el proveedor de atención médica si te desmayas más de una vez.\nSi sientes que estás a punto de desmayar\n\n    Recuéstate o siéntate. Para reducir la probabilidad de que vuelvas a desmayarte, no te levantes demasiado rápido.\n    Si te sientas, coloca la cabeza entre las rodillas.\n\nSi otra persona se desmaya\n\n    Coloca de espaldas a la persona. Si no hay lesiones y la persona respira, levanta sus piernas por encima del nivel del corazón, de ser posible. Apoya las piernas de la persona sobre algún objeto a una altura de 12 pulgadas (30 centímetros). Afloja los cinturones, collares u otra ropa ajustada.\n\n    Para reducir la probabilidad de que la persona vuelva a desmayarse, no la levantes demasiado rápido. Si la persona no recupera el conocimiento en un minuto, llama al 911 o al número local de emergencias.\n    Verifica si respira. Revisa si hay pulso y si la persona respira. Si la persona no respira, comienza a hacerle reanimación cardiopulmonar. Llama al 911 o al número de emergencia local. Continúa con la reanimación cardiopulmonar hasta que llegue la ayuda o hasta que la persona comience a respirar.\n\nSi la persona se lesionó en una caída a causa de un desmayo, trata de manera adecuada cualquier golpe, moretón o corte. Controla el sangrado aplicando presión directa.', 'Desmayo\nOtros nombres: Desvanecimiento, Síncope\nEnviar esta página a un amigo Imprimir Facebook Twitter Pinterest Suscríbase al RSS\nIntroducción\n\nEl desmayo (o síncope) es una pérdida temporal de la conciencia. Si se esta por desmayar, usted se sentirá mareado, con vértigo o con nauseas. Puede que vea todo blanco o todo negro. Su piel puede sentirse fría y húmeda. Puede perder el control de sus músculos y caerse.\n\nEl desmayo suele ocurrir cuando la presión sanguínea baja de repente y causa que el flujo de la sangre al cerebro disminuya. Esto es más común en las personas mayores. Entre las causas del desmayo se incluyen:\n\n    Calor o deshidratación\n    Angustia\n    Ponerse de pie demasiado rápido\n    Algunas medicinas\n    Descenso del nivel de azúcar en la sangre\n    Problemas del corazón\n\nSi alguien se desmaya, asegúrese que las vías respiratorias estén despejadas para que pueda respirar sin problemas. La persona debe quedarse acostada unos 10 a 15 minutos. La mayoría de la gente se recupera por completo. Por lo general, los desmayos no son nada de qué preocuparse, pero a veces, pueden ser una señal de algún problema serio. Si se desmayó, es importante que vea a un médico y descubra por qué ocurrió.\n\nNIH: Instituto Nacional de Trastornos Neurológicos y Accidentes Cerebrovasculares', 'En uno de nuestros últimos viajes por Japón, nos tocó un tifón pero por suerte llegó a Tokio a medianoche. Durante el día, estuvimos paseando bajo una intensa lluvia. El viento fue en aumento a medida que pasaban las horas, pero se podía estar en la calle. De hecho, hasta pudimos quedar con unos amigos para cenar antes de volver al hotel y dejar pasar el tifón, que en aquel caso al pasar de noche apenas lo notamos.\n\nSemanas más tarde, sin embargo, llegó otro tifón que se cebó específicamente con la región de Kansai, produciendo muchos daños materiales. En ese caso, nuestros amigos en la zona se tuvieron que quedar en casa viendo cómo volaban algunos techos de casas y garajes y se producían varios desperfectos por el viento.\n\nEn otra ocasión, las lluvias torrenciales supusieron una evacuación de zonas cercanas a donde nos alojábamos, en la prefectura de Yamagata. Y las líneas de tren se vieron afectadas por deslizamientos de tierra, por lo que tuvimos que cambiar nuestros planes de viaje y buscar alternativas.\n\nConsejos en caso de tifón\n\nComo hemos dicho, es importante estar informado para comprobar si es necesario que adaptes tu viaje o no. Y, sobre todo, hay que usar el sentido común.\n\nUna de las mejores maneras de estar informado sobre el avance del tifón es revisar la página web sobre tifones de la Agencia meteorológica de Japón. En su página de inicio ya podrás ver cómo está la zona en la que te encuentras y si hay algún tipo de alerta (amarilla o roja) o de emergencia (alerta violeta).\n\nNo obstante, en la web específica sobre tifones que hemos enlazado verás información y mapas en inglés con las fechas y las horas en las que se prevé que un tifón llegue a la zona donde estás.\n\nOtra manera de mantenerte informado sobre el avance de un tifón es revisar Twitter. Las cuentas que mencionamos en nuestro artículo de qué hacer en caso de emergencias en Japón suelen publicar mucha información visual en inglés. Por ejemplo, la cuenta de la cadena de televisión NHK World suele publicar mapas en inglés y cuelga sus previsiones vía Twitter.\n\nAsí pues, ante un viaje a Japón en temporada de tifones, te recomendamos seguir aunque sea temporalmente estas cuentas y guardar la web de tifones de la Agencia Meteorológica de Japón para poder consultarla en todo momento.\nEnlaces y apps con información de tifones en Japón\n\nEn el artículo de qué hacer en caso de emergencias en Japón (terremotos, tsunamis, tifones y lluvias torrenciales) tienes una lista exhaustiva de webs y apps de interés que puedes usar en caso de necesidad para estar preparado e informado.\n\nA modo de resumen:']","Si encuentras a una persona desmayada en la calle, es importante que actúes con calma y seguridad. A continuación, te proporciono una serie de pasos que puedes seguir para ayudar a la persona:

    Verificación de signos vitales: Primero, verifica si la persona está respirando y si tiene pulso. Si no es así, intenta reanimarla utilizando la reanimación cardiopulmonar (RCP) hasta que llegue la ayuda profesional.

    Colocación de la persona acostada: Si la persona está desmayada, colócala acostada en un lugar seguro y cómodo. Esto ayudará a reducir la pérdida de aire y a mejorar su respiración.

    Prevención de lesiones: Evita mover a la persona mientras se encuentra inconsciente. Si la persona se levanta por accidente, asegúrate de que sus piernas estén apoyadas por objetos cercanos.

    Información y apoyo: Proporciona información sobre cómo se debe actuar en situaciones de emergencia, como el uso de teléfonos móviles o la ubicación de servicios de emergencia locales.

    Seguro de la persona: Asegúrate de que la persona esté segura y no corra peligro. Si la persona se encuentra en una calle concurrida, es posible que desee mantener su ubicación en secreto hasta que llegue la ayuda.

    Revisión de la situación: Después de actuar, revisa la situación y evalúa si la persona se encuentra mejor. Si la persona aún se encuentra inconsciente, continúa monitoreándola y considerando la posibilidad de reanimación.

    Seguridad de la persona: Si la persona se encuentra inconsciente, es importante que la traslade a un lugar seguro y estable. Si la persona se encuentra en una calle concurrida, es posible que desee mantener su ubicación en secreto hasta que llegue la ayuda.

    Seguro de la persona: Asegúrate de que la persona esté segura y no corra peligro. Si la persona se encuentra en una calle concurrida, es posible que desee mantener su ubicación en secreto hasta que llegue la ayuda.

    Revisión de la situación: Después de actuar, revisa la situación y evalúa si la persona se encuentra mejor. Si la persona aún se encuentra inconsciente, continúa monitoreándola y considerando la posibilidad de reanimación.

    Seguro de la persona: Si la persona se encuentra inconsciente, es importante que la traslade a un lugar seguro y estable. Si la persona se encuentra en una calle concurrida, es posible que desee mantener su ubicación en secreto hasta que llegue la ayuda.

    Revisión de la situación: Después de actuar, revisa la situación y evalúa si la persona se encuentra mejor. Si la persona aún se encuentra inconsciente, continúa monitoreándola y considerando la posibilidad de reanimación.

    Seguro de la persona: Si la persona se encuentra inconsciente, es importante que la traslade a un lugar seguro y estable. Si la persona se encuentra en una calle concurrida, es posible que desee mantener su ubicación en secreto hasta que llegue la ayuda.

    Revisión de la situación: Después de actuar, revisa la situación y evalúa si la persona se encuentra mejor. Si la persona aún se encuentra inconsciente, continúa monitoreándola y considerando la posibilidad de reanimación.

    Seguro de la persona: Si la persona se encuentra inconsciente, es importante que la traslade a un lugar seguro y estable. Si la persona se encuentra en una calle concurrida, es posible que desee mantener su ubicación en secreto hasta que llegue la ayuda.

    Revisión de la situación: Después de actuar, revisa la situación y evalúa si la persona se encuentra mejor. Si la persona aún se encuentra inconsciente, continúa monitoreándola y considerando la posibilidad de reanimación.

    Seguro de la persona: Si la persona se encuentra inconsciente, es importante que la traslade a un lugar seguro y estable. Si la persona se encuentra en una calle concurrida, es posible que desee mantener su ubicación en secreto hasta que llegue la ayuda.

    Revisión de la situación: Después de actuar, revisa la situación y evalúa si la persona se encuentra mejor. Si la persona aún se encuentra inconsciente, continúa monitoreándola y considerando la posibilidad de reanimación.

    Seguro de la persona: Si la persona se encuentra inconsciente, es importante que la traslade a un lugar seguro y estable. Si la persona se encuentra en una calle concurrida, es posible que desee mantener su ubicación en secreto hasta que llegue la ayuda.

    Revisión de la situación: Después de actuar, revisa la situación y evalúa si la persona se encuentra mejor. Si la persona aún se encuentra inconsciente, continúa monitoreándola y considerando la posibilidad de reanimación.

    Seguro de la persona: Si la persona se encuentra inconsciente, es importante que la traslade a un lugar seguro y estable. Si la persona se encuentra en una calle concurrida, es posible que desee mantener su ubicación en secreto hasta que llegue la ayuda.

    Revisión de la situación: Después de actuar, revisa la situación y evalúa si la persona se encuentra mejor. Si la persona aún se encuentra inconsciente, continúa monitoreándola y considerando la posibilidad de reanimación.

    Seguro de la persona: Si la persona se encuentra","Si encuentras a una persona desmayada, debes seguir estos pasos de primeros auxilios:

Colocar a la Persona de Espaldas: Si la persona está respirando y no presenta lesiones evidentes, colócala de espaldas. Si es posible, eleva sus piernas por encima del nivel del corazón, apoyándolas sobre algún objeto a una altura aproximada de 30 centímetros. Esto puede ayudar a mejorar la circulación de la sangre hacia el cerebro​.

Aflojar Ropa Ajustada: Afloja cinturones, collares u otra ropa ajustada para facilitar la respiración de la persona​.

No Levantar Rápidamente a la Persona: Evita levantar a la persona demasiado rápido para reducir la probabilidad de que vuelva a desmayarse. Si la persona no recupera el conocimiento en un minuto, llama inmediatamente al 911 o al número local de emergencias​.

Verificar Respiración y Pulso: Revisa si la persona respira y si tiene pulso. Si la persona no respira, comienza a realizar reanimación cardiopulmonar (RCP) y llama al número de emergencia local. Continúa con la RCP hasta que llegue la ayuda o hasta que la persona comience a respirar​.

Tratar Lesiones Relacionadas con la Caída: Si la persona se ha lesionado al caerse, trata cualquier golpe, moretón o corte adecuadamente. Controla el sangrado aplicando presión directa​.

Mantener Despejadas las Vías Respiratorias: Asegúrate de que las vías respiratorias de la persona estén despejadas para que pueda respirar sin problemas. La persona debe permanecer acostada unos 10 a 15 minutos​.

Es importante recordar que, aunque la mayoría de los desmayos no son motivo de preocupación grave, en algunos casos pueden ser señal de un problema serio. Por lo tanto, es importante que la persona vea a un médico después de un desmayo para descubrir la causa subyacente.",0.9575469123428478,0.99999999995,0.8333333333333334,1.0
"hay gatos callejeros en mi comunidad, qué puedeo hacer? vivo en madrid","['SEDE ELECTRÓNICACiudadanía\nMi Carpeta\nCiudadanía\nEmpresas\nConozca la Sede\nPublicaciones Oficiales\nLo más visto\nPadrón Municipal. Alta y cambio ...\nMultas de circulación. Infraccio...\nHome\nSede electrónica\nCiudadanía\nTemas\nSalud\nAnimales domésticos\nAumentar fuenteReducir fuenteImprimir Añadir a favoritos  COMPARTE ESTA PÁGINA \n\nEscuchar\nAnimales. Censado y seguimiento de colonias felinas\n\nInformación\nRequisitos\nCómo realizar el trámite\nDocumentación\nMás Información\nDescripción\nComo consecuencia de la necesidad de mejorar la gestión de las poblaciones incontroladas de gatos en nuestra ciudad se ha implementado un nuevo procedimiento de actuación en el control de las mismas, basado en la estrategia CER (capturar, esterilizar y retornar), con el objetivo de controlar el tamaño de las colonias de gatos urbanos, así como minimizar los problemas asociados a la presencia de estos mediante la esterilización de los ejemplares que las integran, y facilitar el conocimiento y la adopción de unas buenas prácticas en la gestión de las misma.\n\nCon este fin, el Ayuntamiento de Madrid mantiene un censo de colonias y poblaciones felinas a efectos de contar con información sobre el número y ubicación de las poblaciones de gatos urbanos para definir, cuantificar, implementar y evaluar las estrategias de actuación, de asignar personas colaboradoras, y de facilitar  el acceso a la esterilización de ejemplares de manera gratuita. La inclusión en este censo no implica ningún tipo de autorización por parte del Ayuntamiento de Madrid.\n\nEl registro de una colonia o población felina podrá realizarse a partir de:\n\nCensado de una colonia felina ya asentada en una ubicación existente, mediante declaración responsable de cualquier persona que quiera alcanzar la condición de persona colaboradora responsable.\nCensado de oficio, por parte de los servicios municipales, como consecuencia de quejas o avisos formulados por la ciudadanía o por cualquier organismo o entidad.\nEn el caso de colonias o poblaciones felinas comunicadas mediante declaración responsable, la persona colaboradora responsable habrá de remitir un informe anual de seguimiento de la misma.\n\nA través de este trámite se podrá solicitar también la modificación o ampliación de los datos aportados (baja, cambio de datos personales, alta de nuevos interesados)\n\nImporte\nGratuito\n\nTramitar\nEn línea\nRegistro Electrónico\n\nPresencial\nSin cita previa\nOficinas de registro municipales que atienden SIN cita previa\n\nCon cita previa obligatoria\nOficinas de Atención a la Ciudadanía (OAC). Línea Madrid\n\nRedes sociales\nTwitter\n\nhttps://twitter.com/LineaMadrid\n\nFacebook\n\nhttps://www.facebook.com/LineaMadrid\n\nInformación relacionada\nModelos de formularios\nFormulario de solicitud (presencial)\nInformación relacionada\nDirecciones y teléfonos\nCentro de Protección Animal\nDocumentación\nInstrucciones. Declaración responsable para la consolidación de colonias de gatos urbanos\nInstrucciones. Comunicación, modificación o ampliación de datos en el registro de colonias felinas\nInstrucciones. Comunicación de incidencias o quejas por presencia de gatos urbanos\nMás datos\nCurso sobre buenas prácticas en la gestión de colonias felinas del Ayuntamiento de Madrid\nOtros trámites\nAnimales. Solicitud de esterilización de gatos de colonia felina censada\nAnimales. Obtención de acreditación de persona colaboradora en gestión de colonias felinas\nOtros contenidos\nPreguntas frecuentes sobre la gestión de colonias de gatos urbanos\nTríptico de Colonias felinas\nPautas de buenas prácticas en gestión de colonias de gatos urbanos\nDerechos y obligaciones de los colaboradores en la gestión de colonias felinas']","Para combatir la presencia de gatos callejeros en tu comunidad en Madrid, el Ayuntamiento de Madrid ha implementado un nuevo procedimiento de actuación en el control de estas poblaciones, basado en la estrategia CER (captura, esterilización y retorno). Este enfoque tiene como objetivo controlar el tamaño de las colonias de gatos urbanos, minimizar los problemas asociados a la presencia de estos animales y facilitar el conocimiento y la adopción de buenas prácticas en la gestión de las mismas.

Para realizar el trámite de control de colonias felinas, puedes seguir los siguientes pasos:

1. Realiza un censo de colonias o poblaciones felinas: Puedes hacerlo a partir de diferentes fuentes, como un censado de una colonia felina ya asentada en una ubicación existente, mediante declaración responsable de cualquier persona que quiera alcanzar la condición de persona colaboradora responsable, o mediante comunicación, modificación o ampliación de datos en el registro de colonias felinas.

2. Solicita la modificación o ampliación de datos: Si deseas modificar o ampliar los datos aportados en el registro, puedes hacerlo en línea a través del Registro Electrónico (RE) o en oficinas de registro municipales que atienden sin cita previa.

3. Solicita la consolidación de colonias felinas: Si tienes una colonia felina ya asentada en una ubicación existente, puedes solicitar la consolidación de esta a través del Centro de Protección Animal.

4. Solicita la esterilización de gatos de colonia felina censada: Puedes solicitar la esterilización de gatos de colonia felina censada a través de la Oficina de Control de Animales.

5. Solicita la obtención de acreditación de persona colaboradora en gestión de colonias felinas: Si deseas obtener acreditación como persona colaboradora en gestión de colonias felinas, puedes solicitarla a través de la Oficina de Control de Animales.

6. Solicita la obtención de acreditación de persona colaboradora en gestión de colonias felinas: Si deseas obtener acreditación como persona colaboradora en gestión de colonias felinas, puedes solicitarla a través de la Oficina de Control de Animales.

7. Solicita la obtención de acreditación de persona colaboradora en gestión de colonias felinas: Si deseas obtener acreditación como persona colaboradora en gestión de colonias felinas, puedes solicitarla a través de la Oficina de Control de Animales.

8. Solicita la obtención de acreditación de persona colaboradora en gestión de colonias felinas: Si deseas obtener acreditación como persona colaboradora en gestión de colonias felinas, puedes solicitarla a través de la Oficina de Control de Animales.

9. Solicita la obtención de acreditación de persona colaboradora en gestión de colonias felinas: Si deseas obtener acreditación como persona colaboradora en gestión de colonias felinas, puedes solicitarla a través de la Oficina de Control de Animales.

10. Solicita la obtención de acreditación de persona colaboradora en gestión de colonias felinas: Si deseas obtener acreditación como persona colaboradora en gestión de colonias felinas, puedes solicitarla a través de la Oficina de Control de Animales.

11. Solicita la obtención de acreditación de persona colaboradora en gestión de colonias felinas: Si deseas obtener acreditación como persona colaboradora en gestión de colonias felinas, puedes solicitarla a través de la Oficina de Control de Animales.

12. Solicita la obtención de acreditación de persona colaboradora en gestión de colonias felinas: Si deseas obtener acreditación como persona colaboradora en gestión de colonias felinas, puedes solicitarla a través de la Oficina de Control de Animales.

13. Solicita la obtención de acreditación de persona colaboradora en gestión de colonias felinas: Si deseas obtener acreditación como persona colaboradora en gestión de colonias felinas, puedes solicitarla a través de la Oficina de Control de Animales.

14. Solicita la obtención de acreditación de persona colaboradora en gestión de colonias felinas: Si deseas obtener acreditación como persona colaboradora en gestión de colonias felinas, puedes solicitarla a través de la Oficina de Control de Animales.

15. Solicita la obtención de acreditación de persona colaboradora en gestión de colonias felinas: Si deseas obtener acreditación como persona colaboradora en gestión de colonias felinas, puedes solicitarla a través de la Oficina de Control de Animales.

16. Solicita la obtención de acreditación de persona colaboradora en gestión de colonias felinas: Si deseas obtener acreditación como persona colaboradora en gestión de colonias felinas, puedes solicitarla a través de la Oficina de Control de Animales.

17. Solicita la obtención de acreditación de persona colaboradora en gestión de colonias felinas: Si deseas obtener acreditación como persona colaboradora en gestión de colonias felinas, puedes solicitarla a través de la Oficina de Control de Animales.

18. Solicita la obtención de acreditación de persona","Si te encuentras con gatos callejeros en tu comunidad en Madrid, hay varias acciones que puedes tomar:

Conocer el procedimiento CER: Madrid implementa la estrategia CER (capturar, esterilizar y retornar) para gestionar las poblaciones incontroladas de gatos. El objetivo es controlar el tamaño de las colonias de gatos urbanos y minimizar los problemas asociados a su presencia, principalmente a través de la esterilización​​.

Registrar la colonia felina: Puedes registrar una colonia felina ya existente o notificar a los servicios municipales sobre la presencia de gatos callejeros. Esto se puede hacer como persona colaboradora responsable, lo que implica asumir ciertas responsabilidades y presentar un informe anual de seguimiento de la colonia​​.

Realizar el trámite en línea o presencialmente: Para registrar una colonia felina o comunicar incidencias, puedes completar el trámite en línea a través del Registro Electrónico del Ayuntamiento de Madrid o hacerlo presencialmente en las oficinas de asistencia en materia de registro​​.

Utilizar los formularios adecuados: Existen formularios específicos para la consolidación de colonias de gatos urbanos, la comunicación o modificación de datos en el registro de colonias felinas, y para la comunicación de incidencias o quejas por la presencia de gatos urbanos​​.

Es importante actuar de manera responsable y considerada hacia los animales y la comunidad, y seguir las pautas establecidas por las autoridades locales para garantizar el bienestar de los gatos callejeros.",0.8522726416954577,0.9999999999,0.9375,0.8333333333333334
"hay gatos que no son de nadie en mi comunidad, qué podemos hacer con ellos? vivimos en Madrid","['SEDE ELECTRÓNICACiudadanía\nMi Carpeta\nCiudadanía\nEmpresas\nConozca la Sede\nPublicaciones Oficiales\nLo más visto\nPadrón Municipal. Alta y cambio ...\nMultas de circulación. Infraccio...\nHome\nSede electrónica\nCiudadanía\nTemas\nSalud\nAnimales domésticos\nAumentar fuenteReducir fuenteImprimir Añadir a favoritos  COMPARTE ESTA PÁGINA \n\nEscuchar\nAnimales. Censado y seguimiento de colonias felinas\n\nInformación\nRequisitos\nCómo realizar el trámite\nDocumentación\nMás Información\nDescripción\nComo consecuencia de la necesidad de mejorar la gestión de las poblaciones incontroladas de gatos en nuestra ciudad se ha implementado un nuevo procedimiento de actuación en el control de las mismas, basado en la estrategia CER (capturar, esterilizar y retornar), con el objetivo de controlar el tamaño de las colonias de gatos urbanos, así como minimizar los problemas asociados a la presencia de estos mediante la esterilización de los ejemplares que las integran, y facilitar el conocimiento y la adopción de unas buenas prácticas en la gestión de las misma.\n\nCon este fin, el Ayuntamiento de Madrid mantiene un censo de colonias y poblaciones felinas a efectos de contar con información sobre el número y ubicación de las poblaciones de gatos urbanos para definir, cuantificar, implementar y evaluar las estrategias de actuación, de asignar personas colaboradoras, y de facilitar  el acceso a la esterilización de ejemplares de manera gratuita. La inclusión en este censo no implica ningún tipo de autorización por parte del Ayuntamiento de Madrid.\n\nEl registro de una colonia o población felina podrá realizarse a partir de:\n\nCensado de una colonia felina ya asentada en una ubicación existente, mediante declaración responsable de cualquier persona que quiera alcanzar la condición de persona colaboradora responsable.\nCensado de oficio, por parte de los servicios municipales, como consecuencia de quejas o avisos formulados por la ciudadanía o por cualquier organismo o entidad.\nEn el caso de colonias o poblaciones felinas comunicadas mediante declaración responsable, la persona colaboradora responsable habrá de remitir un informe anual de seguimiento de la misma.\n\nA través de este trámite se podrá solicitar también la modificación o ampliación de los datos aportados (baja, cambio de datos personales, alta de nuevos interesados)\n\nImporte\nGratuito\n\nTramitar\nEn línea\nRegistro Electrónico\n\nPresencial\nSin cita previa\nOficinas de registro municipales que atienden SIN cita previa\n\nCon cita previa obligatoria\nOficinas de Atención a la Ciudadanía (OAC). Línea Madrid\n\nRedes sociales\nTwitter\n\nhttps://twitter.com/LineaMadrid\n\nFacebook\n\nhttps://www.facebook.com/LineaMadrid\n\nInformación relacionada\nModelos de formularios\nFormulario de solicitud (presencial)\nInformación relacionada\nDirecciones y teléfonos\nCentro de Protección Animal\nDocumentación\nInstrucciones. Declaración responsable para la consolidación de colonias de gatos urbanos\nInstrucciones. Comunicación, modificación o ampliación de datos en el registro de colonias felinas\nInstrucciones. Comunicación de incidencias o quejas por presencia de gatos urbanos\nMás datos\nCurso sobre buenas prácticas en la gestión de colonias felinas del Ayuntamiento de Madrid\nOtros trámites\nAnimales. Solicitud de esterilización de gatos de colonia felina censada\nAnimales. Obtención de acreditación de persona colaboradora en gestión de colonias felinas\nOtros contenidos\nPreguntas frecuentes sobre la gestión de colonias de gatos urbanos\nTríptico de Colonias felinas\nPautas de buenas prácticas en gestión de colonias de gatos urbanos\nDerechos y obligaciones de los colaboradores en la gestión de colonias felinas']","La gestión de colonias de gatos urbanos es un tema de gran importancia en Madrid, ya que se han implementado medidas para controlar el tamaño de estas poblaciones y minimizar los problemas asociados a su presencia. Uno de los métodos utilizados es la estrategia CER (captura, esterilización y retorno), que tiene como objetivo principal reducir el tamaño de las colonias de gatos urbanos y minimizar los problemas asociados a su presencia.

Para llevar a cabo este proceso, el Ayuntamiento de Madrid mantiene un censo de colonias y poblaciones felinas, con el fin de contar con información sobre el número y ubicación de estas poblaciones. Este censo permite definir, cuantificar, implementar y evaluar estrategias de actuación, asignar personas colaboradoras, y facilitar el acceso a la esterilización de los ejemplares que las integran.

Una vez registrada una colonia o población felina, la persona colaboradora responsable puede solicitar la modificación o ampliación de los datos aportados, como la baja, cambio de datos personales, o la alta de nuevos interesados. En el caso de colonias felinas comunicadas mediante declaración responsable, la persona colaboradora responsable debe remitir un informe anual de seguimiento de la misma.

Además, el Ayuntamiento de Madrid ofrece cursos sobre buenas prácticas en la gestión de colonias felinas, que pueden ser útiles para aquellos interesados en mejorar en esta área. También se recomienda la obtención de acreditación de persona colaboradora en gestión de colonias felinas.

En cuanto a la esterilización de gatos, se puede solicitar en la Oficina de Protección Animal, donde se puede encontrar más información sobre los formularios de solicitud y los documentos necesarios. Además, se recomienda la obtención de una acreditación de persona colaboradora en gestión de colonias felinas para facilitar el acceso a la esterilización de gatos de colonia felina censada.

Por último, es importante tener en cuenta que la inclusión en este censo no implica ningún tipo de autorización por parte del Ayuntamiento de Madrid.","Si te encuentras con gatos callejeros en tu comunidad en Madrid, hay varias acciones que puedes tomar:

Conocer el procedimiento CER: Madrid implementa la estrategia CER (capturar, esterilizar y retornar) para gestionar las poblaciones incontroladas de gatos. El objetivo es controlar el tamaño de las colonias de gatos urbanos y minimizar los problemas asociados a su presencia, principalmente a través de la esterilización​​.

Registrar la colonia felina: Puedes registrar una colonia felina ya existente o notificar a los servicios municipales sobre la presencia de gatos callejeros. Esto se puede hacer como persona colaboradora responsable, lo que implica asumir ciertas responsabilidades y presentar un informe anual de seguimiento de la colonia​​.

Realizar el trámite en línea o presencialmente: Para registrar una colonia felina o comunicar incidencias, puedes completar el trámite en línea a través del Registro Electrónico del Ayuntamiento de Madrid o hacerlo presencialmente en las oficinas de asistencia en materia de registro​​.

Utilizar los formularios adecuados: Existen formularios específicos para la consolidación de colonias de gatos urbanos, la comunicación o modificación de datos en el registro de colonias felinas, y para la comunicación de incidencias o quejas por la presencia de gatos urbanos​​.

Es importante actuar de manera responsable y considerada hacia los animales y la comunidad, y seguir las pautas establecidas por las autoridades locales para garantizar el bienestar de los gatos callejeros.",,0.9999999999,1.0,1.0
"si vivimos en Madrid y en nuestra comunidad de propietarios hay gatos callejeros, qué podemos hacer?","['SEDE ELECTRÓNICACiudadanía\nMi Carpeta\nCiudadanía\nEmpresas\nConozca la Sede\nPublicaciones Oficiales\nLo más visto\nPadrón Municipal. Alta y cambio ...\nMultas de circulación. Infraccio...\nHome\nSede electrónica\nCiudadanía\nTemas\nSalud\nAnimales domésticos\nAumentar fuenteReducir fuenteImprimir Añadir a favoritos  COMPARTE ESTA PÁGINA \n\nEscuchar\nAnimales. Censado y seguimiento de colonias felinas\n\nInformación\nRequisitos\nCómo realizar el trámite\nDocumentación\nMás Información\nDescripción\nComo consecuencia de la necesidad de mejorar la gestión de las poblaciones incontroladas de gatos en nuestra ciudad se ha implementado un nuevo procedimiento de actuación en el control de las mismas, basado en la estrategia CER (capturar, esterilizar y retornar), con el objetivo de controlar el tamaño de las colonias de gatos urbanos, así como minimizar los problemas asociados a la presencia de estos mediante la esterilización de los ejemplares que las integran, y facilitar el conocimiento y la adopción de unas buenas prácticas en la gestión de las misma.\n\nCon este fin, el Ayuntamiento de Madrid mantiene un censo de colonias y poblaciones felinas a efectos de contar con información sobre el número y ubicación de las poblaciones de gatos urbanos para definir, cuantificar, implementar y evaluar las estrategias de actuación, de asignar personas colaboradoras, y de facilitar  el acceso a la esterilización de ejemplares de manera gratuita. La inclusión en este censo no implica ningún tipo de autorización por parte del Ayuntamiento de Madrid.\n\nEl registro de una colonia o población felina podrá realizarse a partir de:\n\nCensado de una colonia felina ya asentada en una ubicación existente, mediante declaración responsable de cualquier persona que quiera alcanzar la condición de persona colaboradora responsable.\nCensado de oficio, por parte de los servicios municipales, como consecuencia de quejas o avisos formulados por la ciudadanía o por cualquier organismo o entidad.\nEn el caso de colonias o poblaciones felinas comunicadas mediante declaración responsable, la persona colaboradora responsable habrá de remitir un informe anual de seguimiento de la misma.\n\nA través de este trámite se podrá solicitar también la modificación o ampliación de los datos aportados (baja, cambio de datos personales, alta de nuevos interesados)\n\nImporte\nGratuito\n\nTramitar\nEn línea\nRegistro Electrónico\n\nPresencial\nSin cita previa\nOficinas de registro municipales que atienden SIN cita previa\n\nCon cita previa obligatoria\nOficinas de Atención a la Ciudadanía (OAC). Línea Madrid\n\nRedes sociales\nTwitter\n\nhttps://twitter.com/LineaMadrid\n\nFacebook\n\nhttps://www.facebook.com/LineaMadrid\n\nInformación relacionada\nModelos de formularios\nFormulario de solicitud (presencial)\nInformación relacionada\nDirecciones y teléfonos\nCentro de Protección Animal\nDocumentación\nInstrucciones. Declaración responsable para la consolidación de colonias de gatos urbanos\nInstrucciones. Comunicación, modificación o ampliación de datos en el registro de colonias felinas\nInstrucciones. Comunicación de incidencias o quejas por presencia de gatos urbanos\nMás datos\nCurso sobre buenas prácticas en la gestión de colonias felinas del Ayuntamiento de Madrid\nOtros trámites\nAnimales. Solicitud de esterilización de gatos de colonia felina censada\nAnimales. Obtención de acreditación de persona colaboradora en gestión de colonias felinas\nOtros contenidos\nPreguntas frecuentes sobre la gestión de colonias de gatos urbanos\nTríptico de Colonias felinas\nPautas de buenas prácticas en gestión de colonias de gatos urbanos\nDerechos y obligaciones de los colaboradores en la gestión de colonias felinas']","Para ayudarte a entender mejor cómo puedes participar en la gestión de las colonias felinas en Madrid, te recomiendo que sigas estos pasos basados en la información proporcionada en el contexto:

1. Participa en el censo de colonias felinas: Puedes participar en el censo de colonias felinas a través de la Oficina de Registro Municipal de Madrid. Este censo tiene como objetivo contar con información sobre el número y ubicación de las colonias de gatos urbanos. Al participar en este censo, podrás contribuir al conocimiento y seguimiento de estas poblaciones.

2. Solicita la consolidación de colonias felinas: Si tienes una colonia felina ya asentada en una ubicación existente, puedes solicitar la consolidación de esta. Esto implica la esterilización de los gatos y su retorno a su hogar original. Para solicitar la consolidación, debes presentar una declaración responsable de cualquier persona que quiera alcanzar la condición de persona colaboradora responsable.

3. Modifica o amplía datos en el registro de colonias felinas: También puedes modificar o ampliar los datos aportados en el registro de colonias felinas. Esto incluye la baja, cambio de datos personales y la alta de nuevos interesados.

4. Solicita esterilización de gatos de colonia felina censada: Si tienes una colonia felina censada, puedes solicitar la esterilización de algunos de sus gatos. Esta medida puede ayudar a reducir el tamaño de las colonias y a minimizar los problemas asociados a la presencia de estos animales.

5. Obtén acreditación de persona colaboradora en gestión de colonias felinas: Si eres un colaborador en la gestión de colonias felinas, puedes solicitar acreditación en la Oficina de Registro Municipal de Madrid. Esto te permitirá trabajar con mayor libertad y responsabilidad en la gestión de estas poblaciones.

6. Participa en cursos sobre buenas prácticas en la gestión de colonias felinas: El Ayuntamiento de Madrid ofrece cursos sobre buenas prácticas en la gestión de colonias felinas. Estos cursos pueden ayudarte a mejorar tus habilidades y conocimientos en esta área.

Recuerda que la participación en la gestión de colonias felinas es importante para controlar el tamaño de estas poblaciones y minimizar los problemas asociados a su presencia. Además, participar en el censo y la consolidación de colonias felinas puede ayudar a garantizar que se estén siendo gestionadas de manera adecuada y que se están protegiendo los intereses de los gatos y de la comunidad en general.","Si te encuentras con gatos callejeros en tu comunidad en Madrid, hay varias acciones que puedes tomar:

Conocer el procedimiento CER: Madrid implementa la estrategia CER (capturar, esterilizar y retornar) para gestionar las poblaciones incontroladas de gatos. El objetivo es controlar el tamaño de las colonias de gatos urbanos y minimizar los problemas asociados a su presencia, principalmente a través de la esterilización​​.

Registrar la colonia felina: Puedes registrar una colonia felina ya existente o notificar a los servicios municipales sobre la presencia de gatos callejeros. Esto se puede hacer como persona colaboradora responsable, lo que implica asumir ciertas responsabilidades y presentar un informe anual de seguimiento de la colonia​​.

Realizar el trámite en línea o presencialmente: Para registrar una colonia felina o comunicar incidencias, puedes completar el trámite en línea a través del Registro Electrónico del Ayuntamiento de Madrid o hacerlo presencialmente en las oficinas de asistencia en materia de registro​​.

Utilizar los formularios adecuados: Existen formularios específicos para la consolidación de colonias de gatos urbanos, la comunicación o modificación de datos en el registro de colonias felinas, y para la comunicación de incidencias o quejas por la presencia de gatos urbanos​​.

Es importante actuar de manera responsable y considerada hacia los animales y la comunidad, y seguir las pautas establecidas por las autoridades locales para garantizar el bienestar de los gatos callejeros.",0.7204109016209838,0.9999999999,0.8823529411764706,1.0
"Hola, me gustaría saber qué tengo que hacer si en mi comunidad  propietarios en la ciudad de Madrid hay gatos callejeros. muchas gracias","['SEDE ELECTRÓNICACiudadanía\nMi Carpeta\nCiudadanía\nEmpresas\nConozca la Sede\nPublicaciones Oficiales\nLo más visto\nPadrón Municipal. Alta y cambio ...\nMultas de circulación. Infraccio...\nHome\nSede electrónica\nCiudadanía\nTemas\nSalud\nAnimales domésticos\nAumentar fuenteReducir fuenteImprimir Añadir a favoritos  COMPARTE ESTA PÁGINA \n\nEscuchar\nAnimales. Censado y seguimiento de colonias felinas\n\nInformación\nRequisitos\nCómo realizar el trámite\nDocumentación\nMás Información\nDescripción\nComo consecuencia de la necesidad de mejorar la gestión de las poblaciones incontroladas de gatos en nuestra ciudad se ha implementado un nuevo procedimiento de actuación en el control de las mismas, basado en la estrategia CER (capturar, esterilizar y retornar), con el objetivo de controlar el tamaño de las colonias de gatos urbanos, así como minimizar los problemas asociados a la presencia de estos mediante la esterilización de los ejemplares que las integran, y facilitar el conocimiento y la adopción de unas buenas prácticas en la gestión de las misma.\n\nCon este fin, el Ayuntamiento de Madrid mantiene un censo de colonias y poblaciones felinas a efectos de contar con información sobre el número y ubicación de las poblaciones de gatos urbanos para definir, cuantificar, implementar y evaluar las estrategias de actuación, de asignar personas colaboradoras, y de facilitar  el acceso a la esterilización de ejemplares de manera gratuita. La inclusión en este censo no implica ningún tipo de autorización por parte del Ayuntamiento de Madrid.\n\nEl registro de una colonia o población felina podrá realizarse a partir de:\n\nCensado de una colonia felina ya asentada en una ubicación existente, mediante declaración responsable de cualquier persona que quiera alcanzar la condición de persona colaboradora responsable.\nCensado de oficio, por parte de los servicios municipales, como consecuencia de quejas o avisos formulados por la ciudadanía o por cualquier organismo o entidad.\nEn el caso de colonias o poblaciones felinas comunicadas mediante declaración responsable, la persona colaboradora responsable habrá de remitir un informe anual de seguimiento de la misma.\n\nA través de este trámite se podrá solicitar también la modificación o ampliación de los datos aportados (baja, cambio de datos personales, alta de nuevos interesados)\n\nImporte\nGratuito\n\nTramitar\nEn línea\nRegistro Electrónico\n\nPresencial\nSin cita previa\nOficinas de registro municipales que atienden SIN cita previa\n\nCon cita previa obligatoria\nOficinas de Atención a la Ciudadanía (OAC). Línea Madrid\n\nRedes sociales\nTwitter\n\nhttps://twitter.com/LineaMadrid\n\nFacebook\n\nhttps://www.facebook.com/LineaMadrid\n\nInformación relacionada\nModelos de formularios\nFormulario de solicitud (presencial)\nInformación relacionada\nDirecciones y teléfonos\nCentro de Protección Animal\nDocumentación\nInstrucciones. Declaración responsable para la consolidación de colonias de gatos urbanos\nInstrucciones. Comunicación, modificación o ampliación de datos en el registro de colonias felinas\nInstrucciones. Comunicación de incidencias o quejas por presencia de gatos urbanos\nMás datos\nCurso sobre buenas prácticas en la gestión de colonias felinas del Ayuntamiento de Madrid\nOtros trámites\nAnimales. Solicitud de esterilización de gatos de colonia felina censada\nAnimales. Obtención de acreditación de persona colaboradora en gestión de colonias felinas\nOtros contenidos\nPreguntas frecuentes sobre la gestión de colonias de gatos urbanos\nTríptico de Colonias felinas\nPautas de buenas prácticas en gestión de colonias de gatos urbanos\nDerechos y obligaciones de los colaboradores en la gestión de colonias felinas']","Para gestionar las poblaciones de gatos urbanos en Madrid, se ha implementado un nuevo procedimiento basado en la estrategia CER (captura, esterilización y retorno) con el objetivo de controlar el tamaño de las colonias de gatos urbanos, minimizar los problemas asociados a la presencia de estos animales y facilitar el conocimiento y la adopción de buenas prácticas en la gestión de las mismas.

Este enfoque se basa en tres pilares clave:

1. **Captura**: Se lleva a cabo un censado de colonias felinas ya asentadas en una ubicación existente, mediante declaración responsable de cualquier persona que quiera alcanzar la condición de persona colaboradora responsable. Esta acción permite contar con información sobre el número y ubicación de las poblaciones de gatos urbanos.

2. **Esterilización**: Una vez capturadas, se esterilizan los gatos para prevenir el embarazo y reducir la población. Esto ayuda a controlar el número de gatos en la ciudad, al tiempo que promueve la salud y el bienestar de los animales.

3. **Retorno**: Después de la esterilización, los gatos son devueltos a su hogar o a un centro de protección animal. Este paso garantiza que los gatos regresen a su entorno original y pueden ser alimentados y cuidados por sus propias familias.

Este enfoque se basa en la colaboración y la participación de diferentes actores, como propietarios en la ciudad, personas colaboradoras, servicios municipales y centros de protección animal. Además, se mantiene un censo de colonias y poblaciones felinas para contar con información actualizada y definir estrategias de actuación.

La inclusión en este censo no implica ningún tipo de autorización por parte del Ayuntamiento de Madrid. El registro de una colonia o población felina puede realizarse a través de diferentes vías, como el censado de una colonia felina ya asentada en una ubicación existente, mediante declaración responsable de cualquier persona que quiera alcanzar la condición de persona colaboradora responsable, o mediante comunicación, modificación o ampliación de datos en el registro de colonias felinas.

El importe de la esterilización de gatos es gratuito, y la modificación o ampliación de datos en el registro de colonias felinas requiere la presentación de un informe anual de seguimiento. Además, se ofrece un curso sobre buenas prácticas en la gestión de colonias felinas del Ayuntamiento de Madrid.

En cuanto a la obtención de acreditación de persona colaboradora en gestión de colonias felinas, se requiere cumplir con ciertos requisitos y demostrar conocimientos y habilidades en la gestión de colonias felinas. Una vez obtenida, se otorgan beneficios y reconocimientos a los colaboradores.

Por último, se recomienda consultar el trío de colonias felinas, que incluye pautas de buenas prácticas en gestión de colonias de gatos urbanos, así como los derechos y obligaciones de los colaboradores en la gestión de colonias felinas.","Si te encuentras con gatos callejeros en tu comunidad en Madrid, hay varias acciones que puedes tomar:

Conocer el procedimiento CER: Madrid implementa la estrategia CER (capturar, esterilizar y retornar) para gestionar las poblaciones incontroladas de gatos. El objetivo es controlar el tamaño de las colonias de gatos urbanos y minimizar los problemas asociados a su presencia, principalmente a través de la esterilización​​.

Registrar la colonia felina: Puedes registrar una colonia felina ya existente o notificar a los servicios municipales sobre la presencia de gatos callejeros. Esto se puede hacer como persona colaboradora responsable, lo que implica asumir ciertas responsabilidades y presentar un informe anual de seguimiento de la colonia​​.

Realizar el trámite en línea o presencialmente: Para registrar una colonia felina o comunicar incidencias, puedes completar el trámite en línea a través del Registro Electrónico del Ayuntamiento de Madrid o hacerlo presencialmente en las oficinas de asistencia en materia de registro​​.

Utilizar los formularios adecuados: Existen formularios específicos para la consolidación de colonias de gatos urbanos, la comunicación o modificación de datos en el registro de colonias felinas, y para la comunicación de incidencias o quejas por la presencia de gatos urbanos​​.

Es importante actuar de manera responsable y considerada hacia los animales y la comunidad, y seguir las pautas establecidas por las autoridades locales para garantizar el bienestar de los gatos callejeros.",0.679269502069813,0.9999999999,0.8857142857142857,0.8333333333333334
Dime las diferencias entre una corchea y una negra.,"['Empecemos a leer ritmo con un ejemplo.\n\nLas negras: figuras y signos musicales\n\nComo pueden ver y escuchar, cada símbolo en la partitura suena con cada pulso del metrónomo. La duración de cada sonido se representa con un símbolo en el pentagrama que llamamos figura musical. En este ejemplo estamos usando una figura musical llamada negra, así que en la partitura tenemos 8 negras. Podemos concluir que cada pulso del metrónomo es igual a una negra.\n\nEsta figura musical se forma con una línea vertical que llamamos plica y un punto. La ubicación del punto determina la nota en el pentagrama. Si el punto está por debajo de la tercera línea del pentagrama, la plica irá hacia arriba y a la derecha del punto. Si el punto está hacia arriba de la tercera línea, la plica irá hacia abajo y a la izquierda del punto.\nLas corcheas\n\nPara el segundo ejemplo vamos a usar una nueva figura musical, escuchemos:\n\nLas corcheas: signos musicales\n\nEn el ejemplo tenemos 4 negras y luego 8 nuevas figuras musicales que llamaremos corcheas. Cada corchea durala mitad de una negra, por lo que se necesitan 2 corcheas para completar un pulso del metrónomo.Las corcheas se diferencian de las negras porque están unidas con una línea al final de la plica. Pero las corcheas no siempre tienen que estar unidas, las unimos para que se pueda leer fácilmente. Así se ven las corcheas separadas:\n\nLas corcheas separadas\n\nEl sonido es exactamente el mismo si están unidas o no, pero cuando las corcheas hacen parte de un mismo pulso,o hasta dos pulsos seguidos, debemos unirlas para facilitar la lectura.\nLas semicorcheas\n\nAhora aprendamos una nueva figura musical:\n\nLas semicorcheas y los símbolos musicales\n\nEn el ejemplo tenemos 2 negras, luego 4 corcheas y las 16figuras que vemos unidas con dos líneas se llaman semicorcheas. Se parecen a las corcheas, la diferencia está en que se unen al final de las plicas con dos líneas en lugar de una. Al igual que las corcheas, las semicorcheas se pueden unir como se ve en el ejemplo para que se puedan leer fácilmente, pero también pueden estar separadas. Una semicorchea dura exactamente la mitad de una corchea, esto quiere decir que para completar la duración de una corchea necesitamos dos semicorcheas. Y para completar la duración de una negra necesitamos 4 semicorcheas.\nLas fusas y semifusas\n\nAhora veamos un nuevo ejemplo con una nueva figura musical que se llama fusa:\n\nLas fusas como símbolos musicales\n\nLa fusa dura la mitad de una semicorchea. Se diferencia porque se usan tres líneas para unirlas, aunque  también puede aparecer sola con 3 adornos al final de su plica. Se necesitan 8 fusas para completar un pulso de negra.\n\nComo se pueden dar cuenta, cada nueva figura que les enseño dura exactamente la mitad de la anterior. También existe la semifusa que dura la mitad de una fusa y se diferencia por usar 4 líneas o adornos.\nLas blancas y redondas\n\nLa negra no es la figura musical con mayor duración. Veamos el siguiente ejemplo:\n\nLas blancas como figuras musicales\n\nEsta nueva figura que está después de las cuatro negras se llama blanca. Se diferencia de la negra porque su punto no está relleno. Su duración es el doble de una negra, por lo tanto dura dos pulsos completos.\n\nAhora veamos la redonda, que dura el doble de una blanca, es decir 4 negras, y se diferencia porque no tiene plica y es un óvalo sin relleno:\n\nLa redonda en música']","Las corcheas y las negras son dos figuras musicales que se utilizan en la música clásica y en otros estilos musicales. A continuación, se presentan algunas diferencias entre ellas:

    Duración: Las corcheas suelen durar más que las negras. Por ejemplo, una corchea completa dura la mitad de una negra, mientras que una negra completa dura dos pulsos completos​.

Forma: Las corcheas se forman con una línea vertical al final de la plica, mientras que las negras no tienen un final específico. Las corcheas se unen al final de la plica, mientras que las negras pueden estar unidas o separadas​.

Repetición: Las corcheas se unen al final de la plica, lo que permite una lectura más fácil. Las negras, por otro lado, pueden estar unidas o separadas, lo que puede hacer que la lectura sea más compleja​.

Cada una de estas diferencias es importante para entender y comprender mejor cómo funcionan estas figuras musicales en la música clásica y en otros estilos musicales.","Las diferencias principales entre una corchea y una negra en música son su valor de tiempo y su representación gráfica en la partitura.

    Valor de Tiempo:
        La negra tiene un valor equivalente a un cuarto de una redonda. En términos de pulsos, cada pulso del metrónomo equivale a una negra​.
La corchea, por otro lado, tiene un valor equivalente a la mitad de una negra, o lo que es lo mismo, un octavo de una redonda. Por lo tanto, se necesitan dos corcheas para completar el tiempo de un pulso del metrónomo, que es igual al tiempo de una negra​​.

Representación Gráfica:

    La negra se representa con un punto (la cabeza de la nota) y una línea vertical (la plica). La posición del punto en el pentagrama determina la nota musical específica. Si el punto está por debajo de la tercera línea del pentagrama, la plica se dirige hacia arriba y a la derecha del punto; si el punto está por encima de la tercera línea, la plica se dirige hacia abajo y a la izquierda del punto​.
Las corcheas se diferencian de las negras porque, además de tener un punto y una plica, poseen una línea adicional en el extremo de la plica, llamada corchete. Las corcheas pueden estar unidas por este corchete o separadas. Cuando forman parte del mismo pulso o hasta dos pulsos seguidos, generalmente se unen para facilitar la lectura en la partitura​.

En resumen, la principal diferencia entre una negra y una corchea radica en su valor rítmico, siendo la corchea la mitad de la duración de una negra, y en su representación gráfica, donde las corcheas se distinguen por el corchete adicional en la plica.",0.7729936596960932,0.9999999999,0.5833333333333334,
¿Cuál es la diferencia entre una corchea y una negra?,"['Empecemos a leer ritmo con un ejemplo.\n\nLas negras: figuras y signos musicales\n\nComo pueden ver y escuchar, cada símbolo en la partitura suena con cada pulso del metrónomo. La duración de cada sonido se representa con un símbolo en el pentagrama que llamamos figura musical. En este ejemplo estamos usando una figura musical llamada negra, así que en la partitura tenemos 8 negras. Podemos concluir que cada pulso del metrónomo es igual a una negra.\n\nEsta figura musical se forma con una línea vertical que llamamos plica y un punto. La ubicación del punto determina la nota en el pentagrama. Si el punto está por debajo de la tercera línea del pentagrama, la plica irá hacia arriba y a la derecha del punto. Si el punto está hacia arriba de la tercera línea, la plica irá hacia abajo y a la izquierda del punto.\nLas corcheas\n\nPara el segundo ejemplo vamos a usar una nueva figura musical, escuchemos:\n\nLas corcheas: signos musicales\n\nEn el ejemplo tenemos 4 negras y luego 8 nuevas figuras musicales que llamaremos corcheas. Cada corchea durala mitad de una negra, por lo que se necesitan 2 corcheas para completar un pulso del metrónomo.Las corcheas se diferencian de las negras porque están unidas con una línea al final de la plica. Pero las corcheas no siempre tienen que estar unidas, las unimos para que se pueda leer fácilmente. Así se ven las corcheas separadas:\n\nLas corcheas separadas\n\nEl sonido es exactamente el mismo si están unidas o no, pero cuando las corcheas hacen parte de un mismo pulso,o hasta dos pulsos seguidos, debemos unirlas para facilitar la lectura.\nLas semicorcheas\n\nAhora aprendamos una nueva figura musical:\n\nLas semicorcheas y los símbolos musicales\n\nEn el ejemplo tenemos 2 negras, luego 4 corcheas y las 16figuras que vemos unidas con dos líneas se llaman semicorcheas. Se parecen a las corcheas, la diferencia está en que se unen al final de las plicas con dos líneas en lugar de una. Al igual que las corcheas, las semicorcheas se pueden unir como se ve en el ejemplo para que se puedan leer fácilmente, pero también pueden estar separadas. Una semicorchea dura exactamente la mitad de una corchea, esto quiere decir que para completar la duración de una corchea necesitamos dos semicorcheas. Y para completar la duración de una negra necesitamos 4 semicorcheas.\nLas fusas y semifusas\n\nAhora veamos un nuevo ejemplo con una nueva figura musical que se llama fusa:\n\nLas fusas como símbolos musicales\n\nLa fusa dura la mitad de una semicorchea. Se diferencia porque se usan tres líneas para unirlas, aunque  también puede aparecer sola con 3 adornos al final de su plica. Se necesitan 8 fusas para completar un pulso de negra.\n\nComo se pueden dar cuenta, cada nueva figura que les enseño dura exactamente la mitad de la anterior. También existe la semifusa que dura la mitad de una fusa y se diferencia por usar 4 líneas o adornos.\nLas blancas y redondas\n\nLa negra no es la figura musical con mayor duración. Veamos el siguiente ejemplo:\n\nLas blancas como figuras musicales\n\nEsta nueva figura que está después de las cuatro negras se llama blanca. Se diferencia de la negra porque su punto no está relleno. Su duración es el doble de una negra, por lo tanto dura dos pulsos completos.\n\nAhora veamos la redonda, que dura el doble de una blanca, es decir 4 negras, y se diferencia porque no tiene plica y es un óvalo sin relleno:\n\nLa redonda en música']","Las corcheas y las negras son dos figuras musicales distintas en la música. A continuación, se presentan algunas diferencias clave entre ellas:

    Duración: Las corcheas duran la mitad de una negra, mientras que las negras duran dos pulsos completos.

Forma: Las corcheas se forman con una línea vertical llamada plica y un punto, ubicándose debajo de la tercera línea del pentagrama. Las negras, por otro lado, solo tienen una línea vertical llamada plica.

Signos musicales: Además de las corcheas, existen otras figuras musicales como las semicorcheas, las fusas, las semifusas, las blancas y las rondas.

Diferenciación: Las corcheas y las negras se diferencian en su forma, duración y uso en la música. Las corcheas se unen al final de la plica con dos líneas, mientras que las negras solo tienen una línea vertical.

En resumen, las corcheas y las negras son figuras musicales distintas que difieren en su duración, forma y uso en la música.","Las diferencias principales entre una corchea y una negra en música son su valor de tiempo y su representación gráfica en la partitura.

    Valor de Tiempo:
        La negra tiene un valor equivalente a un cuarto de una redonda. En términos de pulsos, cada pulso del metrónomo equivale a una negra​.
La corchea, por otro lado, tiene un valor equivalente a la mitad de una negra, o lo que es lo mismo, un octavo de una redonda. Por lo tanto, se necesitan dos corcheas para completar el tiempo de un pulso del metrónomo, que es igual al tiempo de una negra​​.

Representación Gráfica:

    La negra se representa con un punto (la cabeza de la nota) y una línea vertical (la plica). La posición del punto en el pentagrama determina la nota musical específica. Si el punto está por debajo de la tercera línea del pentagrama, la plica se dirige hacia arriba y a la derecha del punto; si el punto está por encima de la tercera línea, la plica se dirige hacia abajo y a la izquierda del punto​.
Las corcheas se diferencian de las negras porque, además de tener un punto y una plica, poseen una línea adicional en el extremo de la plica, llamada corchete. Las corcheas pueden estar unidas por este corchete o separadas. Cuando forman parte del mismo pulso o hasta dos pulsos seguidos, generalmente se unen para facilitar la lectura en la partitura​.

En resumen, la principal diferencia entre una negra y una corchea radica en su valor rítmico, siendo la corchea la mitad de la duración de una negra, y en su representación gráfica, donde las corcheas se distinguen por el corchete adicional en la plica.",0.8676239397034688,0.9999999999,0.8571428571428571,1.0
"Hola, no comprendo bien qué es una corchea y qué es una negra. ¿Podrías, por favor, decirme las diferencias?","['Empecemos a leer ritmo con un ejemplo.\n\nLas negras: figuras y signos musicales\n\nComo pueden ver y escuchar, cada símbolo en la partitura suena con cada pulso del metrónomo. La duración de cada sonido se representa con un símbolo en el pentagrama que llamamos figura musical. En este ejemplo estamos usando una figura musical llamada negra, así que en la partitura tenemos 8 negras. Podemos concluir que cada pulso del metrónomo es igual a una negra.\n\nEsta figura musical se forma con una línea vertical que llamamos plica y un punto. La ubicación del punto determina la nota en el pentagrama. Si el punto está por debajo de la tercera línea del pentagrama, la plica irá hacia arriba y a la derecha del punto. Si el punto está hacia arriba de la tercera línea, la plica irá hacia abajo y a la izquierda del punto.\nLas corcheas\n\nPara el segundo ejemplo vamos a usar una nueva figura musical, escuchemos:\n\nLas corcheas: signos musicales\n\nEn el ejemplo tenemos 4 negras y luego 8 nuevas figuras musicales que llamaremos corcheas. Cada corchea durala mitad de una negra, por lo que se necesitan 2 corcheas para completar un pulso del metrónomo.Las corcheas se diferencian de las negras porque están unidas con una línea al final de la plica. Pero las corcheas no siempre tienen que estar unidas, las unimos para que se pueda leer fácilmente. Así se ven las corcheas separadas:\n\nLas corcheas separadas\n\nEl sonido es exactamente el mismo si están unidas o no, pero cuando las corcheas hacen parte de un mismo pulso,o hasta dos pulsos seguidos, debemos unirlas para facilitar la lectura.\nLas semicorcheas\n\nAhora aprendamos una nueva figura musical:\n\nLas semicorcheas y los símbolos musicales\n\nEn el ejemplo tenemos 2 negras, luego 4 corcheas y las 16figuras que vemos unidas con dos líneas se llaman semicorcheas. Se parecen a las corcheas, la diferencia está en que se unen al final de las plicas con dos líneas en lugar de una. Al igual que las corcheas, las semicorcheas se pueden unir como se ve en el ejemplo para que se puedan leer fácilmente, pero también pueden estar separadas. Una semicorchea dura exactamente la mitad de una corchea, esto quiere decir que para completar la duración de una corchea necesitamos dos semicorcheas. Y para completar la duración de una negra necesitamos 4 semicorcheas.\nLas fusas y semifusas\n\nAhora veamos un nuevo ejemplo con una nueva figura musical que se llama fusa:\n\nLas fusas como símbolos musicales\n\nLa fusa dura la mitad de una semicorchea. Se diferencia porque se usan tres líneas para unirlas, aunque  también puede aparecer sola con 3 adornos al final de su plica. Se necesitan 8 fusas para completar un pulso de negra.\n\nComo se pueden dar cuenta, cada nueva figura que les enseño dura exactamente la mitad de la anterior. También existe la semifusa que dura la mitad de una fusa y se diferencia por usar 4 líneas o adornos.\nLas blancas y redondas\n\nLa negra no es la figura musical con mayor duración. Veamos el siguiente ejemplo:\n\nLas blancas como figuras musicales\n\nEsta nueva figura que está después de las cuatro negras se llama blanca. Se diferencia de la negra porque su punto no está relleno. Su duración es el doble de una negra, por lo tanto dura dos pulsos completos.\n\nAhora veamos la redonda, que dura el doble de una blanca, es decir 4 negras, y se diferencia porque no tiene plica y es un óvalo sin relleno:\n\nLa redonda en música']","Claro, con gusto te ayudaré a entender las diferencias entre las corcheas y las negras.

Una corchea es un símbolo musical que se utiliza para indicar la duración de una nota musical en un ritmo específico. Cuando se unen varias corcheas, se forman una corchea compleja, que puede tener múltiples notas y se utiliza para indicar la duración de un pulso o un ritmo específico.

Por otro lado, una negra es una figura musical que se utiliza para indicar la duración de una nota musical en un ritmo específico. Las negras se forman con una línea vertical y un punto, y su duración es la misma que la nota musical que se encuentra debajo de la línea vertical. Por ejemplo, en el ejemplo de las negras, cada negra indica una nota musical en un pulso específico.

En resumen, las corcheas y las negras son dos tipos distintos de símbolos musicales que se utilizan para indicar la duración de una nota musical en un ritmo específico. Las corcheas se unen para formar una corchea compleja, mientras que las negras se utilizan para indicar la duración de una nota musical en un ritmo específico.","Las diferencias principales entre una corchea y una negra en música son su valor de tiempo y su representación gráfica en la partitura.

    Valor de Tiempo:
        La negra tiene un valor equivalente a un cuarto de una redonda. En términos de pulsos, cada pulso del metrónomo equivale a una negra​.
La corchea, por otro lado, tiene un valor equivalente a la mitad de una negra, o lo que es lo mismo, un octavo de una redonda. Por lo tanto, se necesitan dos corcheas para completar el tiempo de un pulso del metrónomo, que es igual al tiempo de una negra​​.

Representación Gráfica:

    La negra se representa con un punto (la cabeza de la nota) y una línea vertical (la plica). La posición del punto en el pentagrama determina la nota musical específica. Si el punto está por debajo de la tercera línea del pentagrama, la plica se dirige hacia arriba y a la derecha del punto; si el punto está por encima de la tercera línea, la plica se dirige hacia abajo y a la izquierda del punto​.
Las corcheas se diferencian de las negras porque, además de tener un punto y una plica, poseen una línea adicional en el extremo de la plica, llamada corchete. Las corcheas pueden estar unidas por este corchete o separadas. Cuando forman parte del mismo pulso o hasta dos pulsos seguidos, generalmente se unen para facilitar la lectura en la partitura​.

En resumen, la principal diferencia entre una negra y una corchea radica en su valor rítmico, siendo la corchea la mitad de la duración de una negra, y en su representación gráfica, donde las corcheas se distinguen por el corchete adicional en la plica.",0.8360328779669249,0.9999999999,0.7142857142857143,1.0
"Hola! Quiero saber cómo puedo renovar mi DNI-e, ¿podrías ayudarme paso a paso?","['Renovación del DNI\n\nComo dicta el Artículo 7 del Real Decreto 1553/2005 de 23 de diciembre, para solicitar la renovación del Documento Nacional de Identidad será imprescindible la presencia física de la persona a quien se haya de expedir, el abono en efectivo o a través de tarjeta de crédito/débito la tasa correspondiente, o utilizando el pago por vía telemática\ty aportar los siguientes documentos:\n\n    Una fotografía reciente en color del rostro del solicitante, tamaño 32x26 milímetros, con fondo uniforme blanco y liso, tomada de frente con la cabeza totalmente descubierta y sin gafas de cristales oscuros o cualquier otra prenda que pueda impedir o dificultar la identificación de la persona. (La fotografía deberá mostrar claramente el óvalo de la cara, que incluye cejas, ojos, nariz, boca y mentón, y deberá ser de alta resolución y en papel fotográfico de buena calidad)\n\n    El DNI anterior (En caso de pérdida o extravío se requerirá denuncia previa o comunicación de tal incidencia al equipo de expedición). En caso de caída del chip, el DNI-e deberá ser tratado como un documento deteriorado, estando su titular obligado a la obtención de un duplicado, tal y como se establece en el artículo 8 del Real Decreto 1553/2005, de 23 de diciembre, en el cual se preceptúa que ""los documentos sustituidos perderán el carácter de Documento Nacional de Identidad, así como los efectos que el ordenamiento jurídico atribuye a este con respecto a su titular"".\n\n    En caso de cambio de domicilio, respecto del que figure en el Documento anterior, certificado o volante de empadronamiento del Ayuntamiento donde el solicitante tenga su domicilio, expedido con una antelación máxima de tres meses a la fecha de la solicitud del Documento Nacional de Identidad. Estos documentos no serán necesarios si el interesado autoriza, en el momento de la tramitación, al equipo de expedición a consultar los datos del domicilio mediante acceso al Sistema de Verificación de Datos de residencia.\n\n    Si el alta en el Padrón Municipal se ha realizado en los dos últimos meses, es necesario aportar el certificado o volante de empadronamiento a que se hace referencia.\n\n    NOTA: Debido al posible retraso que se pueda producir en la actualización de los datos del domicilio en el sistema informático y en menor medida, a las posibles incidencias de carácter técnico (ajenas a Policía) en el acceso a los mismos, es recomendable que el ciudadano se provea con anterioridad del certificado o volante de empadronamiento.\n\n    Cuando el titular del DNI sea menor de 14 años o persona con capacidad judicialmente complementada se llevará a cabo en presencia de la persona que tenga encomendada la patria potestad o tutela, o persona apoderada por estas últimas. Puede descargar el modelo de apoderamiento\t, siendo importante leer la nota informativa que se descarga con el mismo.\n\n    En caso de variación de datos de filiación, Certificado del Registro Civil (expedido con una antelación máxima de seis meses a la fecha de la solicitud del DNI 3.0).']","Para solicitar la renovación de tu DNI-e, sigue estos pasos:

    Preparación de los Documentos Necesarios:
        - Fotografía reciente en color del rostro, tamaño 32x26 milímetros, con fondo uniforme blanco y liso, tomada de frente con la cabeza totalmente descubierta y sin gafas de cristales oscuros o cualquier otra prenda que pueda impedir o dificultar la identificación.
        - DNI anterior, en caso de pérdida o extravío, debe presentarse una denuncia previa o comunicación al equipo de expedición.
        - Certificado o volante de empadronamiento del Ayuntamiento donde el solicitante tenga su domicilio, expedido con una antelación máxima de tres meses a la fecha de la solicitud del Documento Nacional de Identidad.
        - Si el alta en el Padrón Municipal se ha realizado en los dos últimos meses, es necesario aportar el certificado o volante de empadronamiento.
        - Si el titular del DNI es menor de 14 años o tiene capacidad judicialmente complementada, se llevará a cabo en presencia de la persona que tenga encomendada la patria potestad o tutela, o persona apoderada por estas últimas.
        - En caso de variación de datos de filiación, se debe presentar el Certificado del Registro Civil (expedido con una antelación máxima de seis meses a la fecha de la solicitud del DNI).
    
Requisitos y Documentos Adicionales:
    - Si el DNI es perdido o extraviado, se requiere presentar una denuncia previa o comunicación al equipo de expedición.
    - Si el DNI ha perdido su chip, debe ser tratado como un documento deteriorado, y el titular estará obligado a la obtención de un duplicado, según lo establecido en el artículo 8 del Real Decreto 1553/2005, de 23 de diciembre.
    - Si el DNI es expirado, se requerirá presentar una solicitud de renovación en el plazo de un mes desde la fecha de expiración.

Solicitud de Renovación:
    - Dirígete a la Oficina de Extranjería o Comisaría de Policía de la provincia donde resides, ya que la renovación de tu DNI se realizará allí.
    - Lleva todos los documentos necesarios, incluyendo la fotografía reciente, el DNI anterior, el certificado o volante de empadronamiento, y el apoderamiento en caso de ser menor de 14 años o tener capacidad judicialmente complementada.
    - Paga la tasa correspondiente, ya sea en efectivo o a través de tarjeta de crédito/débito, o utilizando el pago por vía telemática.

Entrega de la Renovación:
    - Espera a recibir la notificación de la entrega de tu DNI renovado.
    - Recoge tu nuevo DNI en la Oficina de Extranjería o Comisaría de Policía.

Es importante recordar que la renovación de tu DNI es un proceso que puede tardar varios días, dependiendo de la oficina de extranjería o comisaría de policía donde lo solicites. Además, es recomendable verificar la disponibilidad de la oficina antes de acudir, ya que pueden estar atendiendo otros asuntos o estar realizando obras de mantenimiento.","Para renovar tu DNI electrónico (DNI-e) en España, sigue estos pasos, según la información oficial proporcionada por el portal del DNI electrónico:
Presencia física y pago de la tasa: Debes presentarte físicamente y abonar la tasa correspondiente, ya sea en efectivo, con tarjeta de crédito/débito, o mediante pago telemático.
Documentación necesaria:
Fotografía reciente: En color, de 32x26 milímetros, con fondo blanco y liso. Debe ser de alta resolución y mostrar claramente el óvalo de la cara.
DNI anterior: Si se ha perdido, es necesario presentar una denuncia previa o comunicar el incidente.
Cambio de domicilio: Si ha cambiado tu domicilio, necesitarás un certificado o volante de empadronamiento del Ayuntamiento donde residas, expedido en los últimos tres meses.
Menores de 14 años o personas con capacidad judicialmente complementada: Deben estar acompañados por su tutor legal o una persona apoderada.
Variación de datos de filiación: Necesitarás un certificado del Registro Civil.
Extravío, sustracción, destrucción o deterioro del DNI: Debes solicitar un duplicado.
Plazos para la renovación: El DNI se debe renovar dentro de los últimos 180 días de vigencia. En casos de extravío, sustracción, deterioro o mal funcionamiento del chip, se debe renovar lo antes posible​​.
Para más detalles y el proceso completo, te recomiendo visitar el sitio oficial del DNI electrónico en España.",0.8935811439101657,0.9999999999,0.7142857142857143,0.9090909090909091
Buenos días. ¿Serías tan amable de contarme paso a paso cómo puedo renovar el documento nacional de identidad DNI-e?,"['Renovación del DNI\n\nComo dicta el Artículo 7 del Real Decreto 1553/2005 de 23 de diciembre, para solicitar la renovación del Documento Nacional de Identidad será imprescindible la presencia física de la persona a quien se haya de expedir, el abono en efectivo o a través de tarjeta de crédito/débito la tasa correspondiente, o utilizando el pago por vía telemática\ty aportar los siguientes documentos:\n\n    Una fotografía reciente en color del rostro del solicitante, tamaño 32x26 milímetros, con fondo uniforme blanco y liso, tomada de frente con la cabeza totalmente descubierta y sin gafas de cristales oscuros o cualquier otra prenda que pueda impedir o dificultar la identificación de la persona. (La fotografía deberá mostrar claramente el óvalo de la cara, que incluye cejas, ojos, nariz, boca y mentón, y deberá ser de alta resolución y en papel fotográfico de buena calidad)\n\n    El DNI anterior (En caso de pérdida o extravío se requerirá denuncia previa o comunicación de tal incidencia al equipo de expedición). En caso de caída del chip, el DNI-e deberá ser tratado como un documento deteriorado, estando su titular obligado a la obtención de un duplicado, tal y como se establece en el artículo 8 del Real Decreto 1553/2005, de 23 de diciembre, en el cual se preceptúa que ""los documentos sustituidos perderán el carácter de Documento Nacional de Identidad, así como los efectos que el ordenamiento jurídico atribuye a este con respecto a su titular"".\n\n    En caso de cambio de domicilio, respecto del que figure en el Documento anterior, certificado o volante de empadronamiento del Ayuntamiento donde el solicitante tenga su domicilio, expedido con una antelación máxima de tres meses a la fecha de la solicitud del Documento Nacional de Identidad. Estos documentos no serán necesarios si el interesado autoriza, en el momento de la tramitación, al equipo de expedición a consultar los datos del domicilio mediante acceso al Sistema de Verificación de Datos de residencia.\n\n    Si el alta en el Padrón Municipal se ha realizado en los dos últimos meses, es necesario aportar el certificado o volante de empadronamiento a que se hace referencia.\n\n    NOTA: Debido al posible retraso que se pueda producir en la actualización de los datos del domicilio en el sistema informático y en menor medida, a las posibles incidencias de carácter técnico (ajenas a Policía) en el acceso a los mismos, es recomendable que el ciudadano se provea con anterioridad del certificado o volante de empadronamiento.\n\n    Cuando el titular del DNI sea menor de 14 años o persona con capacidad judicialmente complementada se llevará a cabo en presencia de la persona que tenga encomendada la patria potestad o tutela, o persona apoderada por estas últimas. Puede descargar el modelo de apoderamiento\t, siendo importante leer la nota informativa que se descarga con el mismo.\n\n    En caso de variación de datos de filiación, Certificado del Registro Civil (expedido con una antelación máxima de seis meses a la fecha de la solicitud del DNI 3.0).']","Para renovar el DNI-e, sigue estos pasos:

1. **Preparación de los documentos**: Antes de presentar tu solicitud, prepara los siguientes documentos:
   - Fotografía reciente en color del rostro, tamaño 32x26 milímetros, con fondo uniforme blanco y liso. La fotografía debe mostrar claramente el óvalo de la cara, incluyendo cejas, ojos, nariz, boca y mentón, y debe ser de alta resolución y en papel fotográfico de buena calidad.
   - DNI anterior, en caso de pérdida o extravío. Si esto ocurre, debes denunciarlo previamente al equipo de expedición.
   - Certificado o volante de empadronamiento del Ayuntamiento donde tienes tu domicilio, expedido con una antelación máxima de tres meses antes de la fecha de la solicitud del DNI.

2. **Solicitud**: Presenta tu solicitud en la Oficina de Extranjería o en la Comisaría de Policía de la provincia donde resides. Puedes hacerlo en persona o por correo certificado con acuse de recibo.

3. **Pago de la tasa**: Paga la tasa correspondiente por la renovación del DNI-e. Puedes hacerlo en efectivo o a través de tarjeta de crédito/débito en la Oficina de Extranjería o en la Comisaría de Policía.

4. **Documentación adicional**: Si has cambiado de domicilio, debes presentar el certificado o volante de empadronamiento del Ayuntamiento donde tienes tu nueva dirección. Si tu alta en el Padrón Municipal se realizó en los dos últimos meses, también puedes presentar el certificado o volante de empadronamiento.

5. **Verificación de datos**: Si el alta en el Padrón Municipal se realizó en los dos últimos meses, debes aportar el certificado o volante de empadronamiento. Si eres menor de 14 años o tienes capacidad judicialmente complementada, se te llevará a la persona que tenga encomendada la patria potestad o tutela, o persona apoderada por estas últimas.

6. **Revisión de la solicitud**: Tras presentar tu solicitud, la Oficina de Extranjería revisará tu documentación y verificará que todo está correcto. Si todo está en orden, recibirás un aviso de aceptación de la renovación del DNI-e.

Recuerda que este proceso puede variar dependiendo de tu situación individual y de la Oficina de Extranjería o Comisaría de Policía donde presentes tu solicitud. Asegúrate de verificar la información más reciente en la página web del gobierno o consultando con un profesional en inmigración.","Para renovar tu DNI electrónico (DNI-e) en España, sigue estos pasos, según la información oficial proporcionada por el portal del DNI electrónico:
Presencia física y pago de la tasa: Debes presentarte físicamente y abonar la tasa correspondiente, ya sea en efectivo, con tarjeta de crédito/débito, o mediante pago telemático.
Documentación necesaria:
Fotografía reciente: En color, de 32x26 milímetros, con fondo blanco y liso. Debe ser de alta resolución y mostrar claramente el óvalo de la cara.
DNI anterior: Si se ha perdido, es necesario presentar una denuncia previa o comunicar el incidente.
Cambio de domicilio: Si ha cambiado tu domicilio, necesitarás un certificado o volante de empadronamiento del Ayuntamiento donde residas, expedido en los últimos tres meses.
Menores de 14 años o personas con capacidad judicialmente complementada: Deben estar acompañados por su tutor legal o una persona apoderada.
Variación de datos de filiación: Necesitarás un certificado del Registro Civil.
Extravío, sustracción, destrucción o deterioro del DNI: Debes solicitar un duplicado.
Plazos para la renovación: El DNI se debe renovar dentro de los últimos 180 días de vigencia. En casos de extravío, sustracción, deterioro o mal funcionamiento del chip, se debe renovar lo antes posible​​.
Para más detalles y el proceso completo, te recomiendo visitar el sitio oficial del DNI electrónico en España.",,0.9999999999,0.6060606060606061,0.9411764705882353
"Kiero renobar mi dni, ¿q tngo q acer?","['Renovación del DNI\n\nComo dicta el Artículo 7 del Real Decreto 1553/2005 de 23 de diciembre, para solicitar la renovación del Documento Nacional de Identidad será imprescindible la presencia física de la persona a quien se haya de expedir, el abono en efectivo o a través de tarjeta de crédito/débito la tasa correspondiente, o utilizando el pago por vía telemática\ty aportar los siguientes documentos:\n\n    Una fotografía reciente en color del rostro del solicitante, tamaño 32x26 milímetros, con fondo uniforme blanco y liso, tomada de frente con la cabeza totalmente descubierta y sin gafas de cristales oscuros o cualquier otra prenda que pueda impedir o dificultar la identificación de la persona. (La fotografía deberá mostrar claramente el óvalo de la cara, que incluye cejas, ojos, nariz, boca y mentón, y deberá ser de alta resolución y en papel fotográfico de buena calidad)\n\n    El DNI anterior (En caso de pérdida o extravío se requerirá denuncia previa o comunicación de tal incidencia al equipo de expedición). En caso de caída del chip, el DNI-e deberá ser tratado como un documento deteriorado, estando su titular obligado a la obtención de un duplicado, tal y como se establece en el artículo 8 del Real Decreto 1553/2005, de 23 de diciembre, en el cual se preceptúa que ""los documentos sustituidos perderán el carácter de Documento Nacional de Identidad, así como los efectos que el ordenamiento jurídico atribuye a este con respecto a su titular"".\n\n    En caso de cambio de domicilio, respecto del que figure en el Documento anterior, certificado o volante de empadronamiento del Ayuntamiento donde el solicitante tenga su domicilio, expedido con una antelación máxima de tres meses a la fecha de la solicitud del Documento Nacional de Identidad. Estos documentos no serán necesarios si el interesado autoriza, en el momento de la tramitación, al equipo de expedición a consultar los datos del domicilio mediante acceso al Sistema de Verificación de Datos de residencia.\n\n    Si el alta en el Padrón Municipal se ha realizado en los dos últimos meses, es necesario aportar el certificado o volante de empadronamiento a que se hace referencia.\n\n    NOTA: Debido al posible retraso que se pueda producir en la actualización de los datos del domicilio en el sistema informático y en menor medida, a las posibles incidencias de carácter técnico (ajenas a Policía) en el acceso a los mismos, es recomendable que el ciudadano se provea con anterioridad del certificado o volante de empadronamiento.\n\n    Cuando el titular del DNI sea menor de 14 años o persona con capacidad judicialmente complementada se llevará a cabo en presencia de la persona que tenga encomendada la patria potestad o tutela, o persona apoderada por estas últimas. Puede descargar el modelo de apoderamiento\t, siendo importante leer la nota informativa que se descarga con el mismo.\n\n    En caso de variación de datos de filiación, Certificado del Registro Civil (expedido con una antelación máxima de seis meses a la fecha de la solicitud del DNI 3.0).']","Para solicitar la renovación del DNI, es necesario cumplir con ciertos requisitos y presentar ciertos documentos. A continuación, te explico los pasos a seguir:

    Preparación de la Documentación: Antes de presentar tu solicitud, debes preparar la documentación necesaria. Esto incluye:
        - Una fotografía reciente en color del rostro, tamaño 32x26 milímetros, con fondo uniforme blanco y liso. La fotografía debe mostrar claramente el óvalo de la cara, que incluye cejas, ojos, nariz, boca y mentón, y debe ser de alta resolución y en papel fotográfico de buena calidad.
        - El DNI anterior, en caso de que hayas perdido o extravocado tu DNI. Si tu chip se ha caído, el DNI-e deberá ser tratado como un documento deteriorado, y el titular estará obligado a la obtención de un duplicado, según lo establecido en el artículo 8 del Real Decreto 1553/2005, de 23 de diciembre.
        - En caso de cambio de domicilio, un certificado o volante de empadronamiento del Ayuntamiento donde tengas tu domicilio, expedido con una antelación máxima de tres meses a la fecha de la solicitud del DNI. Si has realizado el alta en el Padrón Municipal en los dos últimos meses, también puedes presentar el certificado o volante de empadronamiento.
        - Si eres menor de 14 años o tienes capacidad judicialmente complementada, se llevará a cabo en presencia de la persona que tenga encomendada la patria potestad o tutela, o persona apoderada por estas últimas. En este caso, puedes descargar el modelo de apoderamiento para solicitar la renovación del DNI.

Presentación de la Solicitud: Presenta tu solicitud en la Oficina de Extranjería o en la Comisaría de Policía de la provincia donde resides. También puedes presentarla en línea a través del sitio web del Ministerio de Inclusión, Seguridad Social y Migraciones.

Trámite de la Solicitud: Tras presentar tu solicitud, recibirás un comprobante de presentación. Este comprobante es necesario para solicitar la nueva tarjeta de identidad.

Requisitos adicionales: Además de los documentos mencionados anteriormente, también puedes presentar los siguientes:

    Certificado de empadronamiento: Si has cambiado de domicilio, debes presentar un certificado o volante de empadronamiento del Ayuntamiento donde tengas tu nueva dirección.

    Acreditación de la residencia: Si has realizado el alta en el Padrón Municipal en los dos últimos meses, también puedes presentar esta acreditación.

    Acreditación de la edad: Si eres menor de 14 años, debes presentar una acreditación de tu edad. Si tienes capacidad judicialmente complementada, también puedes presentar esta acreditación.

    Acreditación de la paternidad: Si eres mayor de 14 años y no te encuentras casado, debes presentar una acreditación de tu paternidad. Si te encuentras casado, debes presentar una acreditación de tu paternidad y de la de tu cónyuge.

    Acreditación de la tutela: Si te encuentras bajo tutela, debes presentar una acreditación de tu tutela. Si eres menor de 14 años, también puedes presentar esta acreditación.

Estos documentos pueden variar dependiendo de tu situación personal y del país en el que te encuentres. Es recomendable verificar la información específica en la página web del Ministerio de Inclusión, Seguridad Social y Migraciones o en la Oficina de Extranjería o Comisaría de Policía de la provincia donde resides.","Para renovar tu DNI electrónico (DNI-e) en España, sigue estos pasos, según la información oficial proporcionada por el portal del DNI electrónico:
Presencia física y pago de la tasa: Debes presentarte físicamente y abonar la tasa correspondiente, ya sea en efectivo, con tarjeta de crédito/débito, o mediante pago telemático.
Documentación necesaria:
Fotografía reciente: En color, de 32x26 milímetros, con fondo blanco y liso. Debe ser de alta resolución y mostrar claramente el óvalo de la cara.
DNI anterior: Si se ha perdido, es necesario presentar una denuncia previa o comunicar el incidente.
Cambio de domicilio: Si ha cambiado tu domicilio, necesitarás un certificado o volante de empadronamiento del Ayuntamiento donde residas, expedido en los últimos tres meses.
Menores de 14 años o personas con capacidad judicialmente complementada: Deben estar acompañados por su tutor legal o una persona apoderada.
Variación de datos de filiación: Necesitarás un certificado del Registro Civil.
Extravío, sustracción, destrucción o deterioro del DNI: Debes solicitar un duplicado.
Plazos para la renovación: El DNI se debe renovar dentro de los últimos 180 días de vigencia. En casos de extravío, sustracción, deterioro o mal funcionamiento del chip, se debe renovar lo antes posible​​.
Para más detalles y el proceso completo, te recomiendo visitar el sitio oficial del DNI electrónico en España.",0.5799758673555349,0.9999999999,,0.8
Hola! Acabo de empezar a esquiar y quiero saber qué esquís me puedo comprar,"['Independientemente de la marca que elija, recuerde que la seguridad siempre debe ser su primer prioridad. Asegúrese de tener los patines ajustados correctamente antes de salir a patinar. Esto le ayudará a evitar lesiones y disfrutar de la experiencia de patinar sobre hielo. Así que ¡saca tus patines y aprovecha al máximo tu próxima aventura sobre hielo!\n\nEsperamos que esta guía para principiantes te haya ayudado a aprender cómo comprar los mejores patines de hielo. Siempre tenga en cuenta el ajuste, el precio y la calidad antes de comprar un par de patines de hielo. ¡Compra inteligentemente!\n\nGracias por leer y hasta la próxima. ¡Adiós!']","Para comenzar a esquiar, es importante tener en cuenta varios factores antes de tomar una decisión. Aquí te ofrezco una guía detallada basada en la información obtenida del contexto proporcionado.

    Compra de Patines de Hielo: Es crucial elegir los patines de hielo adecuados para tu tamaño y habilidad. Generalmente, se recomienda que los principiantes comiencen con patines de tamaño medio o grande, ya que son más estables y proporcionan una mejor tracción en hielo. Además, los patines con soporte de goma en la punta pueden ser más seguros y menos propensos a deslizarse.

Ajuste de los Patines: Es esencial que los patines se ajusten correctamente antes de salir a patinar. Un buen ajuste garantiza que los pies estén cómodos y que la plantilla de los patines se distribuya均匀mente a lo largo de los dedos de los pies y las articulaciones. Un ajuste incorrecto puede causar dolor y dificultades para patinar​.

Precio: Los patines de hielo pueden variar en precio, desde los más económicos hasta los más caros. Lo recomendable es buscar entre opciones de diferentes marcas y precios para encontrar los que mejor se adapten a tu presupuesto.

Calidad: La calidad de los patines es fundamental para garantizar una experiencia segura y agradable. Busca patines hechos con materiales de alta calidad, como caucho resistentes y soporte de goma fuerte. También es importante revisar la duración prevista del patín, ya que esto te indicará cuánto tiempo podrás disfrutarlo antes de tener que reemplazarlo​.

Habilidades: Como principiante, es importante elegir patines que te permitan mejorar tus habilidades. Busca patines con un buen equilibrio y una buena tracción en hielo, especialmente si planeas hacer esquí acuático o practicar otros deportes de hielo​.

Uso en Hielo: Es importante recordar que, aunque los patines de hielo son seguros, no son adecuados para todo tipo de terreno. Evita usar patines en hielo en áreas con nieve o hielo sólido, ya que esto puede hacer que los patines se deslicen y te causen lesiones. En cambio, opta por hielo liso y abierto para maximizar la estabilidad y la tracción​​.

En conclusión, para comprar los mejores patines de hielo, es esencial tener en cuenta el ajuste, el precio y la calidad. Buscar patines de tamaño y calidad adecuados, así como opciones de diferentes marcas y precios, es clave para disfrutar de una experiencia segura y agradable de esquiar en hielo.","Para seleccionar los esquís adecuados como principiante en el esquí, hay varios aspectos importantes a considerar:

1. Elección del Tipo de Esquí:
   - Esquís de Pista: Ideales para principiantes, ya que están diseñados para ser utilizados en pistas preparadas. Son generalmente estrechos, lo que aumenta su capacidad de agarre a la nieve, facilitando el aprendizaje de los movimientos básicos.
   - Esquís All Mountain: Versátiles para una variedad de condiciones. Funcionan bien tanto en pista como fuera de ella. Son adecuados si ya has esquiado algunas veces y buscas esquís no limitados a pistas preparadas.

2. Longitud de los Esquís:
   - Como principiante, es recomendable elegir esquís que estén cerca de la altura de tu nariz. Los esquís más cortos son más fáciles de controlar, lo cual es crucial mientras aprendes. Sin embargo, la elección también debe tener en cuenta tu peso, ya que esquís demasiado cortos pueden quitarte control si eres una persona más pesada.

3. Ancho de los Esquís:
   - Los esquís con un ancho de cintura entre 70 y 80 mm son ideales para principiantes, especialmente si pasarás la mayor parte del tiempo en pistas. Estos esquís están diseñados para agarrarse bien a la nieve firme.

4. Flexibilidad:
   - Los esquís más flexibles son recomendados para principiantes, ya que son más fáciles de girar y más indulgentes en caso de detenciones o caídas repentinas. La flexibilidad permite al esquiador sentir más el terreno y aprender a controlar mejor los esquís.

5. Perfil del Esquí:
   - Camber: Diseño tradicional que proporciona un contacto uniforme con la nieve y un control superior del borde, ideal para principiantes.
   - Rocker: Diseño con las puntas levantadas que facilita iniciar giros, útil para principiantes.
   - Mixto Rocker/Camber: Combina las ventajas del camber y el rocker, ofreciendo facilidad para girar y buena sujeción de los bordes.

6. Sistemas Integrados:
   - Algunos modelos para principiantes vienen con fijaciones integradas, lo que puede ser una opción conveniente y segura.

Al elegir tus esquís, es esencial considerar estos factores para asegurar que tengas una experiencia de aprendizaje positiva y segura. También es recomendable asesorarse con profesionales en tiendas de esquí para encontrar el equipo que mejor se adapte a tus necesidades específicas.",0.6250098177222259,0.9999999999,0.7894736842105263,0.2222222222222222
Obtener recomendaciones de esquís para principiantes,"['Los mejores esquís para principiantesLos mejores esquís para principiantes Los mejores esquís para principiantes 1. Rossignol Smash 7 Men Skis 2. Experiencia Rossignol 74 Esquís 3. Rossignol Experience 88 HD Skis 4. Esquís Nordica NRGY 90 5. Esquís Salomón QST 85Si te enganchaste al esquí después de alquilar un par de esquís un puñado de veces, es probablemente el momento adecuado para hacer tu inversión en el deporte. No importa si eres hombre o mujer, tener un par de esquís para principiantes tiene algunos beneficios bastante importantes. Ya no tendrá que esperar en largas colas para el alquiler, especialmente en los fines de semana más ajetreados. Una vez que los compres, puedes tomar tu equipo y dirigirte directamente a las pistas donde te divertirás como nunca.Además, tener los esquís en lugar de alquilarlos también te ayudará a mejorar rápidamente. Cuando tienes tus esquíes, te familiarizas con la forma en que reaccionan y lo que se necesita para controlarlos, aumentando tu confianza mucho más rápido. Cuando se aprende a esquiar, es difícil mantener el equilibrio, doblar las rodillas en un ángulo incómodo y concentrarse en no comer nieve. Al leer toda nuestra guía basada en las revisiones de los esquís para principiantes, podrá tomar la decisión correcta al elegir los esquís adecuados para usted. Vamos a ello: Cómo elegir los mejores esquís para principiantes – Guía de compra Los esquís para principiantes son una plataforma fácil donde aprenderás los fundamentos del esquí, como el giro, el equilibrio y el control. En resumen, un par de esquís para principiantes hará más fácil aprender la técnica adecuada en menos tiempo. Además, estos modelos para principiantes vienen como un sistema integrado con fijaciones o como un esquí plano que requiere la compra de fijaciones por separado.Al comprar esquís para principiantes, hay que tener en cuenta que los esquís vienen en modelos para hombres y mujeres. Los esquís específicos para cada sexo están diseñados no sólo para adaptarse al tamaño de una persona, sino también para tener en cuenta la forma en que una persona se mueve o carga su peso. Aunque estas diferencias de diseño son sutiles, para la mayoría de los esquiadores principiantes, marcan una gran diferencia. Por lo tanto, antes de comprar el mejor par de esquíes para principiantes, debe considerar algunos factores importantes.TamañoEl dimensionamiento de un esquí es un proceso relativamente simple, pero muy importante, necesario para que se disfrute al máximo en las pistas. Un tamaño de esquí adecuado también te dará la mejor experiencia de aprendizaje en la montaña. Un mito popular es que los esquís muy cortos para principiantes son más fáciles de controlar. El hecho es que, si tienes un esquí demasiado corto para tu peso, puede quitarte mucho control y hacer el proceso de aprendizaje mucho más difícil.Los esquíes deben ser del tamaño adecuado para su altura, peso y estilo y habilidad de esquí. No hay una fórmula mágica para determinar el tamaño correcto de los esquís para ti. En general, la longitud adecuada de los esquíes está entre tu barbilla y la parte superior de tu cabeza. Por ejemplo, un esquiador de 1,80 m de altura querrá buscar esquís de entre 170 y 190 cm. El tamaño exacto adecuado para ti dependerá de tu habilidad y estilo de esquí.Factores como la altura y el peso proporcionarán un excelente punto de partida para la mejor elección de los esquís. Hay muchas otras cosas que también debe considerar, como la categoría del esquí, el tipo de nieve, el terreno y la preferencia personal. Puedes encontrar calculadoras en línea donde introduces los parámetros de tu cuerpo y recibirás el tamaño de esquí adecuado para ti.', 'Puedes encontrar instrucciones y tutoriales y hacer ese trabajo tú mismo. Así que, contestado sin rodeos, como principiante deberías recibir tus esquíes como un paquete con fijaciones incluidas!P: ¿Qué tamaño de radio de giro es bueno para los principiantes?A:Los principiantes siempre deben buscar el menor radio de giro posible. Un buen esquí de cintura estrecha debe ser capaz de hacer un giro de 11-13m con facilidad. Aprender a esquiar con un esquí grueso que tiene un radio de giro pobre suele significar que el esquí carecerá de otras características que serán cruciales para desarrollar buenas habilidades como principiante.Es posible ser un gran esquiador en tablas de polvo grueso, pero demasiados principiantes comienzan allí sin desarrollar nunca un conjunto redondeado de habilidades para controlar adecuadamente sus esquís. Los esquíes con un radio de giro más pequeño tienden a ser más ágiles y más fáciles de controlar una vez que se dominan los diversos aspectos de la gestión de su esquí con éxito. Si te metes en un paquete duro o en el hielo en un esquí de cintura estrecha, será mucho más fácil morderlo y mantenerse seguro también.P: ¿Debo ir con un puntaje doble o con un esquí direccional?A:Como principiante, hay algunos aspectos que debería considerar. Los esquís de doble punta tienden a tener un borde efectivo más corto, lo que significa que la cola del esquí aparece antes. Eso significa que será más fácil salir de la curva, y podrás rodar en la siguiente sin atascarte en la cola del esquí.Sin embargo, menos ventaja también significa menos control en las carreras arregladas, donde tú, como principiante, probablemente pasarás la mayor parte del tiempo durante un tiempo. Además, no esquiarás hacia atrás por un tiempo, así que no es necesario dar dos consejos.Una excepción es que si eres un esquiador principiante, y sólo quieres esquiar en un parque, podrías empezar con dos consejos. Necesitarás consejos gemelos en el parque, así que podrías empezar de inmediato con ellos.P: ¿Qué longitud de esquí es buena para los principiantes?A:Dado que los esquís largos son más difíciles de controlar y de aprender, se recomienda que los esquís sean un poco más cortos que el promedio. La mayoría de la gente le dirá que sus esquís deben ser tan altos como su barbilla. Sin embargo, pruebe esquís que sean tan altos como su clavícula. Los esquís más largos son más estables a altas velocidades y le darán más flotación en la nieve profunda como el polvo. Pero como principiante, no deberías hacer ninguna de esas cosas. Por eso un par de esquís más cortos tiene mucho más sentido.El único inconveniente de esto es que eventualmente querrás un par de esquís más largos. Por esa razón, puedes comprar tu primer par de esquís usados para ahorrar dinero y eventualmente comprar unos más largos. Una vez que hayas superado la etapa de principiante, opta por la longitud de la barbilla.Visión general de Globo SurferPara empezar a esquiar hay que divertirse, dominar las habilidades vitales y hacer que la experiencia sea lo más agradable posible. Por esas razones, hemos esbozado las mejores formas de empezar a elegir un esquí para principiantes.Recuerda evitar gastar demasiado y tomarte el tiempo necesario para aprender las técnicas y habilidades adecuadas para esquiar, de modo que puedas esquiar de forma segura y productiva. Si sigue nuestras directrices, estará seguro de terminar con un esquí en el que podrá aprender fácilmente. Esperamos que nuestra guía le haya ayudado a elegir los mejores esquíes para principiantes que se ajusten a sus necesidades.']","Los mejores esquís para principiantes dependen de varios factores, como tu tamaño, habilidad y preferencia personal. Aquí te presento algunas recomendaciones basadas en diferentes fuentes:

    Calidad y Durabilidad: Busca esquís de alta calidad y durabilidad. Los esquís de buena calidad suelen ser más pesados, pero esto les permite ofrecer mayor estabilidad y control en la nieve. Por otro lado, los esquís de menor calidad suelen ser más ligeros, pero pueden ser más difíciles de manejar​.

Tamaño: Los esquís para principiantes suelen ser más cortos que los esquís para adultos, ya que los principiantes tienen un tamaño promedio más pequeño. Esto hace que los esquís sean más manejables y fáciles de controlar​.

Habilidades: Si eres un principiante, es importante que el esquí tenga un tamaño adecuado para tu altura. Los esquís de tamaño incorrecto pueden ser difíciles de manejar y requerir más esfuerzo, lo que puede disminuir la motivación y la confianza en el esquí​.

Recomendaciones específicas: Según la fuente, algunos esquís populares para principiantes incluyen el Rossignol Smash 7 Men Skis, el Experiencia Rossignol 74 Esquís, el Rossignol Experience 88 HD Skis y el Esquí Salomón QST 85. Estos esquís ofrecen una buena combinación de calidad, tamaño y habilidades para principiantes​.

En conclusión, para elegir los mejores esquís para principiantes, es importante considerar tu tamaño, habilidades y preferencias personales. Al hacerlo, podrás encontrar un par de esquís que te permitan aprender y disfrutar al máximo del esquí​.","Para seleccionar los esquís adecuados como principiante en el esquí, hay varios aspectos importantes a considerar:

1. Elección del Tipo de Esquí:
   - Esquís de Pista: Ideales para principiantes, ya que están diseñados para ser utilizados en pistas preparadas. Son generalmente estrechos, lo que aumenta su capacidad de agarre a la nieve, facilitando el aprendizaje de los movimientos básicos.
   - Esquís All Mountain: Versátiles para una variedad de condiciones. Funcionan bien tanto en pista como fuera de ella. Son adecuados si ya has esquiado algunas veces y buscas esquís no limitados a pistas preparadas.

2. Longitud de los Esquís:
   - Como principiante, es recomendable elegir esquís que estén cerca de la altura de tu nariz. Los esquís más cortos son más fáciles de controlar, lo cual es crucial mientras aprendes. Sin embargo, la elección también debe tener en cuenta tu peso, ya que esquís demasiado cortos pueden quitarte control si eres una persona más pesada.

3. Ancho de los Esquís:
   - Los esquís con un ancho de cintura entre 70 y 80 mm son ideales para principiantes, especialmente si pasarás la mayor parte del tiempo en pistas. Estos esquís están diseñados para agarrarse bien a la nieve firme.

4. Flexibilidad:
   - Los esquís más flexibles son recomendados para principiantes, ya que son más fáciles de girar y más indulgentes en caso de detenciones o caídas repentinas. La flexibilidad permite al esquiador sentir más el terreno y aprender a controlar mejor los esquís.

5. Perfil del Esquí:
   - Camber: Diseño tradicional que proporciona un contacto uniforme con la nieve y un control superior del borde, ideal para principiantes.
   - Rocker: Diseño con las puntas levantadas que facilita iniciar giros, útil para principiantes.
   - Mixto Rocker/Camber: Combina las ventajas del camber y el rocker, ofreciendo facilidad para girar y buena sujeción de los bordes.

6. Sistemas Integrados:
   - Algunos modelos para principiantes vienen con fijaciones integradas, lo que puede ser una opción conveniente y segura.

Al elegir tus esquís, es esencial considerar estos factores para asegurar que tengas una experiencia de aprendizaje positiva y segura. También es recomendable asesorarse con profesionales en tiendas de esquí para encontrar el equipo que mejor se adapte a tus necesidades específicas.",,0.99999999995,0.7142857142857143,1.0
